contradiction	Amy, Jerry, Fiona and Nancy are from Georgia, Thailand, Fiji and France respectively.	Nancy is from Georgia.
contradiction	Bruce, Roy, Rebecca and Janet are from Sweden, Ghana, Hungary and United Arab Emirates respectively.	Janet is from Sweden.
contradiction	Ian, Billy, Ray and Virginia are from Colombia, Switzerland, Qatar and Bangladesh respectively.	Virginia is from Colombia.
contradiction	Larry, Amanda, Tom and Leslie are from Libya, South Korea, Mexico and Bhutan respectively.	Leslie is from Libya.
contradiction	Grace, Andrew, Jonathan and Bobby are from Bhutan, Colombia, Italy and Libya respectively.	Bobby is from Bhutan.
contradiction	Judy, Jane, Deborah and Donna are from United Arab Emirates, Ukraine, Laos and Colombia respectively.	Donna is from United Arab Emirates.
contradiction	Edward, Louise, Laura and Kevin are from Chile, Iceland, Bangladesh and Brazil respectively.	Kevin is from Chile.
contradiction	Alexander, Grace, Maria and Al are from Turkey, Zimbabwe, Malaysia and Ghana respectively.	Al is from Turkey.
contradiction	Alex, Steven, Elizabeth and Emma are from Hungary, New Zealand, Azerbaijan and Mexico respectively.	Emma is from Hungary.
contradiction	Tony, Lisa, Anne and Walter are from Israel, Laos, Turkey and South Korea respectively.	Walter is from Israel.
contradiction	Evelyn, Harriet, Kathy and Melissa are from Taiwan, Oman, Japan and Colombia respectively.	Melissa is from Taiwan.
contradiction	Caroline, Tom, Fiona and Lauren are from Iran, Belarus, South Korea and Bangladesh respectively.	Lauren is from Iran.
contradiction	Jimmy, Mary, Sarah and William are from Nepal, United States of America, Portugal and Japan respectively.	William is from Nepal.
contradiction	Samuel, Richard, James and Keith are from Pakistan, Denmark, Mexico and Saudi Arabia respectively.	Keith is from Pakistan.
contradiction	Suzanne, Colin, Lucy and Billy are from Denmark, Mexico, Azerbaijan and Colombia respectively.	Billy is from Denmark.
contradiction	Frederick, Richard, Jack and Jay are from Canada, Finland, Denmark and Egypt respectively.	Jay is from Canada.
contradiction	Jim, Lynn, Jerry and William are from Cuba, Iraq, Malaysia and Saudi Arabia respectively.	William is from Cuba.
contradiction	Alex, Sophie, Caroline and Wendy are from Iran, United States of America, South Korea and Austria respectively.	Wendy is from Iran.
contradiction	Jerry, Bob, Christopher and Sara are from Singapore, Indonesia, Iceland and Vietnam respectively.	Sara is from Singapore.
contradiction	Maria, Harry, Judy and Eleanor are from China, Belgium, Georgia and Zimbabwe respectively.	Eleanor is from China.
contradiction	Jimmy, Susan, Simon and Kate are from Ghana, New Zealand, Philippines and Afghanistan respectively.	Kate is from Ghana.
contradiction	Christine, Colin, Sharon and Al are from Bangladesh, Haiti, Libya and Netherlands respectively.	Al is from Bangladesh.
contradiction	Ryan, David, Diane and Bill are from China, Maldives, United States of America and Belarus respectively.	Bill is from China.
contradiction	Janet, Diane, Don and Sue are from Italy, Finland, Chile and Belgium respectively.	Sue is from Italy.
contradiction	Linda, Robin, Mark and Jerry are from Denmark, Sweden, Mexico and Zimbabwe respectively.	Jerry is from Denmark.
contradiction	Jennifer, Nicole, Sarah and Ellen are from Finland, Saudi Arabia, Ghana and Fiji respectively.	Ellen is from Finland.
contradiction	Adam, Virginia, Sara and Samuel are from Colombia, Greece, Maldives and Ecuador respectively.	Samuel is from Colombia.
contradiction	Nicole, Martha, Elizabeth and Judith are from Saudi Arabia, Ghana, Pakistan and Singapore respectively.	Judith is from Saudi Arabia.
contradiction	Thomas, Ellen, Laura and Katie are from Bhutan, India, Ghana and Afghanistan respectively.	Katie is from Bhutan.
contradiction	Eleanor, Richard, Cynthia and Kevin are from Sweden, Portugal, Greece and New Zealand respectively.	Kevin is from Sweden.
contradiction	Tony, Sally, Jack and Elizabeth are from Netherlands, Fiji, South Korea and Cuba respectively.	Elizabeth is from Netherlands.
contradiction	Al, Kim, Rachel and Martin are from Belarus, Poland, Japan and Ecuador respectively.	Martin is from Belarus.
contradiction	Alice, Henry, Stephen and Frederick are from Pakistan, Oman, Austria and Uruguay respectively.	Frederick is from Pakistan.
contradiction	Dan, Marilyn, Matthew and Eric are from Maldives, Azerbaijan, Indonesia and Ukraine respectively.	Eric is from Maldives.
contradiction	Leslie, Elizabeth, Larry and Rebecca are from Malaysia, Pakistan, Iceland and New Zealand respectively.	Rebecca is from Malaysia.
contradiction	Charlotte, Wendy, Julie and George are from Pakistan, Philippines, Bangladesh and Russia respectively.	George is from Pakistan.
contradiction	Robin, Christine, Julia and Martin are from Zimbabwe, Australia, Haiti and Italy respectively.	Martin is from Zimbabwe.
contradiction	Amy, Rachel, Rose and Edith are from Canada, Uruguay, Malaysia and Mexico respectively.	Edith is from Canada.
contradiction	Bruce, Eric, Kathryn and Robin are from Maldives, Taiwan, Cuba and Japan respectively.	Robin is from Maldives.
contradiction	Dick, Stephanie, Elizabeth and Tim are from Vietnam, Poland, Singapore and Canada respectively.	Tim is from Vietnam.
contradiction	Jim, John, Al and Sarah are from New Zealand, Ireland, Sweden and Israel respectively.	Sarah is from New Zealand.
contradiction	Howard, Bobby, Jean and Charles are from Fiji, Vietnam, Singapore and United States of America respectively.	Charles is from Fiji.
contradiction	Steven, Sarah, Jimmy and Sam are from Laos, Uruguay, Bangladesh and Philippines respectively.	Sam is from Laos.
contradiction	Angela, Chris, George and Sharon are from United Kingdom, Argentina, Bhutan and Mexico respectively.	Sharon is from United Kingdom.
contradiction	Jack, Carolyn, Lauren and Dan are from Turkey, Ghana, Bhutan and Zimbabwe respectively.	Dan is from Turkey.
contradiction	Dan, Linda, Marilyn and Richard are from Saudi Arabia, Portugal, Chile and France respectively.	Richard is from Saudi Arabia.
contradiction	Stephanie, Julia, Dorothy and Victoria are from Sweden, Mexico, Qatar and Azerbaijan respectively.	Victoria is from Sweden.
contradiction	Mary, James, Bob and Adam are from Haiti, New Zealand, Zimbabwe and Ireland respectively.	Adam is from Haiti.
contradiction	Benjamin, Alfred, Ryan and Bill are from Nepal, Laos, Australia and Switzerland respectively.	Bill is from Nepal.
contradiction	Nicole, Florence, Sharon and Ron are from Afghanistan, Colombia, United Kingdom and Israel respectively.	Ron is from Afghanistan.
contradiction	Frank, Kim, Jerry and Judith are from Ukraine, Russia, Saudi Arabia and China respectively.	Judith is from Ukraine.
contradiction	Amanda, Christine, Leslie and Marilyn are from Taiwan, Denmark, Pakistan and China respectively.	Marilyn is from Taiwan.
contradiction	Victoria, Andrew, Elizabeth and Nick are from Malaysia, Belarus, Australia and Philippines respectively.	Nick is from Malaysia.
contradiction	Rebecca, Walter, Samuel and Dave are from United Arab Emirates, Cuba, Malaysia and Vietnam respectively.	Dave is from United Arab Emirates.
contradiction	Julia, Howard, Kathryn and Betty are from India, Australia, Pakistan and Ecuador respectively.	Betty is from India.
contradiction	Sarah, Wendy, Frederick and Sharon are from Portugal, New Zealand, Libya and Belarus respectively.	Sharon is from Portugal.
contradiction	Grace, Pamela, Daniel and Harriet are from Israel, Brazil, Colombia and Libya respectively.	Harriet is from Israel.
contradiction	Benjamin, Mary, Judith and Michelle are from Finland, Austria, France and Switzerland respectively.	Michelle is from Finland.
contradiction	Dick, Jane, Marilyn and Ann are from Bhutan, China, Netherlands and Oman respectively.	Ann is from Bhutan.
contradiction	Mark, Maria, Frank and Lucy are from Zimbabwe, Turkey, Egypt and Bhutan respectively.	Lucy is from Zimbabwe.
contradiction	Sophie, Julie, Nancy and Donald are from New Zealand, Indonesia, Taiwan and Singapore respectively.	Donald is from New Zealand.
contradiction	Carl, Jimmy, Dan and Victoria are from Afghanistan, Ghana, Japan and United Arab Emirates respectively.	Victoria is from Afghanistan.
contradiction	Steven, Sandra, Steve and Frances are from Iran, Sweden, Brazil and Switzerland respectively.	Frances is from Iran.
contradiction	Ray, Diana, Jason and Amanda are from Thailand, Switzerland, Ghana and Saudi Arabia respectively.	Amanda is from Thailand.
contradiction	Kathy, Anne, Ann and Betty are from Ecuador, Russia, Indonesia and Malaysia respectively.	Betty is from Ecuador.
contradiction	Jonathan, Kevin, Jim and Ashley are from Iceland, Germany, Argentina and Philippines respectively.	Ashley is from Iceland.
contradiction	Charlotte, Judith, Florence and Martin are from Libya, Sweden, Poland and Brazil respectively.	Martin is from Libya.
contradiction	Virginia, Stephen, Howard and Melissa are from Brazil, Hungary, Colombia and Nepal respectively.	Melissa is from Brazil.
contradiction	Edwin, Katherine, Grace and Jonathan are from Bhutan, United Kingdom, Ecuador and Azerbaijan respectively.	Jonathan is from Bhutan.
contradiction	Suzanne, George, Lawrence and Patrick are from Israel, Cuba, United Arab Emirates and Thailand respectively.	Patrick is from Israel.
contradiction	Judith, Bobby, John and Jessica are from Chile, Pakistan, Iran and Uruguay respectively.	Jessica is from Chile.
contradiction	Janet, Elaine, Philip and Sophie are from Afghanistan, Saudi Arabia, New Zealand and Brazil respectively.	Sophie is from Afghanistan.
contradiction	Christopher, Thomas, Marilyn and Jim are from Taiwan, Australia, Ireland and Saudi Arabia respectively.	Jim is from Taiwan.
contradiction	Bobby, Tony, Sue and Walter are from Ireland, Philippines, United Arab Emirates and Libya respectively.	Walter is from Ireland.
contradiction	Jerry, Kim, Bruce and Marilyn are from Iceland, New Zealand, Iran and Bangladesh respectively.	Marilyn is from Iceland.
contradiction	Samuel, Johnny, Patricia and Catherine are from Ukraine, Oman, Canada and Finland respectively.	Catherine is from Ukraine.
contradiction	Diane, Sally, Ray and Sarah are from Georgia, India, Netherlands and Israel respectively.	Sarah is from Georgia.
contradiction	Kenneth, Jimmy, James and Katherine are from Azerbaijan, Bhutan, China and Pakistan respectively.	Katherine is from Azerbaijan.
contradiction	Larry, Ian, Ashley and Charlie are from Australia, Afghanistan, Belarus and Iraq respectively.	Charlie is from Australia.
contradiction	Alex, Paul, Susan and Rebecca are from Uruguay, Nepal, Australia and Finland respectively.	Rebecca is from Uruguay.
contradiction	Jason, Jimmy, Stephanie and Alex are from Switzerland, North Korea, Malaysia and Pakistan respectively.	Alex is from Switzerland.
contradiction	Elizabeth, Rose, Mary and Virginia are from Zimbabwe, Afghanistan, Sweden and Belgium respectively.	Virginia is from Zimbabwe.
contradiction	Claire, Donna, Mary and Jerry are from Uruguay, Ghana, Israel and Oman respectively.	Jerry is from Uruguay.
contradiction	Stephen, Steven, Nancy and Jim are from Poland, Saudi Arabia, Ecuador and Maldives respectively.	Jim is from Poland.
contradiction	Michelle, David, George and Jessica are from North Korea, Denmark, Russia and Laos respectively.	Jessica is from North Korea.
contradiction	Donna, Arthur, Francis and Bobby are from Bangladesh, Japan, Bhutan and Belgium respectively.	Bobby is from Bangladesh.
contradiction	Adam, George, Jeff and Harriet are from Poland, Argentina, Georgia and India respectively.	Harriet is from Poland.
contradiction	Alexander, Matt, Diane and Judith are from Vietnam, Philippines, United Kingdom and South Korea respectively.	Judith is from Vietnam.
contradiction	Anthony, Mark, Fiona and Robin are from Brazil, Laos, Poland and Israel respectively.	Robin is from Brazil.
contradiction	Anthony, Edward, Janet and Alan are from Azerbaijan, Oman, Germany and France respectively.	Alan is from Azerbaijan.
contradiction	Ray, Maria, Linda and Suzanne are from United Arab Emirates, Denmark, Iceland and Fiji respectively.	Suzanne is from United Arab Emirates.
contradiction	Jeff, Sue, Wendy and Benjamin are from Singapore, Portugal, New Zealand and Sweden respectively.	Benjamin is from Singapore.
contradiction	Edith, Harry, Emma and Evelyn are from Philippines, Oman, Brazil and Vietnam respectively.	Evelyn is from Philippines.
contradiction	Kim, Grace, Katherine and Ryan are from Turkey, India, Germany and Afghanistan respectively.	Ryan is from Turkey.
contradiction	Stephen, Sarah, Michelle and Donna are from Afghanistan, Argentina, Portugal and Ukraine respectively.	Donna is from Afghanistan.
contradiction	Catherine, Lisa, Bruce and Michelle are from Qatar, China, Ireland and Egypt respectively.	Michelle is from Qatar.
contradiction	Margaret, George, Keith and Nick are from Afghanistan, China, United Arab Emirates and Ghana respectively.	Nick is from Afghanistan.
contradiction	Amanda, Robert, Mary and Robin are from Oman, Taiwan, Finland and Afghanistan respectively.	Robin is from Oman.
contradiction	Harry, Ann, Donald and Howard are from Vietnam, Greece, United Arab Emirates and Belgium respectively.	Howard is from Vietnam.
contradiction	Leslie, Emily, Charlotte and Bill are from Cuba, Zimbabwe, United Arab Emirates and Philippines respectively.	Bill is from Cuba.
contradiction	Frances, Joseph, Diana and Michelle are from Nepal, Poland, Vietnam and Ireland respectively.	Michelle is from Nepal.
contradiction	Ian, Mark, Victoria and Ralph are from Philippines, Maldives, Iran and Netherlands respectively.	Ralph is from Philippines.
contradiction	Suzanne, Michelle, Donna and Wendy are from North Korea, Oman, Belgium and Qatar respectively.	Wendy is from North Korea.
contradiction	Katie, Suzanne, Rebecca and Betty are from United Arab Emirates, Bhutan, Portugal and Mexico respectively.	Betty is from United Arab Emirates.
contradiction	Lauren, Sam, Walter and Lawrence are from Uruguay, Malaysia, Netherlands and Turkey respectively.	Lawrence is from Uruguay.
contradiction	Mary, Heather, Michelle and Julie are from Iraq, Vietnam, Singapore and Qatar respectively.	Julie is from Iraq.
contradiction	Jay, David, Nicole and Emily are from Nepal, Austria, United Arab Emirates and Indonesia respectively.	Emily is from Nepal.
contradiction	Tony, Alex, Anthony and Matthew are from Uruguay, Belarus, Pakistan and New Zealand respectively.	Matthew is from Uruguay.
contradiction	Howard, Rose, Scott and Julia are from Mexico, Taiwan, Japan and Italy respectively.	Julia is from Mexico.
contradiction	Linda, Sharon, Victoria and Anthony are from Pakistan, Qatar, Fiji and Sweden respectively.	Anthony is from Pakistan.
contradiction	Emily, Caroline, Tim and Jonathan are from United Kingdom, India, Greece and Georgia respectively.	Jonathan is from United Kingdom.
contradiction	Wendy, Sharon, Judy and Eleanor are from Thailand, Hungary, Maldives and New Zealand respectively.	Eleanor is from Thailand.
contradiction	Judy, Kathleen, Matt and Sarah are from Mexico, Thailand, Iceland and United States of America respectively.	Sarah is from Mexico.
contradiction	Ray, Grace, Bob and Henry are from India, Singapore, Uruguay and Denmark respectively.	Henry is from India.
contradiction	Arthur, Roger, Jay and Ruth are from Cuba, Zimbabwe, United Kingdom and Russia respectively.	Ruth is from Cuba.
contradiction	Susan, Maria, Kenneth and Jerry are from Iceland, Iran, Belgium and Italy respectively.	Jerry is from Iceland.
contradiction	Scott, Harry, Pamela and Robin are from Ghana, Japan, Iceland and Italy respectively.	Robin is from Ghana.
contradiction	Frances, Johnny, Nancy and Simon are from Pakistan, Iraq, Maldives and Italy respectively.	Simon is from Pakistan.
contradiction	Alexandra, Stephanie, Charlotte and Melissa are from Laos, Hungary, India and Belarus respectively.	Melissa is from Laos.
contradiction	Barbara, Thomas, Keith and Kate are from Iraq, Cuba, Finland and Afghanistan respectively.	Kate is from Iraq.
contradiction	Kathleen, Alexandra, Chris and Francis are from Turkey, Azerbaijan, Afghanistan and Israel respectively.	Francis is from Turkey.
contradiction	Harold, Francis, Michael and Sara are from Egypt, Sweden, Qatar and Austria respectively.	Sara is from Egypt.
contradiction	Nancy, Heather, Lauren and Mary are from Israel, Denmark, South Korea and Afghanistan respectively.	Mary is from Israel.
contradiction	James, John, Virginia and Billy are from Taiwan, Thailand, India and China respectively.	Billy is from Taiwan.
contradiction	William, George, Sara and Katherine are from Netherlands, Italy, Switzerland and Germany respectively.	Katherine is from Netherlands.
contradiction	Keith, Roy, Chris and Susan are from Ghana, Saudi Arabia, Iceland and Portugal respectively.	Susan is from Ghana.
contradiction	Martha, Nancy, Mark and Jessica are from Zimbabwe, Argentina, Philippines and New Zealand respectively.	Jessica is from Zimbabwe.
contradiction	Philip, Lynn, Rose and Mary are from South Korea, Turkey, Georgia and North Korea respectively.	Mary is from South Korea.
contradiction	Matthew, Stephanie, Alex and Alan are from Oman, United Kingdom, Netherlands and Germany respectively.	Alan is from Oman.
contradiction	Julia, Eleanor, Kenneth and Diana are from Germany, Finland, Japan and Ukraine respectively.	Diana is from Germany.
contradiction	Hugh, John, Greg and Andrew are from Mexico, Zimbabwe, Sweden and Uruguay respectively.	Andrew is from Mexico.
contradiction	David, Anthony, Sam and Fiona are from United States of America, Fiji, Mexico and Poland respectively.	Fiona is from United States of America.
contradiction	Angela, Amy, Jason and Katie are from Georgia, Azerbaijan, Taiwan and Philippines respectively.	Katie is from Georgia.
contradiction	Martin, Dan, Sam and Lynn are from Fiji, Portugal, Nepal and Germany respectively.	Lynn is from Fiji.
contradiction	Louis, Angela, Sara and Susan are from Belarus, Pakistan, Iceland and Greece respectively.	Susan is from Belarus.
contradiction	Florence, Jonathan, Eleanor and Arthur are from Saudi Arabia, Poland, Ecuador and United Arab Emirates respectively.	Arthur is from Saudi Arabia.
contradiction	Tim, Jason, Jennifer and Mike are from Hungary, Pakistan, India and Malaysia respectively.	Mike is from Hungary.
contradiction	Sharon, Kathleen, Dick and Mark are from Taiwan, Turkey, United States of America and Ukraine respectively.	Mark is from Taiwan.
contradiction	Wendy, Bobby, Alexandra and Colin are from Philippines, China, Israel and Indonesia respectively.	Colin is from Philippines.
contradiction	Billy, Amy, Cynthia and Mike are from France, Argentina, United Kingdom and Chile respectively.	Mike is from France.
contradiction	Florence, Diana, Sue and Catherine are from United Kingdom, Brazil, Iraq and Saudi Arabia respectively.	Catherine is from United Kingdom.
contradiction	Louise, Steven, Christopher and Robin are from New Zealand, Bangladesh, Zimbabwe and Iraq respectively.	Robin is from New Zealand.
contradiction	Leslie, Christine, Jason and Katherine are from Haiti, Switzerland, Brazil and Vietnam respectively.	Katherine is from Haiti.
contradiction	Kenneth, Catherine, Edwin and Johnny are from Netherlands, New Zealand, Bangladesh and United Kingdom respectively.	Johnny is from Netherlands.
contradiction	Roger, Emily, Alison and Maria are from Austria, France, Vietnam and Israel respectively.	Maria is from Austria.
contradiction	Mark, Adam, Cynthia and Jerry are from Afghanistan, Qatar, Bangladesh and Russia respectively.	Jerry is from Afghanistan.
contradiction	Alison, Edwin, Jill and Frances are from United Kingdom, Ukraine, Malaysia and Georgia respectively.	Frances is from United Kingdom.
contradiction	Sam, Matthew, Karen and Ray are from Germany, Oman, Iran and Maldives respectively.	Ray is from Germany.
contradiction	Andrew, Wendy, Sandra and Tom are from Poland, Ecuador, Brazil and Sweden respectively.	Tom is from Poland.
contradiction	Colin, David, Andrew and John are from Egypt, Bhutan, Bangladesh and India respectively.	John is from Egypt.
contradiction	Sandra, Frances, Janet and Edith are from Switzerland, Oman, Philippines and Cuba respectively.	Edith is from Switzerland.
contradiction	Ed, Keith, Bruce and Kathleen are from Iraq, Oman, Ghana and Mexico respectively.	Kathleen is from Iraq.
contradiction	Daniel, Susan, Sharon and Louis are from Hungary, Afghanistan, Bangladesh and Germany respectively.	Louis is from Hungary.
contradiction	Patricia, Alison, James and Fiona are from Australia, Chile, Bangladesh and Turkey respectively.	Fiona is from Australia.
contradiction	Kathy, Roy, Philip and Mike are from Turkey, Ireland, Iran and Thailand respectively.	Mike is from Turkey.
contradiction	Kathleen, Julia, Stephen and Dick are from Argentina, China, Ghana and South Korea respectively.	Dick is from Argentina.
contradiction	Diana, Marilyn, Bill and Suzanne are from Japan, Haiti, Bangladesh and France respectively.	Suzanne is from Japan.
contradiction	Paul, William, Ralph and Emma are from Greece, Zimbabwe, Belarus and Brazil respectively.	Emma is from Greece.
contradiction	Billy, Julie, James and Martha are from South Korea, Fiji, Libya and Australia respectively.	Martha is from South Korea.
contradiction	Jessica, Charlie, Angela and Sam are from India, United States of America, Afghanistan and Russia respectively.	Sam is from India.
contradiction	Sandra, Rebecca, Jerry and Jason are from Malaysia, Azerbaijan, Afghanistan and Philippines respectively.	Jason is from Malaysia.
contradiction	Diana, Marie, Nicole and Joan are from Saudi Arabia, India, Colombia and Indonesia respectively.	Joan is from Saudi Arabia.
contradiction	Simon, Andrea, Florence and Eric are from India, Libya, Greece and Saudi Arabia respectively.	Eric is from India.
contradiction	Harold, Tom, Susan and Larry are from Iceland, Ghana, Colombia and Netherlands respectively.	Larry is from Iceland.
contradiction	Kim, Lynn, Kathy and Bruce are from Ukraine, Mexico, Finland and Egypt respectively.	Bruce is from Ukraine.
contradiction	Dave, David, Ralph and Maria are from Saudi Arabia, United Kingdom, Uruguay and Pakistan respectively.	Maria is from Saudi Arabia.
contradiction	Helen, Alexander, Lynn and Elizabeth are from South Korea, Cuba, Israel and Fiji respectively.	Elizabeth is from South Korea.
contradiction	Sarah, Martin, Matthew and Kathryn are from Iran, Nepal, Sweden and India respectively.	Kathryn is from Iran.
contradiction	Dan, Heather, Scott and Andrew are from Egypt, Taiwan, Belarus and Portugal respectively.	Andrew is from Egypt.
contradiction	Dave, Michelle, Leslie and Sophie are from Saudi Arabia, Portugal, Turkey and Denmark respectively.	Sophie is from Saudi Arabia.
contradiction	Victoria, Francis, Sophie and Sara are from Colombia, Uruguay, Haiti and Egypt respectively.	Sara is from Colombia.
contradiction	Edwin, Roy, Francis and Arthur are from Russia, France, Bangladesh and Turkey respectively.	Arthur is from Russia.
contradiction	Rachel, Edith, Christopher and Andrew are from Belgium, United States of America, Indonesia and Bangladesh respectively.	Andrew is from Belgium.
contradiction	Jane, Martin, Colin and Albert are from North Korea, Saudi Arabia, Greece and Iraq respectively.	Albert is from North Korea.
contradiction	Joan, John, Sophie and Jason are from Canada, Azerbaijan, Maldives and Nepal respectively.	Jason is from Canada.
contradiction	Ann, Tim, Catherine and Lynn are from Japan, Chile, Switzerland and Zimbabwe respectively.	Lynn is from Japan.
contradiction	Edith, Jason, Eleanor and Roger are from Nepal, Belgium, Zimbabwe and Ireland respectively.	Roger is from Nepal.
contradiction	John, Kate, Catherine and Sam are from Iceland, Taiwan, Finland and Oman respectively.	Sam is from Iceland.
contradiction	Patrick, Simon, Pamela and Harry are from China, Saudi Arabia, Brazil and Thailand respectively.	Harry is from China.
contradiction	Dave, Jessica, Sophie and Tim are from Oman, Ukraine, Fiji and Russia respectively.	Tim is from Oman.
contradiction	Simon, Francis, Stephanie and Judith are from Georgia, Singapore, Turkey and Austria respectively.	Judith is from Georgia.
contradiction	Sharon, Elaine, Alex and Rachel are from Turkey, Russia, Thailand and Egypt respectively.	Rachel is from Turkey.
contradiction	Sandra, Martin, Bob and Lucy are from Greece, Ireland, North Korea and Russia respectively.	Lucy is from Greece.
contradiction	Peter, Louise, Eric and Marilyn are from Fiji, Belarus, Taiwan and Netherlands respectively.	Marilyn is from Fiji.
contradiction	Harriet, Diana, Alexander and Brian are from United States of America, Haiti, Bangladesh and Sweden respectively.	Brian is from United States of America.
contradiction	Diana, Matthew, Laura and Frances are from Netherlands, Bhutan, Singapore and Pakistan respectively.	Frances is from Netherlands.
contradiction	Ashley, Sally, Kim and Edith are from Maldives, Cuba, Fiji and Bangladesh respectively.	Edith is from Maldives.
contradiction	Keith, Jill, Sara and Deborah are from Egypt, Indonesia, Belarus and Philippines respectively.	Deborah is from Egypt.
contradiction	Catherine, Kelly, Bobby and Amy are from Poland, Fiji, Greece and Nepal respectively.	Amy is from Poland.
contradiction	Alexander, Daniel, Joan and Christopher are from Pakistan, Ireland, United Arab Emirates and Cuba respectively.	Christopher is from Pakistan.
contradiction	Stephen, Katie, Angela and Michelle are from Afghanistan, Colombia, Vietnam and Ghana respectively.	Michelle is from Afghanistan.
contradiction	Victoria, Fred, Don and Edward are from Taiwan, Greece, Colombia and North Korea respectively.	Edward is from Taiwan.
contradiction	Diana, Henry, Carol and Arthur are from Greece, Afghanistan, Hungary and Malaysia respectively.	Arthur is from Greece.
