contradiction	Edward, Martha and Robin are from Russia, Singapore and Iceland respectively.	Robin is from Russia.
contradiction	Ed, Suzanne and Donna are from New Zealand, France and China respectively.	Donna is from New Zealand.
contradiction	Keith, Alan and Bobby are from Portugal, Greece and United States of America respectively.	Bobby is from Portugal.
contradiction	Betty, Carol and Ellen are from Germany, Singapore and Greece respectively.	Ellen is from Germany.
contradiction	Frederick, Ellen and Rebecca are from Canada, Italy and Nepal respectively.	Rebecca is from Canada.
contradiction	Ed, Ben and Helen are from South Korea, Turkey and Saudi Arabia respectively.	Helen is from South Korea.
contradiction	Katherine, Alison and Kate are from Vietnam, Mexico and Denmark respectively.	Kate is from Vietnam.
contradiction	Jennifer, Thomas and Barbara are from Brazil, Russia and Portugal respectively.	Barbara is from Brazil.
contradiction	Marilyn, Robert and Fred are from Belgium, Pakistan and Qatar respectively.	Fred is from Belgium.
contradiction	Amy, Edith and Kate are from Netherlands, North Korea and Ghana respectively.	Kate is from Netherlands.
contradiction	Joe, Jessica and Lawrence are from Ecuador, Nepal and Canada respectively.	Lawrence is from Ecuador.
contradiction	Lisa, Ashley and William are from Vietnam, Azerbaijan and Ukraine respectively.	William is from Vietnam.
contradiction	Catherine, Susan and Deborah are from Cuba, Austria and Ireland respectively.	Deborah is from Cuba.
contradiction	Carolyn, Jim and Mark are from Qatar, Bhutan and Pakistan respectively.	Mark is from Qatar.
contradiction	Elaine, Sandra and Walter are from Germany, Bangladesh and Hungary respectively.	Walter is from Germany.
contradiction	Anthony, Catherine and Wendy are from Netherlands, Fiji and Iran respectively.	Wendy is from Netherlands.
contradiction	Lynn, Nicole and Lawrence are from Oman, Russia and Sweden respectively.	Lawrence is from Oman.
contradiction	William, Fiona and Greg are from Colombia, Australia and Taiwan respectively.	Greg is from Colombia.
contradiction	Don, Linda and Brian are from Russia, Egypt and Laos respectively.	Brian is from Russia.
contradiction	Henry, Eric and Jill are from Brazil, Switzerland and Singapore respectively.	Jill is from Brazil.
contradiction	Alan, Jane and Lynn are from Singapore, Saudi Arabia and Maldives respectively.	Lynn is from Singapore.
contradiction	Betty, Ashley and Ed are from Taiwan, Hungary and Oman respectively.	Ed is from Taiwan.
contradiction	Lauren, Nick and George are from Azerbaijan, Ireland and Poland respectively.	George is from Azerbaijan.
contradiction	Amanda, Don and Christopher are from Iran, India and Canada respectively.	Christopher is from Iran.
contradiction	Alexander, Marie and Charlie are from Sweden, India and Bangladesh respectively.	Charlie is from Sweden.
contradiction	Adam, Francis and Sophie are from Israel, Haiti and Australia respectively.	Sophie is from Israel.
contradiction	Kelly, Roy and Ray are from Greece, Finland and Canada respectively.	Ray is from Greece.
contradiction	Keith, Brian and Albert are from Portugal, Bangladesh and Iran respectively.	Albert is from Portugal.
contradiction	Michael, Jack and Francis are from Uruguay, Hungary and Afghanistan respectively.	Francis is from Uruguay.
contradiction	Thomas, Al and Joan are from Qatar, Finland and Zimbabwe respectively.	Joan is from Qatar.
contradiction	Benjamin, Carolyn and Dorothy are from Japan, South Korea and Colombia respectively.	Dorothy is from Japan.
contradiction	Roger, Jack and Chris are from Laos, Afghanistan and Oman respectively.	Chris is from Laos.
contradiction	Ray, Martin and Rachel are from Colombia, Indonesia and Germany respectively.	Rachel is from Colombia.
contradiction	Janet, Alexander and Christine are from Greece, Ukraine and Italy respectively.	Christine is from Greece.
contradiction	Barbara, Janet and George are from Iran, Argentina and Canada respectively.	George is from Iran.
contradiction	Kathy, Andrew and Bruce are from Netherlands, Georgia and Oman respectively.	Bruce is from Netherlands.
contradiction	Donna, Benjamin and Pamela are from Mexico, Hungary and Cuba respectively.	Pamela is from Mexico.
contradiction	Kathy, Florence and Christine are from Austria, Portugal and Bhutan respectively.	Christine is from Austria.
contradiction	Hugh, Eric and Julia are from Ukraine, Chile and Germany respectively.	Julia is from Ukraine.
contradiction	Diana, Ann and Rebecca are from Colombia, Afghanistan and Australia respectively.	Rebecca is from Colombia.
contradiction	Carol, Sarah and Emma are from Ecuador, Ireland and Oman respectively.	Emma is from Ecuador.
contradiction	Nicole, Annie and Roy are from Sweden, Thailand and Cuba respectively.	Roy is from Sweden.
contradiction	Marie, Henry and Tim are from Zimbabwe, Taiwan and Mexico respectively.	Tim is from Zimbabwe.
contradiction	Alfred, Albert and Suzanne are from Austria, Ghana and Switzerland respectively.	Suzanne is from Austria.
contradiction	Frank, Matt and Alex are from Russia, Japan and Singapore respectively.	Alex is from Russia.
contradiction	Patrick, Adam and Anne are from Brazil, Ghana and New Zealand respectively.	Anne is from Brazil.
contradiction	Sara, Andrea and Hugh are from United Kingdom, North Korea and Argentina respectively.	Hugh is from United Kingdom.
contradiction	Elizabeth, Nicole and Annie are from Taiwan, Indonesia and China respectively.	Annie is from Taiwan.
contradiction	Anthony, Emma and Sam are from Pakistan, South Korea and New Zealand respectively.	Sam is from Pakistan.
contradiction	Caroline, Ralph and Virginia are from United States of America, Thailand and Australia respectively.	Virginia is from United States of America.
contradiction	Sophie, Roy and Kathy are from Oman, South Korea and Portugal respectively.	Kathy is from Oman.
contradiction	Ryan, Charlotte and Louise are from Mexico, Thailand and Iran respectively.	Louise is from Mexico.
contradiction	Katherine, Christopher and Marilyn are from Haiti, Thailand and Philippines respectively.	Marilyn is from Haiti.
contradiction	Ed, Bobby and Laura are from Netherlands, Sweden and United Kingdom respectively.	Laura is from Netherlands.
contradiction	Charles, Nicole and Lauren are from United States of America, Japan and Australia respectively.	Lauren is from United States of America.
contradiction	Catherine, Bobby and Jason are from Italy, Denmark and Afghanistan respectively.	Jason is from Italy.
contradiction	Andrew, Alexander and Greg are from Malaysia, India and Mexico respectively.	Greg is from Malaysia.
contradiction	Laura, Jonathan and Jean are from France, Italy and Ecuador respectively.	Jean is from France.
contradiction	Dan, Lynn and Emma are from Ukraine, Argentina and Turkey respectively.	Emma is from Ukraine.
contradiction	Mary, Ian and Hugh are from Hungary, Zimbabwe and Nepal respectively.	Hugh is from Hungary.
contradiction	Ellen, Kathleen and Florence are from Turkey, Fiji and North Korea respectively.	Florence is from Turkey.
contradiction	Marie, Julia and Charlie are from Singapore, Japan and Uruguay respectively.	Charlie is from Singapore.
contradiction	Jay, Judith and Jerry are from Thailand, Fiji and Germany respectively.	Jerry is from Thailand.
contradiction	Carol, Henry and Matt are from Israel, Iran and Portugal respectively.	Matt is from Israel.
contradiction	Elaine, Nicole and Thomas are from Cuba, Iraq and South Korea respectively.	Thomas is from Cuba.
contradiction	Keith, Elaine and Eleanor are from New Zealand, Fiji and Haiti respectively.	Eleanor is from New Zealand.
contradiction	Philip, Karen and Sara are from Japan, Mexico and Switzerland respectively.	Sara is from Japan.
contradiction	Jane, Peter and Keith are from Iraq, Laos and Sweden respectively.	Keith is from Iraq.
contradiction	Annie, Susan and Paul are from Ghana, Canada and Uruguay respectively.	Paul is from Ghana.
contradiction	Dick, Ron and Grace are from Belgium, Cuba and Saudi Arabia respectively.	Grace is from Belgium.
contradiction	Patrick, Chris and Katie are from Canada, Israel and Germany respectively.	Katie is from Canada.
contradiction	Rebecca, Maria and Jessica are from Uruguay, Bangladesh and Russia respectively.	Jessica is from Uruguay.
contradiction	Charlie, Frederick and Karen are from Cuba, Brazil and Canada respectively.	Karen is from Cuba.
contradiction	Kenneth, Daniel and Lauren are from United Kingdom, Ecuador and Ghana respectively.	Lauren is from United Kingdom.
contradiction	Gary, Sarah and Simon are from Switzerland, Brazil and Iran respectively.	Simon is from Switzerland.
contradiction	Melissa, Martha and Samuel are from Russia, New Zealand and Haiti respectively.	Samuel is from Russia.
contradiction	Diane, Sam and Harold are from Iceland, Chile and Georgia respectively.	Harold is from Iceland.
contradiction	Sharon, Christopher and Diane are from Greece, Australia and Turkey respectively.	Diane is from Greece.
contradiction	Alexander, Arthur and William are from Hungary, Afghanistan and Azerbaijan respectively.	William is from Hungary.
contradiction	Walter, Brian and Emma are from Iceland, Saudi Arabia and Vietnam respectively.	Emma is from Iceland.
contradiction	Nicole, Edward and Jack are from Poland, Nepal and Austria respectively.	Jack is from Poland.
contradiction	Charlotte, Joe and David are from Bhutan, South Korea and Singapore respectively.	David is from Bhutan.
contradiction	Brian, Margaret and Lisa are from Thailand, Uruguay and Denmark respectively.	Lisa is from Thailand.
contradiction	Amanda, George and Alan are from United Arab Emirates, Indonesia and Pakistan respectively.	Alan is from United Arab Emirates.
contradiction	Elizabeth, Nicole and Ashley are from Chile, South Korea and Singapore respectively.	Ashley is from Chile.
contradiction	Deborah, Carol and Alison are from Egypt, Azerbaijan and Netherlands respectively.	Alison is from Egypt.
contradiction	Bruce, Jimmy and Eleanor are from Afghanistan, Philippines and New Zealand respectively.	Eleanor is from Afghanistan.
contradiction	Nancy, Alan and Ellen are from Ecuador, United States of America and Mexico respectively.	Ellen is from Ecuador.
contradiction	Jonathan, Ed and Rose are from Ireland, Austria and Ecuador respectively.	Rose is from Ireland.
contradiction	Linda, Stephanie and Lynn are from Turkey, Chile and Ukraine respectively.	Lynn is from Turkey.
contradiction	Matt, Jane and Samuel are from North Korea, Australia and United Arab Emirates respectively.	Samuel is from North Korea.
contradiction	Betty, Kathryn and Johnny are from Maldives, China and United Arab Emirates respectively.	Johnny is from Maldives.
contradiction	Dorothy, Annie and Angela are from Saudi Arabia, Japan and Belarus respectively.	Angela is from Saudi Arabia.
contradiction	Robert, Chris and George are from Cuba, Philippines and South Korea respectively.	George is from Cuba.
contradiction	Helen, Carol and Dick are from Pakistan, Austria and Ecuador respectively.	Dick is from Pakistan.
contradiction	Joe, Harry and Kathy are from Malaysia, Thailand and Portugal respectively.	Kathy is from Malaysia.
contradiction	Daniel, Pamela and Billy are from Pakistan, Oman and United States of America respectively.	Billy is from Pakistan.
contradiction	Mark, Samuel and Alison are from Iraq, India and Qatar respectively.	Alison is from Iraq.
contradiction	Julia, Rachel and Rebecca are from Nepal, Russia and Switzerland respectively.	Rebecca is from Nepal.
contradiction	Alexander, Al and Julie are from United States of America, Oman and Bhutan respectively.	Julie is from United States of America.
contradiction	Bobby, Kathleen and Alfred are from Georgia, Switzerland and Israel respectively.	Alfred is from Georgia.
contradiction	Donna, Harry and Jason are from Belgium, Maldives and France respectively.	Jason is from Belgium.
contradiction	Lauren, Jeff and Kim are from Iceland, Portugal and Turkey respectively.	Kim is from Iceland.
contradiction	Sue, Cynthia and Tim are from Ukraine, Ghana and Bangladesh respectively.	Tim is from Ukraine.
contradiction	Benjamin, Anna and Carol are from Taiwan, Thailand and Georgia respectively.	Carol is from Taiwan.
contradiction	William, Ruth and Helen are from United Arab Emirates, Italy and Qatar respectively.	Helen is from United Arab Emirates.
contradiction	Frances, Stephen and Thomas are from Malaysia, New Zealand and United Kingdom respectively.	Thomas is from Malaysia.
contradiction	Cynthia, Karen and Al are from Georgia, Zimbabwe and Philippines respectively.	Al is from Georgia.
contradiction	Melissa, Christopher and Colin are from United States of America, Ireland and Israel respectively.	Colin is from United States of America.
contradiction	Robert, Fred and Simon are from Iraq, Georgia and Saudi Arabia respectively.	Simon is from Iraq.
contradiction	Sharon, Alexander and Jonathan are from Netherlands, Hungary and Mexico respectively.	Jonathan is from Netherlands.
contradiction	Sarah, Alice and Kathy are from Germany, Ghana and Portugal respectively.	Kathy is from Germany.
contradiction	Tony, Alexander and Sam are from Turkey, Iran and Russia respectively.	Sam is from Turkey.
contradiction	Edwin, Adam and Tom are from Mexico, Azerbaijan and Australia respectively.	Tom is from Mexico.
contradiction	Roy, Daniel and Johnny are from Austria, Russia and South Korea respectively.	Johnny is from Austria.
contradiction	Sue, Julie and Andrew are from India, Egypt and Malaysia respectively.	Andrew is from India.
contradiction	Jerry, Kevin and Daniel are from United States of America, Russia and Switzerland respectively.	Daniel is from United States of America.
contradiction	Samuel, Benjamin and Caroline are from Belarus, Canada and Zimbabwe respectively.	Caroline is from Belarus.
contradiction	Jonathan, Margaret and Pamela are from Chile, Turkey and Azerbaijan respectively.	Pamela is from Chile.
contradiction	Ken, Alan and Adam are from Bangladesh, Fiji and United Arab Emirates respectively.	Adam is from Bangladesh.
contradiction	Emma, Dick and Harold are from Israel, Nepal and North Korea respectively.	Harold is from Israel.
contradiction	Suzanne, Lauren and Chris are from United States of America, Taiwan and Azerbaijan respectively.	Chris is from United States of America.
contradiction	Margaret, Hugh and David are from Switzerland, Haiti and Ukraine respectively.	David is from Switzerland.
contradiction	Thomas, James and Marilyn are from North Korea, Switzerland and Ghana respectively.	Marilyn is from North Korea.
contradiction	Alex, Kenneth and Michael are from Israel, North Korea and Oman respectively.	Michael is from Israel.
contradiction	Anna, Christine and Colin are from Qatar, Libya and United Arab Emirates respectively.	Colin is from Qatar.
contradiction	Alexandra, Rebecca and Barbara are from Iran, Sweden and Portugal respectively.	Barbara is from Iran.
contradiction	Amanda, Evelyn and Amy are from Belgium, Maldives and Chile respectively.	Amy is from Belgium.
contradiction	Harry, Wendy and Jason are from Bangladesh, Nepal and Greece respectively.	Jason is from Bangladesh.
contradiction	Heather, Harriet and Evelyn are from Greece, Maldives and Poland respectively.	Evelyn is from Greece.
contradiction	Sue, Mary and Kenneth are from Philippines, Colombia and Oman respectively.	Kenneth is from Philippines.
contradiction	Laura, Jeff and Keith are from Mexico, Libya and Sweden respectively.	Keith is from Mexico.
contradiction	Emma, Eleanor and Charlotte are from Mexico, Switzerland and Egypt respectively.	Charlotte is from Mexico.
contradiction	Angela, Kathleen and Michelle are from Indonesia, Russia and Fiji respectively.	Michelle is from Indonesia.
contradiction	Arthur, Elaine and Ashley are from United States of America, Zimbabwe and Russia respectively.	Ashley is from United States of America.
contradiction	Ashley, Angela and Frances are from Bangladesh, Haiti and Afghanistan respectively.	Frances is from Bangladesh.
contradiction	Michelle, Greg and Christine are from New Zealand, Israel and Bhutan respectively.	Christine is from New Zealand.
contradiction	Eleanor, Samuel and Betty are from Denmark, Argentina and Hungary respectively.	Betty is from Denmark.
contradiction	Alex, Victoria and Elaine are from India, Ghana and Nepal respectively.	Elaine is from India.
contradiction	Howard, Dan and Tim are from Russia, Ghana and Canada respectively.	Tim is from Russia.
contradiction	Jerry, Emma and Colin are from North Korea, Switzerland and Afghanistan respectively.	Colin is from North Korea.
contradiction	Melissa, Ann and Julie are from Belgium, Portugal and Qatar respectively.	Julie is from Belgium.
contradiction	Alex, Margaret and Stephen are from Libya, Iraq and Australia respectively.	Stephen is from Libya.
contradiction	Hugh, Fiona and Roger are from Russia, France and Ukraine respectively.	Roger is from Russia.
contradiction	Kate, Helen and Ruth are from Pakistan, Australia and Russia respectively.	Ruth is from Pakistan.
contradiction	Dick, Michelle and Anna are from Singapore, New Zealand and United Kingdom respectively.	Anna is from Singapore.
contradiction	George, Jane and Harry are from Poland, Nepal and New Zealand respectively.	Harry is from Poland.
contradiction	Jerry, Frances and Nick are from Portugal, China and South Korea respectively.	Nick is from Portugal.
contradiction	James, Patrick and Cynthia are from Turkey, Pakistan and Thailand respectively.	Cynthia is from Turkey.
contradiction	Mary, Carolyn and Linda are from Fiji, Argentina and Sweden respectively.	Linda is from Fiji.
contradiction	Sam, Christine and Richard are from Poland, Fiji and Qatar respectively.	Richard is from Poland.
contradiction	Stephanie, Rachel and Frederick are from Taiwan, Bhutan and Hungary respectively.	Frederick is from Taiwan.
contradiction	Anne, Mike and Steve are from Singapore, Maldives and Bhutan respectively.	Steve is from Singapore.
contradiction	Sara, Katherine and Fred are from Libya, Ecuador and Cuba respectively.	Fred is from Libya.
contradiction	Fiona, Sarah and Peter are from Ecuador, Taiwan and North Korea respectively.	Peter is from Ecuador.
contradiction	Dorothy, Eric and Janet are from Colombia, Japan and Austria respectively.	Janet is from Colombia.
contradiction	Ryan, Christopher and Ray are from Cuba, North Korea and Israel respectively.	Ray is from Cuba.
contradiction	David, Lucy and Sam are from Georgia, Iran and Ireland respectively.	Sam is from Georgia.
contradiction	Carol, Gary and Michael are from Australia, United Arab Emirates and United States of America respectively.	Michael is from Australia.
contradiction	Patrick, Wendy and Anna are from Philippines, Uruguay and Turkey respectively.	Anna is from Philippines.
contradiction	George, Ann and Joseph are from Thailand, Haiti and Netherlands respectively.	Joseph is from Thailand.
contradiction	Lawrence, Sara and Sophie are from Singapore, Bangladesh and Russia respectively.	Sophie is from Singapore.
contradiction	Edward, Anthony and Ashley are from Libya, Canada and Ecuador respectively.	Ashley is from Libya.
contradiction	Ryan, Brian and Bobby are from United Arab Emirates, Uruguay and Australia respectively.	Bobby is from United Arab Emirates.
contradiction	Virginia, Gary and Albert are from Pakistan, Japan and Canada respectively.	Albert is from Pakistan.
contradiction	Katherine, Claire and Charlie are from France, Maldives and United Arab Emirates respectively.	Charlie is from France.
contradiction	Barbara, Francis and Heather are from Ghana, Canada and Thailand respectively.	Heather is from Ghana.
contradiction	Ian, Christine and Martha are from Israel, Denmark and Laos respectively.	Martha is from Israel.
contradiction	Kathryn, Arthur and Rose are from Nepal, Laos and Vietnam respectively.	Rose is from Nepal.
contradiction	Alison, Matthew and Jean are from India, Oman and Italy respectively.	Jean is from India.
contradiction	Carol, Bob and Jane are from Poland, Colombia and Chile respectively.	Jane is from Poland.
contradiction	Albert, Kevin and Donald are from Iran, Malaysia and Nepal respectively.	Donald is from Iran.
contradiction	Susan, Rebecca and Caroline are from Saudi Arabia, United States of America and Georgia respectively.	Caroline is from Saudi Arabia.
contradiction	Linda, Joseph and Jill are from Afghanistan, Zimbabwe and Cuba respectively.	Jill is from Afghanistan.
contradiction	Karen, Florence and Christine are from Afghanistan, Belgium and Portugal respectively.	Christine is from Afghanistan.
contradiction	Lauren, Joan and Frederick are from North Korea, Vietnam and Russia respectively.	Frederick is from North Korea.
contradiction	Alison, Ron and Claire are from Malaysia, United States of America and Poland respectively.	Claire is from Malaysia.
contradiction	Andrea, Louis and Ron are from Sweden, Argentina and Cuba respectively.	Ron is from Sweden.
contradiction	Fred, Harry and Chris are from Switzerland, Portugal and North Korea respectively.	Chris is from Switzerland.
contradiction	William, Samuel and Roy are from Iceland, Portugal and Cuba respectively.	Roy is from Iceland.
contradiction	Sharon, Ben and Joe are from Georgia, Italy and Colombia respectively.	Joe is from Georgia.
contradiction	Sally, Katie and Tony are from Ukraine, Oman and Afghanistan respectively.	Tony is from Ukraine.
contradiction	Francis, Laura and Barbara are from Belgium, China and Australia respectively.	Barbara is from Belgium.
contradiction	Dorothy, Laura and Bobby are from Zimbabwe, Vietnam and Canada respectively.	Bobby is from Zimbabwe.
contradiction	Joe, Kelly and Rose are from Indonesia, China and Philippines respectively.	Rose is from Indonesia.
contradiction	Henry, Dave and Katie are from Zimbabwe, Italy and Indonesia respectively.	Katie is from Zimbabwe.
contradiction	Ian, Claire and Rachel are from Saudi Arabia, Austria and United Kingdom respectively.	Rachel is from Saudi Arabia.
contradiction	Jay, Kate and Ann are from Egypt, Vietnam and Philippines respectively.	Ann is from Egypt.
contradiction	Paul, Adam and Harriet are from North Korea, Poland and United States of America respectively.	Harriet is from North Korea.
contradiction	Jimmy, Patricia and Johnny are from Finland, Mexico and Iran respectively.	Johnny is from Finland.
contradiction	Bill, Sara and Nick are from Libya, United Kingdom and India respectively.	Nick is from Libya.
contradiction	Ashley, Frederick and Victoria are from Germany, Georgia and Turkey respectively.	Victoria is from Germany.
contradiction	Carolyn, Ralph and Martin are from South Korea, Chile and Ukraine respectively.	Martin is from South Korea.
contradiction	Adam, Kate and Jill are from India, France and Singapore respectively.	Jill is from India.
contradiction	Sophie, Alan and Jack are from Argentina, Libya and Uruguay respectively.	Jack is from Argentina.
contradiction	Greg, Anne and Nancy are from Georgia, Saudi Arabia and Indonesia respectively.	Nancy is from Georgia.
contradiction	Nick, Diana and Angela are from Laos, Vietnam and Ukraine respectively.	Angela is from Laos.
contradiction	Harold, Keith and Sara are from India, Sweden and Australia respectively.	Sara is from India.
contradiction	Hugh, Robert and Charles are from Argentina, Pakistan and Denmark respectively.	Charles is from Argentina.
contradiction	Margaret, Virginia and Ron are from New Zealand, Thailand and Austria respectively.	Ron is from New Zealand.
contradiction	Diana, Mary and Simon are from Sweden, Ireland and Saudi Arabia respectively.	Simon is from Sweden.
contradiction	Alexandra, Jeff and Rose are from Azerbaijan, Philippines and Canada respectively.	Rose is from Azerbaijan.
contradiction	Barbara, Kate and Alison are from Poland, Russia and Georgia respectively.	Alison is from Poland.
contradiction	Helen, Mike and Lucy are from China, Mexico and North Korea respectively.	Lucy is from China.
contradiction	Ken, Kathryn and Chris are from Sweden, Afghanistan and Malaysia respectively.	Chris is from Sweden.
contradiction	Joe, Louis and Michael are from Afghanistan, Maldives and Chile respectively.	Michael is from Afghanistan.
contradiction	Jeff, Thomas and Richard are from Thailand, Iceland and Haiti respectively.	Richard is from Thailand.
contradiction	Bobby, Lawrence and David are from Afghanistan, Israel and Singapore respectively.	David is from Afghanistan.
contradiction	Eleanor, Sharon and Daniel are from United States of America, United Kingdom and Egypt respectively.	Daniel is from United States of America.
contradiction	Andrea, Pamela and Tim are from United States of America, Zimbabwe and Austria respectively.	Tim is from United States of America.
contradiction	Lauren, Martin and Henry are from Brazil, Mexico and Georgia respectively.	Henry is from Brazil.
contradiction	Charles, Frederick and Joe are from Ecuador, Bangladesh and South Korea respectively.	Joe is from Ecuador.
contradiction	Karen, Kathleen and Greg are from Greece, Iran and Laos respectively.	Greg is from Greece.
contradiction	Sue, Sharon and William are from New Zealand, United Kingdom and Bangladesh respectively.	William is from New Zealand.
contradiction	Donna, Charlie and Sara are from Qatar, Japan and Netherlands respectively.	Sara is from Qatar.
contradiction	Daniel, Alex and Matthew are from Vietnam, Fiji and India respectively.	Matthew is from Vietnam.
contradiction	Jay, Jean and Rachel are from Ecuador, Malaysia and Argentina respectively.	Rachel is from Ecuador.
contradiction	Joan, Eleanor and Fiona are from Italy, Afghanistan and Thailand respectively.	Fiona is from Italy.
contradiction	Jennifer, Benjamin and Jack are from Thailand, Iraq and Haiti respectively.	Jack is from Thailand.
contradiction	Sandra, Victoria and George are from Turkey, Ireland and Uruguay respectively.	George is from Turkey.
contradiction	Eleanor, Albert and Linda are from Belgium, Austria and Afghanistan respectively.	Linda is from Belgium.
