contradiction	Rebecca, Chris, George and Rose are from Finland, Chile, Vietnam and Colombia respectively.	Rose is from Finland.
contradiction	Rachel, Michael, Lucy and Arthur are from Indonesia, Germany, Bangladesh and Poland respectively.	Arthur is from Indonesia.
contradiction	Jay, Robert, Roy and Kim are from Iceland, Greece, Brazil and Iran respectively.	Kim is from Iceland.
contradiction	Ellen, Bobby, Victoria and Jerry are from Nepal, Haiti, Qatar and Belgium respectively.	Jerry is from Nepal.
contradiction	Grace, Harry, Cynthia and Dick are from Uruguay, United States of America, Ukraine and Canada respectively.	Dick is from Uruguay.
contradiction	Joe, Howard, Stephanie and Sue are from Saudi Arabia, Israel, Argentina and South Korea respectively.	Sue is from Saudi Arabia.
contradiction	Lawrence, Mike, Tim and Caroline are from Iceland, Greece, Canada and Bhutan respectively.	Caroline is from Iceland.
contradiction	Francis, Jean, Maria and Lucy are from Greece, Azerbaijan, Mexico and South Korea respectively.	Lucy is from Greece.
contradiction	Bruce, Harriet, Tom and Alfred are from Mexico, Brazil, Cuba and Libya respectively.	Alfred is from Mexico.
contradiction	Jennifer, Dorothy, Alexander and Kenneth are from Belgium, Germany, Philippines and Turkey respectively.	Kenneth is from Belgium.
contradiction	Evelyn, Jonathan, Judy and Dick are from Ecuador, Iraq, South Korea and Australia respectively.	Dick is from Ecuador.
contradiction	Kathleen, Harry, Kathy and Betty are from India, Turkey, Canada and Russia respectively.	Betty is from India.
contradiction	Simon, Charlotte, Heather and Susan are from Portugal, United Arab Emirates, Saudi Arabia and Greece respectively.	Susan is from Portugal.
contradiction	Hugh, Marilyn, Matt and Nicole are from Ecuador, Uruguay, Haiti and United States of America respectively.	Nicole is from Ecuador.
contradiction	Rose, Cynthia, Richard and Laura are from Ecuador, China, Austria and Belgium respectively.	Laura is from Ecuador.
contradiction	Edith, Carol, Ashley and Sally are from France, Georgia, China and Greece respectively.	Sally is from France.
contradiction	Joan, Fred, Philip and Alison are from Russia, Zimbabwe, United Arab Emirates and Austria respectively.	Alison is from Russia.
contradiction	Virginia, Grace, Harold and Karen are from Netherlands, Turkey, Saudi Arabia and Colombia respectively.	Karen is from Netherlands.
contradiction	Daniel, Sophie, Scott and Billy are from New Zealand, Netherlands, Hungary and Colombia respectively.	Billy is from New Zealand.
contradiction	Kate, Leslie, Betty and Marilyn are from Turkey, Japan, South Korea and Georgia respectively.	Marilyn is from Turkey.
contradiction	Catherine, Billy, Judith and Sophie are from United Kingdom, Zimbabwe, Italy and Greece respectively.	Sophie is from United Kingdom.
contradiction	Michelle, Scott, Jimmy and Margaret are from Russia, Haiti, Philippines and Greece respectively.	Margaret is from Russia.
contradiction	Christopher, Amanda, Jimmy and Sam are from Brazil, Thailand, Ecuador and Iran respectively.	Sam is from Brazil.
contradiction	Pamela, Fiona, Al and Jill are from Bangladesh, Austria, Brazil and Laos respectively.	Jill is from Bangladesh.
contradiction	Jane, Lauren, Julie and Donna are from Belgium, Pakistan, Canada and Sweden respectively.	Donna is from Belgium.
contradiction	Alfred, Virginia, Patricia and Alexandra are from Austria, Switzerland, United States of America and Pakistan respectively.	Alexandra is from Austria.
contradiction	Andrew, Michael, Eric and Brian are from Netherlands, Pakistan, India and United Arab Emirates respectively.	Brian is from Netherlands.
contradiction	Emma, Patricia, Lisa and Frank are from Australia, Iceland, South Korea and United Kingdom respectively.	Frank is from Australia.
contradiction	Sam, Ann, Eric and Al are from Bhutan, Bangladesh, Switzerland and United States of America respectively.	Al is from Bhutan.
contradiction	Christopher, Joe, Paul and Carol are from India, Japan, Oman and United Arab Emirates respectively.	Carol is from India.
contradiction	Jennifer, Dan, Walter and Martha are from Afghanistan, Saudi Arabia, Qatar and Ecuador respectively.	Martha is from Afghanistan.
contradiction	Fred, Mike, Sharon and Alexandra are from Georgia, Bhutan, Zimbabwe and United Arab Emirates respectively.	Alexandra is from Georgia.
contradiction	Ellen, Ed, Patricia and Margaret are from China, Iraq, Netherlands and Iran respectively.	Margaret is from China.
contradiction	Alexander, Philip, Matthew and Julia are from Colombia, Belgium, Sweden and Thailand respectively.	Julia is from Colombia.
contradiction	Dave, Judith, Eleanor and Carl are from Finland, Israel, Hungary and Taiwan respectively.	Carl is from Finland.
contradiction	Laura, Edward, Kenneth and Ruth are from United States of America, Taiwan, Malaysia and Fiji respectively.	Ruth is from United States of America.
contradiction	Harry, Jonathan, Jennifer and Marilyn are from United States of America, Australia, Thailand and Uruguay respectively.	Marilyn is from United States of America.
contradiction	Colin, Eric, Edwin and Rebecca are from China, Iraq, Ukraine and Nepal respectively.	Rebecca is from China.
contradiction	Alison, Julie, Leslie and Maria are from Laos, China, Nepal and Canada respectively.	Maria is from Laos.
contradiction	Katherine, Frank, Diana and Simon are from Brazil, United Kingdom, France and Taiwan respectively.	Simon is from Brazil.
contradiction	Adam, Johnny, Karen and Susan are from Ghana, Maldives, Finland and Belgium respectively.	Susan is from Ghana.
contradiction	Jimmy, Carl, Margaret and Gary are from Belgium, Denmark, Oman and Sweden respectively.	Gary is from Belgium.
contradiction	Lauren, Hugh, Tom and Ryan are from Nepal, Iraq, Colombia and Fiji respectively.	Ryan is from Nepal.
contradiction	Amy, Harriet, Christine and Ed are from North Korea, Ecuador, Cuba and Ireland respectively.	Ed is from North Korea.
contradiction	Barbara, Nick, Jack and George are from Zimbabwe, Poland, Russia and Belgium respectively.	George is from Zimbabwe.
contradiction	Edwin, Richard, Charlotte and Robin are from Greece, New Zealand, United States of America and Libya respectively.	Robin is from Greece.
contradiction	Evelyn, Annie, Bruce and Susan are from Maldives, Philippines, Australia and Saudi Arabia respectively.	Susan is from Maldives.
contradiction	Patrick, Louise, Cynthia and Rachel are from Cuba, Uruguay, Qatar and Philippines respectively.	Rachel is from Cuba.
contradiction	Sophie, Billy, Anne and Julie are from United Kingdom, Thailand, United States of America and Saudi Arabia respectively.	Julie is from United Kingdom.
contradiction	Frances, Susan, Rebecca and Charlotte are from Poland, Argentina, Azerbaijan and Brazil respectively.	Charlotte is from Poland.
contradiction	Jerry, Florence, Lucy and Colin are from India, Canada, Libya and Belgium respectively.	Colin is from India.
contradiction	Ron, Ben, Jason and Tom are from Maldives, Russia, Sweden and United Arab Emirates respectively.	Tom is from Maldives.
contradiction	Kelly, Arthur, Julia and Frances are from Australia, Egypt, Italy and Belgium respectively.	Frances is from Australia.
contradiction	Nicole, John, Kathy and Betty are from Argentina, United Kingdom, Israel and Colombia respectively.	Betty is from Argentina.
contradiction	Kim, Barbara, Carol and Susan are from Austria, Bhutan, Mexico and Haiti respectively.	Susan is from Austria.
contradiction	Michelle, Peter, Judith and Helen are from North Korea, Belgium, Bangladesh and Thailand respectively.	Helen is from North Korea.
contradiction	Daniel, Ken, Carol and Charles are from Brazil, Qatar, Australia and Argentina respectively.	Charles is from Brazil.
contradiction	Katherine, Ralph, Alison and Amy are from Zimbabwe, Denmark, Thailand and Poland respectively.	Amy is from Zimbabwe.
contradiction	Donald, Daniel, Roy and Anne are from Australia, Hungary, China and Ireland respectively.	Anne is from Australia.
contradiction	Simon, Ian, Alfred and Sally are from Thailand, France, Taiwan and Netherlands respectively.	Sally is from Thailand.
contradiction	Florence, Francis, Linda and Ralph are from India, Maldives, Netherlands and Zimbabwe respectively.	Ralph is from India.
contradiction	Kim, Matthew, Alexandra and Larry are from United States of America, Finland, Afghanistan and Indonesia respectively.	Larry is from United States of America.
contradiction	Frances, Betty, Ruth and Billy are from Portugal, North Korea, Sweden and Belarus respectively.	Billy is from Portugal.
contradiction	Patricia, Jessica, Jimmy and Robert are from Pakistan, Brazil, Germany and France respectively.	Robert is from Pakistan.
contradiction	Frederick, Jerry, Lucy and Martin are from Ecuador, Hungary, Philippines and Iceland respectively.	Martin is from Ecuador.
contradiction	Karen, Daniel, Jim and Samuel are from Vietnam, Fiji, Chile and Israel respectively.	Samuel is from Vietnam.
contradiction	Keith, Amy, Kathryn and Stephanie are from Canada, Zimbabwe, North Korea and Laos respectively.	Stephanie is from Canada.
contradiction	Fred, Alex, Sara and Harry are from Chile, Turkey, Switzerland and Poland respectively.	Harry is from Chile.
contradiction	Lynn, Alexandra, Barbara and Joe are from Ireland, Indonesia, Uruguay and Ecuador respectively.	Joe is from Ireland.
contradiction	Robin, Sophie, Christopher and Catherine are from Colombia, Laos, Zimbabwe and Maldives respectively.	Catherine is from Colombia.
contradiction	William, Kim, Martin and Ann are from Ukraine, Laos, Uruguay and Russia respectively.	Ann is from Ukraine.
contradiction	Chris, Johnny, Kathryn and Benjamin are from Russia, Austria, Japan and Iran respectively.	Benjamin is from Russia.
contradiction	George, Scott, Christopher and Karen are from Netherlands, Finland, Taiwan and Bangladesh respectively.	Karen is from Netherlands.
contradiction	Steve, Robin, Suzanne and Alan are from Portugal, Netherlands, Ireland and Thailand respectively.	Alan is from Portugal.
contradiction	Gary, Katherine, Julie and Catherine are from Libya, Zimbabwe, Japan and Hungary respectively.	Catherine is from Libya.
contradiction	Carol, Elizabeth, Suzanne and Alexander are from Ukraine, Australia, Cuba and Brazil respectively.	Alexander is from Ukraine.
contradiction	Donna, Thomas, James and Martha are from Brazil, Fiji, Azerbaijan and Malaysia respectively.	Martha is from Brazil.
contradiction	Sarah, Brian, Marilyn and Kathy are from North Korea, Hungary, Australia and Ecuador respectively.	Kathy is from North Korea.
contradiction	Kevin, Steven, Roy and Victoria are from Greece, North Korea, Taiwan and Iran respectively.	Victoria is from Greece.
contradiction	Lynn, Harry, Ken and Edith are from Uruguay, Austria, Germany and United Arab Emirates respectively.	Edith is from Uruguay.
contradiction	Edith, Michelle, Charles and Ian are from Austria, Laos, France and Cuba respectively.	Ian is from Austria.
contradiction	Sharon, Katie, Jennifer and Charlie are from Portugal, Haiti, Hungary and United Arab Emirates respectively.	Charlie is from Portugal.
contradiction	Alan, Louise, Harold and Barbara are from North Korea, Mexico, Egypt and Pakistan respectively.	Barbara is from North Korea.
contradiction	Alan, Carl, Albert and Mike are from Japan, Israel, Australia and Argentina respectively.	Mike is from Japan.
contradiction	Alison, Alexandra, Claire and Kate are from Maldives, Italy, Belarus and Bangladesh respectively.	Kate is from Maldives.
contradiction	Billy, Diana, Catherine and Dan are from Brazil, Hungary, Libya and Switzerland respectively.	Dan is from Brazil.
contradiction	Richard, Eleanor, Michael and Andrea are from United Arab Emirates, Iraq, Vietnam and Greece respectively.	Andrea is from United Arab Emirates.
contradiction	Sophie, Ben, Roy and Jason are from India, Thailand, Philippines and Ghana respectively.	Jason is from India.
contradiction	Virginia, Andrew, Caroline and Heather are from Bhutan, Turkey, Colombia and Israel respectively.	Heather is from Bhutan.
contradiction	Margaret, David, Brian and Pamela are from Ghana, Ukraine, Germany and Austria respectively.	Pamela is from Ghana.
contradiction	Jim, Anthony, Helen and George are from New Zealand, Iran, Afghanistan and Bhutan respectively.	George is from New Zealand.
contradiction	Emma, Fred, Patricia and Frank are from Singapore, Switzerland, United Kingdom and Australia respectively.	Frank is from Singapore.
contradiction	Mark, Francis, Jean and Nicole are from India, Georgia, Ukraine and Bangladesh respectively.	Nicole is from India.
contradiction	Annie, Chris, Scott and Alex are from Bangladesh, Canada, Zimbabwe and Italy respectively.	Alex is from Bangladesh.
contradiction	James, Dave, Francis and Brian are from New Zealand, Ecuador, Colombia and Israel respectively.	Brian is from New Zealand.
contradiction	Richard, Elizabeth, Louise and Jonathan are from Nepal, Portugal, United Kingdom and Haiti respectively.	Jonathan is from Nepal.
contradiction	Alexandra, Tim, Jeff and Bruce are from Bangladesh, Finland, Turkey and United Arab Emirates respectively.	Bruce is from Bangladesh.
contradiction	Robert, Lucy, Kim and Leslie are from Egypt, Afghanistan, Hungary and Switzerland respectively.	Leslie is from Egypt.
contradiction	Ray, Eric, Joe and Ruth are from Ecuador, Pakistan, Switzerland and Ireland respectively.	Ruth is from Ecuador.
contradiction	Louis, Michelle, Walter and Jennifer are from Egypt, Japan, Iran and Portugal respectively.	Jennifer is from Egypt.
contradiction	Bruce, Elaine, Richard and Elizabeth are from Belgium, Netherlands, Ireland and Malaysia respectively.	Elizabeth is from Belgium.
contradiction	Andrew, Alan, John and Kevin are from Switzerland, South Korea, Belgium and Pakistan respectively.	Kevin is from Switzerland.
contradiction	Jay, Jimmy, Chris and Louis are from United States of America, Zimbabwe, Singapore and Italy respectively.	Louis is from United States of America.
contradiction	Roger, Kelly, Jonathan and Anne are from Netherlands, Georgia, Fiji and Vietnam respectively.	Anne is from Netherlands.
contradiction	Jane, Sally, Suzanne and Jim are from Uruguay, Maldives, Japan and Colombia respectively.	Jim is from Uruguay.
contradiction	Joe, Benjamin, Marilyn and Charles are from Philippines, Mexico, France and Indonesia respectively.	Charles is from Philippines.
contradiction	Henry, Tom, Sara and Suzanne are from Japan, China, Switzerland and Afghanistan respectively.	Suzanne is from Japan.
contradiction	Judy, Caroline, Mark and Jay are from Fiji, Ukraine, Laos and India respectively.	Jay is from Fiji.
contradiction	Mark, Edith, Sally and Bruce are from Indonesia, Azerbaijan, Singapore and Haiti respectively.	Bruce is from Indonesia.
contradiction	Bill, Daniel, Dorothy and Henry are from Azerbaijan, Philippines, South Korea and China respectively.	Henry is from Azerbaijan.
contradiction	Elizabeth, Charles, Eric and Alexander are from North Korea, Switzerland, China and Sweden respectively.	Alexander is from North Korea.
contradiction	Suzanne, Stephen, Claire and Jack are from Belarus, Uruguay, Iceland and North Korea respectively.	Jack is from Belarus.
contradiction	Marilyn, Margaret, Rachel and Colin are from Hungary, Ghana, Greece and Libya respectively.	Colin is from Hungary.
contradiction	Sara, Robert, Elizabeth and Samuel are from Georgia, Laos, Bangladesh and Bhutan respectively.	Samuel is from Georgia.
contradiction	Kathy, Jerry, William and Elizabeth are from Georgia, China, United Arab Emirates and Belgium respectively.	Elizabeth is from Georgia.
contradiction	Diana, Bobby, Ralph and Kelly are from Germany, Ukraine, Azerbaijan and Japan respectively.	Kelly is from Germany.
contradiction	Helen, Charlotte, Stephanie and Jonathan are from Iceland, Zimbabwe, Georgia and Turkey respectively.	Jonathan is from Iceland.
contradiction	Adam, Al, Jessica and Suzanne are from Austria, Uruguay, Hungary and Brazil respectively.	Suzanne is from Austria.
contradiction	Matt, Alexander, Stephanie and Alex are from North Korea, Vietnam, China and Denmark respectively.	Alex is from North Korea.
contradiction	Bobby, Michael, Diana and Eleanor are from Vietnam, Colombia, Taiwan and Brazil respectively.	Eleanor is from Vietnam.
contradiction	Nick, Dan, Arthur and Charlie are from Austria, Cuba, Brazil and Israel respectively.	Charlie is from Austria.
contradiction	Frances, Jimmy, Larry and Alexander are from Chile, Denmark, Greece and Netherlands respectively.	Alexander is from Chile.
contradiction	Tony, Joe, Laura and Deborah are from Cuba, Iceland, Iran and Greece respectively.	Deborah is from Cuba.
contradiction	Kathleen, Deborah, James and Bob are from China, Fiji, Denmark and North Korea respectively.	Bob is from China.
contradiction	Charlotte, Nancy, Arthur and Frances are from Pakistan, Zimbabwe, Colombia and Laos respectively.	Frances is from Pakistan.
contradiction	Samuel, Edward, Katherine and Janet are from Belgium, North Korea, France and Greece respectively.	Janet is from Belgium.
contradiction	Lynn, Deborah, Mike and Martin are from Turkey, Taiwan, Singapore and Belgium respectively.	Martin is from Turkey.
contradiction	Ralph, Marie, Harold and Carl are from Bangladesh, Colombia, United Arab Emirates and Greece respectively.	Carl is from Bangladesh.
contradiction	Sara, Howard, Jonathan and Michelle are from Colombia, Japan, Azerbaijan and Saudi Arabia respectively.	Michelle is from Colombia.
contradiction	Lawrence, Ray, Melissa and Arthur are from Finland, Fiji, Chile and Iceland respectively.	Arthur is from Finland.
contradiction	Ken, Edward, Harriet and Eric are from Cuba, Belgium, Turkey and Saudi Arabia respectively.	Eric is from Cuba.
contradiction	Helen, Martin, Matt and Carol are from Colombia, Iran, Taiwan and China respectively.	Carol is from Colombia.
contradiction	Alan, Wendy, Anne and Leslie are from Netherlands, United Arab Emirates, Belarus and India respectively.	Leslie is from Netherlands.
contradiction	Dan, Philip, Hugh and Ruth are from Singapore, Afghanistan, New Zealand and Denmark respectively.	Ruth is from Singapore.
contradiction	Joseph, Tony, Harry and Anthony are from Germany, Philippines, France and Bhutan respectively.	Anthony is from Germany.
contradiction	Ruth, Jimmy, Jason and Robin are from Uruguay, Afghanistan, India and Malaysia respectively.	Robin is from Uruguay.
contradiction	Ed, Jay, Roger and Emily are from Chile, Oman, United Arab Emirates and Argentina respectively.	Emily is from Chile.
contradiction	Steven, Christine, Larry and Anna are from Russia, Qatar, Saudi Arabia and Mexico respectively.	Anna is from Russia.
contradiction	Eric, Daniel, Joseph and Judy are from Iraq, Sweden, Switzerland and Finland respectively.	Judy is from Iraq.
contradiction	Ruth, Jay, Ashley and Diana are from Zimbabwe, Germany, Uruguay and Maldives respectively.	Diana is from Zimbabwe.
contradiction	Frances, Patrick, Catherine and Daniel are from India, Argentina, Indonesia and Iraq respectively.	Daniel is from India.
contradiction	Alfred, Roy, Gary and Katie are from Maldives, Georgia, Poland and China respectively.	Katie is from Maldives.
contradiction	Heather, Louise, Judith and Katie are from Nepal, Malaysia, Germany and Netherlands respectively.	Katie is from Nepal.
contradiction	Maria, Andrea, Anna and Kelly are from Laos, Poland, Bangladesh and Colombia respectively.	Kelly is from Laos.
contradiction	Bill, Johnny, Louis and Karen are from Australia, Pakistan, Philippines and Indonesia respectively.	Karen is from Australia.
contradiction	Charles, Walter, Susan and Kenneth are from Vietnam, Belarus, Thailand and Australia respectively.	Kenneth is from Vietnam.
contradiction	Julia, Frank, Adam and Martha are from Haiti, Sweden, Laos and Belgium respectively.	Martha is from Haiti.
contradiction	Joe, Sue, Jane and Jay are from Mexico, Netherlands, Australia and Germany respectively.	Jay is from Mexico.
contradiction	Julia, Ron, Stephanie and Christopher are from France, Mexico, Denmark and Netherlands respectively.	Christopher is from France.
contradiction	Annie, Mike, Benjamin and Rose are from Sweden, Afghanistan, Austria and Brazil respectively.	Rose is from Sweden.
contradiction	Lynn, Benjamin, Ben and Nicole are from Bhutan, Afghanistan, Belgium and France respectively.	Nicole is from Bhutan.
contradiction	Ruth, Bobby, Edwin and Mike are from Nepal, New Zealand, Austria and India respectively.	Mike is from Nepal.
contradiction	Katherine, Dave, Howard and Lauren are from North Korea, Poland, Greece and Pakistan respectively.	Lauren is from North Korea.
contradiction	Joan, Evelyn, Florence and Gary are from Ghana, Greece, Mexico and Azerbaijan respectively.	Gary is from Ghana.
contradiction	Alfred, George, Laura and Dorothy are from Colombia, Malaysia, Poland and Uruguay respectively.	Dorothy is from Colombia.
contradiction	Jennifer, Marilyn, William and Alexandra are from Ghana, United Arab Emirates, France and Chile respectively.	Alexandra is from Ghana.
contradiction	Sandra, Anna, Walter and Roy are from Greece, Colombia, North Korea and United Arab Emirates respectively.	Roy is from Greece.
contradiction	Roger, Harold, Anna and Lucy are from Belgium, Bangladesh, North Korea and Iraq respectively.	Lucy is from Belgium.
contradiction	Diana, Robert, Dick and Alice are from Nepal, Ghana, Russia and New Zealand respectively.	Alice is from Nepal.
contradiction	Bobby, Grace, Don and Caroline are from Maldives, Mexico, South Korea and China respectively.	Caroline is from Maldives.
contradiction	Alice, Rachel, George and Dick are from Nepal, Pakistan, Taiwan and Finland respectively.	Dick is from Nepal.
contradiction	Sally, Carolyn, Jean and Maria are from Fiji, Netherlands, Brazil and Israel respectively.	Maria is from Fiji.
contradiction	Sharon, Ralph, Kathy and Katie are from Iran, Laos, Brazil and Nepal respectively.	Katie is from Iran.
contradiction	Alexander, Bill, Hugh and Ruth are from Oman, South Korea, Portugal and Belarus respectively.	Ruth is from Oman.
contradiction	Scott, Ray, Sally and Grace are from Colombia, Libya, Austria and Australia respectively.	Grace is from Colombia.
contradiction	Ed, Marie, Anna and Joan are from Malaysia, Denmark, Oman and Saudi Arabia respectively.	Joan is from Malaysia.
contradiction	Jane, Jim, Barbara and Greg are from Libya, Switzerland, Laos and Ghana respectively.	Greg is from Libya.
contradiction	Rachel, Kathryn, Alice and Alfred are from Mexico, Georgia, Zimbabwe and Pakistan respectively.	Alfred is from Mexico.
contradiction	Sue, Judith, Victoria and John are from Philippines, Vietnam, China and Ghana respectively.	John is from Philippines.
contradiction	Tom, Mike, Linda and Emily are from New Zealand, Ecuador, Austria and Switzerland respectively.	Emily is from New Zealand.
contradiction	Jimmy, Eleanor, Daniel and Steven are from Singapore, Greece, Ghana and Italy respectively.	Steven is from Singapore.
contradiction	Cynthia, Carol, Alison and Dick are from Qatar, Oman, Haiti and South Korea respectively.	Dick is from Qatar.
contradiction	Mike, Edward, Ben and Nick are from Oman, Maldives, Brazil and United Kingdom respectively.	Nick is from Oman.
contradiction	Ron, Jim, Anne and Christopher are from Colombia, United States of America, Denmark and Japan respectively.	Christopher is from Colombia.
contradiction	Julia, Tony, Bob and Scott are from Belarus, United States of America, Switzerland and Austria respectively.	Scott is from Belarus.
contradiction	Albert, Diane, Greg and Annie are from Russia, Australia, Ukraine and Egypt respectively.	Annie is from Russia.
contradiction	Jerry, Christopher, Melissa and Edward are from Italy, Netherlands, Iran and Canada respectively.	Edward is from Italy.
contradiction	Kenneth, Joseph, Mark and Emma are from Ecuador, Ghana, Chile and Germany respectively.	Emma is from Ecuador.
contradiction	Tim, Kate, Melissa and Catherine are from Sweden, Chile, Mexico and Bhutan respectively.	Catherine is from Sweden.
contradiction	Karen, Andrew, Charlie and Caroline are from Philippines, Egypt, Poland and Pakistan respectively.	Caroline is from Philippines.
contradiction	Francis, Fiona, Wendy and Nick are from New Zealand, Georgia, Greece and Ireland respectively.	Nick is from New Zealand.
contradiction	Ellen, Alex, Virginia and Lauren are from Greece, Argentina, Vietnam and Colombia respectively.	Lauren is from Greece.
contradiction	Annie, Chris, Dan and Alfred are from Belarus, Philippines, Qatar and Pakistan respectively.	Alfred is from Belarus.
contradiction	Rose, Jerry, Emma and Ann are from Afghanistan, United Arab Emirates, Ukraine and Pakistan respectively.	Ann is from Afghanistan.
contradiction	Daniel, Sally, David and Melissa are from Qatar, Maldives, Thailand and Iraq respectively.	Melissa is from Qatar.
contradiction	Harry, Marilyn, Arthur and Al are from Georgia, Brazil, Australia and Mexico respectively.	Al is from Georgia.
contradiction	Fred, Victoria, Anna and Nick are from United Kingdom, Cuba, Mexico and Brazil respectively.	Nick is from United Kingdom.
contradiction	Martha, Lisa, Nicole and Dave are from Portugal, Sweden, Azerbaijan and Belarus respectively.	Dave is from Portugal.
contradiction	Sara, Philip, Peter and Donna are from Belarus, Ireland, New Zealand and Japan respectively.	Donna is from Belarus.
contradiction	Betty, Joseph, Scott and Rebecca are from Australia, Indonesia, Mexico and Libya respectively.	Rebecca is from Australia.
contradiction	Roger, Lawrence, Dorothy and William are from Taiwan, Belgium, Turkey and Portugal respectively.	William is from Taiwan.
contradiction	Chris, Charlie, Jean and Dave are from Zimbabwe, Iceland, United States of America and France respectively.	Dave is from Zimbabwe.
contradiction	Sally, Stephanie, Harry and Martha are from Canada, United Kingdom, North Korea and Hungary respectively.	Martha is from Canada.
