contradiction	Helen, Kenneth, Julia and Tim are from Switzerland, Thailand, New Zealand and Sweden respectively.	Tim is from Switzerland.
contradiction	Ian, Bill, Christine and Linda are from Israel, Haiti, Ukraine and Bangladesh respectively.	Linda is from Israel.
contradiction	Billy, Harry, Scott and Maria are from Egypt, Denmark, North Korea and Philippines respectively.	Maria is from Egypt.
contradiction	Betty, Nicole, Lawrence and Wendy are from Indonesia, Qatar, Taiwan and Ukraine respectively.	Wendy is from Indonesia.
contradiction	Joseph, Carolyn, Tony and Elaine are from Australia, Netherlands, Ireland and Mexico respectively.	Elaine is from Australia.
contradiction	Ashley, Bruce, James and Fred are from Sweden, Brazil, Israel and Argentina respectively.	Fred is from Sweden.
contradiction	Gary, Samuel, Grace and Joan are from Sweden, Ecuador, Zimbabwe and Singapore respectively.	Joan is from Sweden.
contradiction	Claire, Ed, Ian and Sam are from Malaysia, Oman, Greece and Philippines respectively.	Sam is from Malaysia.
contradiction	Betty, Angela, Evelyn and Diana are from Afghanistan, Malaysia, Bhutan and Italy respectively.	Diana is from Afghanistan.
contradiction	Kenneth, Laura, Samuel and Walter are from Ecuador, Chile, Japan and Sweden respectively.	Walter is from Ecuador.
contradiction	Martha, Evelyn, Elizabeth and Sara are from Philippines, Canada, Saudi Arabia and Finland respectively.	Sara is from Philippines.
contradiction	Samuel, Emma, Rachel and Stephanie are from Libya, United Arab Emirates, Netherlands and Uruguay respectively.	Stephanie is from Libya.
contradiction	Diana, Greg, Christopher and Charlotte are from Ukraine, Australia, Chile and Ghana respectively.	Charlotte is from Ukraine.
contradiction	Michelle, Ralph, Joan and Cynthia are from Azerbaijan, Germany, Israel and Iceland respectively.	Cynthia is from Azerbaijan.
contradiction	Walter, Jason, Sharon and Benjamin are from Iran, Maldives, Qatar and Finland respectively.	Benjamin is from Iran.
contradiction	Helen, Kevin, Wendy and Sandra are from Uruguay, Japan, Chile and Ukraine respectively.	Sandra is from Uruguay.
contradiction	Bruce, Tim, Ben and Lucy are from Portugal, Israel, Ireland and France respectively.	Lucy is from Portugal.
contradiction	Tim, Judy, Ron and James are from Libya, Oman, Japan and France respectively.	James is from Libya.
contradiction	Mary, Lynn, Elizabeth and Claire are from China, Italy, Brazil and Japan respectively.	Claire is from China.
contradiction	Rose, Ellen, Kathy and Joan are from Egypt, Singapore, Argentina and Italy respectively.	Joan is from Egypt.
contradiction	Katherine, Dick, Deborah and Dave are from Belgium, Italy, Israel and Bangladesh respectively.	Dave is from Belgium.
contradiction	Scott, Alison, Amy and Ann are from United Arab Emirates, Pakistan, Zimbabwe and United Kingdom respectively.	Ann is from United Arab Emirates.
contradiction	Suzanne, Nicole, Fiona and Don are from Iceland, Ecuador, Cuba and Fiji respectively.	Don is from Iceland.
contradiction	Amy, Pamela, Lawrence and Frederick are from United Kingdom, United Arab Emirates, Ghana and Belarus respectively.	Frederick is from United Kingdom.
contradiction	Don, Jeff, Alice and Victoria are from Iraq, Chile, Cuba and Belarus respectively.	Victoria is from Iraq.
contradiction	Fiona, Harold, Roger and Kathleen are from Libya, Belgium, France and Brazil respectively.	Kathleen is from Libya.
contradiction	Ellen, Peter, Francis and Lynn are from Azerbaijan, Bangladesh, Bhutan and Netherlands respectively.	Lynn is from Azerbaijan.
contradiction	Barbara, Benjamin, Eric and Betty are from Austria, Finland, Taiwan and Iceland respectively.	Betty is from Austria.
contradiction	Maria, Samuel, Caroline and Wendy are from Zimbabwe, Indonesia, Cuba and Singapore respectively.	Wendy is from Zimbabwe.
contradiction	Suzanne, Ann, Florence and Nancy are from Israel, China, Colombia and Cuba respectively.	Nancy is from Israel.
contradiction	Roger, Amanda, Marilyn and Suzanne are from Cuba, Belgium, Italy and Sweden respectively.	Suzanne is from Cuba.
contradiction	Kenneth, Alexandra, George and Carl are from Poland, Vietnam, Libya and Afghanistan respectively.	Carl is from Poland.
contradiction	Bob, Colin, Christine and Judith are from Denmark, Turkey, Brazil and Sweden respectively.	Judith is from Denmark.
contradiction	Alexander, Carol, Pamela and Jack are from Philippines, Ireland, United Kingdom and Libya respectively.	Jack is from Philippines.
contradiction	Harriet, Alice, Mark and Colin are from Austria, Belgium, Georgia and Finland respectively.	Colin is from Austria.
contradiction	Mark, Matthew, Alfred and Mary are from Iran, Iceland, Finland and Japan respectively.	Mary is from Iran.
contradiction	Deborah, Jimmy, Paul and Virginia are from Sweden, New Zealand, Taiwan and Italy respectively.	Virginia is from Sweden.
contradiction	Melissa, Kim, Philip and Ron are from Switzerland, Germany, Laos and Cuba respectively.	Ron is from Switzerland.
contradiction	Joe, Jerry, Sarah and Patricia are from Singapore, Russia, Azerbaijan and Mexico respectively.	Patricia is from Singapore.
contradiction	Julie, Ryan, Robert and Paul are from Saudi Arabia, Germany, Philippines and Afghanistan respectively.	Paul is from Saudi Arabia.
contradiction	Kenneth, Christopher, Heather and Walter are from India, United Kingdom, Austria and Ghana respectively.	Walter is from India.
contradiction	Frances, Edwin, Amanda and Anthony are from Libya, Georgia, Ecuador and Ireland respectively.	Anthony is from Libya.
contradiction	Jim, Sara, Angela and Harriet are from Iran, Brazil, Iraq and Austria respectively.	Harriet is from Iran.
contradiction	Brian, Sophie, Ellen and Daniel are from Egypt, Poland, North Korea and Indonesia respectively.	Daniel is from Egypt.
contradiction	Howard, Julie, Fiona and Laura are from Azerbaijan, United Arab Emirates, Belarus and Bangladesh respectively.	Laura is from Azerbaijan.
contradiction	Diana, Fred, Lisa and Nancy are from Haiti, Thailand, Portugal and Bhutan respectively.	Nancy is from Haiti.
contradiction	Ron, Emma, Tony and Julia are from Pakistan, Japan, Austria and Bhutan respectively.	Julia is from Pakistan.
contradiction	Frances, Laura, Thomas and Steven are from United Kingdom, Haiti, Taiwan and Brazil respectively.	Steven is from United Kingdom.
contradiction	Greg, Helen, Jim and Ruth are from Taiwan, New Zealand, Greece and Ireland respectively.	Ruth is from Taiwan.
contradiction	Jeff, Diane, Edwin and Jennifer are from Fiji, Egypt, Qatar and Russia respectively.	Jennifer is from Fiji.
contradiction	Jill, Ralph, Louise and Ken are from Sweden, Singapore, Pakistan and Uruguay respectively.	Ken is from Sweden.
contradiction	Pamela, Kathy, Tony and Dick are from Afghanistan, Taiwan, Malaysia and Egypt respectively.	Dick is from Afghanistan.
contradiction	Scott, Sarah, Wendy and Peter are from Libya, Belgium, Greece and Georgia respectively.	Peter is from Libya.
contradiction	Ken, Stephen, Sally and Leslie are from Israel, South Korea, Brazil and Maldives respectively.	Leslie is from Israel.
contradiction	Henry, Virginia, Keith and Sara are from Taiwan, Laos, Brazil and Canada respectively.	Sara is from Taiwan.
contradiction	Lawrence, Andrew, Alice and Sally are from Argentina, Uruguay, Haiti and Sweden respectively.	Sally is from Argentina.
contradiction	Kathy, Edward, Kelly and Francis are from Australia, Ireland, North Korea and United Arab Emirates respectively.	Francis is from Australia.
contradiction	Jessica, Roger, Julia and Louise are from India, Iran, Qatar and Germany respectively.	Louise is from India.
contradiction	Carolyn, Wendy, Stephanie and Ellen are from Thailand, Chile, Netherlands and Austria respectively.	Ellen is from Thailand.
contradiction	Alex, Rebecca, Jessica and Samuel are from Greece, Belgium, Libya and Russia respectively.	Samuel is from Greece.
contradiction	Grace, Dorothy, Don and Alex are from New Zealand, Thailand, Netherlands and Canada respectively.	Alex is from New Zealand.
contradiction	Alison, Billy, Harry and Florence are from Belarus, Belgium, Germany and China respectively.	Florence is from Belarus.
contradiction	Eleanor, Anthony, Al and Ron are from Argentina, Philippines, Indonesia and Qatar respectively.	Ron is from Argentina.
contradiction	Janet, Charlotte, Walter and Jim are from Thailand, Iceland, Qatar and Italy respectively.	Jim is from Thailand.
contradiction	Sue, Betty, Sam and Annie are from Fiji, China, Chile and France respectively.	Annie is from Fiji.
contradiction	Sam, Christine, Alexander and Catherine are from Oman, United States of America, Germany and Greece respectively.	Catherine is from Oman.
contradiction	Alex, Francis, Chris and Sarah are from Malaysia, Canada, Bhutan and Hungary respectively.	Sarah is from Malaysia.
contradiction	Cynthia, Martin, Fiona and Louis are from Haiti, Singapore, United Arab Emirates and Pakistan respectively.	Louis is from Haiti.
contradiction	Karen, Robert, Amy and Thomas are from France, Finland, Ecuador and Fiji respectively.	Thomas is from France.
contradiction	Carol, Pamela, Kelly and Rose are from Canada, Zimbabwe, Haiti and Cuba respectively.	Rose is from Canada.
contradiction	Katie, Mary, Bob and Pamela are from Finland, Poland, Saudi Arabia and Indonesia respectively.	Pamela is from Finland.
contradiction	Carolyn, Charlotte, Ken and Julie are from Thailand, Nepal, Indonesia and Bhutan respectively.	Julie is from Thailand.
contradiction	Grace, Stephanie, Jason and Donald are from Fiji, China, Israel and Brazil respectively.	Donald is from Fiji.
contradiction	Gary, Alice, Alexander and Alison are from Argentina, Saudi Arabia, Egypt and Bangladesh respectively.	Alison is from Argentina.
contradiction	Don, Harold, Chris and Christine are from Taiwan, Cuba, Iraq and Laos respectively.	Christine is from Taiwan.
contradiction	Sandra, Brian, Andrew and Julie are from Iraq, Indonesia, China and Finland respectively.	Julie is from Iraq.
contradiction	Melissa, Sam, Rose and Walter are from Canada, Philippines, South Korea and Azerbaijan respectively.	Walter is from Canada.
contradiction	Tom, Susan, Marilyn and Patrick are from Singapore, Austria, Germany and Japan respectively.	Patrick is from Singapore.
contradiction	Henry, Heather, Simon and Arthur are from Qatar, Iran, China and India respectively.	Arthur is from Qatar.
contradiction	Eric, Peter, Katie and Maria are from Canada, Azerbaijan, Bhutan and Cuba respectively.	Maria is from Canada.
contradiction	Julie, Sara, Frederick and Susan are from Laos, United States of America, Oman and Uruguay respectively.	Susan is from Laos.
contradiction	Ralph, Anne, Ryan and Robin are from Belgium, Bhutan, Italy and Malaysia respectively.	Robin is from Belgium.
contradiction	Stephanie, Frederick, Jack and Bobby are from Italy, North Korea, Netherlands and Colombia respectively.	Bobby is from Italy.
contradiction	Fiona, Christopher, Lucy and Jim are from Chile, Uruguay, New Zealand and Taiwan respectively.	Jim is from Chile.
contradiction	Amy, Edward, Al and Don are from Ghana, North Korea, Austria and Iceland respectively.	Don is from Ghana.
contradiction	Greg, Kathleen, Billy and Betty are from Libya, Canada, Germany and United Arab Emirates respectively.	Betty is from Libya.
contradiction	Susan, Roger, Linda and Jessica are from Haiti, Greece, Fiji and United Arab Emirates respectively.	Jessica is from Haiti.
contradiction	Barbara, Ralph, Matthew and Peter are from Ghana, Ukraine, Singapore and Poland respectively.	Peter is from Ghana.
contradiction	Stephen, Robin, Dick and Scott are from Iraq, Cuba, Singapore and Iceland respectively.	Scott is from Iraq.
contradiction	Margaret, Andrew, Amy and Frances are from Oman, Zimbabwe, Maldives and Bangladesh respectively.	Frances is from Oman.
contradiction	Pamela, Simon, Ian and Evelyn are from Philippines, Argentina, Japan and Switzerland respectively.	Evelyn is from Philippines.
contradiction	Andrew, Nicole, Lynn and Harry are from Ecuador, Australia, Japan and Iraq respectively.	Harry is from Ecuador.
contradiction	Gary, Victoria, Lauren and Ruth are from Switzerland, Hungary, Sweden and Egypt respectively.	Ruth is from Switzerland.
contradiction	Sophie, Alex, Elizabeth and Tom are from Pakistan, Libya, Azerbaijan and Finland respectively.	Tom is from Pakistan.
contradiction	Linda, Harriet, Patrick and Eleanor are from Afghanistan, Iceland, Belgium and Egypt respectively.	Eleanor is from Afghanistan.
contradiction	Jennifer, Don, Edwin and Lawrence are from Russia, Japan, United Kingdom and Austria respectively.	Lawrence is from Russia.
contradiction	Joseph, Kim, Virginia and Dan are from Thailand, China, Brazil and Georgia respectively.	Dan is from Thailand.
contradiction	Mark, Betty, Andrea and Matt are from Singapore, Japan, Argentina and Indonesia respectively.	Matt is from Singapore.
contradiction	Andrew, James, Richard and Marilyn are from Vietnam, Ukraine, Portugal and Japan respectively.	Marilyn is from Vietnam.
contradiction	Kathryn, Lynn, Alex and Mary are from Bhutan, Canada, Italy and Chile respectively.	Mary is from Bhutan.
contradiction	Jean, Mike, Janet and Bob are from Haiti, Poland, Belarus and Ireland respectively.	Bob is from Haiti.
contradiction	Sue, Don, Jill and Louis are from Colombia, Belgium, Zimbabwe and Libya respectively.	Louis is from Colombia.
contradiction	Joseph, Ellen, Jim and Rose are from Saudi Arabia, China, Hungary and Egypt respectively.	Rose is from Saudi Arabia.
contradiction	Tony, Harriet, Heather and Jennifer are from Bangladesh, Iceland, Greece and Egypt respectively.	Jennifer is from Bangladesh.
contradiction	Robert, Charlotte, Margaret and Chris are from China, Israel, Finland and Azerbaijan respectively.	Chris is from China.
contradiction	Steven, Christine, Daniel and Alexandra are from Laos, Australia, North Korea and Argentina respectively.	Alexandra is from Laos.
contradiction	Sue, Jean, Diana and Dan are from France, Cuba, Bhutan and India respectively.	Dan is from France.
contradiction	Larry, Jane, Sandra and Bobby are from Maldives, Nepal, China and Philippines respectively.	Bobby is from Maldives.
contradiction	Victoria, Rose, Carl and Johnny are from United States of America, Malaysia, Austria and Iraq respectively.	Johnny is from United States of America.
contradiction	Catherine, Suzanne, Kenneth and Samuel are from Brazil, Bhutan, Israel and Oman respectively.	Samuel is from Brazil.
contradiction	Kenneth, Alison, Melissa and Michael are from Azerbaijan, Bangladesh, Italy and Fiji respectively.	Michael is from Azerbaijan.
contradiction	Lauren, Nancy, Ann and Joseph are from Chile, Ghana, Mexico and Iceland respectively.	Joseph is from Chile.
contradiction	Melissa, Hugh, Ray and Bob are from Zimbabwe, Colombia, Turkey and Belarus respectively.	Bob is from Zimbabwe.
contradiction	Donna, Keith, Jason and Joan are from Philippines, Israel, Ukraine and United Kingdom respectively.	Joan is from Philippines.
contradiction	Florence, Jack, Adam and Henry are from Ireland, Australia, Austria and Azerbaijan respectively.	Henry is from Ireland.
contradiction	Victoria, Catherine, Robin and Katherine are from Germany, Nepal, Australia and United Kingdom respectively.	Katherine is from Germany.
contradiction	Donna, Alexandra, John and Johnny are from Egypt, Denmark, China and Poland respectively.	Johnny is from Egypt.
contradiction	Dick, Katie, Julia and Ron are from Argentina, North Korea, Oman and Germany respectively.	Ron is from Argentina.
contradiction	Bill, Edith, Rachel and Sarah are from Azerbaijan, Mexico, Haiti and Afghanistan respectively.	Sarah is from Azerbaijan.
contradiction	Victoria, Kathleen, Lawrence and Sharon are from Maldives, United States of America, Fiji and Taiwan respectively.	Sharon is from Maldives.
contradiction	Melissa, William, Dick and Amy are from Brazil, Russia, Afghanistan and Georgia respectively.	Amy is from Brazil.
contradiction	Lawrence, Roger, Hugh and Laura are from Hungary, Ukraine, Belarus and Russia respectively.	Laura is from Hungary.
contradiction	Jack, Andrea, Annie and Sophie are from Israel, Pakistan, Ecuador and Turkey respectively.	Sophie is from Israel.
contradiction	Joan, Tim, Rachel and Andrea are from Qatar, Bangladesh, Russia and Greece respectively.	Andrea is from Qatar.
contradiction	William, Kathleen, Jay and Joseph are from Poland, Italy, Turkey and Finland respectively.	Joseph is from Poland.
contradiction	Ryan, Amy, Sam and Brian are from Zimbabwe, Hungary, Nepal and Indonesia respectively.	Brian is from Zimbabwe.
contradiction	Deborah, Charlie, Angela and Scott are from Afghanistan, Australia, Egypt and Saudi Arabia respectively.	Scott is from Afghanistan.
contradiction	Mike, Simon, Martin and Donna are from Turkey, Ireland, Maldives and Philippines respectively.	Donna is from Turkey.
contradiction	Nick, Peter, Louise and Fred are from Singapore, Nepal, Colombia and Argentina respectively.	Fred is from Singapore.
contradiction	Cynthia, Carl, Donna and Roy are from Belgium, Ukraine, Switzerland and Azerbaijan respectively.	Roy is from Belgium.
contradiction	Deborah, Frederick, Martha and Emma are from United States of America, Argentina, Netherlands and Belgium respectively.	Emma is from United States of America.
contradiction	Sara, Bill, Edwin and Elaine are from Bangladesh, Japan, United States of America and Switzerland respectively.	Elaine is from Bangladesh.
contradiction	Virginia, Patricia, Peter and Alexander are from Fiji, Iran, Pakistan and Azerbaijan respectively.	Alexander is from Fiji.
contradiction	Roger, Virginia, Leslie and Thomas are from Egypt, Sweden, France and Bangladesh respectively.	Thomas is from Egypt.
contradiction	Harold, Emma, Kelly and Walter are from Pakistan, Japan, Georgia and Afghanistan respectively.	Walter is from Pakistan.
contradiction	Tom, Wendy, Gary and David are from Canada, New Zealand, Australia and South Korea respectively.	David is from Canada.
contradiction	Nancy, Don, Jane and Nick are from Thailand, Israel, Bhutan and Denmark respectively.	Nick is from Thailand.
contradiction	Alexander, Bobby, Margaret and Lucy are from Egypt, Argentina, Ghana and Austria respectively.	Lucy is from Egypt.
contradiction	Mike, Lauren, Eleanor and Andrew are from Georgia, Chile, Italy and New Zealand respectively.	Andrew is from Georgia.
contradiction	Alison, Michelle, Angela and Roger are from Canada, Ukraine, Afghanistan and Georgia respectively.	Roger is from Canada.
contradiction	Thomas, Sarah, Mary and Scott are from Thailand, United States of America, Bangladesh and Nepal respectively.	Scott is from Thailand.
contradiction	Ashley, Charles, Jim and Judith are from Belarus, Libya, Canada and Denmark respectively.	Judith is from Belarus.
contradiction	Jason, Lucy, Amanda and Sally are from Belarus, China, Malaysia and Brazil respectively.	Sally is from Belarus.
contradiction	Florence, Jeff, Robert and Diana are from Vietnam, New Zealand, Israel and Argentina respectively.	Diana is from Vietnam.
contradiction	Katherine, Joe, Simon and Don are from Iceland, Finland, Germany and Philippines respectively.	Don is from Iceland.
contradiction	Emily, Rachel, Tony and Christopher are from Thailand, Australia, United States of America and Iran respectively.	Christopher is from Thailand.
contradiction	Janet, Charles, Al and Jonathan are from Ukraine, Malaysia, Oman and Philippines respectively.	Jonathan is from Ukraine.
contradiction	Robin, Hugh, Frank and Karen are from Afghanistan, India, Netherlands and United Arab Emirates respectively.	Karen is from Afghanistan.
contradiction	Mary, Kate, Bobby and Greg are from Egypt, Nepal, South Korea and Brazil respectively.	Greg is from Egypt.
contradiction	James, Wendy, Kim and Katie are from Bangladesh, Uruguay, Russia and Portugal respectively.	Katie is from Bangladesh.
contradiction	Frances, Martha, Alexandra and Ken are from India, Ecuador, Laos and Iran respectively.	Ken is from India.
contradiction	Kevin, Lucy, Deborah and Marilyn are from Ghana, Brazil, Turkey and France respectively.	Marilyn is from Ghana.
contradiction	Annie, Ken, Diane and Jeff are from United Kingdom, Argentina, Turkey and Sweden respectively.	Jeff is from United Kingdom.
contradiction	Alfred, Charlie, Stephen and Martha are from Greece, Taiwan, Libya and Cuba respectively.	Martha is from Greece.
contradiction	Lauren, Arthur, Christine and Simon are from Chile, Zimbabwe, Saudi Arabia and Iceland respectively.	Simon is from Chile.
contradiction	Al, Catherine, Virginia and Sarah are from Canada, Pakistan, Turkey and Chile respectively.	Sarah is from Canada.
contradiction	Bobby, Mark, Walter and James are from Turkey, Bhutan, Italy and Indonesia respectively.	James is from Turkey.
contradiction	Kate, Ken, Nancy and Robin are from France, United Kingdom, Bangladesh and Portugal respectively.	Robin is from France.
contradiction	Lucy, Harriet, Alex and Amy are from Ghana, Hungary, Uruguay and Egypt respectively.	Amy is from Ghana.
contradiction	Jason, Pamela, Cynthia and David are from Vietnam, Japan, Laos and Iraq respectively.	David is from Vietnam.
contradiction	Ryan, Jason, Elizabeth and Lynn are from Haiti, Iraq, Oman and North Korea respectively.	Lynn is from Haiti.
contradiction	Jennifer, Kate, Dick and Ray are from Azerbaijan, Ukraine, Fiji and Colombia respectively.	Ray is from Azerbaijan.
contradiction	Florence, Annie, Mark and Fred are from Australia, Bangladesh, Philippines and Sweden respectively.	Fred is from Australia.
contradiction	Alice, Martin, Larry and Greg are from Sweden, Poland, Greece and Hungary respectively.	Greg is from Sweden.
contradiction	Bobby, Charlie, Barbara and Sally are from Portugal, Ghana, South Korea and Laos respectively.	Sally is from Portugal.
contradiction	Frank, Greg, Ian and Sara are from Chile, Belgium, Oman and Italy respectively.	Sara is from Chile.
contradiction	Donald, Edith, Angela and Alison are from Oman, France, Canada and United Kingdom respectively.	Alison is from Oman.
contradiction	Frederick, Anne, Kathryn and Ed are from Georgia, Ireland, Zimbabwe and United Arab Emirates respectively.	Ed is from Georgia.
contradiction	Ruth, Ann, Larry and Scott are from New Zealand, Oman, India and Colombia respectively.	Scott is from New Zealand.
contradiction	Jim, Sharon, Richard and Andrea are from Qatar, Pakistan, Georgia and Israel respectively.	Andrea is from Qatar.
contradiction	Steve, Andrew, Benjamin and Linda are from Vietnam, New Zealand, Malaysia and Belarus respectively.	Linda is from Vietnam.
contradiction	Carolyn, Lucy, Sam and Jason are from Bhutan, Russia, Hungary and Zimbabwe respectively.	Jason is from Bhutan.
contradiction	Alan, Emma, Chris and Colin are from Taiwan, Iraq, India and Mexico respectively.	Colin is from Taiwan.
contradiction	Louise, Eric, Charlotte and Lucy are from Colombia, Israel, Philippines and Saudi Arabia respectively.	Lucy is from Colombia.
contradiction	Jonathan, Gary, Karen and Anna are from Maldives, Sweden, Ireland and Argentina respectively.	Anna is from Maldives.
contradiction	Janet, Ann, Harriet and Roger are from Argentina, Iceland, Cuba and Greece respectively.	Roger is from Argentina.
contradiction	Evelyn, Jeff, Kelly and Billy are from Azerbaijan, Bhutan, Maldives and Greece respectively.	Billy is from Azerbaijan.
contradiction	Rebecca, Jay, Alexander and Sandra are from Belarus, Azerbaijan, Indonesia and Portugal respectively.	Sandra is from Belarus.
contradiction	Ellen, Dick, Eric and Arthur are from India, Denmark, Brazil and Bhutan respectively.	Arthur is from India.
contradiction	Sam, Carol, Betty and Pamela are from Qatar, Maldives, Israel and Greece respectively.	Pamela is from Qatar.
contradiction	Katie, Brian, Peter and Larry are from Uruguay, United States of America, Iraq and Greece respectively.	Larry is from Uruguay.
contradiction	Steve, Jill, Victoria and Florence are from Turkey, Azerbaijan, India and Canada respectively.	Florence is from Turkey.
contradiction	Katie, John, Roy and Jennifer are from Ireland, Mexico, Vietnam and Hungary respectively.	Jennifer is from Ireland.
contradiction	Edward, Alexandra, Mike and Maria are from United Kingdom, Zimbabwe, Afghanistan and Vietnam respectively.	Maria is from United Kingdom.
contradiction	Angela, Susan, Betty and Donna are from Georgia, Singapore, Sweden and Ghana respectively.	Donna is from Georgia.
contradiction	Ben, Michael, Jason and Jill are from Hungary, Indonesia, United Kingdom and Haiti respectively.	Jill is from Hungary.
contradiction	Rebecca, Jimmy, Alexander and Marie are from Italy, Hungary, Bhutan and Zimbabwe respectively.	Marie is from Italy.
contradiction	Pamela, Steven, Hugh and Jerry are from Thailand, Taiwan, Zimbabwe and Chile respectively.	Jerry is from Thailand.
contradiction	Martha, Kim, Chris and Deborah are from Taiwan, Japan, Denmark and Iran respectively.	Deborah is from Taiwan.
contradiction	Fiona, Joe, Ashley and Suzanne are from Ireland, Portugal, Italy and India respectively.	Suzanne is from Ireland.
contradiction	Claire, Judith, Kelly and Victoria are from Austria, United Kingdom, Ghana and Colombia respectively.	Victoria is from Austria.
contradiction	Roger, Ray, Sue and Jane are from Qatar, Mexico, Indonesia and Ghana respectively.	Jane is from Qatar.
contradiction	Elizabeth, John, Heather and Frederick are from Libya, Chile, Georgia and Ukraine respectively.	Frederick is from Libya.
contradiction	Karen, Albert, Bobby and Anna are from Ghana, Austria, Vietnam and Malaysia respectively.	Anna is from Ghana.
contradiction	Helen, Martha, Claire and Steve are from Vietnam, Cuba, Poland and Belgium respectively.	Steve is from Vietnam.
contradiction	Dorothy, Fred, Jack and Tim are from Argentina, Libya, United Kingdom and Ukraine respectively.	Tim is from Argentina.
contradiction	Howard, Jim, Michelle and Johnny are from Malaysia, Mexico, Singapore and Hungary respectively.	Johnny is from Malaysia.
