entailment	Kathryn, Ken, Elizabeth and Mary are from Vietnam, Iran, Thailand and Ireland respectively.	Elizabeth is from Thailand.
entailment	Ken, Leslie, Martin and Carl are from Russia, Georgia, Iran and Singapore respectively.	Martin is from Iran.
entailment	Claire, Eleanor, Nick and Suzanne are from Taiwan, Netherlands, Vietnam and Chile respectively.	Nick is from Vietnam.
entailment	Ann, Scott, Joan and Helen are from Belgium, Thailand, South Korea and Sweden respectively.	Joan is from South Korea.
entailment	Jeff, Grace, Peter and Sam are from Greece, Finland, Laos and Fiji respectively.	Peter is from Laos.
entailment	Caroline, Jessica, Janet and Edward are from Iceland, Iraq, Greece and Israel respectively.	Janet is from Greece.
entailment	Kim, Karen, Chris and Dorothy are from Pakistan, Poland, Philippines and Nepal respectively.	Chris is from Philippines.
entailment	Kevin, Sandra, Elizabeth and Marie are from Pakistan, Austria, Russia and France respectively.	Elizabeth is from Russia.
entailment	Patricia, Linda, Eric and Kathleen are from Indonesia, Austria, Malaysia and Ukraine respectively.	Eric is from Malaysia.
entailment	Kelly, Patricia, Leslie and Kevin are from Netherlands, Libya, Thailand and Portugal respectively.	Leslie is from Thailand.
entailment	Philip, Jay, Alfred and Emma are from United Kingdom, Finland, Saudi Arabia and Thailand respectively.	Alfred is from Saudi Arabia.
entailment	Mary, Diane, Jay and Scott are from Singapore, Belgium, Portugal and Haiti respectively.	Jay is from Portugal.
entailment	Bill, Paul, Lawrence and Jason are from Ireland, Poland, South Korea and Brazil respectively.	Lawrence is from South Korea.
entailment	Carol, Robert, Michael and Lisa are from Laos, Vietnam, Cuba and Ecuador respectively.	Michael is from Cuba.
entailment	Philip, Andrew, Karen and Alexandra are from Ghana, North Korea, Maldives and Iceland respectively.	Karen is from Maldives.
entailment	Dan, Chris, Steve and Bruce are from Sweden, Greece, Austria and Laos respectively.	Steve is from Austria.
entailment	Melissa, Evelyn, Deborah and Kenneth are from Afghanistan, Poland, Argentina and Taiwan respectively.	Deborah is from Argentina.
entailment	Bill, Paul, Kathleen and Julie are from Argentina, Hungary, Oman and Chile respectively.	Kathleen is from Oman.
entailment	Elaine, Ray, Ryan and Harold are from Laos, Bangladesh, Austria and Zimbabwe respectively.	Ryan is from Austria.
entailment	Kelly, Kathy, Marie and Margaret are from Switzerland, Fiji, Singapore and Azerbaijan respectively.	Marie is from Singapore.
entailment	Margaret, Wendy, Katie and Sara are from Haiti, Singapore, France and Belgium respectively.	Katie is from France.
entailment	Jeff, Dorothy, Robert and Simon are from Mexico, United Kingdom, Sweden and Canada respectively.	Robert is from Sweden.
entailment	Jack, Ryan, Arthur and Philip are from Bangladesh, Laos, Egypt and Iceland respectively.	Arthur is from Egypt.
entailment	Alice, Lynn, Mike and Jeff are from North Korea, Philippines, Ireland and Mexico respectively.	Mike is from Ireland.
entailment	Alexandra, Brian, Katherine and Tom are from Israel, Saudi Arabia, Colombia and Italy respectively.	Katherine is from Colombia.
entailment	Dave, Stephanie, Diana and James are from Georgia, South Korea, Colombia and Oman respectively.	Diana is from Colombia.
entailment	Suzanne, Virginia, Margaret and Christine are from Georgia, Philippines, Iran and Thailand respectively.	Margaret is from Iran.
entailment	Emily, Edith, Alfred and Harriet are from Saudi Arabia, Uruguay, Argentina and France respectively.	Alfred is from Argentina.
entailment	Matt, Albert, George and Alex are from Iceland, Argentina, Oman and Pakistan respectively.	George is from Oman.
entailment	Annie, Frances, Eric and Matt are from South Korea, Zimbabwe, North Korea and Belarus respectively.	Eric is from North Korea.
entailment	Peter, Charles, Jill and Kathy are from New Zealand, Zimbabwe, Philippines and South Korea respectively.	Jill is from Philippines.
entailment	Deborah, Simon, Helen and Ryan are from France, Portugal, United States of America and Azerbaijan respectively.	Helen is from United States of America.
entailment	Frederick, Charles, Diane and Linda are from Cuba, Georgia, Germany and Malaysia respectively.	Diane is from Germany.
entailment	David, Kathryn, Lisa and James are from Iran, Philippines, Russia and Hungary respectively.	Lisa is from Russia.
entailment	Christine, Stephen, Ryan and Joe are from Colombia, Indonesia, Israel and Zimbabwe respectively.	Ryan is from Israel.
entailment	Patrick, Greg, Colin and Dan are from Qatar, Denmark, Japan and Malaysia respectively.	Colin is from Japan.
entailment	Martha, Sharon, Janet and Benjamin are from Argentina, Bangladesh, Bhutan and Colombia respectively.	Janet is from Bhutan.
entailment	Wendy, Mike, Janet and James are from Libya, Egypt, United Kingdom and France respectively.	Janet is from United Kingdom.
entailment	Emily, Heather, Jeff and Philip are from Bhutan, Finland, Russia and Turkey respectively.	Jeff is from Russia.
entailment	Donna, Katherine, John and Angela are from Russia, Laos, United States of America and Denmark respectively.	John is from United States of America.
entailment	Victoria, Deborah, Andrew and Martin are from Qatar, Hungary, Nepal and United Arab Emirates respectively.	Andrew is from Nepal.
entailment	Suzanne, Louis, Kelly and Barbara are from Sweden, Afghanistan, Georgia and Denmark respectively.	Kelly is from Georgia.
entailment	Kevin, Tim, Joseph and Linda are from Belgium, Brazil, Qatar and Indonesia respectively.	Joseph is from Qatar.
entailment	Francis, Harriet, Jennifer and Greg are from Ireland, Russia, Japan and Chile respectively.	Jennifer is from Japan.
entailment	Christopher, Ray, Lucy and Emily are from Maldives, United Kingdom, Thailand and Laos respectively.	Lucy is from Thailand.
entailment	Martin, Sara, Charlie and Alison are from Germany, Ireland, Maldives and Iran respectively.	Charlie is from Maldives.
entailment	Kathleen, James, Barbara and Eleanor are from France, Sweden, Ecuador and Greece respectively.	Barbara is from Ecuador.
entailment	Karen, Michelle, Stephanie and Anna are from Thailand, Netherlands, Pakistan and Cuba respectively.	Stephanie is from Pakistan.
entailment	Julia, Howard, Rachel and Barbara are from Singapore, France, Libya and Maldives respectively.	Rachel is from Libya.
entailment	Mary, Ed, Matthew and Edward are from Thailand, Pakistan, Portugal and Switzerland respectively.	Matthew is from Portugal.
entailment	Billy, Anne, Sarah and Jonathan are from China, Ireland, Bhutan and Philippines respectively.	Sarah is from Bhutan.
entailment	Laura, Keith, Kenneth and Harold are from Maldives, Turkey, Ireland and United Arab Emirates respectively.	Kenneth is from Ireland.
entailment	Maria, Dorothy, Anthony and Helen are from Afghanistan, France, Philippines and Laos respectively.	Anthony is from Philippines.
entailment	Julia, Ray, Dorothy and Amanda are from Italy, United States of America, Poland and Portugal respectively.	Dorothy is from Poland.
entailment	Julia, Jay, Laura and Michelle are from North Korea, Italy, Finland and Denmark respectively.	Laura is from Finland.
entailment	Sam, Katie, Jay and Alice are from Philippines, Indonesia, Belarus and Qatar respectively.	Jay is from Belarus.
entailment	Jeff, Anna, Paul and Howard are from Indonesia, Egypt, Brazil and Israel respectively.	Paul is from Brazil.
entailment	Katie, Michelle, Grace and Sara are from Laos, Poland, Uruguay and Ireland respectively.	Grace is from Uruguay.
entailment	Mark, Virginia, Al and Edwin are from Hungary, Thailand, Switzerland and Ukraine respectively.	Al is from Switzerland.
entailment	Johnny, Ellen, Alison and Patricia are from Fiji, Iceland, United Arab Emirates and South Korea respectively.	Alison is from United Arab Emirates.
entailment	Mark, Cynthia, Ray and Frances are from Maldives, France, Bangladesh and Australia respectively.	Ray is from Bangladesh.
entailment	Julie, Albert, Greg and Linda are from Russia, Iceland, Belarus and Ecuador respectively.	Greg is from Belarus.
entailment	Lisa, Harriet, Andrea and Karen are from Belgium, Argentina, Sweden and Germany respectively.	Andrea is from Sweden.
entailment	Dick, Jim, Grace and Kenneth are from Qatar, Hungary, Fiji and Thailand respectively.	Grace is from Fiji.
entailment	Eric, Judy, Diane and Ray are from Uruguay, Ghana, Maldives and Cuba respectively.	Diane is from Maldives.
entailment	Roger, Rose, Carol and Ellen are from Georgia, Sweden, Denmark and France respectively.	Carol is from Denmark.
entailment	Jim, Helen, Elaine and Joe are from Israel, Argentina, Nepal and Sweden respectively.	Elaine is from Nepal.
entailment	Daniel, Henry, Adam and Julia are from Azerbaijan, Indonesia, Taiwan and Argentina respectively.	Adam is from Taiwan.
entailment	Johnny, Mary, Alan and Sara are from Germany, Belarus, Ukraine and United States of America respectively.	Alan is from Ukraine.
entailment	Ron, Marie, Steve and Nancy are from Nepal, North Korea, United States of America and Saudi Arabia respectively.	Steve is from United States of America.
entailment	Jason, Nicole, Colin and Lucy are from Pakistan, Israel, Philippines and United Kingdom respectively.	Colin is from Philippines.
entailment	Stephen, Melissa, Charlie and Sharon are from France, Taiwan, Mexico and Netherlands respectively.	Charlie is from Mexico.
entailment	Edith, Bob, Dan and Claire are from India, Libya, Sweden and Iraq respectively.	Dan is from Sweden.
entailment	Judy, Diana, Stephen and Michael are from Thailand, China, Singapore and Mexico respectively.	Stephen is from Singapore.
entailment	Sophie, Florence, Barbara and Stephen are from Iran, North Korea, Japan and Ireland respectively.	Barbara is from Japan.
entailment	Alfred, Dick, Ralph and Diana are from United Arab Emirates, Iraq, Vietnam and Portugal respectively.	Ralph is from Vietnam.
entailment	Ann, Kate, Walter and Johnny are from Chile, Belgium, New Zealand and North Korea respectively.	Walter is from New Zealand.
entailment	Carol, William, Jeff and James are from Ghana, Bhutan, Libya and Germany respectively.	Jeff is from Libya.
entailment	Andrew, Matt, Elaine and Leslie are from Ghana, Pakistan, Fiji and Finland respectively.	Elaine is from Fiji.
entailment	Ryan, Jean, Donald and Victoria are from Philippines, South Korea, Haiti and Ireland respectively.	Donald is from Haiti.
entailment	Sally, Charlie, Ian and Ken are from Ukraine, Ireland, Maldives and Australia respectively.	Ian is from Maldives.
entailment	Lisa, Kelly, Nicole and Adam are from Iceland, Georgia, Singapore and Pakistan respectively.	Nicole is from Singapore.
entailment	Jane, Frances, James and Stephanie are from Austria, Laos, Australia and Ukraine respectively.	James is from Australia.
entailment	Katie, Paul, Emma and Hugh are from Hungary, New Zealand, Haiti and United States of America respectively.	Emma is from Haiti.
entailment	Jennifer, Susan, Roy and Harry are from France, Greece, Maldives and Vietnam respectively.	Roy is from Maldives.
entailment	Annie, Bruce, Catherine and Charlotte are from Hungary, Egypt, Malaysia and Italy respectively.	Catherine is from Malaysia.
entailment	Frederick, Roger, Grace and Sophie are from Ecuador, Sweden, Austria and Iraq respectively.	Grace is from Austria.
entailment	Bill, Rebecca, Alan and Rachel are from Libya, Iraq, Belarus and Australia respectively.	Alan is from Belarus.
entailment	Jane, Wendy, Larry and Betty are from Belarus, Iceland, Indonesia and Chile respectively.	Larry is from Indonesia.
entailment	Annie, Daniel, Kim and Heather are from Greece, Egypt, Zimbabwe and Iraq respectively.	Kim is from Zimbabwe.
entailment	Steven, William, Ryan and Maria are from Saudi Arabia, Malaysia, Brazil and Indonesia respectively.	Ryan is from Brazil.
entailment	Alison, Anna, Marilyn and Rachel are from Turkey, Canada, Nepal and France respectively.	Marilyn is from Nepal.
entailment	Andrea, Alex, Caroline and Ron are from Fiji, Ukraine, France and Azerbaijan respectively.	Caroline is from France.
entailment	Fiona, Adam, Jessica and Kathy are from Maldives, Australia, Japan and Argentina respectively.	Jessica is from Japan.
entailment	Jay, Barbara, Melissa and Rachel are from Chile, Haiti, Russia and Egypt respectively.	Melissa is from Russia.
entailment	Richard, Christine, Harriet and Greg are from Australia, Bangladesh, Switzerland and Libya respectively.	Harriet is from Switzerland.
entailment	Jay, Larry, Jeff and Diane are from Argentina, Switzerland, Mexico and Bangladesh respectively.	Jeff is from Mexico.
entailment	Joe, Francis, Edith and Dorothy are from Poland, China, Azerbaijan and Egypt respectively.	Edith is from Azerbaijan.
entailment	Colin, Carl, Jonathan and Evelyn are from Bangladesh, Iceland, Vietnam and Russia respectively.	Jonathan is from Vietnam.
entailment	Jim, Kathryn, Catherine and Ray are from Portugal, Canada, Fiji and Poland respectively.	Catherine is from Fiji.
entailment	Ben, Michael, Ryan and Ron are from Ireland, Egypt, Qatar and United Kingdom respectively.	Ryan is from Qatar.
entailment	Anne, Claire, Elaine and Dick are from Israel, Oman, United Kingdom and Saudi Arabia respectively.	Elaine is from United Kingdom.
entailment	Lawrence, Mark, Matt and Dave are from Belgium, Chile, Ecuador and Pakistan respectively.	Matt is from Ecuador.
entailment	Ashley, Martin, Colin and Jack are from Japan, South Korea, Saudi Arabia and Finland respectively.	Colin is from Saudi Arabia.
entailment	Alex, Patrick, Louis and Patricia are from Bangladesh, India, Poland and Iran respectively.	Louis is from Poland.
entailment	Julie, Elizabeth, Ashley and Suzanne are from Russia, United Arab Emirates, Afghanistan and United Kingdom respectively.	Ashley is from Afghanistan.
entailment	Mark, Alison, Robert and Benjamin are from China, Vietnam, Belgium and New Zealand respectively.	Robert is from Belgium.
entailment	Thomas, Amy, Claire and Frederick are from Portugal, Maldives, Denmark and Ghana respectively.	Claire is from Denmark.
entailment	Alex, Ed, Julie and Tim are from Italy, Brazil, South Korea and Iran respectively.	Julie is from South Korea.
entailment	Philip, Jim, Stephanie and Bob are from Fiji, Austria, Zimbabwe and Iceland respectively.	Stephanie is from Zimbabwe.
entailment	Daniel, Walter, Dick and Tim are from Ecuador, Malaysia, Netherlands and Ireland respectively.	Dick is from Netherlands.
entailment	Alexander, Edwin, Lynn and Patrick are from Iraq, Japan, Uruguay and Haiti respectively.	Lynn is from Uruguay.
entailment	Mary, Louis, Amy and Helen are from Azerbaijan, Greece, Belgium and Hungary respectively.	Amy is from Belgium.
entailment	Howard, David, Andrea and Harriet are from Indonesia, Netherlands, Italy and India respectively.	Andrea is from Italy.
entailment	Frederick, Alice, Alfred and Kathy are from Sweden, Fiji, Egypt and South Korea respectively.	Alfred is from Egypt.
entailment	Adam, Jerry, Claire and Grace are from Belarus, Germany, Bhutan and Switzerland respectively.	Claire is from Bhutan.
entailment	Alison, Edwin, Rachel and Anna are from Ghana, Saudi Arabia, Taiwan and Austria respectively.	Rachel is from Taiwan.
entailment	Elizabeth, Diana, Linda and Helen are from South Korea, Mexico, North Korea and Germany respectively.	Linda is from North Korea.
entailment	Ed, Ellen, Jack and Angela are from Portugal, Fiji, Laos and Belgium respectively.	Jack is from Laos.
entailment	Claire, Lauren, Alfred and Kenneth are from Colombia, Qatar, Australia and North Korea respectively.	Alfred is from Australia.
entailment	Ellen, Helen, Alice and Fiona are from Philippines, Portugal, Laos and Malaysia respectively.	Alice is from Laos.
entailment	Bob, Don, Tim and Kim are from China, Colombia, Turkey and Bangladesh respectively.	Tim is from Turkey.
entailment	Edith, Laura, Angela and Steve are from Canada, Fiji, Belarus and China respectively.	Angela is from Belarus.
entailment	Sara, Charlie, Paul and Ray are from South Korea, Haiti, Oman and Switzerland respectively.	Paul is from Oman.
entailment	Heather, George, Al and Frank are from Brazil, Maldives, Uruguay and Bangladesh respectively.	Al is from Uruguay.
entailment	Carol, Sharon, Pamela and Francis are from Mexico, Cuba, Portugal and Australia respectively.	Pamela is from Portugal.
entailment	Nick, Howard, Jason and Rachel are from Brazil, Oman, Portugal and Ukraine respectively.	Jason is from Portugal.
entailment	Karen, Nancy, Samuel and Ashley are from France, Nepal, Austria and Finland respectively.	Samuel is from Austria.
entailment	Don, Patricia, Mike and Kelly are from Russia, Ireland, New Zealand and Sweden respectively.	Mike is from New Zealand.
entailment	Anna, Louise, Alexander and Jay are from Chile, Colombia, Iran and Pakistan respectively.	Alexander is from Iran.
entailment	Jonathan, Lisa, Sandra and Katie are from Denmark, Pakistan, Thailand and Mexico respectively.	Sandra is from Thailand.
entailment	Joan, Steven, Christine and Jeff are from Georgia, France, Brazil and Ghana respectively.	Christine is from Brazil.
entailment	Ann, Jimmy, Jean and Paul are from Indonesia, Iran, Cuba and North Korea respectively.	Jean is from Cuba.
entailment	Melissa, Jessica, Frederick and Charles are from Bhutan, United Arab Emirates, Uruguay and Azerbaijan respectively.	Frederick is from Uruguay.
entailment	Fred, Charles, John and Victoria are from United Arab Emirates, Oman, Poland and Saudi Arabia respectively.	John is from Poland.
entailment	James, Edwin, Maria and Harriet are from North Korea, Malaysia, Saudi Arabia and Nepal respectively.	Maria is from Saudi Arabia.
entailment	Lynn, Sophie, Robert and William are from Cuba, Germany, Bangladesh and Philippines respectively.	Robert is from Bangladesh.
entailment	Evelyn, Francis, Andrea and Elaine are from Australia, Taiwan, Cuba and Finland respectively.	Andrea is from Cuba.
entailment	Paul, Alison, Albert and Amy are from Brazil, Taiwan, Canada and Austria respectively.	Albert is from Canada.
entailment	Dorothy, Barbara, Frederick and Ben are from Azerbaijan, Vietnam, Greece and Indonesia respectively.	Frederick is from Greece.
entailment	Hugh, Grace, Alexander and Elaine are from Ghana, Poland, Laos and Belgium respectively.	Alexander is from Laos.
entailment	Sam, George, Kathryn and Tony are from Russia, United Kingdom, Australia and Vietnam respectively.	Kathryn is from Australia.
entailment	Matthew, Bob, Ken and Ron are from Hungary, Greece, Ireland and Belarus respectively.	Ken is from Ireland.
entailment	Laura, Eric, Howard and Angela are from Brazil, Italy, Singapore and Bangladesh respectively.	Howard is from Singapore.
entailment	Joe, Sharon, Rose and Nicole are from Iraq, Saudi Arabia, Netherlands and Iran respectively.	Rose is from Netherlands.
entailment	Jay, Donna, Anna and Joe are from China, Nepal, Mexico and Vietnam respectively.	Anna is from Mexico.
entailment	Ann, Harold, Jane and Sam are from Italy, Nepal, Canada and Japan respectively.	Jane is from Canada.
entailment	Ben, Linda, Virginia and Andrea are from France, North Korea, Indonesia and Canada respectively.	Virginia is from Indonesia.
entailment	Diana, Elizabeth, Keith and Jonathan are from Turkey, China, Iraq and Belarus respectively.	Keith is from Iraq.
entailment	Lauren, Christine, Bill and Evelyn are from United Arab Emirates, Taiwan, Bhutan and Thailand respectively.	Bill is from Bhutan.
entailment	Samuel, Stephen, Patricia and Pamela are from Haiti, Iraq, Maldives and Colombia respectively.	Patricia is from Maldives.
entailment	Margaret, Daniel, Stephen and Marilyn are from Azerbaijan, Philippines, Chile and Iran respectively.	Stephen is from Chile.
entailment	Larry, Ken, Walter and Michelle are from Russia, Belarus, Finland and Azerbaijan respectively.	Walter is from Finland.
entailment	Ann, Robert, Bill and Janet are from Bhutan, Ghana, Chile and United Arab Emirates respectively.	Bill is from Chile.
entailment	Philip, Ralph, Kathleen and Tony are from Laos, India, Russia and Australia respectively.	Kathleen is from Russia.
entailment	Jennifer, Tony, Rachel and Philip are from India, Finland, Belgium and Israel respectively.	Rachel is from Belgium.
entailment	Nicole, Karen, Chris and Leslie are from Australia, Fiji, North Korea and Japan respectively.	Chris is from North Korea.
entailment	Lisa, Amy, Adam and Alison are from Bangladesh, Ghana, Indonesia and United Kingdom respectively.	Adam is from Indonesia.
entailment	Lynn, Janet, Jimmy and Tony are from Argentina, Denmark, Turkey and Sweden respectively.	Jimmy is from Turkey.
entailment	Frank, Rebecca, Ann and Margaret are from Portugal, Uruguay, Azerbaijan and Colombia respectively.	Ann is from Azerbaijan.
entailment	Susan, Bobby, Lauren and Alexandra are from Zimbabwe, Taiwan, United Arab Emirates and Nepal respectively.	Lauren is from United Arab Emirates.
entailment	Jack, John, Bobby and James are from Bhutan, Laos, Turkey and South Korea respectively.	Bobby is from Turkey.
entailment	Jim, Jerry, Hugh and Mary are from France, South Korea, Brazil and United Kingdom respectively.	Hugh is from Brazil.
entailment	Arthur, Jay, Louis and Robin are from Austria, United Kingdom, Switzerland and Maldives respectively.	Louis is from Switzerland.
entailment	Kelly, Grace, Roger and Matthew are from Poland, Taiwan, Maldives and Ireland respectively.	Roger is from Maldives.
entailment	Dorothy, Jonathan, Eric and Karen are from South Korea, Italy, Mexico and Haiti respectively.	Eric is from Mexico.
entailment	Ken, Christopher, Bill and Diana are from Switzerland, Cuba, Israel and Ghana respectively.	Bill is from Israel.
entailment	Ron, Diana, Jason and Susan are from Singapore, Ghana, Ecuador and Bhutan respectively.	Jason is from Ecuador.
entailment	Alexandra, Emma, Colin and Alice are from Switzerland, Hungary, Qatar and Ireland respectively.	Colin is from Qatar.
entailment	Joe, Sam, Ryan and Kate are from Bhutan, Iraq, Japan and South Korea respectively.	Ryan is from Japan.
entailment	Hugh, Melissa, Philip and Julia are from Japan, Haiti, Austria and Turkey respectively.	Philip is from Austria.
entailment	Mark, Katie, Sue and Lisa are from Ecuador, Qatar, Mexico and Malaysia respectively.	Sue is from Mexico.
entailment	Melissa, Alan, Lawrence and Peter are from Pakistan, Taiwan, Mexico and Austria respectively.	Lawrence is from Mexico.
entailment	Louis, Jimmy, Ray and Melissa are from New Zealand, Austria, Cuba and Haiti respectively.	Ray is from Cuba.
entailment	Steven, Frank, Louis and Eric are from Ukraine, North Korea, Nepal and Fiji respectively.	Louis is from Nepal.
entailment	John, Nicole, Andrew and Jeff are from United States of America, Fiji, Poland and Laos respectively.	Andrew is from Poland.
entailment	Tom, Edward, Jim and Christopher are from Portugal, Afghanistan, South Korea and Nepal respectively.	Jim is from South Korea.
entailment	Sarah, James, Peter and David are from China, Netherlands, Germany and Nepal respectively.	Peter is from Germany.
entailment	Kate, Lucy, Alexandra and Suzanne are from United Arab Emirates, Germany, Finland and Fiji respectively.	Alexandra is from Finland.
entailment	Katie, Robert, Samuel and Eleanor are from Thailand, North Korea, Sweden and Denmark respectively.	Samuel is from Sweden.
entailment	Heather, Joe, Amy and Howard are from Colombia, Brazil, Libya and Saudi Arabia respectively.	Amy is from Libya.
entailment	Tony, Katie, Nicole and Judith are from Maldives, Nepal, Israel and Turkey respectively.	Nicole is from Israel.
entailment	Chris, Martha, Daniel and Walter are from United States of America, Belgium, France and Japan respectively.	Daniel is from France.
entailment	Ashley, Lynn, Donna and Katherine are from United States of America, Greece, Indonesia and Hungary respectively.	Donna is from Indonesia.
entailment	Stephen, Alfred, David and Jessica are from Hungary, Brazil, Bhutan and Fiji respectively.	David is from Bhutan.
entailment	Suzanne, Ian, Julia and Mary are from Vietnam, Portugal, Belgium and China respectively.	Julia is from Belgium.
entailment	William, Louis, Donna and Diane are from Bangladesh, Thailand, Zimbabwe and South Korea respectively.	Donna is from Zimbabwe.
entailment	Harry, Jerry, Catherine and Charles are from Chile, Nepal, Qatar and Oman respectively.	Catherine is from Qatar.
entailment	Jerry, Hugh, Rachel and Ben are from Mexico, Georgia, Australia and Poland respectively.	Rachel is from Australia.
entailment	Julia, Charlotte, Walter and Paul are from Italy, Oman, Russia and Japan respectively.	Walter is from Russia.
entailment	Andrew, Leslie, Philip and Rachel are from United Kingdom, Iraq, Egypt and Greece respectively.	Philip is from Egypt.
entailment	Thomas, Simon, Janet and Gary are from Oman, Georgia, New Zealand and Bhutan respectively.	Janet is from New Zealand.
entailment	Anna, Philip, Ray and Patrick are from Russia, United Kingdom, Philippines and Denmark respectively.	Ray is from Philippines.
entailment	Jimmy, Jason, Frances and Sandra are from Saudi Arabia, Turkey, Japan and Cuba respectively.	Frances is from Japan.
entailment	Francis, Alice, Arthur and Catherine are from Hungary, Qatar, Finland and Cuba respectively.	Arthur is from Finland.
entailment	Emily, Patricia, Ellen and Frederick are from Singapore, Austria, Netherlands and Haiti respectively.	Ellen is from Netherlands.
entailment	Ed, Virginia, Donna and Al are from Sweden, Iceland, Russia and Maldives respectively.	Donna is from Russia.
entailment	Robert, Carol, David and Jack are from Italy, Belarus, Libya and Bangladesh respectively.	David is from Libya.
entailment	Evelyn, Cynthia, Gary and Joe are from United Arab Emirates, Belarus, Indonesia and United States of America respectively.	Gary is from Indonesia.
entailment	Steven, Jay, Scott and Eric are from Bhutan, North Korea, Maldives and Egypt respectively.	Scott is from Maldives.
