entailment	Steven, Ken, Betty and Tony are from Israel, Indonesia, United Arab Emirates and Turkey respectively.	Betty is from United Arab Emirates.
entailment	Bobby, Paul, Joe and Eleanor are from Ghana, Finland, Portugal and Bangladesh respectively.	Joe is from Portugal.
entailment	Alex, Heather, James and Barbara are from Georgia, Ecuador, Maldives and Finland respectively.	James is from Maldives.
entailment	Julia, Charlotte, Carol and Deborah are from Belarus, Colombia, Malaysia and Finland respectively.	Carol is from Malaysia.
entailment	George, Ellen, Tim and Benjamin are from Iran, Japan, Bhutan and India respectively.	Tim is from Bhutan.
entailment	Alan, Evelyn, Billy and Dave are from Haiti, Denmark, Uruguay and Mexico respectively.	Billy is from Uruguay.
entailment	Louise, Lawrence, Keith and Arthur are from China, Azerbaijan, Austria and Chile respectively.	Keith is from Austria.
entailment	Jack, Fred, Jay and Cynthia are from Mexico, Portugal, Georgia and New Zealand respectively.	Jay is from Georgia.
entailment	Kathryn, Bobby, Dorothy and Tom are from Vietnam, Portugal, Austria and Switzerland respectively.	Dorothy is from Austria.
entailment	Billy, Maria, Anthony and Harry are from India, Singapore, Chile and Sweden respectively.	Anthony is from Chile.
entailment	Peter, Rebecca, Karen and Robert are from South Korea, Colombia, Azerbaijan and Hungary respectively.	Karen is from Azerbaijan.
entailment	Mike, Martin, Dick and Virginia are from Singapore, United States of America, Egypt and Indonesia respectively.	Dick is from Egypt.
entailment	Kathleen, John, Emma and Bobby are from Iraq, Argentina, Netherlands and Israel respectively.	Emma is from Netherlands.
entailment	Emily, Ashley, Ron and Andrew are from Iran, Libya, New Zealand and Indonesia respectively.	Ron is from New Zealand.
entailment	Suzanne, Katherine, Jean and Sara are from Georgia, Zimbabwe, North Korea and Italy respectively.	Jean is from North Korea.
entailment	Marilyn, Edward, Scott and Margaret are from United Kingdom, Hungary, Mexico and Greece respectively.	Scott is from Mexico.
entailment	Lucy, Bob, Daniel and Sharon are from Fiji, Iraq, Brazil and Australia respectively.	Daniel is from Brazil.
entailment	Julie, Laura, Cynthia and Steve are from Indonesia, Iran, Singapore and Greece respectively.	Cynthia is from Singapore.
entailment	Ellen, Sue, Jennifer and Christine are from Russia, Maldives, Australia and Libya respectively.	Jennifer is from Australia.
entailment	Gary, Judith, Lawrence and Dick are from Taiwan, South Korea, Russia and Georgia respectively.	Lawrence is from Russia.
entailment	Deborah, Kathleen, Joseph and Elizabeth are from Sweden, Finland, Malaysia and Switzerland respectively.	Joseph is from Malaysia.
entailment	Julia, Daniel, Richard and Frank are from Iran, Germany, United Arab Emirates and Azerbaijan respectively.	Richard is from United Arab Emirates.
entailment	Claire, Christopher, Martha and Ron are from China, Argentina, France and Ecuador respectively.	Martha is from France.
entailment	Matt, Gary, Lisa and Billy are from Cuba, Iran, Vietnam and Bhutan respectively.	Lisa is from Vietnam.
entailment	Jean, Virginia, Sandra and Anna are from Saudi Arabia, Iraq, Afghanistan and Israel respectively.	Sandra is from Afghanistan.
entailment	Sally, Chris, Kathleen and Peter are from Finland, Saudi Arabia, Ecuador and India respectively.	Kathleen is from Ecuador.
entailment	Marie, Martha, Janet and Matthew are from Vietnam, Georgia, Laos and Chile respectively.	Janet is from Laos.
entailment	Mike, Sharon, Emma and Joan are from Hungary, Israel, Iceland and Ecuador respectively.	Emma is from Iceland.
entailment	Anne, Nancy, Mark and George are from Denmark, Germany, Maldives and Haiti respectively.	Mark is from Maldives.
entailment	Nancy, Alex, Al and George are from Hungary, France, Israel and Ghana respectively.	Al is from Israel.
entailment	Jim, Angela, Joan and Laura are from United States of America, Thailand, Oman and North Korea respectively.	Joan is from Oman.
entailment	Tim, Pamela, Julie and Frank are from Ghana, South Korea, Portugal and Afghanistan respectively.	Julie is from Portugal.
entailment	Nicole, Emma, Judy and Roy are from Azerbaijan, Portugal, Brazil and Uruguay respectively.	Judy is from Brazil.
entailment	Carolyn, Melissa, Alice and Kathleen are from India, Portugal, Hungary and Zimbabwe respectively.	Alice is from Hungary.
entailment	Matthew, Christine, Brian and Nick are from North Korea, Bangladesh, Canada and Hungary respectively.	Brian is from Canada.
entailment	Simon, Roy, Virginia and Jean are from Ecuador, Libya, Colombia and Thailand respectively.	Virginia is from Colombia.
entailment	Brian, Judy, Donald and Michael are from Thailand, China, Germany and United Kingdom respectively.	Donald is from Germany.
entailment	Alexander, Samuel, Philip and Dan are from Italy, Belarus, Denmark and Hungary respectively.	Philip is from Denmark.
entailment	Anna, Jason, Robin and Grace are from Zimbabwe, Canada, Pakistan and North Korea respectively.	Robin is from Pakistan.
entailment	David, Bill, Joan and Karen are from Thailand, Switzerland, Netherlands and Afghanistan respectively.	Joan is from Netherlands.
entailment	Roger, Peter, Steve and Stephen are from Vietnam, Uruguay, Nepal and Australia respectively.	Steve is from Nepal.
entailment	Kate, Albert, Rose and Ellen are from Canada, Chile, Afghanistan and Nepal respectively.	Rose is from Afghanistan.
entailment	Ed, Christine, Amy and Jill are from Uruguay, United Arab Emirates, Fiji and North Korea respectively.	Amy is from Fiji.
entailment	Suzanne, Ashley, Lucy and Martin are from Brazil, Fiji, South Korea and Georgia respectively.	Lucy is from South Korea.
entailment	Michael, Robert, Walter and Rebecca are from Australia, Japan, China and Philippines respectively.	Walter is from China.
entailment	Don, Rachel, Helen and Frances are from Finland, United Arab Emirates, Taiwan and Georgia respectively.	Helen is from Taiwan.
entailment	Ben, Kathy, Sam and Colin are from Mexico, Afghanistan, Poland and Netherlands respectively.	Sam is from Poland.
entailment	Betty, Ron, Benjamin and Bruce are from United States of America, Nepal, Bangladesh and Saudi Arabia respectively.	Benjamin is from Bangladesh.
entailment	Edward, Eleanor, David and Alison are from Denmark, Iran, Austria and Greece respectively.	David is from Austria.
entailment	Frederick, Caroline, Philip and Lucy are from Germany, Brazil, Malaysia and Nepal respectively.	Philip is from Malaysia.
entailment	Roger, Edwin, Jonathan and Bobby are from Indonesia, Ukraine, Haiti and Israel respectively.	Jonathan is from Haiti.
entailment	Albert, Colin, Bruce and Don are from Iraq, Malaysia, Libya and Oman respectively.	Bruce is from Libya.
entailment	Jim, Margaret, Katie and Michelle are from United Kingdom, Ireland, Philippines and Zimbabwe respectively.	Katie is from Philippines.
entailment	Jimmy, Hugh, Ralph and Katherine are from Saudi Arabia, Portugal, Israel and Hungary respectively.	Ralph is from Israel.
entailment	Melissa, Sarah, Henry and Jessica are from Switzerland, Oman, France and Haiti respectively.	Henry is from France.
entailment	Mike, Dorothy, Jay and Suzanne are from Fiji, Ghana, Japan and Colombia respectively.	Jay is from Japan.
entailment	Bruce, Kelly, Heather and Edward are from Japan, Argentina, North Korea and Philippines respectively.	Heather is from North Korea.
entailment	Emily, Jessica, Tony and Diane are from Oman, Mexico, Maldives and Iceland respectively.	Tony is from Maldives.
entailment	Billy, Bruce, Ron and Alex are from Thailand, France, Laos and North Korea respectively.	Ron is from Laos.
entailment	Amanda, Lauren, Joseph and Ann are from Belarus, Chile, Ireland and Oman respectively.	Joseph is from Ireland.
entailment	Benjamin, Joan, Mary and Diana are from Iran, Saudi Arabia, Fiji and Poland respectively.	Mary is from Fiji.
entailment	Adam, Bob, Tom and Frank are from Turkey, Bhutan, France and Belarus respectively.	Tom is from France.
entailment	Arthur, Sandra, Ruth and Martin are from Colombia, United Arab Emirates, Denmark and North Korea respectively.	Ruth is from Denmark.
entailment	Jennifer, Frederick, Donald and Tony are from Portugal, Libya, Netherlands and Russia respectively.	Donald is from Netherlands.
entailment	Alfred, Sarah, Albert and Chris are from Saudi Arabia, Thailand, Italy and Singapore respectively.	Albert is from Italy.
entailment	Melissa, Robert, Jeff and George are from Japan, Switzerland, Singapore and Fiji respectively.	Jeff is from Singapore.
entailment	Johnny, Frances, Tom and Ruth are from United Kingdom, Brazil, Zimbabwe and Argentina respectively.	Tom is from Zimbabwe.
entailment	Katie, Jessica, Susan and Mary are from Georgia, Libya, Ghana and Poland respectively.	Susan is from Ghana.
entailment	Lawrence, Karen, Ian and William are from United Arab Emirates, Saudi Arabia, Japan and Oman respectively.	Ian is from Japan.
entailment	Robin, Deborah, Keith and Matthew are from Uruguay, Russia, Finland and Argentina respectively.	Keith is from Finland.
entailment	Fiona, Stephanie, Sally and Bruce are from Israel, Ireland, Iraq and Azerbaijan respectively.	Sally is from Iraq.
entailment	Louis, Charles, Dave and Sue are from United States of America, Pakistan, Afghanistan and Philippines respectively.	Dave is from Afghanistan.
entailment	Barbara, John, Karen and Virginia are from New Zealand, India, Chile and Cuba respectively.	Karen is from Chile.
entailment	Michelle, Jay, Marie and Ed are from New Zealand, Hungary, Austria and Iraq respectively.	Marie is from Austria.
entailment	Sarah, Joan, Dorothy and Stephanie are from Poland, Pakistan, Thailand and Uruguay respectively.	Dorothy is from Thailand.
entailment	Patricia, Carol, Rachel and Anne are from Israel, Netherlands, China and Bangladesh respectively.	Rachel is from China.
entailment	Benjamin, Francis, Lawrence and Sarah are from Fiji, Iran, Turkey and Iraq respectively.	Lawrence is from Turkey.
entailment	Ryan, Dan, Kelly and Christine are from Saudi Arabia, Cuba, Israel and Malaysia respectively.	Kelly is from Israel.
entailment	Pamela, Louise, Andrew and Jeff are from Italy, Germany, Fiji and Uruguay respectively.	Andrew is from Fiji.
entailment	Charlotte, Cynthia, Dan and Alexander are from Zimbabwe, Italy, Maldives and Colombia respectively.	Dan is from Maldives.
entailment	Sam, Elizabeth, Betty and Donald are from Singapore, Brazil, Argentina and Russia respectively.	Betty is from Argentina.
entailment	Patricia, Charlotte, Harry and Stephen are from Greece, Iraq, United Arab Emirates and Italy respectively.	Harry is from United Arab Emirates.
entailment	Don, Lawrence, Mary and Judy are from Indonesia, Georgia, Singapore and Chile respectively.	Mary is from Singapore.
entailment	Ben, Kim, Carolyn and Marilyn are from France, Egypt, United States of America and Iraq respectively.	Carolyn is from United States of America.
entailment	William, Ann, Edwin and Robin are from Poland, Portugal, Canada and France respectively.	Edwin is from Canada.
entailment	William, Kathy, Alfred and Barbara are from Belgium, New Zealand, France and Austria respectively.	Alfred is from France.
entailment	Harold, Alice, Ed and Alex are from Saudi Arabia, Finland, North Korea and Germany respectively.	Ed is from North Korea.
entailment	Amanda, Ashley, Peter and Samuel are from Ukraine, Germany, Switzerland and Colombia respectively.	Peter is from Switzerland.
entailment	William, Elaine, George and Sara are from Egypt, Ireland, Germany and Italy respectively.	George is from Germany.
entailment	Heather, Kelly, Elizabeth and David are from Haiti, New Zealand, Bangladesh and Maldives respectively.	Elizabeth is from Bangladesh.
entailment	Keith, Florence, Jean and Steven are from Sweden, Iceland, Singapore and United Arab Emirates respectively.	Jean is from Singapore.
entailment	Alice, Christine, Lawrence and Julie are from South Korea, India, Ireland and Poland respectively.	Lawrence is from Ireland.
entailment	Joseph, Samuel, Rachel and Francis are from Haiti, Sweden, Australia and Finland respectively.	Rachel is from Australia.
entailment	Dave, Charlotte, Dick and Samuel are from Argentina, Libya, Bhutan and Canada respectively.	Dick is from Bhutan.
entailment	Lucy, Al, Elizabeth and Margaret are from Turkey, Indonesia, Ukraine and Belarus respectively.	Elizabeth is from Ukraine.
entailment	Kim, Amy, George and Virginia are from Nepal, Egypt, Cuba and India respectively.	George is from Cuba.
entailment	Gary, Bruce, Alexandra and Leslie are from Japan, Chile, Oman and Turkey respectively.	Alexandra is from Oman.
entailment	Roger, Claire, Jim and Marilyn are from North Korea, Uruguay, Philippines and Zimbabwe respectively.	Jim is from Philippines.
entailment	Bobby, Kathleen, Lucy and Martin are from Bangladesh, Thailand, Nepal and Qatar respectively.	Lucy is from Nepal.
entailment	Ruth, Harry, Arthur and Dorothy are from Pakistan, Bangladesh, Argentina and Israel respectively.	Arthur is from Argentina.
entailment	Julia, Alfred, Lisa and Caroline are from Iraq, Belarus, Afghanistan and Georgia respectively.	Lisa is from Afghanistan.
entailment	Harriet, Alexandra, Jean and Don are from Georgia, France, Laos and Qatar respectively.	Jean is from Laos.
entailment	Marilyn, Kelly, Bill and Ruth are from Switzerland, Hungary, Mexico and Germany respectively.	Bill is from Mexico.
entailment	Dave, Joseph, Emily and Nancy are from Maldives, Mexico, Saudi Arabia and Haiti respectively.	Emily is from Saudi Arabia.
entailment	Sam, Wendy, Grace and Don are from Hungary, Ghana, Russia and Canada respectively.	Grace is from Russia.
entailment	Kim, Deborah, Sharon and Robin are from France, Azerbaijan, United States of America and United Arab Emirates respectively.	Sharon is from United States of America.
entailment	Nicole, Suzanne, Harriet and Eleanor are from Greece, Japan, Canada and Zimbabwe respectively.	Harriet is from Canada.
entailment	Stephanie, Christopher, Jeff and Wendy are from Canada, Ecuador, North Korea and Greece respectively.	Jeff is from North Korea.
entailment	Carl, Chris, Stephanie and Wendy are from Vietnam, Chile, Switzerland and United Arab Emirates respectively.	Stephanie is from Switzerland.
entailment	Donna, Sue, Lucy and Joan are from Cuba, Vietnam, Netherlands and Hungary respectively.	Lucy is from Netherlands.
entailment	Leslie, Jay, Kathleen and Elizabeth are from Egypt, Iran, United Kingdom and Libya respectively.	Kathleen is from United Kingdom.
entailment	Michael, Walter, Ed and Diane are from Poland, Zimbabwe, Finland and Chile respectively.	Ed is from Finland.
entailment	Matthew, Katherine, Judy and Ron are from Saudi Arabia, Bhutan, Hungary and Oman respectively.	Judy is from Hungary.
entailment	Joseph, Sally, Kathy and Tom are from Israel, Egypt, India and Netherlands respectively.	Kathy is from India.
entailment	Annie, Thomas, Pamela and Victoria are from Iceland, Belgium, Belarus and Uruguay respectively.	Pamela is from Belarus.
entailment	Simon, Jeff, Elaine and Robert are from United States of America, Laos, Sweden and United Arab Emirates respectively.	Elaine is from Sweden.
entailment	Scott, Kevin, Roy and Katie are from Netherlands, Nepal, Bangladesh and Turkey respectively.	Roy is from Bangladesh.
entailment	Barbara, Ralph, Ryan and Sara are from Ghana, Finland, Egypt and Malaysia respectively.	Ryan is from Egypt.
entailment	Charlotte, Benjamin, Charlie and Howard are from Zimbabwe, Haiti, Cuba and Germany respectively.	Charlie is from Cuba.
entailment	Hugh, Roger, Kevin and Dan are from Portugal, Qatar, Uruguay and Iran respectively.	Kevin is from Uruguay.
entailment	Catherine, Ron, Ashley and Ralph are from United Arab Emirates, Poland, France and Saudi Arabia respectively.	Ashley is from France.
entailment	Marie, Caroline, Betty and Diane are from Qatar, Chile, Malaysia and United Arab Emirates respectively.	Betty is from Malaysia.
entailment	Katherine, Lawrence, Francis and Florence are from Singapore, Maldives, Belarus and Turkey respectively.	Francis is from Belarus.
entailment	Tim, Evelyn, Kathryn and Barbara are from Philippines, Finland, Singapore and Taiwan respectively.	Kathryn is from Singapore.
entailment	Marilyn, Virginia, Pamela and Paul are from Nepal, Chile, Bhutan and Poland respectively.	Pamela is from Bhutan.
entailment	Edward, Edith, Mark and Julia are from Egypt, India, North Korea and Zimbabwe respectively.	Mark is from North Korea.
entailment	Elizabeth, Louise, Virginia and Sarah are from Indonesia, Finland, Nepal and Switzerland respectively.	Virginia is from Nepal.
entailment	Amy, Gary, Michelle and Jack are from Netherlands, Iceland, Laos and Italy respectively.	Michelle is from Laos.
entailment	Edwin, Jonathan, Martha and Eleanor are from Belgium, Nepal, Russia and Poland respectively.	Martha is from Russia.
entailment	Lawrence, Dave, Anthony and Jane are from Taiwan, Mexico, Singapore and Australia respectively.	Anthony is from Singapore.
entailment	Charles, Alice, Claire and Larry are from Greece, Saudi Arabia, Bangladesh and Qatar respectively.	Claire is from Bangladesh.
entailment	Grace, Dan, Carl and Martin are from Russia, United States of America, Denmark and Qatar respectively.	Carl is from Denmark.
entailment	Kim, Anne, Tom and Jonathan are from Haiti, Ghana, Germany and Zimbabwe respectively.	Tom is from Germany.
entailment	Deborah, Alexandra, Janet and Nicole are from Mexico, United States of America, South Korea and Malaysia respectively.	Janet is from South Korea.
entailment	Melissa, Frederick, Tim and Donald are from Saudi Arabia, Indonesia, Bangladesh and Belgium respectively.	Tim is from Bangladesh.
entailment	Kathy, Arthur, Alan and Jeff are from Australia, Italy, Oman and Greece respectively.	Alan is from Oman.
entailment	Heather, Sandra, Mark and Lawrence are from Oman, Azerbaijan, Ukraine and Canada respectively.	Mark is from Ukraine.
entailment	Alexander, Jim, Mike and Melissa are from Canada, Ukraine, Iran and Indonesia respectively.	Mike is from Iran.
entailment	Ian, Keith, Karen and Rachel are from Uruguay, France, Denmark and Egypt respectively.	Karen is from Denmark.
entailment	Alice, Colin, Nicole and Richard are from United Arab Emirates, Egypt, Chile and Turkey respectively.	Nicole is from Chile.
entailment	Robin, Don, Christine and Pamela are from Saudi Arabia, Brazil, Iran and Argentina respectively.	Christine is from Iran.
entailment	Sara, Anthony, Alfred and Roger are from Sweden, China, Malaysia and Denmark respectively.	Alfred is from Malaysia.
entailment	Alexander, Rose, Bruce and Adam are from Bangladesh, Bhutan, Canada and Poland respectively.	Bruce is from Canada.
entailment	Albert, Carl, Jennifer and Dick are from Japan, Colombia, Zimbabwe and Ghana respectively.	Jennifer is from Zimbabwe.
entailment	Hugh, Ellen, Emma and Helen are from Ghana, Japan, Cuba and Netherlands respectively.	Emma is from Cuba.
entailment	Harry, Kevin, Kelly and Dan are from Greece, Denmark, United States of America and Ukraine respectively.	Kelly is from United States of America.
entailment	Frank, Steve, Jennifer and Sharon are from South Korea, Austria, Ghana and Colombia respectively.	Jennifer is from Ghana.
entailment	Michelle, Chris, Louise and Barbara are from New Zealand, Uruguay, Bangladesh and Afghanistan respectively.	Louise is from Bangladesh.
entailment	Sara, Thomas, Dorothy and Bobby are from United Kingdom, Canada, United Arab Emirates and Sweden respectively.	Dorothy is from United Arab Emirates.
entailment	Dick, David, Alexandra and Deborah are from Belarus, United Kingdom, Switzerland and Taiwan respectively.	Alexandra is from Switzerland.
entailment	Victoria, Donna, Ian and Bill are from Ireland, Argentina, France and Denmark respectively.	Ian is from France.
entailment	Edward, Scott, Leslie and Ralph are from Vietnam, Ghana, Zimbabwe and Azerbaijan respectively.	Leslie is from Zimbabwe.
entailment	Annie, Marie, Caroline and Ashley are from Germany, Philippines, Thailand and Israel respectively.	Caroline is from Thailand.
entailment	Diane, Patrick, Samuel and Pamela are from Israel, Thailand, Vietnam and China respectively.	Samuel is from Vietnam.
entailment	Nick, Carol, Walter and Christopher are from Uruguay, Singapore, Mexico and Netherlands respectively.	Walter is from Mexico.
entailment	Bruce, Mark, Betty and Charlotte are from North Korea, Afghanistan, New Zealand and Saudi Arabia respectively.	Betty is from New Zealand.
entailment	Daniel, Ryan, Charlotte and Deborah are from Chile, China, North Korea and Switzerland respectively.	Charlotte is from North Korea.
entailment	Jennifer, Walter, Marie and Andrea are from Chile, Colombia, Thailand and Oman respectively.	Marie is from Thailand.
entailment	Ron, Florence, Henry and Andrea are from Bhutan, India, Hungary and Japan respectively.	Henry is from Hungary.
entailment	Don, Sandra, Donald and Harold are from Finland, Bhutan, Ghana and Taiwan respectively.	Donald is from Ghana.
entailment	Lucy, Alexandra, Kathleen and Victoria are from Greece, Austria, Colombia and Malaysia respectively.	Kathleen is from Colombia.
entailment	Donna, Thomas, Robert and Sam are from Cuba, Mexico, Turkey and Georgia respectively.	Robert is from Turkey.
entailment	Adam, Ken, Emily and Jim are from Ireland, Vietnam, Germany and Ukraine respectively.	Emily is from Germany.
entailment	Stephen, Ed, Don and Dick are from Iraq, Bangladesh, Denmark and Iran respectively.	Don is from Denmark.
entailment	Samuel, Ben, Alice and Kate are from Brazil, Bangladesh, Zimbabwe and Pakistan respectively.	Alice is from Zimbabwe.
entailment	Katie, Cynthia, Ed and Alison are from Belgium, Georgia, Canada and Zimbabwe respectively.	Ed is from Canada.
entailment	Jeff, Chris, Al and David are from Brazil, Poland, New Zealand and Iceland respectively.	Al is from New Zealand.
entailment	Donald, Kathy, Karen and Julia are from Ireland, Russia, Ukraine and Saudi Arabia respectively.	Karen is from Ukraine.
entailment	Suzanne, Frances, Henry and Bob are from China, Ireland, United States of America and Brazil respectively.	Henry is from United States of America.
entailment	Mary, Emma, Linda and Joseph are from India, Japan, Philippines and Russia respectively.	Linda is from Philippines.
entailment	Walter, Robin, Jean and Sue are from Netherlands, France, Canada and Ecuador respectively.	Jean is from Canada.
entailment	Wendy, Eleanor, Emily and Diane are from Qatar, New Zealand, Fiji and Oman respectively.	Emily is from Fiji.
entailment	Joan, Donald, Anna and James are from Colombia, Belarus, Bhutan and Hungary respectively.	Anna is from Bhutan.
entailment	Kevin, Frank, Ryan and Fred are from France, Uruguay, Haiti and Switzerland respectively.	Ryan is from Haiti.
entailment	Jerry, Sarah, Edward and Deborah are from Bhutan, Indonesia, Ukraine and Thailand respectively.	Edward is from Ukraine.
entailment	Angela, Albert, Julie and Cynthia are from Saudi Arabia, Egypt, Ecuador and Zimbabwe respectively.	Julie is from Ecuador.
entailment	Louise, Marilyn, Keith and Fiona are from Egypt, Portugal, Taiwan and Iraq respectively.	Keith is from Taiwan.
entailment	Kelly, Edith, Maria and Carl are from Indonesia, North Korea, Libya and Brazil respectively.	Maria is from Libya.
entailment	Pamela, Julia, Sally and Ralph are from United Arab Emirates, Colombia, Ghana and Ukraine respectively.	Sally is from Ghana.
entailment	Christopher, Kim, Jill and Philip are from Austria, Denmark, United States of America and Bhutan respectively.	Jill is from United States of America.
entailment	Dorothy, Don, Ben and Katie are from Brazil, Denmark, United Arab Emirates and Georgia respectively.	Ben is from United Arab Emirates.
entailment	Harold, George, Carl and Jack are from Brazil, Portugal, Oman and Georgia respectively.	Carl is from Oman.
entailment	Mary, Julie, James and Charlotte are from Philippines, South Korea, Afghanistan and Pakistan respectively.	James is from Afghanistan.
entailment	Kate, Leslie, Matthew and Stephen are from Chile, Greece, Finland and Vietnam respectively.	Matthew is from Finland.
entailment	Howard, Lisa, Lynn and Michael are from Fiji, Thailand, Taiwan and Laos respectively.	Lynn is from Taiwan.
entailment	Carl, Linda, Tom and Marilyn are from Finland, Russia, Greece and China respectively.	Tom is from Greece.
entailment	Patricia, Roy, Ken and Jill are from Russia, South Korea, Qatar and Maldives respectively.	Ken is from Qatar.
entailment	Sophie, Emily, Larry and Kate are from Georgia, Uruguay, Finland and Austria respectively.	Larry is from Finland.
entailment	Frederick, Kathy, Jerry and Edward are from United States of America, Germany, Bhutan and Afghanistan respectively.	Jerry is from Bhutan.
entailment	Roger, Deborah, Lucy and Billy are from France, Iceland, Belgium and Singapore respectively.	Lucy is from Belgium.
entailment	Carol, Fiona, Janet and Ruth are from Bangladesh, United Arab Emirates, Georgia and Austria respectively.	Janet is from Georgia.
entailment	Betty, Albert, Peter and Harold are from Nepal, Colombia, Belgium and United Kingdom respectively.	Peter is from Belgium.
entailment	Ben, Larry, Fiona and Simon are from Bangladesh, Belgium, Ukraine and Saudi Arabia respectively.	Fiona is from Ukraine.
entailment	Jim, Amy, Sharon and Helen are from Japan, Germany, Bangladesh and Iraq respectively.	Sharon is from Bangladesh.
entailment	Eleanor, Claire, Dave and Ann are from Chile, Nepal, Uruguay and Israel respectively.	Dave is from Uruguay.
entailment	Evelyn, John, Scott and Wendy are from Thailand, Russia, Ecuador and China respectively.	Scott is from Ecuador.
entailment	Lynn, Walter, Ben and Lucy are from Saudi Arabia, Portugal, Zimbabwe and Japan respectively.	Ben is from Zimbabwe.
entailment	Fred, Amy, Melissa and Ray are from Ireland, Australia, Belgium and Switzerland respectively.	Melissa is from Belgium.
