entailment	Martin, Dave, Marie and Karen are from China, Argentina, Fiji and Denmark respectively.	Marie is from Fiji.
entailment	Jessica, Ray, Peter and Bill are from Iran, Netherlands, Singapore and Pakistan respectively.	Peter is from Singapore.
entailment	Sophie, Bobby, John and Bob are from Ecuador, Austria, Netherlands and Cuba respectively.	John is from Netherlands.
entailment	Barbara, Annie, Carol and Louis are from Maldives, China, Azerbaijan and France respectively.	Carol is from Azerbaijan.
entailment	Gary, Robert, Ralph and Jack are from Nepal, Ecuador, North Korea and Mexico respectively.	Ralph is from North Korea.
entailment	Ralph, Laura, Jane and Amy are from Russia, Ecuador, Malaysia and Singapore respectively.	Jane is from Malaysia.
entailment	Ryan, Chris, Evelyn and Laura are from Uruguay, Belarus, Bangladesh and Denmark respectively.	Evelyn is from Bangladesh.
entailment	Alison, Jonathan, Harry and Matt are from Fiji, Ecuador, Zimbabwe and Iran respectively.	Harry is from Zimbabwe.
entailment	Judith, Gary, Sally and Kenneth are from Japan, Denmark, Ghana and Uruguay respectively.	Sally is from Ghana.
entailment	Martha, Sandra, Kathy and Judith are from Cuba, Ghana, Sweden and Georgia respectively.	Kathy is from Sweden.
entailment	Rachel, Roger, Dorothy and Martin are from South Korea, Ireland, Netherlands and Iran respectively.	Dorothy is from Netherlands.
entailment	Sue, Catherine, Jimmy and Greg are from France, Mexico, Nepal and Australia respectively.	Jimmy is from Nepal.
entailment	Victoria, Jill, Henry and Lisa are from Bhutan, Denmark, Netherlands and Iraq respectively.	Henry is from Netherlands.
entailment	Nick, Tim, Carl and Ryan are from United Kingdom, Netherlands, Libya and Colombia respectively.	Carl is from Libya.
entailment	Al, Charles, Jill and Carl are from Portugal, Pakistan, Oman and Netherlands respectively.	Jill is from Oman.
entailment	Betty, Helen, Alan and Alex are from Argentina, Afghanistan, Belgium and Greece respectively.	Alan is from Belgium.
entailment	Melissa, Louis, Lisa and Alice are from Taiwan, Indonesia, Bhutan and Philippines respectively.	Lisa is from Bhutan.
entailment	Louis, Elizabeth, Alan and Lynn are from North Korea, Ireland, Germany and Finland respectively.	Alan is from Germany.
entailment	Christine, Ralph, Wendy and Ashley are from Ecuador, Canada, United States of America and Argentina respectively.	Wendy is from United States of America.
entailment	Jerry, Cynthia, Emily and Heather are from Switzerland, United States of America, Poland and Zimbabwe respectively.	Emily is from Poland.
entailment	Alfred, Joan, Grace and Alison are from Nepal, Austria, Iceland and Netherlands respectively.	Grace is from Iceland.
entailment	Louise, Frank, Anthony and Julia are from Qatar, New Zealand, Iraq and Indonesia respectively.	Anthony is from Iraq.
entailment	Tom, Alice, Fiona and Nick are from Italy, United Arab Emirates, Ecuador and Libya respectively.	Fiona is from Ecuador.
entailment	Daniel, Tom, Marilyn and Charlie are from India, South Korea, Philippines and Ecuador respectively.	Marilyn is from Philippines.
entailment	Matthew, Frank, Elaine and Donald are from Denmark, United Arab Emirates, Turkey and Iraq respectively.	Elaine is from Turkey.
entailment	Kevin, Jay, Patrick and Christopher are from South Korea, Belarus, Ghana and Hungary respectively.	Patrick is from Ghana.
entailment	Anna, Daniel, Richard and Ron are from Taiwan, United States of America, Bhutan and Greece respectively.	Richard is from Bhutan.
entailment	Al, Judith, Adam and Joan are from France, Fiji, Austria and Mexico respectively.	Adam is from Austria.
entailment	Carl, Susan, Steve and Mark are from Australia, Uruguay, Pakistan and Hungary respectively.	Steve is from Pakistan.
entailment	William, Jeff, Lisa and Andrew are from Maldives, United Kingdom, Nepal and Laos respectively.	Lisa is from Nepal.
entailment	Frances, Kevin, Brian and Kelly are from Vietnam, Ukraine, United Arab Emirates and Bangladesh respectively.	Brian is from United Arab Emirates.
entailment	Joseph, Steven, Andrew and Martin are from Nepal, Indonesia, Philippines and Hungary respectively.	Andrew is from Philippines.
entailment	Richard, Chris, Betty and Kathleen are from Nepal, Iceland, Afghanistan and Mexico respectively.	Betty is from Afghanistan.
entailment	Tim, Martin, Jay and Ralph are from Laos, Austria, Qatar and Poland respectively.	Jay is from Qatar.
entailment	Ryan, Pamela, Richard and Margaret are from Portugal, Netherlands, Canada and Iceland respectively.	Richard is from Canada.
entailment	Katherine, Adam, Lisa and Alex are from Greece, Singapore, Austria and Taiwan respectively.	Lisa is from Austria.
entailment	Caroline, Karen, Kathleen and Marilyn are from Turkey, Ecuador, Oman and North Korea respectively.	Kathleen is from Oman.
entailment	Virginia, Sandra, Bill and Ken are from Brazil, Saudi Arabia, Pakistan and United States of America respectively.	Bill is from Pakistan.
entailment	Ryan, Gary, Bob and Benjamin are from Bhutan, Azerbaijan, Poland and Italy respectively.	Bob is from Poland.
entailment	Kevin, Daniel, Eric and Alice are from Fiji, Ukraine, Taiwan and Singapore respectively.	Eric is from Taiwan.
entailment	Bruce, Grace, Don and Julia are from Ukraine, Bhutan, Vietnam and Iceland respectively.	Don is from Vietnam.
entailment	Jean, Simon, Tim and Carol are from India, Japan, Australia and Indonesia respectively.	Tim is from Australia.
entailment	Don, Roy, Charles and Marie are from Saudi Arabia, Belgium, South Korea and Egypt respectively.	Charles is from South Korea.
entailment	Alfred, Mary, Mark and Victoria are from Ghana, Vietnam, Canada and Argentina respectively.	Mark is from Canada.
entailment	Jane, Alexandra, Edward and Ryan are from Austria, Azerbaijan, Ghana and Oman respectively.	Edward is from Ghana.
entailment	Harold, Kathy, Jill and Emily are from Zimbabwe, Iraq, Switzerland and Egypt respectively.	Jill is from Switzerland.
entailment	John, Sam, Kate and Kathy are from Philippines, Oman, Malaysia and New Zealand respectively.	Kate is from Malaysia.
entailment	Helen, Amanda, Carol and Harry are from Belarus, United Kingdom, Nepal and Australia respectively.	Carol is from Nepal.
entailment	Brian, Wendy, Claire and Ben are from Russia, Mexico, Afghanistan and New Zealand respectively.	Claire is from Afghanistan.
entailment	Sue, Melissa, Stephen and Edith are from Fiji, Oman, Russia and Chile respectively.	Stephen is from Russia.
entailment	Robin, Angela, Mary and Kathryn are from Philippines, Switzerland, Azerbaijan and New Zealand respectively.	Mary is from Azerbaijan.
entailment	Tom, John, Alexandra and Chris are from France, Argentina, Sweden and South Korea respectively.	Alexandra is from Sweden.
entailment	Carol, Andrea, Amy and Ben are from Taiwan, Switzerland, Italy and Qatar respectively.	Amy is from Italy.
entailment	Francis, Lisa, Al and Arthur are from United States of America, Maldives, Brazil and Haiti respectively.	Al is from Brazil.
entailment	Anthony, Lynn, Larry and Kevin are from Chile, Malaysia, Indonesia and Greece respectively.	Larry is from Indonesia.
entailment	Ashley, Mike, Andrea and Wendy are from Bangladesh, Hungary, Sweden and Russia respectively.	Andrea is from Sweden.
entailment	Andrea, Thomas, Daniel and Kim are from Georgia, Hungary, Mexico and Italy respectively.	Daniel is from Mexico.
entailment	Samuel, Kim, Thomas and Tony are from Malaysia, Netherlands, Fiji and Canada respectively.	Thomas is from Fiji.
entailment	Christine, Stephen, Alison and Margaret are from Pakistan, Colombia, Iceland and Zimbabwe respectively.	Alison is from Iceland.
entailment	Amanda, David, Nancy and Rachel are from Switzerland, Laos, Denmark and Taiwan respectively.	Nancy is from Denmark.
entailment	Donna, Ryan, Adam and Karen are from United States of America, New Zealand, Saudi Arabia and Turkey respectively.	Adam is from Saudi Arabia.
entailment	Sally, Robin, Billy and Tim are from Argentina, Australia, Brazil and Singapore respectively.	Billy is from Brazil.
entailment	Marilyn, Joe, Alexandra and Lynn are from New Zealand, Zimbabwe, Oman and United States of America respectively.	Alexandra is from Oman.
entailment	Bobby, Louis, Peter and Wendy are from Sweden, Nepal, Israel and Poland respectively.	Peter is from Israel.
entailment	Caroline, Marie, Stephen and Christine are from Ecuador, Bangladesh, Australia and Ukraine respectively.	Stephen is from Australia.
entailment	Ellen, Joan, Tom and Greg are from France, Poland, Argentina and Japan respectively.	Tom is from Argentina.
entailment	Heather, Marie, Donna and Samuel are from Colombia, Germany, Brazil and Belarus respectively.	Donna is from Brazil.
entailment	Stephanie, Harriet, Laura and Kathryn are from Turkey, Russia, Colombia and Haiti respectively.	Laura is from Colombia.
entailment	Judy, Henry, Bill and Jane are from Bangladesh, Australia, Greece and New Zealand respectively.	Bill is from Greece.
entailment	Alex, Albert, Ashley and Johnny are from Russia, India, Japan and Uruguay respectively.	Ashley is from Japan.
entailment	Dan, Lauren, Elizabeth and Nicole are from United Arab Emirates, Laos, India and Uruguay respectively.	Elizabeth is from India.
entailment	Tom, Dan, Cynthia and Victoria are from Sweden, North Korea, Bhutan and Portugal respectively.	Cynthia is from Bhutan.
entailment	Sarah, Joan, Bobby and Sophie are from Saudi Arabia, Brazil, United Arab Emirates and Finland respectively.	Bobby is from United Arab Emirates.
entailment	Eric, Rose, Tim and Angela are from Bangladesh, Belgium, Canada and United States of America respectively.	Tim is from Canada.
entailment	Jack, Frances, Robert and Ben are from New Zealand, India, Saudi Arabia and Haiti respectively.	Robert is from Saudi Arabia.
entailment	Bruce, Roy, Maria and Michelle are from Qatar, United Arab Emirates, Nepal and Hungary respectively.	Maria is from Nepal.
entailment	Alex, Kenneth, Rachel and Kevin are from Libya, Haiti, Pakistan and China respectively.	Rachel is from Pakistan.
entailment	Linda, Barbara, Elizabeth and Robin are from Colombia, Iceland, Bangladesh and Austria respectively.	Elizabeth is from Bangladesh.
entailment	Ben, Kathryn, Stephanie and Dick are from Bangladesh, Iraq, China and Ukraine respectively.	Stephanie is from China.
entailment	Laura, Greg, Bill and Rachel are from Argentina, Hungary, France and Oman respectively.	Bill is from France.
entailment	Keith, Fred, Larry and Paul are from Belarus, Iraq, Ireland and Indonesia respectively.	Larry is from Ireland.
entailment	Pamela, Dan, Lawrence and Eric are from Mexico, Ecuador, Iraq and Japan respectively.	Lawrence is from Iraq.
entailment	Deborah, Kathy, Matthew and Harry are from Singapore, India, Qatar and Argentina respectively.	Matthew is from Qatar.
entailment	Alfred, Greg, Scott and Edward are from United States of America, Brazil, India and Indonesia respectively.	Scott is from India.
entailment	Victoria, Sara, Lucy and Laura are from Denmark, Singapore, Greece and Vietnam respectively.	Lucy is from Greece.
entailment	Ann, Peter, Greg and Scott are from Iran, Russia, United Arab Emirates and Maldives respectively.	Greg is from United Arab Emirates.
entailment	Ed, Sophie, Jill and Sally are from Philippines, Singapore, Germany and Belarus respectively.	Jill is from Germany.
entailment	Maria, Hugh, Henry and Julia are from Japan, Switzerland, Bangladesh and North Korea respectively.	Henry is from Bangladesh.
entailment	Barbara, Christine, Julia and Chris are from Belarus, Zimbabwe, Denmark and Oman respectively.	Julia is from Denmark.
entailment	Sally, Carolyn, Richard and Maria are from France, Singapore, Maldives and Qatar respectively.	Richard is from Maldives.
entailment	Christine, Elizabeth, David and Jessica are from Philippines, Malaysia, Canada and Saudi Arabia respectively.	David is from Canada.
entailment	Rachel, Kenneth, Amanda and Roy are from Turkey, Ireland, Germany and Argentina respectively.	Amanda is from Germany.
entailment	Stephanie, Arthur, Matt and Jessica are from Belarus, Vietnam, Azerbaijan and Ghana respectively.	Matt is from Azerbaijan.
entailment	Victoria, Judy, Cynthia and Kathryn are from South Korea, Denmark, Finland and India respectively.	Cynthia is from Finland.
entailment	Steven, Mike, Carol and Charlotte are from Ecuador, Iceland, South Korea and Canada respectively.	Carol is from South Korea.
entailment	Kathy, Carl, Jack and Don are from Indonesia, Netherlands, Canada and Maldives respectively.	Jack is from Canada.
entailment	Adam, Henry, Amanda and Patrick are from Maldives, United Kingdom, Greece and Mexico respectively.	Amanda is from Greece.
entailment	Ann, Catherine, Michael and Linda are from Singapore, Iran, Finland and Vietnam respectively.	Michael is from Finland.
entailment	Karen, Jim, Anna and Kelly are from Zimbabwe, Fiji, Germany and Ukraine respectively.	Anna is from Germany.
entailment	Elaine, Edward, Ralph and Cynthia are from United Arab Emirates, Azerbaijan, Qatar and Ukraine respectively.	Ralph is from Qatar.
entailment	Jean, Ken, Matt and Suzanne are from Poland, India, Zimbabwe and Singapore respectively.	Matt is from Zimbabwe.
entailment	Louis, Jonathan, Lisa and George are from New Zealand, Austria, India and Azerbaijan respectively.	Lisa is from India.
entailment	Nick, Roy, Steve and Katherine are from Haiti, North Korea, South Korea and Qatar respectively.	Steve is from South Korea.
entailment	Sarah, Keith, Edward and Judy are from Thailand, Switzerland, Nepal and Denmark respectively.	Edward is from Nepal.
entailment	Joan, Carl, Janet and Alexander are from Austria, Italy, Egypt and Ghana respectively.	Janet is from Egypt.
entailment	Patrick, Roy, Jimmy and Carol are from Switzerland, Turkey, Maldives and New Zealand respectively.	Jimmy is from Maldives.
entailment	Ann, Martha, Katie and Deborah are from Egypt, Russia, Greece and Maldives respectively.	Katie is from Greece.
entailment	Joseph, Elaine, Daniel and Ruth are from France, Bhutan, Singapore and United Arab Emirates respectively.	Daniel is from Singapore.
entailment	Sara, William, Alfred and Donald are from Japan, North Korea, India and Israel respectively.	Alfred is from India.
entailment	Patrick, Kenneth, Jean and Frederick are from Brazil, United Kingdom, Italy and United Arab Emirates respectively.	Jean is from Italy.
entailment	Angela, Joan, Gary and Charlotte are from Finland, South Korea, United Arab Emirates and Turkey respectively.	Gary is from United Arab Emirates.
entailment	Kevin, Pamela, Harry and Gary are from Afghanistan, Denmark, Ecuador and Azerbaijan respectively.	Harry is from Ecuador.
entailment	Sandra, Edwin, Matt and Charlie are from Haiti, Pakistan, Ghana and France respectively.	Matt is from Ghana.
entailment	Kathy, Kenneth, Chris and Marilyn are from Pakistan, Denmark, Azerbaijan and Georgia respectively.	Chris is from Azerbaijan.
entailment	Ralph, John, Kathleen and Gary are from Saudi Arabia, Argentina, Germany and Azerbaijan respectively.	Kathleen is from Germany.
entailment	Mark, Annie, Angela and Scott are from Vietnam, Fiji, Haiti and Ireland respectively.	Angela is from Haiti.
entailment	Martin, Jonathan, Roger and Cynthia are from Uruguay, Japan, Iran and Denmark respectively.	Roger is from Iran.
entailment	Hugh, James, Steve and Daniel are from Argentina, India, Philippines and Sweden respectively.	Steve is from Philippines.
entailment	Hugh, Sharon, Jimmy and Rebecca are from Bangladesh, Netherlands, South Korea and Colombia respectively.	Jimmy is from South Korea.
entailment	Henry, Wendy, Carl and Larry are from Philippines, Maldives, Saudi Arabia and Chile respectively.	Carl is from Saudi Arabia.
entailment	Charlotte, Jill, Richard and Matthew are from Canada, Switzerland, Finland and Denmark respectively.	Richard is from Finland.
entailment	Mark, Bob, Joseph and Stephen are from Zimbabwe, India, China and Georgia respectively.	Joseph is from China.
entailment	Andrew, Daniel, Mary and Barbara are from Uruguay, Iran, United Arab Emirates and Zimbabwe respectively.	Mary is from United Arab Emirates.
entailment	Robert, Edward, Lucy and Benjamin are from Ghana, Maldives, Finland and Pakistan respectively.	Lucy is from Finland.
entailment	Ashley, James, Ellen and Nicole are from Georgia, Vietnam, Iceland and Cuba respectively.	Ellen is from Iceland.
entailment	Tom, Laura, Dorothy and Lynn are from Ireland, Iraq, Germany and Uruguay respectively.	Dorothy is from Germany.
entailment	Linda, Henry, Helen and Philip are from Italy, Sweden, Austria and Poland respectively.	Helen is from Austria.
entailment	Jim, George, Ed and Sara are from India, Belarus, Denmark and Russia respectively.	Ed is from Denmark.
entailment	Walter, Benjamin, Emily and Joseph are from South Korea, Pakistan, Vietnam and Oman respectively.	Emily is from Vietnam.
entailment	Paul, Billy, Hugh and Annie are from Netherlands, Colombia, India and Turkey respectively.	Hugh is from India.
entailment	Rose, Barbara, Walter and Christine are from New Zealand, Argentina, Egypt and Denmark respectively.	Walter is from Egypt.
entailment	Roy, Ashley, Kelly and Louise are from United States of America, Belarus, Switzerland and Iceland respectively.	Kelly is from Switzerland.
entailment	Alexander, Lisa, Jim and Tony are from Ecuador, Fiji, Turkey and France respectively.	Jim is from Turkey.
entailment	Jill, Alice, Virginia and Charlotte are from Iran, Bangladesh, Chile and Oman respectively.	Virginia is from Chile.
entailment	Julie, Mark, Helen and Walter are from Russia, Denmark, Philippines and Singapore respectively.	Helen is from Philippines.
entailment	Sophie, Kelly, Ralph and Bobby are from Sweden, Israel, China and Uruguay respectively.	Ralph is from China.
entailment	Alan, Ian, Robert and Edith are from Azerbaijan, Maldives, Iraq and United States of America respectively.	Robert is from Iraq.
entailment	Alan, Helen, Roy and Diane are from Sweden, China, New Zealand and Vietnam respectively.	Roy is from New Zealand.
entailment	Alan, Suzanne, Chris and Ed are from New Zealand, Belarus, Ukraine and Netherlands respectively.	Chris is from Ukraine.
entailment	Alan, Alexander, Steven and Sophie are from Germany, Philippines, Bhutan and Malaysia respectively.	Steven is from Bhutan.
entailment	Elaine, Lisa, Matt and Ed are from Pakistan, Indonesia, Thailand and Philippines respectively.	Matt is from Thailand.
entailment	Jason, Angela, Sam and Billy are from United Kingdom, Portugal, Iran and Turkey respectively.	Sam is from Iran.
entailment	Grace, Mary, Larry and Mike are from Singapore, Bangladesh, Brazil and Fiji respectively.	Larry is from Brazil.
entailment	Lawrence, Bob, Hugh and Dick are from United States of America, Fiji, Saudi Arabia and Iceland respectively.	Hugh is from Saudi Arabia.
entailment	Jason, Albert, Charles and Kenneth are from Sweden, Israel, Canada and China respectively.	Charles is from Canada.
entailment	Elizabeth, Katherine, Judith and Alexander are from China, Iran, Oman and Poland respectively.	Judith is from Oman.
entailment	Linda, Ray, Frank and Pamela are from Qatar, Portugal, China and Maldives respectively.	Frank is from China.
entailment	Brian, Sandra, Linda and Johnny are from Bangladesh, Finland, Denmark and India respectively.	Linda is from Denmark.
entailment	Marie, Gary, Philip and Jim are from Egypt, Ireland, North Korea and Bhutan respectively.	Philip is from North Korea.
entailment	Ruth, Mark, Eric and Larry are from Qatar, Greece, Netherlands and Cuba respectively.	Eric is from Netherlands.
entailment	Nicole, Sam, Harriet and Tony are from Uruguay, Iceland, Australia and Netherlands respectively.	Harriet is from Australia.
entailment	Harold, Keith, Lisa and Emily are from United Arab Emirates, France, Iceland and Belarus respectively.	Lisa is from Iceland.
entailment	Larry, Alan, Amy and Margaret are from Sweden, Turkey, Chile and Ecuador respectively.	Amy is from Chile.
entailment	Frank, Melissa, Alexandra and Harold are from South Korea, Colombia, Argentina and Switzerland respectively.	Alexandra is from Argentina.
entailment	Frederick, Donna, Carol and Marilyn are from Fiji, India, Afghanistan and Maldives respectively.	Carol is from Afghanistan.
entailment	Betty, Sandra, Suzanne and Ashley are from Oman, Chile, United Kingdom and Egypt respectively.	Suzanne is from United Kingdom.
entailment	Sara, Adam, Harold and Elizabeth are from Italy, Poland, Colombia and United Kingdom respectively.	Harold is from Colombia.
entailment	Daniel, Donna, Carolyn and Johnny are from Argentina, Bangladesh, Afghanistan and Switzerland respectively.	Carolyn is from Afghanistan.
entailment	Elaine, Alan, Sophie and Hugh are from Switzerland, Argentina, Austria and Netherlands respectively.	Sophie is from Austria.
entailment	Jimmy, Alexander, Ian and Kim are from United States of America, Canada, Chile and Belarus respectively.	Ian is from Chile.
entailment	Peter, Sally, Gary and Ann are from Israel, Oman, Ukraine and New Zealand respectively.	Gary is from Ukraine.
entailment	Benjamin, Jane, Jim and Kathryn are from Argentina, Hungary, India and Ireland respectively.	Jim is from India.
entailment	Angela, Alice, Caroline and Keith are from Qatar, Germany, Belgium and Pakistan respectively.	Caroline is from Belgium.
entailment	Leslie, Howard, Ben and Eric are from Austria, Netherlands, China and Germany respectively.	Ben is from China.
entailment	Roger, Karen, Anthony and Virginia are from Georgia, New Zealand, Nepal and Japan respectively.	Anthony is from Nepal.
entailment	Lynn, Benjamin, Anna and Ben are from Mexico, Qatar, Israel and Oman respectively.	Anna is from Israel.
entailment	Joan, Kate, Tony and Jack are from Indonesia, Nepal, North Korea and Belarus respectively.	Tony is from North Korea.
entailment	Nancy, Judith, Carolyn and Adam are from Malaysia, Azerbaijan, Taiwan and Iran respectively.	Carolyn is from Taiwan.
entailment	Dorothy, Bob, Virginia and Roger are from Netherlands, Poland, Israel and Greece respectively.	Virginia is from Israel.
entailment	Alison, Edwin, Tony and Janet are from United Kingdom, China, Mexico and Nepal respectively.	Tony is from Mexico.
entailment	Samuel, Jessica, Virginia and Patricia are from Belarus, Greece, Russia and Ukraine respectively.	Virginia is from Russia.
entailment	Linda, Dave, Daniel and Albert are from Sweden, Netherlands, Finland and United Kingdom respectively.	Daniel is from Finland.
entailment	Ben, Philip, Alan and Annie are from Malaysia, Qatar, Hungary and United Kingdom respectively.	Alan is from Hungary.
entailment	Katherine, Grace, Walter and Caroline are from Poland, Malaysia, Russia and Singapore respectively.	Walter is from Russia.
entailment	Kim, Patrick, Fred and Ellen are from Portugal, Austria, Vietnam and Ecuador respectively.	Fred is from Vietnam.
entailment	Martin, Melissa, George and Brian are from Russia, Indonesia, Turkey and Mexico respectively.	George is from Turkey.
entailment	Andrew, Deborah, Jonathan and Alison are from Libya, United Kingdom, Qatar and Laos respectively.	Jonathan is from Qatar.
entailment	Julie, Florence, Rose and Edwin are from Italy, North Korea, Vietnam and Mexico respectively.	Rose is from Vietnam.
entailment	Steven, Tony, James and Peter are from China, Azerbaijan, Bhutan and Iceland respectively.	James is from Bhutan.
entailment	Eric, Julia, Jerry and Roger are from Libya, Iraq, Argentina and Denmark respectively.	Jerry is from Argentina.
entailment	Dan, Kim, Lawrence and Catherine are from Qatar, Mexico, India and Oman respectively.	Lawrence is from India.
entailment	Christopher, Alexandra, Kevin and Diane are from Qatar, Poland, Saudi Arabia and Switzerland respectively.	Kevin is from Saudi Arabia.
entailment	Charlotte, Sophie, Emily and Helen are from Indonesia, Ireland, Turkey and Zimbabwe respectively.	Emily is from Turkey.
entailment	Maria, Melissa, Claire and Francis are from Sweden, Portugal, Saudi Arabia and Haiti respectively.	Claire is from Saudi Arabia.
entailment	Tim, Annie, Diana and Bob are from Azerbaijan, Hungary, Bangladesh and Colombia respectively.	Diana is from Bangladesh.
entailment	Greg, Jimmy, Jack and Emily are from Ecuador, North Korea, Cuba and United States of America respectively.	Jack is from Cuba.
entailment	Rose, Adam, Carl and Matthew are from Brazil, Japan, Oman and United Kingdom respectively.	Carl is from Oman.
entailment	Anna, Adam, Gary and Sam are from Portugal, South Korea, Iraq and Sweden respectively.	Gary is from Iraq.
entailment	David, Carol, Charlie and Nick are from Saudi Arabia, Australia, Netherlands and Iran respectively.	Charlie is from Netherlands.
entailment	Tom, Amy, Steven and Leslie are from United Kingdom, Mexico, Fiji and New Zealand respectively.	Steven is from Fiji.
entailment	Frances, Joe, Michelle and Diane are from Mexico, Sweden, Uruguay and Oman respectively.	Michelle is from Uruguay.
entailment	Kathy, Eleanor, Kenneth and Virginia are from Saudi Arabia, Iran, Bhutan and Colombia respectively.	Kenneth is from Bhutan.
entailment	Mike, Helen, Kevin and Annie are from Belgium, Saudi Arabia, Afghanistan and Argentina respectively.	Kevin is from Afghanistan.
entailment	Sandra, Maria, Katie and Benjamin are from Netherlands, Germany, Bangladesh and Mexico respectively.	Katie is from Bangladesh.
entailment	Frank, Simon, Betty and Emily are from Belarus, North Korea, Ecuador and Fiji respectively.	Betty is from Ecuador.
entailment	Stephen, Adam, Joan and Andrea are from Ghana, Oman, Vietnam and Russia respectively.	Joan is from Vietnam.
entailment	Ed, Gary, Kim and Robert are from Laos, Qatar, Bhutan and Denmark respectively.	Kim is from Bhutan.
entailment	Stephen, Wendy, Jerry and David are from Saudi Arabia, Pakistan, Brazil and Singapore respectively.	Jerry is from Brazil.
entailment	Amy, Frederick, Lisa and Adam are from Ukraine, India, Portugal and Maldives respectively.	Lisa is from Portugal.
