contradiction	Steven, Andrew and Ian are from Turkey, Cuba and Ireland respectively.	Ian is from Turkey.
contradiction	Amy, Dorothy and Katie are from India, Thailand and Italy respectively.	Katie is from India.
contradiction	Matt, Mike and Greg are from Portugal, Haiti and Iran respectively.	Greg is from Portugal.
contradiction	Ralph, Ken and Anna are from Canada, United Arab Emirates and Pakistan respectively.	Anna is from Canada.
contradiction	Katherine, Martin and Edward are from New Zealand, Egypt and Vietnam respectively.	Edward is from New Zealand.
contradiction	Caroline, Roy and Mike are from United States of America, Ecuador and Nepal respectively.	Mike is from United States of America.
contradiction	Ray, Joe and Frederick are from Egypt, Bhutan and Greece respectively.	Frederick is from Egypt.
contradiction	Cynthia, Louis and Brian are from Indonesia, Afghanistan and Poland respectively.	Brian is from Indonesia.
contradiction	Nicole, Mike and Joan are from Netherlands, Ghana and Colombia respectively.	Joan is from Netherlands.
contradiction	David, Paul and Stephanie are from Bhutan, Turkey and Argentina respectively.	Stephanie is from Bhutan.
contradiction	Frank, Matt and Jonathan are from Haiti, Colombia and United Arab Emirates respectively.	Jonathan is from Haiti.
contradiction	Donna, Emily and Jack are from Oman, South Korea and Thailand respectively.	Jack is from Oman.
contradiction	Catherine, Adam and Rose are from Fiji, China and Greece respectively.	Rose is from Fiji.
contradiction	Peter, Edwin and Martin are from India, Uruguay and Vietnam respectively.	Martin is from India.
contradiction	Albert, Ken and Victoria are from Belarus, Uruguay and Bangladesh respectively.	Victoria is from Belarus.
contradiction	Tony, Roy and Julie are from Ghana, Laos and Canada respectively.	Julie is from Ghana.
contradiction	Johnny, Louise and David are from Russia, Azerbaijan and Austria respectively.	David is from Russia.
contradiction	Judith, Alexander and Brian are from Italy, Switzerland and Pakistan respectively.	Brian is from Italy.
contradiction	Ashley, Rebecca and Diane are from Ghana, Belarus and Israel respectively.	Diane is from Ghana.
contradiction	Elizabeth, Patrick and Jimmy are from Australia, Uruguay and Libya respectively.	Jimmy is from Australia.
contradiction	Michael, Emma and Angela are from Maldives, Canada and Hungary respectively.	Angela is from Maldives.
contradiction	Kathleen, Melissa and Diane are from Qatar, India and Fiji respectively.	Diane is from Qatar.
contradiction	Martha, William and Don are from Taiwan, Cuba and Singapore respectively.	Don is from Taiwan.
contradiction	Tim, Evelyn and Wendy are from Zimbabwe, Thailand and Switzerland respectively.	Wendy is from Zimbabwe.
contradiction	Ray, Mike and Kate are from Netherlands, Vietnam and Cuba respectively.	Kate is from Netherlands.
contradiction	Paul, Dan and Lynn are from Uruguay, China and Philippines respectively.	Lynn is from Uruguay.
contradiction	Nancy, Dick and Diana are from Brazil, Taiwan and Sweden respectively.	Diana is from Brazil.
contradiction	Patricia, Bill and Sara are from Finland, Australia and Argentina respectively.	Sara is from Finland.
contradiction	Jonathan, Judith and Katie are from Taiwan, Ecuador and Italy respectively.	Katie is from Taiwan.
contradiction	Sophie, Sandra and Gary are from Ghana, Haiti and Thailand respectively.	Gary is from Ghana.
contradiction	Martin, Cynthia and Edward are from Cuba, Finland and Fiji respectively.	Edward is from Cuba.
contradiction	Mary, Jerry and Angela are from Afghanistan, Haiti and Italy respectively.	Angela is from Afghanistan.
contradiction	Andrew, Lawrence and Fred are from Finland, Taiwan and Ukraine respectively.	Fred is from Finland.
contradiction	Keith, Donald and Florence are from Philippines, Israel and Portugal respectively.	Florence is from Philippines.
contradiction	Ryan, Dave and Julie are from Iceland, Chile and Russia respectively.	Julie is from Iceland.
contradiction	Angela, Tim and Amy are from Italy, United Arab Emirates and France respectively.	Amy is from Italy.
contradiction	Andrea, Richard and Ashley are from Netherlands, United States of America and United Arab Emirates respectively.	Ashley is from Netherlands.
contradiction	Alison, Arthur and Kim are from Belarus, Canada and Hungary respectively.	Kim is from Belarus.
contradiction	Jim, Edwin and Sam are from Russia, Afghanistan and Austria respectively.	Sam is from Russia.
contradiction	Pamela, Deborah and Barbara are from Saudi Arabia, Mexico and Argentina respectively.	Barbara is from Saudi Arabia.
contradiction	Bruce, Sally and Lynn are from Colombia, Azerbaijan and Malaysia respectively.	Lynn is from Colombia.
contradiction	Judy, Caroline and Julia are from United States of America, Georgia and Egypt respectively.	Julia is from United States of America.
contradiction	Alfred, John and Jason are from Georgia, Sweden and Azerbaijan respectively.	Jason is from Georgia.
contradiction	Al, Nicole and Diana are from Switzerland, Turkey and Hungary respectively.	Diana is from Switzerland.
contradiction	Donna, Stephen and Roger are from Colombia, Taiwan and France respectively.	Roger is from Colombia.
contradiction	Bill, Dick and David are from Indonesia, Russia and Ukraine respectively.	David is from Indonesia.
contradiction	Adam, Harriet and Ralph are from Ghana, Italy and New Zealand respectively.	Ralph is from Ghana.
contradiction	Florence, Katie and Leslie are from Greece, Haiti and Saudi Arabia respectively.	Leslie is from Greece.
contradiction	Brian, Mary and Jonathan are from Indonesia, Uruguay and South Korea respectively.	Jonathan is from Indonesia.
contradiction	Philip, Hugh and Wendy are from Vietnam, Canada and Philippines respectively.	Wendy is from Vietnam.
contradiction	Harriet, Jean and Lauren are from Poland, Maldives and North Korea respectively.	Lauren is from Poland.
contradiction	Alex, Lauren and Brian are from Belgium, Egypt and Zimbabwe respectively.	Brian is from Belgium.
contradiction	Marie, David and Don are from United States of America, United Arab Emirates and Canada respectively.	Don is from United States of America.
contradiction	Samuel, Betty and Kathleen are from Iraq, Azerbaijan and Israel respectively.	Kathleen is from Iraq.
contradiction	Janet, Judy and Elaine are from Vietnam, Nepal and Belgium respectively.	Elaine is from Vietnam.
contradiction	Kenneth, Ron and Chris are from Greece, Iran and United States of America respectively.	Chris is from Greece.
contradiction	Greg, Frederick and Nick are from Canada, Belgium and Vietnam respectively.	Nick is from Canada.
contradiction	Howard, Thomas and George are from Haiti, Japan and United Arab Emirates respectively.	George is from Haiti.
contradiction	Karen, Adam and Ryan are from Bhutan, Malaysia and Italy respectively.	Ryan is from Bhutan.
contradiction	Edith, William and Karen are from Ukraine, Portugal and United Arab Emirates respectively.	Karen is from Ukraine.
contradiction	Bill, Sara and Nancy are from Belgium, Cuba and United States of America respectively.	Nancy is from Belgium.
contradiction	Kim, Stephanie and James are from New Zealand, Brazil and Pakistan respectively.	James is from New Zealand.
contradiction	Catherine, Sophie and Matt are from Taiwan, Switzerland and United Arab Emirates respectively.	Matt is from Taiwan.
contradiction	Edith, Brian and Ed are from Malaysia, Thailand and New Zealand respectively.	Ed is from Malaysia.
contradiction	Martha, Angela and Ian are from Italy, Thailand and New Zealand respectively.	Ian is from Italy.
contradiction	Nick, Howard and Bob are from Cuba, Portugal and Maldives respectively.	Bob is from Cuba.
contradiction	Judith, Bill and Jeff are from United Arab Emirates, Italy and Libya respectively.	Jeff is from United Arab Emirates.
contradiction	Joe, Jane and Harry are from Indonesia, North Korea and Cuba respectively.	Harry is from Indonesia.
contradiction	Jimmy, Andrew and Stephanie are from Mexico, Poland and Ecuador respectively.	Stephanie is from Mexico.
contradiction	Jason, Jerry and Wendy are from Laos, United States of America and Georgia respectively.	Wendy is from Laos.
contradiction	Brian, Simon and Michelle are from Thailand, Argentina and Uruguay respectively.	Michelle is from Thailand.
contradiction	Patricia, Alexandra and Louise are from Maldives, Azerbaijan and Argentina respectively.	Louise is from Maldives.
contradiction	Frank, Bill and Nicole are from Australia, Hungary and Italy respectively.	Nicole is from Australia.
contradiction	Johnny, Edith and Andrea are from Thailand, Italy and United Arab Emirates respectively.	Andrea is from Thailand.
contradiction	Lisa, Alfred and Jeff are from Bangladesh, Libya and Fiji respectively.	Jeff is from Bangladesh.
contradiction	Fiona, Kate and Samuel are from Japan, Oman and North Korea respectively.	Samuel is from Japan.
contradiction	Jerry, Patrick and Brian are from Israel, Singapore and United Kingdom respectively.	Brian is from Israel.
contradiction	Alex, Victoria and Richard are from Finland, Zimbabwe and Israel respectively.	Richard is from Finland.
contradiction	Steve, Tim and Samuel are from Sweden, Vietnam and Thailand respectively.	Samuel is from Sweden.
contradiction	Lynn, Ruth and Ashley are from Laos, Indonesia and Russia respectively.	Ashley is from Laos.
contradiction	Marie, Harold and John are from Haiti, Brazil and Italy respectively.	John is from Haiti.
contradiction	Robert, Alex and Tom are from Hungary, China and Iceland respectively.	Tom is from Hungary.
contradiction	Jill, Kenneth and Kevin are from Egypt, Libya and Laos respectively.	Kevin is from Egypt.
contradiction	Richard, Bobby and Dan are from Belgium, Hungary and Azerbaijan respectively.	Dan is from Belgium.
contradiction	Patricia, Stephen and Kathryn are from Argentina, Thailand and Portugal respectively.	Kathryn is from Argentina.
contradiction	Frank, Steven and Amanda are from Portugal, Iraq and United Kingdom respectively.	Amanda is from Portugal.
contradiction	Sam, Grace and Pamela are from Hungary, Malaysia and Uruguay respectively.	Pamela is from Hungary.
contradiction	Kelly, Howard and Diane are from Pakistan, France and Saudi Arabia respectively.	Diane is from Pakistan.
contradiction	Diane, Bruce and Virginia are from Australia, Argentina and Pakistan respectively.	Virginia is from Australia.
contradiction	Emily, Alice and Claire are from Hungary, Taiwan and United Arab Emirates respectively.	Claire is from Hungary.
contradiction	Laura, Kathleen and Patrick are from Vietnam, Ecuador and Azerbaijan respectively.	Patrick is from Vietnam.
contradiction	Bill, Chris and Matthew are from Bangladesh, United Kingdom and Libya respectively.	Matthew is from Bangladesh.
contradiction	Keith, Fred and Alexandra are from Germany, Bangladesh and Canada respectively.	Alexandra is from Germany.
contradiction	Hugh, Adam and Dorothy are from Bangladesh, North Korea and Ghana respectively.	Dorothy is from Bangladesh.
contradiction	Jeff, Tim and Florence are from Laos, India and Poland respectively.	Florence is from Laos.
contradiction	Frank, Emily and Anthony are from Vietnam, Taiwan and Oman respectively.	Anthony is from Vietnam.
contradiction	Elaine, Suzanne and Anna are from Malaysia, Netherlands and South Korea respectively.	Anna is from Malaysia.
contradiction	Simon, Mike and Sara are from Malaysia, Iran and Germany respectively.	Sara is from Malaysia.
contradiction	Howard, Susan and Mike are from Singapore, Georgia and Bhutan respectively.	Mike is from Singapore.
contradiction	Fiona, Margaret and Jane are from India, Ireland and Pakistan respectively.	Jane is from India.
contradiction	Philip, Kelly and Edward are from Japan, Singapore and Georgia respectively.	Edward is from Japan.
contradiction	Fred, Carol and Larry are from Indonesia, Haiti and Brazil respectively.	Larry is from Indonesia.
contradiction	Dorothy, Charles and Edwin are from New Zealand, Germany and Qatar respectively.	Edwin is from New Zealand.
contradiction	Elaine, Emma and Alex are from Vietnam, Iraq and Portugal respectively.	Alex is from Vietnam.
contradiction	Jeff, Victoria and Donald are from Argentina, Egypt and Finland respectively.	Donald is from Argentina.
contradiction	James, Bruce and Rachel are from Afghanistan, Finland and Poland respectively.	Rachel is from Afghanistan.
contradiction	Alexandra, Karen and Martha are from Saudi Arabia, Cuba and India respectively.	Martha is from Saudi Arabia.
contradiction	Michelle, Leslie and Harry are from China, Taiwan and United States of America respectively.	Harry is from China.
contradiction	Grace, Joseph and Michelle are from Qatar, Afghanistan and United Arab Emirates respectively.	Michelle is from Qatar.
contradiction	Diana, James and Larry are from Sweden, Iraq and Turkey respectively.	Larry is from Sweden.
contradiction	Ray, Janet and Alex are from Vietnam, Belgium and Afghanistan respectively.	Alex is from Vietnam.
contradiction	Larry, Susan and Lynn are from Switzerland, Haiti and United Kingdom respectively.	Lynn is from Switzerland.
contradiction	Maria, Jennifer and Christine are from Ghana, Colombia and Turkey respectively.	Christine is from Ghana.
contradiction	Kelly, Robin and Florence are from Austria, South Korea and Taiwan respectively.	Florence is from Austria.
contradiction	Francis, John and Peter are from Libya, Turkey and Israel respectively.	Peter is from Libya.
contradiction	Virginia, Alison and Sara are from Greece, India and Philippines respectively.	Sara is from Greece.
contradiction	Joan, Janet and Louise are from Denmark, Taiwan and Turkey respectively.	Louise is from Denmark.
contradiction	Kathy, Carol and Roy are from Indonesia, Turkey and Nepal respectively.	Roy is from Indonesia.
contradiction	Charles, Francis and Dorothy are from Singapore, Ireland and Qatar respectively.	Dorothy is from Singapore.
contradiction	Simon, Christine and Steven are from United Arab Emirates, Afghanistan and Saudi Arabia respectively.	Steven is from United Arab Emirates.
contradiction	Samuel, Kathy and Carl are from Iraq, Austria and Portugal respectively.	Carl is from Iraq.
contradiction	Annie, Angela and Johnny are from Austria, Saudi Arabia and South Korea respectively.	Johnny is from Austria.
contradiction	Katherine, Matthew and Tony are from Colombia, Poland and China respectively.	Tony is from Colombia.
contradiction	Katie, Ruth and Arthur are from Ireland, Russia and Netherlands respectively.	Arthur is from Ireland.
contradiction	Emma, Claire and Louise are from Iceland, Maldives and Brazil respectively.	Louise is from Iceland.
contradiction	Lisa, Carl and Lynn are from Fiji, Iran and Finland respectively.	Lynn is from Fiji.
contradiction	William, Janet and Mary are from Sweden, Zimbabwe and Pakistan respectively.	Mary is from Sweden.
contradiction	Stephen, Caroline and Bruce are from Azerbaijan, Switzerland and Indonesia respectively.	Bruce is from Azerbaijan.
contradiction	Don, Melissa and Claire are from Pakistan, Japan and Greece respectively.	Claire is from Pakistan.
contradiction	Alison, Rebecca and Lisa are from Zimbabwe, Belarus and Libya respectively.	Lisa is from Zimbabwe.
contradiction	Adam, Martha and Elizabeth are from North Korea, Indonesia and Hungary respectively.	Elizabeth is from North Korea.
contradiction	Alan, Ellen and Ruth are from Ecuador, India and Afghanistan respectively.	Ruth is from Ecuador.
contradiction	Jimmy, Roger and Virginia are from Sweden, Saudi Arabia and United States of America respectively.	Virginia is from Sweden.
contradiction	Kenneth, Harriet and Don are from Chile, Argentina and Zimbabwe respectively.	Don is from Chile.
contradiction	Grace, Dave and Virginia are from Hungary, Italy and Colombia respectively.	Virginia is from Hungary.
contradiction	Simon, Jeff and Donald are from Mexico, Chile and Bangladesh respectively.	Donald is from Mexico.
contradiction	Karen, Victoria and Peter are from United States of America, Switzerland and Vietnam respectively.	Peter is from United States of America.
contradiction	Ellen, Cynthia and Ben are from Oman, Bhutan and Canada respectively.	Ben is from Oman.
contradiction	Brian, Laura and Charlie are from Argentina, Taiwan and Italy respectively.	Charlie is from Argentina.
contradiction	Marilyn, Patricia and Michael are from Qatar, Zimbabwe and Sweden respectively.	Michael is from Qatar.
contradiction	Kelly, Wendy and Johnny are from Saudi Arabia, United States of America and Nepal respectively.	Johnny is from Saudi Arabia.
contradiction	Ken, Francis and Nicole are from Cuba, North Korea and Mexico respectively.	Nicole is from Cuba.
contradiction	Susan, Ken and Carolyn are from Poland, India and France respectively.	Carolyn is from Poland.
contradiction	Alexandra, Kate and Kim are from Sweden, Finland and Pakistan respectively.	Kim is from Sweden.
contradiction	Robert, Christine and Jimmy are from Cuba, Switzerland and Maldives respectively.	Jimmy is from Cuba.
contradiction	Michael, Jean and Ray are from Maldives, Mexico and Haiti respectively.	Ray is from Maldives.
contradiction	Colin, Scott and Jean are from Libya, Switzerland and Germany respectively.	Jean is from Libya.
contradiction	Diane, Robin and Larry are from Austria, Belgium and Ghana respectively.	Larry is from Austria.
contradiction	Elaine, Colin and Ellen are from Qatar, Mexico and Afghanistan respectively.	Ellen is from Qatar.
contradiction	Katie, Joe and Nick are from United States of America, Chile and Sweden respectively.	Nick is from United States of America.
contradiction	Robin, Albert and Donna are from Thailand, Japan and Vietnam respectively.	Donna is from Thailand.
contradiction	Virginia, Jack and Ray are from China, New Zealand and Turkey respectively.	Ray is from China.
contradiction	Janet, Dick and Albert are from Italy, Colombia and Brazil respectively.	Albert is from Italy.
contradiction	Edward, Cynthia and Carolyn are from Malaysia, Saudi Arabia and Haiti respectively.	Carolyn is from Malaysia.
contradiction	Marie, Kathy and Kate are from Chile, Philippines and Denmark respectively.	Kate is from Chile.
contradiction	Amanda, Angela and Anne are from Azerbaijan, Greece and India respectively.	Anne is from Azerbaijan.
contradiction	John, Alexander and Jill are from Saudi Arabia, Germany and Colombia respectively.	Jill is from Saudi Arabia.
contradiction	Anna, Florence and Dan are from Austria, United Arab Emirates and Poland respectively.	Dan is from Austria.
contradiction	Andrew, Charlotte and Diana are from Singapore, Bangladesh and Qatar respectively.	Diana is from Singapore.
contradiction	Christine, Harriet and Louis are from Maldives, Malaysia and Poland respectively.	Louis is from Maldives.
contradiction	Patrick, Victoria and Jerry are from United States of America, Israel and Australia respectively.	Jerry is from United States of America.
contradiction	Donna, Tom and Mary are from Brazil, Nepal and Fiji respectively.	Mary is from Brazil.
contradiction	Thomas, Al and Robert are from Ukraine, Greece and Iceland respectively.	Robert is from Ukraine.
contradiction	Howard, Amy and Sandra are from Israel, New Zealand and Finland respectively.	Sandra is from Israel.
contradiction	Kathleen, Catherine and Dave are from Saudi Arabia, China and Maldives respectively.	Dave is from Saudi Arabia.
contradiction	Keith, Jimmy and Sophie are from Fiji, Ireland and Iceland respectively.	Sophie is from Fiji.
contradiction	Edward, Howard and Betty are from Argentina, Iraq and United Arab Emirates respectively.	Betty is from Argentina.
contradiction	Sara, Chris and Lawrence are from Iceland, Switzerland and Germany respectively.	Lawrence is from Iceland.
contradiction	Jean, Ralph and Wendy are from Austria, Cuba and Taiwan respectively.	Wendy is from Austria.
contradiction	Billy, Elaine and Michael are from Portugal, Taiwan and Iran respectively.	Michael is from Portugal.
contradiction	Dorothy, Cynthia and Ellen are from Portugal, Chile and Fiji respectively.	Ellen is from Portugal.
contradiction	Edith, Angela and Kelly are from Zimbabwe, Germany and North Korea respectively.	Kelly is from Zimbabwe.
contradiction	Lawrence, Richard and Victoria are from Maldives, Canada and Switzerland respectively.	Victoria is from Maldives.
contradiction	Billy, Leslie and Kevin are from Portugal, United Kingdom and Fiji respectively.	Kevin is from Portugal.
contradiction	Linda, Rebecca and Dorothy are from China, Azerbaijan and Australia respectively.	Dorothy is from China.
contradiction	Dorothy, Steven and Arthur are from Argentina, Maldives and Bhutan respectively.	Arthur is from Argentina.
contradiction	William, Bruce and Thomas are from Iraq, Italy and Ukraine respectively.	Thomas is from Iraq.
contradiction	Marie, Ann and Rebecca are from Egypt, Ireland and Sweden respectively.	Rebecca is from Egypt.
contradiction	Maria, Eric and Harriet are from Thailand, Uruguay and South Korea respectively.	Harriet is from Thailand.
contradiction	Keith, Hugh and Rebecca are from Iraq, Ireland and Argentina respectively.	Rebecca is from Iraq.
contradiction	Dick, Janet and Peter are from Austria, Japan and Switzerland respectively.	Peter is from Austria.
contradiction	Rebecca, Steve and Florence are from Iceland, Italy and Turkey respectively.	Florence is from Iceland.
contradiction	Robin, Joseph and Fred are from Austria, Ghana and United States of America respectively.	Fred is from Austria.
contradiction	Laura, Ellen and Hugh are from Greece, Malaysia and Portugal respectively.	Hugh is from Greece.
contradiction	Kathleen, Lisa and Ellen are from Fiji, Sweden and Cuba respectively.	Ellen is from Fiji.
contradiction	Judith, Nick and Katie are from Azerbaijan, India and Denmark respectively.	Katie is from Azerbaijan.
contradiction	Louise, Evelyn and Jill are from Afghanistan, United Kingdom and Indonesia respectively.	Jill is from Afghanistan.
contradiction	Jay, Bruce and Arthur are from Nepal, Ghana and Taiwan respectively.	Arthur is from Nepal.
contradiction	Robert, Katherine and Laura are from Iraq, New Zealand and Nepal respectively.	Laura is from Iraq.
contradiction	Alison, Emily and Robert are from Maldives, Qatar and Saudi Arabia respectively.	Robert is from Maldives.
contradiction	Alex, Leslie and Tom are from Ireland, Portugal and Laos respectively.	Tom is from Ireland.
contradiction	Carol, Kelly and Eric are from Sweden, Finland and China respectively.	Eric is from Sweden.
contradiction	Colin, Ashley and Rachel are from Japan, Sweden and Argentina respectively.	Rachel is from Japan.
contradiction	Harry, Ellen and Betty are from Portugal, Belarus and Maldives respectively.	Betty is from Portugal.
contradiction	Walter, Donald and Sandra are from Turkey, Ghana and Denmark respectively.	Sandra is from Turkey.
contradiction	Carl, Rachel and Brian are from Chile, Mexico and Ireland respectively.	Brian is from Chile.
contradiction	Sandra, Betty and Howard are from Japan, Azerbaijan and Ukraine respectively.	Howard is from Japan.
contradiction	Kevin, Christine and Robert are from Japan, Switzerland and Georgia respectively.	Robert is from Japan.
contradiction	Sara, Rachel and Emily are from Switzerland, Iraq and Israel respectively.	Emily is from Switzerland.
contradiction	Florence, Catherine and Anne are from United States of America, Russia and Taiwan respectively.	Anne is from United States of America.
contradiction	Roy, Deborah and Jeff are from Thailand, Libya and Cuba respectively.	Jeff is from Thailand.
contradiction	Sarah, Michael and Kelly are from Bhutan, Germany and Denmark respectively.	Kelly is from Bhutan.
contradiction	Julie, Edward and Dorothy are from Taiwan, New Zealand and Qatar respectively.	Dorothy is from Taiwan.
contradiction	Judy, William and Linda are from Canada, South Korea and Belarus respectively.	Linda is from Canada.
contradiction	Kim, Michael and Elaine are from Ecuador, Japan and Hungary respectively.	Elaine is from Ecuador.
contradiction	Michael, Walter and Pamela are from Netherlands, Belgium and Haiti respectively.	Pamela is from Netherlands.
contradiction	Edith, Samuel and Steve are from Netherlands, Portugal and Ireland respectively.	Steve is from Netherlands.
contradiction	Victoria, Larry and Christopher are from Sweden, Taiwan and Azerbaijan respectively.	Christopher is from Sweden.
contradiction	Al, Jeff and Maria are from United Arab Emirates, Afghanistan and Vietnam respectively.	Maria is from United Arab Emirates.
contradiction	Charlotte, Mark and Leslie are from Australia, South Korea and France respectively.	Leslie is from Australia.
contradiction	Frances, Sandra and Kathleen are from Maldives, Poland and Iceland respectively.	Kathleen is from Maldives.
contradiction	Sally, Kelly and Louis are from United Kingdom, Mexico and Ireland respectively.	Louis is from United Kingdom.
contradiction	Kenneth, Jim and Nicole are from Mexico, Bangladesh and Maldives respectively.	Nicole is from Mexico.
contradiction	Colin, Kim and Daniel are from China, Austria and Afghanistan respectively.	Daniel is from China.
contradiction	Ian, Carol and Betty are from United Kingdom, France and Israel respectively.	Betty is from United Kingdom.
contradiction	Michelle, Jay and Matthew are from Netherlands, Uruguay and Cuba respectively.	Matthew is from Netherlands.
contradiction	Elaine, Bob and Rose are from Canada, Pakistan and Indonesia respectively.	Rose is from Canada.
contradiction	Michelle, Henry and Stephen are from Maldives, South Korea and Fiji respectively.	Stephen is from Maldives.
contradiction	Laura, Alison and Tony are from India, Denmark and Uruguay respectively.	Tony is from India.
contradiction	Ben, Gary and Margaret are from Oman, Haiti and Austria respectively.	Margaret is from Oman.
contradiction	Harriet, Bruce and Alexander are from Russia, Switzerland and Mexico respectively.	Alexander is from Russia.
contradiction	Rose, Emma and Kelly are from Thailand, Cuba and Bhutan respectively.	Kelly is from Thailand.
