entailment	Kathryn is cantankerous, cowardly and one-sided.	Kathryn is one-sided.
entailment	Louis is awful, able and talented.	Louis is talented.
entailment	Charlie is callous, fiery and irascible.	Charlie is irascible.
entailment	Paul is snazzy, sour and sophisticated.	Paul is sophisticated.
entailment	Walter is great, immodest and eager.	Walter is eager.
entailment	James is industrious, fastidious and sneering.	James is sneering.
entailment	Charles is one-sided, indiscreet and pensive.	Charles is pensive.
entailment	Don is competent, idiotic and sensible.	Don is sensible.
entailment	Virginia is sassy, cruel and peevish.	Virginia is peevish.
entailment	Thomas is resourceful, cowardly and dowdy.	Thomas is dowdy.
entailment	Jerry is tactful, shy and excitable.	Jerry is excitable.
entailment	Arthur is conceited, unaffected and fastidious.	Arthur is fastidious.
entailment	Kelly is unemotional, venal and reclusive.	Kelly is reclusive.
entailment	Billy is wary, childish and callous.	Billy is callous.
entailment	Jason is hateful, respected and clean.	Jason is clean.
entailment	Evelyn is listless, meticulous and devoted.	Evelyn is devoted.
entailment	Jonathan is reliable, distrustful and quarrelsome.	Jonathan is quarrelsome.
entailment	Chris is leery, enterprising and sleepy.	Chris is sleepy.
entailment	Paul is outspoken, well-behaved and popular.	Paul is popular.
entailment	Nicole is maternal, lithe and obliging.	Nicole is obliging.
entailment	Tony is charming, below average and adventurous.	Tony is adventurous.
entailment	Andrew is elfin, old-fashioned and groggy.	Andrew is groggy.
entailment	Edwin is balanced, tactless and maternal.	Edwin is maternal.
entailment	Frederick is clever, impatient and egotistical.	Frederick is egotistical.
entailment	Alan is unbalanced, talented and indefatigable.	Alan is indefatigable.
entailment	Steve is cranky, well-respected and resourceful.	Steve is resourceful.
entailment	Al is level-headed, dainty and below average.	Al is below average.
entailment	Dick is inspiring, delightful and shy.	Dick is shy.
entailment	Eleanor is disruptive, deep and lethargic.	Eleanor is lethargic.
entailment	Betty is reassuring, lethargic and cautious.	Betty is cautious.
entailment	Harold is lame, unstable and unpopular.	Harold is unpopular.
entailment	Michelle is chic, subtle and lithe.	Michelle is lithe.
entailment	Kathleen is enthusiastic, enterprising and gentle.	Kathleen is gentle.
entailment	Christopher is egotistical, patient and beneficent.	Christopher is beneficent.
entailment	Benjamin is zealous, lovely and popular.	Benjamin is popular.
entailment	Larry is immodest, flabby and sad.	Larry is sad.
entailment	Charles is chic, prudent and stable.	Charles is stable.
entailment	Alexandra is wonderful, dutiful and slothful.	Alexandra is slothful.
entailment	Fiona is fiery, irascible and inexperienced.	Fiona is inexperienced.
entailment	Don is cynical, natural and discerning.	Don is discerning.
entailment	Sharon is cool, efficient and even-tempered.	Sharon is even-tempered.
entailment	Jeff is silly, irritating and paternalistic.	Jeff is paternalistic.
entailment	Roger is industrious, normal and obnoxious.	Roger is obnoxious.
entailment	Janet is level-headed, pretty and callous.	Janet is callous.
entailment	Eleanor is cordial, deep and passive.	Eleanor is passive.
entailment	Maria is assertive, impatient and thinking.	Maria is thinking.
entailment	Rebecca is watchful, groggy and irascible.	Rebecca is irascible.
entailment	Lynn is zealous, testy and delightful.	Lynn is delightful.
entailment	Jay is uncertain, naive and impressionable.	Jay is impressionable.
entailment	Roy is impressive, able and unguarded.	Roy is unguarded.
entailment	Simon is responsible, petulant and dirty.	Simon is dirty.
entailment	Charles is illogical, well-intentioned and composed.	Charles is composed.
entailment	Arthur is grouchy, unguarded and generous.	Arthur is generous.
entailment	Anthony is industrious, ugly and inspiring.	Anthony is inspiring.
entailment	Anthony is great, intelligent and groggy.	Anthony is groggy.
entailment	Charlie is hesitant, uncooperative and shrewd.	Charlie is shrewd.
entailment	Albert is musical, peevish and sophisticated.	Albert is sophisticated.
entailment	Carol is impressive, inconsistent and unfriendly.	Carol is unfriendly.
entailment	Evelyn is sensible, irritable and snazzy.	Evelyn is snazzy.
entailment	Alex is evasive, flaky and distant.	Alex is distant.
entailment	Jennifer is clean, slovenly and inventive.	Jennifer is inventive.
entailment	Marie is content, direct and beneficent.	Marie is beneficent.
entailment	Christopher is provocative, fastidious and courageous.	Christopher is courageous.
entailment	Scott is fussy, vulnerable and quarrelsome.	Scott is quarrelsome.
entailment	Sam is ambitious, paternalistic and unmotivated.	Sam is unmotivated.
entailment	Helen is dreary, mean and excellent.	Helen is excellent.
entailment	Bruce is confident, resourceful and slow.	Bruce is slow.
entailment	Keith is natural, eager and sad.	Keith is sad.
entailment	Thomas is frank, crafty and sulky.	Thomas is sulky.
entailment	Patrick is chic, cooperative and pretty.	Patrick is pretty.
entailment	Eleanor is courageous, lean and peaceful.	Eleanor is peaceful.
entailment	Tim is brilliant, awesome and enthusiastic.	Tim is enthusiastic.
entailment	Francis is provocative, amusing and meddlesome.	Francis is meddlesome.
entailment	Kathryn is hysterical, meddlesome and subtle.	Kathryn is subtle.
entailment	Daniel is querulous, flaky and nasty.	Daniel is nasty.
entailment	Marie is evasive, amusing and considerate.	Marie is considerate.
entailment	Alison is well-respected, spiteful and inconsiderate.	Alison is inconsiderate.
entailment	Dorothy is impressive, slow and conceited.	Dorothy is conceited.
entailment	Dick is fabulous, excitable and critical.	Dick is critical.
entailment	George is reserved, tired and nervous.	George is nervous.
entailment	Michelle is crafty, fussy and volcanic.	Michelle is volcanic.
entailment	Tom is hateful, drunk and unwilling.	Tom is unwilling.
entailment	Alison is sophisticated, plucky and plain-speaking.	Alison is plain-speaking.
entailment	Evelyn is venal, civil and blunt.	Evelyn is blunt.
entailment	Laura is exacting, hateful and curious.	Laura is curious.
entailment	Edward is capable, churlish and morose.	Edward is morose.
entailment	Virginia is well-intentioned, unfriendly and gentle.	Virginia is gentle.
entailment	Melissa is condescending, practical and impatient.	Melissa is impatient.
entailment	Betty is easy-going, sentimental and passionate.	Betty is passionate.
entailment	Ian is unwilling, well-developed and gentle.	Ian is gentle.
entailment	Jim is provocative, dowdy and deft.	Jim is deft.
entailment	Bill is cooperative, egotistical and sad.	Bill is sad.
entailment	Sue is short-tempered, curious and deft.	Sue is deft.
entailment	Jill is noisy, subtle and affectionate.	Jill is affectionate.
entailment	Brian is condescending, awful and alert.	Brian is alert.
entailment	Brian is noisy, brave and condescending.	Brian is condescending.
entailment	Charlie is tactless, distraught and buff.	Charlie is buff.
entailment	Larry is mercurial, plain and obnoxious.	Larry is obnoxious.
entailment	Janet is capable, superficial and imperturbable.	Janet is imperturbable.
entailment	Martin is powerful, illogical and impatient.	Martin is impatient.
entailment	Mike is quick-tempered, ambitious and meticulous.	Mike is meticulous.
entailment	Maria is assertive, dependent and insensitive.	Maria is insensitive.
entailment	Barbara is sullen, ridiculous and amusing.	Barbara is amusing.
entailment	Mark is pretty, grouchy and immodest.	Mark is immodest.
entailment	Martin is dramatic, helpful and illogical.	Martin is illogical.
entailment	Jim is steady, careless and shy.	Jim is shy.
entailment	Joe is sedate, uncooperative and eager.	Joe is eager.
entailment	Lauren is motivated, spirited and condescending.	Lauren is condescending.
entailment	Hugh is groggy, sleepy and morose.	Hugh is morose.
entailment	Marie is moronic, methodical and crass.	Marie is crass.
entailment	Walter is nervous, exacting and delightful.	Walter is delightful.
entailment	Stephen is hesitant, stable and cautious.	Stephen is cautious.
entailment	Johnny is attentive, egotistical and beneficent.	Johnny is beneficent.
entailment	Robin is crass, impetuous and insensitive.	Robin is insensitive.
entailment	Linda is querulous, considerate and exacting.	Linda is exacting.
entailment	Lisa is immature, delightful and insensitive.	Lisa is insensitive.
entailment	Heather is slight, resigned and cold.	Heather is cold.
entailment	Ben is unthinking, silly and frank.	Ben is frank.
entailment	Simon is nervous, logical and immodest.	Simon is immodest.
entailment	Greg is cheerful, dirty and flaky.	Greg is flaky.
entailment	Jennifer is patient, stable and lithe.	Jennifer is lithe.
entailment	Frances is artistic, unstable and restless.	Frances is restless.
entailment	Sally is irritating, caustic and devoted.	Sally is devoted.
entailment	Louise is generous, cheerful and lithe.	Louise is lithe.
entailment	Jean is unpopular, resourceful and boisterous.	Jean is boisterous.
entailment	Louise is obliging, positive and average.	Louise is average.
entailment	Don is slovenly, plain-speaking and circumspect.	Don is circumspect.
entailment	Simon is obliging, disruptive and ugly.	Simon is ugly.
entailment	Nancy is nervous, civil and sensitive.	Nancy is sensitive.
entailment	Stephen is friendly, clean and joyous.	Stephen is joyous.
entailment	Charles is depressed, methodical and disagreeable.	Charles is disagreeable.
entailment	Dorothy is polite, sensitive and short-tempered.	Dorothy is short-tempered.
entailment	William is petulant, well-respected and gluttonous.	William is gluttonous.
entailment	Laura is dainty, mean and even-tempered.	Laura is even-tempered.
entailment	Alison is intolerant, watchful and idle.	Alison is idle.
entailment	Sarah is charming, volcanic and guarded.	Sarah is guarded.
entailment	Angela is plain, slow and insensitive.	Angela is insensitive.
entailment	Katie is petulant, wonderful and suspicious.	Katie is suspicious.
entailment	Joe is irritating, brilliant and efficient.	Joe is efficient.
entailment	Carol is affectionate, fussy and crass.	Carol is crass.
entailment	Adam is sophisticated, unwilling and thinking.	Adam is thinking.
entailment	Robert is unfriendly, dextrous and inconsistent.	Robert is inconsistent.
entailment	Johnny is indefatigable, sneering and ostentatious.	Johnny is ostentatious.
entailment	Gary is affectionate, above average and dutiful.	Gary is dutiful.
entailment	Ed is mild, unbalanced and awful.	Ed is awful.
entailment	John is enthusiastic, morose and unpopular.	John is unpopular.
entailment	Cynthia is soulful, impulsive and demure.	Cynthia is demure.
entailment	Christopher is polite, crafty and imaginative.	Christopher is imaginative.
entailment	Ruth is discreet, balanced and agile.	Ruth is agile.
entailment	Paul is conscientious, intolerant and short-tempered.	Paul is short-tempered.
entailment	Jeff is demonic, enterprising and picky.	Jeff is picky.
entailment	Sharon is ugly, serious and listless.	Sharon is listless.
entailment	Kathleen is slow, jovial and childish.	Kathleen is childish.
entailment	Ed is mean, sharp and prudent.	Ed is prudent.
entailment	Roy is lethargic, dutiful and staid.	Roy is staid.
entailment	Benjamin is plain-speaking, one-sided and able.	Benjamin is able.
entailment	Bill is tactful, persnickety and inventive.	Bill is inventive.
entailment	Bob is lame, exacting and beautiful.	Bob is beautiful.
entailment	Rose is emotional, devoted and good.	Rose is good.
entailment	Joan is cautious, unguarded and agreeable.	Joan is agreeable.
entailment	Nick is somber, friendly and beautiful.	Nick is beautiful.
entailment	Carolyn is easy-going, steady and clever.	Carolyn is clever.
entailment	Frances is thoughtless, illogical and steady.	Frances is steady.
entailment	Fred is serene, warm and delightful.	Fred is delightful.
entailment	Kathy is excitable, irritable and bright.	Kathy is bright.
entailment	Alex is unmotivated, hot-headed and modest.	Alex is modest.
entailment	Joe is unwilling, moronic and judgmental.	Joe is judgmental.
entailment	Mary is emotional, judgmental and silly.	Mary is silly.
entailment	Joseph is great, boisterous and hysterical.	Joseph is hysterical.
entailment	Jean is sedate, cooperative and somber.	Jean is somber.
entailment	David is steady, emotional and artificial.	David is artificial.
entailment	Scott is demonic, immature and enthusiastic.	Scott is enthusiastic.
entailment	Charles is one-sided, incisive and joyous.	Charles is joyous.
entailment	Judy is clever, impressive and uncooperative.	Judy is uncooperative.
entailment	Evelyn is sharp, plucky and lazy.	Evelyn is lazy.
entailment	Lisa is paternal, cowardly and affectionate.	Lisa is affectionate.
entailment	Elizabeth is elfin, dreary and imaginative.	Elizabeth is imaginative.
entailment	Janet is pensive, peaceful and numb.	Janet is numb.
entailment	Evelyn is disruptive, deferential and one-sided.	Evelyn is one-sided.
entailment	Henry is inexperienced, old-fashioned and cowardly.	Henry is cowardly.
entailment	Julie is reliable, unthinking and above average.	Julie is above average.
entailment	Jay is conscientious, striking and resigned.	Jay is resigned.
entailment	Michael is well-developed, analytical and sullen.	Michael is sullen.
entailment	Marilyn is boisterous, uncertain and competent.	Marilyn is competent.
entailment	Marie is funny, inconsiderate and meddlesome.	Marie is meddlesome.
entailment	Kelly is competent, illogical and industrious.	Kelly is industrious.
entailment	Emma is uncertain, unhelpful and sensible.	Emma is sensible.
entailment	Jay is obnoxious, hateful and lethargic.	Jay is lethargic.
entailment	Diana is beneficent, sedate and indefatigable.	Diana is indefatigable.
entailment	Jimmy is good, tolerant and crabby.	Jimmy is crabby.
entailment	Martha is unpleasant, well-developed and callous.	Martha is callous.
entailment	Edward is listless, indolent and cordial.	Edward is cordial.
entailment	Pamela is impulsive, brave and negative.	Pamela is negative.
entailment	Kevin is respected, critical and querulous.	Kevin is querulous.
entailment	Donna is grave, balanced and sturdy.	Donna is sturdy.
entailment	Wendy is slow, cold and zealous.	Wendy is zealous.
entailment	Louis is passionate, passive and reliable.	Louis is reliable.
entailment	Ray is alert, modest and sweet.	Ray is sweet.
entailment	Stephanie is passive, amusing and suspicious.	Stephanie is suspicious.
entailment	Steven is coherent, sharp and distant.	Steven is distant.
entailment	Martin is resentful, condescending and experienced.	Martin is experienced.
entailment	Ellen is warmhearted, sophisticated and childlike.	Ellen is childlike.
entailment	Anthony is polite, motivated and lethargic.	Anthony is lethargic.
entailment	Donald is naive, outspoken and old-fashioned.	Donald is old-fashioned.
entailment	Edward is competent, groggy and enterprising.	Edward is enterprising.
entailment	Roger is lively, bright and buff.	Roger is buff.
entailment	Ryan is lovely, cordial and listless.	Ryan is listless.
entailment	Philip is sentimental, grave and crabby.	Philip is crabby.
entailment	Albert is buff, lovable and demonic.	Albert is demonic.
entailment	Martin is deep, sassy and sulky.	Martin is sulky.
entailment	Colin is impetuous, groggy and lethargic.	Colin is lethargic.
entailment	Eleanor is passive, incompetent and impetuous.	Eleanor is impetuous.
entailment	Ruth is dutiful, outgoing and cold.	Ruth is cold.
entailment	Alex is warm, churlish and dependent.	Alex is dependent.
entailment	Jim is cordial, intelligent and miserable.	Jim is miserable.
entailment	Laura is idiotic, discreet and reserved.	Laura is reserved.
entailment	Harold is selfish, demonic and old-fashioned.	Harold is old-fashioned.
entailment	Mary is cordial, hesitant and helpful.	Mary is helpful.
entailment	Jason is weak, powerful and volcanic.	Jason is volcanic.
entailment	Lauren is responsible, watchful and quiet.	Lauren is quiet.
entailment	David is grave, capable and listless.	David is listless.
entailment	Jean is plain, blue and proficient.	Jean is proficient.
entailment	Claire is decisive, alert and generous.	Claire is generous.
entailment	Jeff is ridiculous, reliable and groggy.	Jeff is groggy.
entailment	Jimmy is supercilious, amusing and reassuring.	Jimmy is reassuring.
entailment	Kim is inconsistent, impressive and leery.	Kim is leery.
entailment	Linda is chic, interesting and churlish.	Linda is churlish.
entailment	Jean is slothful, sneering and cranky.	Jean is cranky.
entailment	Paul is reclusive, ugly and keen.	Paul is keen.
entailment	Jerry is stupid, punctual and dreary.	Jerry is dreary.
entailment	Helen is thoughtful, apprehensive and imperturbable.	Helen is imperturbable.
entailment	Victoria is undependable, inventive and affectionate.	Victoria is affectionate.
entailment	Matthew is impulsive, silly and ugly.	Matthew is ugly.
entailment	Bob is funny, punctual and experienced.	Bob is experienced.
entailment	Rachel is grouchy, alert and spirited.	Rachel is spirited.
entailment	Charlotte is candid, fussy and kind.	Charlotte is kind.
entailment	Jill is helpful, stoic and plain-speaking.	Jill is plain-speaking.
entailment	Patrick is groggy, pensive and deep.	Patrick is deep.
entailment	Maria is cautious, resigned and average.	Maria is average.
entailment	Angela is clever, provocative and mild.	Angela is mild.
entailment	Brian is cruel, flabby and plain.	Brian is plain.
entailment	Harry is incompetent, able and slight.	Harry is slight.
entailment	Robert is inconsiderate, enterprising and indiscreet.	Robert is indiscreet.
entailment	Lynn is dull, childlike and candid.	Lynn is candid.
entailment	Al is able, snazzy and judgmental.	Al is judgmental.
entailment	Janet is meticulous, wonderful and ridiculous.	Janet is ridiculous.
entailment	Claire is energetic, irritable and conceited.	Claire is conceited.
entailment	Lynn is well-rounded, serene and outspoken.	Lynn is outspoken.
entailment	Jessica is level-headed, steady and frank.	Jessica is frank.
entailment	Albert is peaceful, energetic and cold.	Albert is cold.
entailment	Cynthia is friendly, lame and irritable.	Cynthia is irritable.
entailment	Ed is able, bright and short-tempered.	Ed is short-tempered.
entailment	Chris is love-lorn, pensive and reassuring.	Chris is reassuring.
entailment	Rachel is nasty, intelligent and self-assured.	Rachel is self-assured.
entailment	Ron is quarrelsome, peaceful and inactive.	Ron is inactive.
entailment	Frank is careless, discerning and agreeable.	Frank is agreeable.
entailment	Bob is unwilling, noisy and subtle.	Bob is subtle.
entailment	Scott is snazzy, uncooperative and persnickety.	Scott is persnickety.
entailment	Bob is cantankerous, childlike and grouchy.	Bob is grouchy.
entailment	Judy is resourceful, childish and imperturbable.	Judy is imperturbable.
entailment	Eric is good, childlike and composed.	Eric is composed.
entailment	Jack is apprehensive, clever and frank.	Jack is frank.
entailment	Carolyn is vulnerable, artistic and disruptive.	Carolyn is disruptive.
entailment	Florence is proficient, cantankerous and soulless.	Florence is soulless.
entailment	William is unemotional, amusing and caustic.	William is caustic.
entailment	Walter is composed, curious and clean.	Walter is clean.
entailment	Harriet is inconsistent, zealous and slovenly.	Harriet is slovenly.
entailment	Charlie is depressed, nasty and stern.	Charlie is stern.
entailment	Mike is unstable, unemotional and even-tempered.	Mike is even-tempered.
entailment	Sharon is easy-going, caustic and responsible.	Sharon is responsible.
entailment	Henry is quiet, sneering and distant.	Henry is distant.
entailment	Dick is sedate, tranquil and diligent.	Dick is diligent.
entailment	Steve is disagreeable, proficient and unmotivated.	Steve is unmotivated.
entailment	Charles is fervent, amiable and supercilious.	Charles is supercilious.
entailment	Simon is great, callous and attentive.	Simon is attentive.
entailment	Harry is surly, querulous and experienced.	Harry is experienced.
entailment	Edith is analytical, devoted and flashy.	Edith is flashy.
entailment	Alex is impetuous, intelligent and proficient.	Alex is proficient.
entailment	Bobby is tolerant, imaginative and blue.	Bobby is blue.
entailment	Bill is quiet, thoughtless and blue.	Bill is blue.
entailment	Matt is stern, powerful and artistic.	Matt is artistic.
entailment	Janet is sulky, civil and condescending.	Janet is condescending.
entailment	Jerry is beautiful, plain-speaking and mild.	Jerry is mild.
entailment	Matt is zealous, inexperienced and efficient.	Matt is efficient.
entailment	Ben is ostentatious, mean and petulant.	Ben is petulant.
entailment	Julie is impetuous, buff and unreliable.	Julie is unreliable.
entailment	Jean is sleepy, persevering and motivated.	Jean is motivated.
entailment	Katherine is indiscreet, unguarded and cranky.	Katherine is cranky.
