contradiction	Mike and Tom are from Qatar and South Korea respectively.	Tom is from Qatar.
contradiction	Julia and Harriet are from India and Poland respectively.	Harriet is from India.
contradiction	Carl and Jack are from Hungary and United States of America respectively.	Jack is from Hungary.
contradiction	Francis and Howard are from Iraq and Mexico respectively.	Howard is from Iraq.
contradiction	Michael and Harry are from Cuba and Zimbabwe respectively.	Harry is from Cuba.
contradiction	Frances and Alex are from Ecuador and Malaysia respectively.	Alex is from Ecuador.
contradiction	Linda and Jim are from Thailand and Haiti respectively.	Jim is from Thailand.
contradiction	Diane and Bobby are from South Korea and Philippines respectively.	Bobby is from South Korea.
contradiction	Tom and Albert are from Taiwan and India respectively.	Albert is from Taiwan.
contradiction	James and Harriet are from Denmark and Belarus respectively.	Harriet is from Denmark.
contradiction	Lauren and Ralph are from Ukraine and Israel respectively.	Ralph is from Ukraine.
contradiction	Keith and Ron are from Germany and Saudi Arabia respectively.	Ron is from Germany.
contradiction	Carol and Don are from Netherlands and Iceland respectively.	Don is from Netherlands.
contradiction	Harriet and Jane are from Colombia and Indonesia respectively.	Jane is from Colombia.
contradiction	Amy and Alex are from Cuba and Belarus respectively.	Alex is from Cuba.
contradiction	Susan and Maria are from India and Argentina respectively.	Maria is from India.
contradiction	Arthur and Christopher are from Libya and Saudi Arabia respectively.	Christopher is from Libya.
contradiction	Alex and Mark are from Poland and Austria respectively.	Mark is from Poland.
contradiction	Kathleen and Robert are from Singapore and Saudi Arabia respectively.	Robert is from Singapore.
contradiction	Elizabeth and Diana are from Oman and Russia respectively.	Diana is from Oman.
contradiction	Catherine and Paul are from Switzerland and Argentina respectively.	Paul is from Switzerland.
contradiction	Ruth and Ron are from Italy and Russia respectively.	Ron is from Italy.
contradiction	Bruce and Kathy are from Mexico and Portugal respectively.	Kathy is from Mexico.
contradiction	Ralph and Alice are from Denmark and Pakistan respectively.	Alice is from Denmark.
contradiction	Sandra and Ryan are from Qatar and Belarus respectively.	Ryan is from Qatar.
contradiction	Edwin and Sophie are from Zimbabwe and France respectively.	Sophie is from Zimbabwe.
contradiction	Nicole and Jay are from Japan and Belarus respectively.	Jay is from Japan.
contradiction	Chris and Tom are from Belgium and South Korea respectively.	Tom is from Belgium.
contradiction	Annie and Wendy are from Haiti and Iraq respectively.	Wendy is from Haiti.
contradiction	Colin and Ed are from Laos and North Korea respectively.	Ed is from Laos.
contradiction	Andrea and Carolyn are from Ecuador and Ukraine respectively.	Carolyn is from Ecuador.
contradiction	Don and Charlotte are from Ireland and South Korea respectively.	Charlotte is from Ireland.
contradiction	Marie and Walter are from France and Afghanistan respectively.	Walter is from France.
contradiction	James and Samuel are from Australia and Cuba respectively.	Samuel is from Australia.
contradiction	Julie and Johnny are from Ghana and Ecuador respectively.	Johnny is from Ghana.
contradiction	Richard and Colin are from Belgium and Pakistan respectively.	Colin is from Belgium.
contradiction	Ray and Louis are from Taiwan and Egypt respectively.	Louis is from Taiwan.
contradiction	Dorothy and Richard are from Laos and Thailand respectively.	Richard is from Laos.
contradiction	Andrew and Diane are from Hungary and Fiji respectively.	Diane is from Hungary.
contradiction	Peter and Diana are from Brazil and Thailand respectively.	Diana is from Brazil.
contradiction	Suzanne and Roy are from Cuba and France respectively.	Roy is from Cuba.
contradiction	Amanda and Pamela are from Ghana and Israel respectively.	Pamela is from Ghana.
contradiction	Harriet and Katherine are from Belarus and Brazil respectively.	Katherine is from Belarus.
contradiction	Paul and Mary are from Greece and Thailand respectively.	Mary is from Greece.
contradiction	Paul and George are from Qatar and Austria respectively.	George is from Qatar.
contradiction	Dave and Jessica are from United States of America and Uruguay respectively.	Jessica is from United States of America.
contradiction	Mark and Carolyn are from Qatar and Ukraine respectively.	Carolyn is from Qatar.
contradiction	Kevin and Virginia are from China and Iceland respectively.	Virginia is from China.
contradiction	Ray and Albert are from Mexico and Russia respectively.	Albert is from Mexico.
contradiction	Chris and Charlotte are from France and Vietnam respectively.	Charlotte is from France.
contradiction	Wendy and Eric are from North Korea and Singapore respectively.	Eric is from North Korea.
contradiction	Joan and Fiona are from Egypt and Mexico respectively.	Fiona is from Egypt.
contradiction	Elizabeth and Donna are from Malaysia and Poland respectively.	Donna is from Malaysia.
contradiction	Paul and Sally are from Saudi Arabia and Hungary respectively.	Sally is from Saudi Arabia.
contradiction	Don and Andrew are from Ukraine and Zimbabwe respectively.	Andrew is from Ukraine.
contradiction	Alexander and Joe are from Italy and New Zealand respectively.	Joe is from Italy.
contradiction	Colin and Fred are from Ecuador and Oman respectively.	Fred is from Ecuador.
contradiction	Barbara and Andrea are from Portugal and Vietnam respectively.	Andrea is from Portugal.
contradiction	Charles and Stephanie are from Uruguay and Brazil respectively.	Stephanie is from Uruguay.
contradiction	Adam and Katherine are from Chile and Ireland respectively.	Katherine is from Chile.
contradiction	Dick and Chris are from Poland and Pakistan respectively.	Chris is from Poland.
contradiction	Claire and William are from Ukraine and Denmark respectively.	William is from Ukraine.
contradiction	Philip and Frank are from Iceland and Afghanistan respectively.	Frank is from Iceland.
contradiction	Jim and Patricia are from New Zealand and France respectively.	Patricia is from New Zealand.
contradiction	Harriet and Marie are from Iran and China respectively.	Marie is from Iran.
contradiction	Ryan and Maria are from Israel and Iraq respectively.	Maria is from Israel.
contradiction	Pamela and Jean are from France and Greece respectively.	Jean is from France.
contradiction	Dan and Cynthia are from Georgia and Austria respectively.	Cynthia is from Georgia.
contradiction	Al and Albert are from Philippines and Germany respectively.	Albert is from Philippines.
contradiction	Emily and Greg are from Singapore and United Kingdom respectively.	Greg is from Singapore.
contradiction	Jean and Suzanne are from Sweden and United Kingdom respectively.	Suzanne is from Sweden.
contradiction	Carl and Lisa are from United States of America and Portugal respectively.	Lisa is from United States of America.
contradiction	Caroline and Harriet are from Germany and Malaysia respectively.	Harriet is from Germany.
contradiction	Sophie and Lynn are from Ireland and Russia respectively.	Lynn is from Ireland.
contradiction	Al and Hugh are from Fiji and Mexico respectively.	Hugh is from Fiji.
contradiction	Jay and Walter are from Libya and Nepal respectively.	Walter is from Libya.
contradiction	Christine and Donald are from Philippines and Finland respectively.	Donald is from Philippines.
contradiction	Edward and Julie are from Ireland and Japan respectively.	Julie is from Ireland.
contradiction	Julia and Dick are from Oman and Japan respectively.	Dick is from Oman.
contradiction	Jeff and Rebecca are from Austria and Indonesia respectively.	Rebecca is from Austria.
contradiction	Francis and Elaine are from Saudi Arabia and North Korea respectively.	Elaine is from Saudi Arabia.
contradiction	Ryan and Bobby are from Israel and Ecuador respectively.	Bobby is from Israel.
contradiction	Judith and Charlotte are from Ghana and Hungary respectively.	Charlotte is from Ghana.
contradiction	Maria and Dan are from United States of America and Georgia respectively.	Dan is from United States of America.
contradiction	Leslie and Caroline are from Belgium and Ghana respectively.	Caroline is from Belgium.
contradiction	Christine and Charlotte are from Ireland and United Kingdom respectively.	Charlotte is from Ireland.
contradiction	Frank and Dave are from Israel and Iraq respectively.	Dave is from Israel.
contradiction	Philip and Nick are from United States of America and Cuba respectively.	Nick is from United States of America.
contradiction	Gary and Amanda are from Nepal and Poland respectively.	Amanda is from Nepal.
contradiction	Ellen and Louis are from New Zealand and Maldives respectively.	Louis is from New Zealand.
contradiction	Jay and Julie are from Oman and Ecuador respectively.	Julie is from Oman.
contradiction	Eric and Joan are from United Arab Emirates and Vietnam respectively.	Joan is from United Arab Emirates.
contradiction	Christopher and Leslie are from Poland and Vietnam respectively.	Leslie is from Poland.
contradiction	Fiona and Kate are from Thailand and Ukraine respectively.	Kate is from Thailand.
contradiction	Frank and Marilyn are from Belgium and Ecuador respectively.	Marilyn is from Belgium.
contradiction	Brian and Louis are from Canada and Israel respectively.	Louis is from Canada.
contradiction	Donald and Frances are from Pakistan and Qatar respectively.	Frances is from Pakistan.
contradiction	Julie and Steve are from Egypt and Pakistan respectively.	Steve is from Egypt.
contradiction	Jeff and Sarah are from Singapore and Malaysia respectively.	Sarah is from Singapore.
contradiction	Rachel and George are from Iraq and Hungary respectively.	George is from Iraq.
contradiction	Jason and Jim are from Uruguay and China respectively.	Jim is from Uruguay.
contradiction	Anna and Sue are from Belarus and Vietnam respectively.	Sue is from Belarus.
contradiction	Alan and Christopher are from India and Azerbaijan respectively.	Christopher is from India.
contradiction	Donald and Sarah are from Afghanistan and Hungary respectively.	Sarah is from Afghanistan.
contradiction	Gary and Christopher are from Ghana and North Korea respectively.	Christopher is from Ghana.
contradiction	Diana and Julia are from Portugal and New Zealand respectively.	Julia is from Portugal.
contradiction	Diane and Katie are from Laos and Australia respectively.	Katie is from Laos.
contradiction	Fiona and Ralph are from Chile and Maldives respectively.	Ralph is from Chile.
contradiction	Karen and Dorothy are from Cuba and Georgia respectively.	Dorothy is from Cuba.
contradiction	Jessica and Matt are from Belarus and Ecuador respectively.	Matt is from Belarus.
contradiction	Jim and Benjamin are from Zimbabwe and Singapore respectively.	Benjamin is from Zimbabwe.
contradiction	Ben and Janet are from Ireland and North Korea respectively.	Janet is from Ireland.
contradiction	Bob and Tony are from Libya and Indonesia respectively.	Tony is from Libya.
contradiction	Martha and Michelle are from Georgia and Turkey respectively.	Michelle is from Georgia.
contradiction	Ian and Harriet are from Iraq and Thailand respectively.	Harriet is from Iraq.
contradiction	Marie and Larry are from Israel and Zimbabwe respectively.	Larry is from Israel.
contradiction	Steven and Marie are from Maldives and Oman respectively.	Marie is from Maldives.
contradiction	Simon and Sue are from Canada and Indonesia respectively.	Sue is from Canada.
contradiction	Steven and Bob are from Ireland and Qatar respectively.	Bob is from Ireland.
contradiction	Francis and Jean are from Maldives and North Korea respectively.	Jean is from Maldives.
contradiction	Barbara and Christine are from China and Canada respectively.	Christine is from China.
contradiction	Catherine and Paul are from Sweden and Philippines respectively.	Paul is from Sweden.
contradiction	Marie and Jane are from Egypt and Greece respectively.	Jane is from Egypt.
contradiction	Kevin and Stephen are from Austria and Colombia respectively.	Stephen is from Austria.
contradiction	Greg and Bob are from Ukraine and Fiji respectively.	Bob is from Ukraine.
contradiction	Stephen and Harriet are from Brazil and Indonesia respectively.	Harriet is from Brazil.
contradiction	James and Sam are from Turkey and India respectively.	Sam is from Turkey.
contradiction	Bruce and Charles are from Sweden and Cuba respectively.	Charles is from Sweden.
contradiction	Diana and Lucy are from Sweden and Singapore respectively.	Lucy is from Sweden.
contradiction	Rachel and Julia are from Ireland and Qatar respectively.	Julia is from Ireland.
contradiction	Wendy and Robert are from Maldives and Nepal respectively.	Robert is from Maldives.
contradiction	Jane and Fred are from Thailand and Turkey respectively.	Fred is from Thailand.
contradiction	Samuel and Melissa are from Italy and Indonesia respectively.	Melissa is from Italy.
contradiction	Andrew and Donald are from Ireland and Canada respectively.	Donald is from Ireland.
contradiction	Annie and Jessica are from Japan and India respectively.	Jessica is from Japan.
contradiction	Lisa and Frederick are from United Arab Emirates and Germany respectively.	Frederick is from United Arab Emirates.
contradiction	Emma and Alexandra are from Oman and Haiti respectively.	Alexandra is from Oman.
contradiction	Amy and Billy are from Oman and India respectively.	Billy is from Oman.
contradiction	Sam and Kim are from Maldives and Chile respectively.	Kim is from Maldives.
contradiction	Christine and Alice are from Qatar and Sweden respectively.	Alice is from Qatar.
contradiction	Marilyn and James are from Ecuador and Finland respectively.	James is from Ecuador.
contradiction	Claire and Jimmy are from Israel and Indonesia respectively.	Jimmy is from Israel.
contradiction	Karen and Alan are from Australia and Uruguay respectively.	Alan is from Australia.
contradiction	Laura and Emily are from Germany and Saudi Arabia respectively.	Emily is from Germany.
contradiction	Kate and Anthony are from Brazil and Qatar respectively.	Anthony is from Brazil.
contradiction	Jimmy and Deborah are from Egypt and Denmark respectively.	Deborah is from Egypt.
contradiction	Wendy and Paul are from Nepal and Belgium respectively.	Paul is from Nepal.
contradiction	Billy and Nicole are from Iceland and Bhutan respectively.	Nicole is from Iceland.
contradiction	Sara and Ryan are from Italy and Iraq respectively.	Ryan is from Italy.
contradiction	Pamela and Albert are from Netherlands and United Arab Emirates respectively.	Albert is from Netherlands.
contradiction	Charles and Louis are from Pakistan and Italy respectively.	Louis is from Pakistan.
contradiction	Jason and Harriet are from Finland and Cuba respectively.	Harriet is from Finland.
contradiction	Jonathan and Ralph are from Italy and Thailand respectively.	Ralph is from Italy.
contradiction	Julie and Cynthia are from Sweden and New Zealand respectively.	Cynthia is from Sweden.
contradiction	Kim and David are from Ireland and Hungary respectively.	David is from Ireland.
contradiction	Caroline and Sarah are from Finland and Taiwan respectively.	Sarah is from Finland.
contradiction	Arthur and Edward are from New Zealand and Austria respectively.	Edward is from New Zealand.
contradiction	Ruth and Daniel are from Libya and Georgia respectively.	Daniel is from Libya.
contradiction	Paul and Evelyn are from Denmark and Italy respectively.	Evelyn is from Denmark.
contradiction	Gary and Katherine are from France and China respectively.	Katherine is from France.
contradiction	Keith and Alexandra are from Ukraine and Switzerland respectively.	Alexandra is from Ukraine.
contradiction	Elizabeth and Thomas are from Ireland and Brazil respectively.	Thomas is from Ireland.
contradiction	Tony and Julie are from Ghana and Pakistan respectively.	Julie is from Ghana.
contradiction	Karen and Samuel are from Chile and Laos respectively.	Samuel is from Chile.
contradiction	Tim and Grace are from Italy and Singapore respectively.	Grace is from Italy.
contradiction	Angela and Wendy are from Iran and South Korea respectively.	Wendy is from Iran.
contradiction	Ray and Lauren are from India and Brazil respectively.	Lauren is from India.
contradiction	Bobby and Lawrence are from Iraq and Ghana respectively.	Lawrence is from Iraq.
contradiction	Don and James are from Oman and New Zealand respectively.	James is from Oman.
contradiction	Ron and Adam are from Hungary and Finland respectively.	Adam is from Hungary.
contradiction	Dave and Don are from Philippines and Thailand respectively.	Don is from Philippines.
contradiction	Sarah and James are from Turkey and Uruguay respectively.	James is from Turkey.
contradiction	Carol and Eric are from Taiwan and South Korea respectively.	Eric is from Taiwan.
contradiction	Carl and Kathryn are from Pakistan and Belarus respectively.	Kathryn is from Pakistan.
contradiction	Melissa and Victoria are from Argentina and Russia respectively.	Victoria is from Argentina.
contradiction	Scott and Emma are from France and Germany respectively.	Emma is from France.
contradiction	Donna and Daniel are from Austria and Philippines respectively.	Daniel is from Austria.
contradiction	Sharon and Sarah are from Austria and Zimbabwe respectively.	Sarah is from Austria.
contradiction	Dan and Caroline are from Turkey and Iran respectively.	Caroline is from Turkey.
contradiction	Alexandra and Bob are from Maldives and Azerbaijan respectively.	Bob is from Maldives.
contradiction	Ron and Charles are from United States of America and Thailand respectively.	Charles is from United States of America.
contradiction	Ann and Dick are from United States of America and Uruguay respectively.	Dick is from United States of America.
contradiction	Diane and Roy are from Netherlands and Ecuador respectively.	Roy is from Netherlands.
contradiction	Evelyn and Rebecca are from Greece and Austria respectively.	Rebecca is from Greece.
contradiction	Adam and Virginia are from Italy and France respectively.	Virginia is from Italy.
contradiction	Sam and Leslie are from Georgia and Mexico respectively.	Leslie is from Georgia.
contradiction	Barbara and Cynthia are from Maldives and Austria respectively.	Cynthia is from Maldives.
contradiction	Al and Christine are from Georgia and Haiti respectively.	Christine is from Georgia.
contradiction	Jason and Nancy are from Iraq and Denmark respectively.	Nancy is from Iraq.
contradiction	Barbara and Carl are from North Korea and Canada respectively.	Carl is from North Korea.
contradiction	Bill and Hugh are from China and Turkey respectively.	Hugh is from China.
contradiction	George and Diana are from Taiwan and Australia respectively.	Diana is from Taiwan.
contradiction	Caroline and Ruth are from Denmark and Egypt respectively.	Ruth is from Denmark.
contradiction	Amanda and Kenneth are from Bangladesh and Hungary respectively.	Kenneth is from Bangladesh.
contradiction	Alexander and Judy are from Ecuador and Japan respectively.	Judy is from Ecuador.
contradiction	Ralph and Brian are from Ukraine and Iran respectively.	Brian is from Ukraine.
contradiction	Jeff and Leslie are from Portugal and Germany respectively.	Leslie is from Portugal.
contradiction	Sophie and William are from Iraq and Ireland respectively.	William is from Iraq.
contradiction	Harold and Henry are from Thailand and India respectively.	Henry is from Thailand.
contradiction	Jay and Sharon are from Finland and Fiji respectively.	Sharon is from Finland.
contradiction	Walter and Michelle are from Philippines and Malaysia respectively.	Michelle is from Philippines.
contradiction	Caroline and Jeff are from South Korea and Bangladesh respectively.	Jeff is from South Korea.
contradiction	Jim and Chris are from Oman and Ukraine respectively.	Chris is from Oman.
contradiction	Ralph and Dave are from Ghana and Mexico respectively.	Dave is from Ghana.
contradiction	Johnny and Evelyn are from Cuba and Pakistan respectively.	Evelyn is from Cuba.
contradiction	Adam and Barbara are from Brazil and Finland respectively.	Barbara is from Brazil.
contradiction	Angela and Jean are from Egypt and Germany respectively.	Jean is from Egypt.
contradiction	Dick and Matt are from Haiti and Colombia respectively.	Matt is from Haiti.
contradiction	Helen and William are from Taiwan and Italy respectively.	William is from Taiwan.
contradiction	Roy and Sam are from United Kingdom and Qatar respectively.	Sam is from United Kingdom.
contradiction	Julie and David are from Canada and Italy respectively.	David is from Canada.
contradiction	William and Heather are from India and Austria respectively.	Heather is from India.
contradiction	Benjamin and Edward are from Iran and Zimbabwe respectively.	Edward is from Iran.
contradiction	Matt and Jean are from Germany and Australia respectively.	Jean is from Germany.
contradiction	Karen and Janet are from Afghanistan and Portugal respectively.	Janet is from Afghanistan.
contradiction	John and Karen are from Belarus and Vietnam respectively.	Karen is from Belarus.
contradiction	Tony and Kate are from Libya and New Zealand respectively.	Kate is from Libya.
