contradiction	Adam and Frances are from France and Iraq respectively.	Frances is from France.
contradiction	Jonathan and Katherine are from Ireland and Qatar respectively.	Katherine is from Ireland.
contradiction	Marie and Kate are from New Zealand and Pakistan respectively.	Kate is from New Zealand.
contradiction	Jay and Nick are from Russia and Afghanistan respectively.	Nick is from Russia.
contradiction	Daniel and Michael are from Israel and Azerbaijan respectively.	Michael is from Israel.
contradiction	Catherine and Annie are from Germany and North Korea respectively.	Annie is from Germany.
contradiction	Victoria and Louis are from Philippines and Taiwan respectively.	Louis is from Philippines.
contradiction	Ashley and Pamela are from Greece and Austria respectively.	Pamela is from Greece.
contradiction	Alice and Francis are from Ukraine and Argentina respectively.	Francis is from Ukraine.
contradiction	Frank and Brian are from Colombia and Germany respectively.	Brian is from Colombia.
contradiction	Marie and Kate are from Australia and Sweden respectively.	Kate is from Australia.
contradiction	Helen and Harold are from Philippines and Cuba respectively.	Harold is from Philippines.
contradiction	Rachel and Marie are from Germany and Oman respectively.	Marie is from Germany.
contradiction	Patricia and Louise are from Denmark and Zimbabwe respectively.	Louise is from Denmark.
contradiction	Ashley and Alice are from Argentina and Sweden respectively.	Alice is from Argentina.
contradiction	Jean and Paul are from Ukraine and Vietnam respectively.	Paul is from Ukraine.
contradiction	Diana and Jean are from China and Maldives respectively.	Jean is from China.
contradiction	Julie and Dorothy are from Austria and Nepal respectively.	Dorothy is from Austria.
contradiction	Anne and Maria are from Chile and Saudi Arabia respectively.	Maria is from Chile.
contradiction	Christine and Nick are from India and Ukraine respectively.	Nick is from India.
contradiction	Deborah and Karen are from Iceland and Belarus respectively.	Karen is from Iceland.
contradiction	Ed and Linda are from Maldives and Switzerland respectively.	Linda is from Maldives.
contradiction	Harold and Katherine are from Oman and Libya respectively.	Katherine is from Oman.
contradiction	Don and Karen are from Fiji and South Korea respectively.	Karen is from Fiji.
contradiction	Patrick and Harry are from Malaysia and Turkey respectively.	Harry is from Malaysia.
contradiction	Donna and James are from France and Singapore respectively.	James is from France.
contradiction	Lynn and Tom are from Uruguay and Laos respectively.	Tom is from Uruguay.
contradiction	Judith and Alexandra are from Switzerland and Taiwan respectively.	Alexandra is from Switzerland.
contradiction	Catherine and Edwin are from Australia and Japan respectively.	Edwin is from Australia.
contradiction	Kevin and Sandra are from Russia and Portugal respectively.	Sandra is from Russia.
contradiction	Ray and Margaret are from Netherlands and Thailand respectively.	Margaret is from Netherlands.
contradiction	Susan and Rebecca are from Nepal and United Arab Emirates respectively.	Rebecca is from Nepal.
contradiction	Florence and Bob are from Afghanistan and Ecuador respectively.	Bob is from Afghanistan.
contradiction	Mary and Matt are from Saudi Arabia and Israel respectively.	Matt is from Saudi Arabia.
contradiction	Henry and Mary are from Netherlands and Belarus respectively.	Mary is from Netherlands.
contradiction	Maria and Larry are from Azerbaijan and Nepal respectively.	Larry is from Azerbaijan.
contradiction	Leslie and John are from Libya and Taiwan respectively.	John is from Libya.
contradiction	Bill and Angela are from United Arab Emirates and Fiji respectively.	Angela is from United Arab Emirates.
contradiction	Jerry and Larry are from Canada and United Kingdom respectively.	Larry is from Canada.
contradiction	Frances and Martha are from Afghanistan and Iran respectively.	Martha is from Afghanistan.
contradiction	Eleanor and Marilyn are from Sweden and Ghana respectively.	Marilyn is from Sweden.
contradiction	Alison and Brian are from Argentina and France respectively.	Brian is from Argentina.
contradiction	Marilyn and Judith are from United Arab Emirates and Egypt respectively.	Judith is from United Arab Emirates.
contradiction	Tony and Janet are from Saudi Arabia and Singapore respectively.	Janet is from Saudi Arabia.
contradiction	Dave and Emma are from Belarus and Thailand respectively.	Emma is from Belarus.
contradiction	Dorothy and Sarah are from Brazil and Bangladesh respectively.	Sarah is from Brazil.
contradiction	Stephen and Benjamin are from Uruguay and Brazil respectively.	Benjamin is from Uruguay.
contradiction	Kathleen and Philip are from Fiji and Bhutan respectively.	Philip is from Fiji.
contradiction	Sally and Julia are from Haiti and Switzerland respectively.	Julia is from Haiti.
contradiction	Howard and Ian are from United Kingdom and Indonesia respectively.	Ian is from United Kingdom.
contradiction	Andrew and Virginia are from Bhutan and United Arab Emirates respectively.	Virginia is from Bhutan.
contradiction	Caroline and Matthew are from Georgia and Portugal respectively.	Matthew is from Georgia.
contradiction	Philip and Marie are from India and Cuba respectively.	Marie is from India.
contradiction	Samuel and Christine are from Chile and Ukraine respectively.	Christine is from Chile.
contradiction	Harriet and Nancy are from Australia and Argentina respectively.	Nancy is from Australia.
contradiction	Donald and Robert are from Netherlands and Malaysia respectively.	Robert is from Netherlands.
contradiction	Louis and Andrew are from France and Malaysia respectively.	Andrew is from France.
contradiction	Chris and Anthony are from Argentina and Ghana respectively.	Anthony is from Argentina.
contradiction	Frank and Emily are from Nepal and Canada respectively.	Emily is from Nepal.
contradiction	Chris and Elaine are from Portugal and Laos respectively.	Elaine is from Portugal.
contradiction	Richard and Sue are from Uruguay and Saudi Arabia respectively.	Sue is from Uruguay.
contradiction	Simon and Annie are from Belgium and Switzerland respectively.	Annie is from Belgium.
contradiction	Albert and Peter are from Australia and Malaysia respectively.	Peter is from Australia.
contradiction	Rachel and Simon are from Belgium and Bangladesh respectively.	Simon is from Belgium.
contradiction	Jennifer and Heather are from Netherlands and Greece respectively.	Heather is from Netherlands.
contradiction	Heather and Ed are from United Arab Emirates and Colombia respectively.	Ed is from United Arab Emirates.
contradiction	Betty and Ashley are from Singapore and United Kingdom respectively.	Ashley is from Singapore.
contradiction	Peter and Dan are from Belarus and Haiti respectively.	Dan is from Belarus.
contradiction	Charles and Laura are from Russia and Vietnam respectively.	Laura is from Russia.
contradiction	Francis and Patrick are from United States of America and United Arab Emirates respectively.	Patrick is from United States of America.
contradiction	Virginia and Andrea are from Chile and Sweden respectively.	Andrea is from Chile.
contradiction	Louis and Lauren are from Uruguay and Denmark respectively.	Lauren is from Uruguay.
contradiction	Charles and Patrick are from Russia and Maldives respectively.	Patrick is from Russia.
contradiction	Lynn and Patricia are from Indonesia and Netherlands respectively.	Patricia is from Indonesia.
contradiction	Robin and Steven are from Turkey and Belgium respectively.	Steven is from Turkey.
contradiction	Frank and Ben are from China and South Korea respectively.	Ben is from China.
contradiction	Albert and Thomas are from North Korea and Iceland respectively.	Thomas is from North Korea.
contradiction	Albert and Kim are from Malaysia and Oman respectively.	Kim is from Malaysia.
contradiction	Annie and Alfred are from Iceland and Sweden respectively.	Alfred is from Iceland.
contradiction	Joe and Elizabeth are from Oman and Maldives respectively.	Elizabeth is from Oman.
contradiction	Michael and Ken are from India and Belarus respectively.	Ken is from India.
contradiction	Tim and Roger are from Georgia and Nepal respectively.	Roger is from Georgia.
contradiction	Fiona and Steve are from China and United Arab Emirates respectively.	Steve is from China.
contradiction	Kenneth and James are from Turkey and Iraq respectively.	James is from Turkey.
contradiction	Florence and Frederick are from China and Iraq respectively.	Frederick is from China.
contradiction	Larry and Helen are from Saudi Arabia and Indonesia respectively.	Helen is from Saudi Arabia.
contradiction	Kelly and Melissa are from Nepal and Indonesia respectively.	Melissa is from Nepal.
contradiction	William and Robin are from Ukraine and Bangladesh respectively.	Robin is from Ukraine.
contradiction	Joseph and Roger are from Ireland and Italy respectively.	Roger is from Ireland.
contradiction	Louis and James are from Greece and Laos respectively.	James is from Greece.
contradiction	Ken and Don are from Ireland and Portugal respectively.	Don is from Ireland.
contradiction	Kathryn and Nicole are from Qatar and Australia respectively.	Nicole is from Qatar.
contradiction	Bobby and Katherine are from Ukraine and Germany respectively.	Katherine is from Ukraine.
contradiction	Matthew and Martha are from Saudi Arabia and Egypt respectively.	Martha is from Saudi Arabia.
contradiction	Diana and Dick are from India and Denmark respectively.	Dick is from India.
contradiction	Grace and Larry are from Ecuador and Saudi Arabia respectively.	Larry is from Ecuador.
contradiction	Steven and Diane are from Thailand and Bangladesh respectively.	Diane is from Thailand.
contradiction	David and Mark are from Colombia and United Kingdom respectively.	Mark is from Colombia.
contradiction	Sophie and Carl are from Oman and Libya respectively.	Carl is from Oman.
contradiction	Laura and Kelly are from Japan and Egypt respectively.	Kelly is from Japan.
contradiction	Tim and Tom are from Singapore and Taiwan respectively.	Tom is from Singapore.
contradiction	Louis and Fiona are from New Zealand and Fiji respectively.	Fiona is from New Zealand.
contradiction	Kelly and Kim are from Indonesia and Philippines respectively.	Kim is from Indonesia.
contradiction	Stephanie and Jean are from Denmark and Indonesia respectively.	Jean is from Denmark.
contradiction	Adam and George are from China and Nepal respectively.	George is from China.
contradiction	Greg and Bobby are from Saudi Arabia and Denmark respectively.	Bobby is from Saudi Arabia.
contradiction	Johnny and Patrick are from Iran and Zimbabwe respectively.	Patrick is from Iran.
contradiction	Dick and Maria are from Denmark and Hungary respectively.	Maria is from Denmark.
contradiction	Janet and Emily are from Switzerland and Laos respectively.	Emily is from Switzerland.
contradiction	Alfred and Julia are from Mexico and Russia respectively.	Julia is from Mexico.
contradiction	Jeff and Roy are from Indonesia and Mexico respectively.	Roy is from Indonesia.
contradiction	Patrick and Christopher are from Taiwan and Italy respectively.	Christopher is from Taiwan.
contradiction	Janet and Arthur are from Bhutan and Oman respectively.	Arthur is from Bhutan.
contradiction	Ellen and Marie are from Indonesia and Saudi Arabia respectively.	Marie is from Indonesia.
contradiction	Jessica and Ruth are from France and Nepal respectively.	Ruth is from France.
contradiction	Charles and Julie are from China and Pakistan respectively.	Julie is from China.
contradiction	Benjamin and Alfred are from Poland and Turkey respectively.	Alfred is from Poland.
contradiction	Donald and Alan are from Indonesia and Zimbabwe respectively.	Alan is from Indonesia.
contradiction	Colin and William are from Thailand and France respectively.	William is from Thailand.
contradiction	Roger and Ralph are from Argentina and Netherlands respectively.	Ralph is from Argentina.
contradiction	Mary and Larry are from Azerbaijan and Australia respectively.	Larry is from Azerbaijan.
contradiction	Jessica and Carol are from India and Sweden respectively.	Carol is from India.
contradiction	Edwin and Philip are from Belgium and South Korea respectively.	Philip is from Belgium.
contradiction	Donna and Michael are from Indonesia and Belarus respectively.	Michael is from Indonesia.
contradiction	Marilyn and Catherine are from Oman and Iran respectively.	Catherine is from Oman.
contradiction	Don and Charles are from Philippines and Ukraine respectively.	Charles is from Philippines.
contradiction	Laura and Kelly are from Austria and India respectively.	Kelly is from Austria.
contradiction	Judith and Betty are from Germany and India respectively.	Betty is from Germany.
contradiction	Suzanne and Grace are from United Kingdom and Fiji respectively.	Grace is from United Kingdom.
contradiction	Jay and Sarah are from Austria and Indonesia respectively.	Sarah is from Austria.
contradiction	Kathleen and Ashley are from Iceland and Iran respectively.	Ashley is from Iceland.
contradiction	Lawrence and Jean are from Poland and Iraq respectively.	Jean is from Poland.
contradiction	Diana and Benjamin are from Malaysia and Denmark respectively.	Benjamin is from Malaysia.
contradiction	Pamela and Christine are from Libya and Austria respectively.	Christine is from Libya.
contradiction	Melissa and David are from Denmark and Belgium respectively.	David is from Denmark.
contradiction	Claire and Harriet are from South Korea and Canada respectively.	Harriet is from South Korea.
contradiction	Bruce and Robert are from Canada and Azerbaijan respectively.	Robert is from Canada.
contradiction	Sue and Kenneth are from Nepal and Bhutan respectively.	Kenneth is from Nepal.
contradiction	Susan and Nick are from Sweden and China respectively.	Nick is from Sweden.
contradiction	Michelle and Lynn are from Bhutan and Singapore respectively.	Lynn is from Bhutan.
contradiction	Margaret and Samuel are from Laos and United Arab Emirates respectively.	Samuel is from Laos.
contradiction	Arthur and Howard are from Chile and Pakistan respectively.	Howard is from Chile.
contradiction	Tom and Keith are from Uruguay and Hungary respectively.	Keith is from Uruguay.
contradiction	Anthony and Daniel are from Hungary and Belarus respectively.	Daniel is from Hungary.
contradiction	Jack and Rachel are from Italy and Ukraine respectively.	Rachel is from Italy.
contradiction	Ron and Ed are from France and Portugal respectively.	Ed is from France.
contradiction	Mary and Don are from Ukraine and India respectively.	Don is from Ukraine.
contradiction	Rose and Jim are from Nepal and Malaysia respectively.	Jim is from Nepal.
contradiction	Helen and Dan are from Australia and Poland respectively.	Dan is from Australia.
contradiction	Louise and Richard are from Cuba and Libya respectively.	Richard is from Cuba.
contradiction	Martha and Margaret are from Canada and United Kingdom respectively.	Margaret is from Canada.
contradiction	Robin and Barbara are from Brazil and Cuba respectively.	Barbara is from Brazil.
contradiction	Dave and Ashley are from Maldives and Saudi Arabia respectively.	Ashley is from Maldives.
contradiction	Diane and Philip are from Laos and Cuba respectively.	Philip is from Laos.
contradiction	Judy and Angela are from Laos and Singapore respectively.	Angela is from Laos.
contradiction	Sam and Alan are from France and Belgium respectively.	Alan is from France.
contradiction	Ray and Larry are from Qatar and Philippines respectively.	Larry is from Qatar.
contradiction	Joe and Hugh are from Ireland and Switzerland respectively.	Hugh is from Ireland.
contradiction	Joe and Robin are from Indonesia and Switzerland respectively.	Robin is from Indonesia.
contradiction	Hugh and Walter are from Uruguay and Taiwan respectively.	Walter is from Uruguay.
contradiction	Donna and Dick are from Argentina and Georgia respectively.	Dick is from Argentina.
contradiction	David and Kevin are from North Korea and Brazil respectively.	Kevin is from North Korea.
contradiction	Carolyn and Evelyn are from Portugal and Iraq respectively.	Evelyn is from Portugal.
contradiction	Gary and Dave are from Oman and Finland respectively.	Dave is from Oman.
contradiction	Tim and Peter are from Greece and Japan respectively.	Peter is from Greece.
contradiction	Eleanor and Caroline are from Japan and Taiwan respectively.	Caroline is from Japan.
contradiction	David and Tim are from Libya and Singapore respectively.	Tim is from Libya.
contradiction	Deborah and Frank are from North Korea and Ireland respectively.	Frank is from North Korea.
contradiction	Jim and Caroline are from Bhutan and Singapore respectively.	Caroline is from Bhutan.
contradiction	Rebecca and Evelyn are from Russia and Belarus respectively.	Evelyn is from Russia.
contradiction	Kathy and William are from Sweden and United States of America respectively.	William is from Sweden.
contradiction	Jennifer and Matthew are from Haiti and Austria respectively.	Matthew is from Haiti.
contradiction	Amy and Amanda are from Switzerland and Belarus respectively.	Amanda is from Switzerland.
contradiction	Jim and Amy are from New Zealand and Belarus respectively.	Amy is from New Zealand.
contradiction	Jeff and Henry are from Haiti and Ireland respectively.	Henry is from Haiti.
contradiction	Susan and Leslie are from Belgium and Denmark respectively.	Leslie is from Belgium.
contradiction	Stephen and Ben are from France and United States of America respectively.	Ben is from France.
contradiction	Christine and Kathleen are from Brazil and Turkey respectively.	Kathleen is from Brazil.
contradiction	Caroline and John are from Belgium and Germany respectively.	John is from Belgium.
contradiction	Christine and Alexander are from Saudi Arabia and Vietnam respectively.	Alexander is from Saudi Arabia.
contradiction	Dorothy and Francis are from Indonesia and Saudi Arabia respectively.	Francis is from Indonesia.
contradiction	Steve and Nicole are from Ireland and Singapore respectively.	Nicole is from Ireland.
contradiction	Ashley and Donna are from Laos and Argentina respectively.	Donna is from Laos.
contradiction	Tom and Billy are from Ireland and Belarus respectively.	Billy is from Ireland.
contradiction	Lucy and Barbara are from United Kingdom and North Korea respectively.	Barbara is from United Kingdom.
contradiction	George and Carolyn are from Argentina and Germany respectively.	Carolyn is from Argentina.
contradiction	Ryan and Roy are from Azerbaijan and Saudi Arabia respectively.	Roy is from Azerbaijan.
contradiction	Julie and Alexander are from Japan and United States of America respectively.	Alexander is from Japan.
contradiction	Charlie and Nancy are from Italy and Hungary respectively.	Nancy is from Italy.
contradiction	Jason and Frances are from Iran and France respectively.	Frances is from Iran.
contradiction	Helen and Kelly are from Malaysia and Sweden respectively.	Kelly is from Malaysia.
contradiction	Susan and Chris are from Iran and Japan respectively.	Chris is from Iran.
contradiction	Tom and Andrew are from Bangladesh and Iran respectively.	Andrew is from Bangladesh.
contradiction	Jonathan and Sharon are from Switzerland and United Arab Emirates respectively.	Sharon is from Switzerland.
contradiction	Paul and Martin are from Iran and Libya respectively.	Martin is from Iran.
contradiction	William and Tony are from Laos and Ireland respectively.	Tony is from Laos.
contradiction	Edwin and Johnny are from Netherlands and Georgia respectively.	Johnny is from Netherlands.
contradiction	Sharon and Cynthia are from Australia and Taiwan respectively.	Cynthia is from Australia.
contradiction	Ralph and Marilyn are from Argentina and Afghanistan respectively.	Marilyn is from Argentina.
contradiction	Diana and Ruth are from Greece and Switzerland respectively.	Ruth is from Greece.
contradiction	Louis and Diane are from United Kingdom and Iceland respectively.	Diane is from United Kingdom.
contradiction	Richard and Alan are from Belarus and Greece respectively.	Alan is from Belarus.
contradiction	Ralph and Grace are from Japan and Ecuador respectively.	Grace is from Japan.
contradiction	Alfred and Alex are from Cuba and Taiwan respectively.	Alex is from Cuba.
contradiction	Carolyn and Brian are from Afghanistan and South Korea respectively.	Brian is from Afghanistan.
contradiction	Joseph and Ed are from Belgium and Israel respectively.	Ed is from Belgium.
contradiction	Sally and Nancy are from Ghana and United Kingdom respectively.	Nancy is from Ghana.
contradiction	Eleanor and Jerry are from Ukraine and United Kingdom respectively.	Jerry is from Ukraine.
contradiction	Judith and Nick are from Fiji and Uruguay respectively.	Nick is from Fiji.
contradiction	Don and Joan are from Pakistan and Poland respectively.	Joan is from Pakistan.
contradiction	Anna and Howard are from Ukraine and Germany respectively.	Howard is from Ukraine.
contradiction	Rachel and Lawrence are from Germany and Chile respectively.	Lawrence is from Germany.
contradiction	Louis and Michael are from Saudi Arabia and Uruguay respectively.	Michael is from Saudi Arabia.
contradiction	Harold and Louis are from Switzerland and Sweden respectively.	Louis is from Switzerland.
contradiction	Matt and Henry are from Sweden and Iceland respectively.	Henry is from Sweden.
contradiction	Nancy and Suzanne are from Germany and Japan respectively.	Suzanne is from Germany.
contradiction	Tom and Maria are from Oman and Nepal respectively.	Maria is from Oman.
contradiction	Jonathan and Jay are from Australia and Pakistan respectively.	Jay is from Australia.
contradiction	Claire and Margaret are from Ukraine and Bangladesh respectively.	Margaret is from Ukraine.
contradiction	Nancy and Simon are from United Arab Emirates and Maldives respectively.	Simon is from United Arab Emirates.
contradiction	Ellen and Dave are from New Zealand and Colombia respectively.	Dave is from New Zealand.
contradiction	Anthony and Andrew are from Ghana and Taiwan respectively.	Andrew is from Ghana.
contradiction	Susan and Charlotte are from Singapore and Finland respectively.	Charlotte is from Singapore.
contradiction	John and Martin are from Iran and Oman respectively.	Martin is from Iran.
contradiction	Richard and Janet are from Turkey and United States of America respectively.	Janet is from Turkey.
contradiction	Benjamin and Steve are from Ukraine and Azerbaijan respectively.	Steve is from Ukraine.
contradiction	Melissa and Ann are from Maldives and Libya respectively.	Ann is from Maldives.
contradiction	Mark and Fiona are from Russia and Italy respectively.	Fiona is from Russia.
contradiction	Robert and James are from Bangladesh and Taiwan respectively.	James is from Bangladesh.
contradiction	Billy and Alan are from Denmark and Azerbaijan respectively.	Alan is from Denmark.
contradiction	Angela and Brian are from Italy and Turkey respectively.	Brian is from Italy.
contradiction	Jack and Jennifer are from Afghanistan and Laos respectively.	Jennifer is from Afghanistan.
contradiction	Heather and Edith are from Egypt and Thailand respectively.	Edith is from Egypt.
contradiction	Anna and Suzanne are from Switzerland and Canada respectively.	Suzanne is from Switzerland.
contradiction	Florence and Richard are from Bangladesh and Portugal respectively.	Richard is from Bangladesh.
contradiction	Roger and Nicole are from Libya and Haiti respectively.	Nicole is from Libya.
contradiction	Evelyn and Matthew are from Bangladesh and Ecuador respectively.	Matthew is from Bangladesh.
contradiction	Ron and David are from Mexico and Nepal respectively.	David is from Mexico.
contradiction	Roger and Ian are from Sweden and Belarus respectively.	Ian is from Sweden.
contradiction	Chris and Andrea are from United Arab Emirates and Fiji respectively.	Andrea is from United Arab Emirates.
contradiction	Leslie and Benjamin are from Philippines and Singapore respectively.	Benjamin is from Philippines.
contradiction	Marie and Diane are from Turkey and Malaysia respectively.	Diane is from Turkey.
contradiction	Donna and Carolyn are from Switzerland and Cuba respectively.	Carolyn is from Switzerland.
contradiction	Marilyn and Andrea are from Fiji and Ireland respectively.	Andrea is from Fiji.
contradiction	Lawrence and Christopher are from Israel and Philippines respectively.	Christopher is from Israel.
contradiction	Ron and Albert are from Sweden and Switzerland respectively.	Albert is from Sweden.
contradiction	Jack and Jane are from Fiji and Sweden respectively.	Jane is from Fiji.
contradiction	Charles and Margaret are from Sweden and India respectively.	Margaret is from Sweden.
contradiction	Charlotte and Ellen are from Vietnam and Israel respectively.	Ellen is from Vietnam.
contradiction	Helen and Lynn are from Netherlands and Indonesia respectively.	Lynn is from Netherlands.
contradiction	Samuel and Patrick are from Canada and India respectively.	Patrick is from Canada.
contradiction	Alice and Keith are from Laos and Libya respectively.	Keith is from Laos.
contradiction	Dorothy and Nicole are from Argentina and Pakistan respectively.	Nicole is from Argentina.
contradiction	Dave and Carol are from Canada and Saudi Arabia respectively.	Carol is from Canada.
contradiction	Alan and Carl are from Denmark and Finland respectively.	Carl is from Denmark.
contradiction	Ron and Kathleen are from Azerbaijan and Denmark respectively.	Kathleen is from Azerbaijan.
contradiction	Carol and Marilyn are from South Korea and China respectively.	Marilyn is from South Korea.
contradiction	Greg and Jack are from Zimbabwe and Saudi Arabia respectively.	Jack is from Zimbabwe.
contradiction	Samuel and Tim are from Chile and Bhutan respectively.	Tim is from Chile.
contradiction	Nancy and Patrick are from Afghanistan and Russia respectively.	Patrick is from Afghanistan.
