entailment	Jessica, Elaine, Kenneth and Christine are from Bangladesh, Colombia, Belgium and New Zealand respectively.	Kenneth is from Belgium.
entailment	John, Robin, Brian and Emma are from Switzerland, Italy, Argentina and Laos respectively.	Brian is from Argentina.
entailment	Sue, Maria, Robin and Victoria are from Iran, Canada, Sweden and Ecuador respectively.	Robin is from Sweden.
entailment	Robin, Sara, Joseph and Christopher are from Taiwan, Germany, Iceland and Portugal respectively.	Joseph is from Iceland.
entailment	James, Charlie, Tom and Amanda are from Colombia, Ireland, Laos and Qatar respectively.	Tom is from Laos.
entailment	Jennifer, Bobby, Alison and Suzanne are from Chile, Maldives, United States of America and New Zealand respectively.	Alison is from United States of America.
entailment	Dorothy, Lisa, Claire and Carol are from New Zealand, Ghana, Iceland and Ukraine respectively.	Claire is from Iceland.
entailment	Jill, Jessica, Anne and Charlie are from China, Qatar, Ghana and France respectively.	Anne is from Ghana.
entailment	James, Dave, Frederick and Alison are from Haiti, Ghana, Thailand and United Arab Emirates respectively.	Frederick is from Thailand.
entailment	Alison, Karen, Jane and Frank are from United States of America, Indonesia, Zimbabwe and Haiti respectively.	Jane is from Zimbabwe.
entailment	Deborah, Anthony, Roger and Harry are from Ukraine, Japan, Switzerland and Netherlands respectively.	Roger is from Switzerland.
entailment	Rachel, Judith, Kevin and Leslie are from Cuba, Hungary, Iceland and Portugal respectively.	Kevin is from Iceland.
entailment	Mary, Christopher, Lawrence and Ryan are from United States of America, Denmark, Iceland and Saudi Arabia respectively.	Lawrence is from Iceland.
entailment	David, Tom, Tony and Adam are from Oman, Azerbaijan, Japan and Thailand respectively.	Tony is from Japan.
entailment	Ruth, Bob, Frances and Edward are from Canada, Finland, Saudi Arabia and Argentina respectively.	Frances is from Saudi Arabia.
entailment	Kim, Samuel, Jennifer and Greg are from Iran, Georgia, Uruguay and Hungary respectively.	Jennifer is from Uruguay.
entailment	Virginia, Don, Eric and Larry are from Bangladesh, Indonesia, Greece and Israel respectively.	Eric is from Greece.
entailment	William, Rachel, Florence and Patricia are from Japan, Belarus, Israel and United Kingdom respectively.	Florence is from Israel.
entailment	Roy, Heather, Louise and Maria are from Australia, Belgium, Singapore and Egypt respectively.	Louise is from Singapore.
entailment	Harold, Maria, Ashley and Johnny are from Argentina, Haiti, Taiwan and Netherlands respectively.	Ashley is from Taiwan.
entailment	Johnny, Stephanie, Christopher and Wendy are from Afghanistan, Chile, Libya and Iraq respectively.	Christopher is from Libya.
entailment	Ed, Adam, Pamela and Jonathan are from Afghanistan, Bhutan, France and China respectively.	Pamela is from France.
entailment	Diane, Sally, Thomas and David are from Iceland, India, Bhutan and Israel respectively.	Thomas is from Bhutan.
entailment	Steven, Pamela, Annie and Anna are from Switzerland, North Korea, Philippines and Libya respectively.	Annie is from Philippines.
entailment	Colin, Eric, Fred and Jimmy are from Ghana, Nepal, Sweden and Colombia respectively.	Fred is from Sweden.
entailment	Kathy, Kate, Harold and Cynthia are from Zimbabwe, Austria, Fiji and China respectively.	Harold is from Fiji.
entailment	Jill, Elizabeth, Louis and Victoria are from Belgium, Colombia, New Zealand and Netherlands respectively.	Louis is from New Zealand.
entailment	Sharon, Anne, Suzanne and Johnny are from Portugal, Haiti, Nepal and Belarus respectively.	Suzanne is from Nepal.
entailment	Alice, Richard, Jonathan and Rebecca are from Oman, Mexico, Thailand and Argentina respectively.	Jonathan is from Thailand.
entailment	Jean, Richard, Ken and Francis are from France, Thailand, Azerbaijan and Maldives respectively.	Ken is from Azerbaijan.
entailment	Arthur, Frederick, Lauren and Ashley are from Haiti, Georgia, Belgium and Malaysia respectively.	Lauren is from Belgium.
entailment	Alice, Kelly, Richard and Frank are from Haiti, Australia, Singapore and Saudi Arabia respectively.	Richard is from Singapore.
entailment	Anthony, Adam, John and Jean are from Singapore, France, Belgium and Zimbabwe respectively.	John is from Belgium.
entailment	Sara, Elizabeth, Keith and Jean are from Chile, Pakistan, Australia and Mexico respectively.	Keith is from Australia.
entailment	Stephen, Emma, Don and Matthew are from Switzerland, Ecuador, Afghanistan and Iran respectively.	Don is from Afghanistan.
entailment	Sally, Howard, Dave and Marilyn are from Cuba, Oman, Austria and Libya respectively.	Dave is from Austria.
entailment	Leslie, Diana, James and Ann are from Portugal, United Arab Emirates, Greece and Iran respectively.	James is from Greece.
entailment	Dick, Nicole, Joseph and Helen are from Ghana, Haiti, Italy and Pakistan respectively.	Joseph is from Italy.
entailment	Amanda, Carolyn, Daniel and Pamela are from Thailand, Iran, Laos and India respectively.	Daniel is from Laos.
entailment	Jimmy, Robin, Greg and Catherine are from Argentina, Libya, Austria and Georgia respectively.	Greg is from Austria.
entailment	Jeff, Jim, Francis and Matthew are from Singapore, Hungary, Vietnam and Turkey respectively.	Francis is from Vietnam.
entailment	Karen, Fred, Hugh and Tom are from Turkey, Azerbaijan, Taiwan and United States of America respectively.	Hugh is from Taiwan.
entailment	Karen, Peter, Hugh and Anna are from United States of America, Germany, Iraq and Pakistan respectively.	Hugh is from Iraq.
entailment	Peter, Adam, Louise and Steven are from Georgia, Iraq, Maldives and Turkey respectively.	Louise is from Maldives.
entailment	Walter, Sharon, Charlie and Ken are from Greece, Brazil, Mexico and Sweden respectively.	Charlie is from Mexico.
entailment	Alice, Frederick, Adam and Tim are from Uruguay, North Korea, Egypt and Georgia respectively.	Adam is from Egypt.
entailment	Melissa, Patrick, Elaine and Wendy are from United States of America, Libya, Zimbabwe and Canada respectively.	Elaine is from Zimbabwe.
entailment	Jimmy, Robin, Fred and Charles are from Oman, United States of America, Malaysia and Finland respectively.	Fred is from Malaysia.
entailment	Lucy, Kim, Susan and Kathleen are from North Korea, Uruguay, Libya and Ecuador respectively.	Susan is from Libya.
entailment	Sophie, Judy, Martha and Laura are from Maldives, Qatar, Cuba and Haiti respectively.	Martha is from Cuba.
entailment	Christine, Elaine, Kathy and Elizabeth are from Ireland, Fiji, France and Haiti respectively.	Kathy is from France.
entailment	Kelly, Jeff, Annie and Ryan are from Switzerland, Portugal, Georgia and Turkey respectively.	Annie is from Georgia.
entailment	Annie, Matt, Deborah and Donald are from Switzerland, Hungary, New Zealand and Nepal respectively.	Deborah is from New Zealand.
entailment	Tim, Roy, Helen and Patricia are from Ecuador, Greece, Pakistan and Oman respectively.	Helen is from Pakistan.
entailment	Bob, Claire, Maria and John are from Hungary, India, Iran and Oman respectively.	Maria is from Iran.
entailment	Don, Emily, Kathleen and Maria are from United States of America, Thailand, Laos and Iran respectively.	Kathleen is from Laos.
entailment	Arthur, Stephen, Charles and Walter are from Denmark, Belgium, Haiti and Colombia respectively.	Charles is from Haiti.
entailment	Tim, Robert, William and Stephanie are from Ireland, Pakistan, Denmark and Brazil respectively.	William is from Denmark.
entailment	Edward, Ellen, Mark and Patricia are from South Korea, Azerbaijan, United States of America and Turkey respectively.	Mark is from United States of America.
entailment	Alison, Don, Jean and Nicole are from China, Sweden, Bangladesh and Taiwan respectively.	Jean is from Bangladesh.
entailment	Martha, Ron, Jay and Billy are from Germany, Vietnam, Iceland and Japan respectively.	Jay is from Iceland.
entailment	Harold, Nicole, Suzanne and Patricia are from Ukraine, India, Australia and Finland respectively.	Suzanne is from Australia.
entailment	Sue, Colin, Joseph and Diane are from Netherlands, Indonesia, France and Qatar respectively.	Joseph is from France.
entailment	Ben, Sam, Catherine and Ken are from Austria, Azerbaijan, Taiwan and Fiji respectively.	Catherine is from Taiwan.
entailment	Kelly, Rachel, Mary and Richard are from Australia, Singapore, Belarus and New Zealand respectively.	Mary is from Belarus.
entailment	Stephanie, Bill, Frances and George are from United Kingdom, Austria, Oman and Ecuador respectively.	Frances is from Oman.
entailment	Patricia, Howard, Steven and Ed are from Finland, Hungary, Taiwan and Colombia respectively.	Steven is from Taiwan.
entailment	Maria, Nick, Charlie and Frances are from Qatar, Iceland, Georgia and Canada respectively.	Charlie is from Georgia.
entailment	Ed, Larry, Elizabeth and Marilyn are from Australia, Afghanistan, Uruguay and India respectively.	Elizabeth is from Uruguay.
entailment	Chris, Howard, Benjamin and Sharon are from Hungary, Cuba, Germany and Afghanistan respectively.	Benjamin is from Germany.
entailment	Scott, Diana, Frank and Sue are from Switzerland, United Arab Emirates, Azerbaijan and Bhutan respectively.	Frank is from Azerbaijan.
entailment	Charlotte, Ed, Karen and Ellen are from Italy, Turkey, Indonesia and Germany respectively.	Karen is from Indonesia.
entailment	Edward, Roger, Catherine and Brian are from Ukraine, Saudi Arabia, United Kingdom and Bangladesh respectively.	Catherine is from United Kingdom.
entailment	Richard, Arthur, Lynn and Frances are from India, Haiti, North Korea and Poland respectively.	Lynn is from North Korea.
entailment	Jay, Maria, Patricia and Dan are from Pakistan, France, United Arab Emirates and China respectively.	Patricia is from United Arab Emirates.
entailment	Matthew, Suzanne, Kelly and Kathy are from Cuba, Pakistan, Qatar and Taiwan respectively.	Kelly is from Qatar.
entailment	Jane, Kenneth, Dick and Sara are from Switzerland, Denmark, Singapore and Oman respectively.	Dick is from Singapore.
entailment	Michelle, Joan, Heather and Elizabeth are from Afghanistan, Cuba, Ireland and Azerbaijan respectively.	Heather is from Ireland.
entailment	Lauren, Walter, Paul and Daniel are from Denmark, Fiji, South Korea and Thailand respectively.	Paul is from South Korea.
entailment	Jeff, Tom, Adam and Catherine are from United Kingdom, Cuba, Colombia and Ukraine respectively.	Adam is from Colombia.
entailment	Kate, Gary, Emily and Alex are from Vietnam, China, Libya and Afghanistan respectively.	Emily is from Libya.
entailment	Henry, Kevin, Rebecca and Howard are from Greece, Japan, Mexico and Canada respectively.	Rebecca is from Mexico.
entailment	Lauren, Rachel, Alexander and Grace are from India, Austria, Canada and Ghana respectively.	Alexander is from Canada.
entailment	Helen, Eric, Emma and Roger are from Greece, France, Oman and Nepal respectively.	Emma is from Oman.
entailment	Louis, Ashley, Mark and Alex are from Maldives, China, Netherlands and United Kingdom respectively.	Mark is from Netherlands.
entailment	Jennifer, Marilyn, Virginia and Don are from Bhutan, Iran, Azerbaijan and Zimbabwe respectively.	Virginia is from Azerbaijan.
entailment	Andrea, Suzanne, Frances and Lisa are from Bhutan, Israel, Zimbabwe and China respectively.	Frances is from Zimbabwe.
entailment	Ashley, Janet, Cynthia and Jack are from United States of America, Thailand, North Korea and United Arab Emirates respectively.	Cynthia is from North Korea.
entailment	Robert, Harold, Florence and Lynn are from Israel, Maldives, Libya and Poland respectively.	Florence is from Libya.
entailment	Alison, Alice, Gary and Ken are from Qatar, Fiji, Pakistan and Iraq respectively.	Gary is from Pakistan.
entailment	Elizabeth, James, Eric and Scott are from Russia, Egypt, Finland and Uruguay respectively.	Eric is from Finland.
entailment	Susan, Lynn, Jay and Francis are from Colombia, France, Portugal and United States of America respectively.	Jay is from Portugal.
entailment	Greg, Benjamin, David and Elizabeth are from Germany, Canada, United Arab Emirates and Laos respectively.	David is from United Arab Emirates.
entailment	Al, Sharon, Rebecca and Keith are from Ecuador, New Zealand, South Korea and Georgia respectively.	Rebecca is from South Korea.
entailment	Rebecca, Paul, Ray and Roger are from India, Haiti, Switzerland and Portugal respectively.	Ray is from Switzerland.
entailment	Mark, Victoria, Virginia and Alexander are from Brazil, Laos, Iran and Poland respectively.	Virginia is from Iran.
entailment	Virginia, Edward, Scott and Billy are from Afghanistan, Portugal, Argentina and Hungary respectively.	Scott is from Argentina.
entailment	Linda, Walter, Patrick and Matthew are from Finland, Turkey, Chile and United Kingdom respectively.	Patrick is from Chile.
entailment	Sally, Karen, Daniel and Tony are from South Korea, Finland, Argentina and Vietnam respectively.	Daniel is from Argentina.
entailment	Bob, Kim, Susan and Annie are from Qatar, Haiti, Ukraine and United Kingdom respectively.	Susan is from Ukraine.
entailment	Peter, Donald, Ray and Carol are from Nepal, Belgium, Canada and Saudi Arabia respectively.	Ray is from Canada.
entailment	Kate, Arthur, Lucy and Walter are from Laos, Brazil, Fiji and Cuba respectively.	Lucy is from Fiji.
entailment	Fiona, Philip, Donna and Sophie are from Greece, Singapore, Russia and United States of America respectively.	Donna is from Russia.
entailment	Billy, Annie, Johnny and David are from Maldives, United Arab Emirates, Turkey and Iceland respectively.	Johnny is from Turkey.
entailment	Jimmy, Tony, Larry and Jim are from Haiti, Finland, Afghanistan and Poland respectively.	Larry is from Afghanistan.
entailment	Hugh, Bruce, Walter and Victoria are from Brazil, Colombia, Iceland and Indonesia respectively.	Walter is from Iceland.
entailment	Amy, Emma, Susan and Patricia are from Ukraine, Russia, Bangladesh and Haiti respectively.	Susan is from Bangladesh.
entailment	Diane, Francis, Adam and Heather are from Maldives, Russia, Germany and South Korea respectively.	Adam is from Germany.
entailment	Sam, James, Martin and Johnny are from Ireland, Israel, Hungary and Qatar respectively.	Martin is from Hungary.
entailment	Kim, Jean, Linda and Ed are from Oman, Bhutan, Finland and France respectively.	Linda is from Finland.
entailment	Nancy, David, Adam and Diana are from Egypt, Greece, Bhutan and Uruguay respectively.	Adam is from Bhutan.
entailment	Carl, Ann, Andrew and Jane are from Maldives, Japan, France and Ghana respectively.	Andrew is from France.
entailment	Ellen, Sarah, Martha and Alison are from Poland, Egypt, Laos and Japan respectively.	Martha is from Laos.
entailment	Florence, Alexandra, Catherine and Howard are from Canada, Iran, Finland and China respectively.	Catherine is from Finland.
entailment	Andrea, Ralph, Lauren and Matt are from Colombia, Turkey, Thailand and Italy respectively.	Lauren is from Thailand.
entailment	Alfred, Samuel, Michael and Jerry are from Germany, Malaysia, Saudi Arabia and Zimbabwe respectively.	Michael is from Saudi Arabia.
entailment	Jean, Jay, Claire and Patricia are from France, Chile, Argentina and Hungary respectively.	Claire is from Argentina.
entailment	Kelly, Rose, James and Thomas are from Australia, Vietnam, France and Denmark respectively.	James is from France.
entailment	Nicole, Laura, Lisa and Katherine are from Japan, Maldives, Ukraine and Belgium respectively.	Lisa is from Ukraine.
entailment	Claire, Alex, Jean and Tim are from China, United Arab Emirates, Russia and Turkey respectively.	Jean is from Russia.
entailment	Dave, Ron, Alex and Christopher are from Thailand, Haiti, Japan and Qatar respectively.	Alex is from Japan.
entailment	Nicole, Marie, Andrea and Ron are from New Zealand, Chile, Laos and China respectively.	Andrea is from Laos.
entailment	Lynn, Bobby, Jack and Dorothy are from Argentina, Iran, Belgium and Georgia respectively.	Jack is from Belgium.
entailment	Charlotte, Nick, Susan and Paul are from Switzerland, Austria, Philippines and Vietnam respectively.	Susan is from Philippines.
entailment	Larry, Simon, Emily and John are from Mexico, Afghanistan, Indonesia and New Zealand respectively.	Emily is from Indonesia.
entailment	Catherine, Diana, Paul and Daniel are from United States of America, Finland, Ireland and Maldives respectively.	Paul is from Ireland.
entailment	Ruth, Stephen, Charlotte and Ken are from Egypt, Netherlands, Malaysia and Pakistan respectively.	Charlotte is from Malaysia.
entailment	Patrick, Marilyn, Jay and Ken are from Singapore, Malaysia, Russia and Indonesia respectively.	Jay is from Russia.
entailment	Jeff, Kathy, Robin and Karen are from United Kingdom, Switzerland, Laos and Iran respectively.	Robin is from Laos.
entailment	Johnny, Dorothy, Ann and Susan are from Iran, Portugal, Argentina and France respectively.	Ann is from Argentina.
entailment	Thomas, Julie, Eric and Mike are from Taiwan, Bhutan, United Kingdom and Italy respectively.	Eric is from United Kingdom.
entailment	Ed, Fred, Alice and Ray are from Haiti, Qatar, Belgium and Argentina respectively.	Alice is from Belgium.
entailment	Julie, Alex, Carolyn and Jane are from Portugal, Libya, Iraq and Poland respectively.	Carolyn is from Iraq.
entailment	Florence, Bobby, Brian and Keith are from Ecuador, Portugal, Canada and North Korea respectively.	Brian is from Canada.
entailment	Melissa, Francis, Simon and Walter are from Singapore, Italy, Maldives and South Korea respectively.	Simon is from Maldives.
entailment	Daniel, Don, Ruth and Charlotte are from United Arab Emirates, Netherlands, Ecuador and Iraq respectively.	Ruth is from Ecuador.
entailment	Pamela, Mark, James and Nick are from Bhutan, Taiwan, North Korea and Germany respectively.	James is from North Korea.
entailment	Diana, Kathleen, Marie and Ashley are from Ireland, Saudi Arabia, Argentina and Mexico respectively.	Marie is from Argentina.
entailment	Martin, Ryan, Lauren and Bruce are from Denmark, Afghanistan, Philippines and Zimbabwe respectively.	Lauren is from Philippines.
entailment	Robin, Stephanie, Frances and Howard are from Australia, Laos, Nepal and Taiwan respectively.	Frances is from Nepal.
entailment	Alfred, Benjamin, Walter and Jay are from Saudi Arabia, Afghanistan, New Zealand and Russia respectively.	Walter is from New Zealand.
entailment	Thomas, Sharon, Martin and Maria are from Uruguay, Malaysia, Vietnam and United Kingdom respectively.	Martin is from Vietnam.
entailment	Maria, Ian, Sarah and Donna are from Taiwan, Chile, Sweden and Maldives respectively.	Sarah is from Sweden.
entailment	Brian, Kelly, Dave and Wendy are from Hungary, North Korea, Iraq and Egypt respectively.	Dave is from Iraq.
entailment	Alexander, Kenneth, John and Marie are from Turkey, Libya, Egypt and Israel respectively.	John is from Egypt.
entailment	Brian, Katie, Ray and Rachel are from Israel, Zimbabwe, Taiwan and Malaysia respectively.	Ray is from Taiwan.
entailment	Donna, Jim, Evelyn and Sophie are from Australia, Afghanistan, Ireland and United Kingdom respectively.	Evelyn is from Ireland.
entailment	Alexander, Fiona, Dan and Marilyn are from Vietnam, Belgium, Argentina and Iraq respectively.	Dan is from Argentina.
entailment	Rachel, Sue, Francis and Eleanor are from China, Vietnam, Hungary and Sweden respectively.	Francis is from Hungary.
entailment	Alison, Jessica, Richard and Nicole are from Saudi Arabia, Philippines, Thailand and Pakistan respectively.	Richard is from Thailand.
entailment	Diane, Edith, Richard and Carl are from Mexico, Netherlands, Laos and United Arab Emirates respectively.	Richard is from Laos.
entailment	Henry, Catherine, Harold and Lucy are from Haiti, Belarus, Canada and China respectively.	Harold is from Canada.
entailment	Andrew, Greg, Kathryn and Robin are from Colombia, Netherlands, Libya and Oman respectively.	Kathryn is from Libya.
entailment	Steven, Robert, Edward and Keith are from India, Laos, Libya and Philippines respectively.	Edward is from Libya.
entailment	Victoria, Ray, Pamela and Carl are from Cuba, Finland, Switzerland and Maldives respectively.	Pamela is from Switzerland.
entailment	Howard, Sarah, Jeff and Gary are from South Korea, Russia, Pakistan and North Korea respectively.	Jeff is from Pakistan.
entailment	Paul, Francis, Judith and David are from Bhutan, Chile, United Arab Emirates and Ukraine respectively.	Judith is from United Arab Emirates.
entailment	Lisa, Ryan, Jonathan and Alfred are from Malaysia, Canada, Taiwan and Austria respectively.	Jonathan is from Taiwan.
entailment	Anthony, Harriet, Helen and Ed are from Belgium, Haiti, North Korea and Singapore respectively.	Helen is from North Korea.
entailment	Judy, Matthew, Jeff and Jason are from Pakistan, Belgium, Austria and Philippines respectively.	Jeff is from Austria.
entailment	Alexandra, Jeff, Julia and Richard are from Switzerland, Finland, Fiji and Thailand respectively.	Julia is from Fiji.
entailment	Rachel, Sara, Katherine and Walter are from Nepal, Poland, Austria and Bhutan respectively.	Katherine is from Austria.
entailment	Frederick, Victoria, Barbara and Eleanor are from Ireland, South Korea, Greece and Denmark respectively.	Barbara is from Greece.
entailment	Andrew, Rebecca, Kathy and Alexander are from Japan, Hungary, Sweden and Canada respectively.	Kathy is from Sweden.
entailment	Greg, Walter, Edwin and Deborah are from Nepal, Libya, Brazil and United Kingdom respectively.	Edwin is from Brazil.
entailment	Maria, Evelyn, Peter and Ray are from Portugal, Italy, France and Iran respectively.	Peter is from France.
entailment	David, Alfred, Tony and Joan are from Pakistan, Ecuador, Nepal and Libya respectively.	Tony is from Nepal.
entailment	Philip, Benjamin, Catherine and Alexander are from Vietnam, Egypt, Iraq and Japan respectively.	Catherine is from Iraq.
entailment	Dave, Chris, Carol and Jim are from Taiwan, Georgia, Germany and Oman respectively.	Carol is from Germany.
entailment	Lucy, Michelle, Judy and Amy are from Bangladesh, Australia, United Kingdom and Netherlands respectively.	Judy is from United Kingdom.
entailment	Maria, Sarah, Alice and Elizabeth are from Bhutan, Iran, Ghana and Fiji respectively.	Alice is from Ghana.
entailment	Philip, Sue, Ann and Michael are from Ireland, United Arab Emirates, Fiji and Vietnam respectively.	Ann is from Fiji.
entailment	Janet, Fred, Jim and Hugh are from Argentina, Zimbabwe, Singapore and United Kingdom respectively.	Jim is from Singapore.
entailment	Matthew, Joseph, Henry and Lawrence are from Azerbaijan, United States of America, Fiji and Taiwan respectively.	Henry is from Fiji.
entailment	Sam, Bruce, Al and Harold are from Egypt, Taiwan, Ecuador and China respectively.	Al is from Ecuador.
entailment	Emma, Betty, John and Mark are from Oman, United Arab Emirates, Argentina and Uruguay respectively.	John is from Argentina.
entailment	Paul, Frances, John and Kathy are from China, Indonesia, Germany and Pakistan respectively.	John is from Germany.
entailment	Alex, Betty, Thomas and Steve are from Argentina, Portugal, Colombia and Mexico respectively.	Thomas is from Colombia.
entailment	Jason, Don, Kathy and Donald are from Azerbaijan, Belgium, Ecuador and Austria respectively.	Kathy is from Ecuador.
entailment	Emily, James, Diane and Louise are from China, Egypt, Greece and Iran respectively.	Diane is from Greece.
entailment	Caroline, Diana, Judith and Tim are from Hungary, Australia, Egypt and Bhutan respectively.	Judith is from Egypt.
entailment	Henry, Philip, Michael and Carolyn are from Georgia, Italy, Finland and Chile respectively.	Michael is from Finland.
entailment	Steven, Kathryn, Roger and Julie are from Iceland, Cuba, United Kingdom and Taiwan respectively.	Roger is from United Kingdom.
entailment	Arthur, Steven, Sharon and Al are from Belgium, Ireland, Laos and United Kingdom respectively.	Sharon is from Laos.
entailment	Sandra, Florence, Edward and Nick are from Azerbaijan, Colombia, Poland and Indonesia respectively.	Edward is from Poland.
entailment	Sophie, Kevin, Laura and Michael are from Malaysia, Chile, Hungary and France respectively.	Laura is from Hungary.
entailment	Sarah, Kim, Edward and Stephen are from Afghanistan, Ireland, Saudi Arabia and Poland respectively.	Edward is from Saudi Arabia.
entailment	Paul, Alfred, Colin and Al are from Australia, Turkey, China and Haiti respectively.	Colin is from China.
entailment	Janet, Martin, Harry and Louise are from Hungary, Canada, Thailand and Ecuador respectively.	Harry is from Thailand.
entailment	Pamela, Jerry, Ruth and Sandra are from Austria, Denmark, United Arab Emirates and China respectively.	Ruth is from United Arab Emirates.
entailment	Adam, Wendy, Louise and Christine are from Ecuador, Malaysia, Canada and United States of America respectively.	Louise is from Canada.
entailment	Philip, Sara, Sue and Emily are from Mexico, United Kingdom, Hungary and Georgia respectively.	Sue is from Hungary.
entailment	Harry, Joe, Amy and Betty are from Libya, Vietnam, Nepal and Ecuador respectively.	Amy is from Nepal.
entailment	Lauren, Jonathan, Don and Sara are from Saudi Arabia, Turkey, Hungary and Cuba respectively.	Don is from Hungary.
entailment	Nicole, Deborah, Louise and Robert are from Iraq, Zimbabwe, Canada and New Zealand respectively.	Louise is from Canada.
entailment	Fiona, Dan, Sarah and Arthur are from Iran, Maldives, Singapore and Zimbabwe respectively.	Sarah is from Singapore.
entailment	Frank, Victoria, Jeff and Jessica are from Hungary, Georgia, Netherlands and Greece respectively.	Jeff is from Netherlands.
entailment	Alan, Ruth, Kathleen and Amanda are from Argentina, Ireland, Uruguay and Denmark respectively.	Kathleen is from Uruguay.
entailment	Claire, Dick, Alan and Jessica are from Austria, Bangladesh, India and Ghana respectively.	Alan is from India.
