contradiction	Melissa and Benjamin are from Belarus and Argentina respectively.	Benjamin is from Belarus.
contradiction	David and Harriet are from Finland and France respectively.	Harriet is from Finland.
contradiction	Karen and Maria are from Chile and Singapore respectively.	Maria is from Chile.
contradiction	Alexander and Billy are from Poland and Iceland respectively.	Billy is from Poland.
contradiction	Steve and Anna are from Mexico and Colombia respectively.	Anna is from Mexico.
contradiction	Tony and Virginia are from Libya and Haiti respectively.	Virginia is from Libya.
contradiction	Angela and Leslie are from Denmark and Poland respectively.	Leslie is from Denmark.
contradiction	Emma and Alan are from Mexico and Canada respectively.	Alan is from Mexico.
contradiction	Barbara and Lynn are from New Zealand and Maldives respectively.	Lynn is from New Zealand.
contradiction	Florence and Carol are from Austria and Ecuador respectively.	Carol is from Austria.
contradiction	Andrea and Roger are from Iceland and North Korea respectively.	Roger is from Iceland.
contradiction	John and Bobby are from Azerbaijan and Vietnam respectively.	Bobby is from Azerbaijan.
contradiction	Tim and Virginia are from Indonesia and Belarus respectively.	Virginia is from Indonesia.
contradiction	Sophie and Sue are from Brazil and Turkey respectively.	Sue is from Brazil.
contradiction	Louise and Roy are from Japan and Indonesia respectively.	Roy is from Japan.
contradiction	Bob and Francis are from Hungary and Belarus respectively.	Francis is from Hungary.
contradiction	Catherine and Janet are from Ghana and France respectively.	Janet is from Ghana.
contradiction	Claire and Bob are from Ghana and Portugal respectively.	Bob is from Ghana.
contradiction	Edward and George are from Nepal and Poland respectively.	George is from Nepal.
contradiction	John and Robin are from Portugal and Colombia respectively.	Robin is from Portugal.
contradiction	Kathryn and Frederick are from Finland and Ireland respectively.	Frederick is from Finland.
contradiction	Nancy and Florence are from Ukraine and North Korea respectively.	Florence is from Ukraine.
contradiction	Grace and Michelle are from Uruguay and Singapore respectively.	Michelle is from Uruguay.
contradiction	Keith and Ellen are from Azerbaijan and Libya respectively.	Ellen is from Azerbaijan.
contradiction	Nick and Tim are from Taiwan and Ghana respectively.	Tim is from Taiwan.
contradiction	Alice and Howard are from Switzerland and Mexico respectively.	Howard is from Switzerland.
contradiction	Mark and Mary are from Russia and Ukraine respectively.	Mary is from Russia.
contradiction	Deborah and Diana are from Brazil and Hungary respectively.	Diana is from Brazil.
contradiction	Ashley and Linda are from India and Italy respectively.	Linda is from India.
contradiction	Peter and Frances are from Belarus and Ireland respectively.	Frances is from Belarus.
contradiction	Christine and Judith are from New Zealand and United Arab Emirates respectively.	Judith is from New Zealand.
contradiction	Richard and Alexandra are from Qatar and Vietnam respectively.	Alexandra is from Qatar.
contradiction	Catherine and Diana are from Afghanistan and Georgia respectively.	Diana is from Afghanistan.
contradiction	Matt and Anne are from Australia and Bangladesh respectively.	Anne is from Australia.
contradiction	Jack and Paul are from Iran and Haiti respectively.	Paul is from Iran.
contradiction	Robin and Tony are from Zimbabwe and Oman respectively.	Tony is from Zimbabwe.
contradiction	Tony and Elaine are from Russia and Switzerland respectively.	Elaine is from Russia.
contradiction	Lucy and Jimmy are from Thailand and Germany respectively.	Jimmy is from Thailand.
contradiction	Sally and Wendy are from Bangladesh and Cuba respectively.	Wendy is from Bangladesh.
contradiction	Eleanor and Harriet are from Poland and Libya respectively.	Harriet is from Poland.
contradiction	Jessica and Angela are from United States of America and Philippines respectively.	Angela is from United States of America.
contradiction	Richard and Ron are from Argentina and Austria respectively.	Ron is from Argentina.
contradiction	Karen and Marilyn are from Egypt and Greece respectively.	Marilyn is from Egypt.
contradiction	Nick and Rebecca are from Ecuador and Zimbabwe respectively.	Rebecca is from Ecuador.
contradiction	Don and Maria are from Egypt and Australia respectively.	Maria is from Egypt.
contradiction	Virginia and Angela are from Colombia and Switzerland respectively.	Angela is from Colombia.
contradiction	Sarah and Sophie are from Japan and Greece respectively.	Sophie is from Japan.
contradiction	Ryan and Tom are from China and Austria respectively.	Tom is from China.
contradiction	Ashley and Virginia are from Pakistan and Ghana respectively.	Virginia is from Pakistan.
contradiction	Janet and Sue are from Iran and Georgia respectively.	Sue is from Iran.
contradiction	Richard and Gary are from Fiji and Georgia respectively.	Gary is from Fiji.
contradiction	Elizabeth and Sophie are from Colombia and Finland respectively.	Sophie is from Colombia.
contradiction	Lawrence and Jay are from Qatar and Thailand respectively.	Jay is from Qatar.
contradiction	Anne and Evelyn are from Libya and Chile respectively.	Evelyn is from Libya.
contradiction	Alexandra and David are from Philippines and United Kingdom respectively.	David is from Philippines.
contradiction	William and Sarah are from United States of America and Philippines respectively.	Sarah is from United States of America.
contradiction	Alexandra and Diane are from Azerbaijan and Netherlands respectively.	Diane is from Azerbaijan.
contradiction	Emily and Lauren are from New Zealand and Taiwan respectively.	Lauren is from New Zealand.
contradiction	Patricia and Dan are from Mexico and Indonesia respectively.	Dan is from Mexico.
contradiction	Wendy and Kenneth are from Uruguay and Qatar respectively.	Kenneth is from Uruguay.
contradiction	Sandra and Dick are from Ghana and Vietnam respectively.	Dick is from Ghana.
contradiction	Francis and Sarah are from Turkey and United Kingdom respectively.	Sarah is from Turkey.
contradiction	Judith and Joan are from Ecuador and Hungary respectively.	Joan is from Ecuador.
contradiction	Fiona and Deborah are from Qatar and Ireland respectively.	Deborah is from Qatar.
contradiction	Julie and Florence are from Iran and Colombia respectively.	Florence is from Iran.
contradiction	Daniel and Gary are from China and Argentina respectively.	Gary is from China.
contradiction	Harriet and John are from Chile and Iran respectively.	John is from Chile.
contradiction	Ellen and Sally are from Qatar and Argentina respectively.	Sally is from Qatar.
contradiction	Patrick and Fiona are from Hungary and Haiti respectively.	Fiona is from Hungary.
contradiction	Deborah and Larry are from Iceland and Greece respectively.	Larry is from Iceland.
contradiction	Dick and Jonathan are from Mexico and United Kingdom respectively.	Jonathan is from Mexico.
contradiction	Jay and Alison are from Ireland and Germany respectively.	Alison is from Ireland.
contradiction	Margaret and Dave are from Nepal and United Kingdom respectively.	Dave is from Nepal.
contradiction	Eric and Rose are from Maldives and Oman respectively.	Rose is from Maldives.
contradiction	Jill and Mark are from Portugal and Austria respectively.	Mark is from Portugal.
contradiction	Lauren and Andrea are from Finland and Zimbabwe respectively.	Andrea is from Finland.
contradiction	Sam and Ray are from Cuba and Argentina respectively.	Ray is from Cuba.
contradiction	Anna and Howard are from Greece and Germany respectively.	Howard is from Greece.
contradiction	Louis and Anna are from Israel and Nepal respectively.	Anna is from Israel.
contradiction	Louis and Patrick are from Ukraine and Japan respectively.	Patrick is from Ukraine.
contradiction	Al and Charlotte are from Ecuador and Singapore respectively.	Charlotte is from Ecuador.
contradiction	Harold and Amanda are from Ukraine and Russia respectively.	Amanda is from Ukraine.
contradiction	Christine and Barbara are from Qatar and Ireland respectively.	Barbara is from Qatar.
contradiction	Jonathan and Anthony are from Fiji and Maldives respectively.	Anthony is from Fiji.
contradiction	Jill and Philip are from Philippines and Zimbabwe respectively.	Philip is from Philippines.
contradiction	Ann and Dorothy are from New Zealand and Zimbabwe respectively.	Dorothy is from New Zealand.
contradiction	Charles and Elizabeth are from United States of America and Vietnam respectively.	Elizabeth is from United States of America.
contradiction	Walter and Betty are from Brazil and Egypt respectively.	Betty is from Brazil.
contradiction	Peter and Al are from Laos and North Korea respectively.	Al is from Laos.
contradiction	Alexander and Dan are from Singapore and Italy respectively.	Dan is from Singapore.
contradiction	Stephanie and Eleanor are from Netherlands and Canada respectively.	Eleanor is from Netherlands.
contradiction	Stephanie and William are from Vietnam and Ecuador respectively.	William is from Vietnam.
contradiction	Jonathan and Eleanor are from Taiwan and Maldives respectively.	Eleanor is from Taiwan.
contradiction	Margaret and Louise are from Italy and United Kingdom respectively.	Louise is from Italy.
contradiction	Peter and Sara are from Bhutan and Laos respectively.	Sara is from Bhutan.
contradiction	Chris and Howard are from Uruguay and Fiji respectively.	Howard is from Uruguay.
contradiction	Marilyn and Roy are from Portugal and Chile respectively.	Roy is from Portugal.
contradiction	Lauren and Frank are from Qatar and Libya respectively.	Frank is from Qatar.
contradiction	Patrick and Robin are from China and Saudi Arabia respectively.	Robin is from China.
contradiction	Ed and Edith are from Fiji and Chile respectively.	Edith is from Fiji.
contradiction	Steve and Don are from Maldives and North Korea respectively.	Don is from Maldives.
contradiction	Carl and Sara are from Vietnam and Denmark respectively.	Sara is from Vietnam.
contradiction	Susan and Stephen are from Mexico and Germany respectively.	Stephen is from Mexico.
contradiction	Michelle and Howard are from Israel and Belgium respectively.	Howard is from Israel.
contradiction	Matt and Adam are from China and Netherlands respectively.	Adam is from China.
contradiction	Ken and Lynn are from Haiti and Colombia respectively.	Lynn is from Haiti.
contradiction	Jean and Judith are from Israel and Thailand respectively.	Judith is from Israel.
contradiction	Ann and Jessica are from India and Bangladesh respectively.	Jessica is from India.
contradiction	Louis and Carolyn are from Haiti and Bhutan respectively.	Carolyn is from Haiti.
contradiction	Harold and Eric are from Vietnam and Iraq respectively.	Eric is from Vietnam.
contradiction	David and George are from Zimbabwe and New Zealand respectively.	George is from Zimbabwe.
contradiction	Colin and Martin are from Belgium and South Korea respectively.	Martin is from Belgium.
contradiction	Jean and Steve are from Portugal and Switzerland respectively.	Steve is from Portugal.
contradiction	Johnny and Harry are from North Korea and Denmark respectively.	Harry is from North Korea.
contradiction	Fred and Jerry are from New Zealand and Singapore respectively.	Jerry is from New Zealand.
contradiction	Kelly and Victoria are from Egypt and Malaysia respectively.	Victoria is from Egypt.
contradiction	Walter and Jessica are from Greece and Portugal respectively.	Jessica is from Greece.
contradiction	Thomas and Arthur are from Portugal and Iceland respectively.	Arthur is from Portugal.
contradiction	Peter and Heather are from Greece and Egypt respectively.	Heather is from Greece.
contradiction	Michelle and Dan are from Iraq and Bangladesh respectively.	Dan is from Iraq.
contradiction	Joan and Nicole are from Canada and Malaysia respectively.	Nicole is from Canada.
contradiction	Jim and Suzanne are from Indonesia and Egypt respectively.	Suzanne is from Indonesia.
contradiction	Francis and Mark are from Pakistan and Austria respectively.	Mark is from Pakistan.
contradiction	Bobby and Francis are from Switzerland and Greece respectively.	Francis is from Switzerland.
contradiction	Sandra and Dan are from Thailand and Argentina respectively.	Dan is from Thailand.
contradiction	Thomas and Carolyn are from Sweden and Russia respectively.	Carolyn is from Sweden.
contradiction	Ann and Tom are from Vietnam and Ecuador respectively.	Tom is from Vietnam.
contradiction	Charles and Caroline are from Austria and Zimbabwe respectively.	Caroline is from Austria.
contradiction	Janet and Edwin are from Switzerland and Bhutan respectively.	Edwin is from Switzerland.
contradiction	Janet and Ben are from Bangladesh and Australia respectively.	Ben is from Bangladesh.
contradiction	Colin and Steve are from Netherlands and Pakistan respectively.	Steve is from Netherlands.
contradiction	Katie and Donald are from Iran and Turkey respectively.	Donald is from Iran.
contradiction	Stephen and Hugh are from New Zealand and Vietnam respectively.	Hugh is from New Zealand.
contradiction	Roger and Mark are from Greece and Portugal respectively.	Mark is from Greece.
contradiction	Susan and Fred are from Canada and Israel respectively.	Fred is from Canada.
contradiction	Carolyn and Elaine are from Ukraine and Mexico respectively.	Elaine is from Ukraine.
contradiction	Alfred and Steven are from India and Chile respectively.	Steven is from India.
contradiction	Laura and Alexandra are from Nepal and Chile respectively.	Alexandra is from Nepal.
contradiction	Suzanne and Jessica are from India and Egypt respectively.	Jessica is from India.
contradiction	Linda and Anne are from Thailand and Denmark respectively.	Anne is from Thailand.
contradiction	Pamela and Katie are from China and Belgium respectively.	Katie is from China.
contradiction	Wendy and Arthur are from Maldives and Israel respectively.	Arthur is from Maldives.
contradiction	Peter and Frank are from Japan and Netherlands respectively.	Frank is from Japan.
contradiction	Ken and Marilyn are from United Arab Emirates and Turkey respectively.	Marilyn is from United Arab Emirates.
contradiction	Adam and Kevin are from Vietnam and Germany respectively.	Kevin is from Vietnam.
contradiction	Daniel and Sharon are from Belarus and Germany respectively.	Sharon is from Belarus.
contradiction	Ashley and Alison are from Colombia and Afghanistan respectively.	Alison is from Colombia.
contradiction	Roger and Wendy are from Austria and Japan respectively.	Wendy is from Austria.
contradiction	Benjamin and Henry are from Mexico and Bangladesh respectively.	Henry is from Mexico.
contradiction	Leslie and Emily are from Greece and Afghanistan respectively.	Emily is from Greece.
contradiction	Anthony and Jonathan are from Greece and Finland respectively.	Jonathan is from Greece.
contradiction	Nancy and Stephen are from Philippines and United Kingdom respectively.	Stephen is from Philippines.
contradiction	Carol and Stephen are from Finland and Bangladesh respectively.	Stephen is from Finland.
contradiction	Catherine and Alice are from Ecuador and Iceland respectively.	Alice is from Ecuador.
contradiction	Francis and Edith are from Fiji and Indonesia respectively.	Edith is from Fiji.
contradiction	Emily and Howard are from Laos and Indonesia respectively.	Howard is from Laos.
contradiction	Kate and Kenneth are from Qatar and Georgia respectively.	Kenneth is from Qatar.
contradiction	Diana and Lisa are from China and Saudi Arabia respectively.	Lisa is from China.
contradiction	Martin and Dave are from Ecuador and Iceland respectively.	Dave is from Ecuador.
contradiction	Louis and Leslie are from Poland and Netherlands respectively.	Leslie is from Poland.
contradiction	Catherine and Eric are from Colombia and Vietnam respectively.	Eric is from Colombia.
contradiction	Julia and Philip are from China and Saudi Arabia respectively.	Philip is from China.
contradiction	Ian and Hugh are from Indonesia and Iceland respectively.	Hugh is from Indonesia.
contradiction	Deborah and Virginia are from Ireland and Ecuador respectively.	Virginia is from Ireland.
contradiction	Louise and Bill are from Denmark and Libya respectively.	Bill is from Denmark.
contradiction	Matthew and William are from Switzerland and Austria respectively.	William is from Switzerland.
contradiction	Dave and Emily are from Qatar and Ireland respectively.	Emily is from Qatar.
contradiction	Francis and Charlotte are from Bhutan and United Arab Emirates respectively.	Charlotte is from Bhutan.
contradiction	Edward and Virginia are from Bangladesh and Switzerland respectively.	Virginia is from Bangladesh.
contradiction	Thomas and Jimmy are from Laos and Maldives respectively.	Jimmy is from Laos.
contradiction	Roy and Sharon are from Thailand and Iceland respectively.	Sharon is from Thailand.
contradiction	Carolyn and Simon are from Belarus and Bangladesh respectively.	Simon is from Belarus.
contradiction	Stephanie and John are from Iran and Qatar respectively.	John is from Iran.
contradiction	Robin and Ron are from Uruguay and Ghana respectively.	Ron is from Uruguay.
contradiction	Julie and Elaine are from Finland and Bhutan respectively.	Elaine is from Finland.
contradiction	Katie and Martin are from Nepal and Fiji respectively.	Martin is from Nepal.
contradiction	Anne and Samuel are from Indonesia and Turkey respectively.	Samuel is from Indonesia.
contradiction	Mark and Joan are from Oman and Ecuador respectively.	Joan is from Oman.
contradiction	Marilyn and Lauren are from Vietnam and India respectively.	Lauren is from Vietnam.
contradiction	Billy and Susan are from Germany and Indonesia respectively.	Susan is from Germany.
contradiction	Christine and Paul are from Nepal and Malaysia respectively.	Paul is from Nepal.
contradiction	Larry and Lynn are from Argentina and Russia respectively.	Lynn is from Argentina.
contradiction	Ruth and Kathy are from Poland and Libya respectively.	Kathy is from Poland.
contradiction	Emily and Martha are from Turkey and United Arab Emirates respectively.	Martha is from Turkey.
contradiction	Lisa and Steven are from Portugal and Philippines respectively.	Steven is from Portugal.
contradiction	Sandra and Ruth are from United Arab Emirates and North Korea respectively.	Ruth is from United Arab Emirates.
contradiction	Stephen and Gary are from Thailand and Singapore respectively.	Gary is from Thailand.
contradiction	Helen and William are from Libya and Turkey respectively.	William is from Libya.
contradiction	Patrick and Rebecca are from Taiwan and United Kingdom respectively.	Rebecca is from Taiwan.
contradiction	Kenneth and Patricia are from South Korea and Finland respectively.	Patricia is from South Korea.
contradiction	Roger and Cynthia are from Italy and Denmark respectively.	Cynthia is from Italy.
contradiction	Alice and Patricia are from Oman and France respectively.	Patricia is from Oman.
contradiction	Emma and Karen are from Qatar and Georgia respectively.	Karen is from Qatar.
contradiction	Brian and Sara are from Chile and Libya respectively.	Sara is from Chile.
contradiction	Linda and Robin are from Egypt and Netherlands respectively.	Robin is from Egypt.
contradiction	Sophie and Donna are from United States of America and Bangladesh respectively.	Donna is from United States of America.
contradiction	Rebecca and Walter are from United Arab Emirates and Saudi Arabia respectively.	Walter is from United Arab Emirates.
contradiction	Jessica and Joan are from Libya and Greece respectively.	Joan is from Libya.
contradiction	Ray and Paul are from United States of America and Georgia respectively.	Paul is from United States of America.
contradiction	Anne and Charlotte are from Germany and Oman respectively.	Charlotte is from Germany.
contradiction	Bruce and Angela are from Colombia and Turkey respectively.	Angela is from Colombia.
contradiction	Julia and Stephanie are from France and North Korea respectively.	Stephanie is from France.
contradiction	Dorothy and Robert are from Austria and Hungary respectively.	Robert is from Austria.
contradiction	Anne and Bobby are from France and Japan respectively.	Bobby is from France.
contradiction	Sandra and Jean are from Canada and Thailand respectively.	Jean is from Canada.
contradiction	Melissa and Kathleen are from Laos and Thailand respectively.	Kathleen is from Laos.
contradiction	Bill and Alfred are from Azerbaijan and Iran respectively.	Alfred is from Azerbaijan.
contradiction	Henry and Lauren are from Bangladesh and Bhutan respectively.	Lauren is from Bangladesh.
contradiction	Stephanie and Amy are from Netherlands and Bhutan respectively.	Amy is from Netherlands.
contradiction	Fiona and Louis are from Italy and Egypt respectively.	Louis is from Italy.
contradiction	Carolyn and Albert are from Philippines and Austria respectively.	Albert is from Philippines.
contradiction	Suzanne and Harold are from New Zealand and Iran respectively.	Harold is from New Zealand.
contradiction	Albert and Marie are from Singapore and Saudi Arabia respectively.	Marie is from Singapore.
contradiction	Martha and Andrea are from Poland and Afghanistan respectively.	Andrea is from Poland.
contradiction	Benjamin and Patrick are from Fiji and Sweden respectively.	Patrick is from Fiji.
contradiction	Melissa and Kathleen are from Indonesia and Saudi Arabia respectively.	Kathleen is from Indonesia.
contradiction	Jerry and Diana are from North Korea and Hungary respectively.	Diana is from North Korea.
contradiction	Francis and Annie are from Belarus and Denmark respectively.	Annie is from Belarus.
contradiction	Carol and Andrea are from Portugal and Hungary respectively.	Andrea is from Portugal.
contradiction	Lauren and Richard are from Hungary and Greece respectively.	Richard is from Hungary.
contradiction	Laura and Bruce are from Switzerland and Thailand respectively.	Bruce is from Switzerland.
contradiction	Nicole and Diana are from Iraq and Switzerland respectively.	Diana is from Iraq.
contradiction	Lucy and Donald are from Chile and Ireland respectively.	Donald is from Chile.
contradiction	Kathleen and William are from Ecuador and Portugal respectively.	William is from Ecuador.
contradiction	Ashley and Dick are from Ecuador and Russia respectively.	Dick is from Ecuador.
contradiction	Marilyn and Victoria are from Mexico and Cuba respectively.	Victoria is from Mexico.
contradiction	Carolyn and Patricia are from Taiwan and Russia respectively.	Patricia is from Taiwan.
contradiction	Robin and Martha are from Zimbabwe and Germany respectively.	Martha is from Zimbabwe.
contradiction	Kathryn and Robin are from Finland and Germany respectively.	Robin is from Finland.
contradiction	Lynn and Catherine are from China and Libya respectively.	Catherine is from China.
contradiction	Janet and Louis are from France and China respectively.	Louis is from France.
contradiction	Andrea and Nicole are from Laos and Bhutan respectively.	Nicole is from Laos.
contradiction	Elizabeth and Rose are from Saudi Arabia and Turkey respectively.	Rose is from Saudi Arabia.
contradiction	Heather and Rachel are from India and Oman respectively.	Rachel is from India.
contradiction	Francis and Harold are from United Kingdom and Libya respectively.	Harold is from United Kingdom.
contradiction	Peter and Anna are from Austria and Bhutan respectively.	Anna is from Austria.
contradiction	Katherine and Matthew are from Denmark and Germany respectively.	Matthew is from Denmark.
contradiction	Helen and Caroline are from Saudi Arabia and Pakistan respectively.	Caroline is from Saudi Arabia.
contradiction	William and Charlotte are from Azerbaijan and Zimbabwe respectively.	Charlotte is from Azerbaijan.
contradiction	Sandra and Tony are from France and United States of America respectively.	Tony is from France.
contradiction	Nancy and Robert are from Poland and Germany respectively.	Robert is from Poland.
contradiction	Ryan and Caroline are from Italy and Uruguay respectively.	Caroline is from Italy.
contradiction	Marie and Pamela are from China and Iraq respectively.	Pamela is from China.
contradiction	Sophie and Helen are from Haiti and Denmark respectively.	Helen is from Haiti.
contradiction	Ralph and Marie are from Cuba and Georgia respectively.	Marie is from Cuba.
contradiction	Ruth and Emily are from Chile and Bangladesh respectively.	Emily is from Chile.
contradiction	Harriet and Claire are from Vietnam and South Korea respectively.	Claire is from Vietnam.
contradiction	Ann and Billy are from United States of America and Portugal respectively.	Billy is from United States of America.
contradiction	Angela and Brian are from Canada and Taiwan respectively.	Brian is from Canada.
contradiction	Claire and Alfred are from United Arab Emirates and Bhutan respectively.	Alfred is from United Arab Emirates.
contradiction	Bob and Maria are from Oman and Finland respectively.	Maria is from Oman.
contradiction	Harold and Mike are from France and Canada respectively.	Mike is from France.
contradiction	Wendy and Adam are from Argentina and Brazil respectively.	Adam is from Argentina.
contradiction	Samuel and Katie are from Belarus and France respectively.	Katie is from Belarus.
contradiction	Jean and Melissa are from Finland and Afghanistan respectively.	Melissa is from Finland.
contradiction	Susan and Jonathan are from Finland and Austria respectively.	Jonathan is from Finland.
contradiction	Deborah and Tim are from Sweden and Vietnam respectively.	Tim is from Sweden.
contradiction	James and Christopher are from Mexico and Iran respectively.	Christopher is from Mexico.
contradiction	Eleanor and Steven are from Sweden and Turkey respectively.	Steven is from Sweden.
contradiction	Charlie and Wendy are from Ukraine and Poland respectively.	Wendy is from Ukraine.
contradiction	Ashley and Michael are from Iran and Bangladesh respectively.	Michael is from Iran.
