entailment	Marie is incompetent, weak and cool-headed.	Marie is cool-headed.
entailment	Fiona is indefatigable, curious and groggy.	Fiona is groggy.
entailment	Anna is ferocious, ridiculous and boisterous.	Anna is boisterous.
entailment	Fiona is prudent, well-developed and gentle.	Fiona is gentle.
entailment	Nicole is irritable, unpleasant and sentimental.	Nicole is sentimental.
entailment	Andrea is churlish, irascible and adventurous.	Andrea is adventurous.
entailment	Julia is affectionate, churlish and unreliable.	Julia is unreliable.
entailment	Louise is joyous, unwilling and amusing.	Louise is amusing.
entailment	Ryan is talented, plain and beautiful.	Ryan is beautiful.
entailment	George is enthusiastic, impressionable and careful.	George is careful.
entailment	Scott is indefatigable, deft and revered.	Scott is revered.
entailment	Bill is paternal, intolerant and caustic.	Bill is caustic.
entailment	Benjamin is deep, self-assured and capable.	Benjamin is capable.
entailment	Katie is cool, reliable and unwilling.	Katie is unwilling.
entailment	Alice is picky, impractical and lithe.	Alice is lithe.
entailment	Wendy is lethargic, artificial and frank.	Wendy is frank.
entailment	Sophie is shrewd, numb and pleasant.	Sophie is pleasant.
entailment	Carol is well-intentioned, awesome and composed.	Carol is composed.
entailment	Virginia is inconsiderate, reluctant and passionate.	Virginia is passionate.
entailment	Jim is candid, keen and lovable.	Jim is lovable.
entailment	Alfred is natural, leery and thoughtful.	Alfred is thoughtful.
entailment	William is flabby, sensitive and unreliable.	William is unreliable.
entailment	Tim is experienced, selfish and demure.	Tim is demure.
entailment	Robert is surly, careful and childlike.	Robert is childlike.
entailment	Daniel is uncertain, dependent and amusing.	Daniel is amusing.
entailment	Alan is uncertain, peevish and smart.	Alan is smart.
entailment	Victoria is affectionate, tactful and orderly.	Victoria is orderly.
entailment	Frances is weak, deft and well-behaved.	Frances is well-behaved.
entailment	Julie is hateful, reliable and natural.	Julie is natural.
entailment	Claire is lithe, below average and unaffected.	Claire is unaffected.
entailment	Jay is proud, versatile and sneering.	Jay is sneering.
entailment	Larry is realistic, plucky and delightful.	Larry is delightful.
entailment	Ryan is sloppy, peaceful and guarded.	Ryan is guarded.
entailment	Amy is thoughtless, circumspect and indiscreet.	Amy is indiscreet.
entailment	Sophie is reliable, cautious and silly.	Sophie is silly.
entailment	Kathleen is inexperienced, unwilling and obnoxious.	Kathleen is obnoxious.
entailment	Sandra is kind, abnormal and normal.	Sandra is normal.
entailment	Lauren is stupid, obnoxious and clean.	Lauren is clean.
entailment	Jonathan is unaffected, jovial and tactless.	Jonathan is tactless.
entailment	Joan is deep, numb and clumsy.	Joan is clumsy.
entailment	Adam is unpleasant, idiotic and confident.	Adam is confident.
entailment	Jeff is mild, blunt and mature.	Jeff is mature.
entailment	Jerry is one-sided, responsible and uncooperative.	Jerry is uncooperative.
entailment	Charles is devoted, slothful and touchy.	Charles is touchy.
entailment	Steve is petulant, impetuous and practical.	Steve is practical.
entailment	Jim is unhelpful, proud and experienced.	Jim is experienced.
entailment	Harriet is testy, reclusive and naughty.	Harriet is naughty.
entailment	Ashley is excellent, cranky and drugged.	Ashley is drugged.
entailment	Margaret is drowsy, flabby and unsure.	Margaret is unsure.
entailment	Ben is vulnerable, reclusive and pleasant.	Ben is pleasant.
entailment	Elizabeth is normal, well-respected and disagreeable.	Elizabeth is disagreeable.
entailment	Frederick is nasty, circumspect and natural.	Frederick is natural.
entailment	Lauren is quick, drugged and sharp.	Lauren is sharp.
entailment	Diane is able, shrewd and interesting.	Diane is interesting.
entailment	Donna is mercurial, sassy and frank.	Donna is frank.
entailment	Tim is vigilant, distrustful and jocular.	Tim is jocular.
entailment	Lawrence is awesome, reliable and delightful.	Lawrence is delightful.
entailment	Henry is numb, impractical and grouchy.	Henry is grouchy.
entailment	Stephen is careless, lethargic and restless.	Stephen is restless.
entailment	Marilyn is venal, passionate and sneering.	Marilyn is sneering.
entailment	Henry is beneficent, keen and modest.	Henry is modest.
entailment	George is industrious, flashy and affectionate.	George is affectionate.
entailment	Anthony is warm, courageous and unbalanced.	Anthony is unbalanced.
entailment	Linda is persevering, confused and idle.	Linda is idle.
entailment	Fiona is impulsive, obliging and local.	Fiona is local.
entailment	Harry is angelic, sentimental and responsible.	Harry is responsible.
entailment	Arthur is cruel, industrious and practical.	Arthur is practical.
entailment	Kenneth is respectful, well-rounded and sincere.	Kenneth is sincere.
entailment	Paul is dull, incompetent and nervous.	Paul is nervous.
entailment	Evelyn is sour, industrious and leery.	Evelyn is leery.
entailment	Leslie is mild, callous and boisterous.	Leslie is boisterous.
entailment	Stephen is proficient, sad and inventive.	Stephen is inventive.
entailment	Mike is awesome, unfriendly and distrustful.	Mike is distrustful.
entailment	Jane is energetic, cheerful and judgmental.	Jane is judgmental.
entailment	Louis is sullen, cantankerous and well-behaved.	Louis is well-behaved.
entailment	Colin is sad, imperturbable and venal.	Colin is venal.
entailment	Christopher is frank, persnickety and gloomy.	Christopher is gloomy.
entailment	Samuel is disruptive, negative and nasty.	Samuel is nasty.
entailment	Johnny is callous, undependable and passionate.	Johnny is passionate.
entailment	Marilyn is depressed, thoughtful and petulant.	Marilyn is petulant.
entailment	Frederick is irascible, mercurial and pleasant.	Frederick is pleasant.
entailment	Tony is stoic, miserable and easy-going.	Tony is easy-going.
entailment	Suzanne is average, drugged and exacting.	Suzanne is exacting.
entailment	Roger is pleasant, energetic and able.	Roger is able.
entailment	Caroline is direct, attentive and hearty.	Caroline is hearty.
entailment	Linda is direct, unaffected and great.	Linda is great.
entailment	Katherine is imperturbable, provocative and picky.	Katherine is picky.
entailment	Andrea is awesome, maternal and timid.	Andrea is timid.
entailment	Greg is impulsive, fervent and plain-speaking.	Greg is plain-speaking.
entailment	Charlotte is jocular, friendly and restless.	Charlotte is restless.
entailment	Gary is depressed, hateful and cowardly.	Gary is cowardly.
entailment	Jay is dull, drunk and sneering.	Jay is sneering.
entailment	Harry is caustic, intolerant and disagreeable.	Harry is disagreeable.
entailment	Patrick is demonic, crabby and good.	Patrick is good.
entailment	Louise is normal, courageous and independent.	Louise is independent.
entailment	Harold is serene, affectionate and passive.	Harold is passive.
entailment	Kate is tolerant, hearty and mean.	Kate is mean.
entailment	Ashley is slow, clumsy and peaceful.	Ashley is peaceful.
entailment	Barbara is cooperative, obliging and unwilling.	Barbara is unwilling.
entailment	Sara is indefatigable, grouchy and beneficent.	Sara is beneficent.
entailment	Anthony is persnickety, sedate and enthusiastic.	Anthony is enthusiastic.
entailment	Robin is snazzy, imaginative and restless.	Robin is restless.
entailment	Stephanie is undependable, well-respected and candid.	Stephanie is candid.
entailment	Mark is direct, playful and crabby.	Mark is crabby.
entailment	Lawrence is unimaginative, illogical and sassy.	Lawrence is sassy.
entailment	George is dowdy, cantankerous and distant.	George is distant.
entailment	Jeff is wonderful, cool-headed and interesting.	Jeff is interesting.
entailment	Don is slothful, serious and cool-headed.	Don is cool-headed.
entailment	Christopher is above average, impressionable and old-fashioned.	Christopher is old-fashioned.
entailment	Billy is deep, sour and beneficent.	Billy is beneficent.
entailment	Kate is sulky, quick and quiet.	Kate is quiet.
entailment	Rachel is local, impulsive and lazy.	Rachel is lazy.
entailment	Johnny is flabby, childish and angelic.	Johnny is angelic.
entailment	Sally is persevering, mature and tired.	Sally is tired.
entailment	Larry is fiery, unguarded and popular.	Larry is popular.
entailment	Johnny is polite, respected and listless.	Johnny is listless.
entailment	Arthur is earnest, sincere and resourceful.	Arthur is resourceful.
entailment	Dan is indolent, saucy and naive.	Dan is naive.
entailment	Maria is sincere, charming and impatient.	Maria is impatient.
entailment	Sophie is disagreeable, sleepy and resigned.	Sophie is resigned.
entailment	Donald is volcanic, polite and lithe.	Donald is lithe.
entailment	Tom is amiable, striking and picky.	Tom is picky.
entailment	Deborah is cool, dowdy and unthinking.	Deborah is unthinking.
entailment	Walter is crabby, resentful and nasty.	Walter is nasty.
entailment	Carolyn is tired, deferential and thoughtless.	Carolyn is thoughtless.
entailment	Rose is gloomy, eager and clumsy.	Rose is clumsy.
entailment	Carl is experienced, smart and punctual.	Carl is punctual.
entailment	Katherine is fabulous, fastidious and querulous.	Katherine is querulous.
entailment	Kathleen is surly, kind and ostentatious.	Kathleen is ostentatious.
entailment	Marilyn is motivated, grave and dull.	Marilyn is dull.
entailment	Jim is wary, well-respected and careful.	Jim is careful.
entailment	Charlie is alert, impetuous and leery.	Charlie is leery.
entailment	Julia is cowardly, average and diligent.	Julia is diligent.
entailment	Simon is peevish, decisive and weak.	Simon is weak.
entailment	Janet is uncertain, miserable and talented.	Janet is talented.
entailment	Patrick is amazing, respected and sober.	Patrick is sober.
entailment	Kim is cranky, industrious and pleasant.	Kim is pleasant.
entailment	Florence is tranquil, unsophisticated and undependable.	Florence is undependable.
entailment	Jay is logical, dull and friendly.	Jay is friendly.
entailment	Bob is cowardly, spirited and kind.	Bob is kind.
entailment	Alison is indefatigable, selfish and plucky.	Alison is plucky.
entailment	Lauren is idiotic, sullen and average.	Lauren is average.
entailment	Samuel is bright, adventurous and discreet.	Samuel is discreet.
entailment	Frances is circumspect, deferential and frank.	Frances is frank.
entailment	Susan is orderly, outspoken and querulous.	Susan is querulous.
entailment	Laura is provocative, fervent and ambitious.	Laura is ambitious.
entailment	Pamela is uncertain, sullen and striking.	Pamela is striking.
entailment	Matthew is awful, exacting and confused.	Matthew is confused.
entailment	Martin is popular, obliging and eager.	Martin is eager.
entailment	Judy is composed, amiable and slight.	Judy is slight.
entailment	Lynn is meticulous, inventive and fervent.	Lynn is fervent.
entailment	Marie is apathetic, uncooperative and judgmental.	Marie is judgmental.
entailment	Carol is childish, unsophisticated and timid.	Carol is timid.
entailment	Charles is demure, sour and amusing.	Charles is amusing.
entailment	Bruce is one-sided, unpleasant and incisive.	Bruce is incisive.
entailment	Robert is warmhearted, stoic and idle.	Robert is idle.
entailment	Jeff is careful, jocular and spiteful.	Jeff is spiteful.
entailment	Robert is resigned, alert and well-rounded.	Robert is well-rounded.
entailment	Nicole is warm, love-lorn and adventurous.	Nicole is adventurous.
entailment	Kathleen is amiable, delicate and sassy.	Kathleen is sassy.
entailment	Hugh is callous, logical and ferocious.	Hugh is ferocious.
entailment	Anthony is normal, reclusive and cynical.	Anthony is cynical.
entailment	Emily is dainty, capable and unthinking.	Emily is unthinking.
entailment	Hugh is shrewd, cold and tactful.	Hugh is tactful.
entailment	Grace is tolerant, sassy and respected.	Grace is respected.
entailment	Melissa is provocative, cowardly and impractical.	Melissa is impractical.
entailment	Jerry is lithe, pretty and friendly.	Jerry is friendly.
entailment	Patricia is cautious, disagreeable and illogical.	Patricia is illogical.
entailment	Ruth is sad, direct and patient.	Ruth is patient.
entailment	Mary is sulky, watchful and popular.	Mary is popular.
entailment	Harry is plucky, nosy and slow.	Harry is slow.
entailment	David is amazing, patient and unpopular.	David is unpopular.
entailment	Susan is watchful, impetuous and buff.	Susan is buff.
entailment	Alfred is cowardly, depressed and wary.	Alfred is wary.
entailment	Brian is outgoing, dowdy and shy.	Brian is shy.
entailment	Charles is childish, alert and revered.	Charles is revered.
entailment	Marie is even-tempered, provocative and hot-headed.	Marie is hot-headed.
entailment	Joan is inventive, tactless and coherent.	Joan is coherent.
entailment	Frank is unfriendly, kind and lean.	Frank is lean.
entailment	David is plucky, disagreeable and natural.	David is natural.
entailment	Lauren is responsible, beneficent and petulant.	Lauren is petulant.
entailment	Deborah is considerate, efficient and cooperative.	Deborah is cooperative.
entailment	Grace is immature, inexperienced and able.	Grace is able.
entailment	Janet is sober, nosy and shy.	Janet is shy.
entailment	Sandra is decisive, spiteful and unbalanced.	Sandra is unbalanced.
entailment	Ann is petulant, inconsistent and excitable.	Ann is excitable.
entailment	Ashley is fervent, lean and candid.	Ashley is candid.
entailment	Harold is polite, watchful and cranky.	Harold is cranky.
entailment	Diana is timid, energetic and gluttonous.	Diana is gluttonous.
entailment	Jimmy is grouchy, unstable and cautious.	Jimmy is cautious.
entailment	Billy is considerate, insensitive and curious.	Billy is curious.
entailment	Colin is idle, mature and discerning.	Colin is discerning.
entailment	Andrew is grave, independent and practical.	Andrew is practical.
entailment	Patricia is nervous, impatient and thinking.	Patricia is thinking.
entailment	Alexander is able, unfriendly and irritating.	Alexander is irritating.
entailment	Kathryn is independent, absent-minded and irritable.	Kathryn is irritable.
entailment	Anna is plain-speaking, inactive and cruel.	Anna is cruel.
entailment	Martin is strong, chic and cordial.	Martin is cordial.
entailment	Stephen is plain, callous and obliging.	Stephen is obliging.
entailment	Walter is lively, realistic and positive.	Walter is positive.
entailment	Joan is unsophisticated, imperturbable and joyous.	Joan is joyous.
entailment	Julia is plain, querulous and interesting.	Julia is interesting.
entailment	Harold is versatile, devoted and supercilious.	Harold is supercilious.
entailment	Elaine is peevish, ridiculous and beautiful.	Elaine is beautiful.
entailment	Jim is slight, clumsy and decisive.	Jim is decisive.
entailment	Nancy is discreet, disruptive and analytical.	Nancy is analytical.
entailment	Fred is impulsive, petulant and interesting.	Fred is interesting.
entailment	Kathleen is earnest, adventurous and unfriendly.	Kathleen is unfriendly.
entailment	Carolyn is reliable, immodest and pleasant.	Carolyn is pleasant.
entailment	Mark is excellent, bright and beautiful.	Mark is beautiful.
entailment	Robert is sneering, ostentatious and groggy.	Robert is groggy.
entailment	Evelyn is eager, well-intentioned and persnickety.	Evelyn is persnickety.
entailment	Peter is morose, love-lorn and orderly.	Peter is orderly.
entailment	Heather is reclusive, selfish and amusing.	Heather is amusing.
entailment	Kate is illogical, gluttonous and amazing.	Kate is amazing.
entailment	Laura is capable, gentle and dramatic.	Laura is dramatic.
entailment	Mary is proficient, hearty and vigilant.	Mary is vigilant.
entailment	Dick is good, clean and kind.	Dick is kind.
entailment	Gary is slovenly, angelic and thinking.	Gary is thinking.
entailment	Emma is patient, sweet and depressed.	Emma is depressed.
entailment	Julia is paternal, delightful and beautiful.	Julia is beautiful.
entailment	Alfred is motivated, unemotional and able.	Alfred is able.
entailment	Tom is unstable, slight and unimaginative.	Tom is unimaginative.
entailment	Anna is hesitant, content and irascible.	Anna is irascible.
entailment	Howard is absent-minded, proud and well-developed.	Howard is well-developed.
entailment	Angela is lovable, agreeable and passionate.	Angela is passionate.
entailment	Kate is slovenly, mature and staid.	Kate is staid.
entailment	Lauren is outgoing, reassuring and cruel.	Lauren is cruel.
entailment	Evelyn is depressed, passive and conceited.	Evelyn is conceited.
entailment	Wendy is hypercritical, provocative and confident.	Wendy is confident.
entailment	Louis is considerate, pretty and respected.	Louis is respected.
entailment	Dick is proficient, cool-headed and impulsive.	Dick is impulsive.
entailment	Dave is careless, sincere and impatient.	Dave is impatient.
entailment	James is kind, sneering and civil.	James is civil.
entailment	Daniel is average, watchful and obliging.	Daniel is obliging.
entailment	Mike is coherent, funny and earnest.	Mike is earnest.
entailment	Jim is unmotivated, dreary and lethargic.	Jim is lethargic.
entailment	Howard is enterprising, competent and sassy.	Howard is sassy.
entailment	Edwin is mild, touchy and disagreeable.	Edwin is disagreeable.
entailment	Maria is grouchy, enterprising and dependent.	Maria is dependent.
entailment	Dick is fabulous, impatient and considerate.	Dick is considerate.
entailment	Michelle is reserved, distant and inactive.	Michelle is inactive.
entailment	Dave is nasty, elfin and sulky.	Dave is sulky.
entailment	Ellen is timid, proud and demure.	Ellen is demure.
entailment	Matt is earnest, quick-tempered and distant.	Matt is distant.
entailment	Susan is conscientious, keen and kind.	Susan is kind.
entailment	Robert is above average, ferocious and crabby.	Robert is crabby.
entailment	Alexander is meddlesome, ambitious and analytical.	Alexander is analytical.
entailment	John is hypercritical, adventurous and proficient.	John is proficient.
entailment	Colin is dainty, tactless and orderly.	Colin is orderly.
entailment	Ryan is ridiculous, delightful and thinking.	Ryan is thinking.
entailment	Lisa is distant, love-lorn and revered.	Lisa is revered.
entailment	Richard is delightful, weak and paternal.	Richard is paternal.
entailment	Alfred is curious, angelic and willing.	Alfred is willing.
entailment	Michael is brilliant, irascible and clean.	Michael is clean.
entailment	Eric is peevish, unhelpful and flashy.	Eric is flashy.
entailment	Sue is persnickety, lazy and methodical.	Sue is methodical.
entailment	Annie is peaceful, beneficent and cynical.	Annie is cynical.
entailment	Florence is obliging, ferocious and devoted.	Florence is devoted.
entailment	Jay is churlish, incompetent and powerful.	Jay is powerful.
entailment	Dan is deft, dowdy and querulous.	Dan is querulous.
entailment	Tom is venal, delightful and peaceful.	Tom is peaceful.
entailment	Ben is devoted, gloomy and orderly.	Ben is orderly.
entailment	Annie is confused, chic and clever.	Annie is clever.
entailment	Jay is selfish, unsure and sturdy.	Jay is sturdy.
entailment	Jonathan is old-fashioned, wonderful and apathetic.	Jonathan is apathetic.
entailment	Suzanne is buff, reluctant and pensive.	Suzanne is pensive.
entailment	Tony is provocative, charming and funny.	Tony is funny.
entailment	Arthur is caustic, keen and querulous.	Arthur is querulous.
entailment	Howard is reassuring, cowardly and obnoxious.	Howard is obnoxious.
entailment	Martin is flabby, morose and obnoxious.	Martin is obnoxious.
entailment	Eleanor is outgoing, naive and cooperative.	Eleanor is cooperative.
entailment	Ryan is cheerful, wary and flashy.	Ryan is flashy.
entailment	Karen is fussy, decisive and unwilling.	Karen is unwilling.
entailment	Ralph is indolent, pensive and sensible.	Ralph is sensible.
entailment	Jerry is capable, watchful and local.	Jerry is local.
entailment	Alison is groggy, watchful and critical.	Alison is critical.
entailment	Virginia is stoic, disagreeable and dutiful.	Virginia is dutiful.
entailment	Mike is reliable, intelligent and deferential.	Mike is deferential.
entailment	Bill is apathetic, beautiful and content.	Bill is content.
entailment	Catherine is deferential, stupid and hot-headed.	Catherine is hot-headed.
entailment	Joe is peevish, superficial and reserved.	Joe is reserved.
entailment	Matt is unpopular, inactive and hysterical.	Matt is hysterical.
entailment	Lucy is steady, discreet and pleasant.	Lucy is pleasant.
entailment	Jonathan is analytical, distraught and ardent.	Jonathan is ardent.
entailment	Jeff is cold, stern and efficient.	Jeff is efficient.
entailment	Brian is nasty, conceited and discerning.	Brian is discerning.
entailment	Patrick is joyous, sturdy and bright.	Patrick is bright.
entailment	Stephen is affectionate, enterprising and charming.	Stephen is charming.
entailment	Sandra is beneficent, unmotivated and hateful.	Sandra is hateful.
entailment	Charlie is cold, impressive and apathetic.	Charlie is apathetic.
entailment	Jimmy is unpleasant, blunt and jovial.	Jimmy is jovial.
entailment	Melissa is crass, unpleasant and immodest.	Melissa is immodest.
entailment	Donna is meddlesome, inconsistent and picky.	Donna is picky.
entailment	Mark is naughty, volcanic and noisy.	Mark is noisy.
entailment	David is apprehensive, impractical and condescending.	David is condescending.
entailment	Carl is sullen, chic and lithe.	Carl is lithe.
entailment	Ralph is indefatigable, judgmental and indolent.	Ralph is indolent.
entailment	Jason is diligent, apprehensive and cranky.	Jason is cranky.
entailment	Benjamin is unpopular, cooperative and gentle.	Benjamin is gentle.
entailment	Joseph is passionate, jovial and tranquil.	Joseph is tranquil.
entailment	Eleanor is quick, methodical and morose.	Eleanor is morose.
entailment	William is deep, confident and bright.	William is bright.
entailment	Nick is childish, proficient and irascible.	Nick is irascible.
entailment	Kelly is distant, tired and one-sided.	Kelly is one-sided.
entailment	Harriet is well-intentioned, wonderful and fervent.	Harriet is fervent.
entailment	Lynn is resentful, soulful and fastidious.	Lynn is fastidious.
entailment	Stephanie is mean, elfin and outspoken.	Stephanie is outspoken.
entailment	Bob is inspiring, miserable and independent.	Bob is independent.
entailment	Andrew is careful, musical and sullen.	Andrew is sullen.
entailment	Frederick is staid, deft and maternal.	Frederick is maternal.
entailment	Ron is irascible, versatile and beautiful.	Ron is beautiful.
entailment	James is thoughtful, sincere and competent.	James is competent.
entailment	Amanda is natural, distraught and indiscreet.	Amanda is indiscreet.
entailment	Keith is tactless, sedate and slight.	Keith is slight.
entailment	Lauren is well-intentioned, moronic and devoted.	Lauren is devoted.
entailment	Tom is serene, proud and distraught.	Tom is distraught.
entailment	Kate is silly, idiotic and blunt.	Kate is blunt.
entailment	Jennifer is timid, brilliant and sneering.	Jennifer is sneering.
entailment	Peter is courageous, tranquil and prudent.	Peter is prudent.
entailment	Louise is enterprising, sloppy and composed.	Louise is composed.
entailment	Caroline is level-headed, irascible and warmhearted.	Caroline is warmhearted.
entailment	Laura is dull, methodical and confident.	Laura is confident.
entailment	Ralph is paternal, composed and impressionable.	Ralph is impressionable.
entailment	Joe is vigilant, venal and brave.	Joe is brave.
entailment	Wendy is evasive, careless and agreeable.	Wendy is agreeable.
entailment	Lucy is normal, amazing and flashy.	Lucy is flashy.
entailment	Al is obnoxious, soulful and unhelpful.	Al is unhelpful.
entailment	Jean is self-assured, unsophisticated and cowardly.	Jean is cowardly.
entailment	Joseph is ridiculous, ferocious and dependent.	Joseph is dependent.
entailment	David is awful, lovely and methodical.	David is methodical.
entailment	Deborah is one-sided, blunt and inconsiderate.	Deborah is inconsiderate.
entailment	Barbara is lame, numb and experienced.	Barbara is experienced.
entailment	Ann is motivated, easy-going and sober.	Ann is sober.
entailment	Stephanie is awful, vulnerable and inspiring.	Stephanie is inspiring.
entailment	Joe is guarded, absent-minded and indefatigable.	Joe is indefatigable.
entailment	Anne is easy-going, practical and egotistical.	Anne is egotistical.
entailment	Evelyn is good, ridiculous and inexperienced.	Evelyn is inexperienced.
entailment	Larry is fastidious, devoted and unguarded.	Larry is unguarded.
entailment	Martin is sleepy, local and wary.	Martin is wary.
entailment	Michelle is circumspect, serene and reluctant.	Michelle is reluctant.
entailment	Frank is listless, versatile and outspoken.	Frank is outspoken.
entailment	John is intolerant, dextrous and cantankerous.	John is cantankerous.
entailment	Alexander is content, thoughtful and civil.	Alexander is civil.
entailment	Rose is wary, inspiring and helpful.	Rose is helpful.
entailment	Edwin is well-intentioned, shrewd and callous.	Edwin is callous.
entailment	Julie is unfriendly, dainty and mean.	Julie is mean.
entailment	Emma is steady, silly and impressionable.	Emma is impressionable.
entailment	Jane is immature, snobby and incisive.	Jane is incisive.
entailment	Patrick is insensitive, sensitive and enterprising.	Patrick is enterprising.
entailment	Martha is methodical, direct and resourceful.	Martha is resourceful.
entailment	Frederick is dirty, fervent and lively.	Frederick is lively.
entailment	Edward is lovable, outspoken and buff.	Edward is buff.
entailment	Greg is excitable, shrewd and obnoxious.	Greg is obnoxious.
entailment	Pamela is naive, beneficent and subtle.	Pamela is subtle.
entailment	Kim is selfish, adventurous and unthinking.	Kim is unthinking.
entailment	Harry is blunt, dowdy and unwilling.	Harry is unwilling.
