entailment	Nick is impractical, snazzy and flashy.	Nick is flashy.
entailment	Deborah is selfish, intelligent and tolerant.	Deborah is tolerant.
entailment	Alfred is cold, condescending and adventurous.	Alfred is adventurous.
entailment	John is egotistical, slow and staid.	John is staid.
entailment	Victoria is wonderful, hateful and weak.	Victoria is weak.
entailment	Donald is tactless, methodical and vulnerable.	Donald is vulnerable.
entailment	Ray is drowsy, clean and persevering.	Ray is persevering.
entailment	Lucy is cantankerous, reserved and critical.	Lucy is critical.
entailment	Kathryn is peaceful, hateful and average.	Kathryn is average.
entailment	Ashley is obliging, modest and amusing.	Ashley is amusing.
entailment	Angela is restless, kind and paternal.	Angela is paternal.
entailment	Philip is dull, crass and energetic.	Philip is energetic.
entailment	Jason is ridiculous, boisterous and shy.	Jason is shy.
entailment	Diane is nasty, grouchy and incompetent.	Diane is incompetent.
entailment	Roger is love-lorn, motivated and beneficent.	Roger is beneficent.
entailment	Jonathan is undependable, childlike and condescending.	Jonathan is condescending.
entailment	Alexandra is volcanic, sturdy and crass.	Alexandra is crass.
entailment	Emily is musical, resourceful and efficient.	Emily is efficient.
entailment	Amanda is callous, amazing and imaginative.	Amanda is imaginative.
entailment	Alexander is thinking, warm and lame.	Alexander is lame.
entailment	Jill is bright, picky and jovial.	Jill is jovial.
entailment	Harriet is grave, inventive and willing.	Harriet is willing.
entailment	Sharon is polite, proficient and spiteful.	Sharon is spiteful.
entailment	Charlotte is fabulous, drugged and plain-speaking.	Charlotte is plain-speaking.
entailment	Frances is clumsy, crass and imperturbable.	Frances is imperturbable.
entailment	Lisa is jovial, blue and inventive.	Lisa is inventive.
entailment	Suzanne is numb, emotional and assertive.	Suzanne is assertive.
entailment	Michelle is reclusive, flashy and maternal.	Michelle is maternal.
entailment	Katie is helpful, venal and guarded.	Katie is guarded.
entailment	Virginia is realistic, delicate and staid.	Virginia is staid.
entailment	Donald is hateful, blunt and average.	Donald is average.
entailment	Diana is immodest, undependable and drugged.	Diana is drugged.
entailment	Louise is slow, leery and thoughtless.	Louise is thoughtless.
entailment	Jason is fiery, nervous and cowardly.	Jason is cowardly.
entailment	Edith is cheerful, jovial and unbalanced.	Edith is unbalanced.
entailment	Laura is lazy, bright and crafty.	Laura is crafty.
entailment	Jerry is steady, devoted and inexperienced.	Jerry is inexperienced.
entailment	Carolyn is sleepy, snazzy and below average.	Carolyn is below average.
entailment	John is civil, stupid and above average.	John is above average.
entailment	Rebecca is depressed, talented and stern.	Rebecca is stern.
entailment	Melissa is deferential, unthinking and helpful.	Melissa is helpful.
entailment	Donald is eager, able and demure.	Donald is demure.
entailment	Annie is mild, selfish and lovely.	Annie is lovely.
entailment	Rose is passive, local and revered.	Rose is revered.
entailment	Anthony is paternal, coherent and inconsistent.	Anthony is inconsistent.
entailment	Jean is provocative, careless and idiotic.	Jean is idiotic.
entailment	Anna is insensitive, agile and plucky.	Anna is plucky.
entailment	Linda is confident, elfin and wary.	Linda is wary.
entailment	Tim is dutiful, flashy and patient.	Tim is patient.
entailment	Rose is dowdy, petulant and unsure.	Rose is unsure.
entailment	Heather is discreet, sad and experienced.	Heather is experienced.
entailment	Jeff is picky, impressionable and irritating.	Jeff is irritating.
entailment	Nancy is inconsiderate, capable and stupid.	Nancy is stupid.
entailment	Mark is paternal, mild and analytical.	Mark is analytical.
entailment	Dan is fussy, balanced and quarrelsome.	Dan is quarrelsome.
entailment	Harriet is above average, normal and sassy.	Harriet is sassy.
entailment	Jim is sedate, uncooperative and impatient.	Jim is impatient.
entailment	Eleanor is querulous, thoughtless and dependent.	Eleanor is dependent.
entailment	Jean is superficial, distant and thoughtful.	Jean is thoughtful.
entailment	Harold is mean, drowsy and supercilious.	Harold is supercilious.
entailment	Ashley is courageous, cantankerous and miserable.	Ashley is miserable.
entailment	Katie is grave, curious and impetuous.	Katie is impetuous.
entailment	Steven is unwilling, imaginative and tired.	Steven is tired.
entailment	Alan is resigned, pleasant and blunt.	Alan is blunt.
entailment	Lauren is respected, lovable and confused.	Lauren is confused.
entailment	Ryan is delightful, lethargic and sober.	Ryan is sober.
entailment	Katherine is peevish, civil and incompetent.	Katherine is incompetent.
entailment	Suzanne is motivated, funny and mean.	Suzanne is mean.
entailment	Amy is peevish, venal and lazy.	Amy is lazy.
entailment	Nancy is delightful, steady and normal.	Nancy is normal.
entailment	John is demure, unhelpful and positive.	John is positive.
entailment	James is gluttonous, amazing and persnickety.	James is persnickety.
entailment	Dan is shy, even-tempered and unwilling.	Dan is unwilling.
entailment	Jim is subtle, touchy and level-headed.	Jim is level-headed.
entailment	Cynthia is reluctant, polite and careful.	Cynthia is careful.
entailment	Harold is unbalanced, experienced and silly.	Harold is silly.
entailment	Arthur is gloomy, serene and irritable.	Arthur is irritable.
entailment	Robin is unbalanced, naive and dainty.	Robin is dainty.
entailment	Keith is prejudiced, inconsiderate and reluctant.	Keith is reluctant.
entailment	Frederick is petulant, experienced and evasive.	Frederick is evasive.
entailment	Donna is great, long-winded and sober.	Donna is sober.
entailment	Margaret is sloppy, unhelpful and unsophisticated.	Margaret is unsophisticated.
entailment	Louis is awesome, superficial and intolerant.	Louis is intolerant.
entailment	Dick is uncooperative, soulless and venal.	Dick is venal.
entailment	Ben is slow, wary and evasive.	Ben is evasive.
entailment	Roger is unpleasant, jocular and gluttonous.	Roger is gluttonous.
entailment	Marilyn is undependable, warmhearted and cordial.	Marilyn is cordial.
entailment	Victoria is passive, somber and stupid.	Victoria is stupid.
entailment	Andrea is long-winded, nosy and jocular.	Andrea is jocular.
entailment	Grace is flaky, methodical and awful.	Grace is awful.
entailment	Dorothy is careless, tolerant and moronic.	Dorothy is moronic.
entailment	Betty is deft, independent and imaginative.	Betty is imaginative.
entailment	Mark is impressionable, callous and sullen.	Mark is sullen.
entailment	Elaine is morose, egotistical and dutiful.	Elaine is dutiful.
entailment	Maria is suspicious, playful and content.	Maria is content.
entailment	Alexander is patient, experienced and numb.	Alexander is numb.
entailment	Diane is beneficent, candid and enterprising.	Diane is enterprising.
entailment	Rachel is adventurous, suspicious and slight.	Rachel is slight.
entailment	Andrea is unguarded, soulful and artificial.	Andrea is artificial.
entailment	Ann is incompetent, sleepy and reserved.	Ann is reserved.
entailment	Bobby is plain, jovial and devoted.	Bobby is devoted.
entailment	Judith is even-tempered, vulnerable and natural.	Judith is natural.
entailment	Roy is dextrous, tactless and cynical.	Roy is cynical.
entailment	Joseph is guarded, slow and unstable.	Joseph is unstable.
entailment	John is brave, drugged and direct.	John is direct.
entailment	Robin is alert, impulsive and normal.	Robin is normal.
entailment	Arthur is apprehensive, restless and mature.	Arthur is mature.
entailment	Keith is passive, distraught and competent.	Keith is competent.
entailment	Frederick is below average, vulnerable and strong.	Frederick is strong.
entailment	Henry is unemotional, indefatigable and spirited.	Henry is spirited.
entailment	John is generous, playful and critical.	John is critical.
entailment	Jean is restless, stable and competent.	Jean is competent.
entailment	Victoria is cooperative, dreary and smart.	Victoria is smart.
entailment	Kelly is buff, sedate and inspiring.	Kelly is inspiring.
entailment	Ashley is pensive, cooperative and lithe.	Ashley is lithe.
entailment	Marie is earnest, indefatigable and tired.	Marie is tired.
entailment	Anthony is reserved, drunk and slow.	Anthony is slow.
entailment	Alex is delicate, polite and resourceful.	Alex is resourceful.
entailment	Rebecca is clever, ambitious and gluttonous.	Rebecca is gluttonous.
entailment	Ken is easy-going, cruel and sedate.	Ken is sedate.
entailment	Mike is orderly, testy and kind.	Mike is kind.
entailment	Thomas is selfish, decisive and even-tempered.	Thomas is even-tempered.
entailment	Sophie is attentive, awesome and zealous.	Sophie is zealous.
entailment	Marilyn is listless, devoted and musical.	Marilyn is musical.
entailment	Bobby is direct, reliable and incisive.	Bobby is incisive.
entailment	Alison is shy, energetic and competent.	Alison is competent.
entailment	Anne is cruel, cautious and strong.	Anne is strong.
entailment	Diana is well-developed, dainty and reserved.	Diana is reserved.
entailment	Christopher is vulnerable, deft and childish.	Christopher is childish.
entailment	Claire is drowsy, intolerant and above average.	Claire is above average.
entailment	Jack is reserved, serene and amusing.	Jack is amusing.
entailment	Christopher is long-winded, numb and nervous.	Christopher is nervous.
entailment	Florence is sweet, content and inactive.	Florence is inactive.
entailment	Katherine is one-sided, irritable and vigilant.	Katherine is vigilant.
entailment	Deborah is plain-speaking, passive and awesome.	Deborah is awesome.
entailment	Kathy is unsure, resourceful and cooperative.	Kathy is cooperative.
entailment	Howard is unreliable, sweet and sturdy.	Howard is sturdy.
entailment	Patricia is critical, saucy and unhelpful.	Patricia is unhelpful.
entailment	Bobby is impractical, cool and crabby.	Bobby is crabby.
entailment	Martha is unwilling, energetic and zealous.	Martha is zealous.
entailment	Jerry is clean, distant and well-rounded.	Jerry is well-rounded.
entailment	Hugh is sleepy, deep and delightful.	Hugh is delightful.
entailment	Carolyn is positive, level-headed and experienced.	Carolyn is experienced.
entailment	Sharon is devoted, peaceful and amazing.	Sharon is amazing.
entailment	Colin is condescending, ambitious and sad.	Colin is sad.
entailment	Robin is stable, unsure and intelligent.	Robin is intelligent.
entailment	Kim is sturdy, mean and indefatigable.	Kim is indefatigable.
entailment	Evelyn is mercurial, thoughtless and lively.	Evelyn is lively.
entailment	Steve is practical, absent-minded and bright.	Steve is bright.
entailment	Tom is grouchy, clean and musical.	Tom is musical.
entailment	Anna is boisterous, snobby and composed.	Anna is composed.
entailment	Alison is excellent, cheerful and unbalanced.	Alison is unbalanced.
entailment	Jean is logical, hearty and passionate.	Jean is passionate.
entailment	Andrea is charming, sturdy and well-intentioned.	Andrea is well-intentioned.
entailment	Adam is wonderful, conscientious and restless.	Adam is restless.
entailment	Martin is cooperative, curious and quiet.	Martin is quiet.
entailment	Roger is strong, plucky and idle.	Roger is idle.
entailment	Steve is old-fashioned, disruptive and passionate.	Steve is passionate.
entailment	Jonathan is incompetent, gentle and inspiring.	Jonathan is inspiring.
entailment	Dorothy is churlish, persevering and lovable.	Dorothy is lovable.
entailment	Colin is petulant, ridiculous and guarded.	Colin is guarded.
entailment	Harold is adventurous, boisterous and wonderful.	Harold is wonderful.
entailment	Edward is cordial, agreeable and impulsive.	Edward is impulsive.
entailment	Ann is testy, disruptive and leery.	Ann is leery.
entailment	Robert is slothful, flaky and unthinking.	Robert is unthinking.
entailment	Ellen is reserved, friendly and dirty.	Ellen is dirty.
entailment	Julia is independent, quiet and candid.	Julia is candid.
entailment	Sarah is ferocious, childish and restless.	Sarah is restless.
entailment	Hugh is powerful, tactful and gloomy.	Hugh is gloomy.
entailment	Janet is cool, callous and proficient.	Janet is proficient.
entailment	Daniel is conceited, thoughtful and indefatigable.	Daniel is indefatigable.
entailment	Judy is enterprising, experienced and zealous.	Judy is zealous.
entailment	Bobby is excellent, impetuous and unpleasant.	Bobby is unpleasant.
entailment	Paul is silly, supercilious and independent.	Paul is independent.
entailment	Lisa is provocative, artificial and leery.	Lisa is leery.
entailment	Carol is sweet, popular and hesitant.	Carol is hesitant.
entailment	Diana is adventurous, cautious and deferential.	Diana is deferential.
entailment	Paul is gentle, enthusiastic and reclusive.	Paul is reclusive.
entailment	Nick is dull, lithe and naughty.	Nick is naughty.
entailment	Harry is groggy, cooperative and sneering.	Harry is sneering.
entailment	Louis is leery, delightful and sloppy.	Louis is sloppy.
entailment	Donald is hypercritical, pleasant and nosy.	Donald is nosy.
entailment	Jean is demure, weak and dutiful.	Jean is dutiful.
entailment	Fiona is obnoxious, quarrelsome and methodical.	Fiona is methodical.
entailment	Susan is demonic, imaginative and deferential.	Susan is deferential.
entailment	Roy is listless, surly and gluttonous.	Roy is gluttonous.
entailment	Dave is sensitive, quick and petulant.	Dave is petulant.
entailment	Julia is evasive, somber and angelic.	Julia is angelic.
entailment	Harry is zealous, cantankerous and unemotional.	Harry is unemotional.
entailment	Linda is realistic, cautious and well-rounded.	Linda is well-rounded.
entailment	Charlie is depressed, above average and alert.	Charlie is alert.
entailment	Diana is petulant, unbalanced and resigned.	Diana is resigned.
entailment	Sue is pleasant, inexperienced and incompetent.	Sue is incompetent.
entailment	Peter is ridiculous, independent and flabby.	Peter is flabby.
entailment	Jonathan is powerful, childlike and sedate.	Jonathan is sedate.
entailment	Christopher is blunt, well-behaved and passionate.	Christopher is passionate.
entailment	Suzanne is good, unreliable and unguarded.	Suzanne is unguarded.
entailment	Don is lethargic, enterprising and curious.	Don is curious.
entailment	Leslie is above average, circumspect and awesome.	Leslie is awesome.
entailment	Eleanor is dutiful, emotional and assertive.	Eleanor is assertive.
entailment	Victoria is deft, revered and mature.	Victoria is mature.
entailment	Judith is smart, exacting and venal.	Judith is venal.
entailment	Scott is playful, enthusiastic and tactless.	Scott is tactless.
entailment	Harold is abnormal, condescending and responsible.	Harold is responsible.
entailment	Sara is drunk, churlish and gloomy.	Sara is gloomy.
entailment	Lucy is idle, helpful and indiscreet.	Lucy is indiscreet.
entailment	Ron is clever, level-headed and volcanic.	Ron is volcanic.
entailment	Philip is careless, flabby and irritable.	Philip is irritable.
entailment	Jeff is naughty, clumsy and inconsiderate.	Jeff is inconsiderate.
entailment	Ben is naughty, slothful and intelligent.	Ben is intelligent.
entailment	Johnny is confused, intelligent and ostentatious.	Johnny is ostentatious.
entailment	Sophie is sulky, unimaginative and boisterous.	Sophie is boisterous.
entailment	Suzanne is dainty, tolerant and uncertain.	Suzanne is uncertain.
entailment	Chris is pretty, drunk and cranky.	Chris is cranky.
entailment	Bill is discerning, hot-headed and hypercritical.	Bill is hypercritical.
entailment	Rebecca is stable, vulnerable and candid.	Rebecca is candid.
entailment	Jill is assertive, flabby and cynical.	Jill is cynical.
entailment	Jean is depressed, unaffected and guarded.	Jean is guarded.
entailment	Pamela is obnoxious, prejudiced and revered.	Pamela is revered.
entailment	Alexandra is unfriendly, sloppy and wonderful.	Alexandra is wonderful.
entailment	Gary is slow, hot-headed and demure.	Gary is demure.
entailment	Larry is selfish, well-intentioned and unthinking.	Larry is unthinking.
entailment	Emily is mild, crabby and lithe.	Emily is lithe.
entailment	Sam is nasty, shrewd and affectionate.	Sam is affectionate.
entailment	Amanda is churlish, attentive and normal.	Amanda is normal.
entailment	Ben is zealous, unfriendly and curious.	Ben is curious.
entailment	Fiona is fiery, stoic and cold.	Fiona is cold.
entailment	Pamela is jovial, flashy and efficient.	Pamela is efficient.
entailment	Martin is well-respected, curious and reserved.	Martin is reserved.
entailment	Heather is nervous, dramatic and brilliant.	Heather is brilliant.
entailment	Melissa is sincere, sensitive and blue.	Melissa is blue.
entailment	Ashley is immature, idle and excitable.	Ashley is excitable.
entailment	John is unwilling, revered and cowardly.	John is cowardly.
entailment	Kelly is abnormal, inactive and analytical.	Kelly is analytical.
entailment	Howard is lame, gentle and distrustful.	Howard is distrustful.
entailment	Sandra is diligent, ostentatious and methodical.	Sandra is methodical.
entailment	Judith is incompetent, love-lorn and hot-headed.	Judith is hot-headed.
entailment	Judith is distrustful, discerning and unimaginative.	Judith is unimaginative.
entailment	Sandra is selfish, steady and prejudiced.	Sandra is prejudiced.
entailment	Alfred is dependent, nasty and intelligent.	Alfred is intelligent.
entailment	Jeff is gentle, lithe and querulous.	Jeff is querulous.
entailment	Nick is indiscreet, candid and powerful.	Nick is powerful.
entailment	Wendy is apprehensive, unstable and impatient.	Wendy is impatient.
entailment	Sue is angelic, unstable and wonderful.	Sue is wonderful.
entailment	Johnny is efficient, slovenly and fabulous.	Johnny is fabulous.
entailment	Maria is maternal, balanced and unsure.	Maria is unsure.
entailment	Jonathan is lean, hot-headed and content.	Jonathan is content.
entailment	Alexander is well-developed, plain-speaking and agreeable.	Alexander is agreeable.
entailment	Leslie is sober, irascible and chic.	Leslie is chic.
entailment	Edwin is hateful, provocative and soulless.	Edwin is soulless.
entailment	Alexander is unthinking, prudent and deferential.	Alexander is deferential.
entailment	Tom is independent, amazing and nosy.	Tom is nosy.
entailment	David is shy, ugly and shrewd.	David is shrewd.
entailment	Patricia is sneering, imaginative and churlish.	Patricia is churlish.
entailment	Elizabeth is incisive, sentimental and affectionate.	Elizabeth is affectionate.
entailment	Grace is incompetent, polite and clever.	Grace is clever.
entailment	Keith is ugly, indefatigable and cold.	Keith is cold.
entailment	Al is miserable, sturdy and modest.	Al is modest.
entailment	Rachel is sad, ugly and drunk.	Rachel is drunk.
entailment	Lynn is respectful, stable and unsure.	Lynn is unsure.
entailment	Catherine is gloomy, affectionate and friendly.	Catherine is friendly.
entailment	Karen is emotional, unfriendly and slovenly.	Karen is slovenly.
entailment	Johnny is ridiculous, sober and insensitive.	Johnny is insensitive.
entailment	Steve is unreliable, gluttonous and brilliant.	Steve is brilliant.
entailment	Hugh is impatient, clean and coherent.	Hugh is coherent.
entailment	Lucy is great, normal and interesting.	Lucy is interesting.
entailment	Janet is amusing, circumspect and sassy.	Janet is sassy.
entailment	Jill is motivated, flabby and distraught.	Jill is distraught.
entailment	Marie is funny, churlish and persnickety.	Marie is persnickety.
entailment	Patricia is grouchy, discreet and impatient.	Patricia is impatient.
entailment	Carolyn is sophisticated, confused and jovial.	Carolyn is jovial.
entailment	Victoria is tolerant, drunk and sensible.	Victoria is sensible.
entailment	Diane is disruptive, curious and listless.	Diane is listless.
entailment	Katherine is soulless, conceited and plain-speaking.	Katherine is plain-speaking.
entailment	Larry is ostentatious, unthinking and drugged.	Larry is drugged.
entailment	Dick is nosy, generous and snazzy.	Dick is snazzy.
entailment	Alex is meticulous, paternal and restless.	Alex is restless.
entailment	Don is balanced, ridiculous and kind.	Don is kind.
entailment	Jane is crabby, numb and churlish.	Jane is churlish.
entailment	Billy is awesome, clever and mild.	Billy is mild.
entailment	Ellen is shy, punctual and cowardly.	Ellen is cowardly.
entailment	Carol is leery, warm and unbalanced.	Carol is unbalanced.
entailment	Sandra is orderly, modest and sturdy.	Sandra is sturdy.
entailment	Francis is abnormal, shy and crafty.	Francis is crafty.
entailment	Anna is persnickety, devoted and generous.	Anna is generous.
entailment	Chris is courageous, joyous and exacting.	Chris is exacting.
entailment	Steven is indiscreet, devoted and earnest.	Steven is earnest.
entailment	Diane is soulless, sneering and persevering.	Diane is persevering.
entailment	Harriet is sober, cold and level-headed.	Harriet is level-headed.
entailment	Nicole is delightful, pleasant and fabulous.	Nicole is fabulous.
entailment	Charles is demure, wonderful and brilliant.	Charles is brilliant.
entailment	Anthony is well-rounded, irascible and intolerant.	Anthony is intolerant.
entailment	Charlie is buff, childlike and inspiring.	Charlie is inspiring.
entailment	Don is obnoxious, amiable and good.	Don is good.
entailment	Katie is depressed, immature and mercurial.	Katie is mercurial.
entailment	Samuel is capable, thoughtful and sullen.	Samuel is sullen.
entailment	Bill is positive, blue and experienced.	Bill is experienced.
entailment	Patrick is fervent, conceited and direct.	Patrick is direct.
entailment	Linda is drunk, cautious and reserved.	Linda is reserved.
entailment	Margaret is gloomy, sulky and unmotivated.	Margaret is unmotivated.
entailment	Samuel is beautiful, proficient and apprehensive.	Samuel is apprehensive.
entailment	Charles is plain-speaking, bright and amusing.	Charles is amusing.
entailment	Victoria is uncooperative, charming and inexperienced.	Victoria is inexperienced.
entailment	Kelly is impetuous, devoted and enthusiastic.	Kelly is enthusiastic.
entailment	Lynn is flabby, drugged and silly.	Lynn is silly.
entailment	Betty is smart, deft and excitable.	Betty is excitable.
entailment	Bill is spiteful, careful and impressionable.	Bill is impressionable.
entailment	Keith is methodical, sophisticated and apathetic.	Keith is apathetic.
entailment	Al is disruptive, awesome and ardent.	Al is ardent.
entailment	Jessica is careless, cynical and excellent.	Jessica is excellent.
entailment	Charles is fussy, distraught and old-fashioned.	Charles is old-fashioned.
entailment	Howard is unimaginative, hateful and old-fashioned.	Howard is old-fashioned.
entailment	Charles is playful, testy and eager.	Charles is eager.
entailment	Charlotte is below average, bright and testy.	Charlotte is testy.
entailment	Kate is passionate, cruel and well-developed.	Kate is well-developed.
entailment	Joan is selfish, distrustful and deferential.	Joan is deferential.
entailment	Billy is undependable, suspicious and pensive.	Billy is pensive.
entailment	Johnny is restless, venal and ferocious.	Johnny is ferocious.
entailment	Julia is persnickety, immodest and modest.	Julia is modest.
entailment	Laura is warm, considerate and persevering.	Laura is persevering.
entailment	Linda is agreeable, irascible and resentful.	Linda is resentful.
entailment	Gary is careless, dreary and listless.	Gary is listless.
entailment	Christopher is excellent, friendly and clean.	Christopher is clean.
entailment	Caroline is unhelpful, sturdy and clean.	Caroline is clean.
entailment	Lauren is apprehensive, unguarded and pleasant.	Lauren is pleasant.
entailment	Amy is mercurial, exacting and egotistical.	Amy is egotistical.
entailment	Kathy is soulful, distrustful and brilliant.	Kathy is brilliant.
entailment	Janet is methodical, immodest and lovable.	Janet is lovable.
entailment	Billy is cantankerous, grouchy and jovial.	Billy is jovial.
entailment	Lisa is self-assured, unmotivated and quick-tempered.	Lisa is quick-tempered.
entailment	Alexander is logical, impetuous and demure.	Alexander is demure.
entailment	Harry is deep, wary and clumsy.	Harry is clumsy.
entailment	Catherine is elfin, dutiful and reserved.	Catherine is reserved.
entailment	Kathryn is crafty, cynical and reclusive.	Kathryn is reclusive.
entailment	Jason is dutiful, keen and uncertain.	Jason is uncertain.
entailment	Joan is capable, churlish and grouchy.	Joan is grouchy.
entailment	Sophie is groggy, long-winded and revered.	Sophie is revered.
entailment	James is playful, hypercritical and sharp.	James is sharp.
entailment	Robert is thoughtless, cruel and querulous.	Robert is querulous.
entailment	Ann is stern, unstable and jovial.	Ann is jovial.
entailment	Lisa is civil, cool and peevish.	Lisa is peevish.
entailment	Kelly is balanced, cranky and groggy.	Kelly is groggy.
entailment	Heather is one-sided, pensive and timid.	Heather is timid.
entailment	Francis is cautious, unsophisticated and slow.	Francis is slow.
entailment	Brian is punctual, helpful and dirty.	Brian is dirty.
entailment	Sandra is spirited, idle and unpopular.	Sandra is unpopular.
entailment	Mark is guarded, callous and clever.	Mark is clever.
entailment	Colin is unimaginative, irritating and egotistical.	Colin is egotistical.
entailment	Simon is thinking, impulsive and critical.	Simon is critical.
entailment	Andrew is passionate, angelic and meticulous.	Andrew is meticulous.
entailment	Andrew is cantankerous, enthusiastic and versatile.	Andrew is versatile.
entailment	Judy is brilliant, unreliable and awesome.	Judy is awesome.
entailment	Steven is musical, crabby and confused.	Steven is confused.
entailment	Kathleen is nervous, impetuous and cowardly.	Kathleen is cowardly.
entailment	Grace is grouchy, patient and awful.	Grace is awful.
