contradiction	Andrea, Ralph and Frances are from Germany, New Zealand and Pakistan respectively.	Frances is from Germany.
contradiction	Robert, Fiona and Catherine are from Israel, Portugal and China respectively.	Catherine is from Israel.
contradiction	Alex, Matt and Caroline are from Philippines, Oman and Finland respectively.	Caroline is from Philippines.
contradiction	Anthony, Alan and Jeff are from Singapore, Hungary and Argentina respectively.	Jeff is from Singapore.
contradiction	Charlie, Billy and Joe are from Libya, Japan and Qatar respectively.	Joe is from Libya.
contradiction	Charles, Judith and Brian are from Netherlands, Fiji and Portugal respectively.	Brian is from Netherlands.
contradiction	Alfred, Thomas and John are from Azerbaijan, Pakistan and Haiti respectively.	John is from Azerbaijan.
contradiction	Robert, Barbara and Jane are from Belarus, South Korea and France respectively.	Jane is from Belarus.
contradiction	Joe, Henry and Charles are from India, Russia and China respectively.	Charles is from India.
contradiction	Greg, Jane and Alan are from United States of America, Cuba and Vietnam respectively.	Alan is from United States of America.
contradiction	Rebecca, Joseph and Lucy are from Maldives, Argentina and Uruguay respectively.	Lucy is from Maldives.
contradiction	Catherine, Jim and Dave are from Sweden, Canada and Ireland respectively.	Dave is from Sweden.
contradiction	Linda, Virginia and Barbara are from Thailand, Fiji and Azerbaijan respectively.	Barbara is from Thailand.
contradiction	Kenneth, Alison and Jill are from Chile, Belarus and Belgium respectively.	Jill is from Chile.
contradiction	Charles, Carolyn and Jimmy are from Turkey, South Korea and Netherlands respectively.	Jimmy is from Turkey.
contradiction	Susan, Karen and Bobby are from Sweden, Russia and Hungary respectively.	Bobby is from Sweden.
contradiction	Linda, Kathleen and Jimmy are from United Arab Emirates, Taiwan and Ghana respectively.	Jimmy is from United Arab Emirates.
contradiction	David, Betty and Angela are from Switzerland, Afghanistan and Canada respectively.	Angela is from Switzerland.
contradiction	Laura, Ron and Louise are from Iceland, Canada and Denmark respectively.	Louise is from Iceland.
contradiction	Evelyn, Tony and Sophie are from Oman, Egypt and Saudi Arabia respectively.	Sophie is from Oman.
contradiction	Andrew, Anna and Louise are from United Arab Emirates, Colombia and Zimbabwe respectively.	Louise is from United Arab Emirates.
contradiction	Alex, Catherine and Dick are from Azerbaijan, Bhutan and Afghanistan respectively.	Dick is from Azerbaijan.
contradiction	Howard, Steven and Jack are from United Kingdom, Canada and Switzerland respectively.	Jack is from United Kingdom.
contradiction	William, Steve and Joe are from Austria, Colombia and Egypt respectively.	Joe is from Austria.
contradiction	Louise, Arthur and Fiona are from Fiji, Georgia and Brazil respectively.	Fiona is from Fiji.
contradiction	Barbara, Roy and Martha are from Oman, Japan and Haiti respectively.	Martha is from Oman.
contradiction	Ralph, Cynthia and Dave are from India, Ukraine and South Korea respectively.	Dave is from India.
contradiction	Alex, Ed and Tim are from Bangladesh, Netherlands and Austria respectively.	Tim is from Bangladesh.
contradiction	Martin, Louis and Joan are from Uruguay, Iceland and Portugal respectively.	Joan is from Uruguay.
contradiction	Richard, Al and Alexandra are from Belgium, Pakistan and Switzerland respectively.	Alexandra is from Belgium.
contradiction	Simon, Jay and Brian are from Colombia, Pakistan and Italy respectively.	Brian is from Colombia.
contradiction	Judith, Julia and Leslie are from Canada, Iran and Israel respectively.	Leslie is from Canada.
contradiction	Patrick, Diana and Ann are from Mexico, Ecuador and Japan respectively.	Ann is from Mexico.
contradiction	Lucy, Joe and Joseph are from Georgia, Zimbabwe and Malaysia respectively.	Joseph is from Georgia.
contradiction	Philip, Diane and Marilyn are from Oman, Pakistan and Portugal respectively.	Marilyn is from Oman.
contradiction	Nick, Edwin and Johnny are from Germany, Laos and Chile respectively.	Johnny is from Germany.
contradiction	William, Julia and Kenneth are from Philippines, Bhutan and Japan respectively.	Kenneth is from Philippines.
contradiction	Louise, Emily and Ann are from Maldives, China and Afghanistan respectively.	Ann is from Maldives.
contradiction	Rebecca, Angela and Dorothy are from Fiji, Switzerland and Ecuador respectively.	Dorothy is from Fiji.
contradiction	Victoria, Keith and Tony are from Iceland, Mexico and United States of America respectively.	Tony is from Iceland.
contradiction	Jeff, Patricia and Billy are from Germany, Austria and Greece respectively.	Billy is from Germany.
contradiction	Mike, Bob and Lauren are from New Zealand, Brazil and Egypt respectively.	Lauren is from New Zealand.
contradiction	Rebecca, Janet and Ellen are from Nepal, China and Azerbaijan respectively.	Ellen is from Nepal.
contradiction	Walter, Ron and Judith are from Azerbaijan, United Arab Emirates and Vietnam respectively.	Judith is from Azerbaijan.
contradiction	Johnny, Ruth and Rachel are from Russia, Bangladesh and North Korea respectively.	Rachel is from Russia.
contradiction	Fiona, Sarah and Kevin are from Ecuador, Belarus and Japan respectively.	Kevin is from Ecuador.
contradiction	Michelle, Tony and Harry are from Mexico, New Zealand and Italy respectively.	Harry is from Mexico.
contradiction	Frederick, Jennifer and Benjamin are from Austria, Belgium and New Zealand respectively.	Benjamin is from Austria.
contradiction	Harold, James and Alfred are from Maldives, Pakistan and India respectively.	Alfred is from Maldives.
contradiction	Alice, Lynn and Albert are from Afghanistan, Iran and Indonesia respectively.	Albert is from Afghanistan.
contradiction	Patricia, Christopher and Sam are from Pakistan, Ecuador and Argentina respectively.	Sam is from Pakistan.
contradiction	Simon, Jean and Lynn are from Finland, Austria and Japan respectively.	Lynn is from Finland.
contradiction	Peter, Lauren and Jimmy are from Australia, France and Bangladesh respectively.	Jimmy is from Australia.
contradiction	Ron, Harold and Charlie are from Afghanistan, China and Haiti respectively.	Charlie is from Afghanistan.
contradiction	Keith, Alexander and Mike are from Georgia, Brazil and Oman respectively.	Mike is from Georgia.
contradiction	Bill, Jennifer and Margaret are from Chile, Canada and Iraq respectively.	Margaret is from Chile.
contradiction	Adam, Frances and Helen are from Japan, Cuba and United Kingdom respectively.	Helen is from Japan.
contradiction	Maria, Harold and Brian are from Nepal, Bhutan and Afghanistan respectively.	Brian is from Nepal.
contradiction	Christine, Lisa and Sophie are from Azerbaijan, Philippines and Libya respectively.	Sophie is from Azerbaijan.
contradiction	Amanda, Marilyn and Harriet are from Austria, Azerbaijan and Brazil respectively.	Harriet is from Austria.
contradiction	Elizabeth, Frank and Julie are from Chile, Hungary and Ukraine respectively.	Julie is from Chile.
contradiction	Carl, Ken and Jeff are from United States of America, Pakistan and Belgium respectively.	Jeff is from United States of America.
contradiction	Suzanne, Henry and Sara are from Nepal, Qatar and South Korea respectively.	Sara is from Nepal.
contradiction	Harry, Kathy and Bill are from North Korea, Azerbaijan and Netherlands respectively.	Bill is from North Korea.
contradiction	Martha, Kim and Patricia are from Netherlands, Russia and Austria respectively.	Patricia is from Netherlands.
contradiction	Brian, Lisa and Chris are from South Korea, Colombia and Hungary respectively.	Chris is from South Korea.
contradiction	Maria, Sam and Harold are from Iraq, Ghana and Finland respectively.	Harold is from Iraq.
contradiction	Walter, Sophie and Annie are from North Korea, Sweden and Italy respectively.	Annie is from North Korea.
contradiction	Ben, Matthew and Christine are from Uruguay, Brazil and United States of America respectively.	Christine is from Uruguay.
contradiction	Nancy, Albert and Daniel are from Cuba, Argentina and New Zealand respectively.	Daniel is from Cuba.
contradiction	Daniel, Jack and Tony are from Austria, Qatar and Mexico respectively.	Tony is from Austria.
contradiction	Steven, Jimmy and Nick are from Hungary, Afghanistan and Ecuador respectively.	Nick is from Hungary.
contradiction	Ben, Diana and Andrea are from Israel, Colombia and Azerbaijan respectively.	Andrea is from Israel.
contradiction	David, Sam and Keith are from Poland, Finland and Egypt respectively.	Keith is from Poland.
contradiction	Emily, Simon and Louise are from Colombia, Nepal and India respectively.	Louise is from Colombia.
contradiction	Mark, Kevin and Jay are from Mexico, Ghana and Poland respectively.	Jay is from Mexico.
contradiction	Richard, Amanda and Gary are from Mexico, Bhutan and United Arab Emirates respectively.	Gary is from Mexico.
contradiction	Cynthia, Don and Nancy are from Indonesia, Vietnam and Saudi Arabia respectively.	Nancy is from Indonesia.
contradiction	Rose, Sally and Donna are from Poland, Cuba and Hungary respectively.	Donna is from Poland.
contradiction	Donna, Ryan and Kathy are from Israel, Finland and Cuba respectively.	Kathy is from Israel.
contradiction	Jessica, Robert and Jane are from United States of America, Haiti and Russia respectively.	Jane is from United States of America.
contradiction	Jill, Lawrence and Martha are from Uruguay, Ecuador and Haiti respectively.	Martha is from Uruguay.
contradiction	Michael, Howard and Nick are from Taiwan, Brazil and Ghana respectively.	Nick is from Taiwan.
contradiction	Cynthia, Martin and Barbara are from Turkey, Iran and Egypt respectively.	Barbara is from Turkey.
contradiction	Dick, Alan and Elaine are from Brazil, Libya and United Arab Emirates respectively.	Elaine is from Brazil.
contradiction	Kim, Billy and Ben are from Israel, United Arab Emirates and Poland respectively.	Ben is from Israel.
contradiction	George, Alice and Alex are from United States of America, Netherlands and Sweden respectively.	Alex is from United States of America.
contradiction	Arthur, Ralph and Andrew are from Fiji, Brazil and Ecuador respectively.	Andrew is from Fiji.
contradiction	Rachel, Julie and Arthur are from Poland, Hungary and Laos respectively.	Arthur is from Poland.
contradiction	Evelyn, Rose and Adam are from Italy, Belarus and Thailand respectively.	Adam is from Italy.
contradiction	Henry, Martha and Joe are from Taiwan, Switzerland and Malaysia respectively.	Joe is from Taiwan.
contradiction	Jeff, Amanda and Dan are from Belgium, Libya and Hungary respectively.	Dan is from Belgium.
contradiction	Heather, Tom and Betty are from North Korea, Poland and Austria respectively.	Betty is from North Korea.
contradiction	Lucy, Suzanne and Grace are from Uruguay, Iraq and North Korea respectively.	Grace is from Uruguay.
contradiction	Robin, Frank and Bruce are from South Korea, United States of America and Canada respectively.	Bruce is from South Korea.
contradiction	Arthur, Edwin and Nick are from Mexico, Turkey and Russia respectively.	Nick is from Mexico.
contradiction	Anthony, Ashley and Rose are from Mexico, Portugal and Austria respectively.	Rose is from Mexico.
contradiction	Al, Ralph and Edward are from Belgium, Maldives and Taiwan respectively.	Edward is from Belgium.
contradiction	Eric, Dick and Joseph are from Sweden, Bhutan and Ecuador respectively.	Joseph is from Sweden.
contradiction	Alfred, Kenneth and Jessica are from Argentina, Belarus and Vietnam respectively.	Jessica is from Argentina.
contradiction	Victoria, Edith and Linda are from Nepal, Ecuador and Philippines respectively.	Linda is from Nepal.
contradiction	Julia, Diana and Charlie are from Libya, Ecuador and Australia respectively.	Charlie is from Libya.
contradiction	Adam, Melissa and Don are from Ecuador, Ukraine and Iceland respectively.	Don is from Ecuador.
contradiction	Jim, Thomas and Ron are from Saudi Arabia, United Arab Emirates and Azerbaijan respectively.	Ron is from Saudi Arabia.
contradiction	Julie, Diane and Henry are from Mexico, India and Cuba respectively.	Henry is from Mexico.
contradiction	Kim, Jack and Melissa are from Italy, Japan and Laos respectively.	Melissa is from Italy.
contradiction	Frances, Sara and Louis are from Portugal, Hungary and Oman respectively.	Louis is from Portugal.
contradiction	Joe, Philip and Bob are from Saudi Arabia, China and Ireland respectively.	Bob is from Saudi Arabia.
contradiction	Carolyn, Jeff and Pamela are from United States of America, United Arab Emirates and Denmark respectively.	Pamela is from United States of America.
contradiction	Ray, Adam and Alfred are from Italy, Haiti and United Arab Emirates respectively.	Alfred is from Italy.
contradiction	Julie, Claire and Alexandra are from Maldives, United Kingdom and Australia respectively.	Alexandra is from Maldives.
contradiction	John, Pamela and Roger are from Netherlands, Libya and Mexico respectively.	Roger is from Netherlands.
contradiction	Dan, Heather and Helen are from Iraq, South Korea and Netherlands respectively.	Helen is from Iraq.
contradiction	Diane, Hugh and Amy are from Azerbaijan, Israel and Libya respectively.	Amy is from Azerbaijan.
contradiction	Bill, Lynn and Bobby are from Austria, Russia and United Arab Emirates respectively.	Bobby is from Austria.
contradiction	Jessica, Simon and Diane are from Taiwan, Hungary and Thailand respectively.	Diane is from Taiwan.
contradiction	Martin, Janet and Kate are from Turkey, Portugal and Argentina respectively.	Kate is from Turkey.
contradiction	Nancy, Tom and Joan are from Taiwan, Georgia and Canada respectively.	Joan is from Taiwan.
contradiction	Ken, Katie and Daniel are from China, Italy and Belarus respectively.	Daniel is from China.
contradiction	Eleanor, Susan and Alexandra are from South Korea, Philippines and Bangladesh respectively.	Alexandra is from South Korea.
contradiction	Alice, Lauren and Judy are from Greece, Afghanistan and Oman respectively.	Judy is from Greece.
contradiction	Fred, Tom and Alison are from Libya, Haiti and India respectively.	Alison is from Libya.
contradiction	Stephen, Jessica and Eric are from Qatar, Iran and Uruguay respectively.	Eric is from Qatar.
contradiction	Bill, Sam and Lisa are from Maldives, North Korea and Iceland respectively.	Lisa is from Maldives.
contradiction	Melissa, Robert and Francis are from Malaysia, Mexico and Russia respectively.	Francis is from Malaysia.
contradiction	Jeff, Harry and Grace are from Brazil, Oman and Bangladesh respectively.	Grace is from Brazil.
contradiction	Carol, Simon and Robert are from Saudi Arabia, Azerbaijan and Poland respectively.	Robert is from Saudi Arabia.
contradiction	Julia, Steven and Peter are from Iceland, Bhutan and Switzerland respectively.	Peter is from Iceland.
contradiction	Billy, Stephen and Donald are from Belarus, Nepal and Afghanistan respectively.	Donald is from Belarus.
contradiction	Katherine, Christine and Al are from India, Denmark and Bangladesh respectively.	Al is from India.
contradiction	Grace, Bill and Lynn are from Belarus, China and Azerbaijan respectively.	Lynn is from Belarus.
contradiction	Mike, Harry and Chris are from Hungary, Iraq and Portugal respectively.	Chris is from Hungary.
contradiction	Emily, Andrea and Ray are from Netherlands, Brazil and Bhutan respectively.	Ray is from Netherlands.
contradiction	Lisa, Sam and Francis are from Italy, Australia and Iran respectively.	Francis is from Italy.
contradiction	Linda, Heather and Samuel are from Argentina, Malaysia and Afghanistan respectively.	Samuel is from Argentina.
contradiction	Arthur, Leslie and Colin are from Haiti, Saudi Arabia and Japan respectively.	Colin is from Haiti.
contradiction	Linda, Bob and Ed are from Georgia, Thailand and Iceland respectively.	Ed is from Georgia.
contradiction	Edwin, Rebecca and Charlotte are from Libya, Ghana and Russia respectively.	Charlotte is from Libya.
contradiction	Rebecca, Victoria and Julie are from Netherlands, Turkey and Brazil respectively.	Julie is from Netherlands.
contradiction	Philip, Benjamin and Daniel are from Bhutan, Italy and Austria respectively.	Daniel is from Bhutan.
contradiction	Jeff, Helen and Rose are from Belarus, Turkey and Ecuador respectively.	Rose is from Belarus.
contradiction	Sally, Melissa and Martha are from France, India and Chile respectively.	Martha is from France.
contradiction	Edward, Frances and Diane are from Laos, Bangladesh and Saudi Arabia respectively.	Diane is from Laos.
contradiction	Nicole, Stephen and Donna are from Ukraine, Zimbabwe and Uruguay respectively.	Donna is from Ukraine.
contradiction	Rachel, Robin and Julie are from Malaysia, Taiwan and Argentina respectively.	Julie is from Malaysia.
contradiction	Joseph, Jack and Karen are from United Arab Emirates, Egypt and Indonesia respectively.	Karen is from United Arab Emirates.
contradiction	Louise, Rebecca and Keith are from Ghana, Iraq and Vietnam respectively.	Keith is from Ghana.
contradiction	Louise, David and Steve are from Ireland, Afghanistan and Hungary respectively.	Steve is from Ireland.
contradiction	Michelle, Carl and Daniel are from Azerbaijan, Denmark and Mexico respectively.	Daniel is from Azerbaijan.
contradiction	Catherine, Stephanie and Jay are from France, Poland and Portugal respectively.	Jay is from France.
contradiction	Christopher, Johnny and Victoria are from Austria, Singapore and Afghanistan respectively.	Victoria is from Austria.
contradiction	Carolyn, Fiona and Ralph are from Italy, Georgia and United Kingdom respectively.	Ralph is from Italy.
contradiction	Fiona, Stephanie and Mark are from Haiti, France and Georgia respectively.	Mark is from Haiti.
contradiction	Steve, Jeff and Barbara are from Georgia, Ukraine and Russia respectively.	Barbara is from Georgia.
contradiction	Robert, Alison and Anthony are from Brazil, Bhutan and Afghanistan respectively.	Anthony is from Brazil.
contradiction	Charlie, Matt and Dick are from United Kingdom, Pakistan and Uruguay respectively.	Dick is from United Kingdom.
contradiction	Joan, Alfred and Leslie are from Ecuador, Philippines and Poland respectively.	Leslie is from Ecuador.
contradiction	Greg, Tony and Jimmy are from Chile, Haiti and Egypt respectively.	Jimmy is from Chile.
contradiction	Amanda, Jerry and Dave are from Germany, Belarus and Chile respectively.	Dave is from Germany.
contradiction	Mike, Ashley and Joan are from Russia, Ecuador and Colombia respectively.	Joan is from Russia.
contradiction	Frances, Mark and Jerry are from Laos, Philippines and Hungary respectively.	Jerry is from Laos.
contradiction	Karen, Pamela and Samuel are from Iraq, Ukraine and Indonesia respectively.	Samuel is from Iraq.
contradiction	Johnny, Stephanie and Frank are from Haiti, New Zealand and Belgium respectively.	Frank is from Haiti.
contradiction	Tom, Catherine and Dan are from Hungary, Uruguay and Zimbabwe respectively.	Dan is from Hungary.
contradiction	Sharon, Ralph and Louise are from Portugal, Belgium and Malaysia respectively.	Louise is from Portugal.
contradiction	Kathy, Mark and Jennifer are from Fiji, Ukraine and Saudi Arabia respectively.	Jennifer is from Fiji.
contradiction	Christine, David and Robert are from Canada, India and Azerbaijan respectively.	Robert is from Canada.
contradiction	Louise, Henry and Kathryn are from Singapore, Cuba and Afghanistan respectively.	Kathryn is from Singapore.
contradiction	Francis, Patricia and Steve are from Greece, Cuba and Ghana respectively.	Steve is from Greece.
contradiction	Michelle, Emily and Steven are from United States of America, United Kingdom and Japan respectively.	Steven is from United States of America.
contradiction	Jean, Elaine and Kathryn are from Cuba, Ecuador and Bangladesh respectively.	Kathryn is from Cuba.
contradiction	Tim, Nicole and Louise are from Greece, Ecuador and Zimbabwe respectively.	Louise is from Greece.
contradiction	Patrick, Diana and Donald are from United States of America, Afghanistan and Vietnam respectively.	Donald is from United States of America.
contradiction	Howard, Rose and Anna are from China, India and Japan respectively.	Anna is from China.
contradiction	Kate, Kelly and Kathleen are from Fiji, Finland and Sweden respectively.	Kathleen is from Fiji.
contradiction	Andrea, Bobby and Matt are from Malaysia, Australia and Pakistan respectively.	Matt is from Malaysia.
contradiction	Tony, James and Jimmy are from Switzerland, North Korea and France respectively.	Jimmy is from Switzerland.
contradiction	Frances, Ellen and Anne are from Belgium, Maldives and India respectively.	Anne is from Belgium.
contradiction	Harry, Kate and Ian are from Bhutan, Israel and Cuba respectively.	Ian is from Bhutan.
contradiction	Heather, Alan and Billy are from Iceland, Iraq and Taiwan respectively.	Billy is from Iceland.
contradiction	Nancy, Dave and Susan are from United Arab Emirates, Brazil and Poland respectively.	Susan is from United Arab Emirates.
contradiction	Michael, Eric and Sharon are from Chile, United Arab Emirates and Belgium respectively.	Sharon is from Chile.
contradiction	Lynn, Sue and Steven are from Chile, Vietnam and Thailand respectively.	Steven is from Chile.
contradiction	Martin, Jean and Sally are from Egypt, Bhutan and Afghanistan respectively.	Sally is from Egypt.
contradiction	Louise, Sharon and Anne are from Laos, Russia and Ghana respectively.	Anne is from Laos.
contradiction	Nicole, Henry and Christopher are from Switzerland, Bhutan and India respectively.	Christopher is from Switzerland.
contradiction	Jim, Suzanne and Harold are from United Kingdom, Poland and Azerbaijan respectively.	Harold is from United Kingdom.
contradiction	Ken, Harriet and Ralph are from Afghanistan, Iraq and Pakistan respectively.	Ralph is from Afghanistan.
contradiction	Bill, Lynn and Sam are from Afghanistan, Georgia and France respectively.	Sam is from Afghanistan.
contradiction	Joan, Marilyn and Hugh are from Laos, China and Sweden respectively.	Hugh is from Laos.
contradiction	Carl, Jessica and Joe are from Brazil, Russia and Portugal respectively.	Joe is from Brazil.
contradiction	Evelyn, Adam and Leslie are from Argentina, Ukraine and Georgia respectively.	Leslie is from Argentina.
contradiction	Frederick, Lucy and Ralph are from India, Netherlands and Sweden respectively.	Ralph is from India.
contradiction	Ray, Chris and Suzanne are from Cuba, Germany and Ghana respectively.	Suzanne is from Cuba.
contradiction	Dan, Harriet and Rachel are from Pakistan, Malaysia and Brazil respectively.	Rachel is from Pakistan.
contradiction	Jim, Don and Steven are from United Arab Emirates, Pakistan and Belarus respectively.	Steven is from United Arab Emirates.
contradiction	Jill, Ralph and Stephen are from Afghanistan, Cuba and Nepal respectively.	Stephen is from Afghanistan.
contradiction	Karen, Edwin and Donald are from Turkey, United States of America and Israel respectively.	Donald is from Turkey.
contradiction	Laura, Steve and Barbara are from Uruguay, Japan and Sweden respectively.	Barbara is from Uruguay.
contradiction	Hugh, Edward and Fred are from Austria, Libya and Saudi Arabia respectively.	Fred is from Austria.
contradiction	Nicole, Tom and Dave are from Laos, Sweden and Libya respectively.	Dave is from Laos.
contradiction	Tony, Robin and Judy are from Russia, Mexico and Taiwan respectively.	Judy is from Russia.
contradiction	David, Virginia and Al are from Portugal, Oman and Finland respectively.	Al is from Portugal.
contradiction	Patricia, Michael and Lisa are from Russia, Belgium and Egypt respectively.	Lisa is from Russia.
contradiction	Stephen, Fiona and Bruce are from Bangladesh, Turkey and Philippines respectively.	Bruce is from Bangladesh.
contradiction	Roger, Jim and Al are from Iraq, Nepal and Italy respectively.	Al is from Iraq.
contradiction	Alexander, Anthony and Joe are from Azerbaijan, Oman and Saudi Arabia respectively.	Joe is from Azerbaijan.
contradiction	Peter, Lawrence and Lauren are from Denmark, Canada and Bangladesh respectively.	Lauren is from Denmark.
contradiction	Harry, Adam and Janet are from Ireland, Finland and Oman respectively.	Janet is from Ireland.
contradiction	Christopher, Kate and Patrick are from Singapore, France and South Korea respectively.	Patrick is from Singapore.
contradiction	Heather, Matthew and Patricia are from Germany, Philippines and Maldives respectively.	Patricia is from Germany.
contradiction	Katie, Jennifer and Fiona are from Greece, United States of America and Taiwan respectively.	Fiona is from Greece.
contradiction	Kim, Carl and Matt are from Israel, Philippines and Russia respectively.	Matt is from Israel.
contradiction	Kathleen, Dan and Claire are from Ghana, New Zealand and Maldives respectively.	Claire is from Ghana.
contradiction	Mike, Sue and Louise are from Ghana, Qatar and Bhutan respectively.	Louise is from Ghana.
contradiction	Jean, Julie and Eric are from China, Nepal and Chile respectively.	Eric is from China.
contradiction	Amy, Julie and Leslie are from France, Ukraine and Zimbabwe respectively.	Leslie is from France.
contradiction	Barbara, Stephanie and Jason are from France, Greece and Egypt respectively.	Jason is from France.
contradiction	Louis, Bobby and Scott are from Belgium, Mexico and Brazil respectively.	Scott is from Belgium.
contradiction	Jim, Benjamin and Lisa are from Belarus, Azerbaijan and Iran respectively.	Lisa is from Belarus.
contradiction	Eleanor, Emily and Marilyn are from Zimbabwe, Haiti and Vietnam respectively.	Marilyn is from Zimbabwe.
contradiction	Dick, Carl and Rebecca are from South Korea, Malaysia and Qatar respectively.	Rebecca is from South Korea.
contradiction	Arthur, Kathryn and Greg are from Greece, Singapore and France respectively.	Greg is from Greece.
