contradiction	David, Maria, Harriet and Anthony are from Australia, Oman, Chile and Colombia respectively.	Anthony is from Australia.
contradiction	Bob, Martin, Susan and Gary are from Portugal, Israel, New Zealand and Finland respectively.	Gary is from Portugal.
contradiction	Elizabeth, Richard, Carolyn and Annie are from Qatar, Belgium, Indonesia and Uruguay respectively.	Annie is from Qatar.
contradiction	Alexandra, William, Tom and Charlotte are from Hungary, Chile, Netherlands and Libya respectively.	Charlotte is from Hungary.
contradiction	Amy, Elizabeth, Kenneth and Alison are from Japan, Chile, Bangladesh and Ghana respectively.	Alison is from Japan.
contradiction	Hugh, Colin, Mike and Bobby are from Laos, Italy, Maldives and Portugal respectively.	Bobby is from Laos.
contradiction	Dave, Angela, Carol and Ben are from North Korea, Azerbaijan, Uruguay and Belgium respectively.	Ben is from North Korea.
contradiction	Arthur, Ann, Greg and Sophie are from Pakistan, Colombia, Uruguay and Indonesia respectively.	Sophie is from Pakistan.
contradiction	Bob, Bobby, Peter and Mike are from Greece, Argentina, Philippines and Saudi Arabia respectively.	Mike is from Greece.
contradiction	Kenneth, Patrick, Sharon and Ray are from Netherlands, United Kingdom, United Arab Emirates and Canada respectively.	Ray is from Netherlands.
contradiction	Julia, Rachel, Mike and Don are from Ghana, Russia, France and Uruguay respectively.	Don is from Ghana.
contradiction	Kate, Ken, Sandra and Roger are from United Kingdom, United States of America, Hungary and Bhutan respectively.	Roger is from United Kingdom.
contradiction	Louis, Marilyn, Katherine and Amanda are from United Kingdom, Libya, Denmark and Italy respectively.	Amanda is from United Kingdom.
contradiction	Karen, Roy, Billy and Sue are from Brazil, Vietnam, Qatar and Ukraine respectively.	Sue is from Brazil.
contradiction	Robert, Philip, Louis and Elaine are from Hungary, Azerbaijan, Zimbabwe and Austria respectively.	Elaine is from Hungary.
contradiction	Judy, George, Eric and Alison are from Georgia, Pakistan, South Korea and New Zealand respectively.	Alison is from Georgia.
contradiction	Susan, Harriet, James and Leslie are from Australia, Bangladesh, Iran and Russia respectively.	Leslie is from Australia.
contradiction	Deborah, James, Rebecca and Dorothy are from Belarus, Uruguay, Singapore and Germany respectively.	Dorothy is from Belarus.
contradiction	Amy, Grace, Kathryn and Louis are from Iceland, Philippines, Uruguay and Israel respectively.	Louis is from Iceland.
contradiction	Sam, Kathryn, Henry and Kathleen are from Thailand, Oman, Cuba and Greece respectively.	Kathleen is from Thailand.
contradiction	Kathleen, Amanda, Alex and Martin are from Japan, Philippines, Afghanistan and Singapore respectively.	Martin is from Japan.
contradiction	Kevin, Hugh, Dick and Ann are from Vietnam, Australia, Sweden and Argentina respectively.	Ann is from Vietnam.
contradiction	Caroline, Don, William and Al are from Afghanistan, Singapore, Mexico and Qatar respectively.	Al is from Afghanistan.
contradiction	Robin, Charlotte, Amy and Howard are from Malaysia, Maldives, Laos and Zimbabwe respectively.	Howard is from Malaysia.
contradiction	Hugh, Michelle, Bruce and Elaine are from Argentina, Hungary, United Arab Emirates and Haiti respectively.	Elaine is from Argentina.
contradiction	Ed, Suzanne, Julie and Julia are from Chile, Ukraine, United Kingdom and Ghana respectively.	Julia is from Chile.
contradiction	Jimmy, Barbara, Matthew and Walter are from Nepal, Malaysia, Indonesia and Chile respectively.	Walter is from Nepal.
contradiction	Christine, Gary, Frances and Kelly are from Cuba, Germany, Libya and Austria respectively.	Kelly is from Cuba.
contradiction	Diane, Barbara, Kevin and Rose are from Argentina, Nepal, Italy and France respectively.	Rose is from Argentina.
contradiction	Alex, Amanda, Don and Claire are from Canada, Ghana, Belgium and Bangladesh respectively.	Claire is from Canada.
contradiction	Elaine, Bruce, Joan and Mike are from Hungary, Azerbaijan, Fiji and Canada respectively.	Mike is from Hungary.
contradiction	Florence, Mary, Richard and Wendy are from Turkey, Greece, Oman and Poland respectively.	Wendy is from Turkey.
contradiction	Kathryn, Frank, Louis and Jack are from Belarus, Australia, Uruguay and South Korea respectively.	Jack is from Belarus.
contradiction	Simon, Carolyn, Grace and Kim are from Ecuador, Netherlands, Uruguay and Turkey respectively.	Kim is from Ecuador.
contradiction	Howard, Sharon, Marilyn and Robin are from Bhutan, Italy, Egypt and Sweden respectively.	Robin is from Bhutan.
contradiction	Jane, Patrick, Martha and Howard are from Ecuador, Libya, United Kingdom and Bhutan respectively.	Howard is from Ecuador.
contradiction	Eleanor, Caroline, Ben and Jimmy are from Fiji, Sweden, Malaysia and Brazil respectively.	Jimmy is from Fiji.
contradiction	Emma, Edwin, Alfred and Patricia are from Azerbaijan, Afghanistan, Saudi Arabia and Belarus respectively.	Patricia is from Azerbaijan.
contradiction	Philip, Brian, Charles and Martin are from Netherlands, Iran, New Zealand and Iraq respectively.	Martin is from Netherlands.
contradiction	Karen, Lisa, Dorothy and Lauren are from United States of America, North Korea, Malaysia and United Arab Emirates respectively.	Lauren is from United States of America.
contradiction	Anthony, Jean, Janet and Don are from Canada, Pakistan, Thailand and Iran respectively.	Don is from Canada.
contradiction	Katie, Tim, Charlotte and Stephen are from Greece, Uruguay, Saudi Arabia and Vietnam respectively.	Stephen is from Greece.
contradiction	Peter, Elaine, Susan and Al are from India, Indonesia, Thailand and Philippines respectively.	Al is from India.
contradiction	Judith, Victoria, Ashley and Alice are from Ghana, China, Turkey and United States of America respectively.	Alice is from Ghana.
contradiction	Sally, Sharon, Edward and Kathleen are from Taiwan, Hungary, Bhutan and Canada respectively.	Kathleen is from Taiwan.
contradiction	Karen, Bill, Fiona and Michael are from North Korea, Afghanistan, Ireland and India respectively.	Michael is from North Korea.
contradiction	Sue, Alice, Kevin and Charlie are from Netherlands, Australia, Qatar and Oman respectively.	Charlie is from Netherlands.
contradiction	Nancy, Bob, Daniel and Alfred are from China, Iran, Belgium and Greece respectively.	Alfred is from China.
contradiction	John, Bob, Grace and Amanda are from Thailand, Maldives, Turkey and United Kingdom respectively.	Amanda is from Thailand.
contradiction	Charlie, Steve, Kim and Catherine are from Uruguay, Austria, Israel and Taiwan respectively.	Catherine is from Uruguay.
contradiction	Mike, Philip, Florence and Jerry are from Malaysia, Finland, Russia and Zimbabwe respectively.	Jerry is from Malaysia.
contradiction	Marie, Sarah, Emma and Anne are from Maldives, China, Switzerland and Indonesia respectively.	Anne is from Maldives.
contradiction	Claire, Arthur, Christine and Susan are from North Korea, United States of America, Laos and Japan respectively.	Susan is from North Korea.
contradiction	Patrick, Jane, Albert and James are from Iceland, Russia, Turkey and Pakistan respectively.	James is from Iceland.
contradiction	Ryan, Michael, Bill and Keith are from France, Australia, Fiji and Zimbabwe respectively.	Keith is from France.
contradiction	Barbara, Nick, Emma and Heather are from China, Italy, Portugal and Germany respectively.	Heather is from China.
contradiction	Larry, Virginia, Francis and Maria are from Pakistan, Bangladesh, Portugal and Hungary respectively.	Maria is from Pakistan.
contradiction	Billy, Francis, Annie and Kelly are from Ukraine, Nepal, Greece and Finland respectively.	Kelly is from Ukraine.
contradiction	Ron, Dick, Bruce and Arthur are from Iran, Sweden, Bhutan and Bangladesh respectively.	Arthur is from Iran.
contradiction	Albert, Joseph, Howard and Ryan are from Laos, Ecuador, Turkey and Canada respectively.	Ryan is from Laos.
contradiction	Bruce, Linda, Walter and Kathryn are from Japan, Australia, Ghana and Malaysia respectively.	Kathryn is from Japan.
contradiction	Helen, Alice, Sam and Ellen are from Colombia, United Arab Emirates, Taiwan and Finland respectively.	Ellen is from Colombia.
contradiction	Sharon, Benjamin, Lawrence and Sarah are from Indonesia, Sweden, Georgia and Thailand respectively.	Sarah is from Indonesia.
contradiction	Mary, Jennifer, Carol and Mike are from Uruguay, Singapore, China and Iceland respectively.	Mike is from Uruguay.
contradiction	Elizabeth, Keith, Judith and Joe are from Belarus, Ireland, Maldives and Uruguay respectively.	Joe is from Belarus.
contradiction	Daniel, Michelle, Bill and Ann are from Finland, Philippines, France and Belarus respectively.	Ann is from Finland.
contradiction	Ray, Emma, Diana and Virginia are from Ecuador, Greece, Laos and Ghana respectively.	Virginia is from Ecuador.
contradiction	Pamela, Scott, Andrea and Grace are from North Korea, Italy, Sweden and Laos respectively.	Grace is from North Korea.
contradiction	Alice, Victoria, Leslie and Katie are from Indonesia, Netherlands, Georgia and Sweden respectively.	Katie is from Indonesia.
contradiction	Steven, Nicole, Caroline and Cynthia are from Ukraine, Italy, Greece and Egypt respectively.	Cynthia is from Ukraine.
contradiction	Ken, Sophie, Judy and Rose are from Japan, France, Poland and Maldives respectively.	Rose is from Japan.
contradiction	Kevin, Diane, Frank and Robert are from United States of America, France, Laos and Iceland respectively.	Robert is from United States of America.
contradiction	Suzanne, Caroline, Henry and Alice are from Sweden, France, Uruguay and Zimbabwe respectively.	Alice is from Sweden.
contradiction	Emma, Dave, Rachel and Charlotte are from Uruguay, Belarus, Russia and Canada respectively.	Charlotte is from Uruguay.
contradiction	Hugh, Fred, Ron and Carl are from Cuba, Indonesia, India and Haiti respectively.	Carl is from Cuba.
contradiction	Philip, Al, Louis and Robin are from Belarus, New Zealand, Iceland and Finland respectively.	Robin is from Belarus.
contradiction	Lawrence, Dan, Jason and Sara are from South Korea, Uruguay, Oman and Russia respectively.	Sara is from South Korea.
contradiction	Julie, Brian, Robin and Gary are from Belarus, Russia, Finland and Azerbaijan respectively.	Gary is from Belarus.
contradiction	Lauren, Ian, Matt and Sandra are from Iran, Greece, Colombia and Israel respectively.	Sandra is from Iran.
contradiction	Frank, Caroline, Margaret and Anne are from Israel, Vietnam, North Korea and India respectively.	Anne is from Israel.
contradiction	Julie, Jason, Daniel and Wendy are from Ghana, Philippines, North Korea and United Kingdom respectively.	Wendy is from Ghana.
contradiction	Emily, George, Elizabeth and Janet are from Israel, Belgium, Pakistan and Bangladesh respectively.	Janet is from Israel.
contradiction	Keith, Matt, Sandra and Jerry are from Ukraine, Nepal, Netherlands and Malaysia respectively.	Jerry is from Ukraine.
contradiction	Edwin, Sarah, Diane and Robin are from Portugal, Hungary, Egypt and Russia respectively.	Robin is from Portugal.
contradiction	Barbara, Evelyn, Jonathan and Sophie are from Laos, United Kingdom, Iraq and Iceland respectively.	Sophie is from Laos.
contradiction	Rose, Maria, Nick and Ryan are from Italy, Turkey, Belarus and Maldives respectively.	Ryan is from Italy.
contradiction	Kim, Louis, Albert and Mary are from Poland, Iraq, Netherlands and Ghana respectively.	Mary is from Poland.
contradiction	Helen, Sara, Harry and Susan are from Georgia, Iran, United States of America and Canada respectively.	Susan is from Georgia.
contradiction	Alice, Kevin, Diane and Sally are from Georgia, Argentina, Iraq and Malaysia respectively.	Sally is from Georgia.
contradiction	Ruth, Alan, Ralph and Ann are from Saudi Arabia, Bhutan, Netherlands and Chile respectively.	Ann is from Saudi Arabia.
contradiction	Bill, Alison, Ellen and Don are from Russia, Azerbaijan, India and Chile respectively.	Don is from Russia.
contradiction	Florence, Joe, Paul and Bob are from Iceland, Uruguay, Egypt and Maldives respectively.	Bob is from Iceland.
contradiction	Peter, Michelle, Chris and Martha are from Poland, Germany, Fiji and Libya respectively.	Martha is from Poland.
contradiction	Charlie, Sally, Pamela and Jennifer are from Zimbabwe, Afghanistan, United Arab Emirates and Haiti respectively.	Jennifer is from Zimbabwe.
contradiction	Lauren, Kathy, Wendy and Eric are from Germany, Bangladesh, United Arab Emirates and Poland respectively.	Eric is from Germany.
contradiction	Carol, Margaret, Diana and Elizabeth are from United Kingdom, Turkey, Brazil and Portugal respectively.	Elizabeth is from United Kingdom.
contradiction	Charlie, Andrew, Alison and Lawrence are from Laos, Afghanistan, Egypt and Ukraine respectively.	Lawrence is from Laos.
contradiction	Johnny, Victoria, Andrea and Charlie are from Libya, United States of America, United Arab Emirates and Malaysia respectively.	Charlie is from Libya.
contradiction	Tom, Evelyn, Suzanne and Larry are from Mexico, China, Poland and Indonesia respectively.	Larry is from Mexico.
contradiction	Scott, Jill, Harry and Kathryn are from Finland, Indonesia, Denmark and United Arab Emirates respectively.	Kathryn is from Finland.
contradiction	Bob, George, Christopher and Christine are from Belarus, Hungary, Portugal and Pakistan respectively.	Christine is from Belarus.
contradiction	Brian, Ellen, Nick and Dan are from Azerbaijan, Thailand, Taiwan and Canada respectively.	Dan is from Azerbaijan.
contradiction	Fiona, Martin, Harry and Victoria are from Hungary, Fiji, Ecuador and Azerbaijan respectively.	Victoria is from Hungary.
contradiction	Larry, Robert, Elizabeth and Ryan are from United Arab Emirates, Haiti, Sweden and Iran respectively.	Ryan is from United Arab Emirates.
contradiction	Frederick, Pamela, Louis and Arthur are from Japan, Israel, Argentina and Iran respectively.	Arthur is from Japan.
contradiction	Diane, Paul, Nick and Kevin are from Germany, Maldives, Italy and Turkey respectively.	Kevin is from Germany.
contradiction	Marilyn, Matthew, Edward and Adam are from Ukraine, Australia, Nepal and Taiwan respectively.	Adam is from Ukraine.
contradiction	Alfred, Mike, Judy and Karen are from Belarus, Cuba, Sweden and Mexico respectively.	Karen is from Belarus.
contradiction	Dan, Christine, Sue and Lisa are from Austria, Oman, Zimbabwe and United Kingdom respectively.	Lisa is from Austria.
contradiction	Lynn, Paul, Elizabeth and Patrick are from Russia, United Arab Emirates, Thailand and Belarus respectively.	Patrick is from Russia.
contradiction	Lucy, Jennifer, Ryan and Lynn are from Bangladesh, Hungary, Ukraine and Uruguay respectively.	Lynn is from Bangladesh.
contradiction	Alexander, Dorothy, Johnny and Katherine are from United Kingdom, North Korea, Iceland and United Arab Emirates respectively.	Katherine is from United Kingdom.
contradiction	Amy, Katie, Sally and Robin are from New Zealand, Fiji, Haiti and Bhutan respectively.	Robin is from New Zealand.
contradiction	Anne, Donald, Edith and James are from Oman, United Arab Emirates, Italy and Hungary respectively.	James is from Oman.
contradiction	John, Lauren, Chris and Sandra are from Fiji, North Korea, Egypt and Mexico respectively.	Sandra is from Fiji.
contradiction	Maria, Chris, Kelly and Christopher are from Australia, Portugal, Ghana and Cuba respectively.	Christopher is from Australia.
contradiction	Jack, Albert, Bruce and Ellen are from Maldives, Belarus, North Korea and Japan respectively.	Ellen is from Maldives.
contradiction	Joan, Virginia, Linda and Kate are from Belarus, Iraq, Portugal and Colombia respectively.	Kate is from Belarus.
contradiction	Julie, Katherine, Charles and Elaine are from Chile, Netherlands, Brazil and Germany respectively.	Elaine is from Chile.
contradiction	Kate, Carl, Linda and Kenneth are from Fiji, Israel, Brazil and Belgium respectively.	Kenneth is from Fiji.
contradiction	Diane, Kathleen, Edwin and Steven are from Egypt, Turkey, Ireland and Iraq respectively.	Steven is from Egypt.
contradiction	Dan, Richard, Kathy and Lisa are from Cuba, Iraq, United States of America and Chile respectively.	Lisa is from Cuba.
contradiction	Julie, Emma, Elaine and Tony are from New Zealand, France, Qatar and Ecuador respectively.	Tony is from New Zealand.
contradiction	Linda, Greg, Amy and Sara are from Canada, Cuba, North Korea and Turkey respectively.	Sara is from Canada.
contradiction	John, Bruce, Ben and Frederick are from Mexico, Poland, Maldives and Saudi Arabia respectively.	Frederick is from Mexico.
contradiction	Kim, Ashley, Alexandra and Judy are from United Kingdom, Haiti, Portugal and Afghanistan respectively.	Judy is from United Kingdom.
contradiction	Barbara, Edith, Elizabeth and Jerry are from United States of America, Nepal, Turkey and Japan respectively.	Jerry is from United States of America.
contradiction	Ralph, Susan, Charles and Bruce are from Hungary, Oman, Poland and Denmark respectively.	Bruce is from Hungary.
contradiction	Greg, Diana, Helen and Paul are from Russia, Ghana, Israel and Ecuador respectively.	Paul is from Russia.
contradiction	Ian, Carl, David and Mike are from Taiwan, Azerbaijan, Hungary and Poland respectively.	Mike is from Taiwan.
contradiction	Donna, Dave, Margaret and Robert are from Greece, Egypt, India and Oman respectively.	Robert is from Greece.
contradiction	Alfred, Deborah, Victoria and Barbara are from Zimbabwe, Italy, Pakistan and United Arab Emirates respectively.	Barbara is from Zimbabwe.
contradiction	Laura, Kathy, Florence and Nicole are from Portugal, Singapore, Saudi Arabia and Italy respectively.	Nicole is from Portugal.
contradiction	Howard, Greg, Elizabeth and Marie are from Turkey, Cuba, United Kingdom and Belgium respectively.	Marie is from Turkey.
contradiction	Sally, Lisa, Amy and Martin are from United Arab Emirates, South Korea, Netherlands and Ireland respectively.	Martin is from United Arab Emirates.
contradiction	Francis, Caroline, Don and Catherine are from United States of America, United Arab Emirates, Fiji and Bhutan respectively.	Catherine is from United States of America.
contradiction	Marilyn, Martin, Pamela and Karen are from United States of America, Indonesia, New Zealand and India respectively.	Karen is from United States of America.
contradiction	Dave, Karen, Peter and Daniel are from Bhutan, Belgium, Nepal and Iraq respectively.	Daniel is from Bhutan.
contradiction	Frances, Wendy, Roger and Arthur are from Colombia, Finland, Oman and Ecuador respectively.	Arthur is from Colombia.
contradiction	Don, Martha, Ryan and Walter are from Afghanistan, Netherlands, Nepal and New Zealand respectively.	Walter is from Afghanistan.
contradiction	Grace, Ian, Deborah and Laura are from Malaysia, Uruguay, Netherlands and Argentina respectively.	Laura is from Malaysia.
contradiction	Mary, Richard, Caroline and Thomas are from Azerbaijan, Indonesia, Pakistan and Netherlands respectively.	Thomas is from Azerbaijan.
contradiction	Robin, Michelle, Leslie and Johnny are from Indonesia, Belgium, Pakistan and Chile respectively.	Johnny is from Indonesia.
contradiction	Susan, Nancy, Ray and Jessica are from Poland, Chile, Portugal and Switzerland respectively.	Jessica is from Poland.
contradiction	Emma, Susan, Maria and Roy are from Germany, Belarus, Poland and Ukraine respectively.	Roy is from Germany.
contradiction	Alfred, Maria, Jeff and Jane are from Zimbabwe, Philippines, Belarus and Libya respectively.	Jane is from Zimbabwe.
contradiction	Bobby, Sara, Arthur and Margaret are from Mexico, United Kingdom, Oman and Belarus respectively.	Margaret is from Mexico.
contradiction	Sally, Patrick, Lauren and Harriet are from Georgia, Fiji, India and Hungary respectively.	Harriet is from Georgia.
contradiction	Philip, Alison, Jerry and Jonathan are from Malaysia, Egypt, Saudi Arabia and Georgia respectively.	Jonathan is from Malaysia.
contradiction	Don, Kathy, Dan and Charles are from Vietnam, Italy, Israel and Denmark respectively.	Charles is from Vietnam.
contradiction	Diana, Maria, Florence and Eleanor are from Chile, United Kingdom, Libya and Brazil respectively.	Eleanor is from Chile.
contradiction	Peter, Frank, Katherine and Sam are from Ecuador, Libya, Japan and Iraq respectively.	Sam is from Ecuador.
contradiction	Kathy, Marilyn, Wendy and Steven are from Nepal, Philippines, Ireland and Italy respectively.	Steven is from Nepal.
contradiction	Carol, Harriet, Bob and Steven are from Ireland, Hungary, Israel and South Korea respectively.	Steven is from Ireland.
contradiction	Linda, Anna, Harry and Tony are from Zimbabwe, Austria, Netherlands and Bhutan respectively.	Tony is from Zimbabwe.
contradiction	Howard, Robin, Martha and Carolyn are from Ireland, Portugal, Iraq and Germany respectively.	Carolyn is from Ireland.
contradiction	Sue, Philip, Alison and Alexander are from Haiti, Russia, New Zealand and Mexico respectively.	Alexander is from Haiti.
contradiction	Rose, Marie, Martin and Robert are from Indonesia, Azerbaijan, Belarus and Sweden respectively.	Robert is from Indonesia.
contradiction	Emily, Sam, Patrick and Howard are from Maldives, North Korea, Saudi Arabia and United Kingdom respectively.	Howard is from Maldives.
contradiction	Anna, Helen, Francis and William are from Vietnam, Belarus, Italy and Pakistan respectively.	William is from Vietnam.
contradiction	Tom, Edwin, Evelyn and Anne are from Laos, Malaysia, Ghana and Mexico respectively.	Anne is from Laos.
contradiction	Bob, Ashley, Arthur and Anthony are from Zimbabwe, United Arab Emirates, Netherlands and India respectively.	Anthony is from Zimbabwe.
contradiction	Kenneth, Carl, Judy and Ellen are from Greece, Maldives, Australia and Netherlands respectively.	Ellen is from Greece.
contradiction	Angela, Nicole, Kim and Ashley are from Belarus, Afghanistan, Hungary and Ecuador respectively.	Ashley is from Belarus.
contradiction	Amanda, Charles, Michael and Rose are from Italy, Laos, Denmark and Oman respectively.	Rose is from Italy.
contradiction	Dick, Henry, Jill and Louise are from Australia, Thailand, Laos and Denmark respectively.	Louise is from Australia.
contradiction	Carol, Samuel, Bob and John are from Denmark, Maldives, Afghanistan and North Korea respectively.	John is from Denmark.
contradiction	Robin, Alex, Anthony and Colin are from Denmark, Germany, Belgium and United States of America respectively.	Colin is from Denmark.
contradiction	Elizabeth, Ian, Frederick and Janet are from Georgia, Bangladesh, United Kingdom and Australia respectively.	Janet is from Georgia.
contradiction	Mary, Martha, Stephanie and Tom are from Qatar, Iran, Philippines and New Zealand respectively.	Tom is from Qatar.
contradiction	Albert, Nicole, Samuel and Claire are from Argentina, Japan, Taiwan and Israel respectively.	Claire is from Argentina.
contradiction	Alison, Heather, Frances and Eleanor are from Saudi Arabia, Poland, France and Iceland respectively.	Eleanor is from Saudi Arabia.
contradiction	Jimmy, Andrea, Julie and Louise are from Canada, Ghana, Argentina and Portugal respectively.	Louise is from Canada.
contradiction	Jay, Dave, Donna and Carolyn are from France, Bhutan, Turkey and Austria respectively.	Carolyn is from France.
contradiction	Richard, Roger, Rebecca and Robert are from Taiwan, Saudi Arabia, Austria and South Korea respectively.	Robert is from Taiwan.
contradiction	Emma, John, Elizabeth and Joan are from Portugal, China, Taiwan and Oman respectively.	Joan is from Portugal.
contradiction	Michael, Henry, Colin and Martin are from Egypt, Australia, Switzerland and Brazil respectively.	Martin is from Egypt.
contradiction	Ed, Richard, Andrea and Ray are from Sweden, Belgium, Portugal and Georgia respectively.	Ray is from Sweden.
contradiction	Tony, Kathryn, Victoria and Joe are from Netherlands, Canada, Laos and China respectively.	Joe is from Netherlands.
contradiction	Elaine, Wendy, Harry and Katie are from New Zealand, Iran, Austria and Australia respectively.	Katie is from New Zealand.
contradiction	Evelyn, Jim, Edward and Greg are from Oman, Singapore, Russia and Nepal respectively.	Greg is from Oman.
contradiction	Bob, Harold, Judith and Kenneth are from Maldives, Vietnam, Japan and Oman respectively.	Kenneth is from Maldives.
contradiction	Nancy, Christine, Frederick and Emily are from Taiwan, New Zealand, Cuba and Greece respectively.	Emily is from Taiwan.
contradiction	Thomas, George, Lawrence and Simon are from Germany, Pakistan, Portugal and Brazil respectively.	Simon is from Germany.
contradiction	Daniel, Steve, Kim and Jessica are from Georgia, Azerbaijan, Indonesia and Australia respectively.	Jessica is from Georgia.
contradiction	Howard, Don, Maria and Peter are from Denmark, New Zealand, Georgia and Israel respectively.	Peter is from Denmark.
contradiction	Eric, Charlie, Sue and Eleanor are from France, Greece, Cuba and Chile respectively.	Eleanor is from France.
contradiction	Judy, Lauren, Francis and Melissa are from Belarus, Georgia, Sweden and Uruguay respectively.	Melissa is from Belarus.
contradiction	Albert, Nick, Dan and Carolyn are from Netherlands, Iraq, Ukraine and Maldives respectively.	Carolyn is from Netherlands.
contradiction	Anne, Joe, Rachel and Elaine are from Indonesia, Iceland, New Zealand and Cuba respectively.	Elaine is from Indonesia.
contradiction	Carol, Dan, Samuel and Charlie are from Netherlands, Singapore, United Arab Emirates and Denmark respectively.	Charlie is from Netherlands.
contradiction	Sarah, Katie, Steven and Maria are from Belgium, Japan, Indonesia and Canada respectively.	Maria is from Belgium.
contradiction	Judy, Jean, Claire and Bob are from Egypt, Cuba, Iran and Portugal respectively.	Bob is from Egypt.
contradiction	Donald, Gary, Heather and Victoria are from Afghanistan, Egypt, Poland and Georgia respectively.	Victoria is from Afghanistan.
