contradiction	Paul, Johnny and Deborah are from Australia, India and Vietnam respectively.	Deborah is from Australia.
contradiction	Ed, Catherine and Dan are from Sweden, Poland and Australia respectively.	Dan is from Sweden.
contradiction	Donna, Albert and Michelle are from Philippines, Poland and Qatar respectively.	Michelle is from Philippines.
contradiction	Brian, Nicole and Lynn are from United Kingdom, Ireland and Egypt respectively.	Lynn is from United Kingdom.
contradiction	Kathleen, Eric and Kevin are from Poland, Finland and South Korea respectively.	Kevin is from Poland.
contradiction	Rebecca, Ashley and Patrick are from Sweden, Pakistan and Zimbabwe respectively.	Patrick is from Sweden.
contradiction	Julia, Tim and Sam are from Japan, Qatar and Iceland respectively.	Sam is from Japan.
contradiction	Helen, Lisa and David are from Thailand, Taiwan and Australia respectively.	David is from Thailand.
contradiction	Jay, Joseph and Wendy are from New Zealand, Switzerland and Zimbabwe respectively.	Wendy is from New Zealand.
contradiction	Elaine, Peter and Evelyn are from Turkey, Australia and Malaysia respectively.	Evelyn is from Turkey.
contradiction	John, Louis and Jerry are from Pakistan, Philippines and Israel respectively.	Jerry is from Pakistan.
contradiction	Robert, Nancy and Katie are from France, Egypt and Belgium respectively.	Katie is from France.
contradiction	Eleanor, Sandra and Jennifer are from Japan, France and Afghanistan respectively.	Jennifer is from Japan.
contradiction	Jimmy, Evelyn and Helen are from Iraq, Fiji and Azerbaijan respectively.	Helen is from Iraq.
contradiction	Judy, Daniel and Leslie are from Bangladesh, Italy and Mexico respectively.	Leslie is from Bangladesh.
contradiction	Dave, Katie and Tony are from Iraq, Bangladesh and Germany respectively.	Tony is from Iraq.
contradiction	Charles, Brian and Scott are from Taiwan, Germany and Canada respectively.	Scott is from Taiwan.
contradiction	Lisa, Francis and Julie are from Poland, Georgia and Singapore respectively.	Julie is from Poland.
contradiction	Frances, Barbara and Sam are from Russia, Egypt and Colombia respectively.	Sam is from Russia.
contradiction	Edward, Jonathan and Eric are from Austria, Switzerland and Denmark respectively.	Eric is from Austria.
contradiction	George, Betty and Diana are from Israel, Greece and Oman respectively.	Diana is from Israel.
contradiction	Kim, Ray and Catherine are from Qatar, Poland and Ghana respectively.	Catherine is from Qatar.
contradiction	Al, Donna and Ryan are from Philippines, Qatar and Hungary respectively.	Ryan is from Philippines.
contradiction	Helen, Sharon and Kathleen are from Afghanistan, United Arab Emirates and Zimbabwe respectively.	Kathleen is from Afghanistan.
contradiction	Jennifer, Bob and Tom are from Russia, Argentina and Canada respectively.	Tom is from Russia.
contradiction	Bruce, Evelyn and Rebecca are from Bangladesh, Afghanistan and Brazil respectively.	Rebecca is from Bangladesh.
contradiction	Melissa, Richard and Carolyn are from Germany, Taiwan and Hungary respectively.	Carolyn is from Germany.
contradiction	James, Martin and Richard are from Oman, Ghana and Iran respectively.	Richard is from Oman.
contradiction	Mary, George and Michael are from Bangladesh, Russia and Indonesia respectively.	Michael is from Bangladesh.
contradiction	Greg, Dan and Cynthia are from Zimbabwe, United Arab Emirates and Germany respectively.	Cynthia is from Zimbabwe.
contradiction	Don, Peter and Karen are from Hungary, Finland and Australia respectively.	Karen is from Hungary.
contradiction	Walter, Dorothy and Wendy are from Ghana, Denmark and Libya respectively.	Wendy is from Ghana.
contradiction	Marie, Kelly and Joan are from Switzerland, Japan and Taiwan respectively.	Joan is from Switzerland.
contradiction	Ed, Gary and Stephen are from Oman, Greece and Indonesia respectively.	Stephen is from Oman.
contradiction	Philip, Kate and Stephanie are from Egypt, Belgium and Pakistan respectively.	Stephanie is from Egypt.
contradiction	Jason, Gary and Jeff are from Oman, North Korea and Malaysia respectively.	Jeff is from Oman.
contradiction	Ian, Jessica and Patrick are from Mexico, United Arab Emirates and Iraq respectively.	Patrick is from Mexico.
contradiction	Suzanne, Cynthia and Francis are from Indonesia, Iceland and Libya respectively.	Francis is from Indonesia.
contradiction	Diane, Dave and Grace are from Georgia, United Kingdom and Portugal respectively.	Grace is from Georgia.
contradiction	Barbara, Dan and Colin are from Australia, Poland and Ireland respectively.	Colin is from Australia.
contradiction	Katie, Brian and Bruce are from Netherlands, Russia and Ireland respectively.	Bruce is from Netherlands.
contradiction	Anthony, Evelyn and Ruth are from China, New Zealand and Fiji respectively.	Ruth is from China.
contradiction	Lauren, Bobby and Ken are from North Korea, Brazil and Libya respectively.	Ken is from North Korea.
contradiction	Bobby, Alexander and Mike are from Cuba, United Arab Emirates and Saudi Arabia respectively.	Mike is from Cuba.
contradiction	Carolyn, Walter and Alexandra are from Indonesia, Iran and India respectively.	Alexandra is from Indonesia.
contradiction	Melissa, Claire and Carol are from Saudi Arabia, Bangladesh and Colombia respectively.	Carol is from Saudi Arabia.
contradiction	Martha, Nick and Fred are from Vietnam, Ireland and South Korea respectively.	Fred is from Vietnam.
contradiction	Thomas, Betty and Carol are from New Zealand, Brazil and Mexico respectively.	Carol is from New Zealand.
contradiction	Ralph, Jim and Tim are from Haiti, United States of America and Fiji respectively.	Tim is from Haiti.
contradiction	Amy, Edwin and Julia are from Afghanistan, Poland and Bangladesh respectively.	Julia is from Afghanistan.
contradiction	Scott, Tim and Jay are from Italy, Finland and Georgia respectively.	Jay is from Italy.
contradiction	Catherine, Ben and Rebecca are from Israel, Finland and Thailand respectively.	Rebecca is from Israel.
contradiction	Alfred, Albert and Simon are from Pakistan, Turkey and Chile respectively.	Simon is from Pakistan.
contradiction	Suzanne, Benjamin and Annie are from Portugal, Libya and Philippines respectively.	Annie is from Portugal.
contradiction	Nick, Mary and Jane are from Qatar, Ireland and Argentina respectively.	Jane is from Qatar.
contradiction	Mary, Arthur and Betty are from Ecuador, Ukraine and Argentina respectively.	Betty is from Ecuador.
contradiction	Robert, Harry and Joan are from Mexico, Germany and Netherlands respectively.	Joan is from Mexico.
contradiction	Ray, Rebecca and Sue are from Maldives, China and Singapore respectively.	Sue is from Maldives.
contradiction	Marie, Christine and Stephen are from Egypt, Australia and Cuba respectively.	Stephen is from Egypt.
contradiction	Julia, Sandra and Albert are from Germany, Egypt and Switzerland respectively.	Albert is from Germany.
contradiction	Jessica, Kevin and Christopher are from Ghana, Denmark and Egypt respectively.	Christopher is from Ghana.
contradiction	Lawrence, Sharon and Ian are from Georgia, Iran and Libya respectively.	Ian is from Georgia.
contradiction	Al, Jim and Lucy are from New Zealand, Malaysia and Finland respectively.	Lucy is from New Zealand.
contradiction	Howard, Tom and Suzanne are from Uruguay, Mexico and Qatar respectively.	Suzanne is from Uruguay.
contradiction	James, Lisa and Diana are from Russia, Turkey and New Zealand respectively.	Diana is from Russia.
contradiction	Diane, Andrea and Florence are from Georgia, Poland and Iceland respectively.	Florence is from Georgia.
contradiction	Jessica, Amanda and Don are from Oman, Finland and Malaysia respectively.	Don is from Oman.
contradiction	Peter, John and Ralph are from Fiji, Laos and Mexico respectively.	Ralph is from Fiji.
contradiction	Daniel, Sandra and Carolyn are from Bhutan, Maldives and Qatar respectively.	Carolyn is from Bhutan.
contradiction	Alexandra, Greg and Ray are from Belarus, Brazil and Iraq respectively.	Ray is from Belarus.
contradiction	Anna, Brian and Nancy are from Philippines, Maldives and Turkey respectively.	Nancy is from Philippines.
contradiction	Elaine, Linda and Robert are from Australia, China and Zimbabwe respectively.	Robert is from Australia.
contradiction	Lawrence, Andrea and Sandra are from Pakistan, Maldives and Taiwan respectively.	Sandra is from Pakistan.
contradiction	Melissa, Patricia and Carol are from United Arab Emirates, France and Iraq respectively.	Carol is from United Arab Emirates.
contradiction	David, Jessica and Larry are from Argentina, United Kingdom and Italy respectively.	Larry is from Argentina.
contradiction	Bill, Alan and Jennifer are from Ukraine, South Korea and Israel respectively.	Jennifer is from Ukraine.
contradiction	Jean, Jane and Patricia are from Japan, New Zealand and Taiwan respectively.	Patricia is from Japan.
contradiction	Barbara, Jim and Sam are from Austria, United States of America and Ecuador respectively.	Sam is from Austria.
contradiction	Sam, Bob and Robert are from Greece, Iran and South Korea respectively.	Robert is from Greece.
contradiction	Jonathan, Bruce and Mary are from Qatar, Switzerland and Iran respectively.	Mary is from Qatar.
contradiction	Barbara, Judy and Andrew are from Maldives, Sweden and Denmark respectively.	Andrew is from Maldives.
contradiction	Don, Rachel and Bill are from Bhutan, Afghanistan and Japan respectively.	Bill is from Bhutan.
contradiction	Jason, Mark and Jimmy are from Libya, Philippines and Turkey respectively.	Jimmy is from Libya.
contradiction	Ian, Johnny and Deborah are from Taiwan, Austria and Chile respectively.	Deborah is from Taiwan.
contradiction	Kevin, Nancy and Sam are from France, Canada and Russia respectively.	Sam is from France.
contradiction	George, Katherine and Charlotte are from Maldives, Zimbabwe and Japan respectively.	Charlotte is from Maldives.
contradiction	Simon, Samuel and Arthur are from Philippines, Iran and Haiti respectively.	Arthur is from Philippines.
contradiction	Alex, Amy and Jessica are from Fiji, Netherlands and Singapore respectively.	Jessica is from Fiji.
contradiction	Arthur, Marilyn and Melissa are from Turkey, North Korea and Singapore respectively.	Melissa is from Turkey.
contradiction	Tim, Kenneth and Eleanor are from Qatar, Ghana and Egypt respectively.	Eleanor is from Qatar.
contradiction	Bill, Martha and Christine are from Finland, Switzerland and Portugal respectively.	Christine is from Finland.
contradiction	Jeff, Andrea and Dick are from Australia, Mexico and North Korea respectively.	Dick is from Australia.
contradiction	Claire, Chris and Harry are from Mexico, Cuba and Laos respectively.	Harry is from Mexico.
contradiction	Matthew, Ron and Sue are from Italy, Israel and Iran respectively.	Sue is from Italy.
contradiction	Katherine, Gary and Donald are from Qatar, Bhutan and Maldives respectively.	Donald is from Qatar.
contradiction	Alfred, Brian and Jennifer are from Switzerland, Pakistan and Italy respectively.	Jennifer is from Switzerland.
contradiction	Jane, Wendy and Frank are from Canada, Ecuador and Maldives respectively.	Frank is from Canada.
contradiction	Dick, Ray and Jerry are from Maldives, Greece and Malaysia respectively.	Jerry is from Maldives.
contradiction	Roger, Louis and Nancy are from Greece, India and Israel respectively.	Nancy is from Greece.
contradiction	Eleanor, George and Jim are from Nepal, New Zealand and Pakistan respectively.	Jim is from Nepal.
contradiction	Kathryn, Donna and Christine are from Singapore, Israel and Egypt respectively.	Christine is from Singapore.
contradiction	Dan, Julia and Diane are from Switzerland, South Korea and Nepal respectively.	Diane is from Switzerland.
contradiction	Arthur, Harry and Florence are from Iceland, United Arab Emirates and Fiji respectively.	Florence is from Iceland.
contradiction	Maria, Alison and Ashley are from Indonesia, Switzerland and Egypt respectively.	Ashley is from Indonesia.
contradiction	Sarah, Roger and Kate are from Iraq, China and Belgium respectively.	Kate is from Iraq.
contradiction	Patrick, David and Lynn are from Malaysia, North Korea and Turkey respectively.	Lynn is from Malaysia.
contradiction	Robert, Bruce and Roger are from Indonesia, Denmark and Russia respectively.	Roger is from Indonesia.
contradiction	Gary, Martin and Edwin are from Israel, Colombia and New Zealand respectively.	Edwin is from Israel.
contradiction	Alfred, Jane and Mark are from Zimbabwe, Brazil and Bhutan respectively.	Mark is from Zimbabwe.
contradiction	Philip, Carl and Annie are from New Zealand, Afghanistan and Germany respectively.	Annie is from New Zealand.
contradiction	Karen, Tom and Tim are from United States of America, Colombia and Pakistan respectively.	Tim is from United States of America.
contradiction	Betty, Maria and Lisa are from Taiwan, Russia and Qatar respectively.	Lisa is from Taiwan.
contradiction	Florence, Harriet and Don are from New Zealand, Denmark and Malaysia respectively.	Don is from New Zealand.
contradiction	Cynthia, Frances and Kenneth are from Belgium, Portugal and Mexico respectively.	Kenneth is from Belgium.
contradiction	Christine, Mary and Carolyn are from Singapore, Belgium and Vietnam respectively.	Carolyn is from Singapore.
contradiction	Karen, Diane and Peter are from Malaysia, Australia and Finland respectively.	Peter is from Malaysia.
contradiction	Alan, Stephanie and Ruth are from Haiti, Australia and Maldives respectively.	Ruth is from Haiti.
contradiction	Hugh, Benjamin and Matt are from Brazil, Netherlands and Portugal respectively.	Matt is from Brazil.
contradiction	Sandra, Steven and Rachel are from United Arab Emirates, Brazil and Georgia respectively.	Rachel is from United Arab Emirates.
contradiction	Katie, Alice and Anne are from Thailand, Netherlands and United Kingdom respectively.	Anne is from Thailand.
contradiction	Lucy, Tom and Leslie are from Chile, South Korea and Georgia respectively.	Leslie is from Chile.
contradiction	Harriet, Caroline and Larry are from Netherlands, New Zealand and Bangladesh respectively.	Larry is from Netherlands.
contradiction	Mary, Tom and Ray are from Poland, Uruguay and Turkey respectively.	Ray is from Poland.
contradiction	Keith, Andrew and Frederick are from Singapore, Bangladesh and Greece respectively.	Frederick is from Singapore.
contradiction	Kathy, Bruce and Wendy are from Pakistan, Oman and Vietnam respectively.	Wendy is from Pakistan.
contradiction	Nick, Michelle and Roger are from Japan, Cuba and Iraq respectively.	Roger is from Japan.
contradiction	Edwin, Jason and Janet are from South Korea, Ecuador and Greece respectively.	Janet is from South Korea.
contradiction	Andrew, Linda and Florence are from Bhutan, Switzerland and Egypt respectively.	Florence is from Bhutan.
contradiction	Frank, Pamela and Fiona are from Thailand, Mexico and Philippines respectively.	Fiona is from Thailand.
contradiction	Karen, Maria and Nick are from Germany, Hungary and Australia respectively.	Nick is from Germany.
contradiction	Walter, Anna and John are from Thailand, North Korea and Bhutan respectively.	John is from Thailand.
contradiction	Martin, Evelyn and Angela are from Israel, Canada and Mexico respectively.	Angela is from Israel.
contradiction	Patricia, Jason and Harriet are from Egypt, Nepal and South Korea respectively.	Harriet is from Egypt.
contradiction	Kim, Francis and Lynn are from Bhutan, Ghana and Azerbaijan respectively.	Lynn is from Bhutan.
contradiction	Karen, Anne and Catherine are from Israel, Ghana and Nepal respectively.	Catherine is from Israel.
contradiction	Barbara, Frank and Jean are from Haiti, Poland and Mexico respectively.	Jean is from Haiti.
contradiction	Edwin, Brian and Patrick are from Japan, Iceland and United States of America respectively.	Patrick is from Japan.
contradiction	Grace, Roger and Steve are from Brazil, France and Taiwan respectively.	Steve is from Brazil.
contradiction	Harry, Laura and Lawrence are from Fiji, India and Haiti respectively.	Lawrence is from Fiji.
contradiction	Julia, Ed and Charlie are from Bhutan, Oman and Colombia respectively.	Charlie is from Bhutan.
contradiction	Martha, Stephanie and Robert are from Thailand, United States of America and India respectively.	Robert is from Thailand.
contradiction	Tony, Betty and Janet are from Greece, Uruguay and Iran respectively.	Janet is from Greece.
contradiction	Alexander, Ray and Dan are from Italy, Belgium and Vietnam respectively.	Dan is from Italy.
contradiction	Tom, Diana and Jessica are from Libya, United Arab Emirates and Maldives respectively.	Jessica is from Libya.
contradiction	Rose, Hugh and Eleanor are from Thailand, Qatar and Fiji respectively.	Eleanor is from Thailand.
contradiction	Jack, Florence and Mike are from Greece, Bhutan and Hungary respectively.	Mike is from Greece.
contradiction	Alice, Edward and Ruth are from Bhutan, Finland and Ukraine respectively.	Ruth is from Bhutan.
contradiction	Matthew, Dan and Florence are from Portugal, Maldives and North Korea respectively.	Florence is from Portugal.
contradiction	Patrick, Judy and Larry are from Austria, Greece and Pakistan respectively.	Larry is from Austria.
contradiction	Judy, Jason and Victoria are from Canada, South Korea and Switzerland respectively.	Victoria is from Canada.
contradiction	Sharon, Bill and Rebecca are from Georgia, Indonesia and South Korea respectively.	Rebecca is from Georgia.
contradiction	Elaine, Donna and Sam are from Germany, Uruguay and Hungary respectively.	Sam is from Germany.
contradiction	Victoria, Roger and Chris are from North Korea, Netherlands and Australia respectively.	Chris is from North Korea.
contradiction	Brian, Jay and Sharon are from Chile, Egypt and Russia respectively.	Sharon is from Chile.
contradiction	Eleanor, Thomas and Marie are from Switzerland, Malaysia and Russia respectively.	Marie is from Switzerland.
contradiction	Grace, Martin and Tom are from France, Japan and Pakistan respectively.	Tom is from France.
contradiction	Harry, Bill and Elaine are from Russia, Azerbaijan and New Zealand respectively.	Elaine is from Russia.
contradiction	Brian, Carolyn and Heather are from Japan, Haiti and Zimbabwe respectively.	Heather is from Japan.
contradiction	Diane, Chris and Jay are from Egypt, Russia and North Korea respectively.	Jay is from Egypt.
contradiction	Sue, Ian and Patrick are from Canada, France and Egypt respectively.	Patrick is from Canada.
contradiction	Annie, Alexander and Francis are from South Korea, Sweden and Brazil respectively.	Francis is from South Korea.
contradiction	Dan, Betty and Rachel are from United Kingdom, Belarus and Belgium respectively.	Rachel is from United Kingdom.
contradiction	Sue, Lucy and Nick are from Bangladesh, Bhutan and Haiti respectively.	Nick is from Bangladesh.
contradiction	Billy, Karen and Suzanne are from Denmark, Singapore and Colombia respectively.	Suzanne is from Denmark.
contradiction	Walter, Christopher and Virginia are from France, Oman and Ukraine respectively.	Virginia is from France.
contradiction	Jessica, Charlotte and Matthew are from Fiji, Libya and North Korea respectively.	Matthew is from Fiji.
contradiction	Ruth, Diane and James are from Greece, Pakistan and Portugal respectively.	James is from Greece.
contradiction	Billy, Joe and Benjamin are from Belgium, Australia and Singapore respectively.	Benjamin is from Belgium.
contradiction	Jean, Rose and Edward are from Zimbabwe, North Korea and Philippines respectively.	Edward is from Zimbabwe.
contradiction	Charles, Kelly and Bobby are from Ecuador, Malaysia and Cuba respectively.	Bobby is from Ecuador.
contradiction	Rose, Sam and Dorothy are from Belarus, Maldives and Malaysia respectively.	Dorothy is from Belarus.
contradiction	Jessica, Samuel and Diana are from Switzerland, Ireland and Pakistan respectively.	Diana is from Switzerland.
contradiction	Frank, Leslie and Sarah are from India, Afghanistan and Belgium respectively.	Sarah is from India.
contradiction	Patrick, Bob and Robert are from Ecuador, France and Iraq respectively.	Robert is from Ecuador.
contradiction	Ed, Matthew and Bobby are from Portugal, Oman and Denmark respectively.	Bobby is from Portugal.
contradiction	Fiona, Dave and Jim are from Finland, Austria and Belarus respectively.	Jim is from Finland.
contradiction	Henry, Alexandra and Janet are from Greece, Finland and Libya respectively.	Janet is from Greece.
contradiction	Florence, Evelyn and Elaine are from Switzerland, Malaysia and Portugal respectively.	Elaine is from Switzerland.
contradiction	Charlotte, William and Christopher are from Brazil, Afghanistan and Finland respectively.	Christopher is from Brazil.
contradiction	Harold, Joan and Katie are from Oman, New Zealand and Austria respectively.	Katie is from Oman.
contradiction	Stephen, Ron and James are from Laos, Hungary and South Korea respectively.	James is from Laos.
contradiction	Ben, Lauren and Nick are from Malaysia, Israel and Ecuador respectively.	Nick is from Malaysia.
contradiction	Simon, Catherine and Michael are from Vietnam, Netherlands and Nepal respectively.	Michael is from Vietnam.
contradiction	Bob, Alexandra and Martin are from South Korea, Iraq and Haiti respectively.	Martin is from South Korea.
contradiction	Cynthia, Louise and Annie are from Switzerland, Germany and Belgium respectively.	Annie is from Switzerland.
contradiction	Bill, Alexandra and Keith are from Hungary, Malaysia and Portugal respectively.	Keith is from Hungary.
contradiction	Diane, Jimmy and Betty are from Haiti, Germany and Saudi Arabia respectively.	Betty is from Haiti.
contradiction	Patrick, Larry and Dick are from United Kingdom, Georgia and Germany respectively.	Dick is from United Kingdom.
contradiction	Florence, Eleanor and Scott are from Belgium, Thailand and Saudi Arabia respectively.	Scott is from Belgium.
contradiction	Patricia, Suzanne and Roger are from North Korea, Chile and United Arab Emirates respectively.	Roger is from North Korea.
contradiction	Tim, Alison and Katherine are from Brazil, Philippines and Fiji respectively.	Katherine is from Brazil.
contradiction	Bruce, Martha and Gary are from Sweden, Italy and Germany respectively.	Gary is from Sweden.
contradiction	Kathleen, Kathryn and Jane are from Vietnam, Malaysia and Qatar respectively.	Jane is from Vietnam.
contradiction	Jason, Philip and Kim are from Israel, Canada and Australia respectively.	Kim is from Israel.
contradiction	Cynthia, Lisa and Sara are from Azerbaijan, Japan and Singapore respectively.	Sara is from Azerbaijan.
contradiction	Jean, Eleanor and Maria are from North Korea, Uruguay and India respectively.	Maria is from North Korea.
contradiction	Jean, Sandra and Patrick are from Taiwan, Oman and Thailand respectively.	Patrick is from Taiwan.
contradiction	Peter, Anthony and Amy are from Iran, Austria and Argentina respectively.	Amy is from Iran.
contradiction	Elizabeth, Ryan and Jim are from Saudi Arabia, Azerbaijan and Vietnam respectively.	Jim is from Saudi Arabia.
contradiction	Barbara, Rose and Joe are from Italy, Finland and Bhutan respectively.	Joe is from Italy.
contradiction	Ashley, Dave and Julia are from France, Australia and Finland respectively.	Julia is from France.
contradiction	Andrea, Benjamin and Emma are from Austria, Nepal and Ireland respectively.	Emma is from Austria.
contradiction	Amy, Charles and Mary are from Pakistan, Chile and United Kingdom respectively.	Mary is from Pakistan.
contradiction	Ann, Melissa and Joan are from Canada, Hungary and Bhutan respectively.	Joan is from Canada.
contradiction	Andrew, George and Claire are from Israel, Taiwan and Colombia respectively.	Claire is from Israel.
contradiction	Steven, Bruce and William are from Azerbaijan, Ireland and Iceland respectively.	William is from Azerbaijan.
contradiction	Sandra, Pamela and Rose are from Denmark, Ecuador and Egypt respectively.	Rose is from Denmark.
contradiction	Helen, Don and Ashley are from North Korea, Ghana and Poland respectively.	Ashley is from North Korea.
contradiction	Lisa, Catherine and Virginia are from Switzerland, Bangladesh and Australia respectively.	Virginia is from Switzerland.
contradiction	Adam, Ken and Julie are from Saudi Arabia, Canada and Bhutan respectively.	Julie is from Saudi Arabia.
contradiction	Christine, Kenneth and Peter are from Israel, Denmark and Philippines respectively.	Peter is from Israel.
contradiction	David, Tom and Betty are from Iraq, Belgium and Malaysia respectively.	Betty is from Iraq.
contradiction	Jack, Deborah and Steven are from Mexico, United States of America and Austria respectively.	Steven is from Mexico.
contradiction	Emma, Rachel and Kenneth are from Mexico, Colombia and Australia respectively.	Kenneth is from Mexico.
contradiction	Ryan, Emma and Edith are from Argentina, Mexico and Denmark respectively.	Edith is from Argentina.
contradiction	Emma, Kevin and Karen are from Ukraine, United Arab Emirates and Pakistan respectively.	Karen is from Ukraine.
contradiction	Lauren, Ken and Heather are from Malaysia, India and France respectively.	Heather is from Malaysia.
contradiction	Louise, Sara and Nick are from Zimbabwe, Denmark and Bhutan respectively.	Nick is from Zimbabwe.
contradiction	Alan, Walter and Jill are from Belarus, Ukraine and Iraq respectively.	Jill is from Belarus.
contradiction	Carl, James and Harry are from Ukraine, France and Nepal respectively.	Harry is from Ukraine.
contradiction	Mike, Ellen and Judy are from Chile, Poland and Germany respectively.	Judy is from Chile.
contradiction	Joe, Karen and Carl are from Australia, Georgia and Libya respectively.	Carl is from Australia.
contradiction	Jeff, Patricia and Alfred are from South Korea, Iceland and Georgia respectively.	Alfred is from South Korea.
contradiction	Larry, Diana and Suzanne are from Taiwan, Indonesia and Afghanistan respectively.	Suzanne is from Taiwan.
