contradiction	Ashley and Steven are from Portugal and Switzerland respectively.	Steven is from Portugal.
contradiction	Claire and Daniel are from Qatar and Ireland respectively.	Daniel is from Qatar.
contradiction	Billy and Nicole are from Austria and Chile respectively.	Nicole is from Austria.
contradiction	Hugh and Lisa are from Greece and Iran respectively.	Lisa is from Greece.
contradiction	Jessica and Donald are from Oman and Azerbaijan respectively.	Donald is from Oman.
contradiction	Nick and Julia are from Turkey and China respectively.	Julia is from Turkey.
contradiction	Kenneth and Charlotte are from India and Iran respectively.	Charlotte is from India.
contradiction	Elizabeth and Francis are from Chile and Belgium respectively.	Francis is from Chile.
contradiction	Julie and Jennifer are from North Korea and Bhutan respectively.	Jennifer is from North Korea.
contradiction	Chris and Matthew are from Malaysia and Qatar respectively.	Matthew is from Malaysia.
contradiction	Ralph and Stephen are from Poland and Turkey respectively.	Stephen is from Poland.
contradiction	Nancy and Ralph are from Afghanistan and Maldives respectively.	Ralph is from Afghanistan.
contradiction	Tony and Brian are from Vietnam and United States of America respectively.	Brian is from Vietnam.
contradiction	Don and Sharon are from Philippines and Poland respectively.	Sharon is from Philippines.
contradiction	Bobby and Jessica are from Maldives and Poland respectively.	Jessica is from Maldives.
contradiction	Cynthia and Roger are from Egypt and Qatar respectively.	Roger is from Egypt.
contradiction	Fred and Howard are from Maldives and Italy respectively.	Howard is from Maldives.
contradiction	Richard and Lucy are from Brazil and Haiti respectively.	Lucy is from Brazil.
contradiction	Charlotte and Caroline are from Fiji and Argentina respectively.	Caroline is from Fiji.
contradiction	Lisa and Jeff are from Israel and United States of America respectively.	Jeff is from Israel.
contradiction	Sarah and Bobby are from Saudi Arabia and Ghana respectively.	Bobby is from Saudi Arabia.
contradiction	Michelle and Suzanne are from Fiji and Turkey respectively.	Suzanne is from Fiji.
contradiction	Hugh and Simon are from Qatar and Iraq respectively.	Simon is from Qatar.
contradiction	Thomas and Ed are from Laos and United Arab Emirates respectively.	Ed is from Laos.
contradiction	Dave and Benjamin are from Iran and Bhutan respectively.	Benjamin is from Iran.
contradiction	Simon and Cynthia are from Russia and Greece respectively.	Cynthia is from Russia.
contradiction	Judith and Sally are from Iraq and Germany respectively.	Sally is from Iraq.
contradiction	Arthur and Alex are from Bangladesh and Australia respectively.	Alex is from Bangladesh.
contradiction	Alfred and Anthony are from Afghanistan and Indonesia respectively.	Anthony is from Afghanistan.
contradiction	Lynn and Kathleen are from Switzerland and Russia respectively.	Kathleen is from Switzerland.
contradiction	Joan and Ian are from North Korea and Sweden respectively.	Ian is from North Korea.
contradiction	Robin and David are from Netherlands and Ukraine respectively.	David is from Netherlands.
contradiction	Stephanie and Rachel are from Belarus and Chile respectively.	Rachel is from Belarus.
contradiction	Alice and Heather are from Japan and Philippines respectively.	Heather is from Japan.
contradiction	Harold and Sarah are from Greece and Libya respectively.	Sarah is from Greece.
contradiction	Anna and Pamela are from Canada and Bhutan respectively.	Pamela is from Canada.
contradiction	Steve and Cynthia are from South Korea and Vietnam respectively.	Cynthia is from South Korea.
contradiction	Sharon and Michelle are from United States of America and China respectively.	Michelle is from United States of America.
contradiction	Mike and Jill are from Turkey and India respectively.	Jill is from Turkey.
contradiction	Charlie and Jason are from Egypt and Belgium respectively.	Jason is from Egypt.
contradiction	Deborah and Frank are from Turkey and Hungary respectively.	Frank is from Turkey.
contradiction	Al and Cynthia are from Zimbabwe and Japan respectively.	Cynthia is from Zimbabwe.
contradiction	Kathleen and Jennifer are from Iraq and Maldives respectively.	Jennifer is from Iraq.
contradiction	Ken and Benjamin are from Oman and Libya respectively.	Benjamin is from Oman.
contradiction	Ken and Katie are from Singapore and Ireland respectively.	Katie is from Singapore.
contradiction	William and Ed are from Canada and Brazil respectively.	Ed is from Canada.
contradiction	Anna and Virginia are from Italy and Belarus respectively.	Virginia is from Italy.
contradiction	Dave and Catherine are from France and Uruguay respectively.	Catherine is from France.
contradiction	Judy and Janet are from Finland and Saudi Arabia respectively.	Janet is from Finland.
contradiction	Ralph and Sue are from Germany and Australia respectively.	Sue is from Germany.
contradiction	Virginia and Marie are from Ecuador and Argentina respectively.	Marie is from Ecuador.
contradiction	Joseph and Dorothy are from Oman and Zimbabwe respectively.	Dorothy is from Oman.
contradiction	Annie and Chris are from Mexico and Greece respectively.	Chris is from Mexico.
contradiction	Robert and Charles are from Nepal and Maldives respectively.	Charles is from Nepal.
contradiction	Jimmy and Stephanie are from Ecuador and Argentina respectively.	Stephanie is from Ecuador.
contradiction	Joe and Alice are from Fiji and Azerbaijan respectively.	Alice is from Fiji.
contradiction	Dan and Simon are from India and Cuba respectively.	Simon is from India.
contradiction	Robert and Rebecca are from China and Cuba respectively.	Rebecca is from China.
contradiction	Betty and Jean are from Cuba and Turkey respectively.	Jean is from Cuba.
contradiction	Patrick and Elizabeth are from Israel and Ecuador respectively.	Elizabeth is from Israel.
contradiction	Harriet and Maria are from Fiji and Germany respectively.	Maria is from Fiji.
contradiction	Judy and Harriet are from Libya and Iran respectively.	Harriet is from Libya.
contradiction	Susan and Roy are from Taiwan and United Kingdom respectively.	Roy is from Taiwan.
contradiction	Mark and Heather are from Qatar and Egypt respectively.	Heather is from Qatar.
contradiction	Betty and Christine are from Ecuador and Afghanistan respectively.	Christine is from Ecuador.
contradiction	Claire and Sara are from Indonesia and Georgia respectively.	Sara is from Indonesia.
contradiction	Sara and Carol are from Colombia and United States of America respectively.	Carol is from Colombia.
contradiction	Michael and Kathleen are from Iraq and Ecuador respectively.	Kathleen is from Iraq.
contradiction	Jack and Ashley are from Italy and Denmark respectively.	Ashley is from Italy.
contradiction	Francis and Larry are from Turkey and North Korea respectively.	Larry is from Turkey.
contradiction	Henry and Dave are from Uruguay and Iraq respectively.	Dave is from Uruguay.
contradiction	Mark and Charlotte are from Laos and Singapore respectively.	Charlotte is from Laos.
contradiction	Michelle and Pamela are from Taiwan and Portugal respectively.	Pamela is from Taiwan.
contradiction	Michael and Anna are from Iceland and New Zealand respectively.	Anna is from Iceland.
contradiction	Fred and Amanda are from Poland and Qatar respectively.	Amanda is from Poland.
contradiction	Rebecca and Fred are from Philippines and Turkey respectively.	Fred is from Philippines.
contradiction	Susan and Kenneth are from Haiti and Malaysia respectively.	Kenneth is from Haiti.
contradiction	Kathryn and Barbara are from Oman and Australia respectively.	Barbara is from Oman.
contradiction	Betty and Lisa are from Belarus and Iceland respectively.	Lisa is from Belarus.
contradiction	Joseph and Steven are from Laos and Germany respectively.	Steven is from Laos.
contradiction	Lucy and Eleanor are from United Arab Emirates and Maldives respectively.	Eleanor is from United Arab Emirates.
contradiction	Jimmy and Lucy are from Taiwan and Austria respectively.	Lucy is from Taiwan.
contradiction	Pamela and John are from United Kingdom and Taiwan respectively.	John is from United Kingdom.
contradiction	Jonathan and Dan are from Hungary and Italy respectively.	Dan is from Hungary.
contradiction	Emily and Eleanor are from France and Ukraine respectively.	Eleanor is from France.
contradiction	Judith and Julie are from Sweden and Pakistan respectively.	Julie is from Sweden.
contradiction	John and Dick are from Oman and France respectively.	Dick is from Oman.
contradiction	Benjamin and Jimmy are from Switzerland and Taiwan respectively.	Jimmy is from Switzerland.
contradiction	Carol and Bobby are from Cuba and Laos respectively.	Bobby is from Cuba.
contradiction	James and Brian are from Malaysia and Colombia respectively.	Brian is from Malaysia.
contradiction	Suzanne and Mary are from Ireland and Georgia respectively.	Mary is from Ireland.
contradiction	Andrew and Ben are from Greece and Singapore respectively.	Ben is from Greece.
contradiction	Lawrence and Francis are from Oman and Portugal respectively.	Francis is from Oman.
contradiction	Matthew and Donald are from Canada and Fiji respectively.	Donald is from Canada.
contradiction	Ed and Samuel are from India and New Zealand respectively.	Samuel is from India.
contradiction	Victoria and Fred are from Sweden and Denmark respectively.	Fred is from Sweden.
contradiction	Howard and Tony are from Maldives and Azerbaijan respectively.	Tony is from Maldives.
contradiction	Bob and Sally are from Denmark and Bhutan respectively.	Sally is from Denmark.
contradiction	Eric and Lucy are from Ecuador and Egypt respectively.	Lucy is from Ecuador.
contradiction	Bobby and Jerry are from Israel and France respectively.	Jerry is from Israel.
contradiction	Kevin and Leslie are from Belarus and Argentina respectively.	Leslie is from Belarus.
contradiction	Alex and Matthew are from Iran and Vietnam respectively.	Matthew is from Iran.
contradiction	Kathryn and Colin are from Russia and North Korea respectively.	Colin is from Russia.
contradiction	Jill and Alfred are from Singapore and Malaysia respectively.	Alfred is from Singapore.
contradiction	Sophie and Greg are from Egypt and France respectively.	Greg is from Egypt.
contradiction	Ryan and Kelly are from Afghanistan and Philippines respectively.	Kelly is from Afghanistan.
contradiction	Deborah and Tony are from Georgia and Austria respectively.	Tony is from Georgia.
contradiction	Lawrence and Francis are from Egypt and Laos respectively.	Francis is from Egypt.
contradiction	Kelly and Kathryn are from Switzerland and Iran respectively.	Kathryn is from Switzerland.
contradiction	Andrew and Ralph are from Fiji and Laos respectively.	Ralph is from Fiji.
contradiction	Mike and Stephanie are from Chile and Philippines respectively.	Stephanie is from Chile.
contradiction	Howard and Donald are from Malaysia and South Korea respectively.	Donald is from Malaysia.
contradiction	Jessica and Wendy are from United States of America and Netherlands respectively.	Wendy is from United States of America.
contradiction	Jessica and Matthew are from Turkey and Zimbabwe respectively.	Matthew is from Turkey.
contradiction	Edward and Scott are from Saudi Arabia and Libya respectively.	Scott is from Saudi Arabia.
contradiction	Keith and Ben are from Laos and Argentina respectively.	Ben is from Laos.
contradiction	Leslie and Richard are from Greece and Germany respectively.	Richard is from Greece.
contradiction	Howard and Kelly are from Denmark and Ireland respectively.	Kelly is from Denmark.
contradiction	Thomas and Walter are from Taiwan and Ireland respectively.	Walter is from Taiwan.
contradiction	Peter and Cynthia are from Pakistan and Australia respectively.	Cynthia is from Pakistan.
contradiction	Robert and Alexandra are from Afghanistan and Mexico respectively.	Alexandra is from Afghanistan.
contradiction	David and Sharon are from Iran and Philippines respectively.	Sharon is from Iran.
contradiction	Judy and Ann are from Denmark and Brazil respectively.	Ann is from Denmark.
contradiction	Charlotte and Steven are from China and Germany respectively.	Steven is from China.
contradiction	Sarah and Virginia are from Malaysia and China respectively.	Virginia is from Malaysia.
contradiction	Pamela and Peter are from Chile and Libya respectively.	Peter is from Chile.
contradiction	Angela and Melissa are from Mexico and Israel respectively.	Melissa is from Mexico.
contradiction	Jane and Marie are from Argentina and Portugal respectively.	Marie is from Argentina.
contradiction	Jeff and Francis are from Canada and Vietnam respectively.	Francis is from Canada.
contradiction	Louis and Jennifer are from Japan and China respectively.	Jennifer is from Japan.
contradiction	Matthew and Peter are from United Arab Emirates and Hungary respectively.	Peter is from United Arab Emirates.
contradiction	Richard and Steven are from Ireland and South Korea respectively.	Steven is from Ireland.
contradiction	Carol and Tony are from Canada and Israel respectively.	Tony is from Canada.
contradiction	Albert and Alfred are from Germany and Ghana respectively.	Alfred is from Germany.
contradiction	Suzanne and Francis are from Pakistan and Portugal respectively.	Francis is from Pakistan.
contradiction	Kathleen and Colin are from Oman and Finland respectively.	Colin is from Oman.
contradiction	Scott and Cynthia are from Afghanistan and Singapore respectively.	Cynthia is from Afghanistan.
contradiction	Barbara and Cynthia are from Malaysia and Georgia respectively.	Cynthia is from Malaysia.
contradiction	Frederick and Sara are from Colombia and Germany respectively.	Sara is from Colombia.
contradiction	Janet and Cynthia are from Laos and Belgium respectively.	Cynthia is from Laos.
contradiction	Benjamin and Kathryn are from Japan and Iran respectively.	Kathryn is from Japan.
contradiction	Robin and Judith are from Ecuador and Switzerland respectively.	Judith is from Ecuador.
contradiction	Alfred and Heather are from France and India respectively.	Heather is from France.
contradiction	Donna and Alexander are from United Kingdom and Mexico respectively.	Alexander is from United Kingdom.
contradiction	Michelle and Pamela are from Ukraine and Fiji respectively.	Pamela is from Ukraine.
contradiction	Kathy and Matthew are from Austria and Colombia respectively.	Matthew is from Austria.
contradiction	Kenneth and Tom are from North Korea and Greece respectively.	Tom is from North Korea.
contradiction	George and Thomas are from Finland and Chile respectively.	Thomas is from Finland.
contradiction	David and Philip are from Iraq and Ghana respectively.	Philip is from Iraq.
contradiction	Don and Andrea are from Finland and Saudi Arabia respectively.	Andrea is from Finland.
contradiction	Julie and Bill are from Iraq and Libya respectively.	Bill is from Iraq.
contradiction	Jane and Ellen are from Belgium and Japan respectively.	Ellen is from Belgium.
contradiction	Fred and Elaine are from Russia and South Korea respectively.	Elaine is from Russia.
contradiction	Amy and Virginia are from France and Sweden respectively.	Virginia is from France.
contradiction	Brian and Carl are from Denmark and Sweden respectively.	Carl is from Denmark.
contradiction	Grace and Angela are from India and Afghanistan respectively.	Angela is from India.
contradiction	Robin and Alfred are from Greece and Haiti respectively.	Alfred is from Greece.
contradiction	Emily and Martin are from Bangladesh and Bhutan respectively.	Martin is from Bangladesh.
contradiction	Louise and Janet are from Poland and Argentina respectively.	Janet is from Poland.
contradiction	Anthony and Bill are from Maldives and Belarus respectively.	Bill is from Maldives.
contradiction	Sue and Robert are from Malaysia and Laos respectively.	Robert is from Malaysia.
contradiction	Bill and Charlie are from Laos and Saudi Arabia respectively.	Charlie is from Laos.
contradiction	Jennifer and Edith are from Indonesia and Turkey respectively.	Edith is from Indonesia.
contradiction	Steven and Elaine are from Germany and Maldives respectively.	Elaine is from Germany.
contradiction	Sharon and Benjamin are from Israel and France respectively.	Benjamin is from Israel.
contradiction	Donna and Edwin are from Pakistan and Philippines respectively.	Edwin is from Pakistan.
contradiction	Sharon and Sally are from Portugal and Georgia respectively.	Sally is from Portugal.
contradiction	William and Marilyn are from Belarus and Switzerland respectively.	Marilyn is from Belarus.
contradiction	Mary and Nicole are from Philippines and Azerbaijan respectively.	Nicole is from Philippines.
contradiction	Joseph and Christopher are from Georgia and Brazil respectively.	Christopher is from Georgia.
contradiction	Lynn and Susan are from Vietnam and Laos respectively.	Susan is from Vietnam.
contradiction	Dick and Barbara are from Bangladesh and Nepal respectively.	Barbara is from Bangladesh.
contradiction	Elizabeth and Susan are from United States of America and Iran respectively.	Susan is from United States of America.
contradiction	Andrew and Andrea are from Philippines and Hungary respectively.	Andrea is from Philippines.
contradiction	Catherine and Melissa are from Belgium and Maldives respectively.	Melissa is from Belgium.
contradiction	Arthur and Ann are from Libya and Finland respectively.	Ann is from Libya.
contradiction	Judy and Pamela are from Philippines and Maldives respectively.	Pamela is from Philippines.
contradiction	Sophie and Louis are from Netherlands and Bangladesh respectively.	Louis is from Netherlands.
contradiction	Frank and Janet are from Italy and Brazil respectively.	Janet is from Italy.
contradiction	Mike and Carolyn are from Mexico and United Arab Emirates respectively.	Carolyn is from Mexico.
contradiction	Pamela and Michael are from United States of America and India respectively.	Michael is from United States of America.
contradiction	Ray and Matthew are from Australia and Switzerland respectively.	Matthew is from Australia.
contradiction	William and Nancy are from Bhutan and Russia respectively.	Nancy is from Bhutan.
contradiction	Ellen and Robin are from Poland and Japan respectively.	Robin is from Poland.
contradiction	Christopher and Al are from Ghana and Ecuador respectively.	Al is from Ghana.
contradiction	Brian and Ian are from Brazil and Philippines respectively.	Ian is from Brazil.
contradiction	Michael and Steven are from Greece and Indonesia respectively.	Steven is from Greece.
contradiction	Steve and Christopher are from Saudi Arabia and Brazil respectively.	Christopher is from Saudi Arabia.
contradiction	Jay and Margaret are from North Korea and Taiwan respectively.	Margaret is from North Korea.
contradiction	Kelly and Louise are from Iceland and Thailand respectively.	Louise is from Iceland.
contradiction	Anthony and Kathryn are from Azerbaijan and Qatar respectively.	Kathryn is from Azerbaijan.
contradiction	Sarah and Gary are from Greece and United States of America respectively.	Gary is from Greece.
contradiction	Patrick and Jim are from Austria and Vietnam respectively.	Jim is from Austria.
contradiction	Alfred and Ben are from Vietnam and Turkey respectively.	Ben is from Vietnam.
contradiction	Lynn and Harriet are from Vietnam and Finland respectively.	Harriet is from Vietnam.
contradiction	Anthony and Bill are from Ukraine and Portugal respectively.	Bill is from Ukraine.
contradiction	Marie and Alice are from North Korea and Germany respectively.	Alice is from North Korea.
contradiction	Simon and Philip are from Vietnam and Taiwan respectively.	Philip is from Vietnam.
contradiction	Greg and Anna are from Malaysia and France respectively.	Anna is from Malaysia.
contradiction	Judy and Jean are from Oman and China respectively.	Jean is from Oman.
contradiction	Joan and Diana are from Mexico and Greece respectively.	Diana is from Mexico.
contradiction	Claire and Nancy are from Denmark and Libya respectively.	Nancy is from Denmark.
contradiction	Alan and Samuel are from Brazil and Malaysia respectively.	Samuel is from Brazil.
contradiction	Jimmy and Kathryn are from South Korea and Austria respectively.	Kathryn is from South Korea.
contradiction	Michelle and Martin are from Laos and Brazil respectively.	Martin is from Laos.
contradiction	Jennifer and Roy are from Chile and Afghanistan respectively.	Roy is from Chile.
contradiction	Tony and Pamela are from Iraq and Qatar respectively.	Pamela is from Iraq.
contradiction	Greg and Carolyn are from Bangladesh and Zimbabwe respectively.	Carolyn is from Bangladesh.
contradiction	Kelly and Francis are from Austria and Indonesia respectively.	Francis is from Austria.
contradiction	Kenneth and Kate are from Brazil and Iraq respectively.	Kate is from Brazil.
contradiction	Ed and Kathryn are from Vietnam and Iceland respectively.	Kathryn is from Vietnam.
contradiction	Donna and Frederick are from Philippines and Libya respectively.	Frederick is from Philippines.
contradiction	Katie and Andrea are from United Kingdom and United Arab Emirates respectively.	Andrea is from United Kingdom.
contradiction	Alfred and Jason are from Ecuador and New Zealand respectively.	Jason is from Ecuador.
contradiction	Jean and Lisa are from Philippines and Germany respectively.	Lisa is from Philippines.
contradiction	Greg and Barbara are from Bhutan and Azerbaijan respectively.	Barbara is from Bhutan.
contradiction	Jane and Sandra are from Hungary and China respectively.	Sandra is from Hungary.
contradiction	Larry and Ray are from New Zealand and Libya respectively.	Ray is from New Zealand.
contradiction	Emma and Claire are from Italy and Ecuador respectively.	Claire is from Italy.
contradiction	Suzanne and Emily are from Maldives and Taiwan respectively.	Emily is from Maldives.
contradiction	Sophie and Sam are from Netherlands and Belgium respectively.	Sam is from Netherlands.
contradiction	Tim and Barbara are from United Kingdom and Netherlands respectively.	Barbara is from United Kingdom.
contradiction	Anthony and Eleanor are from Colombia and France respectively.	Eleanor is from Colombia.
contradiction	Patricia and Harry are from United Kingdom and Laos respectively.	Harry is from United Kingdom.
contradiction	Alan and Donald are from Maldives and Bhutan respectively.	Donald is from Maldives.
contradiction	Bob and Scott are from India and Poland respectively.	Scott is from India.
contradiction	Donald and Larry are from Germany and Cuba respectively.	Larry is from Germany.
contradiction	Nancy and Judith are from Portugal and Italy respectively.	Judith is from Portugal.
contradiction	Jane and Dave are from Egypt and Bangladesh respectively.	Dave is from Egypt.
contradiction	Sandra and Sophie are from Fiji and Netherlands respectively.	Sophie is from Fiji.
contradiction	Maria and Dave are from Iceland and Belgium respectively.	Dave is from Iceland.
contradiction	Ruth and Claire are from Qatar and Denmark respectively.	Claire is from Qatar.
contradiction	Charlotte and Francis are from South Korea and Israel respectively.	Francis is from South Korea.
contradiction	Deborah and Caroline are from Zimbabwe and Thailand respectively.	Caroline is from Zimbabwe.
contradiction	Patrick and Kathryn are from Iraq and Chile respectively.	Kathryn is from Iraq.
contradiction	Jill and Marilyn are from Iraq and India respectively.	Marilyn is from Iraq.
contradiction	Steve and Florence are from Hungary and Libya respectively.	Florence is from Hungary.
contradiction	Virginia and Jason are from Libya and Malaysia respectively.	Jason is from Libya.
contradiction	Ralph and Alan are from Taiwan and Oman respectively.	Alan is from Taiwan.
contradiction	Suzanne and Albert are from Indonesia and Turkey respectively.	Albert is from Indonesia.
contradiction	Arthur and Dan are from Italy and Malaysia respectively.	Dan is from Italy.
contradiction	Lauren and Matt are from Iran and Netherlands respectively.	Matt is from Iran.
contradiction	Peter and Brian are from Mexico and Philippines respectively.	Brian is from Mexico.
contradiction	Roy and Andrea are from Libya and Portugal respectively.	Andrea is from Libya.
contradiction	Charlie and Martha are from Netherlands and Ireland respectively.	Martha is from Netherlands.
contradiction	Dick and Joe are from Finland and Fiji respectively.	Joe is from Finland.
contradiction	Virginia and Frances are from Fiji and Iraq respectively.	Frances is from Fiji.
contradiction	Dan and Mary are from Belarus and Italy respectively.	Mary is from Belarus.
contradiction	Barbara and Michael are from Laos and Uruguay respectively.	Michael is from Laos.
contradiction	Robin and Frances are from Iraq and Sweden respectively.	Frances is from Iraq.
contradiction	Frederick and Judy are from Fiji and Laos respectively.	Judy is from Fiji.
contradiction	Ryan and Donald are from Philippines and Austria respectively.	Donald is from Philippines.
contradiction	Thomas and Leslie are from Turkey and Chile respectively.	Leslie is from Turkey.
contradiction	Julia and Walter are from Ukraine and Iceland respectively.	Walter is from Ukraine.
contradiction	Edward and Anna are from Argentina and Israel respectively.	Anna is from Argentina.
contradiction	Jim and Don are from Iceland and Argentina respectively.	Don is from Iceland.
contradiction	Roy and Suzanne are from Oman and Austria respectively.	Suzanne is from Oman.
contradiction	Jennifer and Jane are from Chile and Colombia respectively.	Jane is from Chile.
contradiction	Tony and Chris are from United Arab Emirates and New Zealand respectively.	Chris is from United Arab Emirates.
contradiction	Lawrence and Johnny are from Russia and Iraq respectively.	Johnny is from Russia.
contradiction	Annie and Sara are from Brazil and Afghanistan respectively.	Sara is from Brazil.
contradiction	Dan and Bruce are from Sweden and United Arab Emirates respectively.	Bruce is from Sweden.
