entailment	Charles is prouder than Lucy.	Charles and Lucy can be compared in terms of how proud they are.
entailment	Henry is cleverer than Kim.	Henry and Kim can be compared in terms of how clever they are.
entailment	Edwin is messier than Johnny.	Edwin and Johnny can be compared in terms of how messy they are.
entailment	Andrew is bossier than Philip.	Andrew and Philip can be compared in terms of how bossy they are.
entailment	Sarah is firmer than Nicole.	Sarah and Nicole can be compared in terms of how firm they are.
entailment	Joan is more tired than Peter.	Joan and Peter can be compared in terms of how tired they are.
entailment	Lauren is fitter than Lawrence.	Lauren and Lawrence can be compared in terms of how fit they are.
entailment	Bob is curvier than Alice.	Bob and Alice can be compared in terms of how curvy they are.
entailment	Donald is smaller than Anna.	Donald and Anna can be compared in terms of how small they are.
entailment	Marie is grosser than Jay.	Marie and Jay can be compared in terms of how gross they are.
entailment	Wendy is tougher than Ron.	Wendy and Ron can be compared in terms of how tough they are.
entailment	Amanda is wiser than Grace.	Amanda and Grace can be compared in terms of how wise they are.
entailment	Jessica is more tired than Katherine.	Jessica and Katherine can be compared in terms of how tired they are.
entailment	Janet is sincerer than Florence.	Janet and Florence can be compared in terms of how sincere they are.
entailment	Samuel is shyer than Greg.	Samuel and Greg can be compared in terms of how shy they are.
entailment	Janet is creepier than John.	Janet and John can be compared in terms of how creepy they are.
entailment	Harry is weaker than Margaret.	Harry and Margaret can be compared in terms of how weak they are.
entailment	Jeff is tougher than Grace.	Jeff and Grace can be compared in terms of how tough they are.
entailment	John is scarier than Joseph.	John and Joseph can be compared in terms of how scary they are.
entailment	Margaret is sadder than Alfred.	Margaret and Alfred can be compared in terms of how sad they are.
entailment	Florence is thinner than Sophie.	Florence and Sophie can be compared in terms of how thin they are.
entailment	Howard is more renowned than Alice.	Howard and Alice can be compared in terms of how renowned they are.
entailment	Marilyn is curvier than Matt.	Marilyn and Matt can be compared in terms of how curvy they are.
entailment	Mike is more clever than Billy.	Mike and Billy can be compared in terms of how clever they are.
entailment	Wendy is lonlier than Edward.	Wendy and Edward can be compared in terms of how lonely they are.
entailment	Edward is poorer than Walter.	Edward and Walter can be compared in terms of how poor they are.
entailment	Joseph is hotter than Dave.	Joseph and Dave can be compared in terms of how hot they are.
entailment	Anna is taller than Ray.	Anna and Ray can be compared in terms of how tall they are.
entailment	Alison is dumber than Jerry.	Alison and Jerry can be compared in terms of how dumb they are.
entailment	Frank is sadder than Emily.	Frank and Emily can be compared in terms of how sad they are.
entailment	Rebecca is younger than Diana.	Rebecca and Diana can be compared in terms of how young they are.
entailment	Rebecca is guilter than Victoria.	Rebecca and Victoria can be compared in terms of how guilty they are.
entailment	Kevin is bigger than Barbara.	Kevin and Barbara can be compared in terms of how big they are.
entailment	Evelyn is noisier than Henry.	Evelyn and Henry can be compared in terms of how noisy they are.
entailment	Kathy is sincerer than Roger.	Kathy and Roger can be compared in terms of how sincere they are.
entailment	Carl is creepier than Don.	Carl and Don can be compared in terms of how creepy they are.
entailment	Frederick is more important than Lynn.	Frederick and Lynn can be compared in terms of how important they are.
entailment	Jack is busier than Greg.	Jack and Greg can be compared in terms of how busy they are.
entailment	Amy is more clever than Marie.	Amy and Marie can be compared in terms of how clever they are.
entailment	Martin is tougher than Andrea.	Martin and Andrea can be compared in terms of how tough they are.
entailment	Jeff is more beautiful than Rachel.	Jeff and Rachel can be compared in terms of how beautiful they are.
entailment	Pamela is calmer than Cynthia.	Pamela and Cynthia can be compared in terms of how calm they are.
entailment	Johnny is angrier than Ralph.	Johnny and Ralph can be compared in terms of how angry they are.
entailment	Marilyn is older than Dan.	Marilyn and Dan can be compared in terms of how old they are.
entailment	Jean is gentler than Roy.	Jean and Roy can be compared in terms of how gentle they are.
entailment	Sam is sillier than Dorothy.	Sam and Dorothy can be compared in terms of how silly they are.
entailment	Evelyn is happier than Kate.	Evelyn and Kate can be compared in terms of how happy they are.
entailment	Elizabeth is sleepier than Tony.	Elizabeth and Tony can be compared in terms of how sleepy they are.
entailment	Judith is more interesting than Jason.	Judith and Jason can be compared in terms of how interesting they are.
entailment	Eric is skinnier than Peter.	Eric and Peter can be compared in terms of how skinny they are.
entailment	Kim is smaller than Larry.	Kim and Larry can be compared in terms of how small they are.
entailment	Lisa is fatter than Jimmy.	Lisa and Jimmy can be compared in terms of how fat they are.
entailment	Eric is more important than Ashley.	Eric and Ashley can be compared in terms of how important they are.
entailment	Arthur is taller than Tony.	Arthur and Tony can be compared in terms of how tall they are.
entailment	James is saltier than Henry.	James and Henry can be compared in terms of how salty they are.
entailment	Jessica is naughtier than Linda.	Jessica and Linda can be compared in terms of how naughty they are.
entailment	Greg is curvier than Margaret.	Greg and Margaret can be compared in terms of how curvy they are.
entailment	Susan is angrier than William.	Susan and William can be compared in terms of how angry they are.
entailment	Michael is more attractive than Lawrence.	Michael and Lawrence can be compared in terms of how attractive they are.
entailment	Katherine is lovelier than Frederick.	Katherine and Frederick can be compared in terms of how lovely they are.
entailment	Lisa is more attractive than Florence.	Lisa and Florence can be compared in terms of how attractive they are.
entailment	Laura is more polite than Kenneth.	Laura and Kenneth can be compared in terms of how polite they are.
entailment	Don is fitter than Andrea.	Don and Andrea can be compared in terms of how fit they are.
entailment	Kenneth is shyer than Cynthia.	Kenneth and Cynthia can be compared in terms of how shy they are.
entailment	Dick is more attractive than Harriet.	Dick and Harriet can be compared in terms of how attractive they are.
entailment	Ann is humbler than Bobby.	Ann and Bobby can be compared in terms of how humble they are.
entailment	Amanda is fitter than Harry.	Amanda and Harry can be compared in terms of how fit they are.
entailment	Katie is bigger than Emma.	Katie and Emma can be compared in terms of how big they are.
entailment	Louis is louder than Fiona.	Louis and Fiona can be compared in terms of how loud they are.
entailment	Judith is fitter than Edward.	Judith and Edward can be compared in terms of how fit they are.
entailment	Rose is skinnier than Ray.	Rose and Ray can be compared in terms of how skinny they are.
entailment	Heather is sincerer than Sharon.	Heather and Sharon can be compared in terms of how sincere they are.
entailment	Adam is slower than Grace.	Adam and Grace can be compared in terms of how slow they are.
entailment	Lawrence is kinder than Sophie.	Lawrence and Sophie can be compared in terms of how kind they are.
entailment	Michael is skinnier than Lucy.	Michael and Lucy can be compared in terms of how skinny they are.
entailment	Maria is poorer than Charles.	Maria and Charles can be compared in terms of how poor they are.
entailment	Donna is older than Anna.	Donna and Anna can be compared in terms of how old they are.
entailment	Helen is bolder than Victoria.	Helen and Victoria can be compared in terms of how bold they are.
entailment	Sophie is hotter than Carl.	Sophie and Carl can be compared in terms of how hot they are.
entailment	Sharon is firmer than Steven.	Sharon and Steven can be compared in terms of how firm they are.
entailment	Joseph is lonlier than Kelly.	Joseph and Kelly can be compared in terms of how lonely they are.
entailment	Alice is friendlier than Harry.	Alice and Harry can be compared in terms of how friendly they are.
entailment	Emily is more clever than Margaret.	Emily and Margaret can be compared in terms of how clever they are.
entailment	Howard is stronger than Rachel.	Howard and Rachel can be compared in terms of how strong they are.
entailment	Mary is funnier than Amy.	Mary and Amy can be compared in terms of how funny they are.
entailment	Samuel is bolder than Eleanor.	Samuel and Eleanor can be compared in terms of how bold they are.
entailment	Rachel is crazier than Anne.	Rachel and Anne can be compared in terms of how crazy they are.
entailment	Alexander is classier than Sophie.	Alexander and Sophie can be compared in terms of how classy they are.
entailment	Robin is humbler than Kathryn.	Robin and Kathryn can be compared in terms of how humble they are.
entailment	Hugh is more clever than Harriet.	Hugh and Harriet can be compared in terms of how clever they are.
entailment	Robert is greedier than Kate.	Robert and Kate can be compared in terms of how greedy they are.
entailment	Jill is fitter than Jason.	Jill and Jason can be compared in terms of how fit they are.
entailment	Walter is bitterer than Adam.	Walter and Adam can be compared in terms of how bitter they are.
entailment	Marie is sadder than Eric.	Marie and Eric can be compared in terms of how sad they are.
entailment	Joseph is more modern than Sally.	Joseph and Sally can be compared in terms of how modern they are.
entailment	Walter is shyer than Dick.	Walter and Dick can be compared in terms of how shy they are.
entailment	Alexandra is quieter than Jessica.	Alexandra and Jessica can be compared in terms of how quiet they are.
entailment	Frederick is weirder than Ashley.	Frederick and Ashley can be compared in terms of how weird they are.
entailment	Brian is angrier than Suzanne.	Brian and Suzanne can be compared in terms of how angry they are.
entailment	Alexandra is noisier than Kathy.	Alexandra and Kathy can be compared in terms of how noisy they are.
entailment	Linda is chubbier than Keith.	Linda and Keith can be compared in terms of how chubby they are.
entailment	Nancy is noisier than Harriet.	Nancy and Harriet can be compared in terms of how noisy they are.
entailment	Ian is saltier than Donald.	Ian and Donald can be compared in terms of how salty they are.
entailment	Carol is clumsier than Roy.	Carol and Roy can be compared in terms of how clumsy they are.
entailment	Donald is poorer than Kevin.	Donald and Kevin can be compared in terms of how poor they are.
entailment	Linda is busier than Walter.	Linda and Walter can be compared in terms of how busy they are.
entailment	Ken is more clever than Johnny.	Ken and Johnny can be compared in terms of how clever they are.
entailment	Ellen is tinier than Fiona.	Ellen and Fiona can be compared in terms of how tiny they are.
entailment	Sandra is cuter than Alexander.	Sandra and Alexander can be compared in terms of how cute they are.
entailment	Samuel is taller than Benjamin.	Samuel and Benjamin can be compared in terms of how tall they are.
entailment	Chris is gloomier than Paul.	Chris and Paul can be compared in terms of how gloomy they are.
entailment	Lisa is braver than Andrew.	Lisa and Andrew can be compared in terms of how brave they are.
entailment	Greg is chubbier than Annie.	Greg and Annie can be compared in terms of how chubby they are.
entailment	Harriet is firmer than Charlie.	Harriet and Charlie can be compared in terms of how firm they are.
entailment	Evelyn is younger than Anthony.	Evelyn and Anthony can be compared in terms of how young they are.
entailment	Suzanne is prouder than Ralph.	Suzanne and Ralph can be compared in terms of how proud they are.
entailment	Daniel is happier than Susan.	Daniel and Susan can be compared in terms of how happy they are.
entailment	Ray is more handsome than Michael.	Ray and Michael can be compared in terms of how handsome they are.
entailment	Dan is ruder than Linda.	Dan and Linda can be compared in terms of how rude they are.
entailment	Edward is nicer than Alice.	Edward and Alice can be compared in terms of how nice they are.
entailment	Margaret is duller than Jim.	Margaret and Jim can be compared in terms of how dull they are.
entailment	Julia is fairer than George.	Julia and George can be compared in terms of how fair they are.
entailment	Jeff is duller than Elaine.	Jeff and Elaine can be compared in terms of how dull they are.
entailment	Andrew is weirder than Lucy.	Andrew and Lucy can be compared in terms of how weird they are.
entailment	Edward is more bitter than Emma.	Edward and Emma can be compared in terms of how bitter they are.
entailment	Jean is greater than Andrea.	Jean and Andrea can be compared in terms of how great they are.
entailment	Rachel is meaner than Johnny.	Rachel and Johnny can be compared in terms of how mean they are.
entailment	Diana is duller than Julie.	Diana and Julie can be compared in terms of how dull they are.
entailment	Patricia is denser than Rose.	Patricia and Rose can be compared in terms of how dense they are.
entailment	Dorothy is curvier than Rose.	Dorothy and Rose can be compared in terms of how curvy they are.
entailment	Sharon is clumsier than Edwin.	Sharon and Edwin can be compared in terms of how clumsy they are.
entailment	Adam is sorrier than Jerry.	Adam and Jerry can be compared in terms of how sorry they are.
entailment	Mike is lazier than Claire.	Mike and Claire can be compared in terms of how lazy they are.
entailment	Daniel is more bitter than Bill.	Daniel and Bill can be compared in terms of how bitter they are.
entailment	Matt is slower than Margaret.	Matt and Margaret can be compared in terms of how slow they are.
entailment	Billy is wealthier than Grace.	Billy and Grace can be compared in terms of how wealthy they are.
entailment	Alexander is sorrier than Alfred.	Alexander and Alfred can be compared in terms of how sorry they are.
entailment	Lauren is funnier than Victoria.	Lauren and Victoria can be compared in terms of how funny they are.
entailment	Charlie is shallower than Charles.	Charlie and Charles can be compared in terms of how shallow they are.
entailment	John is funnier than Dave.	John and Dave can be compared in terms of how funny they are.
entailment	Mark is poorer than Marilyn.	Mark and Marilyn can be compared in terms of how poor they are.
entailment	Claire is scarier than Suzanne.	Claire and Suzanne can be compared in terms of how scary they are.
entailment	Kenneth is weaker than Larry.	Kenneth and Larry can be compared in terms of how weak they are.
entailment	Carol is prouder than Howard.	Carol and Howard can be compared in terms of how proud they are.
entailment	Ralph is more bitter than Richard.	Ralph and Richard can be compared in terms of how bitter they are.
entailment	Jessica is stronger than Alan.	Jessica and Alan can be compared in terms of how strong they are.
entailment	Rebecca is bigger than Harry.	Rebecca and Harry can be compared in terms of how big they are.
entailment	Anthony is more attractive than Bob.	Anthony and Bob can be compared in terms of how attractive they are.
entailment	Michael is tougher than Marilyn.	Michael and Marilyn can be compared in terms of how tough they are.
entailment	Elizabeth is classier than Jay.	Elizabeth and Jay can be compared in terms of how classy they are.
entailment	Julia is bigger than Henry.	Julia and Henry can be compared in terms of how big they are.
entailment	Emily is greedier than Suzanne.	Emily and Suzanne can be compared in terms of how greedy they are.
entailment	Ralph is duller than Matthew.	Ralph and Matthew can be compared in terms of how dull they are.
entailment	Mary is thinner than Carl.	Mary and Carl can be compared in terms of how thin they are.
entailment	Kevin is stronger than Kelly.	Kevin and Kelly can be compared in terms of how strong they are.
entailment	Don is healthier than Grace.	Don and Grace can be compared in terms of how healthy they are.
entailment	Harry is noisier than Sophie.	Harry and Sophie can be compared in terms of how noisy they are.
entailment	Jason is noisier than Louis.	Jason and Louis can be compared in terms of how noisy they are.
entailment	Katie is tinier than Bruce.	Katie and Bruce can be compared in terms of how tiny they are.
entailment	Karen is brighter than Christine.	Karen and Christine can be compared in terms of how bright they are.
entailment	Ray is sweeter than Lisa.	Ray and Lisa can be compared in terms of how sweet they are.
entailment	Don is wealthier than Rachel.	Don and Rachel can be compared in terms of how wealthy they are.
entailment	Pamela is more renowned than Susan.	Pamela and Susan can be compared in terms of how renowned they are.
entailment	Rose is more clever than Bruce.	Rose and Bruce can be compared in terms of how clever they are.
entailment	Ray is bitterer than Alan.	Ray and Alan can be compared in terms of how bitter they are.
entailment	Joan is greater than Martin.	Joan and Martin can be compared in terms of how great they are.
entailment	Frank is crueller than Walter.	Frank and Walter can be compared in terms of how cruel they are.
entailment	Ann is noisier than Diane.	Ann and Diane can be compared in terms of how noisy they are.
entailment	Virginia is curvier than Sue.	Virginia and Sue can be compared in terms of how curvy they are.
entailment	Rebecca is more popular than Fred.	Rebecca and Fred can be compared in terms of how popular they are.
entailment	Ron is crazier than Dick.	Ron and Dick can be compared in terms of how crazy they are.
entailment	Michael is better than Rebecca.	Michael and Rebecca can be compared in terms of how good they are.
entailment	Jerry is duller than Diane.	Jerry and Diane can be compared in terms of how dull they are.
entailment	Don is slower than Harold.	Don and Harold can be compared in terms of how slow they are.
entailment	Ashley is clumsier than Anna.	Ashley and Anna can be compared in terms of how clumsy they are.
entailment	Rose is sadder than Katie.	Rose and Katie can be compared in terms of how sad they are.
entailment	Dick is more important than Cynthia.	Dick and Cynthia can be compared in terms of how important they are.
entailment	Roy is more clever than William.	Roy and William can be compared in terms of how clever they are.
entailment	Carolyn is weaker than Patrick.	Carolyn and Patrick can be compared in terms of how weak they are.
entailment	Dave is saltier than Kate.	Dave and Kate can be compared in terms of how salty they are.
entailment	Rebecca is bitterer than Larry.	Rebecca and Larry can be compared in terms of how bitter they are.
entailment	Sam is wiser than Jonathan.	Sam and Jonathan can be compared in terms of how wise they are.
entailment	Harold is tinier than Katherine.	Harold and Katherine can be compared in terms of how tiny they are.
entailment	Kevin is brighter than Al.	Kevin and Al can be compared in terms of how bright they are.
entailment	Sally is gloomier than Don.	Sally and Don can be compared in terms of how gloomy they are.
entailment	Scott is hotter than Chris.	Scott and Chris can be compared in terms of how hot they are.
entailment	Patricia is cuter than Sally.	Patricia and Sally can be compared in terms of how cute they are.
entailment	Jason is better than Dick.	Jason and Dick can be compared in terms of how good they are.
entailment	Pamela is healthier than Arthur.	Pamela and Arthur can be compared in terms of how healthy they are.
entailment	Ashley is prettier than Don.	Ashley and Don can be compared in terms of how pretty they are.
entailment	Scott is thinner than Amy.	Scott and Amy can be compared in terms of how thin they are.
entailment	Mark is longer than Jason.	Mark and Jason can be compared in terms of how long they are.
entailment	Barbara is fatter than Sara.	Barbara and Sara can be compared in terms of how fat they are.
entailment	George is classier than Nancy.	George and Nancy can be compared in terms of how classy they are.
entailment	Joan is sincerer than Harold.	Joan and Harold can be compared in terms of how sincere they are.
entailment	Dick is sleepier than Emma.	Dick and Emma can be compared in terms of how sleepy they are.
entailment	Rachel is louder than Samuel.	Rachel and Samuel can be compared in terms of how loud they are.
entailment	Joseph is meaner than Keith.	Joseph and Keith can be compared in terms of how mean they are.
entailment	William is greater than Thomas.	William and Thomas can be compared in terms of how great they are.
entailment	Fiona is fitter than Simon.	Fiona and Simon can be compared in terms of how fit they are.
entailment	Jason is more interesting than William.	Jason and William can be compared in terms of how interesting they are.
entailment	Nick is slimmer than Jay.	Nick and Jay can be compared in terms of how slim they are.
entailment	Ray is uglier than Carl.	Ray and Carl can be compared in terms of how ugly they are.
entailment	Sue is better than Jim.	Sue and Jim can be compared in terms of how good they are.
entailment	Florence is meaner than Alex.	Florence and Alex can be compared in terms of how mean they are.
entailment	Anthony is funnier than Donald.	Anthony and Donald can be compared in terms of how funny they are.
entailment	Sally is cleverer than Roy.	Sally and Roy can be compared in terms of how clever they are.
entailment	Kate is more clever than Ann.	Kate and Ann can be compared in terms of how clever they are.
entailment	Charlie is thinner than Nicole.	Charlie and Nicole can be compared in terms of how thin they are.
entailment	Matthew is more bitter than Emma.	Matthew and Emma can be compared in terms of how bitter they are.
entailment	Sam is bolder than Heather.	Sam and Heather can be compared in terms of how bold they are.
entailment	Pamela is grosser than David.	Pamela and David can be compared in terms of how gross they are.
entailment	Florence is younger than Patrick.	Florence and Patrick can be compared in terms of how young they are.
entailment	William is louder than Jay.	William and Jay can be compared in terms of how loud they are.
entailment	Greg is harsher than Ashley.	Greg and Ashley can be compared in terms of how harsh they are.
entailment	Billy is more clever than Maria.	Billy and Maria can be compared in terms of how clever they are.
entailment	Jim is fatter than Emma.	Jim and Emma can be compared in terms of how fat they are.
entailment	Edward is tougher than Alfred.	Edward and Alfred can be compared in terms of how tough they are.
entailment	Donna is prouder than Judith.	Donna and Judith can be compared in terms of how proud they are.
entailment	Sharon is more bitter than Eleanor.	Sharon and Eleanor can be compared in terms of how bitter they are.
entailment	Tony is sadder than Harriet.	Tony and Harriet can be compared in terms of how sad they are.
entailment	Amy is kinder than Frances.	Amy and Frances can be compared in terms of how kind they are.
entailment	Steve is shallower than Linda.	Steve and Linda can be compared in terms of how shallow they are.
entailment	Jimmy is more tired than Thomas.	Jimmy and Thomas can be compared in terms of how tired they are.
entailment	Heather is slimmer than Grace.	Heather and Grace can be compared in terms of how slim they are.
entailment	Albert is shallower than Ellen.	Albert and Ellen can be compared in terms of how shallow they are.
entailment	Philip is denser than Jill.	Philip and Jill can be compared in terms of how dense they are.
entailment	Kelly is harsher than Nancy.	Kelly and Nancy can be compared in terms of how harsh they are.
entailment	Alex is bigger than Al.	Alex and Al can be compared in terms of how big they are.
entailment	Steve is shallower than Catherine.	Steve and Catherine can be compared in terms of how shallow they are.
entailment	Ann is gloomier than Colin.	Ann and Colin can be compared in terms of how gloomy they are.
entailment	Anthony is bossier than Katherine.	Anthony and Katherine can be compared in terms of how bossy they are.
entailment	Peter is more tired than Ed.	Peter and Ed can be compared in terms of how tired they are.
entailment	Frances is dumber than Eric.	Frances and Eric can be compared in terms of how dumb they are.
entailment	Jay is gloomier than Ron.	Jay and Ron can be compared in terms of how gloomy they are.
entailment	Chris is friendlier than Grace.	Chris and Grace can be compared in terms of how friendly they are.
entailment	Frances is skinnier than Michael.	Frances and Michael can be compared in terms of how skinny they are.
entailment	Jim is cleverer than Albert.	Jim and Albert can be compared in terms of how clever they are.
entailment	Grace is cleverer than Judith.	Grace and Judith can be compared in terms of how clever they are.
entailment	Jean is slower than Peter.	Jean and Peter can be compared in terms of how slow they are.
entailment	Christopher is nicer than Melissa.	Christopher and Melissa can be compared in terms of how nice they are.
entailment	Diana is shorter than Dan.	Diana and Dan can be compared in terms of how short they are.
entailment	Dick is more modern than Ken.	Dick and Ken can be compared in terms of how modern they are.
entailment	Billy is greater than Jimmy.	Billy and Jimmy can be compared in terms of how great they are.
