entailment	Andrew is fairer than Martha.	Andrew and Martha can be compared in terms of how fair they are.
entailment	Sandra is duller than Annie.	Sandra and Annie can be compared in terms of how dull they are.
entailment	Margaret is more clever than Dorothy.	Margaret and Dorothy can be compared in terms of how clever they are.
entailment	Suzanne is quieter than Alice.	Suzanne and Alice can be compared in terms of how quiet they are.
entailment	Dorothy is gloomier than Billy.	Dorothy and Billy can be compared in terms of how gloomy they are.
entailment	Donald is lonlier than Sally.	Donald and Sally can be compared in terms of how lonely they are.
entailment	Emma is more tired than Matt.	Emma and Matt can be compared in terms of how tired they are.
entailment	Matt is more handsome than Al.	Matt and Al can be compared in terms of how handsome they are.
entailment	Joe is classier than Robin.	Joe and Robin can be compared in terms of how classy they are.
entailment	Sharon is younger than Lisa.	Sharon and Lisa can be compared in terms of how young they are.
entailment	Caroline is healthier than Diana.	Caroline and Diana can be compared in terms of how healthy they are.
entailment	Al is more clever than Carol.	Al and Carol can be compared in terms of how clever they are.
entailment	Jerry is more beautiful than Keith.	Jerry and Keith can be compared in terms of how beautiful they are.
entailment	Nicole is wiser than Robin.	Nicole and Robin can be compared in terms of how wise they are.
entailment	Marie is fairer than Anna.	Marie and Anna can be compared in terms of how fair they are.
entailment	Ron is meaner than Patrick.	Ron and Patrick can be compared in terms of how mean they are.
entailment	Virginia is more interesting than Dick.	Virginia and Dick can be compared in terms of how interesting they are.
entailment	Christine is greater than Alexander.	Christine and Alexander can be compared in terms of how great they are.
entailment	Peter is brighter than Janet.	Peter and Janet can be compared in terms of how bright they are.
entailment	Mary is fatter than Ann.	Mary and Ann can be compared in terms of how fat they are.
entailment	Joan is busier than Alfred.	Joan and Alfred can be compared in terms of how busy they are.
entailment	Jean is noisier than Jennifer.	Jean and Jennifer can be compared in terms of how noisy they are.
entailment	Sue is happier than Judy.	Sue and Judy can be compared in terms of how happy they are.
entailment	Lucy is more polite than Colin.	Lucy and Colin can be compared in terms of how polite they are.
entailment	Tony is skinnier than Sally.	Tony and Sally can be compared in terms of how skinny they are.
entailment	Ruth is kinder than Katie.	Ruth and Katie can be compared in terms of how kind they are.
entailment	Patricia is firmer than Kathleen.	Patricia and Kathleen can be compared in terms of how firm they are.
entailment	Eleanor is poorer than Ralph.	Eleanor and Ralph can be compared in terms of how poor they are.
entailment	Colin is sweeter than Frank.	Colin and Frank can be compared in terms of how sweet they are.
entailment	Helen is more important than Patrick.	Helen and Patrick can be compared in terms of how important they are.
entailment	Alison is scarier than Evelyn.	Alison and Evelyn can be compared in terms of how scary they are.
entailment	Steven is sharper than Matt.	Steven and Matt can be compared in terms of how sharp they are.
entailment	Judith is curvier than Marie.	Judith and Marie can be compared in terms of how curvy they are.
entailment	Angela is nicer than Jim.	Angela and Jim can be compared in terms of how nice they are.
entailment	Peter is humbler than James.	Peter and James can be compared in terms of how humble they are.
entailment	Jean is bitterer than Scott.	Jean and Scott can be compared in terms of how bitter they are.
entailment	Cynthia is noisier than Charlotte.	Cynthia and Charlotte can be compared in terms of how noisy they are.
entailment	James is shallower than Sue.	James and Sue can be compared in terms of how shallow they are.
entailment	Louis is lonlier than Matthew.	Louis and Matthew can be compared in terms of how lonely they are.
entailment	Dick is nicer than Brian.	Dick and Brian can be compared in terms of how nice they are.
entailment	Nicole is more attractive than Pamela.	Nicole and Pamela can be compared in terms of how attractive they are.
entailment	Jonathan is skinnier than Adam.	Jonathan and Adam can be compared in terms of how skinny they are.
entailment	Julia is slimmer than Jane.	Julia and Jane can be compared in terms of how slim they are.
entailment	Matthew is weaker than Elizabeth.	Matthew and Elizabeth can be compared in terms of how weak they are.
entailment	Kenneth is harsher than Lucy.	Kenneth and Lucy can be compared in terms of how harsh they are.
entailment	Roger is braver than Patrick.	Roger and Patrick can be compared in terms of how brave they are.
entailment	Christopher is sweeter than Stephen.	Christopher and Stephen can be compared in terms of how sweet they are.
entailment	Angela is nicer than Edith.	Angela and Edith can be compared in terms of how nice they are.
entailment	Patrick is prettier than Jim.	Patrick and Jim can be compared in terms of how pretty they are.
entailment	Barbara is quieter than Roy.	Barbara and Roy can be compared in terms of how quiet they are.
entailment	Rose is ruder than Charlie.	Rose and Charlie can be compared in terms of how rude they are.
entailment	Lucy is friendlier than Jane.	Lucy and Jane can be compared in terms of how friendly they are.
entailment	Jonathan is greater than Rose.	Jonathan and Rose can be compared in terms of how great they are.
entailment	Angela is fatter than Harriet.	Angela and Harriet can be compared in terms of how fat they are.
entailment	Nicole is braver than Carolyn.	Nicole and Carolyn can be compared in terms of how brave they are.
entailment	Kim is uglier than Kathleen.	Kim and Kathleen can be compared in terms of how ugly they are.
entailment	Mary is wiser than Bill.	Mary and Bill can be compared in terms of how wise they are.
entailment	Samuel is sharper than Harold.	Samuel and Harold can be compared in terms of how sharp they are.
entailment	Anne is humbler than Jerry.	Anne and Jerry can be compared in terms of how humble they are.
entailment	Nancy is creepier than Christine.	Nancy and Christine can be compared in terms of how creepy they are.
entailment	Jimmy is harsher than Ken.	Jimmy and Ken can be compared in terms of how harsh they are.
entailment	Jack is more handsome than Ian.	Jack and Ian can be compared in terms of how handsome they are.
entailment	Bob is sleepier than Steve.	Bob and Steve can be compared in terms of how sleepy they are.
entailment	Ruth is more bitter than Matt.	Ruth and Matt can be compared in terms of how bitter they are.
entailment	Tony is hungrier than Kathryn.	Tony and Kathryn can be compared in terms of how hungry they are.
entailment	David is more clever than Tony.	David and Tony can be compared in terms of how clever they are.
entailment	Jessica is smarter than Heather.	Jessica and Heather can be compared in terms of how smart they are.
entailment	Steve is kinder than Joan.	Steve and Joan can be compared in terms of how kind they are.
entailment	Jessica is crazier than Nick.	Jessica and Nick can be compared in terms of how crazy they are.
entailment	Frances is grosser than Simon.	Frances and Simon can be compared in terms of how gross they are.
entailment	Roy is tougher than Lauren.	Roy and Lauren can be compared in terms of how tough they are.
entailment	Linda is chubbier than Sophie.	Linda and Sophie can be compared in terms of how chubby they are.
entailment	Jimmy is bolder than Colin.	Jimmy and Colin can be compared in terms of how bold they are.
entailment	Simon is wiser than Eric.	Simon and Eric can be compared in terms of how wise they are.
entailment	Philip is weaker than Thomas.	Philip and Thomas can be compared in terms of how weak they are.
entailment	Katherine is firmer than Betty.	Katherine and Betty can be compared in terms of how firm they are.
entailment	Claire is cleverer than Carolyn.	Claire and Carolyn can be compared in terms of how clever they are.
entailment	Alfred is fatter than Samuel.	Alfred and Samuel can be compared in terms of how fat they are.
entailment	Jane is more beautiful than Daniel.	Jane and Daniel can be compared in terms of how beautiful they are.
entailment	Michael is younger than Elizabeth.	Michael and Elizabeth can be compared in terms of how young they are.
entailment	Alexander is lonlier than Carolyn.	Alexander and Carolyn can be compared in terms of how lonely they are.
entailment	Andrew is prouder than Joan.	Andrew and Joan can be compared in terms of how proud they are.
entailment	Simon is lonlier than Marilyn.	Simon and Marilyn can be compared in terms of how lonely they are.
entailment	Sharon is hotter than Rebecca.	Sharon and Rebecca can be compared in terms of how hot they are.
entailment	Jane is sincerer than Jim.	Jane and Jim can be compared in terms of how sincere they are.
entailment	Lauren is more modern than Janet.	Lauren and Janet can be compared in terms of how modern they are.
entailment	Grace is grosser than Alfred.	Grace and Alfred can be compared in terms of how gross they are.
entailment	Christopher is friendlier than Jason.	Christopher and Jason can be compared in terms of how friendly they are.
entailment	Alexander is weirder than Lucy.	Alexander and Lucy can be compared in terms of how weird they are.
entailment	Bruce is dumber than Maria.	Bruce and Maria can be compared in terms of how dumb they are.
entailment	Bill is curvier than Amanda.	Bill and Amanda can be compared in terms of how curvy they are.
entailment	Judy is more bitter than Florence.	Judy and Florence can be compared in terms of how bitter they are.
entailment	Kelly is more attractive than Laura.	Kelly and Laura can be compared in terms of how attractive they are.
entailment	Patricia is smaller than Ed.	Patricia and Ed can be compared in terms of how small they are.
entailment	Rachel is bitterer than Heather.	Rachel and Heather can be compared in terms of how bitter they are.
entailment	Edward is lonlier than Sally.	Edward and Sally can be compared in terms of how lonely they are.
entailment	Alexander is chubbier than Ed.	Alexander and Ed can be compared in terms of how chubby they are.
entailment	Frederick is taller than Angela.	Frederick and Angela can be compared in terms of how tall they are.
entailment	Matt is curvier than Sophie.	Matt and Sophie can be compared in terms of how curvy they are.
entailment	Tony is prettier than Steve.	Tony and Steve can be compared in terms of how pretty they are.
entailment	Anthony is messier than Emily.	Anthony and Emily can be compared in terms of how messy they are.
entailment	Mike is more polite than Bill.	Mike and Bill can be compared in terms of how polite they are.
entailment	Roger is meaner than Jeff.	Roger and Jeff can be compared in terms of how mean they are.
entailment	Caroline is richer than Simon.	Caroline and Simon can be compared in terms of how rich they are.
entailment	Richard is wiser than Emily.	Richard and Emily can be compared in terms of how wise they are.
entailment	Bob is more popular than Brian.	Bob and Brian can be compared in terms of how popular they are.
entailment	Mark is wealthier than Julia.	Mark and Julia can be compared in terms of how wealthy they are.
entailment	Ruth is slimmer than Tom.	Ruth and Tom can be compared in terms of how slim they are.
entailment	Mike is sorrier than Matt.	Mike and Matt can be compared in terms of how sorry they are.
entailment	Annie is slimmer than Howard.	Annie and Howard can be compared in terms of how slim they are.
entailment	Katherine is gentler than Deborah.	Katherine and Deborah can be compared in terms of how gentle they are.
entailment	Lucy is sharper than Ann.	Lucy and Ann can be compared in terms of how sharp they are.
entailment	Roy is harsher than Nicole.	Roy and Nicole can be compared in terms of how harsh they are.
entailment	Emily is more polite than Andrew.	Emily and Andrew can be compared in terms of how polite they are.
entailment	Alison is lonlier than Andrew.	Alison and Andrew can be compared in terms of how lonely they are.
entailment	Sharon is friendlier than Larry.	Sharon and Larry can be compared in terms of how friendly they are.
entailment	Wendy is faster than Jessica.	Wendy and Jessica can be compared in terms of how fast they are.
entailment	Ryan is happier than Betty.	Ryan and Betty can be compared in terms of how happy they are.
entailment	Jack is clumsier than Rose.	Jack and Rose can be compared in terms of how clumsy they are.
entailment	Dorothy is quieter than Kate.	Dorothy and Kate can be compared in terms of how quiet they are.
entailment	Billy is weirder than Colin.	Billy and Colin can be compared in terms of how weird they are.
entailment	Patrick is more popular than Susan.	Patrick and Susan can be compared in terms of how popular they are.
entailment	Kevin is more modern than Jill.	Kevin and Jill can be compared in terms of how modern they are.
entailment	Howard is prouder than Victoria.	Howard and Victoria can be compared in terms of how proud they are.
entailment	Judy is crazier than Kate.	Judy and Kate can be compared in terms of how crazy they are.
entailment	Michelle is tougher than Carol.	Michelle and Carol can be compared in terms of how tough they are.
entailment	Virginia is shyer than Thomas.	Virginia and Thomas can be compared in terms of how shy they are.
entailment	Jean is greater than Harry.	Jean and Harry can be compared in terms of how great they are.
entailment	Jeff is sleepier than Sally.	Jeff and Sally can be compared in terms of how sleepy they are.
entailment	Robin is more popular than Grace.	Robin and Grace can be compared in terms of how popular they are.
entailment	Jason is noisier than Thomas.	Jason and Thomas can be compared in terms of how noisy they are.
entailment	Peter is naughtier than Tim.	Peter and Tim can be compared in terms of how naughty they are.
entailment	Lucy is lovelier than Jay.	Lucy and Jay can be compared in terms of how lovely they are.
entailment	Ben is skinnier than Benjamin.	Ben and Benjamin can be compared in terms of how skinny they are.
entailment	Rebecca is gloomier than Marie.	Rebecca and Marie can be compared in terms of how gloomy they are.
entailment	Keith is crueller than Edith.	Keith and Edith can be compared in terms of how cruel they are.
entailment	Alexandra is more attractive than Bobby.	Alexandra and Bobby can be compared in terms of how attractive they are.
entailment	Julia is greedier than Ken.	Julia and Ken can be compared in terms of how greedy they are.
entailment	Elaine is politer than Roger.	Elaine and Roger can be compared in terms of how polite they are.
entailment	Benjamin is fairer than Marie.	Benjamin and Marie can be compared in terms of how fair they are.
entailment	Don is louder than Brian.	Don and Brian can be compared in terms of how loud they are.
entailment	Simon is shorter than Nancy.	Simon and Nancy can be compared in terms of how short they are.
entailment	Tony is younger than Gary.	Tony and Gary can be compared in terms of how young they are.
entailment	Stephen is prouder than Ray.	Stephen and Ray can be compared in terms of how proud they are.
entailment	Andrea is calmer than Virginia.	Andrea and Virginia can be compared in terms of how calm they are.
entailment	Rachel is wiser than Amanda.	Rachel and Amanda can be compared in terms of how wise they are.
entailment	Anna is friendlier than Edith.	Anna and Edith can be compared in terms of how friendly they are.
entailment	Steve is meaner than Keith.	Steve and Keith can be compared in terms of how mean they are.
entailment	Sharon is slimmer than Patricia.	Sharon and Patricia can be compared in terms of how slim they are.
entailment	Janet is cleverer than Matt.	Janet and Matt can be compared in terms of how clever they are.
entailment	Janet is thinner than Linda.	Janet and Linda can be compared in terms of how thin they are.
entailment	Alex is messier than Fiona.	Alex and Fiona can be compared in terms of how messy they are.
entailment	Virginia is denser than Paul.	Virginia and Paul can be compared in terms of how dense they are.
entailment	Virginia is gloomier than Francis.	Virginia and Francis can be compared in terms of how gloomy they are.
entailment	Anne is more clever than Laura.	Anne and Laura can be compared in terms of how clever they are.
entailment	Dave is taller than Carol.	Dave and Carol can be compared in terms of how tall they are.
entailment	Peter is tinier than Eleanor.	Peter and Eleanor can be compared in terms of how tiny they are.
entailment	Mike is longer than Jean.	Mike and Jean can be compared in terms of how long they are.
entailment	Kelly is more clever than Bobby.	Kelly and Bobby can be compared in terms of how clever they are.
entailment	Karen is classier than John.	Karen and John can be compared in terms of how classy they are.
entailment	Jean is crazier than Alison.	Jean and Alison can be compared in terms of how crazy they are.
entailment	Lucy is slimmer than Nicole.	Lucy and Nicole can be compared in terms of how slim they are.
entailment	Mary is more beautiful than Alex.	Mary and Alex can be compared in terms of how beautiful they are.
entailment	Matthew is messier than Ruth.	Matthew and Ruth can be compared in terms of how messy they are.
entailment	Edith is funnier than Angela.	Edith and Angela can be compared in terms of how funny they are.
entailment	Harold is busier than Cynthia.	Harold and Cynthia can be compared in terms of how busy they are.
entailment	Mike is more important than Jean.	Mike and Jean can be compared in terms of how important they are.
entailment	Sophie is more important than Jay.	Sophie and Jay can be compared in terms of how important they are.
entailment	Colin is crazier than Anne.	Colin and Anne can be compared in terms of how crazy they are.
entailment	Mark is more beautiful than Larry.	Mark and Larry can be compared in terms of how beautiful they are.
entailment	Linda is richer than Ruth.	Linda and Ruth can be compared in terms of how rich they are.
entailment	Martha is clumsier than Jean.	Martha and Jean can be compared in terms of how clumsy they are.
entailment	Daniel is brighter than Alison.	Daniel and Alison can be compared in terms of how bright they are.
entailment	Kate is more tired than Judy.	Kate and Judy can be compared in terms of how tired they are.
entailment	Kenneth is bolder than Paul.	Kenneth and Paul can be compared in terms of how bold they are.
entailment	Mike is shorter than Virginia.	Mike and Virginia can be compared in terms of how short they are.
entailment	Scott is dumber than Lisa.	Scott and Lisa can be compared in terms of how dumb they are.
entailment	Sarah is sharper than Stephen.	Sarah and Stephen can be compared in terms of how sharp they are.
entailment	Florence is more bitter than Benjamin.	Florence and Benjamin can be compared in terms of how bitter they are.
entailment	Sara is sweeter than Nick.	Sara and Nick can be compared in terms of how sweet they are.
entailment	Heather is bigger than Kathleen.	Heather and Kathleen can be compared in terms of how big they are.
entailment	Stephanie is crazier than Mary.	Stephanie and Mary can be compared in terms of how crazy they are.
entailment	George is cleverer than Betty.	George and Betty can be compared in terms of how clever they are.
entailment	Mary is bossier than Al.	Mary and Al can be compared in terms of how bossy they are.
entailment	Al is tougher than Joseph.	Al and Joseph can be compared in terms of how tough they are.
entailment	Bruce is creepier than Annie.	Bruce and Annie can be compared in terms of how creepy they are.
entailment	Jane is healthier than Amanda.	Jane and Amanda can be compared in terms of how healthy they are.
entailment	Ann is busier than Scott.	Ann and Scott can be compared in terms of how busy they are.
entailment	Daniel is bolder than Harold.	Daniel and Harold can be compared in terms of how bold they are.
entailment	Sharon is worse than Lisa.	Sharon and Lisa can be compared in terms of how bad they are.
entailment	Thomas is meaner than Jay.	Thomas and Jay can be compared in terms of how mean they are.
entailment	Nick is busier than Kevin.	Nick and Kevin can be compared in terms of how busy they are.
entailment	Judy is more beautiful than Roy.	Judy and Roy can be compared in terms of how beautiful they are.
entailment	Sophie is happier than Jay.	Sophie and Jay can be compared in terms of how happy they are.
entailment	Jean is wealthier than Christopher.	Jean and Christopher can be compared in terms of how wealthy they are.
entailment	Jonathan is braver than Evelyn.	Jonathan and Evelyn can be compared in terms of how brave they are.
entailment	Dan is richer than Kenneth.	Dan and Kenneth can be compared in terms of how rich they are.
entailment	Roger is more renowned than Don.	Roger and Don can be compared in terms of how renowned they are.
entailment	Joe is more popular than Richard.	Joe and Richard can be compared in terms of how popular they are.
entailment	Frederick is classier than Emily.	Frederick and Emily can be compared in terms of how classy they are.
entailment	Ken is taller than Martha.	Ken and Martha can be compared in terms of how tall they are.
entailment	Frank is calmer than Keith.	Frank and Keith can be compared in terms of how calm they are.
entailment	Jerry is more handsome than Elizabeth.	Jerry and Elizabeth can be compared in terms of how handsome they are.
entailment	Ryan is uglier than Keith.	Ryan and Keith can be compared in terms of how ugly they are.
entailment	Elizabeth is older than Caroline.	Elizabeth and Caroline can be compared in terms of how old they are.
entailment	Nicole is messier than Roy.	Nicole and Roy can be compared in terms of how messy they are.
entailment	Robin is healthier than Barbara.	Robin and Barbara can be compared in terms of how healthy they are.
entailment	Eleanor is poorer than Harry.	Eleanor and Harry can be compared in terms of how poor they are.
entailment	Cynthia is hotter than Arthur.	Cynthia and Arthur can be compared in terms of how hot they are.
entailment	Ken is tougher than Henry.	Ken and Henry can be compared in terms of how tough they are.
entailment	Elaine is creepier than Nancy.	Elaine and Nancy can be compared in terms of how creepy they are.
entailment	Jimmy is sleepier than Edwin.	Jimmy and Edwin can be compared in terms of how sleepy they are.
entailment	Sue is better than Judith.	Sue and Judith can be compared in terms of how good they are.
entailment	Jessica is bolder than Ann.	Jessica and Ann can be compared in terms of how bold they are.
entailment	Johnny is wealthier than Sophie.	Johnny and Sophie can be compared in terms of how wealthy they are.
entailment	Eleanor is lovelier than Benjamin.	Eleanor and Benjamin can be compared in terms of how lovely they are.
entailment	Heather is sweeter than Roy.	Heather and Roy can be compared in terms of how sweet they are.
entailment	Steven is firmer than Jason.	Steven and Jason can be compared in terms of how firm they are.
entailment	Bobby is bigger than Henry.	Bobby and Henry can be compared in terms of how big they are.
entailment	Jonathan is weaker than Victoria.	Jonathan and Victoria can be compared in terms of how weak they are.
entailment	Alison is gentler than Ralph.	Alison and Ralph can be compared in terms of how gentle they are.
entailment	Kim is wiser than Matt.	Kim and Matt can be compared in terms of how wise they are.
entailment	Jessica is prouder than Greg.	Jessica and Greg can be compared in terms of how proud they are.
entailment	Carol is tougher than Andrea.	Carol and Andrea can be compared in terms of how tough they are.
entailment	Evelyn is noisier than Sandra.	Evelyn and Sandra can be compared in terms of how noisy they are.
entailment	Rose is meaner than Charlotte.	Rose and Charlotte can be compared in terms of how mean they are.
entailment	Dave is more tired than Linda.	Dave and Linda can be compared in terms of how tired they are.
entailment	Nicole is more beautiful than Sam.	Nicole and Sam can be compared in terms of how beautiful they are.
entailment	Jennifer is slower than Francis.	Jennifer and Francis can be compared in terms of how slow they are.
entailment	Susan is more bitter than Rose.	Susan and Rose can be compared in terms of how bitter they are.
entailment	Bobby is fitter than Katherine.	Bobby and Katherine can be compared in terms of how fit they are.
entailment	Rebecca is guilter than Emily.	Rebecca and Emily can be compared in terms of how guilty they are.
entailment	Ray is bossier than Anthony.	Ray and Anthony can be compared in terms of how bossy they are.
entailment	Louise is greater than Steve.	Louise and Steve can be compared in terms of how great they are.
entailment	Florence is hairier than Christopher.	Florence and Christopher can be compared in terms of how hairy they are.
entailment	Samuel is sweeter than Larry.	Samuel and Larry can be compared in terms of how sweet they are.
entailment	Pamela is crazier than Thomas.	Pamela and Thomas can be compared in terms of how crazy they are.
entailment	Sue is firmer than Grace.	Sue and Grace can be compared in terms of how firm they are.
entailment	Paul is richer than Carl.	Paul and Carl can be compared in terms of how rich they are.
entailment	Patrick is weirder than Charles.	Patrick and Charles can be compared in terms of how weird they are.
entailment	Joe is older than Sue.	Joe and Sue can be compared in terms of how old they are.
entailment	Carolyn is smarter than Caroline.	Carolyn and Caroline can be compared in terms of how smart they are.
entailment	Ian is denser than Caroline.	Ian and Caroline can be compared in terms of how dense they are.
