entailment	Walter is fatter than Sandra.	Walter and Sandra can be compared in terms of how fat they are.
entailment	Jean is fatter than Ruth.	Jean and Ruth can be compared in terms of how fat they are.
entailment	Howard is chubbier than Donna.	Howard and Donna can be compared in terms of how chubby they are.
entailment	Emily is cuter than Ruth.	Emily and Ruth can be compared in terms of how cute they are.
entailment	Bill is older than Evelyn.	Bill and Evelyn can be compared in terms of how old they are.
entailment	Kelly is stronger than Alice.	Kelly and Alice can be compared in terms of how strong they are.
entailment	Harriet is harsher than Pamela.	Harriet and Pamela can be compared in terms of how harsh they are.
entailment	Alexandra is wiser than Gary.	Alexandra and Gary can be compared in terms of how wise they are.
entailment	Daniel is skinnier than Ruth.	Daniel and Ruth can be compared in terms of how skinny they are.
entailment	Thomas is thinner than Matthew.	Thomas and Matthew can be compared in terms of how thin they are.
entailment	Johnny is slower than Deborah.	Johnny and Deborah can be compared in terms of how slow they are.
entailment	Jessica is longer than Marie.	Jessica and Marie can be compared in terms of how long they are.
entailment	Scott is poorer than Anne.	Scott and Anne can be compared in terms of how poor they are.
entailment	Eric is thinner than Keith.	Eric and Keith can be compared in terms of how thin they are.
entailment	Sophie is more attractive than Diana.	Sophie and Diana can be compared in terms of how attractive they are.
entailment	Sophie is crueller than Joe.	Sophie and Joe can be compared in terms of how cruel they are.
entailment	Richard is slower than Steve.	Richard and Steve can be compared in terms of how slow they are.
entailment	Jay is dumber than Emma.	Jay and Emma can be compared in terms of how dumb they are.
entailment	Larry is slower than Heather.	Larry and Heather can be compared in terms of how slow they are.
entailment	Susan is humbler than Sharon.	Susan and Sharon can be compared in terms of how humble they are.
entailment	Mike is worse than Kelly.	Mike and Kelly can be compared in terms of how bad they are.
entailment	Annie is chubbier than Amanda.	Annie and Amanda can be compared in terms of how chubby they are.
entailment	Lynn is tougher than Samuel.	Lynn and Samuel can be compared in terms of how tough they are.
entailment	Annie is humbler than Michael.	Annie and Michael can be compared in terms of how humble they are.
entailment	Victoria is braver than William.	Victoria and William can be compared in terms of how brave they are.
entailment	Alice is more interesting than Sam.	Alice and Sam can be compared in terms of how interesting they are.
entailment	Katie is prettier than Bob.	Katie and Bob can be compared in terms of how pretty they are.
entailment	Sharon is politer than Carol.	Sharon and Carol can be compared in terms of how polite they are.
entailment	Eric is politer than Alan.	Eric and Alan can be compared in terms of how polite they are.
entailment	Lynn is smaller than Julia.	Lynn and Julia can be compared in terms of how small they are.
entailment	Alfred is cleverer than Annie.	Alfred and Annie can be compared in terms of how clever they are.
entailment	Jason is bossier than Robert.	Jason and Robert can be compared in terms of how bossy they are.
entailment	Caroline is more handsome than Tim.	Caroline and Tim can be compared in terms of how handsome they are.
entailment	Kenneth is stronger than Steven.	Kenneth and Steven can be compared in terms of how strong they are.
entailment	Barbara is hotter than Lynn.	Barbara and Lynn can be compared in terms of how hot they are.
entailment	Alan is politer than Angela.	Alan and Angela can be compared in terms of how polite they are.
entailment	Ralph is more handsome than Ryan.	Ralph and Ryan can be compared in terms of how handsome they are.
entailment	Ryan is fatter than Carl.	Ryan and Carl can be compared in terms of how fat they are.
entailment	Judith is better than Rebecca.	Judith and Rebecca can be compared in terms of how good they are.
entailment	Dave is more handsome than Rebecca.	Dave and Rebecca can be compared in terms of how handsome they are.
entailment	Claire is classier than Nancy.	Claire and Nancy can be compared in terms of how classy they are.
entailment	Brian is younger than Jean.	Brian and Jean can be compared in terms of how young they are.
entailment	Tom is grosser than Barbara.	Tom and Barbara can be compared in terms of how gross they are.
entailment	Christopher is fitter than Amy.	Christopher and Amy can be compared in terms of how fit they are.
entailment	Elizabeth is older than Patrick.	Elizabeth and Patrick can be compared in terms of how old they are.
entailment	Johnny is humbler than Alison.	Johnny and Alison can be compared in terms of how humble they are.
entailment	Tony is bitterer than Johnny.	Tony and Johnny can be compared in terms of how bitter they are.
entailment	Stephen is sharper than Ian.	Stephen and Ian can be compared in terms of how sharp they are.
entailment	Nicole is quieter than Joe.	Nicole and Joe can be compared in terms of how quiet they are.
entailment	Caroline is lonlier than Edith.	Caroline and Edith can be compared in terms of how lonely they are.
entailment	Linda is clumsier than Harold.	Linda and Harold can be compared in terms of how clumsy they are.
entailment	Walter is sharper than Greg.	Walter and Greg can be compared in terms of how sharp they are.
entailment	Larry is more popular than Bobby.	Larry and Bobby can be compared in terms of how popular they are.
entailment	Carolyn is more handsome than Kathleen.	Carolyn and Kathleen can be compared in terms of how handsome they are.
entailment	Christopher is sweeter than Thomas.	Christopher and Thomas can be compared in terms of how sweet they are.
entailment	Linda is lonlier than Mike.	Linda and Mike can be compared in terms of how lonely they are.
entailment	Rose is more handsome than Kim.	Rose and Kim can be compared in terms of how handsome they are.
entailment	Arthur is bitterer than William.	Arthur and William can be compared in terms of how bitter they are.
entailment	Jonathan is busier than Angela.	Jonathan and Angela can be compared in terms of how busy they are.
entailment	Steven is more attractive than Caroline.	Steven and Caroline can be compared in terms of how attractive they are.
entailment	Stephanie is happier than Jennifer.	Stephanie and Jennifer can be compared in terms of how happy they are.
entailment	Ron is worse than Helen.	Ron and Helen can be compared in terms of how bad they are.
entailment	Lawrence is meaner than Edward.	Lawrence and Edward can be compared in terms of how mean they are.
entailment	Charlotte is weaker than Joan.	Charlotte and Joan can be compared in terms of how weak they are.
entailment	Tim is uglier than Rebecca.	Tim and Rebecca can be compared in terms of how ugly they are.
entailment	Simon is sorrier than Janet.	Simon and Janet can be compared in terms of how sorry they are.
entailment	Kathy is cleverer than Eleanor.	Kathy and Eleanor can be compared in terms of how clever they are.
entailment	Howard is sharper than Albert.	Howard and Albert can be compared in terms of how sharp they are.
entailment	Bill is curvier than Sally.	Bill and Sally can be compared in terms of how curvy they are.
entailment	Virginia is older than Sharon.	Virginia and Sharon can be compared in terms of how old they are.
entailment	Tony is weirder than Anthony.	Tony and Anthony can be compared in terms of how weird they are.
entailment	Paul is hotter than Fred.	Paul and Fred can be compared in terms of how hot they are.
entailment	Heather is more clever than Elaine.	Heather and Elaine can be compared in terms of how clever they are.
entailment	Ann is brighter than Ray.	Ann and Ray can be compared in terms of how bright they are.
entailment	Matthew is denser than Ellen.	Matthew and Ellen can be compared in terms of how dense they are.
entailment	Francis is happier than Caroline.	Francis and Caroline can be compared in terms of how happy they are.
entailment	Patricia is prettier than John.	Patricia and John can be compared in terms of how pretty they are.
entailment	Lawrence is bossier than Andrew.	Lawrence and Andrew can be compared in terms of how bossy they are.
entailment	Judith is ruder than Donna.	Judith and Donna can be compared in terms of how rude they are.
entailment	Tony is hotter than Sarah.	Tony and Sarah can be compared in terms of how hot they are.
entailment	Roger is greedier than Michelle.	Roger and Michelle can be compared in terms of how greedy they are.
entailment	Katherine is stronger than Ralph.	Katherine and Ralph can be compared in terms of how strong they are.
entailment	Jill is angrier than Dave.	Jill and Dave can be compared in terms of how angry they are.
entailment	Elizabeth is creepier than Patrick.	Elizabeth and Patrick can be compared in terms of how creepy they are.
entailment	James is fairer than Frederick.	James and Frederick can be compared in terms of how fair they are.
entailment	Ruth is busier than Paul.	Ruth and Paul can be compared in terms of how busy they are.
entailment	Charlie is shallower than Louise.	Charlie and Louise can be compared in terms of how shallow they are.
entailment	Sara is crazier than Mary.	Sara and Mary can be compared in terms of how crazy they are.
entailment	Kate is humbler than Alfred.	Kate and Alfred can be compared in terms of how humble they are.
entailment	Frances is friendlier than Anne.	Frances and Anne can be compared in terms of how friendly they are.
entailment	Angela is sincerer than Al.	Angela and Al can be compared in terms of how sincere they are.
entailment	Thomas is nicer than Julie.	Thomas and Julie can be compared in terms of how nice they are.
entailment	Karen is grosser than Bobby.	Karen and Bobby can be compared in terms of how gross they are.
entailment	Andrew is clumsier than Kathy.	Andrew and Kathy can be compared in terms of how clumsy they are.
entailment	Leslie is angrier than Edwin.	Leslie and Edwin can be compared in terms of how angry they are.
entailment	Alfred is smaller than Stephen.	Alfred and Stephen can be compared in terms of how small they are.
entailment	Henry is chubbier than Simon.	Henry and Simon can be compared in terms of how chubby they are.
entailment	Bill is sillier than Evelyn.	Bill and Evelyn can be compared in terms of how silly they are.
entailment	Sara is noisier than Charles.	Sara and Charles can be compared in terms of how noisy they are.
entailment	Scott is louder than Benjamin.	Scott and Benjamin can be compared in terms of how loud they are.
entailment	Jerry is sillier than Jack.	Jerry and Jack can be compared in terms of how silly they are.
entailment	Frederick is bossier than Edith.	Frederick and Edith can be compared in terms of how bossy they are.
entailment	Julia is duller than Roger.	Julia and Roger can be compared in terms of how dull they are.
entailment	Ann is sillier than Melissa.	Ann and Melissa can be compared in terms of how silly they are.
entailment	Peter is worse than Marie.	Peter and Marie can be compared in terms of how bad they are.
entailment	Cynthia is nicer than Robert.	Cynthia and Robert can be compared in terms of how nice they are.
entailment	Carolyn is funnier than Evelyn.	Carolyn and Evelyn can be compared in terms of how funny they are.
entailment	Julie is bigger than Bobby.	Julie and Bobby can be compared in terms of how big they are.
entailment	Louise is faster than Don.	Louise and Don can be compared in terms of how fast they are.
entailment	Margaret is sleepier than Ben.	Margaret and Ben can be compared in terms of how sleepy they are.
entailment	Don is more attractive than Amanda.	Don and Amanda can be compared in terms of how attractive they are.
entailment	Jason is stronger than Diane.	Jason and Diane can be compared in terms of how strong they are.
entailment	Catherine is naughtier than Linda.	Catherine and Linda can be compared in terms of how naughty they are.
entailment	Susan is quieter than Deborah.	Susan and Deborah can be compared in terms of how quiet they are.
entailment	Joan is lonlier than Hugh.	Joan and Hugh can be compared in terms of how lonely they are.
entailment	Albert is naughtier than Elizabeth.	Albert and Elizabeth can be compared in terms of how naughty they are.
entailment	Thomas is saltier than Helen.	Thomas and Helen can be compared in terms of how salty they are.
entailment	Virginia is more popular than Florence.	Virginia and Florence can be compared in terms of how popular they are.
entailment	Lisa is sillier than Pamela.	Lisa and Pamela can be compared in terms of how silly they are.
entailment	William is gentler than Robert.	William and Robert can be compared in terms of how gentle they are.
entailment	Rachel is slimmer than Kim.	Rachel and Kim can be compared in terms of how slim they are.
entailment	Karen is smaller than Ruth.	Karen and Ruth can be compared in terms of how small they are.
entailment	Adam is nicer than Simon.	Adam and Simon can be compared in terms of how nice they are.
entailment	Diana is sweeter than Pamela.	Diana and Pamela can be compared in terms of how sweet they are.
entailment	Leslie is more tired than Charlie.	Leslie and Charlie can be compared in terms of how tired they are.
entailment	Louise is saltier than Suzanne.	Louise and Suzanne can be compared in terms of how salty they are.
entailment	Marie is scarier than Mark.	Marie and Mark can be compared in terms of how scary they are.
entailment	Annie is dumber than Edith.	Annie and Edith can be compared in terms of how dumb they are.
entailment	Anthony is better than Catherine.	Anthony and Catherine can be compared in terms of how good they are.
entailment	Jason is gloomier than Adam.	Jason and Adam can be compared in terms of how gloomy they are.
entailment	Anthony is denser than Steven.	Anthony and Steven can be compared in terms of how dense they are.
entailment	Albert is bossier than Kelly.	Albert and Kelly can be compared in terms of how bossy they are.
entailment	Anna is more polite than Kim.	Anna and Kim can be compared in terms of how polite they are.
entailment	Carol is gentler than Wendy.	Carol and Wendy can be compared in terms of how gentle they are.
entailment	Ray is clumsier than Tony.	Ray and Tony can be compared in terms of how clumsy they are.
entailment	Ellen is bigger than Joan.	Ellen and Joan can be compared in terms of how big they are.
entailment	Francis is cleverer than Carolyn.	Francis and Carolyn can be compared in terms of how clever they are.
entailment	Mark is quieter than Michelle.	Mark and Michelle can be compared in terms of how quiet they are.
entailment	Maria is tougher than Edith.	Maria and Edith can be compared in terms of how tough they are.
entailment	Steve is uglier than Patrick.	Steve and Patrick can be compared in terms of how ugly they are.
entailment	Steve is prettier than Bobby.	Steve and Bobby can be compared in terms of how pretty they are.
entailment	Ellen is sharper than Charlie.	Ellen and Charlie can be compared in terms of how sharp they are.
entailment	Ron is nicer than Jennifer.	Ron and Jennifer can be compared in terms of how nice they are.
entailment	Arthur is louder than Nicole.	Arthur and Nicole can be compared in terms of how loud they are.
entailment	Rose is healthier than Nancy.	Rose and Nancy can be compared in terms of how healthy they are.
entailment	Tony is humbler than Charlie.	Tony and Charlie can be compared in terms of how humble they are.
entailment	Kelly is uglier than Amy.	Kelly and Amy can be compared in terms of how ugly they are.
entailment	Leslie is more important than Anthony.	Leslie and Anthony can be compared in terms of how important they are.
entailment	Elaine is sillier than Chris.	Elaine and Chris can be compared in terms of how silly they are.
entailment	Carol is wiser than Julie.	Carol and Julie can be compared in terms of how wise they are.
entailment	Amanda is quieter than Ken.	Amanda and Ken can be compared in terms of how quiet they are.
entailment	Daniel is older than Lauren.	Daniel and Lauren can be compared in terms of how old they are.
entailment	Alison is naughtier than Michelle.	Alison and Michelle can be compared in terms of how naughty they are.
entailment	Rachel is fatter than Eleanor.	Rachel and Eleanor can be compared in terms of how fat they are.
entailment	Lawrence is angrier than Frederick.	Lawrence and Frederick can be compared in terms of how angry they are.
entailment	Barbara is slimmer than Rachel.	Barbara and Rachel can be compared in terms of how slim they are.
entailment	Christopher is friendlier than Alexander.	Christopher and Alexander can be compared in terms of how friendly they are.
entailment	Dick is gloomier than Alison.	Dick and Alison can be compared in terms of how gloomy they are.
entailment	Mike is funnier than Colin.	Mike and Colin can be compared in terms of how funny they are.
entailment	Louis is sorrier than Adam.	Louis and Adam can be compared in terms of how sorry they are.
entailment	Andrew is shyer than Stephanie.	Andrew and Stephanie can be compared in terms of how shy they are.
entailment	Suzanne is older than Jimmy.	Suzanne and Jimmy can be compared in terms of how old they are.
entailment	Julie is crazier than Dan.	Julie and Dan can be compared in terms of how crazy they are.
entailment	Nick is better than Kathryn.	Nick and Kathryn can be compared in terms of how good they are.
entailment	Charlie is bossier than Betty.	Charlie and Betty can be compared in terms of how bossy they are.
entailment	Anthony is grosser than Rachel.	Anthony and Rachel can be compared in terms of how gross they are.
entailment	Mike is louder than Lawrence.	Mike and Lawrence can be compared in terms of how loud they are.
entailment	Suzanne is wealthier than Francis.	Suzanne and Francis can be compared in terms of how wealthy they are.
entailment	Ian is older than Alexandra.	Ian and Alexandra can be compared in terms of how old they are.
entailment	Melissa is more popular than Lisa.	Melissa and Lisa can be compared in terms of how popular they are.
entailment	Christine is lonlier than Lawrence.	Christine and Lawrence can be compared in terms of how lonely they are.
entailment	Carolyn is sorrier than Matt.	Carolyn and Matt can be compared in terms of how sorry they are.
entailment	Grace is politer than Evelyn.	Grace and Evelyn can be compared in terms of how polite they are.
entailment	Diana is older than Nicole.	Diana and Nicole can be compared in terms of how old they are.
entailment	Alfred is politer than Deborah.	Alfred and Deborah can be compared in terms of how polite they are.
entailment	Alison is more interesting than Melissa.	Alison and Melissa can be compared in terms of how interesting they are.
entailment	Carolyn is prettier than Joe.	Carolyn and Joe can be compared in terms of how pretty they are.
entailment	Christine is wiser than William.	Christine and William can be compared in terms of how wise they are.
entailment	Elaine is uglier than Catherine.	Elaine and Catherine can be compared in terms of how ugly they are.
entailment	Nancy is sharper than Donald.	Nancy and Donald can be compared in terms of how sharp they are.
entailment	Sara is naughtier than Colin.	Sara and Colin can be compared in terms of how naughty they are.
entailment	Kate is noisier than Hugh.	Kate and Hugh can be compared in terms of how noisy they are.
entailment	Philip is friendlier than Melissa.	Philip and Melissa can be compared in terms of how friendly they are.
entailment	Leslie is more interesting than Virginia.	Leslie and Virginia can be compared in terms of how interesting they are.
entailment	Lawrence is prouder than Helen.	Lawrence and Helen can be compared in terms of how proud they are.
entailment	Donna is gentler than Amy.	Donna and Amy can be compared in terms of how gentle they are.
entailment	Frances is smarter than Elaine.	Frances and Elaine can be compared in terms of how smart they are.
entailment	Lisa is smaller than Jason.	Lisa and Jason can be compared in terms of how small they are.
entailment	Alexandra is crueller than Joseph.	Alexandra and Joseph can be compared in terms of how cruel they are.
entailment	Helen is healthier than Frances.	Helen and Frances can be compared in terms of how healthy they are.
entailment	Nancy is crazier than Daniel.	Nancy and Daniel can be compared in terms of how crazy they are.
entailment	Heather is prouder than Roger.	Heather and Roger can be compared in terms of how proud they are.
entailment	Carol is prouder than Roger.	Carol and Roger can be compared in terms of how proud they are.
entailment	Claire is funnier than Jessica.	Claire and Jessica can be compared in terms of how funny they are.
entailment	Chris is more handsome than Steven.	Chris and Steven can be compared in terms of how handsome they are.
entailment	Tom is saltier than Eric.	Tom and Eric can be compared in terms of how salty they are.
entailment	Edward is tougher than Ken.	Edward and Ken can be compared in terms of how tough they are.
entailment	Jonathan is nicer than Carl.	Jonathan and Carl can be compared in terms of how nice they are.
entailment	Carl is healthier than Sandra.	Carl and Sandra can be compared in terms of how healthy they are.
entailment	Philip is politer than Pamela.	Philip and Pamela can be compared in terms of how polite they are.
entailment	Jim is more renowned than Ann.	Jim and Ann can be compared in terms of how renowned they are.
entailment	Bobby is quieter than Harold.	Bobby and Harold can be compared in terms of how quiet they are.
entailment	Alfred is weirder than Peter.	Alfred and Peter can be compared in terms of how weird they are.
entailment	Eric is prouder than Robin.	Eric and Robin can be compared in terms of how proud they are.
entailment	Greg is happier than Lucy.	Greg and Lucy can be compared in terms of how happy they are.
entailment	Dick is shallower than Carl.	Dick and Carl can be compared in terms of how shallow they are.
entailment	Eric is uglier than Judith.	Eric and Judith can be compared in terms of how ugly they are.
entailment	Katherine is duller than Roger.	Katherine and Roger can be compared in terms of how dull they are.
entailment	Grace is noisier than Albert.	Grace and Albert can be compared in terms of how noisy they are.
entailment	Nicole is gentler than Amanda.	Nicole and Amanda can be compared in terms of how gentle they are.
entailment	Betty is crazier than Alison.	Betty and Alison can be compared in terms of how crazy they are.
entailment	Lynn is more modern than Francis.	Lynn and Francis can be compared in terms of how modern they are.
entailment	Florence is more popular than Joan.	Florence and Joan can be compared in terms of how popular they are.
entailment	Mary is humbler than Alex.	Mary and Alex can be compared in terms of how humble they are.
entailment	Alexandra is wiser than Sue.	Alexandra and Sue can be compared in terms of how wise they are.
entailment	Kenneth is hairier than Thomas.	Kenneth and Thomas can be compared in terms of how hairy they are.
entailment	Jack is lonlier than Christine.	Jack and Christine can be compared in terms of how lonely they are.
entailment	Ray is poorer than Jean.	Ray and Jean can be compared in terms of how poor they are.
entailment	Sarah is bolder than Simon.	Sarah and Simon can be compared in terms of how bold they are.
entailment	Bill is naughtier than Patrick.	Bill and Patrick can be compared in terms of how naughty they are.
entailment	Tony is sweeter than Jack.	Tony and Jack can be compared in terms of how sweet they are.
entailment	Charlie is naughtier than Johnny.	Charlie and Johnny can be compared in terms of how naughty they are.
entailment	Robin is taller than Margaret.	Robin and Margaret can be compared in terms of how tall they are.
entailment	Helen is crueller than Roger.	Helen and Roger can be compared in terms of how cruel they are.
entailment	Frances is braver than Jean.	Frances and Jean can be compared in terms of how brave they are.
entailment	Harry is more handsome than Ron.	Harry and Ron can be compared in terms of how handsome they are.
entailment	Lynn is more popular than Charlotte.	Lynn and Charlotte can be compared in terms of how popular they are.
entailment	Frank is weaker than Tony.	Frank and Tony can be compared in terms of how weak they are.
entailment	Betty is more tired than Grace.	Betty and Grace can be compared in terms of how tired they are.
entailment	Ralph is tougher than Harold.	Ralph and Harold can be compared in terms of how tough they are.
entailment	Alice is longer than Alfred.	Alice and Alfred can be compared in terms of how long they are.
entailment	Ed is chubbier than Kathleen.	Ed and Kathleen can be compared in terms of how chubby they are.
entailment	Francis is healthier than Jessica.	Francis and Jessica can be compared in terms of how healthy they are.
entailment	John is bolder than Sarah.	John and Sarah can be compared in terms of how bold they are.
entailment	Peter is tinier than Barbara.	Peter and Barbara can be compared in terms of how tiny they are.
entailment	Larry is wiser than Frank.	Larry and Frank can be compared in terms of how wise they are.
entailment	Katie is healthier than Pamela.	Katie and Pamela can be compared in terms of how healthy they are.
entailment	Kathryn is more clever than Stephen.	Kathryn and Stephen can be compared in terms of how clever they are.
entailment	Carol is tougher than Christine.	Carol and Christine can be compared in terms of how tough they are.
entailment	Charlie is guilter than Andrea.	Charlie and Andrea can be compared in terms of how guilty they are.
entailment	Jerry is clumsier than Edith.	Jerry and Edith can be compared in terms of how clumsy they are.
entailment	Al is shorter than Thomas.	Al and Thomas can be compared in terms of how short they are.
