entailment	Frank is poorer than Kim.	Frank and Kim can be compared in terms of how poor they are.
entailment	Jay is ruder than Ryan.	Jay and Ryan can be compared in terms of how rude they are.
entailment	Michelle is lazier than Sharon.	Michelle and Sharon can be compared in terms of how lazy they are.
entailment	Carol is cuter than John.	Carol and John can be compared in terms of how cute they are.
entailment	Carol is sweeter than Claire.	Carol and Claire can be compared in terms of how sweet they are.
entailment	Ryan is hotter than Linda.	Ryan and Linda can be compared in terms of how hot they are.
entailment	Stephanie is stronger than Dorothy.	Stephanie and Dorothy can be compared in terms of how strong they are.
entailment	Donna is smaller than Matt.	Donna and Matt can be compared in terms of how small they are.
entailment	Lisa is healthier than Edwin.	Lisa and Edwin can be compared in terms of how healthy they are.
entailment	Sophie is noisier than Katie.	Sophie and Katie can be compared in terms of how noisy they are.
entailment	Anne is gloomier than Bob.	Anne and Bob can be compared in terms of how gloomy they are.
entailment	Gary is more renowned than Colin.	Gary and Colin can be compared in terms of how renowned they are.
entailment	Emma is busier than Sandra.	Emma and Sandra can be compared in terms of how busy they are.
entailment	Andrew is hotter than Benjamin.	Andrew and Benjamin can be compared in terms of how hot they are.
entailment	Stephanie is bossier than Keith.	Stephanie and Keith can be compared in terms of how bossy they are.
entailment	Al is sadder than Christine.	Al and Christine can be compared in terms of how sad they are.
entailment	Kathleen is uglier than Matthew.	Kathleen and Matthew can be compared in terms of how ugly they are.
entailment	Ron is more beautiful than Donald.	Ron and Donald can be compared in terms of how beautiful they are.
entailment	Nancy is curvier than Daniel.	Nancy and Daniel can be compared in terms of how curvy they are.
entailment	Jay is sharper than Ron.	Jay and Ron can be compared in terms of how sharp they are.
entailment	Karen is nicer than Bill.	Karen and Bill can be compared in terms of how nice they are.
entailment	Jim is sorrier than Emily.	Jim and Emily can be compared in terms of how sorry they are.
entailment	Harriet is more popular than Christine.	Harriet and Christine can be compared in terms of how popular they are.
entailment	Alison is sillier than Catherine.	Alison and Catherine can be compared in terms of how silly they are.
entailment	Sara is better than Mark.	Sara and Mark can be compared in terms of how good they are.
entailment	Kenneth is gentler than Carol.	Kenneth and Carol can be compared in terms of how gentle they are.
entailment	Caroline is ruder than Frances.	Caroline and Frances can be compared in terms of how rude they are.
entailment	Edward is greater than Kim.	Edward and Kim can be compared in terms of how great they are.
entailment	William is dumber than Martha.	William and Martha can be compared in terms of how dumb they are.
entailment	Mike is happier than Paul.	Mike and Paul can be compared in terms of how happy they are.
entailment	Charlotte is politer than Donald.	Charlotte and Donald can be compared in terms of how polite they are.
entailment	Charlotte is more tired than Claire.	Charlotte and Claire can be compared in terms of how tired they are.
entailment	Edith is greedier than Emily.	Edith and Emily can be compared in terms of how greedy they are.
entailment	James is firmer than Christine.	James and Christine can be compared in terms of how firm they are.
entailment	Edith is worse than Samuel.	Edith and Samuel can be compared in terms of how bad they are.
entailment	Johnny is bigger than Steve.	Johnny and Steve can be compared in terms of how big they are.
entailment	Kathy is clumsier than Sam.	Kathy and Sam can be compared in terms of how clumsy they are.
entailment	Jimmy is bitterer than Michelle.	Jimmy and Michelle can be compared in terms of how bitter they are.
entailment	Caroline is cuter than Roger.	Caroline and Roger can be compared in terms of how cute they are.
entailment	Robert is shyer than Sally.	Robert and Sally can be compared in terms of how shy they are.
entailment	Carl is richer than Lauren.	Carl and Lauren can be compared in terms of how rich they are.
entailment	Michael is naughtier than Rose.	Michael and Rose can be compared in terms of how naughty they are.
entailment	Jason is slimmer than James.	Jason and James can be compared in terms of how slim they are.
entailment	Edwin is harsher than Dorothy.	Edwin and Dorothy can be compared in terms of how harsh they are.
entailment	Thomas is messier than Alexandra.	Thomas and Alexandra can be compared in terms of how messy they are.
entailment	Mike is greedier than Grace.	Mike and Grace can be compared in terms of how greedy they are.
entailment	Cynthia is thinner than Patricia.	Cynthia and Patricia can be compared in terms of how thin they are.
entailment	Alison is hairier than Ellen.	Alison and Ellen can be compared in terms of how hairy they are.
entailment	Frank is weirder than Lucy.	Frank and Lucy can be compared in terms of how weird they are.
entailment	Ken is more beautiful than Sally.	Ken and Sally can be compared in terms of how beautiful they are.
entailment	Ashley is shallower than Kathleen.	Ashley and Kathleen can be compared in terms of how shallow they are.
entailment	Kathleen is shallower than Deborah.	Kathleen and Deborah can be compared in terms of how shallow they are.
entailment	Frank is more clever than Linda.	Frank and Linda can be compared in terms of how clever they are.
entailment	Tom is saltier than Sam.	Tom and Sam can be compared in terms of how salty they are.
entailment	Lisa is slimmer than Anthony.	Lisa and Anthony can be compared in terms of how slim they are.
entailment	Tom is bitterer than Nicole.	Tom and Nicole can be compared in terms of how bitter they are.
entailment	Janet is greedier than Jeff.	Janet and Jeff can be compared in terms of how greedy they are.
entailment	Leslie is shallower than Don.	Leslie and Don can be compared in terms of how shallow they are.
entailment	Ellen is sillier than Stephen.	Ellen and Stephen can be compared in terms of how silly they are.
entailment	Caroline is sleepier than Jennifer.	Caroline and Jennifer can be compared in terms of how sleepy they are.
entailment	Colin is greedier than Victoria.	Colin and Victoria can be compared in terms of how greedy they are.
entailment	Cynthia is noisier than Francis.	Cynthia and Francis can be compared in terms of how noisy they are.
entailment	Lisa is cuter than Florence.	Lisa and Florence can be compared in terms of how cute they are.
entailment	Deborah is thinner than Sam.	Deborah and Sam can be compared in terms of how thin they are.
entailment	Frederick is bitterer than Frances.	Frederick and Frances can be compared in terms of how bitter they are.
entailment	Chris is worse than Dave.	Chris and Dave can be compared in terms of how bad they are.
entailment	Jimmy is greedier than James.	Jimmy and James can be compared in terms of how greedy they are.
entailment	Simon is bossier than Jonathan.	Simon and Jonathan can be compared in terms of how bossy they are.
entailment	Chris is skinnier than Thomas.	Chris and Thomas can be compared in terms of how skinny they are.
entailment	Marilyn is younger than Lynn.	Marilyn and Lynn can be compared in terms of how young they are.
entailment	Pamela is calmer than Heather.	Pamela and Heather can be compared in terms of how calm they are.
entailment	William is noisier than Chris.	William and Chris can be compared in terms of how noisy they are.
entailment	Jay is hotter than Jerry.	Jay and Jerry can be compared in terms of how hot they are.
entailment	Ray is harsher than Louis.	Ray and Louis can be compared in terms of how harsh they are.
entailment	Tim is sincerer than Laura.	Tim and Laura can be compared in terms of how sincere they are.
entailment	Diana is sillier than Jimmy.	Diana and Jimmy can be compared in terms of how silly they are.
entailment	Joan is guilter than Frederick.	Joan and Frederick can be compared in terms of how guilty they are.
entailment	Jack is lovelier than Benjamin.	Jack and Benjamin can be compared in terms of how lovely they are.
entailment	Alfred is shorter than Simon.	Alfred and Simon can be compared in terms of how short they are.
entailment	Ron is poorer than George.	Ron and George can be compared in terms of how poor they are.
entailment	Ed is cuter than Ellen.	Ed and Ellen can be compared in terms of how cute they are.
entailment	Paul is hungrier than Deborah.	Paul and Deborah can be compared in terms of how hungry they are.
entailment	Jill is skinnier than Ian.	Jill and Ian can be compared in terms of how skinny they are.
entailment	Matt is happier than Edith.	Matt and Edith can be compared in terms of how happy they are.
entailment	Tony is tougher than Carolyn.	Tony and Carolyn can be compared in terms of how tough they are.
entailment	Steven is nicer than Dan.	Steven and Dan can be compared in terms of how nice they are.
entailment	Marie is cuter than Brian.	Marie and Brian can be compared in terms of how cute they are.
entailment	Anna is kinder than Henry.	Anna and Henry can be compared in terms of how kind they are.
entailment	Lisa is lovelier than Marilyn.	Lisa and Marilyn can be compared in terms of how lovely they are.
entailment	Christopher is denser than Carl.	Christopher and Carl can be compared in terms of how dense they are.
entailment	Chris is grosser than Diane.	Chris and Diane can be compared in terms of how gross they are.
entailment	Louis is duller than Rebecca.	Louis and Rebecca can be compared in terms of how dull they are.
entailment	Marie is shorter than Donald.	Marie and Donald can be compared in terms of how short they are.
entailment	Scott is more modern than Marilyn.	Scott and Marilyn can be compared in terms of how modern they are.
entailment	Gary is shyer than Martha.	Gary and Martha can be compared in terms of how shy they are.
entailment	Betty is more popular than Peter.	Betty and Peter can be compared in terms of how popular they are.
entailment	Anne is kinder than Annie.	Anne and Annie can be compared in terms of how kind they are.
entailment	Harold is happier than Angela.	Harold and Angela can be compared in terms of how happy they are.
entailment	Alfred is fatter than Louise.	Alfred and Louise can be compared in terms of how fat they are.
entailment	Maria is more clever than Andrea.	Maria and Andrea can be compared in terms of how clever they are.
entailment	Jason is more polite than Sue.	Jason and Sue can be compared in terms of how polite they are.
entailment	Steven is brighter than Greg.	Steven and Greg can be compared in terms of how bright they are.
entailment	Pamela is greater than Deborah.	Pamela and Deborah can be compared in terms of how great they are.
entailment	Dick is fairer than Nick.	Dick and Nick can be compared in terms of how fair they are.
entailment	Albert is older than Dan.	Albert and Dan can be compared in terms of how old they are.
entailment	Ed is more popular than Robert.	Ed and Robert can be compared in terms of how popular they are.
entailment	Margaret is worse than Peter.	Margaret and Peter can be compared in terms of how bad they are.
entailment	James is fairer than Kathleen.	James and Kathleen can be compared in terms of how fair they are.
entailment	Ann is gentler than Lawrence.	Ann and Lawrence can be compared in terms of how gentle they are.
entailment	Louis is friendlier than Edwin.	Louis and Edwin can be compared in terms of how friendly they are.
entailment	Heather is curvier than Amy.	Heather and Amy can be compared in terms of how curvy they are.
entailment	Stephanie is humbler than Sue.	Stephanie and Sue can be compared in terms of how humble they are.
entailment	Patricia is bossier than Margaret.	Patricia and Margaret can be compared in terms of how bossy they are.
entailment	Lynn is denser than Karen.	Lynn and Karen can be compared in terms of how dense they are.
entailment	Anna is hungrier than Alexandra.	Anna and Alexandra can be compared in terms of how hungry they are.
entailment	Bobby is tougher than Howard.	Bobby and Howard can be compared in terms of how tough they are.
entailment	Charlie is fairer than Judith.	Charlie and Judith can be compared in terms of how fair they are.
entailment	Alex is more beautiful than Howard.	Alex and Howard can be compared in terms of how beautiful they are.
entailment	Janet is bolder than Albert.	Janet and Albert can be compared in terms of how bold they are.
entailment	Jonathan is shorter than Ken.	Jonathan and Ken can be compared in terms of how short they are.
entailment	Pamela is prouder than Matt.	Pamela and Matt can be compared in terms of how proud they are.
entailment	Martin is more beautiful than Alexandra.	Martin and Alexandra can be compared in terms of how beautiful they are.
entailment	Carol is longer than Greg.	Carol and Greg can be compared in terms of how long they are.
entailment	Ruth is smarter than Stephanie.	Ruth and Stephanie can be compared in terms of how smart they are.
entailment	Carol is greater than Stephen.	Carol and Stephen can be compared in terms of how great they are.
entailment	Pamela is weirder than Suzanne.	Pamela and Suzanne can be compared in terms of how weird they are.
entailment	Nick is hotter than Emily.	Nick and Emily can be compared in terms of how hot they are.
entailment	Sally is lonlier than Fred.	Sally and Fred can be compared in terms of how lonely they are.
entailment	Joan is harsher than Louise.	Joan and Louise can be compared in terms of how harsh they are.
entailment	Dave is messier than Rachel.	Dave and Rachel can be compared in terms of how messy they are.
entailment	Amy is shorter than Edwin.	Amy and Edwin can be compared in terms of how short they are.
entailment	Carl is faster than Stephen.	Carl and Stephen can be compared in terms of how fast they are.
entailment	Carol is bitterer than William.	Carol and William can be compared in terms of how bitter they are.
entailment	Samuel is sincerer than Elaine.	Samuel and Elaine can be compared in terms of how sincere they are.
entailment	Dan is brighter than Barbara.	Dan and Barbara can be compared in terms of how bright they are.
entailment	Roger is thinner than Kathleen.	Roger and Kathleen can be compared in terms of how thin they are.
entailment	Joe is weirder than Ron.	Joe and Ron can be compared in terms of how weird they are.
entailment	Martin is humbler than Brian.	Martin and Brian can be compared in terms of how humble they are.
entailment	Sophie is louder than Bobby.	Sophie and Bobby can be compared in terms of how loud they are.
entailment	Billy is stronger than Adam.	Billy and Adam can be compared in terms of how strong they are.
entailment	Ian is more bitter than Walter.	Ian and Walter can be compared in terms of how bitter they are.
entailment	Lucy is lonlier than Alex.	Lucy and Alex can be compared in terms of how lonely they are.
entailment	Alex is fatter than Edith.	Alex and Edith can be compared in terms of how fat they are.
entailment	Jeff is prouder than Susan.	Jeff and Susan can be compared in terms of how proud they are.
entailment	Ellen is brighter than Catherine.	Ellen and Catherine can be compared in terms of how bright they are.
entailment	Lucy is worse than Alex.	Lucy and Alex can be compared in terms of how bad they are.
entailment	Harry is hotter than Florence.	Harry and Florence can be compared in terms of how hot they are.
entailment	Ed is thinner than Carol.	Ed and Carol can be compared in terms of how thin they are.
entailment	Philip is bitterer than Elaine.	Philip and Elaine can be compared in terms of how bitter they are.
entailment	Harry is worse than Ron.	Harry and Ron can be compared in terms of how bad they are.
entailment	Melissa is naughtier than Steve.	Melissa and Steve can be compared in terms of how naughty they are.
entailment	Tom is scarier than Stephanie.	Tom and Stephanie can be compared in terms of how scary they are.
entailment	Lucy is sleepier than Melissa.	Lucy and Melissa can be compared in terms of how sleepy they are.
entailment	Sam is bigger than Sandra.	Sam and Sandra can be compared in terms of how big they are.
entailment	Charles is stronger than Joan.	Charles and Joan can be compared in terms of how strong they are.
entailment	George is sharper than Sara.	George and Sara can be compared in terms of how sharp they are.
entailment	Roger is curvier than Bobby.	Roger and Bobby can be compared in terms of how curvy they are.
entailment	Claire is nicer than Nick.	Claire and Nick can be compared in terms of how nice they are.
entailment	Andrea is hungrier than Eleanor.	Andrea and Eleanor can be compared in terms of how hungry they are.
entailment	Kim is shyer than Kate.	Kim and Kate can be compared in terms of how shy they are.
entailment	George is more polite than Alex.	George and Alex can be compared in terms of how polite they are.
entailment	Kenneth is nicer than Ruth.	Kenneth and Ruth can be compared in terms of how nice they are.
entailment	Sally is guilter than Katie.	Sally and Katie can be compared in terms of how guilty they are.
entailment	James is uglier than Caroline.	James and Caroline can be compared in terms of how ugly they are.
entailment	Nancy is fitter than Rose.	Nancy and Rose can be compared in terms of how fit they are.
entailment	George is uglier than Roy.	George and Roy can be compared in terms of how ugly they are.
entailment	Bill is funnier than Edith.	Bill and Edith can be compared in terms of how funny they are.
entailment	Grace is more clever than Thomas.	Grace and Thomas can be compared in terms of how clever they are.
entailment	Julie is more renowned than David.	Julie and David can be compared in terms of how renowned they are.
entailment	Claire is richer than James.	Claire and James can be compared in terms of how rich they are.
entailment	Wendy is faster than Amy.	Wendy and Amy can be compared in terms of how fast they are.
entailment	Patricia is braver than George.	Patricia and George can be compared in terms of how brave they are.
entailment	Thomas is busier than Sally.	Thomas and Sally can be compared in terms of how busy they are.
entailment	Billy is smarter than Julie.	Billy and Julie can be compared in terms of how smart they are.
entailment	George is ruder than Lauren.	George and Lauren can be compared in terms of how rude they are.
entailment	Gary is funnier than Kate.	Gary and Kate can be compared in terms of how funny they are.
entailment	Gary is younger than James.	Gary and James can be compared in terms of how young they are.
entailment	Lauren is poorer than Charlotte.	Lauren and Charlotte can be compared in terms of how poor they are.
entailment	Robin is smaller than Dick.	Robin and Dick can be compared in terms of how small they are.
entailment	Julie is more modern than Francis.	Julie and Francis can be compared in terms of how modern they are.
entailment	Grace is greater than Al.	Grace and Al can be compared in terms of how great they are.
entailment	Jack is angrier than Betty.	Jack and Betty can be compared in terms of how angry they are.
entailment	Bruce is greater than Florence.	Bruce and Florence can be compared in terms of how great they are.
entailment	Samuel is sharper than Brian.	Samuel and Brian can be compared in terms of how sharp they are.
entailment	Charles is creepier than Hugh.	Charles and Hugh can be compared in terms of how creepy they are.
entailment	Lawrence is friendlier than Sara.	Lawrence and Sara can be compared in terms of how friendly they are.
entailment	Rebecca is sorrier than Judith.	Rebecca and Judith can be compared in terms of how sorry they are.
entailment	Arthur is braver than Andrea.	Arthur and Andrea can be compared in terms of how brave they are.
entailment	Sandra is grosser than Anne.	Sandra and Anne can be compared in terms of how gross they are.
entailment	Patricia is wiser than Lauren.	Patricia and Lauren can be compared in terms of how wise they are.
entailment	Alex is sharper than Dorothy.	Alex and Dorothy can be compared in terms of how sharp they are.
entailment	Tom is wealthier than Laura.	Tom and Laura can be compared in terms of how wealthy they are.
entailment	Deborah is prouder than Diane.	Deborah and Diane can be compared in terms of how proud they are.
entailment	Amanda is skinnier than Alison.	Amanda and Alison can be compared in terms of how skinny they are.
entailment	Martin is shallower than Sharon.	Martin and Sharon can be compared in terms of how shallow they are.
entailment	Jill is chubbier than Tom.	Jill and Tom can be compared in terms of how chubby they are.
entailment	Anna is skinnier than Sally.	Anna and Sally can be compared in terms of how skinny they are.
entailment	Roger is prouder than Elaine.	Roger and Elaine can be compared in terms of how proud they are.
entailment	Leslie is sincerer than Alexandra.	Leslie and Alexandra can be compared in terms of how sincere they are.
entailment	Ken is weaker than Melissa.	Ken and Melissa can be compared in terms of how weak they are.
entailment	Ray is sorrier than Wendy.	Ray and Wendy can be compared in terms of how sorry they are.
entailment	Sara is older than Andrew.	Sara and Andrew can be compared in terms of how old they are.
entailment	Scott is taller than Virginia.	Scott and Virginia can be compared in terms of how tall they are.
entailment	Stephanie is meaner than Mike.	Stephanie and Mike can be compared in terms of how mean they are.
entailment	Ann is fitter than Carolyn.	Ann and Carolyn can be compared in terms of how fit they are.
entailment	Richard is curvier than Alexander.	Richard and Alexander can be compared in terms of how curvy they are.
entailment	Dorothy is sillier than James.	Dorothy and James can be compared in terms of how silly they are.
entailment	Ray is creepier than Bruce.	Ray and Bruce can be compared in terms of how creepy they are.
entailment	Tim is creepier than Gary.	Tim and Gary can be compared in terms of how creepy they are.
entailment	Victoria is more handsome than Tim.	Victoria and Tim can be compared in terms of how handsome they are.
entailment	Charlotte is meaner than Jack.	Charlotte and Jack can be compared in terms of how mean they are.
entailment	Jessica is worse than Sam.	Jessica and Sam can be compared in terms of how bad they are.
entailment	Wendy is more popular than Kim.	Wendy and Kim can be compared in terms of how popular they are.
entailment	Emily is friendlier than William.	Emily and William can be compared in terms of how friendly they are.
entailment	Hugh is faster than Barbara.	Hugh and Barbara can be compared in terms of how fast they are.
entailment	Jay is weirder than Anthony.	Jay and Anthony can be compared in terms of how weird they are.
entailment	Jason is fatter than Carl.	Jason and Carl can be compared in terms of how fat they are.
entailment	Martha is grosser than Keith.	Martha and Keith can be compared in terms of how gross they are.
entailment	Frances is angrier than Robert.	Frances and Robert can be compared in terms of how angry they are.
entailment	Alex is cleverer than Carl.	Alex and Carl can be compared in terms of how clever they are.
entailment	Deborah is sadder than Grace.	Deborah and Grace can be compared in terms of how sad they are.
entailment	Francis is more polite than Jill.	Francis and Jill can be compared in terms of how polite they are.
entailment	Alexandra is faster than Ann.	Alexandra and Ann can be compared in terms of how fast they are.
entailment	Fred is humbler than Diane.	Fred and Diane can be compared in terms of how humble they are.
entailment	Kelly is slimmer than Deborah.	Kelly and Deborah can be compared in terms of how slim they are.
entailment	Martha is slimmer than Wendy.	Martha and Wendy can be compared in terms of how slim they are.
entailment	Laura is busier than Mark.	Laura and Mark can be compared in terms of how busy they are.
entailment	Melissa is fitter than Marie.	Melissa and Marie can be compared in terms of how fit they are.
entailment	Sue is more renowned than Jimmy.	Sue and Jimmy can be compared in terms of how renowned they are.
entailment	Jason is duller than Matthew.	Jason and Matthew can be compared in terms of how dull they are.
entailment	Betty is better than Larry.	Betty and Larry can be compared in terms of how good they are.
entailment	Martin is ruder than Richard.	Martin and Richard can be compared in terms of how rude they are.
entailment	Tom is braver than Grace.	Tom and Grace can be compared in terms of how brave they are.
entailment	Ellen is lazier than Claire.	Ellen and Claire can be compared in terms of how lazy they are.
entailment	Fiona is calmer than Jane.	Fiona and Jane can be compared in terms of how calm they are.
entailment	Ralph is guilter than Jane.	Ralph and Jane can be compared in terms of how guilty they are.
entailment	Melissa is shorter than Anna.	Melissa and Anna can be compared in terms of how short they are.
entailment	Jim is bigger than Sandra.	Jim and Sandra can be compared in terms of how big they are.
entailment	Louis is more renowned than Adam.	Louis and Adam can be compared in terms of how renowned they are.
entailment	Peter is busier than George.	Peter and George can be compared in terms of how busy they are.
entailment	Kelly is sorrier than Keith.	Kelly and Keith can be compared in terms of how sorry they are.
entailment	Patricia is shallower than Mary.	Patricia and Mary can be compared in terms of how shallow they are.
entailment	Dorothy is brighter than Sharon.	Dorothy and Sharon can be compared in terms of how bright they are.
entailment	Edwin is taller than Donna.	Edwin and Donna can be compared in terms of how tall they are.
entailment	Joan is denser than Edwin.	Joan and Edwin can be compared in terms of how dense they are.
