neutral	Edith lives in Ireland.	Edith is a journalist.
neutral	Cynthia lives in Austria.	Cynthia is a judge.
neutral	Sophie lives in Iraq.	Sophie is a teacher.
neutral	Scott lives in Cuba.	Scott is a hairdresser.
neutral	Nancy lives in Iraq.	Nancy is an artist.
neutral	Caroline lives in Colombia.	Caroline is a chef.
neutral	David lives in Iceland.	David is a tailor.
neutral	Nick lives in Ghana.	Nick is an artist.
neutral	Scott lives in Brazil.	Scott is an electrician.
neutral	Wendy lives in Switzerland.	Wendy is an electrician.
neutral	Walter lives in Afghanistan.	Walter is a writer.
neutral	Matthew lives in Iceland.	Matthew is a cook.
neutral	Albert lives in Libya.	Albert is a designer.
neutral	Alfred lives in Hungary.	Alfred is a secretary.
neutral	Cynthia lives in Haiti.	Cynthia is an artist.
neutral	Louis lives in Australia.	Louis is a hairdresser.
neutral	Helen lives in Georgia.	Helen is a librarian.
neutral	Jason lives in Bhutan.	Jason is a police officer.
neutral	Carl lives in Afghanistan.	Carl is a police officer.
neutral	Mark lives in Maldives.	Mark is a journalist.
neutral	Steven lives in United Arab Emirates.	Steven is a designer.
neutral	Martin lives in United Arab Emirates.	Martin is a lecturer.
neutral	Alexandra lives in Germany.	Alexandra is a teacher.
neutral	Billy lives in Australia.	Billy is a journalist.
neutral	Sarah lives in Australia.	Sarah is a scientist.
neutral	Anne lives in Pakistan.	Anne is an artist.
neutral	Judith lives in Argentina.	Judith is a farmer.
neutral	Peter lives in Ghana.	Peter is a dentist.
neutral	Stephen lives in Iraq.	Stephen is a judge.
neutral	Ralph lives in Vietnam.	Ralph is a journalist.
neutral	Lucy lives in Ireland.	Lucy is a judge.
neutral	Brian lives in Philippines.	Brian is a firefighter.
neutral	Thomas lives in Sweden.	Thomas is an accountant.
neutral	Matthew lives in New Zealand.	Matthew is a model.
neutral	Lauren lives in Pakistan.	Lauren is a librarian.
neutral	Ryan lives in Japan.	Ryan is a photographer.
neutral	Joe lives in Maldives.	Joe is a designer.
neutral	Steven lives in Germany.	Steven is an accountant.
neutral	Stephanie lives in Finland.	Stephanie is an aviator.
neutral	Karen lives in France.	Karen is a teacher.
neutral	Jack lives in Russia.	Jack is an engineer.
neutral	Sam lives in North Korea.	Sam is an actor.
neutral	Laura lives in Singapore.	Laura is a librarian.
neutral	Edward lives in Azerbaijan.	Edward is a professor.
neutral	Bobby lives in Hungary.	Bobby is an electrician.
neutral	Harriet lives in Ecuador.	Harriet is a tailor.
neutral	Brian lives in Georgia.	Brian is a butler.
neutral	Dick lives in Finland.	Dick is a teacher.
neutral	Anne lives in Libya.	Anne is a librarian.
neutral	Laura lives in Georgia.	Laura is a nurse.
neutral	Laura lives in United Kingdom.	Laura is a designer.
neutral	Catherine lives in Japan.	Catherine is a firefighter.
neutral	Nancy lives in Russia.	Nancy is a librarian.
neutral	Harry lives in Poland.	Harry is a photographer.
neutral	Patrick lives in United States of America.	Patrick is a police officer.
neutral	Gary lives in Chile.	Gary is a professor.
neutral	Bruce lives in Vietnam.	Bruce is a scientist.
neutral	Frances lives in Pakistan.	Frances is a physician.
neutral	Sophie lives in Oman.	Sophie is an engineer.
neutral	Elaine lives in Maldives.	Elaine is a hairdresser.
neutral	Christine lives in Japan.	Christine is a professor.
neutral	Jason lives in Libya.	Jason is a police officer.
neutral	Pamela lives in Germany.	Pamela is a writer.
neutral	Emily lives in Ireland.	Emily is a designer.
neutral	Virginia lives in Japan.	Virginia is a judge.
neutral	Kenneth lives in Uruguay.	Kenneth is a journalist.
neutral	Jerry lives in Japan.	Jerry is a journalist.
neutral	Donna lives in Saudi Arabia.	Donna is a journalist.
neutral	Fred lives in Taiwan.	Fred is a hairdresser.
neutral	Bobby lives in Zimbabwe.	Bobby is a librarian.
neutral	Maria lives in Georgia.	Maria is a dentist.
neutral	Hugh lives in United Arab Emirates.	Hugh is a firefighter.
neutral	Kim lives in Canada.	Kim is a tailor.
neutral	Francis lives in Zimbabwe.	Francis is a tailor.
neutral	Carl lives in Italy.	Carl is an author.
neutral	Alfred lives in France.	Alfred is a farmer.
neutral	Edith lives in Ghana.	Edith is a mechanic.
neutral	Elaine lives in Ghana.	Elaine is an engineer.
neutral	Nancy lives in India.	Nancy is a cook.
neutral	Henry lives in Egypt.	Henry is a lawyer.
neutral	Ray lives in Ghana.	Ray is a lecturer.
neutral	Philip lives in Azerbaijan.	Philip is a tailor.
neutral	Linda lives in North Korea.	Linda is an artist.
neutral	Melissa lives in Brazil.	Melissa is a dietitian.
neutral	Sam lives in Philippines.	Sam is a writer.
neutral	Jerry lives in Russia.	Jerry is a plumber.
neutral	Susan lives in Cuba.	Susan is a scientist.
neutral	Dick lives in Azerbaijan.	Dick is a scientist.
neutral	Victoria lives in Malaysia.	Victoria is an architect.
neutral	Benjamin lives in Vietnam.	Benjamin is a police officer.
neutral	Judith lives in Libya.	Judith is a journalist.
neutral	Walter lives in Singapore.	Walter is a tailor.
neutral	Kathleen lives in Philippines.	Kathleen is a judge.
neutral	Eric lives in France.	Eric is an artist.
neutral	Kathleen lives in United Arab Emirates.	Kathleen is a dentist.
neutral	Anthony lives in Chile.	Anthony is a journalist.
neutral	Melissa lives in Afghanistan.	Melissa is an artist.
neutral	Brian lives in Nepal.	Brian is a photographer.
neutral	Eric lives in Nepal.	Eric is an artist.
neutral	Ann lives in Sweden.	Ann is a mechanic.
neutral	Louise lives in Libya.	Louise is a lecturer.
neutral	Evelyn lives in Poland.	Evelyn is an artist.
neutral	Scott lives in Israel.	Scott is an aviator.
neutral	Amy lives in Ireland.	Amy is a tailor.
neutral	George lives in Mexico.	George is an aviator.
neutral	Emma lives in Laos.	Emma is a librarian.
neutral	Catherine lives in Austria.	Catherine is a lawyer.
neutral	Jill lives in Switzerland.	Jill is a chef.
neutral	Benjamin lives in Bangladesh.	Benjamin is an electrician.
neutral	Mary lives in Argentina.	Mary is a lecturer.
neutral	Julie lives in Japan.	Julie is a chef.
neutral	Emily lives in Azerbaijan.	Emily is a chef.
neutral	Emma lives in Italy.	Emma is a librarian.
neutral	Judy lives in Laos.	Judy is a firefighter.
neutral	Louise lives in Ukraine.	Louise is a nurse.
neutral	Sara lives in Denmark.	Sara is an author.
neutral	Elaine lives in Ecuador.	Elaine is an aviator.
neutral	Ken lives in New Zealand.	Ken is a firefighter.
neutral	Harriet lives in Austria.	Harriet is a judge.
neutral	Jerry lives in Pakistan.	Jerry is an electrician.
neutral	Thomas lives in Afghanistan.	Thomas is an actor.
neutral	Katherine lives in Thailand.	Katherine is an architect.
neutral	Sandra lives in Greece.	Sandra is a writer.
neutral	Ann lives in South Korea.	Ann is a lecturer.
neutral	Al lives in Ukraine.	Al is an economist.
neutral	Sharon lives in Haiti.	Sharon is a firefighter.
neutral	Linda lives in Bhutan.	Linda is an aviator.
neutral	John lives in Sweden.	John is a firefighter.
neutral	Sara lives in Ukraine.	Sara is an aviator.
neutral	Eric lives in Georgia.	Eric is a lecturer.
neutral	Kim lives in United States of America.	Kim is a police officer.
neutral	Joan lives in Finland.	Joan is a butler.
neutral	Amanda lives in Belarus.	Amanda is a physician.
neutral	Harriet lives in Indonesia.	Harriet is a plumber.
neutral	Andrew lives in Bhutan.	Andrew is an author.
neutral	Bobby lives in South Korea.	Bobby is a physician.
neutral	Sarah lives in United Kingdom.	Sarah is a teacher.
neutral	Bob lives in Denmark.	Bob is a mechanic.
neutral	Victoria lives in Cuba.	Victoria is an electrician.
neutral	Dan lives in Switzerland.	Dan is a librarian.
neutral	Gary lives in Ghana.	Gary is a tailor.
neutral	Samuel lives in Bhutan.	Samuel is a dietitian.
neutral	Peter lives in Colombia.	Peter is an artist.
neutral	Suzanne lives in Brazil.	Suzanne is a plumber.
neutral	Edward lives in Denmark.	Edward is an economist.
neutral	Edith lives in Egypt.	Edith is a writer.
neutral	Anna lives in Chile.	Anna is a designer.
neutral	Sandra lives in United Kingdom.	Sandra is a professor.
neutral	Colin lives in Philippines.	Colin is a teacher.
neutral	Kevin lives in Libya.	Kevin is a librarian.
neutral	Ellen lives in Uruguay.	Ellen is a firefighter.
neutral	Carol lives in India.	Carol is an actor.
neutral	Mark lives in Iran.	Mark is an actor.
neutral	Andrea lives in Laos.	Andrea is a nurse.
neutral	Anthony lives in Iran.	Anthony is a hairdresser.
neutral	Laura lives in Portugal.	Laura is a secretary.
neutral	Walter lives in Australia.	Walter is a police officer.
neutral	Andrew lives in Azerbaijan.	Andrew is an accountant.
neutral	Bob lives in Uruguay.	Bob is a judge.
neutral	Alex lives in Portugal.	Alex is a judge.
neutral	Catherine lives in Nepal.	Catherine is an architect.
neutral	Maria lives in Austria.	Maria is a photographer.
neutral	Lynn lives in Portugal.	Lynn is a teacher.
neutral	Christopher lives in South Korea.	Christopher is a mechanic.
neutral	Fiona lives in Cuba.	Fiona is an accountant.
neutral	Eleanor lives in United Kingdom.	Eleanor is a dietitian.
neutral	Kevin lives in Poland.	Kevin is a journalist.
neutral	Sam lives in Libya.	Sam is a police officer.
neutral	Victoria lives in North Korea.	Victoria is an artist.
neutral	Keith lives in Egypt.	Keith is a journalist.
neutral	Sara lives in Libya.	Sara is a butler.
neutral	Hugh lives in Zimbabwe.	Hugh is an engineer.
neutral	Martha lives in Iceland.	Martha is a secretary.
neutral	Elizabeth lives in Bhutan.	Elizabeth is an architect.
neutral	Thomas lives in Azerbaijan.	Thomas is a secretary.
neutral	Harold lives in Haiti.	Harold is an engineer.
neutral	Emma lives in United Arab Emirates.	Emma is a journalist.
neutral	John lives in South Korea.	John is a lecturer.
neutral	Louis lives in South Korea.	Louis is a designer.
neutral	Linda lives in Turkey.	Linda is an architect.
neutral	Philip lives in Finland.	Philip is a cook.
neutral	Bill lives in Philippines.	Bill is an artist.
neutral	Nancy lives in Finland.	Nancy is a scientist.
neutral	Billy lives in Cuba.	Billy is a plumber.
neutral	Samuel lives in Laos.	Samuel is a chef.
neutral	Richard lives in United Arab Emirates.	Richard is an engineer.
neutral	Ralph lives in Philippines.	Ralph is a designer.
neutral	Frank lives in Australia.	Frank is a judge.
neutral	Nancy lives in Finland.	Nancy is a lawyer.
neutral	Virginia lives in Nepal.	Virginia is a firefighter.
neutral	Laura lives in Iran.	Laura is a cook.
neutral	Richard lives in Haiti.	Richard is an author.
neutral	Betty lives in Indonesia.	Betty is an accountant.
neutral	Wendy lives in Russia.	Wendy is a hairdresser.
neutral	Sharon lives in Maldives.	Sharon is a secretary.
neutral	Linda lives in Pakistan.	Linda is a firefighter.
neutral	Mike lives in Turkey.	Mike is a cook.
neutral	Sophie lives in Iran.	Sophie is a secretary.
neutral	Katie lives in Hungary.	Katie is an engineer.
neutral	Sara lives in Sweden.	Sara is a plumber.
neutral	William lives in Turkey.	William is a teacher.
neutral	Patricia lives in Saudi Arabia.	Patricia is a cook.
neutral	Peter lives in Azerbaijan.	Peter is a scientist.
neutral	Michelle lives in North Korea.	Michelle is an architect.
neutral	Kathryn lives in Brazil.	Kathryn is a chef.
neutral	Emma lives in Chile.	Emma is a lecturer.
neutral	Henry lives in Iraq.	Henry is a teacher.
neutral	Amy lives in Qatar.	Amy is a teacher.
neutral	Joseph lives in Ireland.	Joseph is a tailor.
neutral	Lisa lives in Maldives.	Lisa is a teacher.
neutral	Thomas lives in Greece.	Thomas is a secretary.
neutral	Diane lives in Vietnam.	Diane is an economist.
neutral	Donald lives in Indonesia.	Donald is an accountant.
neutral	Roy lives in Colombia.	Roy is an accountant.
neutral	Jean lives in France.	Jean is a physician.
neutral	Alison lives in Iceland.	Alison is an author.
neutral	Alice lives in Oman.	Alice is a professor.
neutral	Jane lives in Poland.	Jane is a nurse.
neutral	Stephanie lives in Ecuador.	Stephanie is a writer.
neutral	Leslie lives in Maldives.	Leslie is a farmer.
neutral	Ian lives in Cuba.	Ian is an electrician.
neutral	Greg lives in United Arab Emirates.	Greg is an accountant.
neutral	Kathy lives in Israel.	Kathy is an economist.
neutral	Roy lives in Ecuador.	Roy is an electrician.
neutral	Joan lives in Canada.	Joan is a lecturer.
neutral	Adam lives in Canada.	Adam is a butler.
neutral	Betty lives in Iraq.	Betty is a plumber.
neutral	Frank lives in United States of America.	Frank is a chef.
neutral	Joseph lives in Haiti.	Joseph is a firefighter.
neutral	Dick lives in China.	Dick is a physician.
neutral	Anne lives in Mexico.	Anne is an artist.
neutral	Andrea lives in Afghanistan.	Andrea is a firefighter.
neutral	Nicole lives in Ecuador.	Nicole is an author.
neutral	Ruth lives in Fiji.	Ruth is an author.
neutral	Alison lives in Belarus.	Alison is a butler.
neutral	Roger lives in Colombia.	Roger is an artist.
neutral	Christine lives in Ecuador.	Christine is a designer.
neutral	Mark lives in Maldives.	Mark is a cook.
neutral	Kevin lives in Israel.	Kevin is a professor.
neutral	Annie lives in Nepal.	Annie is a firefighter.
neutral	Richard lives in Bhutan.	Richard is a photographer.
neutral	Ashley lives in Austria.	Ashley is an author.
neutral	Bob lives in Belarus.	Bob is an electrician.
neutral	Howard lives in Sweden.	Howard is an actor.
neutral	Lauren lives in Australia.	Lauren is a mechanic.
neutral	Maria lives in South Korea.	Maria is an electrician.
neutral	Hugh lives in Haiti.	Hugh is a police officer.
neutral	Howard lives in Argentina.	Howard is a cook.
neutral	Amanda lives in France.	Amanda is an architect.
neutral	Roger lives in Georgia.	Roger is a librarian.
neutral	Lisa lives in Sweden.	Lisa is a butler.
neutral	Stephen lives in Netherlands.	Stephen is a designer.
neutral	Lisa lives in Indonesia.	Lisa is a judge.
neutral	Charlotte lives in Sweden.	Charlotte is a cook.
neutral	Ruth lives in Belarus.	Ruth is a cook.
neutral	Julie lives in Ukraine.	Julie is a professor.
neutral	Charlotte lives in Afghanistan.	Charlotte is an architect.
neutral	Alan lives in Singapore.	Alan is a teacher.
neutral	Matthew lives in Afghanistan.	Matthew is an engineer.
neutral	Betty lives in Iran.	Betty is a lecturer.
neutral	Alexandra lives in Oman.	Alexandra is an economist.
neutral	Kate lives in Iceland.	Kate is a dentist.
neutral	Larry lives in Haiti.	Larry is an aviator.
neutral	Christine lives in Zimbabwe.	Christine is a journalist.
neutral	Ashley lives in Iran.	Ashley is a hairdresser.
neutral	Colin lives in Iraq.	Colin is a teacher.
neutral	Wendy lives in United States of America.	Wendy is an economist.
neutral	Jerry lives in Fiji.	Jerry is a librarian.
neutral	Alex lives in United Kingdom.	Alex is an artist.
neutral	Thomas lives in China.	Thomas is a cook.
neutral	Elizabeth lives in China.	Elizabeth is a firefighter.
neutral	Harold lives in Nepal.	Harold is a lecturer.
neutral	Sharon lives in Ukraine.	Sharon is a photographer.
neutral	Edith lives in Chile.	Edith is a dentist.
neutral	Keith lives in Argentina.	Keith is an architect.
neutral	Julia lives in Ghana.	Julia is an artist.
neutral	George lives in Mexico.	George is an author.
neutral	Lauren lives in Maldives.	Lauren is a model.
neutral	Al lives in Uruguay.	Al is a lecturer.
neutral	Caroline lives in Russia.	Caroline is a farmer.
neutral	Judith lives in Belgium.	Judith is a photographer.
neutral	Frederick lives in Singapore.	Frederick is a hairdresser.
neutral	Martha lives in Australia.	Martha is a nurse.
neutral	Dave lives in Laos.	Dave is a firefighter.
neutral	Tom lives in Austria.	Tom is an accountant.
neutral	Sophie lives in Oman.	Sophie is a tailor.
neutral	Steven lives in Argentina.	Steven is a plumber.
neutral	Kathryn lives in Iran.	Kathryn is a physician.
neutral	Thomas lives in Chile.	Thomas is an aviator.
neutral	Jerry lives in Hungary.	Jerry is a lecturer.
neutral	Michelle lives in Chile.	Michelle is a lawyer.
neutral	Alex lives in New Zealand.	Alex is a photographer.
neutral	Jane lives in Qatar.	Jane is a writer.
neutral	Virginia lives in Portugal.	Virginia is an artist.
neutral	Patrick lives in Hungary.	Patrick is a designer.
neutral	Al lives in Nepal.	Al is an architect.
neutral	Cynthia lives in Philippines.	Cynthia is a chef.
neutral	Jim lives in Iceland.	Jim is a firefighter.
neutral	Steven lives in Italy.	Steven is a physician.
neutral	Albert lives in Brazil.	Albert is a tailor.
neutral	Robin lives in Ghana.	Robin is a mechanic.
neutral	Nicole lives in Bhutan.	Nicole is a photographer.
neutral	Alison lives in Saudi Arabia.	Alison is a tailor.
neutral	Jonathan lives in South Korea.	Jonathan is a lecturer.
neutral	Maria lives in Iraq.	Maria is an aviator.
neutral	Anne lives in Japan.	Anne is an accountant.
neutral	Sally lives in Netherlands.	Sally is a secretary.
neutral	Anne lives in Austria.	Anne is a librarian.
neutral	Daniel lives in Libya.	Daniel is a scientist.
neutral	Sally lives in Ghana.	Sally is a butler.
neutral	Donald lives in Nepal.	Donald is an architect.
neutral	Sara lives in Netherlands.	Sara is a physician.
neutral	Frank lives in United Kingdom.	Frank is an electrician.
neutral	Michelle lives in Brazil.	Michelle is a designer.
neutral	Donald lives in Turkey.	Donald is an artist.
neutral	Ben lives in United Arab Emirates.	Ben is an architect.
neutral	John lives in Greece.	John is a cook.
neutral	Harry lives in Chile.	Harry is a police officer.
neutral	Christopher lives in Philippines.	Christopher is an architect.
neutral	Betty lives in Switzerland.	Betty is a designer.
neutral	Marilyn lives in Ghana.	Marilyn is a scientist.
neutral	Judith lives in Colombia.	Judith is a hairdresser.
neutral	Steve lives in Bhutan.	Steve is a dentist.
neutral	Dave lives in Nepal.	Dave is a hairdresser.
neutral	Fred lives in Thailand.	Fred is an accountant.
neutral	Adam lives in Russia.	Adam is a photographer.
neutral	Linda lives in Poland.	Linda is a writer.
neutral	Stephen lives in Philippines.	Stephen is an electrician.
neutral	Sandra lives in Afghanistan.	Sandra is a professor.
neutral	Edwin lives in New Zealand.	Edwin is a physician.
neutral	Emma lives in Libya.	Emma is an author.
neutral	Daniel lives in United Arab Emirates.	Daniel is a journalist.
neutral	Andrea lives in Haiti.	Andrea is a police officer.
neutral	Edwin lives in Fiji.	Edwin is a firefighter.
neutral	Amy lives in Chile.	Amy is a lawyer.
neutral	Benjamin lives in Saudi Arabia.	Benjamin is a police officer.
neutral	Mark lives in Zimbabwe.	Mark is a butler.
neutral	Joseph lives in India.	Joseph is a tailor.
neutral	Sam lives in Italy.	Sam is a physician.
neutral	Frederick lives in Italy.	Frederick is an architect.
neutral	Katherine lives in United Arab Emirates.	Katherine is a butler.
neutral	Gary lives in Portugal.	Gary is a chef.
neutral	Joe lives in Taiwan.	Joe is a journalist.
neutral	Walter lives in Canada.	Walter is a writer.
neutral	Robin lives in Fiji.	Robin is a hairdresser.
neutral	Robert lives in Australia.	Robert is an actor.
neutral	Christine lives in Thailand.	Christine is an artist.
neutral	Michelle lives in Canada.	Michelle is a teacher.
neutral	Matt lives in Greece.	Matt is a farmer.
neutral	David lives in Ukraine.	David is a nurse.
neutral	Andrew lives in Japan.	Andrew is a lecturer.
neutral	Rebecca lives in Australia.	Rebecca is a teacher.
neutral	Scott lives in Qatar.	Scott is a model.
neutral	Jennifer lives in Azerbaijan.	Jennifer is a dietitian.
neutral	Charles lives in Singapore.	Charles is a tailor.
neutral	Anna lives in Poland.	Anna is a writer.
neutral	Leslie lives in Georgia.	Leslie is a police officer.
neutral	Frederick lives in Malaysia.	Frederick is a dentist.
neutral	Jane lives in Brazil.	Jane is a hairdresser.
neutral	Matt lives in Qatar.	Matt is a tailor.
neutral	Donald lives in Italy.	Donald is an electrician.
neutral	Nancy lives in Pakistan.	Nancy is a firefighter.
neutral	John lives in Denmark.	John is a cook.
neutral	Elaine lives in Thailand.	Elaine is a physician.
neutral	Bill lives in Poland.	Bill is an engineer.
neutral	Susan lives in Finland.	Susan is a dentist.
neutral	Sara lives in Australia.	Sara is a professor.
neutral	Ray lives in Thailand.	Ray is an electrician.
neutral	Linda lives in Iran.	Linda is a physician.
neutral	Lawrence lives in Austria.	Lawrence is a writer.
neutral	Martin lives in South Korea.	Martin is an accountant.
neutral	Roger lives in Ecuador.	Roger is a hairdresser.
neutral	Bobby lives in Iceland.	Bobby is a librarian.
neutral	Benjamin lives in Zimbabwe.	Benjamin is a scientist.
neutral	Joe lives in Laos.	Joe is a lawyer.
neutral	Brian lives in Russia.	Brian is a hairdresser.
neutral	Carl lives in Philippines.	Carl is a lecturer.
neutral	Marie lives in Switzerland.	Marie is a chef.
neutral	Ellen lives in Egypt.	Ellen is an actor.
neutral	Robert lives in Argentina.	Robert is an artist.
neutral	Anthony lives in Iran.	Anthony is a lecturer.
neutral	Eleanor lives in Belgium.	Eleanor is a writer.
neutral	David lives in Iceland.	David is a tailor.
neutral	Jonathan lives in Uruguay.	Jonathan is a chef.
neutral	Steven lives in Belgium.	Steven is a model.
neutral	Alex lives in Azerbaijan.	Alex is an artist.
neutral	Ralph lives in Australia.	Ralph is a scientist.
neutral	Louis lives in Switzerland.	Louis is a farmer.
neutral	Steve lives in Denmark.	Steve is a hairdresser.
neutral	Ellen lives in Japan.	Ellen is an artist.
neutral	Keith lives in Malaysia.	Keith is a cook.
neutral	Martha lives in Brazil.	Martha is a farmer.
neutral	Edward lives in Iceland.	Edward is a nurse.
neutral	Wendy lives in Portugal.	Wendy is an architect.
neutral	Julia lives in Malaysia.	Julia is a scientist.
neutral	Dick lives in Saudi Arabia.	Dick is an electrician.
neutral	Laura lives in North Korea.	Laura is a physician.
neutral	Louise lives in Afghanistan.	Louise is a dietitian.
neutral	Ellen lives in Thailand.	Ellen is an engineer.
neutral	Frank lives in Chile.	Frank is a lawyer.
neutral	Ryan lives in Fiji.	Ryan is a hairdresser.
neutral	Ryan lives in Israel.	Ryan is a plumber.
neutral	Karen lives in Fiji.	Karen is a lawyer.
neutral	Jason lives in Ireland.	Jason is an author.
neutral	Stephanie lives in Ireland.	Stephanie is an artist.
neutral	Albert lives in Iraq.	Albert is an actor.
neutral	Martha lives in Switzerland.	Martha is a secretary.
neutral	Charlotte lives in Egypt.	Charlotte is a teacher.
neutral	Claire lives in Oman.	Claire is a scientist.
neutral	Bob lives in Argentina.	Bob is a judge.
neutral	Peter lives in United States of America.	Peter is an engineer.
neutral	Charles lives in Saudi Arabia.	Charles is a lawyer.
neutral	Barbara lives in Switzerland.	Barbara is a mechanic.
neutral	Joan lives in Cuba.	Joan is a physician.
neutral	Judy lives in Chile.	Judy is an engineer.
neutral	Mike lives in Thailand.	Mike is an aviator.
neutral	Pamela lives in Bhutan.	Pamela is a plumber.
neutral	Stephen lives in Russia.	Stephen is an aviator.
neutral	Jimmy lives in Thailand.	Jimmy is an aviator.
neutral	Louis lives in Afghanistan.	Louis is a designer.
neutral	Michelle lives in United States of America.	Michelle is a judge.
neutral	Edwin lives in Finland.	Edwin is a dietitian.
neutral	Jason lives in Mexico.	Jason is a dietitian.
neutral	Dorothy lives in Chile.	Dorothy is a librarian.
neutral	Colin lives in Canada.	Colin is a butler.
neutral	Alice lives in Zimbabwe.	Alice is an economist.
neutral	Fred lives in Haiti.	Fred is an electrician.
neutral	Emma lives in Georgia.	Emma is a model.
neutral	Lisa lives in North Korea.	Lisa is an author.
neutral	Frederick lives in Sweden.	Frederick is a plumber.
neutral	Kathleen lives in United States of America.	Kathleen is a model.
neutral	Joan lives in Iceland.	Joan is a scientist.
neutral	Alex lives in Georgia.	Alex is a tailor.
neutral	Katherine lives in Ireland.	Katherine is a designer.
neutral	Benjamin lives in Colombia.	Benjamin is a dentist.
neutral	Jimmy lives in South Korea.	Jimmy is a journalist.
neutral	Michelle lives in Israel.	Michelle is a professor.
neutral	Rose lives in Chile.	Rose is a lawyer.
neutral	Cynthia lives in Cuba.	Cynthia is a police officer.
neutral	Chris lives in Colombia.	Chris is a firefighter.
neutral	Leslie lives in Germany.	Leslie is a teacher.
neutral	Sophie lives in Portugal.	Sophie is a secretary.
neutral	Sue lives in Netherlands.	Sue is an actor.
neutral	Jim lives in Saudi Arabia.	Jim is a police officer.
neutral	Chris lives in Maldives.	Chris is a physician.
neutral	Dan lives in New Zealand.	Dan is a tailor.
neutral	Susan lives in Bhutan.	Susan is a physician.
neutral	Carl lives in Bhutan.	Carl is a secretary.
neutral	Paul lives in China.	Paul is a model.
neutral	Susan lives in Colombia.	Susan is a judge.
neutral	Helen lives in Brazil.	Helen is a mechanic.
neutral	Anne lives in Austria.	Anne is a photographer.
neutral	Dan lives in Colombia.	Dan is a model.
neutral	Ed lives in Pakistan.	Ed is a physician.
neutral	Linda lives in Poland.	Linda is an architect.
neutral	Francis lives in Iraq.	Francis is a lawyer.
neutral	Victoria lives in China.	Victoria is an accountant.
neutral	Nicole lives in Poland.	Nicole is a butler.
neutral	Daniel lives in Italy.	Daniel is an aviator.
neutral	Katherine lives in Thailand.	Katherine is a butler.
neutral	Paul lives in Hungary.	Paul is a model.
neutral	Anthony lives in Poland.	Anthony is a secretary.
neutral	Philip lives in Nepal.	Philip is a nurse.
neutral	Bill lives in Egypt.	Bill is an aviator.
neutral	Henry lives in Turkey.	Henry is an aviator.
neutral	Ruth lives in Uruguay.	Ruth is an actor.
neutral	Ken lives in Georgia.	Ken is an actor.
neutral	Laura lives in Ukraine.	Laura is an economist.
neutral	Elaine lives in China.	Elaine is an electrician.
neutral	Charlotte lives in Haiti.	Charlotte is a judge.
neutral	Kim lives in Colombia.	Kim is a farmer.
neutral	Jonathan lives in Egypt.	Jonathan is a chef.
neutral	Albert lives in Chile.	Albert is a farmer.
neutral	Billy lives in Turkey.	Billy is a cook.
neutral	Diane lives in United Arab Emirates.	Diane is an architect.
