neutral	Louis lives in Ireland.	Louis is a journalist.
neutral	Diane lives in Belarus.	Diane is a photographer.
neutral	Judy lives in Denmark.	Judy is a dietitian.
neutral	Ashley lives in Austria.	Ashley is a police officer.
neutral	Betty lives in United Arab Emirates.	Betty is a professor.
neutral	Janet lives in Laos.	Janet is a police officer.
neutral	Edward lives in Laos.	Edward is an electrician.
neutral	Lucy lives in Singapore.	Lucy is a firefighter.
neutral	Helen lives in Philippines.	Helen is an electrician.
neutral	Dan lives in Greece.	Dan is an engineer.
neutral	John lives in United Kingdom.	John is a cook.
neutral	Greg lives in Singapore.	Greg is a firefighter.
neutral	Anne lives in Turkey.	Anne is a police officer.
neutral	Harriet lives in Uruguay.	Harriet is a designer.
neutral	Kelly lives in Argentina.	Kelly is a cook.
neutral	Betty lives in United States of America.	Betty is a writer.
neutral	Joan lives in United Arab Emirates.	Joan is a judge.
neutral	Dick lives in Bangladesh.	Dick is a mechanic.
neutral	Joan lives in Afghanistan.	Joan is a lecturer.
neutral	Stephen lives in Haiti.	Stephen is a cook.
neutral	Francis lives in Uruguay.	Francis is a chef.
neutral	Eleanor lives in Russia.	Eleanor is an architect.
neutral	Al lives in Singapore.	Al is a mechanic.
neutral	Sara lives in Japan.	Sara is a writer.
neutral	Dave lives in Iran.	Dave is a physician.
neutral	Suzanne lives in Uruguay.	Suzanne is a hairdresser.
neutral	Jennifer lives in Maldives.	Jennifer is a mechanic.
neutral	Donna lives in China.	Donna is a hairdresser.
neutral	Carol lives in Switzerland.	Carol is a teacher.
neutral	Jimmy lives in Afghanistan.	Jimmy is a librarian.
neutral	Jane lives in Belgium.	Jane is a judge.
neutral	David lives in Greece.	David is a dentist.
neutral	Brian lives in Germany.	Brian is a judge.
neutral	Alice lives in Ukraine.	Alice is a lecturer.
neutral	Dan lives in Zimbabwe.	Dan is a physician.
neutral	Charles lives in Turkey.	Charles is a dietitian.
neutral	George lives in Switzerland.	George is a model.
neutral	Harold lives in Bhutan.	Harold is a police officer.
neutral	Harold lives in China.	Harold is a photographer.
neutral	Johnny lives in Chile.	Johnny is a secretary.
neutral	Tim lives in Qatar.	Tim is a writer.
neutral	Richard lives in South Korea.	Richard is a teacher.
neutral	Louis lives in Greece.	Louis is an artist.
neutral	Mary lives in Georgia.	Mary is a lawyer.
neutral	Al lives in Greece.	Al is a dietitian.
neutral	Walter lives in Russia.	Walter is a farmer.
neutral	Frederick lives in Saudi Arabia.	Frederick is an author.
neutral	Larry lives in Thailand.	Larry is a nurse.
neutral	Robin lives in Haiti.	Robin is a plumber.
neutral	Ashley lives in Chile.	Ashley is a mechanic.
neutral	Jane lives in Singapore.	Jane is a scientist.
neutral	Kelly lives in Switzerland.	Kelly is a dentist.
neutral	Harold lives in Nepal.	Harold is an actor.
neutral	Kathryn lives in Bangladesh.	Kathryn is a dentist.
neutral	Julie lives in France.	Julie is a hairdresser.
neutral	Sue lives in China.	Sue is a butler.
neutral	Hugh lives in Fiji.	Hugh is a firefighter.
neutral	Gary lives in Afghanistan.	Gary is a photographer.
neutral	Christopher lives in South Korea.	Christopher is an architect.
neutral	Suzanne lives in Afghanistan.	Suzanne is a scientist.
neutral	Linda lives in Nepal.	Linda is an accountant.
neutral	Rachel lives in Finland.	Rachel is a hairdresser.
neutral	William lives in Belgium.	William is a hairdresser.
neutral	Leslie lives in United Arab Emirates.	Leslie is an actor.
neutral	Grace lives in Taiwan.	Grace is a police officer.
neutral	Florence lives in Saudi Arabia.	Florence is a cook.
neutral	Mary lives in South Korea.	Mary is a scientist.
neutral	Alice lives in Australia.	Alice is a mechanic.
neutral	Catherine lives in Libya.	Catherine is an architect.
neutral	Julia lives in Brazil.	Julia is a photographer.
neutral	Karen lives in India.	Karen is an accountant.
neutral	Eleanor lives in Mexico.	Eleanor is an architect.
neutral	Jack lives in Nepal.	Jack is a tailor.
neutral	Fred lives in Nepal.	Fred is a journalist.
neutral	Robin lives in Bangladesh.	Robin is an aviator.
neutral	Rose lives in Denmark.	Rose is a nurse.
neutral	Andrew lives in Canada.	Andrew is an engineer.
neutral	Rachel lives in Vietnam.	Rachel is a lecturer.
neutral	Matt lives in Switzerland.	Matt is an aviator.
neutral	Christopher lives in South Korea.	Christopher is a plumber.
neutral	Victoria lives in Taiwan.	Victoria is a physician.
neutral	Katie lives in Zimbabwe.	Katie is a chef.
neutral	Dan lives in Chile.	Dan is an aviator.
neutral	Bill lives in Poland.	Bill is a firefighter.
neutral	Barbara lives in China.	Barbara is a cook.
neutral	Ralph lives in South Korea.	Ralph is an accountant.
neutral	Ryan lives in Hungary.	Ryan is a journalist.
neutral	Sharon lives in Colombia.	Sharon is a judge.
neutral	Simon lives in China.	Simon is a professor.
neutral	Simon lives in Azerbaijan.	Simon is a farmer.
neutral	Carolyn lives in Belgium.	Carolyn is a mechanic.
neutral	Kenneth lives in Maldives.	Kenneth is an actor.
neutral	Dorothy lives in Uruguay.	Dorothy is a nurse.
neutral	Ralph lives in Vietnam.	Ralph is a model.
neutral	Joe lives in Vietnam.	Joe is a farmer.
neutral	Barbara lives in Haiti.	Barbara is an economist.
neutral	Ann lives in Denmark.	Ann is an electrician.
neutral	Mark lives in Switzerland.	Mark is a designer.
neutral	Thomas lives in Maldives.	Thomas is a hairdresser.
neutral	Anne lives in Colombia.	Anne is a secretary.
neutral	James lives in Taiwan.	James is a librarian.
neutral	Harriet lives in Maldives.	Harriet is an engineer.
neutral	Ellen lives in Colombia.	Ellen is a teacher.
neutral	Mike lives in Canada.	Mike is a firefighter.
neutral	Stephanie lives in Libya.	Stephanie is a firefighter.
neutral	Anna lives in Indonesia.	Anna is an engineer.
neutral	Anna lives in Thailand.	Anna is a firefighter.
neutral	Samuel lives in Netherlands.	Samuel is a nurse.
neutral	Kim lives in Vietnam.	Kim is an economist.
neutral	Linda lives in Turkey.	Linda is an engineer.
neutral	Patrick lives in Pakistan.	Patrick is a lecturer.
neutral	Ray lives in Chile.	Ray is a lawyer.
neutral	Alice lives in Italy.	Alice is a hairdresser.
neutral	Ryan lives in Cuba.	Ryan is an artist.
neutral	Margaret lives in Taiwan.	Margaret is an actor.
neutral	Walter lives in Fiji.	Walter is a photographer.
neutral	Dorothy lives in Oman.	Dorothy is a plumber.
neutral	Gary lives in Germany.	Gary is a tailor.
neutral	James lives in Russia.	James is a designer.
neutral	Billy lives in Greece.	Billy is a librarian.
neutral	Jennifer lives in Zimbabwe.	Jennifer is a judge.
neutral	Stephen lives in Laos.	Stephen is an artist.
neutral	Thomas lives in Greece.	Thomas is a dentist.
neutral	Jill lives in Russia.	Jill is a chef.
neutral	Cynthia lives in United States of America.	Cynthia is a model.
neutral	Charles lives in Cuba.	Charles is a scientist.
neutral	Steven lives in China.	Steven is a police officer.
neutral	Ron lives in North Korea.	Ron is a cook.
neutral	David lives in Bangladesh.	David is a dentist.
neutral	Amy lives in Azerbaijan.	Amy is a plumber.
neutral	Emily lives in Hungary.	Emily is an engineer.
neutral	Ian lives in Netherlands.	Ian is a designer.
neutral	Tim lives in Philippines.	Tim is a judge.
neutral	Robert lives in Azerbaijan.	Robert is a lawyer.
neutral	Elaine lives in Greece.	Elaine is an architect.
neutral	Kim lives in Maldives.	Kim is a lawyer.
neutral	Jeff lives in Bhutan.	Jeff is a lawyer.
neutral	Marilyn lives in North Korea.	Marilyn is a police officer.
neutral	Billy lives in Saudi Arabia.	Billy is a cook.
neutral	Sophie lives in Italy.	Sophie is an aviator.
neutral	Mark lives in Qatar.	Mark is a secretary.
neutral	Alex lives in United Kingdom.	Alex is a writer.
neutral	Robin lives in Maldives.	Robin is a lecturer.
neutral	Jonathan lives in Belgium.	Jonathan is a scientist.
neutral	Matt lives in Portugal.	Matt is an architect.
neutral	Ken lives in United Kingdom.	Ken is an engineer.
neutral	Cynthia lives in Israel.	Cynthia is a writer.
neutral	Dorothy lives in Fiji.	Dorothy is a lawyer.
neutral	Claire lives in Canada.	Claire is a chef.
neutral	Ray lives in Philippines.	Ray is a chef.
neutral	Victoria lives in United Kingdom.	Victoria is a writer.
neutral	Diane lives in Afghanistan.	Diane is a designer.
neutral	Janet lives in Qatar.	Janet is a journalist.
neutral	Ray lives in Italy.	Ray is a dietitian.
neutral	Amanda lives in Libya.	Amanda is a farmer.
neutral	Christopher lives in Argentina.	Christopher is a dentist.
neutral	Ben lives in Afghanistan.	Ben is an aviator.
neutral	Arthur lives in Indonesia.	Arthur is a chef.
neutral	Dave lives in Portugal.	Dave is a dietitian.
neutral	Ken lives in Egypt.	Ken is a dietitian.
neutral	Elaine lives in Georgia.	Elaine is a lawyer.
neutral	Florence lives in United Kingdom.	Florence is a mechanic.
neutral	Alice lives in Maldives.	Alice is an actor.
neutral	Jack lives in Ghana.	Jack is a judge.
neutral	Caroline lives in China.	Caroline is a journalist.
neutral	Ellen lives in Ukraine.	Ellen is a nurse.
neutral	David lives in Malaysia.	David is a writer.
neutral	Christine lives in Georgia.	Christine is a cook.
neutral	Nicole lives in Maldives.	Nicole is an artist.
neutral	Nick lives in Ukraine.	Nick is a police officer.
neutral	Anthony lives in Greece.	Anthony is a farmer.
neutral	Marie lives in Greece.	Marie is an architect.
neutral	Lauren lives in Australia.	Lauren is a professor.
neutral	Gary lives in Libya.	Gary is a photographer.
neutral	Michael lives in Haiti.	Michael is a plumber.
neutral	Kathryn lives in France.	Kathryn is a plumber.
neutral	Margaret lives in Italy.	Margaret is an accountant.
neutral	Heather lives in Oman.	Heather is an aviator.
neutral	Kim lives in Cuba.	Kim is a chef.
neutral	George lives in Indonesia.	George is a plumber.
neutral	Keith lives in Switzerland.	Keith is an actor.
neutral	Mike lives in United Arab Emirates.	Mike is an economist.
neutral	Rachel lives in Finland.	Rachel is an economist.
neutral	Eleanor lives in United Arab Emirates.	Eleanor is a photographer.
neutral	Frank lives in Qatar.	Frank is an engineer.
neutral	Harold lives in Uruguay.	Harold is an actor.
neutral	Charlie lives in Uruguay.	Charlie is a secretary.
neutral	Johnny lives in Sweden.	Johnny is a cook.
neutral	Al lives in Indonesia.	Al is a teacher.
neutral	Ken lives in Indonesia.	Ken is a tailor.
neutral	Emma lives in United Arab Emirates.	Emma is a nurse.
neutral	Judy lives in Germany.	Judy is a judge.
neutral	Karen lives in United Kingdom.	Karen is a farmer.
neutral	Rose lives in Iran.	Rose is a chef.
neutral	Ed lives in India.	Ed is a librarian.
neutral	Andrew lives in Denmark.	Andrew is a farmer.
neutral	Pamela lives in Turkey.	Pamela is a photographer.
neutral	Pamela lives in Argentina.	Pamela is a librarian.
neutral	David lives in United Kingdom.	David is an electrician.
neutral	Harry lives in Bangladesh.	Harry is a physician.
neutral	Ann lives in Switzerland.	Ann is a secretary.
neutral	Stephen lives in Australia.	Stephen is a police officer.
neutral	Marilyn lives in Sweden.	Marilyn is a photographer.
neutral	Eleanor lives in Zimbabwe.	Eleanor is a police officer.
neutral	Kelly lives in India.	Kelly is a cook.
neutral	Louise lives in Vietnam.	Louise is a professor.
neutral	Jill lives in Nepal.	Jill is a teacher.
neutral	Marilyn lives in Mexico.	Marilyn is a writer.
neutral	Amy lives in Bangladesh.	Amy is a dietitian.
neutral	Donald lives in Ireland.	Donald is a plumber.
neutral	Louis lives in Indonesia.	Louis is a chef.
neutral	Ruth lives in Bhutan.	Ruth is a professor.
neutral	Catherine lives in Indonesia.	Catherine is a police officer.
neutral	Helen lives in Israel.	Helen is a dietitian.
neutral	Lawrence lives in Sweden.	Lawrence is a writer.
neutral	Roy lives in Denmark.	Roy is a librarian.
neutral	Sam lives in Mexico.	Sam is a firefighter.
neutral	Robin lives in Iran.	Robin is a journalist.
neutral	Ashley lives in Iraq.	Ashley is a firefighter.
neutral	Steve lives in United Arab Emirates.	Steve is an actor.
neutral	Stephen lives in Italy.	Stephen is an engineer.
neutral	Eric lives in Colombia.	Eric is an architect.
neutral	Alice lives in Malaysia.	Alice is a librarian.
neutral	Jean lives in India.	Jean is a designer.
neutral	Simon lives in Ghana.	Simon is an engineer.
neutral	Anna lives in South Korea.	Anna is an artist.
neutral	John lives in Cuba.	John is an actor.
neutral	Lucy lives in Qatar.	Lucy is an accountant.
neutral	Chris lives in Afghanistan.	Chris is a designer.
neutral	Steven lives in Turkey.	Steven is an electrician.
neutral	Judy lives in Finland.	Judy is a hairdresser.
neutral	Katherine lives in Malaysia.	Katherine is a plumber.
neutral	Andrew lives in Sweden.	Andrew is a butler.
neutral	Janet lives in Afghanistan.	Janet is a judge.
neutral	Catherine lives in Maldives.	Catherine is a lecturer.
neutral	Jim lives in Maldives.	Jim is a nurse.
neutral	Kathy lives in Brazil.	Kathy is a chef.
neutral	Jane lives in Cuba.	Jane is an architect.
neutral	Amanda lives in Iran.	Amanda is a model.
neutral	Edith lives in Portugal.	Edith is a nurse.
neutral	Philip lives in Ukraine.	Philip is a nurse.
neutral	Janet lives in Pakistan.	Janet is a dentist.
neutral	Frederick lives in Austria.	Frederick is an author.
neutral	Stephen lives in Russia.	Stephen is a tailor.
neutral	James lives in Turkey.	James is a police officer.
neutral	Christine lives in Indonesia.	Christine is a designer.
neutral	Louise lives in Israel.	Louise is a dietitian.
neutral	Ben lives in United Kingdom.	Ben is a lecturer.
neutral	Don lives in Bhutan.	Don is a plumber.
neutral	Andrew lives in Libya.	Andrew is a butler.
neutral	Peter lives in Turkey.	Peter is a teacher.
neutral	Eleanor lives in Germany.	Eleanor is a teacher.
neutral	Jonathan lives in South Korea.	Jonathan is a nurse.
neutral	Martha lives in Finland.	Martha is a dietitian.
neutral	Jerry lives in Iran.	Jerry is a physician.
neutral	Sophie lives in Zimbabwe.	Sophie is a butler.
neutral	Gary lives in India.	Gary is a farmer.
neutral	Sara lives in United Kingdom.	Sara is an electrician.
neutral	Ruth lives in France.	Ruth is a hairdresser.
neutral	Karen lives in Cuba.	Karen is a judge.
neutral	Louis lives in Brazil.	Louis is a judge.
neutral	Ed lives in Pakistan.	Ed is a chef.
neutral	Bill lives in Vietnam.	Bill is a plumber.
neutral	Jill lives in Philippines.	Jill is an aviator.
neutral	Sharon lives in Zimbabwe.	Sharon is an engineer.
neutral	Suzanne lives in North Korea.	Suzanne is a hairdresser.
neutral	Ralph lives in Georgia.	Ralph is a mechanic.
neutral	Edwin lives in Zimbabwe.	Edwin is a tailor.
neutral	Dick lives in Italy.	Dick is a tailor.
neutral	Barbara lives in India.	Barbara is a secretary.
neutral	Andrea lives in Austria.	Andrea is a police officer.
neutral	Peter lives in China.	Peter is a dentist.
neutral	Claire lives in South Korea.	Claire is a nurse.
neutral	Victoria lives in Ukraine.	Victoria is a lawyer.
neutral	Ann lives in Greece.	Ann is a hairdresser.
neutral	Tim lives in Qatar.	Tim is a lawyer.
neutral	Kathleen lives in Azerbaijan.	Kathleen is an artist.
neutral	Roy lives in Indonesia.	Roy is a journalist.
neutral	Scott lives in Saudi Arabia.	Scott is a police officer.
neutral	Nick lives in Maldives.	Nick is a professor.
neutral	Simon lives in Georgia.	Simon is a mechanic.
neutral	Peter lives in Thailand.	Peter is a designer.
neutral	Tim lives in Chile.	Tim is a professor.
neutral	Howard lives in Malaysia.	Howard is an accountant.
neutral	Carl lives in Fiji.	Carl is a police officer.
neutral	Frances lives in United Kingdom.	Frances is a cook.
neutral	Emily lives in Haiti.	Emily is an economist.
neutral	Alice lives in Italy.	Alice is an author.
neutral	Kelly lives in Greece.	Kelly is an architect.
neutral	Helen lives in France.	Helen is a model.
neutral	George lives in Netherlands.	George is an actor.
neutral	Marilyn lives in Austria.	Marilyn is an author.
neutral	Virginia lives in Oman.	Virginia is a butler.
neutral	Sandra lives in Cuba.	Sandra is a nurse.
neutral	Tim lives in Ghana.	Tim is a designer.
neutral	Kenneth lives in Hungary.	Kenneth is an economist.
neutral	Evelyn lives in France.	Evelyn is an electrician.
neutral	Sally lives in United Arab Emirates.	Sally is a firefighter.
neutral	Wendy lives in Qatar.	Wendy is a judge.
neutral	Ed lives in Israel.	Ed is a designer.
neutral	Charlie lives in Azerbaijan.	Charlie is a firefighter.
neutral	Jill lives in Qatar.	Jill is a lecturer.
neutral	Florence lives in Iran.	Florence is an actor.
neutral	Tom lives in Colombia.	Tom is an accountant.
neutral	Amanda lives in Colombia.	Amanda is a tailor.
neutral	Sara lives in Colombia.	Sara is a hairdresser.
neutral	Anthony lives in United States of America.	Anthony is a tailor.
neutral	Thomas lives in Ukraine.	Thomas is a hairdresser.
neutral	Ed lives in Ireland.	Ed is a lawyer.
neutral	Lucy lives in Greece.	Lucy is a lawyer.
neutral	Amy lives in Ecuador.	Amy is a physician.
neutral	Jerry lives in Laos.	Jerry is an electrician.
neutral	Stephanie lives in Indonesia.	Stephanie is a teacher.
neutral	Jay lives in Cuba.	Jay is an electrician.
neutral	Lisa lives in Brazil.	Lisa is a dietitian.
neutral	Virginia lives in Switzerland.	Virginia is a physician.
neutral	Bruce lives in Afghanistan.	Bruce is an architect.
neutral	Martha lives in Zimbabwe.	Martha is a dietitian.
neutral	Deborah lives in Indonesia.	Deborah is a butler.
neutral	Jessica lives in United States of America.	Jessica is an aviator.
neutral	Harry lives in Indonesia.	Harry is an electrician.
neutral	Marie lives in United Kingdom.	Marie is a hairdresser.
neutral	Pamela lives in United States of America.	Pamela is an author.
neutral	Pamela lives in Egypt.	Pamela is a tailor.
neutral	Rose lives in Italy.	Rose is an electrician.
neutral	Sharon lives in Azerbaijan.	Sharon is an artist.
neutral	Andrea lives in Azerbaijan.	Andrea is a tailor.
neutral	Francis lives in Oman.	Francis is a judge.
neutral	Nicole lives in United Arab Emirates.	Nicole is a professor.
neutral	Anne lives in Indonesia.	Anne is a designer.
neutral	Jerry lives in Ukraine.	Jerry is a butler.
neutral	Stephen lives in Austria.	Stephen is a photographer.
neutral	Claire lives in Australia.	Claire is a dentist.
neutral	Virginia lives in Taiwan.	Virginia is an electrician.
neutral	Charlie lives in Nepal.	Charlie is a tailor.
neutral	Jack lives in New Zealand.	Jack is a plumber.
neutral	Jay lives in Brazil.	Jay is a lawyer.
neutral	Tom lives in Brazil.	Tom is a physician.
neutral	Katie lives in Vietnam.	Katie is a librarian.
neutral	Bill lives in Greece.	Bill is a professor.
neutral	Jennifer lives in North Korea.	Jennifer is an artist.
neutral	Adam lives in Philippines.	Adam is a dentist.
neutral	Philip lives in Canada.	Philip is an aviator.
neutral	Roger lives in Azerbaijan.	Roger is a tailor.
neutral	Martha lives in Portugal.	Martha is a mechanic.
neutral	Lauren lives in Nepal.	Lauren is an electrician.
neutral	Martha lives in Finland.	Martha is a writer.
neutral	Harold lives in Switzerland.	Harold is a dentist.
neutral	Joseph lives in Afghanistan.	Joseph is a hairdresser.
neutral	Billy lives in United States of America.	Billy is a professor.
neutral	Louise lives in Brazil.	Louise is a farmer.
neutral	Christine lives in Brazil.	Christine is a designer.
neutral	Fred lives in Bangladesh.	Fred is a physician.
neutral	Heather lives in Australia.	Heather is a designer.
neutral	Chris lives in Cuba.	Chris is a lecturer.
neutral	James lives in Iran.	James is a judge.
neutral	Charles lives in Iran.	Charles is an artist.
neutral	Jerry lives in Cuba.	Jerry is an engineer.
neutral	Ashley lives in Cuba.	Ashley is a dentist.
neutral	Nancy lives in Mexico.	Nancy is a plumber.
neutral	Tim lives in Pakistan.	Tim is a judge.
neutral	Deborah lives in Hungary.	Deborah is a chef.
neutral	Philip lives in Germany.	Philip is a dentist.
neutral	Bob lives in Portugal.	Bob is a lecturer.
neutral	Robert lives in Italy.	Robert is a lecturer.
neutral	Dave lives in Argentina.	Dave is a mechanic.
neutral	Robert lives in South Korea.	Robert is a librarian.
neutral	Eric lives in Portugal.	Eric is an actor.
neutral	Fred lives in New Zealand.	Fred is a photographer.
neutral	Brian lives in Mexico.	Brian is an actor.
neutral	Harold lives in Pakistan.	Harold is a photographer.
neutral	Melissa lives in Philippines.	Melissa is a secretary.
neutral	Ashley lives in Sweden.	Ashley is a cook.
neutral	Emma lives in Iraq.	Emma is a police officer.
neutral	Edward lives in Georgia.	Edward is a nurse.
neutral	Marie lives in Libya.	Marie is an actor.
neutral	Eric lives in Cuba.	Eric is a farmer.
neutral	Tom lives in Denmark.	Tom is a nurse.
neutral	Alan lives in Ireland.	Alan is a hairdresser.
neutral	Roger lives in Belgium.	Roger is a farmer.
neutral	Ben lives in Ukraine.	Ben is a mechanic.
neutral	Kate lives in Germany.	Kate is a photographer.
neutral	Samuel lives in Israel.	Samuel is a hairdresser.
neutral	Heather lives in Haiti.	Heather is a butler.
neutral	Michael lives in Bangladesh.	Michael is a plumber.
neutral	Ryan lives in Singapore.	Ryan is a mechanic.
neutral	Johnny lives in Cuba.	Johnny is a writer.
neutral	Kelly lives in Turkey.	Kelly is a designer.
neutral	Cynthia lives in Vietnam.	Cynthia is a lawyer.
neutral	Ryan lives in Thailand.	Ryan is a professor.
neutral	Jay lives in Canada.	Jay is an aviator.
neutral	Eleanor lives in United Kingdom.	Eleanor is a dietitian.
neutral	Ann lives in Ireland.	Ann is an engineer.
neutral	Bill lives in Pakistan.	Bill is a police officer.
neutral	Ann lives in Philippines.	Ann is a scientist.
neutral	Billy lives in Haiti.	Billy is an architect.
neutral	Don lives in Ecuador.	Don is an actor.
neutral	Eric lives in Canada.	Eric is a dentist.
neutral	Jack lives in Georgia.	Jack is a hairdresser.
neutral	Wendy lives in Brazil.	Wendy is an electrician.
neutral	Carol lives in Israel.	Carol is a plumber.
neutral	Sue lives in South Korea.	Sue is a lawyer.
neutral	Edwin lives in Laos.	Edwin is an economist.
neutral	Ruth lives in Sweden.	Ruth is a chef.
neutral	Rose lives in Canada.	Rose is an electrician.
neutral	Matthew lives in Philippines.	Matthew is a mechanic.
neutral	Frances lives in Iraq.	Frances is a plumber.
neutral	Keith lives in France.	Keith is a judge.
neutral	Colin lives in Singapore.	Colin is an artist.
neutral	Florence lives in Egypt.	Florence is a plumber.
neutral	Kim lives in North Korea.	Kim is an accountant.
neutral	Jessica lives in Netherlands.	Jessica is a cook.
neutral	Eleanor lives in Qatar.	Eleanor is a physician.
neutral	Sandra lives in Portugal.	Sandra is a lawyer.
neutral	Christine lives in Libya.	Christine is a secretary.
neutral	Michael lives in United States of America.	Michael is a model.
neutral	Alfred lives in Australia.	Alfred is a farmer.
neutral	Amy lives in Bhutan.	Amy is a police officer.
neutral	Charlie lives in France.	Charlie is a chef.
neutral	Rose lives in Switzerland.	Rose is a scientist.
neutral	James lives in Malaysia.	James is a cook.
neutral	Nancy lives in China.	Nancy is a tailor.
neutral	Marilyn lives in North Korea.	Marilyn is a hairdresser.
neutral	Joan lives in Finland.	Joan is a scientist.
neutral	Eleanor lives in Israel.	Eleanor is a chef.
neutral	Stephanie lives in Iraq.	Stephanie is a secretary.
neutral	Frederick lives in Germany.	Frederick is an actor.
neutral	Jane lives in United Kingdom.	Jane is a farmer.
neutral	Kathryn lives in Iran.	Kathryn is a secretary.
neutral	Barbara lives in Azerbaijan.	Barbara is a librarian.
neutral	Fred lives in Philippines.	Fred is a dentist.
neutral	John lives in Libya.	John is a dietitian.
neutral	Alexandra lives in Qatar.	Alexandra is a writer.
neutral	Walter lives in Switzerland.	Walter is an actor.
neutral	Alexandra lives in Finland.	Alexandra is an accountant.
neutral	Kathryn lives in Thailand.	Kathryn is a police officer.
neutral	Pamela lives in France.	Pamela is a physician.
neutral	Jean lives in Iceland.	Jean is a farmer.
neutral	Philip lives in Oman.	Philip is a professor.
neutral	Dorothy lives in Brazil.	Dorothy is a librarian.
neutral	Lynn lives in Japan.	Lynn is a physician.
neutral	Frederick lives in Chile.	Frederick is an architect.
neutral	Jack lives in Israel.	Jack is a butler.
neutral	Kate lives in India.	Kate is a mechanic.
neutral	Ashley lives in Ukraine.	Ashley is a butler.
neutral	Emma lives in Bhutan.	Emma is an economist.
neutral	Linda lives in Maldives.	Linda is a designer.
neutral	Adam lives in Ukraine.	Adam is a writer.
neutral	Anthony lives in Austria.	Anthony is a plumber.
neutral	Ralph lives in Brazil.	Ralph is a farmer.
neutral	Stephanie lives in Poland.	Stephanie is a mechanic.
neutral	Linda lives in Canada.	Linda is a scientist.
neutral	Carol lives in United Kingdom.	Carol is a chef.
neutral	Bobby lives in Sweden.	Bobby is an economist.
neutral	Alexander lives in Ghana.	Alexander is a journalist.
neutral	Ed lives in India.	Ed is a dentist.
neutral	Emma lives in Brazil.	Emma is a designer.
neutral	Heather lives in Sweden.	Heather is a photographer.
neutral	Kenneth lives in Fiji.	Kenneth is a photographer.
neutral	Jason lives in Oman.	Jason is an actor.
neutral	Hugh lives in Philippines.	Hugh is a dentist.
neutral	Virginia lives in Belarus.	Virginia is an artist.
neutral	Anthony lives in Portugal.	Anthony is an aviator.
neutral	Francis lives in Argentina.	Francis is a police officer.
neutral	Roy lives in Ecuador.	Roy is an electrician.
neutral	Ron lives in Singapore.	Ron is a chef.
neutral	Ron lives in Qatar.	Ron is a chef.
neutral	Adam lives in Maldives.	Adam is a professor.
neutral	Walter lives in Hungary.	Walter is an economist.
neutral	Katie lives in Denmark.	Katie is a librarian.
neutral	Kelly lives in Uruguay.	Kelly is an aviator.
neutral	Ann lives in Azerbaijan.	Ann is an accountant.
neutral	Larry lives in New Zealand.	Larry is a librarian.
neutral	Jane lives in Hungary.	Jane is an author.
neutral	Carolyn lives in Ukraine.	Carolyn is a police officer.
