neutral	Christopher lives in Zimbabwe.	Christopher is a hairdresser.
neutral	Mary lives in Azerbaijan.	Mary is a cook.
neutral	Ken lives in Maldives.	Ken is a farmer.
neutral	Jack lives in Austria.	Jack is a secretary.
neutral	Judith lives in Colombia.	Judith is an accountant.
neutral	Robert lives in Bangladesh.	Robert is a police officer.
neutral	Charlotte lives in Sweden.	Charlotte is a farmer.
neutral	Joan lives in Japan.	Joan is a model.
neutral	Martha lives in Pakistan.	Martha is an economist.
neutral	Susan lives in Bangladesh.	Susan is a plumber.
neutral	Harriet lives in China.	Harriet is a cook.
neutral	Harold lives in Poland.	Harold is a model.
neutral	Ralph lives in Australia.	Ralph is a dietitian.
neutral	Frederick lives in Chile.	Frederick is a dentist.
neutral	Jimmy lives in Egypt.	Jimmy is a scientist.
neutral	Carl lives in Portugal.	Carl is a firefighter.
neutral	Frank lives in Switzerland.	Frank is a secretary.
neutral	Walter lives in Libya.	Walter is an electrician.
neutral	Ralph lives in Iraq.	Ralph is a dentist.
neutral	Alison lives in Switzerland.	Alison is a cook.
neutral	Alex lives in United Kingdom.	Alex is a professor.
neutral	Frances lives in Ecuador.	Frances is a mechanic.
neutral	Ian lives in Fiji.	Ian is an aviator.
neutral	Julie lives in Uruguay.	Julie is a mechanic.
neutral	Simon lives in South Korea.	Simon is a nurse.
neutral	Martin lives in Azerbaijan.	Martin is a secretary.
neutral	Charlotte lives in Malaysia.	Charlotte is a professor.
neutral	Laura lives in Belgium.	Laura is a plumber.
neutral	Victoria lives in Italy.	Victoria is a professor.
neutral	Steven lives in Belarus.	Steven is a writer.
neutral	Lynn lives in Chile.	Lynn is a mechanic.
neutral	Alfred lives in Greece.	Alfred is a professor.
neutral	Roger lives in Hungary.	Roger is a cook.
neutral	Andrea lives in Indonesia.	Andrea is a dentist.
neutral	Charlie lives in Ghana.	Charlie is an economist.
neutral	Kate lives in Austria.	Kate is a journalist.
neutral	Patrick lives in Denmark.	Patrick is a cook.
neutral	Evelyn lives in Oman.	Evelyn is an economist.
neutral	Samuel lives in Singapore.	Samuel is a chef.
neutral	Stephanie lives in Afghanistan.	Stephanie is a judge.
neutral	Roger lives in Iraq.	Roger is a tailor.
neutral	Kelly lives in Brazil.	Kelly is a physician.
neutral	Eric lives in Iceland.	Eric is an electrician.
neutral	Sue lives in South Korea.	Sue is a dietitian.
neutral	Mary lives in Sweden.	Mary is a judge.
neutral	Christopher lives in Ghana.	Christopher is a farmer.
neutral	Diana lives in New Zealand.	Diana is a writer.
neutral	Kim lives in Japan.	Kim is a plumber.
neutral	Carolyn lives in Maldives.	Carolyn is a scientist.
neutral	Jennifer lives in China.	Jennifer is a teacher.
