contradiction	Lynn begins the game.	Lynn never begins the game.
contradiction	Stephen shows the presentation.	Stephen never shows the presentation.
contradiction	Eric uses the money.	Eric never uses the money.
contradiction	Daniel begins the game.	Daniel never begins the game.
contradiction	Peter makes paintings.	Peter never makes paintings.
contradiction	Sam works at office.	Sam never works at office.
contradiction	Greg sees the clock.	Greg never sees the clock.
contradiction	Benjamin finds the key.	Benjamin never finds the key.
contradiction	John helps the stranger.	John never helps the stranger.
contradiction	Peter runs a marathon.	Peter never runs a marathon.
contradiction	Alex thinks correctly.	Alex never thinks correctly.
contradiction	Grace tells the truth.	Grace never tells the truth.
contradiction	Sandra hears the announcement.	Sandra never hears the announcement.
contradiction	Barbara works at office.	Barbara never works at office.
contradiction	Frederick keeps the change.	Frederick never keeps the change.
contradiction	Johnny moves the table.	Johnny never moves the table.
contradiction	Fred shows the presentation.	Fred never shows the presentation.
contradiction	Carl likes football.	Carl never likes football.
contradiction	Victoria plays basketball.	Victoria never plays basketball.
contradiction	Bill tells the truth.	Bill never tells the truth.
contradiction	Leslie helps the stranger.	Leslie never helps the stranger.
contradiction	Alex talks nonsense.	Alex never talks nonsense.
contradiction	Anthony knows the solution.	Anthony never knows the solution.
contradiction	Stephanie knows the solution.	Stephanie never knows the solution.
contradiction	Louise runs a marathon.	Louise never runs a marathon.
contradiction	Adam moves the table.	Adam never moves the table.
contradiction	Evelyn shows the presentation.	Evelyn never shows the presentation.
contradiction	Anthony leaves the house.	Anthony never leaves the house.
contradiction	Melissa moves the table.	Melissa never moves the table.
contradiction	Al likes football.	Al never likes football.
contradiction	Jimmy talks nonsense.	Jimmy never talks nonsense.
contradiction	Keith begins the game.	Keith never begins the game.
contradiction	Jim begins the game.	Jim never begins the game.
contradiction	Matthew plays basketball.	Matthew never plays basketball.
contradiction	Florence calls the number.	Florence never calls the number.
contradiction	Diana uses the money.	Diana never uses the money.
contradiction	Ray uses the money.	Ray never uses the money.
contradiction	Bobby goes to school.	Bobby never goes to school.
contradiction	Harriet finds the key.	Harriet never finds the key.
contradiction	Katherine calls the number.	Katherine never calls the number.
contradiction	Rebecca moves the table.	Rebecca never moves the table.
contradiction	Harry asks the question.	Harry never asks the question.
contradiction	Jeff likes football.	Jeff never likes football.
contradiction	Emily sees the clock.	Emily never sees the clock.
contradiction	Ruth helps the stranger.	Ruth never helps the stranger.
contradiction	Ryan turns the light.	Ryan never turns the light.
contradiction	Johnny starts the match.	Johnny never starts the match.
contradiction	Jack asks the question.	Jack never asks the question.
contradiction	Jack makes paintings.	Jack never makes paintings.
contradiction	Carl keeps the change.	Carl never keeps the change.
contradiction	Gary asks the question.	Gary never asks the question.
contradiction	Eleanor runs a marathon.	Eleanor never runs a marathon.
contradiction	Carl asks the question.	Carl never asks the question.
contradiction	Frances moves the table.	Frances never moves the table.
contradiction	Kelly talks nonsense.	Kelly never talks nonsense.
contradiction	Nick hears the announcement.	Nick never hears the announcement.
contradiction	Carl uses the money.	Carl never uses the money.
contradiction	Philip talks nonsense.	Philip never talks nonsense.
contradiction	Ellen talks nonsense.	Ellen never talks nonsense.
contradiction	Bruce comes home.	Bruce never comes home.
contradiction	Billy comes home.	Billy never comes home.
contradiction	Johnny goes to school.	Johnny never goes to school.
contradiction	Emma sees the clock.	Emma never sees the clock.
contradiction	Leslie runs a marathon.	Leslie never runs a marathon.
contradiction	Judith knows the solution.	Judith never knows the solution.
contradiction	Mike begins the game.	Mike never begins the game.
contradiction	Charlie leaves the house.	Charlie never leaves the house.
contradiction	Ruth calls the number.	Ruth never calls the number.
contradiction	Andrea leaves the house.	Andrea never leaves the house.
contradiction	David finds the key.	David never finds the key.
contradiction	Charles leaves the house.	Charles never leaves the house.
contradiction	Nancy keeps the change.	Nancy never keeps the change.
contradiction	Bill starts the match.	Bill never starts the match.
contradiction	Ron sees the clock.	Ron never sees the clock.
contradiction	Florence gives the money.	Florence never gives the money.
contradiction	Fred sees the clock.	Fred never sees the clock.
contradiction	Howard says the truth.	Howard never says the truth.
contradiction	Sarah finds the key.	Sarah never finds the key.
contradiction	Lucy talks nonsense.	Lucy never talks nonsense.
contradiction	Ryan keeps the change.	Ryan never keeps the change.
contradiction	Rose calls the number.	Rose never calls the number.
contradiction	Dave goes to school.	Dave never goes to school.
contradiction	Michelle keeps the change.	Michelle never keeps the change.
contradiction	Sarah sees the clock.	Sarah never sees the clock.
contradiction	Walter asks the question.	Walter never asks the question.
contradiction	Albert shows the presentation.	Albert never shows the presentation.
contradiction	Patricia gives the money.	Patricia never gives the money.
contradiction	Lawrence makes paintings.	Lawrence never makes paintings.
contradiction	Al keeps the change.	Al never keeps the change.
contradiction	John helps the stranger.	John never helps the stranger.
contradiction	Tony leaves the house.	Tony never leaves the house.
contradiction	Al knows the solution.	Al never knows the solution.
contradiction	Robert calls the number.	Robert never calls the number.
contradiction	Fiona makes paintings.	Fiona never makes paintings.
contradiction	William shows the presentation.	William never shows the presentation.
contradiction	Lucy tells the truth.	Lucy never tells the truth.
contradiction	Virginia goes to school.	Virginia never goes to school.
contradiction	Mike talks nonsense.	Mike never talks nonsense.
contradiction	Charlotte sees the clock.	Charlotte never sees the clock.
contradiction	Sally moves the table.	Sally never moves the table.
contradiction	Karen keeps the change.	Karen never keeps the change.
contradiction	Bruce shows the presentation.	Bruce never shows the presentation.
contradiction	Donna helps the stranger.	Donna never helps the stranger.
contradiction	Frances turns the light.	Frances never turns the light.
contradiction	Lynn shows the presentation.	Lynn never shows the presentation.
contradiction	Hugh plays basketball.	Hugh never plays basketball.
contradiction	Ruth thinks correctly.	Ruth never thinks correctly.
contradiction	Scott tells the truth.	Scott never tells the truth.
contradiction	Ralph moves the table.	Ralph never moves the table.
contradiction	Joan moves the table.	Joan never moves the table.
contradiction	Anna feels sad.	Anna never feels sad.
contradiction	Evelyn plays basketball.	Evelyn never plays basketball.
contradiction	Julie makes paintings.	Julie never makes paintings.
contradiction	Walter uses the money.	Walter never uses the money.
contradiction	Jane uses the money.	Jane never uses the money.
contradiction	Heather feels sad.	Heather never feels sad.
contradiction	Angela makes paintings.	Angela never makes paintings.
contradiction	Amy moves the table.	Amy never moves the table.
contradiction	Anna keeps the change.	Anna never keeps the change.
contradiction	Deborah looks distressed.	Deborah never looks distressed.
contradiction	Alan hears the announcement.	Alan never hears the announcement.
contradiction	Gary likes football.	Gary never likes football.
contradiction	James leaves the house.	James never leaves the house.
contradiction	Charles shows the presentation.	Charles never shows the presentation.
contradiction	Rebecca hears the announcement.	Rebecca never hears the announcement.
contradiction	Lauren likes football.	Lauren never likes football.
contradiction	Evelyn feels sad.	Evelyn never feels sad.
contradiction	Anthony helps the stranger.	Anthony never helps the stranger.
contradiction	Sara moves the table.	Sara never moves the table.
contradiction	Emma hears the announcement.	Emma never hears the announcement.
contradiction	Evelyn uses the money.	Evelyn never uses the money.
contradiction	Ruth finds the key.	Ruth never finds the key.
contradiction	Richard calls the number.	Richard never calls the number.
contradiction	Jean finds the key.	Jean never finds the key.
contradiction	Ruth starts the match.	Ruth never starts the match.
contradiction	William likes football.	William never likes football.
contradiction	Martha works at office.	Martha never works at office.
contradiction	Donald finds the key.	Donald never finds the key.
contradiction	Carolyn feels sad.	Carolyn never feels sad.
contradiction	Sandra feels sad.	Sandra never feels sad.
contradiction	Lawrence keeps the change.	Lawrence never keeps the change.
contradiction	Brian thinks correctly.	Brian never thinks correctly.
contradiction	Dan runs a marathon.	Dan never runs a marathon.
contradiction	Tim gives the money.	Tim never gives the money.
contradiction	Roger thinks correctly.	Roger never thinks correctly.
contradiction	Alice finds the key.	Alice never finds the key.
contradiction	Nick shows the presentation.	Nick never shows the presentation.
contradiction	Carl tells the truth.	Carl never tells the truth.
contradiction	Jay hears the announcement.	Jay never hears the announcement.
contradiction	Ed tells the truth.	Ed never tells the truth.
contradiction	Wendy tells the truth.	Wendy never tells the truth.
contradiction	Julie thinks correctly.	Julie never thinks correctly.
contradiction	Marilyn asks the question.	Marilyn never asks the question.
contradiction	Carol turns the light.	Carol never turns the light.
contradiction	Francis shows the presentation.	Francis never shows the presentation.
contradiction	Mike leaves the house.	Mike never leaves the house.
contradiction	Nick hears the announcement.	Nick never hears the announcement.
contradiction	Robin turns the light.	Robin never turns the light.
contradiction	Jennifer shows the presentation.	Jennifer never shows the presentation.
contradiction	Ryan looks distressed.	Ryan never looks distressed.
contradiction	Dick leaves the house.	Dick never leaves the house.
contradiction	Benjamin leaves the house.	Benjamin never leaves the house.
contradiction	Ann helps the stranger.	Ann never helps the stranger.
contradiction	Tony gives the money.	Tony never gives the money.
contradiction	Linda knows the solution.	Linda never knows the solution.
contradiction	Ian goes to school.	Ian never goes to school.
contradiction	Annie gives the money.	Annie never gives the money.
contradiction	Lawrence runs a marathon.	Lawrence never runs a marathon.
contradiction	Ben begins the game.	Ben never begins the game.
contradiction	Caroline tells the truth.	Caroline never tells the truth.
contradiction	Martin turns the light.	Martin never turns the light.
contradiction	Maria helps the stranger.	Maria never helps the stranger.
contradiction	Edward finds the key.	Edward never finds the key.
contradiction	Karen likes football.	Karen never likes football.
contradiction	Ed asks the question.	Ed never asks the question.
contradiction	Sandra lives in a hostel.	Sandra never lives in a hostel.
contradiction	Nicole moves the table.	Nicole never moves the table.
contradiction	Kathleen likes football.	Kathleen never likes football.
contradiction	Tom hears the announcement.	Tom never hears the announcement.
contradiction	Frederick starts the match.	Frederick never starts the match.
contradiction	Colin feels sad.	Colin never feels sad.
contradiction	Steven gives the money.	Steven never gives the money.
contradiction	Jeff comes home.	Jeff never comes home.
contradiction	Jessica talks nonsense.	Jessica never talks nonsense.
contradiction	Dorothy thinks correctly.	Dorothy never thinks correctly.
contradiction	Kathryn gives the money.	Kathryn never gives the money.
contradiction	Jonathan keeps the change.	Jonathan never keeps the change.
contradiction	Kate keeps the change.	Kate never keeps the change.
contradiction	Claire feels sad.	Claire never feels sad.
contradiction	Donald looks distressed.	Donald never looks distressed.
contradiction	Stephanie talks nonsense.	Stephanie never talks nonsense.
contradiction	Charlie starts the match.	Charlie never starts the match.
contradiction	Diana keeps the change.	Diana never keeps the change.
contradiction	Kathryn sees the clock.	Kathryn never sees the clock.
contradiction	Jennifer looks distressed.	Jennifer never looks distressed.
contradiction	Fiona knows the solution.	Fiona never knows the solution.
contradiction	Walter starts the match.	Walter never starts the match.
contradiction	Betty runs a marathon.	Betty never runs a marathon.
contradiction	Diana comes home.	Diana never comes home.
contradiction	Jessica knows the solution.	Jessica never knows the solution.
contradiction	Florence says the truth.	Florence never says the truth.
contradiction	Kim helps the stranger.	Kim never helps the stranger.
contradiction	Edward runs a marathon.	Edward never runs a marathon.
contradiction	Billy gives the money.	Billy never gives the money.
contradiction	Evelyn hears the announcement.	Evelyn never hears the announcement.
contradiction	Dave thinks correctly.	Dave never thinks correctly.
contradiction	Kevin lives in a hostel.	Kevin never lives in a hostel.
contradiction	Jay comes home.	Jay never comes home.
contradiction	Tom runs a marathon.	Tom never runs a marathon.
contradiction	Alexander gives the money.	Alexander never gives the money.
contradiction	Jeff asks the question.	Jeff never asks the question.
contradiction	Christopher calls the number.	Christopher never calls the number.
contradiction	Jeff makes paintings.	Jeff never makes paintings.
contradiction	Elizabeth comes home.	Elizabeth never comes home.
contradiction	Colin turns the light.	Colin never turns the light.
contradiction	Kelly says the truth.	Kelly never says the truth.
contradiction	Joan runs a marathon.	Joan never runs a marathon.
contradiction	Andrea feels sad.	Andrea never feels sad.
contradiction	Jessica calls the number.	Jessica never calls the number.
contradiction	Dorothy moves the table.	Dorothy never moves the table.
contradiction	Ben likes football.	Ben never likes football.
contradiction	Paul works at office.	Paul never works at office.
contradiction	Jim keeps the change.	Jim never keeps the change.
contradiction	Ryan likes football.	Ryan never likes football.
contradiction	Alice moves the table.	Alice never moves the table.
contradiction	Amanda sees the clock.	Amanda never sees the clock.
contradiction	Bruce turns the light.	Bruce never turns the light.
contradiction	Sophie says the truth.	Sophie never says the truth.
contradiction	Tim comes home.	Tim never comes home.
contradiction	Brian finds the key.	Brian never finds the key.
contradiction	Paul turns the light.	Paul never turns the light.
contradiction	Harry leaves the house.	Harry never leaves the house.
contradiction	Jim comes home.	Jim never comes home.
contradiction	Johnny sees the clock.	Johnny never sees the clock.
contradiction	Joan finds the key.	Joan never finds the key.
contradiction	Michelle plays basketball.	Michelle never plays basketball.
contradiction	Judith talks nonsense.	Judith never talks nonsense.
contradiction	Bobby asks the question.	Bobby never asks the question.
contradiction	Matt shows the presentation.	Matt never shows the presentation.
contradiction	Eric tells the truth.	Eric never tells the truth.
contradiction	Fiona begins the game.	Fiona never begins the game.
contradiction	Chris plays basketball.	Chris never plays basketball.
contradiction	Edith keeps the change.	Edith never keeps the change.
contradiction	Tony keeps the change.	Tony never keeps the change.
contradiction	Jean runs a marathon.	Jean never runs a marathon.
contradiction	Philip lives in a hostel.	Philip never lives in a hostel.
contradiction	Judy gives the money.	Judy never gives the money.
contradiction	Colin finds the key.	Colin never finds the key.
contradiction	Lucy moves the table.	Lucy never moves the table.
contradiction	Benjamin thinks correctly.	Benjamin never thinks correctly.
contradiction	Angela helps the stranger.	Angela never helps the stranger.
contradiction	Anne turns the light.	Anne never turns the light.
contradiction	Albert comes home.	Albert never comes home.
contradiction	Ashley lives in a hostel.	Ashley never lives in a hostel.
contradiction	Sophie calls the number.	Sophie never calls the number.
contradiction	Joe moves the table.	Joe never moves the table.
contradiction	Frances finds the key.	Frances never finds the key.
contradiction	Dave knows the solution.	Dave never knows the solution.
contradiction	Lisa comes home.	Lisa never comes home.
contradiction	Jessica tells the truth.	Jessica never tells the truth.
contradiction	Catherine shows the presentation.	Catherine never shows the presentation.
contradiction	Eric makes paintings.	Eric never makes paintings.
contradiction	Larry calls the number.	Larry never calls the number.
contradiction	Angela begins the game.	Angela never begins the game.
contradiction	Philip works at office.	Philip never works at office.
contradiction	Annie begins the game.	Annie never begins the game.
contradiction	Johnny uses the money.	Johnny never uses the money.
contradiction	Steve tells the truth.	Steve never tells the truth.
contradiction	Peter makes paintings.	Peter never makes paintings.
contradiction	Johnny works at office.	Johnny never works at office.
contradiction	Emma works at office.	Emma never works at office.
contradiction	Kevin looks distressed.	Kevin never looks distressed.
contradiction	Howard hears the announcement.	Howard never hears the announcement.
contradiction	Dan calls the number.	Dan never calls the number.
contradiction	Andrea says the truth.	Andrea never says the truth.
contradiction	Linda leaves the house.	Linda never leaves the house.
contradiction	George plays basketball.	George never plays basketball.
contradiction	Emma lives in a hostel.	Emma never lives in a hostel.
contradiction	Jerry finds the key.	Jerry never finds the key.
contradiction	Chris plays basketball.	Chris never plays basketball.
contradiction	Roger tells the truth.	Roger never tells the truth.
contradiction	Catherine goes to school.	Catherine never goes to school.
contradiction	Michael thinks correctly.	Michael never thinks correctly.
contradiction	Rose feels sad.	Rose never feels sad.
contradiction	Edith turns the light.	Edith never turns the light.
contradiction	Barbara starts the match.	Barbara never starts the match.
contradiction	Albert looks distressed.	Albert never looks distressed.
contradiction	Margaret works at office.	Margaret never works at office.
contradiction	Lucy begins the game.	Lucy never begins the game.
contradiction	Christopher gives the money.	Christopher never gives the money.
contradiction	Anna works at office.	Anna never works at office.
contradiction	Emily leaves the house.	Emily never leaves the house.
contradiction	Jessica feels sad.	Jessica never feels sad.
contradiction	Jane runs a marathon.	Jane never runs a marathon.
contradiction	James starts the match.	James never starts the match.
contradiction	Donna says the truth.	Donna never says the truth.
contradiction	Karen leaves the house.	Karen never leaves the house.
contradiction	Bruce sees the clock.	Bruce never sees the clock.
contradiction	Fiona talks nonsense.	Fiona never talks nonsense.
contradiction	Diane finds the key.	Diane never finds the key.
contradiction	Lawrence runs a marathon.	Lawrence never runs a marathon.
contradiction	Scott runs a marathon.	Scott never runs a marathon.
contradiction	Frank turns the light.	Frank never turns the light.
contradiction	Judy talks nonsense.	Judy never talks nonsense.
contradiction	Caroline gives the money.	Caroline never gives the money.
contradiction	Tim sees the clock.	Tim never sees the clock.
contradiction	Richard feels sad.	Richard never feels sad.
contradiction	Chris turns the light.	Chris never turns the light.
contradiction	Johnny works at office.	Johnny never works at office.
contradiction	Grace goes to school.	Grace never goes to school.
contradiction	Dave starts the match.	Dave never starts the match.
contradiction	Alexander thinks correctly.	Alexander never thinks correctly.
contradiction	Emily works at office.	Emily never works at office.
contradiction	Tony leaves the house.	Tony never leaves the house.
contradiction	Alice helps the stranger.	Alice never helps the stranger.
contradiction	Bob tells the truth.	Bob never tells the truth.
contradiction	Elaine looks distressed.	Elaine never looks distressed.
contradiction	Jane goes to school.	Jane never goes to school.
contradiction	Helen uses the money.	Helen never uses the money.
contradiction	Brian goes to school.	Brian never goes to school.
contradiction	Dan helps the stranger.	Dan never helps the stranger.
contradiction	Sara plays basketball.	Sara never plays basketball.
contradiction	Arthur gives the money.	Arthur never gives the money.
contradiction	Edwin leaves the house.	Edwin never leaves the house.
contradiction	Dick hears the announcement.	Dick never hears the announcement.
contradiction	Alan finds the key.	Alan never finds the key.
contradiction	Dave calls the number.	Dave never calls the number.
contradiction	Kenneth begins the game.	Kenneth never begins the game.
contradiction	Laura feels sad.	Laura never feels sad.
contradiction	Eric keeps the change.	Eric never keeps the change.
contradiction	Anthony begins the game.	Anthony never begins the game.
contradiction	Charles shows the presentation.	Charles never shows the presentation.
contradiction	Eric asks the question.	Eric never asks the question.
contradiction	Sara tells the truth.	Sara never tells the truth.
contradiction	Jim helps the stranger.	Jim never helps the stranger.
contradiction	Judy looks distressed.	Judy never looks distressed.
contradiction	Elizabeth calls the number.	Elizabeth never calls the number.
contradiction	Ashley begins the game.	Ashley never begins the game.
contradiction	Eleanor talks nonsense.	Eleanor never talks nonsense.
contradiction	Frederick shows the presentation.	Frederick never shows the presentation.
contradiction	Annie says the truth.	Annie never says the truth.
contradiction	Charlie sees the clock.	Charlie never sees the clock.
contradiction	Cynthia starts the match.	Cynthia never starts the match.
contradiction	Tony lives in a hostel.	Tony never lives in a hostel.
contradiction	Edward looks distressed.	Edward never looks distressed.
contradiction	Jay likes football.	Jay never likes football.
contradiction	Andrea talks nonsense.	Andrea never talks nonsense.
contradiction	Eleanor keeps the change.	Eleanor never keeps the change.
contradiction	Jason runs a marathon.	Jason never runs a marathon.
contradiction	William talks nonsense.	William never talks nonsense.
contradiction	Mike thinks correctly.	Mike never thinks correctly.
contradiction	Janet tells the truth.	Janet never tells the truth.
contradiction	Sophie sees the clock.	Sophie never sees the clock.
contradiction	Dick says the truth.	Dick never says the truth.
contradiction	Samuel turns the light.	Samuel never turns the light.
contradiction	Elizabeth talks nonsense.	Elizabeth never talks nonsense.
contradiction	Rebecca leaves the house.	Rebecca never leaves the house.
contradiction	Rose makes paintings.	Rose never makes paintings.
contradiction	Chris sees the clock.	Chris never sees the clock.
contradiction	Sarah goes to school.	Sarah never goes to school.
contradiction	Alexandra goes to school.	Alexandra never goes to school.
contradiction	Carol asks the question.	Carol never asks the question.
contradiction	Edwin uses the money.	Edwin never uses the money.
contradiction	Jack keeps the change.	Jack never keeps the change.
contradiction	Harry looks distressed.	Harry never looks distressed.
contradiction	Bruce knows the solution.	Bruce never knows the solution.
contradiction	Eleanor calls the number.	Eleanor never calls the number.
contradiction	Andrew starts the match.	Andrew never starts the match.
contradiction	Steve plays basketball.	Steve never plays basketball.
contradiction	Kathy runs a marathon.	Kathy never runs a marathon.
contradiction	Francis thinks correctly.	Francis never thinks correctly.
contradiction	Alexandra shows the presentation.	Alexandra never shows the presentation.
contradiction	Jeff runs a marathon.	Jeff never runs a marathon.
contradiction	Tony talks nonsense.	Tony never talks nonsense.
contradiction	Pamela looks distressed.	Pamela never looks distressed.
contradiction	Dorothy looks distressed.	Dorothy never looks distressed.
contradiction	Barbara comes home.	Barbara never comes home.
contradiction	Andrew begins the game.	Andrew never begins the game.
contradiction	Jim starts the match.	Jim never starts the match.
contradiction	Pamela finds the key.	Pamela never finds the key.
contradiction	Anna goes to school.	Anna never goes to school.
contradiction	Catherine likes football.	Catherine never likes football.
contradiction	David talks nonsense.	David never talks nonsense.
contradiction	Emma gives the money.	Emma never gives the money.
contradiction	Christine thinks correctly.	Christine never thinks correctly.
