contradiction	Evelyn works at office.	Evelyn never works at office.
contradiction	Keith finds the key.	Keith never finds the key.
contradiction	Ruth gives the money.	Ruth never gives the money.
contradiction	Arthur works at office.	Arthur never works at office.
contradiction	Kate starts the match.	Kate never starts the match.
contradiction	Alison lives in a hostel.	Alison never lives in a hostel.
contradiction	Bob says the truth.	Bob never says the truth.
contradiction	Ralph knows the solution.	Ralph never knows the solution.
contradiction	Alice leaves the house.	Alice never leaves the house.
contradiction	Lucy likes football.	Lucy never likes football.
contradiction	Helen begins the game.	Helen never begins the game.
contradiction	Julie thinks correctly.	Julie never thinks correctly.
contradiction	Joseph tells the truth.	Joseph never tells the truth.
contradiction	Martha calls the number.	Martha never calls the number.
contradiction	Arthur runs a marathon.	Arthur never runs a marathon.
contradiction	Eric gives the money.	Eric never gives the money.
contradiction	Thomas knows the solution.	Thomas never knows the solution.
contradiction	Elaine runs a marathon.	Elaine never runs a marathon.
contradiction	Bobby moves the table.	Bobby never moves the table.
contradiction	Ron thinks correctly.	Ron never thinks correctly.
contradiction	Paul tells the truth.	Paul never tells the truth.
contradiction	Johnny starts the match.	Johnny never starts the match.
contradiction	Alfred helps the stranger.	Alfred never helps the stranger.
contradiction	Jessica leaves the house.	Jessica never leaves the house.
contradiction	Edwin tells the truth.	Edwin never tells the truth.
contradiction	Amanda leaves the house.	Amanda never leaves the house.
contradiction	Joan gives the money.	Joan never gives the money.
contradiction	Charlotte calls the number.	Charlotte never calls the number.
contradiction	William says the truth.	William never says the truth.
contradiction	Howard thinks correctly.	Howard never thinks correctly.
contradiction	John likes football.	John never likes football.
contradiction	Joe works at office.	Joe never works at office.
contradiction	Kevin looks distressed.	Kevin never looks distressed.
contradiction	Albert works at office.	Albert never works at office.
contradiction	Jim calls the number.	Jim never calls the number.
contradiction	Jessica leaves the house.	Jessica never leaves the house.
contradiction	Brian says the truth.	Brian never says the truth.
contradiction	Judy makes paintings.	Judy never makes paintings.
contradiction	Ken makes paintings.	Ken never makes paintings.
contradiction	Eleanor asks the question.	Eleanor never asks the question.
contradiction	Brian shows the presentation.	Brian never shows the presentation.
contradiction	Lauren moves the table.	Lauren never moves the table.
contradiction	Andrea looks distressed.	Andrea never looks distressed.
contradiction	Diana knows the solution.	Diana never knows the solution.
contradiction	Carol uses the money.	Carol never uses the money.
contradiction	Charles begins the game.	Charles never begins the game.
contradiction	Carolyn talks nonsense.	Carolyn never talks nonsense.
contradiction	Nancy makes paintings.	Nancy never makes paintings.
contradiction	Carolyn plays basketball.	Carolyn never plays basketball.
contradiction	Bill comes home.	Bill never comes home.
contradiction	Claire leaves the house.	Claire never leaves the house.
contradiction	Jennifer hears the announcement.	Jennifer never hears the announcement.
contradiction	Dave turns the light.	Dave never turns the light.
contradiction	Laura likes football.	Laura never likes football.
contradiction	Alexandra helps the stranger.	Alexandra never helps the stranger.
contradiction	Heather sees the clock.	Heather never sees the clock.
contradiction	Diana turns the light.	Diana never turns the light.
contradiction	Richard knows the solution.	Richard never knows the solution.
contradiction	Sara thinks correctly.	Sara never thinks correctly.
contradiction	Angela knows the solution.	Angela never knows the solution.
contradiction	Angela finds the key.	Angela never finds the key.
contradiction	Rachel begins the game.	Rachel never begins the game.
contradiction	Jim keeps the change.	Jim never keeps the change.
contradiction	Hugh talks nonsense.	Hugh never talks nonsense.
contradiction	Matt finds the key.	Matt never finds the key.
contradiction	Ed plays basketball.	Ed never plays basketball.
contradiction	Ruth helps the stranger.	Ruth never helps the stranger.
contradiction	Joseph begins the game.	Joseph never begins the game.
contradiction	Tony sees the clock.	Tony never sees the clock.
contradiction	Greg comes home.	Greg never comes home.
contradiction	Sophie goes to school.	Sophie never goes to school.
contradiction	Sophie helps the stranger.	Sophie never helps the stranger.
contradiction	Jerry helps the stranger.	Jerry never helps the stranger.
contradiction	Roy goes to school.	Roy never goes to school.
contradiction	Catherine looks distressed.	Catherine never looks distressed.
contradiction	Johnny sees the clock.	Johnny never sees the clock.
contradiction	Roger turns the light.	Roger never turns the light.
contradiction	Louis knows the solution.	Louis never knows the solution.
contradiction	Dick works at office.	Dick never works at office.
contradiction	Jonathan says the truth.	Jonathan never says the truth.
contradiction	Karen hears the announcement.	Karen never hears the announcement.
contradiction	Bill helps the stranger.	Bill never helps the stranger.
contradiction	Bobby keeps the change.	Bobby never keeps the change.
contradiction	Mark says the truth.	Mark never says the truth.
contradiction	Charlie uses the money.	Charlie never uses the money.
contradiction	Jeff leaves the house.	Jeff never leaves the house.
contradiction	Amanda tells the truth.	Amanda never tells the truth.
contradiction	Edwin says the truth.	Edwin never says the truth.
contradiction	David uses the money.	David never uses the money.
contradiction	Carol goes to school.	Carol never goes to school.
contradiction	Mike hears the announcement.	Mike never hears the announcement.
contradiction	Dave hears the announcement.	Dave never hears the announcement.
contradiction	Kathryn sees the clock.	Kathryn never sees the clock.
contradiction	Grace runs a marathon.	Grace never runs a marathon.
contradiction	Jason leaves the house.	Jason never leaves the house.
contradiction	Julie plays basketball.	Julie never plays basketball.
contradiction	Kenneth moves the table.	Kenneth never moves the table.
contradiction	Henry says the truth.	Henry never says the truth.
contradiction	Kelly goes to school.	Kelly never goes to school.
contradiction	Carolyn looks distressed.	Carolyn never looks distressed.
contradiction	Tom feels sad.	Tom never feels sad.
contradiction	Carolyn helps the stranger.	Carolyn never helps the stranger.
contradiction	Steve says the truth.	Steve never says the truth.
contradiction	Alison hears the announcement.	Alison never hears the announcement.
contradiction	Joan asks the question.	Joan never asks the question.
contradiction	Cynthia runs a marathon.	Cynthia never runs a marathon.
contradiction	Rachel lives in a hostel.	Rachel never lives in a hostel.
contradiction	Grace makes paintings.	Grace never makes paintings.
contradiction	Thomas runs a marathon.	Thomas never runs a marathon.
contradiction	George starts the match.	George never starts the match.
contradiction	Sally knows the solution.	Sally never knows the solution.
contradiction	Tony uses the money.	Tony never uses the money.
contradiction	Tony helps the stranger.	Tony never helps the stranger.
contradiction	Dick calls the number.	Dick never calls the number.
contradiction	Lucy plays basketball.	Lucy never plays basketball.
contradiction	Andrea comes home.	Andrea never comes home.
contradiction	Virginia begins the game.	Virginia never begins the game.
contradiction	Christine goes to school.	Christine never goes to school.
contradiction	David turns the light.	David never turns the light.
contradiction	Jay asks the question.	Jay never asks the question.
contradiction	Scott thinks correctly.	Scott never thinks correctly.
contradiction	Nancy asks the question.	Nancy never asks the question.
contradiction	Lynn gives the money.	Lynn never gives the money.
contradiction	Charlotte tells the truth.	Charlotte never tells the truth.
contradiction	Colin says the truth.	Colin never says the truth.
contradiction	Nicole looks distressed.	Nicole never looks distressed.
contradiction	Claire works at office.	Claire never works at office.
contradiction	Don lives in a hostel.	Don never lives in a hostel.
contradiction	Kathy likes football.	Kathy never likes football.
contradiction	John hears the announcement.	John never hears the announcement.
contradiction	Lucy helps the stranger.	Lucy never helps the stranger.
contradiction	Eric sees the clock.	Eric never sees the clock.
contradiction	Sue goes to school.	Sue never goes to school.
contradiction	Victoria keeps the change.	Victoria never keeps the change.
contradiction	Judith asks the question.	Judith never asks the question.
contradiction	George goes to school.	George never goes to school.
contradiction	Susan likes football.	Susan never likes football.
contradiction	Edward uses the money.	Edward never uses the money.
contradiction	Ashley starts the match.	Ashley never starts the match.
contradiction	Lynn gives the money.	Lynn never gives the money.
contradiction	Steve makes paintings.	Steve never makes paintings.
contradiction	Frederick uses the money.	Frederick never uses the money.
contradiction	Katherine leaves the house.	Katherine never leaves the house.
contradiction	Alan hears the announcement.	Alan never hears the announcement.
contradiction	Steven uses the money.	Steven never uses the money.
contradiction	Eleanor makes paintings.	Eleanor never makes paintings.
contradiction	Lynn says the truth.	Lynn never says the truth.
contradiction	Alex finds the key.	Alex never finds the key.
contradiction	Kathy feels sad.	Kathy never feels sad.
contradiction	Anne looks distressed.	Anne never looks distressed.
contradiction	Cynthia looks distressed.	Cynthia never looks distressed.
contradiction	Anne feels sad.	Anne never feels sad.
contradiction	Kenneth thinks correctly.	Kenneth never thinks correctly.
contradiction	Carl lives in a hostel.	Carl never lives in a hostel.
contradiction	Jill tells the truth.	Jill never tells the truth.
contradiction	Carol shows the presentation.	Carol never shows the presentation.
contradiction	Linda feels sad.	Linda never feels sad.
contradiction	Linda runs a marathon.	Linda never runs a marathon.
contradiction	Billy moves the table.	Billy never moves the table.
contradiction	Bill says the truth.	Bill never says the truth.
contradiction	Larry turns the light.	Larry never turns the light.
contradiction	Sam keeps the change.	Sam never keeps the change.
contradiction	Jonathan leaves the house.	Jonathan never leaves the house.
contradiction	Don lives in a hostel.	Don never lives in a hostel.
contradiction	William keeps the change.	William never keeps the change.
contradiction	Tom comes home.	Tom never comes home.
contradiction	Emma gives the money.	Emma never gives the money.
contradiction	Sam asks the question.	Sam never asks the question.
contradiction	Diana lives in a hostel.	Diana never lives in a hostel.
contradiction	Scott gives the money.	Scott never gives the money.
contradiction	Mark helps the stranger.	Mark never helps the stranger.
contradiction	Benjamin talks nonsense.	Benjamin never talks nonsense.
contradiction	Leslie looks distressed.	Leslie never looks distressed.
contradiction	Janet feels sad.	Janet never feels sad.
contradiction	Michael helps the stranger.	Michael never helps the stranger.
contradiction	Rachel gives the money.	Rachel never gives the money.
contradiction	Roger helps the stranger.	Roger never helps the stranger.
contradiction	Edward likes football.	Edward never likes football.
contradiction	Jennifer moves the table.	Jennifer never moves the table.
contradiction	Arthur calls the number.	Arthur never calls the number.
contradiction	Betty finds the key.	Betty never finds the key.
contradiction	Jill leaves the house.	Jill never leaves the house.
contradiction	Bobby sees the clock.	Bobby never sees the clock.
contradiction	Louis helps the stranger.	Louis never helps the stranger.
contradiction	Lawrence makes paintings.	Lawrence never makes paintings.
contradiction	Bob hears the announcement.	Bob never hears the announcement.
contradiction	Ken goes to school.	Ken never goes to school.
contradiction	Ralph works at office.	Ralph never works at office.
contradiction	Adam hears the announcement.	Adam never hears the announcement.
contradiction	Jeff says the truth.	Jeff never says the truth.
contradiction	Ray calls the number.	Ray never calls the number.
contradiction	Frank plays basketball.	Frank never plays basketball.
contradiction	Bill makes paintings.	Bill never makes paintings.
contradiction	Bruce begins the game.	Bruce never begins the game.
contradiction	Gary comes home.	Gary never comes home.
contradiction	Sandra sees the clock.	Sandra never sees the clock.
contradiction	Wendy goes to school.	Wendy never goes to school.
contradiction	Bill leaves the house.	Bill never leaves the house.
contradiction	Lawrence finds the key.	Lawrence never finds the key.
contradiction	Claire talks nonsense.	Claire never talks nonsense.
contradiction	Charlie finds the key.	Charlie never finds the key.
contradiction	Johnny likes football.	Johnny never likes football.
contradiction	Louis comes home.	Louis never comes home.
contradiction	Louis talks nonsense.	Louis never talks nonsense.
contradiction	Barbara uses the money.	Barbara never uses the money.
contradiction	Lucy looks distressed.	Lucy never looks distressed.
contradiction	Margaret tells the truth.	Margaret never tells the truth.
contradiction	Gary starts the match.	Gary never starts the match.
contradiction	Alice sees the clock.	Alice never sees the clock.
contradiction	Kate uses the money.	Kate never uses the money.
contradiction	Harriet likes football.	Harriet never likes football.
contradiction	Dick gives the money.	Dick never gives the money.
contradiction	Dorothy feels sad.	Dorothy never feels sad.
contradiction	Carolyn looks distressed.	Carolyn never looks distressed.
contradiction	Ron finds the key.	Ron never finds the key.
contradiction	Dick talks nonsense.	Dick never talks nonsense.
contradiction	Kate asks the question.	Kate never asks the question.
contradiction	Carolyn says the truth.	Carolyn never says the truth.
contradiction	Fiona gives the money.	Fiona never gives the money.
contradiction	Jerry talks nonsense.	Jerry never talks nonsense.
contradiction	Lynn knows the solution.	Lynn never knows the solution.
contradiction	Julie turns the light.	Julie never turns the light.
contradiction	Henry makes paintings.	Henry never makes paintings.
contradiction	Bill comes home.	Bill never comes home.
contradiction	Katherine gives the money.	Katherine never gives the money.
contradiction	Edward leaves the house.	Edward never leaves the house.
contradiction	Andrew runs a marathon.	Andrew never runs a marathon.
contradiction	Richard knows the solution.	Richard never knows the solution.
contradiction	Ken shows the presentation.	Ken never shows the presentation.
contradiction	Emily calls the number.	Emily never calls the number.
contradiction	Mark leaves the house.	Mark never leaves the house.
contradiction	Jean thinks correctly.	Jean never thinks correctly.
contradiction	Joe turns the light.	Joe never turns the light.
