contradiction	Keith talks nonsense.	Keith never talks nonsense.
contradiction	David gives the money.	David never gives the money.
contradiction	Steven says the truth.	Steven never says the truth.
contradiction	Emily begins the game.	Emily never begins the game.
contradiction	Leslie hears the announcement.	Leslie never hears the announcement.
contradiction	Richard helps the stranger.	Richard never helps the stranger.
contradiction	Kathleen likes football.	Kathleen never likes football.
contradiction	Chris plays basketball.	Chris never plays basketball.
contradiction	Bob plays basketball.	Bob never plays basketball.
contradiction	Sandra starts the match.	Sandra never starts the match.
contradiction	Alfred makes paintings.	Alfred never makes paintings.
contradiction	Edith keeps the change.	Edith never keeps the change.
contradiction	Gary moves the table.	Gary never moves the table.
contradiction	Howard makes paintings.	Howard never makes paintings.
contradiction	Nancy makes paintings.	Nancy never makes paintings.
contradiction	Steve uses the money.	Steve never uses the money.
contradiction	Sue sees the clock.	Sue never sees the clock.
contradiction	Jim runs a marathon.	Jim never runs a marathon.
contradiction	Amanda knows the solution.	Amanda never knows the solution.
contradiction	Helen knows the solution.	Helen never knows the solution.
contradiction	Donald sees the clock.	Donald never sees the clock.
contradiction	Samuel runs a marathon.	Samuel never runs a marathon.
contradiction	Dorothy calls the number.	Dorothy never calls the number.
contradiction	Bill leaves the house.	Bill never leaves the house.
contradiction	Kathleen calls the number.	Kathleen never calls the number.
contradiction	Julia says the truth.	Julia never says the truth.
contradiction	Alan starts the match.	Alan never starts the match.
contradiction	Paul moves the table.	Paul never moves the table.
contradiction	Fred calls the number.	Fred never calls the number.
contradiction	Judith goes to school.	Judith never goes to school.
contradiction	Marilyn likes football.	Marilyn never likes football.
contradiction	Christine lives in a hostel.	Christine never lives in a hostel.
contradiction	Jennifer tells the truth.	Jennifer never tells the truth.
contradiction	Louise runs a marathon.	Louise never runs a marathon.
contradiction	Jessica says the truth.	Jessica never says the truth.
contradiction	Karen lives in a hostel.	Karen never lives in a hostel.
contradiction	Edward thinks correctly.	Edward never thinks correctly.
contradiction	Louise helps the stranger.	Louise never helps the stranger.
contradiction	Francis begins the game.	Francis never begins the game.
contradiction	Susan thinks correctly.	Susan never thinks correctly.
contradiction	Keith says the truth.	Keith never says the truth.
contradiction	Dorothy asks the question.	Dorothy never asks the question.
contradiction	Catherine goes to school.	Catherine never goes to school.
contradiction	Ann runs a marathon.	Ann never runs a marathon.
contradiction	Betty knows the solution.	Betty never knows the solution.
contradiction	Mark thinks correctly.	Mark never thinks correctly.
contradiction	Walter comes home.	Walter never comes home.
contradiction	Joe goes to school.	Joe never goes to school.
contradiction	Sandra finds the key.	Sandra never finds the key.
contradiction	Sue talks nonsense.	Sue never talks nonsense.
contradiction	Anthony goes to school.	Anthony never goes to school.
contradiction	Frederick uses the money.	Frederick never uses the money.
contradiction	Elaine knows the solution.	Elaine never knows the solution.
contradiction	Matthew finds the key.	Matthew never finds the key.
contradiction	Rose plays basketball.	Rose never plays basketball.
contradiction	Wendy tells the truth.	Wendy never tells the truth.
contradiction	Jean makes paintings.	Jean never makes paintings.
contradiction	Patricia knows the solution.	Patricia never knows the solution.
contradiction	Carl knows the solution.	Carl never knows the solution.
contradiction	Louise looks distressed.	Louise never looks distressed.
contradiction	Dorothy lives in a hostel.	Dorothy never lives in a hostel.
contradiction	Sharon likes football.	Sharon never likes football.
contradiction	Lisa leaves the house.	Lisa never leaves the house.
contradiction	Colin makes paintings.	Colin never makes paintings.
contradiction	Harry turns the light.	Harry never turns the light.
contradiction	Leslie hears the announcement.	Leslie never hears the announcement.
contradiction	Helen keeps the change.	Helen never keeps the change.
contradiction	Michael shows the presentation.	Michael never shows the presentation.
contradiction	Kathleen tells the truth.	Kathleen never tells the truth.
contradiction	Lauren works at office.	Lauren never works at office.
contradiction	Ben plays basketball.	Ben never plays basketball.
contradiction	Robert finds the key.	Robert never finds the key.
contradiction	Fiona runs a marathon.	Fiona never runs a marathon.
contradiction	Jimmy makes paintings.	Jimmy never makes paintings.
contradiction	Harry starts the match.	Harry never starts the match.
contradiction	Jimmy plays basketball.	Jimmy never plays basketball.
contradiction	Richard begins the game.	Richard never begins the game.
contradiction	Michelle tells the truth.	Michelle never tells the truth.
contradiction	Samuel shows the presentation.	Samuel never shows the presentation.
contradiction	Richard hears the announcement.	Richard never hears the announcement.
contradiction	Fred runs a marathon.	Fred never runs a marathon.
contradiction	Ray calls the number.	Ray never calls the number.
contradiction	Jim likes football.	Jim never likes football.
contradiction	Virginia runs a marathon.	Virginia never runs a marathon.
contradiction	Carolyn says the truth.	Carolyn never says the truth.
contradiction	Tony moves the table.	Tony never moves the table.
contradiction	Johnny feels sad.	Johnny never feels sad.
contradiction	Larry calls the number.	Larry never calls the number.
contradiction	Martha calls the number.	Martha never calls the number.
contradiction	Kim plays basketball.	Kim never plays basketball.
contradiction	Matt moves the table.	Matt never moves the table.
contradiction	Alexandra turns the light.	Alexandra never turns the light.
contradiction	Heather uses the money.	Heather never uses the money.
contradiction	Francis calls the number.	Francis never calls the number.
contradiction	Tom runs a marathon.	Tom never runs a marathon.
contradiction	Robert keeps the change.	Robert never keeps the change.
contradiction	Kelly finds the key.	Kelly never finds the key.
contradiction	Frances tells the truth.	Frances never tells the truth.
contradiction	Ben hears the announcement.	Ben never hears the announcement.
contradiction	Tom shows the presentation.	Tom never shows the presentation.
contradiction	Joe shows the presentation.	Joe never shows the presentation.
contradiction	Bob helps the stranger.	Bob never helps the stranger.
contradiction	Michael lives in a hostel.	Michael never lives in a hostel.
contradiction	Angela helps the stranger.	Angela never helps the stranger.
contradiction	Lawrence helps the stranger.	Lawrence never helps the stranger.
contradiction	Don hears the announcement.	Don never hears the announcement.
contradiction	Edward turns the light.	Edward never turns the light.
contradiction	Scott hears the announcement.	Scott never hears the announcement.
contradiction	Jennifer begins the game.	Jennifer never begins the game.
contradiction	Michelle helps the stranger.	Michelle never helps the stranger.
contradiction	John works at office.	John never works at office.
contradiction	Kenneth calls the number.	Kenneth never calls the number.
contradiction	Suzanne runs a marathon.	Suzanne never runs a marathon.
contradiction	Eric keeps the change.	Eric never keeps the change.
contradiction	Catherine begins the game.	Catherine never begins the game.
contradiction	Sam looks distressed.	Sam never looks distressed.
contradiction	Patricia knows the solution.	Patricia never knows the solution.
contradiction	Frances begins the game.	Frances never begins the game.
contradiction	Louis lives in a hostel.	Louis never lives in a hostel.
contradiction	Roy helps the stranger.	Roy never helps the stranger.
contradiction	Sophie feels sad.	Sophie never feels sad.
contradiction	Hugh likes football.	Hugh never likes football.
contradiction	Mike goes to school.	Mike never goes to school.
contradiction	Henry says the truth.	Henry never says the truth.
contradiction	Chris feels sad.	Chris never feels sad.
contradiction	Amanda leaves the house.	Amanda never leaves the house.
contradiction	Janet asks the question.	Janet never asks the question.
contradiction	Walter uses the money.	Walter never uses the money.
contradiction	Kevin sees the clock.	Kevin never sees the clock.
contradiction	Jack shows the presentation.	Jack never shows the presentation.
contradiction	Rose keeps the change.	Rose never keeps the change.
contradiction	Dan uses the money.	Dan never uses the money.
contradiction	Jean turns the light.	Jean never turns the light.
contradiction	Peter calls the number.	Peter never calls the number.
contradiction	Dick comes home.	Dick never comes home.
contradiction	Harry turns the light.	Harry never turns the light.
contradiction	Christine thinks correctly.	Christine never thinks correctly.
contradiction	Charlotte begins the game.	Charlotte never begins the game.
contradiction	Daniel shows the presentation.	Daniel never shows the presentation.
contradiction	Annie talks nonsense.	Annie never talks nonsense.
contradiction	Fiona looks distressed.	Fiona never looks distressed.
contradiction	Edward tells the truth.	Edward never tells the truth.
contradiction	Bill tells the truth.	Bill never tells the truth.
contradiction	Andrew gives the money.	Andrew never gives the money.
contradiction	Mark looks distressed.	Mark never looks distressed.
contradiction	Patrick talks nonsense.	Patrick never talks nonsense.
contradiction	Elizabeth talks nonsense.	Elizabeth never talks nonsense.
contradiction	Edith uses the money.	Edith never uses the money.
contradiction	Roger starts the match.	Roger never starts the match.
contradiction	Harriet sees the clock.	Harriet never sees the clock.
contradiction	Samuel leaves the house.	Samuel never leaves the house.
contradiction	Diane knows the solution.	Diane never knows the solution.
contradiction	Christine comes home.	Christine never comes home.
contradiction	Frank calls the number.	Frank never calls the number.
contradiction	Steven starts the match.	Steven never starts the match.
contradiction	Frances moves the table.	Frances never moves the table.
contradiction	Joan gives the money.	Joan never gives the money.
contradiction	Fred calls the number.	Fred never calls the number.
contradiction	Frances leaves the house.	Frances never leaves the house.
contradiction	Jim starts the match.	Jim never starts the match.
contradiction	Lisa calls the number.	Lisa never calls the number.
contradiction	Victoria says the truth.	Victoria never says the truth.
contradiction	Ashley goes to school.	Ashley never goes to school.
contradiction	Edwin finds the key.	Edwin never finds the key.
contradiction	Walter makes paintings.	Walter never makes paintings.
contradiction	Philip helps the stranger.	Philip never helps the stranger.
contradiction	Catherine uses the money.	Catherine never uses the money.
contradiction	Ann shows the presentation.	Ann never shows the presentation.
contradiction	Harold calls the number.	Harold never calls the number.
contradiction	Kate leaves the house.	Kate never leaves the house.
contradiction	Kevin helps the stranger.	Kevin never helps the stranger.
contradiction	Sam knows the solution.	Sam never knows the solution.
contradiction	Patrick finds the key.	Patrick never finds the key.
contradiction	Jane talks nonsense.	Jane never talks nonsense.
contradiction	Thomas keeps the change.	Thomas never keeps the change.
contradiction	Rachel tells the truth.	Rachel never tells the truth.
contradiction	Carolyn goes to school.	Carolyn never goes to school.
contradiction	Donna gives the money.	Donna never gives the money.
contradiction	Ryan hears the announcement.	Ryan never hears the announcement.
contradiction	Ann runs a marathon.	Ann never runs a marathon.
contradiction	Lisa knows the solution.	Lisa never knows the solution.
contradiction	Edward turns the light.	Edward never turns the light.
contradiction	Dave knows the solution.	Dave never knows the solution.
contradiction	Rose looks distressed.	Rose never looks distressed.
contradiction	Alison begins the game.	Alison never begins the game.
contradiction	Julia asks the question.	Julia never asks the question.
contradiction	Sandra comes home.	Sandra never comes home.
contradiction	Daniel moves the table.	Daniel never moves the table.
contradiction	Mary hears the announcement.	Mary never hears the announcement.
contradiction	Edith feels sad.	Edith never feels sad.
contradiction	Nicole tells the truth.	Nicole never tells the truth.
contradiction	George knows the solution.	George never knows the solution.
contradiction	Anne likes football.	Anne never likes football.
contradiction	Billy keeps the change.	Billy never keeps the change.
contradiction	Richard calls the number.	Richard never calls the number.
contradiction	Anna looks distressed.	Anna never looks distressed.
contradiction	Kate goes to school.	Kate never goes to school.
contradiction	Paul moves the table.	Paul never moves the table.
contradiction	Sophie hears the announcement.	Sophie never hears the announcement.
contradiction	Al uses the money.	Al never uses the money.
contradiction	James likes football.	James never likes football.
contradiction	James calls the number.	James never calls the number.
contradiction	Charlie gives the money.	Charlie never gives the money.
contradiction	Bill begins the game.	Bill never begins the game.
contradiction	Ashley asks the question.	Ashley never asks the question.
contradiction	Steve begins the game.	Steve never begins the game.
contradiction	Rachel begins the game.	Rachel never begins the game.
contradiction	Martha comes home.	Martha never comes home.
contradiction	Chris turns the light.	Chris never turns the light.
contradiction	Diana uses the money.	Diana never uses the money.
contradiction	Stephanie makes paintings.	Stephanie never makes paintings.
contradiction	Bruce comes home.	Bruce never comes home.
contradiction	Lucy leaves the house.	Lucy never leaves the house.
contradiction	Rachel plays basketball.	Rachel never plays basketball.
contradiction	Anna makes paintings.	Anna never makes paintings.
contradiction	Walter talks nonsense.	Walter never talks nonsense.
contradiction	Charlotte plays basketball.	Charlotte never plays basketball.
contradiction	Scott makes paintings.	Scott never makes paintings.
contradiction	Wendy turns the light.	Wendy never turns the light.
contradiction	Richard hears the announcement.	Richard never hears the announcement.
contradiction	Robert leaves the house.	Robert never leaves the house.
contradiction	Jane begins the game.	Jane never begins the game.
contradiction	Jessica knows the solution.	Jessica never knows the solution.
contradiction	Judy talks nonsense.	Judy never talks nonsense.
contradiction	Kelly feels sad.	Kelly never feels sad.
contradiction	Elaine comes home.	Elaine never comes home.
contradiction	Emily keeps the change.	Emily never keeps the change.
contradiction	Jason asks the question.	Jason never asks the question.
contradiction	Richard hears the announcement.	Richard never hears the announcement.
contradiction	Kathleen uses the money.	Kathleen never uses the money.
contradiction	Caroline lives in a hostel.	Caroline never lives in a hostel.
contradiction	Julie hears the announcement.	Julie never hears the announcement.
contradiction	Ralph turns the light.	Ralph never turns the light.
contradiction	Ann uses the money.	Ann never uses the money.
contradiction	Deborah moves the table.	Deborah never moves the table.
contradiction	Frank makes paintings.	Frank never makes paintings.
contradiction	Jim plays basketball.	Jim never plays basketball.
contradiction	Steve finds the key.	Steve never finds the key.
contradiction	Ian runs a marathon.	Ian never runs a marathon.
contradiction	Julie keeps the change.	Julie never keeps the change.
contradiction	Marilyn shows the presentation.	Marilyn never shows the presentation.
contradiction	Maria shows the presentation.	Maria never shows the presentation.
contradiction	Richard feels sad.	Richard never feels sad.
contradiction	Benjamin feels sad.	Benjamin never feels sad.
contradiction	Ryan plays basketball.	Ryan never plays basketball.
contradiction	Maria hears the announcement.	Maria never hears the announcement.
contradiction	Nick shows the presentation.	Nick never shows the presentation.
contradiction	Anna says the truth.	Anna never says the truth.
contradiction	Amy comes home.	Amy never comes home.
contradiction	Melissa lives in a hostel.	Melissa never lives in a hostel.
contradiction	Julie moves the table.	Julie never moves the table.
contradiction	Wendy starts the match.	Wendy never starts the match.
contradiction	Dave knows the solution.	Dave never knows the solution.
contradiction	Kim tells the truth.	Kim never tells the truth.
contradiction	Sophie asks the question.	Sophie never asks the question.
contradiction	Anthony uses the money.	Anthony never uses the money.
contradiction	Helen runs a marathon.	Helen never runs a marathon.
contradiction	Charles goes to school.	Charles never goes to school.
contradiction	Jerry talks nonsense.	Jerry never talks nonsense.
contradiction	Ken shows the presentation.	Ken never shows the presentation.
contradiction	Stephen leaves the house.	Stephen never leaves the house.
contradiction	Colin works at office.	Colin never works at office.
contradiction	Angela keeps the change.	Angela never keeps the change.
contradiction	George sees the clock.	George never sees the clock.
contradiction	Steve says the truth.	Steve never says the truth.
contradiction	Sandra shows the presentation.	Sandra never shows the presentation.
contradiction	Deborah thinks correctly.	Deborah never thinks correctly.
contradiction	Kelly calls the number.	Kelly never calls the number.
contradiction	Thomas runs a marathon.	Thomas never runs a marathon.
contradiction	Anna looks distressed.	Anna never looks distressed.
contradiction	Betty tells the truth.	Betty never tells the truth.
contradiction	Grace gives the money.	Grace never gives the money.
contradiction	Kathleen feels sad.	Kathleen never feels sad.
contradiction	Michael moves the table.	Michael never moves the table.
contradiction	Albert plays basketball.	Albert never plays basketball.
contradiction	Charles runs a marathon.	Charles never runs a marathon.
contradiction	Jean says the truth.	Jean never says the truth.
contradiction	Katherine thinks correctly.	Katherine never thinks correctly.
contradiction	Linda thinks correctly.	Linda never thinks correctly.
contradiction	Johnny helps the stranger.	Johnny never helps the stranger.
contradiction	Ben helps the stranger.	Ben never helps the stranger.
contradiction	Paul goes to school.	Paul never goes to school.
contradiction	Michael lives in a hostel.	Michael never lives in a hostel.
contradiction	Susan moves the table.	Susan never moves the table.
contradiction	Anna looks distressed.	Anna never looks distressed.
contradiction	Michelle plays basketball.	Michelle never plays basketball.
contradiction	Martha calls the number.	Martha never calls the number.
contradiction	Ryan looks distressed.	Ryan never looks distressed.
contradiction	Jane plays basketball.	Jane never plays basketball.
contradiction	Roger lives in a hostel.	Roger never lives in a hostel.
contradiction	Charlie starts the match.	Charlie never starts the match.
contradiction	Kenneth hears the announcement.	Kenneth never hears the announcement.
contradiction	Tim leaves the house.	Tim never leaves the house.
contradiction	Eleanor asks the question.	Eleanor never asks the question.
contradiction	Robin tells the truth.	Robin never tells the truth.
contradiction	Ryan finds the key.	Ryan never finds the key.
contradiction	Jimmy begins the game.	Jimmy never begins the game.
contradiction	Victoria plays basketball.	Victoria never plays basketball.
contradiction	Elizabeth uses the money.	Elizabeth never uses the money.
contradiction	Dave keeps the change.	Dave never keeps the change.
contradiction	Florence tells the truth.	Florence never tells the truth.
contradiction	David shows the presentation.	David never shows the presentation.
contradiction	Tom calls the number.	Tom never calls the number.
contradiction	Brian thinks correctly.	Brian never thinks correctly.
contradiction	Daniel talks nonsense.	Daniel never talks nonsense.
contradiction	Leslie runs a marathon.	Leslie never runs a marathon.
contradiction	Nancy sees the clock.	Nancy never sees the clock.
contradiction	Colin calls the number.	Colin never calls the number.
contradiction	Amy tells the truth.	Amy never tells the truth.
contradiction	Andrew looks distressed.	Andrew never looks distressed.
contradiction	Alex thinks correctly.	Alex never thinks correctly.
contradiction	Wendy knows the solution.	Wendy never knows the solution.
contradiction	Nicole hears the announcement.	Nicole never hears the announcement.
contradiction	Kathy uses the money.	Kathy never uses the money.
contradiction	Gary thinks correctly.	Gary never thinks correctly.
contradiction	Ryan gives the money.	Ryan never gives the money.
contradiction	Anthony finds the key.	Anthony never finds the key.
contradiction	Samuel moves the table.	Samuel never moves the table.
contradiction	Jonathan sees the clock.	Jonathan never sees the clock.
contradiction	Ann keeps the change.	Ann never keeps the change.
contradiction	Ian gives the money.	Ian never gives the money.
contradiction	Elaine sees the clock.	Elaine never sees the clock.
contradiction	Betty shows the presentation.	Betty never shows the presentation.
contradiction	Robin calls the number.	Robin never calls the number.
contradiction	Billy comes home.	Billy never comes home.
contradiction	Roy leaves the house.	Roy never leaves the house.
contradiction	Anna sees the clock.	Anna never sees the clock.
contradiction	Karen says the truth.	Karen never says the truth.
contradiction	Emma plays basketball.	Emma never plays basketball.
contradiction	Betty asks the question.	Betty never asks the question.
contradiction	Heather helps the stranger.	Heather never helps the stranger.
contradiction	Kenneth lives in a hostel.	Kenneth never lives in a hostel.
contradiction	Diana goes to school.	Diana never goes to school.
contradiction	Jeff asks the question.	Jeff never asks the question.
contradiction	Harry shows the presentation.	Harry never shows the presentation.
contradiction	Adam begins the game.	Adam never begins the game.
contradiction	Mary runs a marathon.	Mary never runs a marathon.
contradiction	Joe feels sad.	Joe never feels sad.
contradiction	Evelyn comes home.	Evelyn never comes home.
contradiction	Susan likes football.	Susan never likes football.
contradiction	Edward sees the clock.	Edward never sees the clock.
contradiction	Ray makes paintings.	Ray never makes paintings.
contradiction	Rebecca shows the presentation.	Rebecca never shows the presentation.
contradiction	Jay feels sad.	Jay never feels sad.
contradiction	Kathy runs a marathon.	Kathy never runs a marathon.
contradiction	Jeff comes home.	Jeff never comes home.
contradiction	Donald goes to school.	Donald never goes to school.
contradiction	Bobby keeps the change.	Bobby never keeps the change.
contradiction	Alan says the truth.	Alan never says the truth.
contradiction	Tom gives the money.	Tom never gives the money.
contradiction	Diana hears the announcement.	Diana never hears the announcement.
contradiction	Mike makes paintings.	Mike never makes paintings.
contradiction	Karen starts the match.	Karen never starts the match.
contradiction	Christopher comes home.	Christopher never comes home.
contradiction	Kathleen runs a marathon.	Kathleen never runs a marathon.
contradiction	Marilyn gives the money.	Marilyn never gives the money.
contradiction	Colin plays basketball.	Colin never plays basketball.
contradiction	Ray moves the table.	Ray never moves the table.
contradiction	Betty calls the number.	Betty never calls the number.
contradiction	Keith feels sad.	Keith never feels sad.
contradiction	Lisa lives in a hostel.	Lisa never lives in a hostel.
contradiction	Sophie leaves the house.	Sophie never leaves the house.
contradiction	Fred uses the money.	Fred never uses the money.
contradiction	Jean says the truth.	Jean never says the truth.
contradiction	Jean feels sad.	Jean never feels sad.
contradiction	Katherine tells the truth.	Katherine never tells the truth.
contradiction	Alfred keeps the change.	Alfred never keeps the change.
contradiction	Ed calls the number.	Ed never calls the number.
contradiction	Elizabeth calls the number.	Elizabeth never calls the number.
contradiction	Philip finds the key.	Philip never finds the key.
contradiction	Rachel knows the solution.	Rachel never knows the solution.
contradiction	Tim sees the clock.	Tim never sees the clock.
contradiction	Adam finds the key.	Adam never finds the key.
contradiction	Lucy hears the announcement.	Lucy never hears the announcement.
contradiction	Lucy knows the solution.	Lucy never knows the solution.
contradiction	Rachel thinks correctly.	Rachel never thinks correctly.
contradiction	Sally begins the game.	Sally never begins the game.
contradiction	Alfred calls the number.	Alfred never calls the number.
contradiction	Robert thinks correctly.	Robert never thinks correctly.
contradiction	Melissa knows the solution.	Melissa never knows the solution.
contradiction	Florence finds the key.	Florence never finds the key.
contradiction	Judy moves the table.	Judy never moves the table.
