contradiction	Ian and Jessica are the only children of Andrea.	Andrea has exactly 3 children.
contradiction	Michelle and Ken are the only children of Elizabeth.	Elizabeth has exactly 4 children.
contradiction	Diana and Karen are the only children of Kathleen.	Kathleen has exactly 5 children.
contradiction	Frederick and Betty are the only children of Charlotte.	Charlotte has exactly 4 children.
contradiction	Alex and Jerry are the only children of Bruce.	Bruce has exactly 4 children.
contradiction	Alan and Jason are the only children of Helen.	Helen has exactly 1 children.
contradiction	Jessica and Alice are the only children of Arthur.	Arthur has exactly 1 children.
contradiction	Frederick and Nick are the only children of Annie.	Annie has exactly 1 children.
contradiction	Patricia and Alice are the only children of Philip.	Philip has exactly 5 children.
contradiction	Colin and Francis are the only children of Philip.	Philip has exactly 5 children.
contradiction	Ian and Eleanor are the only children of Louis.	Louis has exactly 5 children.
contradiction	David and Jeff are the only children of Catherine.	Catherine has exactly 5 children.
contradiction	Judith and Cynthia are the only children of Matthew.	Matthew has exactly 5 children.
contradiction	Philip and Betty are the only children of Louis.	Louis has exactly 1 children.
contradiction	Tim and Edith are the only children of Donald.	Donald has exactly 1 children.
contradiction	Harriet and Anne are the only children of Mike.	Mike has exactly 1 children.
contradiction	Martha and Mike are the only children of Mark.	Mark has exactly 1 children.
contradiction	Elaine and Roger are the only children of Ryan.	Ryan has exactly 4 children.
contradiction	Albert and Anne are the only children of Jonathan.	Jonathan has exactly 0 children.
contradiction	Sam and Michael are the only children of Robert.	Robert has exactly 1 children.
contradiction	Patricia and Bruce are the only children of Scott.	Scott has exactly 1 children.
contradiction	Rachel and Matt are the only children of Jason.	Jason has exactly 3 children.
contradiction	Johnny and Melissa are the only children of Linda.	Linda has exactly 1 children.
contradiction	Caroline and Samuel are the only children of Rebecca.	Rebecca has exactly 0 children.
contradiction	Stephanie and Evelyn are the only children of Amy.	Amy has exactly 1 children.
contradiction	Bruce and Sophie are the only children of Sue.	Sue has exactly 1 children.
contradiction	Evelyn and Angela are the only children of Dorothy.	Dorothy has exactly 0 children.
contradiction	Carol and Claire are the only children of Andrew.	Andrew has exactly 4 children.
contradiction	Albert and Diane are the only children of Annie.	Annie has exactly 3 children.
contradiction	Catherine and Victoria are the only children of Stephanie.	Stephanie has exactly 5 children.
contradiction	Lauren and Harriet are the only children of Alice.	Alice has exactly 3 children.
contradiction	Kathy and Martin are the only children of Nick.	Nick has exactly 5 children.
contradiction	Richard and Emma are the only children of Greg.	Greg has exactly 3 children.
contradiction	Tom and Emma are the only children of Heather.	Heather has exactly 4 children.
contradiction	Victoria and Diana are the only children of Harry.	Harry has exactly 4 children.
contradiction	Andrew and Alison are the only children of Larry.	Larry has exactly 1 children.
contradiction	Lisa and Harriet are the only children of Johnny.	Johnny has exactly 0 children.
contradiction	Jay and James are the only children of Albert.	Albert has exactly 3 children.
contradiction	Annie and Alice are the only children of Ruth.	Ruth has exactly 1 children.
contradiction	Frank and Kenneth are the only children of Frederick.	Frederick has exactly 3 children.
contradiction	Greg and Alfred are the only children of Carolyn.	Carolyn has exactly 5 children.
contradiction	Diane and Marilyn are the only children of Edith.	Edith has exactly 0 children.
contradiction	Harry and Tom are the only children of Chris.	Chris has exactly 5 children.
contradiction	Adam and Sue are the only children of Carolyn.	Carolyn has exactly 1 children.
contradiction	Julie and Annie are the only children of Harriet.	Harriet has exactly 1 children.
contradiction	Ian and Scott are the only children of Jason.	Jason has exactly 4 children.
contradiction	Ed and Amy are the only children of Kevin.	Kevin has exactly 4 children.
contradiction	Alice and Eleanor are the only children of Kathleen.	Kathleen has exactly 4 children.
contradiction	Amanda and Ed are the only children of Charlotte.	Charlotte has exactly 5 children.
contradiction	Cynthia and Billy are the only children of Marie.	Marie has exactly 1 children.
contradiction	Peter and Alison are the only children of Joseph.	Joseph has exactly 0 children.
contradiction	Kate and Jeff are the only children of Barbara.	Barbara has exactly 1 children.
contradiction	Louis and Roy are the only children of Colin.	Colin has exactly 1 children.
contradiction	Jessica and Steve are the only children of Helen.	Helen has exactly 1 children.
contradiction	Louis and Samuel are the only children of Lisa.	Lisa has exactly 0 children.
contradiction	Stephen and Adam are the only children of Jeff.	Jeff has exactly 1 children.
contradiction	Katherine and Rebecca are the only children of Katie.	Katie has exactly 0 children.
contradiction	Caroline and Ray are the only children of Amanda.	Amanda has exactly 1 children.
contradiction	Fred and Judith are the only children of Nancy.	Nancy has exactly 4 children.
contradiction	Sally and Alison are the only children of Keith.	Keith has exactly 5 children.
contradiction	Carolyn and Alison are the only children of Simon.	Simon has exactly 0 children.
contradiction	Greg and Robert are the only children of Cynthia.	Cynthia has exactly 1 children.
contradiction	Anna and Catherine are the only children of Virginia.	Virginia has exactly 3 children.
contradiction	Ken and Richard are the only children of Greg.	Greg has exactly 5 children.
contradiction	Edward and Katie are the only children of Laura.	Laura has exactly 4 children.
contradiction	Richard and Louis are the only children of Ruth.	Ruth has exactly 3 children.
contradiction	Pamela and Paul are the only children of Annie.	Annie has exactly 0 children.
contradiction	Deborah and Rachel are the only children of Ryan.	Ryan has exactly 0 children.
contradiction	Sue and Ray are the only children of Jay.	Jay has exactly 0 children.
contradiction	Mark and Virginia are the only children of Rebecca.	Rebecca has exactly 0 children.
contradiction	Margaret and Michelle are the only children of Kathy.	Kathy has exactly 1 children.
contradiction	Eric and Simon are the only children of Robert.	Robert has exactly 0 children.
contradiction	Amy and Fred are the only children of Victoria.	Victoria has exactly 5 children.
contradiction	Angela and Louise are the only children of Gary.	Gary has exactly 5 children.
contradiction	Frederick and Angela are the only children of Louise.	Louise has exactly 4 children.
contradiction	Ron and Charles are the only children of Alexandra.	Alexandra has exactly 5 children.
contradiction	Wendy and Charles are the only children of Joan.	Joan has exactly 4 children.
contradiction	Kathleen and Dick are the only children of Christopher.	Christopher has exactly 0 children.
contradiction	Kim and Betty are the only children of Francis.	Francis has exactly 5 children.
contradiction	Sarah and Kathleen are the only children of Janet.	Janet has exactly 1 children.
contradiction	Barbara and Sharon are the only children of Fiona.	Fiona has exactly 4 children.
contradiction	Benjamin and Ron are the only children of Jane.	Jane has exactly 5 children.
contradiction	Francis and Walter are the only children of Albert.	Albert has exactly 0 children.
contradiction	Mary and Judy are the only children of Julia.	Julia has exactly 4 children.
contradiction	Kathleen and William are the only children of David.	David has exactly 3 children.
contradiction	Catherine and Kim are the only children of Francis.	Francis has exactly 0 children.
contradiction	Alex and Dan are the only children of Joseph.	Joseph has exactly 4 children.
contradiction	Elizabeth and Matt are the only children of Joan.	Joan has exactly 3 children.
contradiction	Wendy and Katie are the only children of Donald.	Donald has exactly 1 children.
contradiction	Katie and Ken are the only children of Elaine.	Elaine has exactly 3 children.
contradiction	William and Fred are the only children of Kim.	Kim has exactly 0 children.
contradiction	Howard and Catherine are the only children of Simon.	Simon has exactly 5 children.
contradiction	Jerry and Ryan are the only children of Christine.	Christine has exactly 5 children.
contradiction	Gary and Deborah are the only children of Steven.	Steven has exactly 1 children.
contradiction	Sally and Kelly are the only children of Alice.	Alice has exactly 1 children.
contradiction	Jean and Lynn are the only children of Lucy.	Lucy has exactly 5 children.
contradiction	Pamela and Jimmy are the only children of George.	George has exactly 3 children.
contradiction	Donna and Christine are the only children of Jessica.	Jessica has exactly 1 children.
contradiction	Grace and Adam are the only children of Ed.	Ed has exactly 0 children.
contradiction	Kim and Alexander are the only children of Janet.	Janet has exactly 1 children.
contradiction	Martin and James are the only children of Sara.	Sara has exactly 1 children.
contradiction	Frank and Jonathan are the only children of Victoria.	Victoria has exactly 3 children.
contradiction	Caroline and Fiona are the only children of Donald.	Donald has exactly 4 children.
contradiction	Matt and Marie are the only children of Steven.	Steven has exactly 3 children.
contradiction	Roy and Jean are the only children of Sandra.	Sandra has exactly 3 children.
contradiction	Bill and Jean are the only children of Linda.	Linda has exactly 4 children.
contradiction	Lisa and Mary are the only children of Martin.	Martin has exactly 1 children.
contradiction	Ashley and Robert are the only children of Samuel.	Samuel has exactly 1 children.
contradiction	Al and Katherine are the only children of Andrew.	Andrew has exactly 3 children.
contradiction	Matthew and Jane are the only children of Sam.	Sam has exactly 0 children.
contradiction	Bruce and Claire are the only children of Paul.	Paul has exactly 3 children.
contradiction	Hugh and Frances are the only children of Paul.	Paul has exactly 1 children.
contradiction	Ian and Benjamin are the only children of Dick.	Dick has exactly 0 children.
contradiction	Laura and Frank are the only children of Walter.	Walter has exactly 5 children.
contradiction	Grace and Donald are the only children of Patricia.	Patricia has exactly 1 children.
contradiction	Frank and Bill are the only children of Matt.	Matt has exactly 5 children.
contradiction	Jerry and Joe are the only children of Jay.	Jay has exactly 4 children.
contradiction	Nicole and Don are the only children of Bruce.	Bruce has exactly 1 children.
contradiction	Judy and Donna are the only children of Johnny.	Johnny has exactly 5 children.
contradiction	Colin and Katie are the only children of Don.	Don has exactly 3 children.
contradiction	Ashley and Susan are the only children of Anthony.	Anthony has exactly 4 children.
contradiction	Donald and Alan are the only children of Cynthia.	Cynthia has exactly 0 children.
contradiction	Scott and Donald are the only children of Mary.	Mary has exactly 5 children.
contradiction	Albert and Deborah are the only children of Walter.	Walter has exactly 5 children.
contradiction	Fiona and Carolyn are the only children of Patrick.	Patrick has exactly 4 children.
contradiction	Louise and Alexander are the only children of Nick.	Nick has exactly 3 children.
contradiction	Robert and Roger are the only children of Joe.	Joe has exactly 5 children.
contradiction	James and Kelly are the only children of Colin.	Colin has exactly 5 children.
contradiction	Elaine and Patrick are the only children of Sara.	Sara has exactly 0 children.
contradiction	Paul and Heather are the only children of Scott.	Scott has exactly 3 children.
contradiction	Kelly and Diane are the only children of Matt.	Matt has exactly 3 children.
contradiction	Jonathan and Cynthia are the only children of Ashley.	Ashley has exactly 4 children.
contradiction	Wendy and Steven are the only children of Judy.	Judy has exactly 0 children.
contradiction	Anthony and Anne are the only children of Martha.	Martha has exactly 0 children.
contradiction	Joseph and John are the only children of Jack.	Jack has exactly 0 children.
contradiction	Elaine and Marilyn are the only children of Gary.	Gary has exactly 4 children.
contradiction	Alan and Colin are the only children of Frederick.	Frederick has exactly 1 children.
contradiction	Samuel and Leslie are the only children of Scott.	Scott has exactly 5 children.
contradiction	Alfred and Lawrence are the only children of Annie.	Annie has exactly 0 children.
contradiction	Don and Elaine are the only children of Steve.	Steve has exactly 5 children.
contradiction	Patricia and Susan are the only children of Emma.	Emma has exactly 3 children.
contradiction	Eric and Jack are the only children of Roger.	Roger has exactly 5 children.
contradiction	Ellen and Kenneth are the only children of Ben.	Ben has exactly 3 children.
contradiction	Cynthia and Sam are the only children of Steven.	Steven has exactly 4 children.
contradiction	Ann and Dorothy are the only children of Scott.	Scott has exactly 4 children.
contradiction	Emily and Harriet are the only children of Anna.	Anna has exactly 4 children.
contradiction	Amy and Henry are the only children of Pamela.	Pamela has exactly 0 children.
contradiction	Maria and Rose are the only children of Walter.	Walter has exactly 4 children.
contradiction	Stephanie and Fred are the only children of Marilyn.	Marilyn has exactly 5 children.
contradiction	Henry and Susan are the only children of Alexander.	Alexander has exactly 3 children.
contradiction	Kim and Jay are the only children of Victoria.	Victoria has exactly 4 children.
contradiction	Jack and Wendy are the only children of Lawrence.	Lawrence has exactly 3 children.
contradiction	Benjamin and Caroline are the only children of Edward.	Edward has exactly 3 children.
contradiction	Alfred and Donald are the only children of Sharon.	Sharon has exactly 5 children.
contradiction	George and Joan are the only children of Ray.	Ray has exactly 3 children.
contradiction	Harry and Philip are the only children of Francis.	Francis has exactly 4 children.
contradiction	Maria and Sandra are the only children of John.	John has exactly 0 children.
contradiction	Barbara and Rebecca are the only children of Amy.	Amy has exactly 0 children.
contradiction	Frederick and Lisa are the only children of Alice.	Alice has exactly 3 children.
contradiction	Sandra and William are the only children of Jessica.	Jessica has exactly 3 children.
contradiction	Richard and Maria are the only children of Evelyn.	Evelyn has exactly 5 children.
contradiction	Amy and Bruce are the only children of Ryan.	Ryan has exactly 4 children.
contradiction	Jason and Julia are the only children of Jessica.	Jessica has exactly 5 children.
contradiction	Carol and Jim are the only children of Sandra.	Sandra has exactly 1 children.
contradiction	Annie and Sam are the only children of Ben.	Ben has exactly 3 children.
contradiction	Tim and Linda are the only children of Sharon.	Sharon has exactly 0 children.
contradiction	Jill and Rose are the only children of Jimmy.	Jimmy has exactly 4 children.
contradiction	Kenneth and Elaine are the only children of Harry.	Harry has exactly 3 children.
contradiction	Patrick and Francis are the only children of Joseph.	Joseph has exactly 3 children.
