contradiction	Joe and Joseph are the only children of Charles.	Charles has exactly 5 children.
contradiction	Johnny and Peter are the only children of Edward.	Edward has exactly 3 children.
contradiction	Bob and Christopher are the only children of Amy.	Amy has exactly 0 children.
contradiction	Ashley and Eric are the only children of Al.	Al has exactly 1 children.
contradiction	Alexandra and Marilyn are the only children of Betty.	Betty has exactly 0 children.
contradiction	Thomas and Steven are the only children of Kelly.	Kelly has exactly 4 children.
contradiction	Helen and Florence are the only children of Al.	Al has exactly 5 children.
contradiction	Kate and Susan are the only children of Frederick.	Frederick has exactly 0 children.
contradiction	Al and Mark are the only children of Dave.	Dave has exactly 0 children.
contradiction	Nancy and Bruce are the only children of Charles.	Charles has exactly 3 children.
contradiction	Melissa and Anthony are the only children of Pamela.	Pamela has exactly 1 children.
contradiction	Roy and Linda are the only children of Matt.	Matt has exactly 0 children.
contradiction	Jimmy and Alfred are the only children of Joan.	Joan has exactly 3 children.
contradiction	Alice and Kenneth are the only children of Pamela.	Pamela has exactly 1 children.
contradiction	Kathy and Sally are the only children of Kathryn.	Kathryn has exactly 3 children.
contradiction	Rachel and Linda are the only children of Marilyn.	Marilyn has exactly 0 children.
contradiction	Ruth and Matthew are the only children of Steve.	Steve has exactly 1 children.
contradiction	Daniel and Jerry are the only children of Janet.	Janet has exactly 1 children.
contradiction	Sam and Colin are the only children of Wendy.	Wendy has exactly 5 children.
contradiction	Caroline and Kate are the only children of Al.	Al has exactly 1 children.
contradiction	Don and Betty are the only children of Suzanne.	Suzanne has exactly 5 children.
contradiction	Bob and Gary are the only children of Eleanor.	Eleanor has exactly 5 children.
contradiction	Amanda and Katie are the only children of Jason.	Jason has exactly 1 children.
contradiction	Samuel and Jean are the only children of Bill.	Bill has exactly 4 children.
contradiction	John and Dave are the only children of Albert.	Albert has exactly 5 children.
contradiction	Nancy and Kathleen are the only children of Scott.	Scott has exactly 3 children.
contradiction	Julie and Hugh are the only children of Billy.	Billy has exactly 0 children.
contradiction	Edwin and Dorothy are the only children of Amanda.	Amanda has exactly 3 children.
contradiction	Marilyn and Kim are the only children of Philip.	Philip has exactly 4 children.
contradiction	James and Daniel are the only children of Robert.	Robert has exactly 5 children.
contradiction	Chris and Jeff are the only children of Amy.	Amy has exactly 4 children.
contradiction	Ruth and Stephanie are the only children of Bob.	Bob has exactly 5 children.
contradiction	Elizabeth and Matthew are the only children of Fiona.	Fiona has exactly 5 children.
contradiction	Karen and Annie are the only children of Sandra.	Sandra has exactly 5 children.
contradiction	Ken and Simon are the only children of Edith.	Edith has exactly 4 children.
contradiction	Eric and Jay are the only children of Keith.	Keith has exactly 1 children.
contradiction	Nancy and Ed are the only children of Adam.	Adam has exactly 1 children.
contradiction	Amanda and Dan are the only children of Ruth.	Ruth has exactly 0 children.
contradiction	Edith and James are the only children of Mark.	Mark has exactly 4 children.
contradiction	Alexander and Walter are the only children of Matt.	Matt has exactly 3 children.
contradiction	Andrew and Kelly are the only children of George.	George has exactly 5 children.
contradiction	Jay and Ray are the only children of Jack.	Jack has exactly 1 children.
contradiction	Catherine and Chris are the only children of Caroline.	Caroline has exactly 3 children.
contradiction	Jonathan and Maria are the only children of Evelyn.	Evelyn has exactly 1 children.
contradiction	Francis and Ray are the only children of Andrea.	Andrea has exactly 5 children.
contradiction	Andrea and Kevin are the only children of Jimmy.	Jimmy has exactly 4 children.
contradiction	Jay and Barbara are the only children of Emma.	Emma has exactly 4 children.
contradiction	Scott and Sally are the only children of William.	William has exactly 4 children.
contradiction	Sarah and Elaine are the only children of Roy.	Roy has exactly 0 children.
contradiction	Victoria and Dan are the only children of Alison.	Alison has exactly 1 children.
contradiction	Johnny and Ray are the only children of Linda.	Linda has exactly 0 children.
contradiction	Amanda and Diana are the only children of Anthony.	Anthony has exactly 3 children.
contradiction	Harriet and Richard are the only children of Benjamin.	Benjamin has exactly 4 children.
contradiction	Fred and Jerry are the only children of Steve.	Steve has exactly 0 children.
contradiction	Don and Lisa are the only children of Alexandra.	Alexandra has exactly 4 children.
contradiction	Alexander and Samuel are the only children of Mark.	Mark has exactly 1 children.
contradiction	Edwin and Alan are the only children of Colin.	Colin has exactly 3 children.
contradiction	Tom and Eleanor are the only children of Edith.	Edith has exactly 3 children.
contradiction	Andrew and Carolyn are the only children of Alexander.	Alexander has exactly 0 children.
contradiction	Matthew and Simon are the only children of Alison.	Alison has exactly 4 children.
contradiction	Kathy and Roy are the only children of Tom.	Tom has exactly 0 children.
contradiction	Harold and Dick are the only children of Tim.	Tim has exactly 5 children.
contradiction	Richard and Katherine are the only children of Arthur.	Arthur has exactly 0 children.
contradiction	Samuel and Ray are the only children of Lisa.	Lisa has exactly 4 children.
contradiction	Steve and Karen are the only children of Arthur.	Arthur has exactly 1 children.
contradiction	Frances and Simon are the only children of Ed.	Ed has exactly 3 children.
contradiction	Laura and Ann are the only children of Greg.	Greg has exactly 0 children.
contradiction	Stephen and Jerry are the only children of Sarah.	Sarah has exactly 3 children.
contradiction	Caroline and Mark are the only children of Joseph.	Joseph has exactly 4 children.
contradiction	Marilyn and Ruth are the only children of Dick.	Dick has exactly 1 children.
contradiction	Jean and Matthew are the only children of Sam.	Sam has exactly 0 children.
contradiction	Alan and Kate are the only children of Diane.	Diane has exactly 1 children.
contradiction	Dave and Sarah are the only children of Heather.	Heather has exactly 3 children.
contradiction	Greg and Helen are the only children of Jean.	Jean has exactly 1 children.
contradiction	Charles and Harry are the only children of Florence.	Florence has exactly 0 children.
contradiction	Robin and Virginia are the only children of Bob.	Bob has exactly 0 children.
contradiction	Tom and Keith are the only children of Andrea.	Andrea has exactly 3 children.
contradiction	Larry and Wendy are the only children of Karen.	Karen has exactly 0 children.
contradiction	Steven and Steve are the only children of Robert.	Robert has exactly 5 children.
contradiction	Roy and Alexandra are the only children of Frances.	Frances has exactly 1 children.
contradiction	Ryan and Kim are the only children of Billy.	Billy has exactly 1 children.
contradiction	Kate and Al are the only children of Helen.	Helen has exactly 4 children.
contradiction	Larry and John are the only children of Nancy.	Nancy has exactly 5 children.
contradiction	Johnny and Colin are the only children of Claire.	Claire has exactly 5 children.
contradiction	Frederick and Sophie are the only children of Ryan.	Ryan has exactly 1 children.
contradiction	Nicole and Stephanie are the only children of Katie.	Katie has exactly 5 children.
contradiction	Rose and Harold are the only children of Jason.	Jason has exactly 0 children.
contradiction	Amy and Kevin are the only children of Alison.	Alison has exactly 0 children.
contradiction	Elaine and Colin are the only children of Suzanne.	Suzanne has exactly 0 children.
contradiction	Annie and Dick are the only children of Julia.	Julia has exactly 1 children.
contradiction	Annie and Robin are the only children of Sam.	Sam has exactly 3 children.
contradiction	Lauren and Eleanor are the only children of Daniel.	Daniel has exactly 4 children.
contradiction	Kelly and Joe are the only children of Bruce.	Bruce has exactly 3 children.
contradiction	Charlotte and Anne are the only children of Betty.	Betty has exactly 0 children.
contradiction	Robert and Nick are the only children of Greg.	Greg has exactly 4 children.
contradiction	Jay and Kim are the only children of Sam.	Sam has exactly 0 children.
contradiction	Jessica and David are the only children of William.	William has exactly 3 children.
contradiction	Alex and Joan are the only children of Philip.	Philip has exactly 4 children.
contradiction	Chris and Patricia are the only children of Richard.	Richard has exactly 4 children.
contradiction	Ray and Victoria are the only children of Harold.	Harold has exactly 4 children.
contradiction	Frank and Larry are the only children of Mike.	Mike has exactly 3 children.
contradiction	Christopher and Jeff are the only children of Barbara.	Barbara has exactly 4 children.
contradiction	Diane and Walter are the only children of Alexandra.	Alexandra has exactly 4 children.
contradiction	Deborah and Caroline are the only children of Elaine.	Elaine has exactly 3 children.
contradiction	Alexandra and Jim are the only children of Edith.	Edith has exactly 4 children.
contradiction	Susan and Walter are the only children of Fred.	Fred has exactly 0 children.
contradiction	Sarah and Andrea are the only children of Lynn.	Lynn has exactly 4 children.
contradiction	Kate and Kathryn are the only children of Ryan.	Ryan has exactly 3 children.
contradiction	Suzanne and Sophie are the only children of Laura.	Laura has exactly 5 children.
contradiction	Florence and Jonathan are the only children of Alfred.	Alfred has exactly 4 children.
contradiction	Virginia and Ben are the only children of Andrea.	Andrea has exactly 0 children.
contradiction	Dan and David are the only children of Sam.	Sam has exactly 5 children.
contradiction	Mary and Martha are the only children of John.	John has exactly 4 children.
contradiction	Ashley and John are the only children of Joseph.	Joseph has exactly 0 children.
contradiction	Dorothy and Maria are the only children of Linda.	Linda has exactly 5 children.
contradiction	Scott and Greg are the only children of Martin.	Martin has exactly 5 children.
contradiction	Ruth and Don are the only children of Joan.	Joan has exactly 3 children.
contradiction	Matthew and Mike are the only children of Alex.	Alex has exactly 1 children.
contradiction	Kate and Edwin are the only children of Ruth.	Ruth has exactly 4 children.
contradiction	Jonathan and Judy are the only children of Carl.	Carl has exactly 4 children.
contradiction	Grace and Claire are the only children of Frances.	Frances has exactly 4 children.
contradiction	Jason and Ben are the only children of Charlie.	Charlie has exactly 1 children.
contradiction	Donna and Leslie are the only children of Philip.	Philip has exactly 0 children.
contradiction	Roy and Harry are the only children of Rose.	Rose has exactly 0 children.
contradiction	Ralph and Anna are the only children of Philip.	Philip has exactly 5 children.
contradiction	Daniel and Jonathan are the only children of Adam.	Adam has exactly 1 children.
contradiction	Brian and Kathleen are the only children of Ray.	Ray has exactly 3 children.
contradiction	Maria and Marilyn are the only children of Ruth.	Ruth has exactly 5 children.
contradiction	Grace and Chris are the only children of Stephanie.	Stephanie has exactly 0 children.
contradiction	Kathryn and Diane are the only children of Nicole.	Nicole has exactly 5 children.
contradiction	Sara and Edwin are the only children of Edith.	Edith has exactly 3 children.
contradiction	Christine and Ray are the only children of Virginia.	Virginia has exactly 0 children.
contradiction	Ken and Dave are the only children of Kevin.	Kevin has exactly 4 children.
contradiction	Edward and Ann are the only children of Philip.	Philip has exactly 5 children.
contradiction	Donna and Sandra are the only children of Marie.	Marie has exactly 0 children.
contradiction	Julia and Patrick are the only children of Albert.	Albert has exactly 1 children.
contradiction	Sue and Jim are the only children of Nick.	Nick has exactly 3 children.
contradiction	Sally and Albert are the only children of Steve.	Steve has exactly 0 children.
contradiction	Jill and Caroline are the only children of Virginia.	Virginia has exactly 0 children.
contradiction	Caroline and Carolyn are the only children of Francis.	Francis has exactly 1 children.
contradiction	Tom and Jane are the only children of Amy.	Amy has exactly 4 children.
contradiction	Nick and Dorothy are the only children of Alfred.	Alfred has exactly 4 children.
contradiction	Harry and Ann are the only children of Al.	Al has exactly 1 children.
contradiction	Maria and Ruth are the only children of Wendy.	Wendy has exactly 5 children.
contradiction	Patricia and Leslie are the only children of Sam.	Sam has exactly 5 children.
contradiction	Michael and Alexander are the only children of Karen.	Karen has exactly 5 children.
contradiction	Ralph and Albert are the only children of Frank.	Frank has exactly 0 children.
contradiction	Frederick and Nick are the only children of Martha.	Martha has exactly 4 children.
contradiction	Laura and Jean are the only children of Michelle.	Michelle has exactly 4 children.
contradiction	Diana and Nick are the only children of Howard.	Howard has exactly 0 children.
contradiction	Claire and Katherine are the only children of Harold.	Harold has exactly 0 children.
contradiction	Michelle and Ian are the only children of Gary.	Gary has exactly 5 children.
contradiction	Joe and Virginia are the only children of Robin.	Robin has exactly 5 children.
contradiction	Katherine and Harold are the only children of Hugh.	Hugh has exactly 0 children.
contradiction	Nick and Julia are the only children of Jean.	Jean has exactly 3 children.
contradiction	George and Edward are the only children of Chris.	Chris has exactly 1 children.
contradiction	Dan and Joan are the only children of Jim.	Jim has exactly 4 children.
contradiction	Frederick and Susan are the only children of Sandra.	Sandra has exactly 1 children.
contradiction	Pamela and Louise are the only children of Diane.	Diane has exactly 3 children.
contradiction	Johnny and Eric are the only children of James.	James has exactly 0 children.
contradiction	Bill and Tim are the only children of Annie.	Annie has exactly 3 children.
contradiction	John and Eric are the only children of Stephanie.	Stephanie has exactly 1 children.
contradiction	William and Benjamin are the only children of Elizabeth.	Elizabeth has exactly 0 children.
contradiction	Sam and Victoria are the only children of Louis.	Louis has exactly 3 children.
contradiction	Ryan and Sue are the only children of Pamela.	Pamela has exactly 0 children.
contradiction	Ray and Edward are the only children of Don.	Don has exactly 3 children.
contradiction	Melissa and Bruce are the only children of Rachel.	Rachel has exactly 0 children.
contradiction	Alex and Elaine are the only children of Robert.	Robert has exactly 5 children.
contradiction	Edward and Rose are the only children of Sophie.	Sophie has exactly 1 children.
contradiction	Laura and Frank are the only children of Fred.	Fred has exactly 3 children.
contradiction	Frank and Barbara are the only children of John.	John has exactly 0 children.
contradiction	Kathleen and Sandra are the only children of Robert.	Robert has exactly 3 children.
contradiction	Larry and Sally are the only children of Carol.	Carol has exactly 0 children.
contradiction	Amy and Lauren are the only children of Eric.	Eric has exactly 3 children.
contradiction	Stephanie and Al are the only children of Charles.	Charles has exactly 4 children.
contradiction	Judith and Lisa are the only children of Edith.	Edith has exactly 3 children.
contradiction	Andrew and Charlie are the only children of Diana.	Diana has exactly 0 children.
contradiction	Nick and Brian are the only children of Cynthia.	Cynthia has exactly 5 children.
contradiction	Charlie and Angela are the only children of Marie.	Marie has exactly 4 children.
contradiction	Betty and Jay are the only children of Ann.	Ann has exactly 3 children.
contradiction	Edith and Florence are the only children of Kevin.	Kevin has exactly 0 children.
contradiction	Mary and Ellen are the only children of Sam.	Sam has exactly 5 children.
contradiction	Deborah and Sharon are the only children of Gary.	Gary has exactly 0 children.
contradiction	Lauren and Alice are the only children of William.	William has exactly 4 children.
contradiction	James and Bobby are the only children of Susan.	Susan has exactly 5 children.
contradiction	Carolyn and Lynn are the only children of Julia.	Julia has exactly 3 children.
contradiction	Ron and Leslie are the only children of Eric.	Eric has exactly 0 children.
contradiction	Kenneth and Ian are the only children of Alice.	Alice has exactly 5 children.
contradiction	Lisa and Fred are the only children of Ruth.	Ruth has exactly 1 children.
contradiction	Alfred and Tim are the only children of Kate.	Kate has exactly 5 children.
contradiction	Frederick and Sam are the only children of Catherine.	Catherine has exactly 1 children.
contradiction	Lucy and Scott are the only children of Andrew.	Andrew has exactly 4 children.
contradiction	Cynthia and Frank are the only children of Ken.	Ken has exactly 0 children.
contradiction	Angela and Rose are the only children of Al.	Al has exactly 1 children.
contradiction	Katie and Eleanor are the only children of Jean.	Jean has exactly 5 children.
contradiction	Eric and Carol are the only children of Paul.	Paul has exactly 4 children.
contradiction	Caroline and Judy are the only children of Rachel.	Rachel has exactly 4 children.
contradiction	Paul and Barbara are the only children of Colin.	Colin has exactly 4 children.
contradiction	Fred and Anthony are the only children of Roy.	Roy has exactly 4 children.
contradiction	Edward and Al are the only children of Peter.	Peter has exactly 5 children.
contradiction	Peter and Sophie are the only children of Jonathan.	Jonathan has exactly 5 children.
contradiction	Jennifer and Caroline are the only children of Jonathan.	Jonathan has exactly 4 children.
contradiction	Fred and Carol are the only children of Billy.	Billy has exactly 1 children.
contradiction	Kate and Ron are the only children of Sam.	Sam has exactly 0 children.
contradiction	Stephen and Donna are the only children of Jack.	Jack has exactly 4 children.
contradiction	Ed and Janet are the only children of Richard.	Richard has exactly 4 children.
contradiction	Edward and Louise are the only children of Frank.	Frank has exactly 3 children.
contradiction	Patrick and Joseph are the only children of Bill.	Bill has exactly 5 children.
contradiction	Fred and Anthony are the only children of Richard.	Richard has exactly 0 children.
contradiction	Ron and Bruce are the only children of Lauren.	Lauren has exactly 4 children.
contradiction	Ben and Ruth are the only children of Keith.	Keith has exactly 3 children.
contradiction	Albert and Al are the only children of Anne.	Anne has exactly 3 children.
contradiction	Ralph and Alison are the only children of Andrea.	Andrea has exactly 5 children.
contradiction	Jay and Laura are the only children of Nicole.	Nicole has exactly 1 children.
contradiction	Jill and Heather are the only children of Grace.	Grace has exactly 1 children.
contradiction	Sarah and Nicole are the only children of Henry.	Henry has exactly 0 children.
contradiction	Kenneth and Ray are the only children of Kim.	Kim has exactly 3 children.
contradiction	Ed and Bobby are the only children of Alexander.	Alexander has exactly 0 children.
contradiction	Cynthia and Ian are the only children of Brian.	Brian has exactly 4 children.
contradiction	Marilyn and Heather are the only children of Dan.	Dan has exactly 5 children.
contradiction	Maria and Samuel are the only children of Peter.	Peter has exactly 4 children.
contradiction	Joe and David are the only children of Steven.	Steven has exactly 4 children.
contradiction	Jean and Larry are the only children of Walter.	Walter has exactly 0 children.
contradiction	Andrea and Mike are the only children of Sue.	Sue has exactly 3 children.
contradiction	Dave and Steven are the only children of Marie.	Marie has exactly 1 children.
contradiction	Ann and Lawrence are the only children of Carolyn.	Carolyn has exactly 1 children.
contradiction	Wendy and Marilyn are the only children of Gary.	Gary has exactly 1 children.
contradiction	Rose and Angela are the only children of Colin.	Colin has exactly 0 children.
contradiction	Anne and Cynthia are the only children of Katherine.	Katherine has exactly 3 children.
contradiction	Sarah and Paul are the only children of Alexandra.	Alexandra has exactly 4 children.
contradiction	Eric and Robert are the only children of William.	William has exactly 0 children.
contradiction	Amy and Kevin are the only children of Sally.	Sally has exactly 0 children.
contradiction	Jason and Carl are the only children of Sharon.	Sharon has exactly 1 children.
contradiction	Martha and Joan are the only children of Katherine.	Katherine has exactly 1 children.
contradiction	Christine and Amy are the only children of Roger.	Roger has exactly 0 children.
contradiction	Billy and Matthew are the only children of Christopher.	Christopher has exactly 3 children.
contradiction	Martin and Victoria are the only children of Alfred.	Alfred has exactly 3 children.
contradiction	Ellen and Carol are the only children of Diane.	Diane has exactly 0 children.
contradiction	Frances and Caroline are the only children of Charlie.	Charlie has exactly 1 children.
contradiction	Sara and Pamela are the only children of Ryan.	Ryan has exactly 4 children.
contradiction	David and Jennifer are the only children of Michelle.	Michelle has exactly 1 children.
contradiction	Greg and Charlotte are the only children of Jeff.	Jeff has exactly 0 children.
contradiction	Greg and Michelle are the only children of Charles.	Charles has exactly 5 children.
contradiction	Carol and Rebecca are the only children of Samuel.	Samuel has exactly 0 children.
contradiction	Charles and Billy are the only children of Maria.	Maria has exactly 0 children.
contradiction	Brian and Daniel are the only children of Alice.	Alice has exactly 5 children.
contradiction	Catherine and Elaine are the only children of Peter.	Peter has exactly 5 children.
contradiction	Claire and Daniel are the only children of Sarah.	Sarah has exactly 1 children.
contradiction	James and Bob are the only children of Carl.	Carl has exactly 0 children.
contradiction	Colin and Wendy are the only children of Jason.	Jason has exactly 1 children.
contradiction	Don and Adam are the only children of Donald.	Donald has exactly 4 children.
contradiction	Harry and Amy are the only children of Ann.	Ann has exactly 1 children.
contradiction	William and Harry are the only children of Louis.	Louis has exactly 3 children.
contradiction	Jason and Elizabeth are the only children of Frances.	Frances has exactly 0 children.
contradiction	Sandra and Kelly are the only children of Dave.	Dave has exactly 4 children.
contradiction	Ralph and Margaret are the only children of Al.	Al has exactly 1 children.
contradiction	Susan and Alfred are the only children of Florence.	Florence has exactly 3 children.
contradiction	Dorothy and Frank are the only children of Janet.	Janet has exactly 0 children.
contradiction	Christine and Fred are the only children of Tim.	Tim has exactly 4 children.
contradiction	Philip and Bruce are the only children of Louise.	Louise has exactly 5 children.
contradiction	Helen and Kelly are the only children of Christine.	Christine has exactly 4 children.
contradiction	Donna and Matt are the only children of Nick.	Nick has exactly 3 children.
contradiction	Jerry and Mary are the only children of Pamela.	Pamela has exactly 0 children.
contradiction	Louise and James are the only children of Edwin.	Edwin has exactly 0 children.
contradiction	Bruce and Virginia are the only children of Greg.	Greg has exactly 4 children.
contradiction	Adam and Thomas are the only children of Roger.	Roger has exactly 3 children.
contradiction	Daniel and Benjamin are the only children of Adam.	Adam has exactly 5 children.
contradiction	Joan and Deborah are the only children of Lawrence.	Lawrence has exactly 0 children.
contradiction	Michelle and Jennifer are the only children of Edwin.	Edwin has exactly 0 children.
contradiction	Diane and Joan are the only children of Maria.	Maria has exactly 5 children.
contradiction	Bob and Carol are the only children of Andrea.	Andrea has exactly 3 children.
contradiction	Ken and Cynthia are the only children of Thomas.	Thomas has exactly 1 children.
contradiction	Robert and Dick are the only children of Lauren.	Lauren has exactly 0 children.
contradiction	Julie and Michael are the only children of Grace.	Grace has exactly 5 children.
contradiction	Anna and Johnny are the only children of Keith.	Keith has exactly 5 children.
contradiction	Patricia and Kate are the only children of Robin.	Robin has exactly 1 children.
contradiction	Keith and Stephanie are the only children of Helen.	Helen has exactly 4 children.
contradiction	Wendy and Alan are the only children of Benjamin.	Benjamin has exactly 3 children.
