entailment	Jack, Alexandra and Anthony are the only children of Sally.	Sally has exactly 3 children.
entailment	Alexander, Jane and Mary are the only children of Cynthia.	Cynthia has exactly 3 children.
entailment	Emily, Jimmy and Philip are the only children of Robert.	Robert has exactly 3 children.
entailment	Frederick, Lawrence and Heather are the only children of Mary.	Mary has exactly 3 children.
entailment	Charles, Johnny and Sam are the only children of Kathleen.	Kathleen has exactly 3 children.
entailment	Heather, Andrea and Roy are the only children of Lynn.	Lynn has exactly 3 children.
entailment	Al, Julie and Steven are the only children of Lauren.	Lauren has exactly 3 children.
entailment	Eleanor, Louis and Simon are the only children of Katherine.	Katherine has exactly 3 children.
entailment	Edith, Suzanne and Tim are the only children of Ruth.	Ruth has exactly 3 children.
entailment	Amy, Nick and Jessica are the only children of Mike.	Mike has exactly 3 children.
entailment	Jeff, Anthony and Francis are the only children of Richard.	Richard has exactly 3 children.
entailment	Andrew, Joe and Kenneth are the only children of Ryan.	Ryan has exactly 3 children.
entailment	Alan, Carol and Eric are the only children of Emily.	Emily has exactly 3 children.
entailment	Sharon, Joseph and Steve are the only children of Kate.	Kate has exactly 3 children.
entailment	Jim, Keith and Katie are the only children of Fiona.	Fiona has exactly 3 children.
entailment	Philip, Edward and Tim are the only children of Joseph.	Joseph has exactly 3 children.
entailment	Suzanne, Sam and Jerry are the only children of Eleanor.	Eleanor has exactly 3 children.
entailment	Colin, Dan and Martha are the only children of Laura.	Laura has exactly 3 children.
entailment	David, Barbara and Alexandra are the only children of Bill.	Bill has exactly 3 children.
entailment	Helen, Jason and Sharon are the only children of Jay.	Jay has exactly 3 children.
entailment	Jennifer, Alfred and Melissa are the only children of Helen.	Helen has exactly 3 children.
entailment	Edith, Christopher and Ken are the only children of Alexander.	Alexander has exactly 3 children.
entailment	Gary, Ken and Anna are the only children of Matthew.	Matthew has exactly 3 children.
entailment	Florence, James and Ray are the only children of Katherine.	Katherine has exactly 3 children.
entailment	Larry, David and Anthony are the only children of Jill.	Jill has exactly 3 children.
entailment	Ron, Ralph and Margaret are the only children of Larry.	Larry has exactly 3 children.
entailment	George, Claire and David are the only children of Mary.	Mary has exactly 3 children.
entailment	Matt, Sara and Larry are the only children of Daniel.	Daniel has exactly 3 children.
entailment	Mark, Tim and Amanda are the only children of Kim.	Kim has exactly 3 children.
entailment	Ed, Ashley and James are the only children of Sam.	Sam has exactly 3 children.
entailment	Simon, Carl and Martin are the only children of Fiona.	Fiona has exactly 3 children.
entailment	Lisa, Rose and Ann are the only children of Laura.	Laura has exactly 3 children.
entailment	Joseph, Christine and Anne are the only children of Alison.	Alison has exactly 3 children.
entailment	Charlotte, Lauren and Carolyn are the only children of Emily.	Emily has exactly 3 children.
entailment	Nick, Joe and Julie are the only children of Anna.	Anna has exactly 3 children.
entailment	Ian, Grace and Francis are the only children of Henry.	Henry has exactly 3 children.
entailment	Gary, Kathryn and Robert are the only children of Charles.	Charles has exactly 3 children.
entailment	Maria, Charlie and Barbara are the only children of Albert.	Albert has exactly 3 children.
entailment	Edwin, Scott and Jerry are the only children of Patrick.	Patrick has exactly 3 children.
entailment	Thomas, Elaine and Larry are the only children of Virginia.	Virginia has exactly 3 children.
entailment	Brian, Charles and Chris are the only children of Nicole.	Nicole has exactly 3 children.
entailment	Sam, Richard and Don are the only children of Jean.	Jean has exactly 3 children.
entailment	Matthew, Carolyn and Joseph are the only children of Sue.	Sue has exactly 3 children.
entailment	Katherine, Mary and Kim are the only children of Ashley.	Ashley has exactly 3 children.
entailment	Philip, Charles and Colin are the only children of Henry.	Henry has exactly 3 children.
entailment	Scott, Edith and Donna are the only children of Mike.	Mike has exactly 3 children.
entailment	Virginia, Anne and Rebecca are the only children of Ann.	Ann has exactly 3 children.
entailment	Johnny, Ann and Steve are the only children of Marie.	Marie has exactly 3 children.
entailment	George, Matthew and Walter are the only children of Tim.	Tim has exactly 3 children.
entailment	John, Ken and Alan are the only children of Alexandra.	Alexandra has exactly 3 children.
entailment	Andrea, Nick and Patrick are the only children of Linda.	Linda has exactly 3 children.
entailment	Alfred, Daniel and Alison are the only children of Joseph.	Joseph has exactly 3 children.
entailment	Ed, Steve and Edith are the only children of Greg.	Greg has exactly 3 children.
entailment	Ellen, Colin and Ryan are the only children of Ralph.	Ralph has exactly 3 children.
entailment	Ben, Katherine and Jessica are the only children of Jennifer.	Jennifer has exactly 3 children.
entailment	Andrea, Daniel and Joe are the only children of Thomas.	Thomas has exactly 3 children.
entailment	Jessica, Pamela and Rose are the only children of Sara.	Sara has exactly 3 children.
entailment	Barbara, Richard and Joe are the only children of Don.	Don has exactly 3 children.
entailment	Louis, Jason and Hugh are the only children of Ralph.	Ralph has exactly 3 children.
entailment	Helen, Keith and Annie are the only children of Walter.	Walter has exactly 3 children.
entailment	Emily, Ryan and Michelle are the only children of Samuel.	Samuel has exactly 3 children.
entailment	Diane, Carolyn and Michael are the only children of Diana.	Diana has exactly 3 children.
entailment	Peter, Albert and Sam are the only children of Maria.	Maria has exactly 3 children.
entailment	Robert, Sally and Christine are the only children of Kate.	Kate has exactly 3 children.
entailment	Katie, Arthur and Evelyn are the only children of Sally.	Sally has exactly 3 children.
entailment	Ian, Marie and Patricia are the only children of Chris.	Chris has exactly 3 children.
entailment	Carl, Martin and Kate are the only children of Joseph.	Joseph has exactly 3 children.
entailment	Alexandra, Howard and Sandra are the only children of Larry.	Larry has exactly 3 children.
entailment	Sam, Suzanne and Alison are the only children of Edward.	Edward has exactly 3 children.
entailment	Greg, Tony and Dorothy are the only children of Ron.	Ron has exactly 3 children.
entailment	Julie, Kim and Amy are the only children of Philip.	Philip has exactly 3 children.
entailment	Chris, Alexandra and Bill are the only children of Frank.	Frank has exactly 3 children.
entailment	Sally, Dorothy and Donald are the only children of Rose.	Rose has exactly 3 children.
entailment	Ashley, Diana and Donald are the only children of Don.	Don has exactly 3 children.
entailment	Judy, Patrick and Bill are the only children of Anthony.	Anthony has exactly 3 children.
entailment	Maria, Ian and Michael are the only children of Ann.	Ann has exactly 3 children.
entailment	Martin, Eric and Alison are the only children of Jack.	Jack has exactly 3 children.
entailment	Matthew, Larry and Joe are the only children of Lynn.	Lynn has exactly 3 children.
entailment	Eleanor, Alex and Dan are the only children of Sophie.	Sophie has exactly 3 children.
entailment	Sara, Ken and Louise are the only children of Katherine.	Katherine has exactly 3 children.
entailment	Robert, Jack and Fred are the only children of John.	John has exactly 3 children.
entailment	Catherine, Richard and Arthur are the only children of Alfred.	Alfred has exactly 3 children.
entailment	Andrew, Marie and Janet are the only children of Jay.	Jay has exactly 3 children.
entailment	Joe, Paul and Jonathan are the only children of Charlie.	Charlie has exactly 3 children.
entailment	Anthony, Ray and Lawrence are the only children of Gary.	Gary has exactly 3 children.
entailment	Martha, Jessica and Francis are the only children of Angela.	Angela has exactly 3 children.
entailment	Jonathan, Ann and Richard are the only children of Johnny.	Johnny has exactly 3 children.
entailment	Adam, Annie and Ray are the only children of Marie.	Marie has exactly 3 children.
entailment	Larry, Harold and Andrea are the only children of Albert.	Albert has exactly 3 children.
entailment	Keith, Laura and Alan are the only children of Alison.	Alison has exactly 3 children.
entailment	Jill, Johnny and Julia are the only children of Joe.	Joe has exactly 3 children.
entailment	Francis, Alex and Rebecca are the only children of Charles.	Charles has exactly 3 children.
entailment	Janet, Pamela and Mike are the only children of Chris.	Chris has exactly 3 children.
entailment	Colin, Matthew and Michael are the only children of Roy.	Roy has exactly 3 children.
entailment	Jerry, Frances and Dan are the only children of Julia.	Julia has exactly 3 children.
entailment	Carolyn, Andrew and Michael are the only children of Louise.	Louise has exactly 3 children.
entailment	Adam, Ryan and Linda are the only children of Sharon.	Sharon has exactly 3 children.
entailment	Brian, Bobby and Sally are the only children of Bruce.	Bruce has exactly 3 children.
entailment	Kathleen, Judith and Andrea are the only children of Harry.	Harry has exactly 3 children.
entailment	Edith, Philip and Jane are the only children of Sam.	Sam has exactly 3 children.
entailment	Albert, Bruce and Michael are the only children of Diana.	Diana has exactly 3 children.
entailment	Sarah, Caroline and Samuel are the only children of Michelle.	Michelle has exactly 3 children.
entailment	Keith, Judy and Sandra are the only children of Steven.	Steven has exactly 3 children.
entailment	Frederick, Lauren and Billy are the only children of Nancy.	Nancy has exactly 3 children.
entailment	Billy, Louis and Karen are the only children of Eleanor.	Eleanor has exactly 3 children.
entailment	Louise, Mark and Scott are the only children of Charles.	Charles has exactly 3 children.
entailment	Judy, Rose and Andrew are the only children of George.	George has exactly 3 children.
entailment	Tim, Jeff and Bruce are the only children of Victoria.	Victoria has exactly 3 children.
entailment	Tony, Kenneth and Robin are the only children of Linda.	Linda has exactly 3 children.
entailment	Christopher, Charles and Charlie are the only children of Dorothy.	Dorothy has exactly 3 children.
entailment	Kevin, Keith and Don are the only children of Alex.	Alex has exactly 3 children.
entailment	Charles, Alan and Kathryn are the only children of Ken.	Ken has exactly 3 children.
entailment	Joe, Susan and Kate are the only children of Nick.	Nick has exactly 3 children.
entailment	Andrew, Patrick and Edward are the only children of Walter.	Walter has exactly 3 children.
entailment	Dan, Jonathan and Albert are the only children of Jennifer.	Jennifer has exactly 3 children.
entailment	Joan, David and Richard are the only children of Dave.	Dave has exactly 3 children.
entailment	Caroline, Jill and Charles are the only children of Rose.	Rose has exactly 3 children.
entailment	Stephen, Stephanie and Robert are the only children of Carolyn.	Carolyn has exactly 3 children.
entailment	Robert, Keith and Ruth are the only children of Sandra.	Sandra has exactly 3 children.
entailment	Dave, Ray and Ken are the only children of Rachel.	Rachel has exactly 3 children.
entailment	Ann, Alex and Donna are the only children of Jim.	Jim has exactly 3 children.
entailment	Jessica, Kathy and Ben are the only children of Frank.	Frank has exactly 3 children.
entailment	Frances, Lawrence and Daniel are the only children of Jay.	Jay has exactly 3 children.
entailment	Tim, Patrick and David are the only children of Catherine.	Catherine has exactly 3 children.
entailment	Ryan, Virginia and Marilyn are the only children of Steve.	Steve has exactly 3 children.
entailment	Kevin, Anthony and Melissa are the only children of Fiona.	Fiona has exactly 3 children.
entailment	Walter, Melissa and Sandra are the only children of Keith.	Keith has exactly 3 children.
entailment	Stephen, Ruth and Bobby are the only children of Virginia.	Virginia has exactly 3 children.
entailment	Grace, Linda and Jessica are the only children of Johnny.	Johnny has exactly 3 children.
entailment	Judith, Maria and Caroline are the only children of Jim.	Jim has exactly 3 children.
entailment	Harriet, Philip and Melissa are the only children of Matt.	Matt has exactly 3 children.
entailment	Frank, Caroline and Fred are the only children of Angela.	Angela has exactly 3 children.
entailment	Keith, Richard and Helen are the only children of Ruth.	Ruth has exactly 3 children.
entailment	Dick, Angela and Dan are the only children of Ian.	Ian has exactly 3 children.
entailment	Dan, Stephanie and Emily are the only children of Charles.	Charles has exactly 3 children.
entailment	Ian, Brian and Christine are the only children of Harriet.	Harriet has exactly 3 children.
entailment	Ian, Matthew and Judith are the only children of Cynthia.	Cynthia has exactly 3 children.
entailment	Robert, Gary and Alexander are the only children of Don.	Don has exactly 3 children.
entailment	Angela, Kathy and Jane are the only children of Caroline.	Caroline has exactly 3 children.
entailment	Dick, Francis and Mark are the only children of Jason.	Jason has exactly 3 children.
entailment	Melissa, Evelyn and William are the only children of Harry.	Harry has exactly 3 children.
entailment	Nicole, Sue and Peter are the only children of Sarah.	Sarah has exactly 3 children.
entailment	Edith, Matt and Dave are the only children of Bill.	Bill has exactly 3 children.
entailment	Matt, William and Grace are the only children of Jennifer.	Jennifer has exactly 3 children.
entailment	Scott, Christopher and Mike are the only children of Frederick.	Frederick has exactly 3 children.
entailment	Margaret, Barbara and Roy are the only children of Joe.	Joe has exactly 3 children.
entailment	Ralph, Sara and Katherine are the only children of Fred.	Fred has exactly 3 children.
entailment	Richard, Katherine and Stephen are the only children of Rebecca.	Rebecca has exactly 3 children.
entailment	Scott, Cynthia and Matthew are the only children of Bruce.	Bruce has exactly 3 children.
entailment	Thomas, Judith and Ruth are the only children of Edwin.	Edwin has exactly 3 children.
entailment	Jay, Ellen and Kathy are the only children of Ann.	Ann has exactly 3 children.
entailment	Frederick, Scott and Ashley are the only children of Betty.	Betty has exactly 3 children.
entailment	Kevin, Carl and Johnny are the only children of Bill.	Bill has exactly 3 children.
entailment	Jeff, Joseph and Jonathan are the only children of Alexander.	Alexander has exactly 3 children.
entailment	Harriet, Harry and Ian are the only children of Kevin.	Kevin has exactly 3 children.
entailment	David, Lawrence and Charlotte are the only children of Paul.	Paul has exactly 3 children.
entailment	Dorothy, Kathleen and Sally are the only children of Sarah.	Sarah has exactly 3 children.
entailment	Scott, Louise and Susan are the only children of Donald.	Donald has exactly 3 children.
entailment	Lauren, Betty and Katherine are the only children of Stephen.	Stephen has exactly 3 children.
entailment	Harold, Brian and Cynthia are the only children of Helen.	Helen has exactly 3 children.
entailment	Albert, Joseph and Sandra are the only children of Anne.	Anne has exactly 3 children.
entailment	Adam, Emma and Johnny are the only children of Sara.	Sara has exactly 3 children.
entailment	Jill, Benjamin and Louis are the only children of Martha.	Martha has exactly 3 children.
entailment	Albert, Virginia and Caroline are the only children of Harriet.	Harriet has exactly 3 children.
entailment	Emma, Samuel and Caroline are the only children of Hugh.	Hugh has exactly 3 children.
entailment	Grace, Rose and Carolyn are the only children of Frank.	Frank has exactly 3 children.
entailment	Adam, Samuel and Charlotte are the only children of Tom.	Tom has exactly 3 children.
entailment	Lauren, Ann and Deborah are the only children of Jonathan.	Jonathan has exactly 3 children.
entailment	Jonathan, Jason and Maria are the only children of Ed.	Ed has exactly 3 children.
entailment	Judy, Michael and Ann are the only children of Sally.	Sally has exactly 3 children.
entailment	Andrew, Marie and Lauren are the only children of Donna.	Donna has exactly 3 children.
entailment	Joe, Charlotte and Albert are the only children of Suzanne.	Suzanne has exactly 3 children.
entailment	Julia, Elizabeth and Jennifer are the only children of Carl.	Carl has exactly 3 children.
entailment	Ashley, Andrea and Anna are the only children of Hugh.	Hugh has exactly 3 children.
entailment	Sue, Ray and Sally are the only children of Bruce.	Bruce has exactly 3 children.
entailment	Dan, Michael and Billy are the only children of Andrea.	Andrea has exactly 3 children.
entailment	Jason, Elizabeth and Wendy are the only children of Alice.	Alice has exactly 3 children.
entailment	Martha, Philip and Johnny are the only children of Heather.	Heather has exactly 3 children.
entailment	Andrea, Steven and John are the only children of Michelle.	Michelle has exactly 3 children.
entailment	Janet, Sophie and Sarah are the only children of Stephen.	Stephen has exactly 3 children.
entailment	Dorothy, Richard and Kathryn are the only children of Robin.	Robin has exactly 3 children.
entailment	Roy, Alexander and Joseph are the only children of Cynthia.	Cynthia has exactly 3 children.
entailment	Albert, Elizabeth and Harriet are the only children of Janet.	Janet has exactly 3 children.
entailment	Elizabeth, James and Anthony are the only children of Laura.	Laura has exactly 3 children.
entailment	Bruce, Nicole and Bob are the only children of Helen.	Helen has exactly 3 children.
entailment	Ken, Jill and Harriet are the only children of Sarah.	Sarah has exactly 3 children.
entailment	Adam, Jessica and Keith are the only children of Al.	Al has exactly 3 children.
entailment	Suzanne, Mike and Alice are the only children of Roy.	Roy has exactly 3 children.
entailment	Lisa, Joan and Christopher are the only children of Suzanne.	Suzanne has exactly 3 children.
entailment	Judith, Joan and Jerry are the only children of Fred.	Fred has exactly 3 children.
entailment	Louis, Albert and Virginia are the only children of Edwin.	Edwin has exactly 3 children.
entailment	Laura, Donald and Lauren are the only children of Jean.	Jean has exactly 3 children.
entailment	Ashley, Kathy and Carolyn are the only children of Jay.	Jay has exactly 3 children.
entailment	Jonathan, Jimmy and Andrew are the only children of Elaine.	Elaine has exactly 3 children.
entailment	Ray, Simon and Fred are the only children of Mary.	Mary has exactly 3 children.
entailment	Marie, Alfred and Stephen are the only children of Howard.	Howard has exactly 3 children.
entailment	Catherine, Adam and Eleanor are the only children of Robert.	Robert has exactly 3 children.
entailment	Sharon, Kim and Julia are the only children of Michelle.	Michelle has exactly 3 children.
entailment	Pamela, Colin and Christopher are the only children of Leslie.	Leslie has exactly 3 children.
entailment	Angela, Elaine and Jessica are the only children of Lawrence.	Lawrence has exactly 3 children.
entailment	Edith, Caroline and Francis are the only children of Leslie.	Leslie has exactly 3 children.
entailment	Jason, Judy and Roger are the only children of Colin.	Colin has exactly 3 children.
entailment	Tony, Helen and Andrew are the only children of Lucy.	Lucy has exactly 3 children.
entailment	Nick, Elizabeth and Annie are the only children of Christine.	Christine has exactly 3 children.
entailment	Patrick, Don and Michael are the only children of Charles.	Charles has exactly 3 children.
entailment	Harriet, Frances and Peter are the only children of Diana.	Diana has exactly 3 children.
entailment	Andrea, Alison and Kate are the only children of Marilyn.	Marilyn has exactly 3 children.
entailment	Gary, Harriet and Joseph are the only children of Rebecca.	Rebecca has exactly 3 children.
