entailment	Matt, Amy and Anne are the only children of Amanda.	Amanda has exactly 3 children.
entailment	Philip, Evelyn and Sarah are the only children of Peter.	Peter has exactly 3 children.
entailment	Ann, Sara and Charlotte are the only children of Alison.	Alison has exactly 3 children.
entailment	Louis, Claire and Larry are the only children of Joe.	Joe has exactly 3 children.
entailment	Bob, Steve and Katherine are the only children of Kim.	Kim has exactly 3 children.
entailment	Howard, Susan and Johnny are the only children of Marie.	Marie has exactly 3 children.
entailment	Dorothy, Sarah and Lynn are the only children of Tom.	Tom has exactly 3 children.
entailment	Jim, Kathleen and Kathy are the only children of Ben.	Ben has exactly 3 children.
entailment	Leslie, Judy and Benjamin are the only children of Scott.	Scott has exactly 3 children.
entailment	Kelly, Anna and Tom are the only children of Alfred.	Alfred has exactly 3 children.
entailment	Katie, Walter and Hugh are the only children of Anthony.	Anthony has exactly 3 children.
entailment	Kathy, Barbara and Jerry are the only children of Kelly.	Kelly has exactly 3 children.
entailment	Ralph, Jerry and Ron are the only children of Carolyn.	Carolyn has exactly 3 children.
entailment	John, David and James are the only children of Marie.	Marie has exactly 3 children.
entailment	Linda, Charlotte and Kathleen are the only children of Matt.	Matt has exactly 3 children.
entailment	Deborah, Charlie and Grace are the only children of Katie.	Katie has exactly 3 children.
entailment	Matt, Henry and Barbara are the only children of Eric.	Eric has exactly 3 children.
entailment	Barbara, Charlotte and Cynthia are the only children of Judith.	Judith has exactly 3 children.
entailment	Ryan, Amy and Matt are the only children of Wendy.	Wendy has exactly 3 children.
entailment	Steve, Karen and Roy are the only children of Rose.	Rose has exactly 3 children.
entailment	Louis, Sharon and Charlie are the only children of Lisa.	Lisa has exactly 3 children.
entailment	Rose, Amanda and Kenneth are the only children of Charlie.	Charlie has exactly 3 children.
entailment	David, Simon and Judith are the only children of Ralph.	Ralph has exactly 3 children.
entailment	Sally, Robert and Cynthia are the only children of Maria.	Maria has exactly 3 children.
entailment	Martin, Fiona and Bill are the only children of Heather.	Heather has exactly 3 children.
entailment	Emily, Jason and Lawrence are the only children of Thomas.	Thomas has exactly 3 children.
entailment	Karen, Jill and Bruce are the only children of Wendy.	Wendy has exactly 3 children.
entailment	Don, Arthur and Harold are the only children of Nick.	Nick has exactly 3 children.
entailment	Kathy, Andrea and Harriet are the only children of Victoria.	Victoria has exactly 3 children.
entailment	Sophie, Florence and Simon are the only children of Kenneth.	Kenneth has exactly 3 children.
entailment	Andrea, Ashley and Nancy are the only children of Emily.	Emily has exactly 3 children.
entailment	George, Adam and Susan are the only children of Lawrence.	Lawrence has exactly 3 children.
entailment	Linda, Eric and Bobby are the only children of Florence.	Florence has exactly 3 children.
entailment	Maria, Christine and Emily are the only children of Patrick.	Patrick has exactly 3 children.
entailment	Katherine, Sam and Claire are the only children of Diane.	Diane has exactly 3 children.
entailment	Frank, Lawrence and Larry are the only children of Michelle.	Michelle has exactly 3 children.
entailment	Judy, Roy and Donald are the only children of Peter.	Peter has exactly 3 children.
entailment	Wendy, Mary and Sharon are the only children of Kathleen.	Kathleen has exactly 3 children.
entailment	Jason, Lynn and Bruce are the only children of Elaine.	Elaine has exactly 3 children.
entailment	Sam, Kenneth and Joseph are the only children of Roy.	Roy has exactly 3 children.
entailment	Jonathan, Carl and David are the only children of Victoria.	Victoria has exactly 3 children.
entailment	Charlotte, Albert and Ed are the only children of Scott.	Scott has exactly 3 children.
entailment	Alexander, Kelly and Alice are the only children of Lynn.	Lynn has exactly 3 children.
entailment	Jim, Patrick and Lauren are the only children of Simon.	Simon has exactly 3 children.
entailment	Howard, Alfred and Jim are the only children of Thomas.	Thomas has exactly 3 children.
entailment	Susan, Bill and Ruth are the only children of Steve.	Steve has exactly 3 children.
entailment	Frances, Andrea and Brian are the only children of Walter.	Walter has exactly 3 children.
entailment	Jack, Elizabeth and Roy are the only children of Susan.	Susan has exactly 3 children.
entailment	Marie, Rachel and Susan are the only children of Helen.	Helen has exactly 3 children.
entailment	Edward, Sophie and Chris are the only children of Helen.	Helen has exactly 3 children.
entailment	Edward, Ruth and Adam are the only children of Howard.	Howard has exactly 3 children.
entailment	Al, Joan and Anthony are the only children of Kathleen.	Kathleen has exactly 3 children.
entailment	Anna, Al and Edward are the only children of Betty.	Betty has exactly 3 children.
entailment	Harriet, Colin and Alex are the only children of Jonathan.	Jonathan has exactly 3 children.
entailment	Sara, Christine and Judith are the only children of Eleanor.	Eleanor has exactly 3 children.
entailment	Evelyn, Virginia and Colin are the only children of Sandra.	Sandra has exactly 3 children.
entailment	Harriet, Rachel and Jean are the only children of Robin.	Robin has exactly 3 children.
entailment	Ian, Philip and Steven are the only children of Adam.	Adam has exactly 3 children.
entailment	Kathryn, Christopher and Bill are the only children of Carol.	Carol has exactly 3 children.
entailment	Barbara, Colin and Ashley are the only children of Margaret.	Margaret has exactly 3 children.
entailment	Charlotte, Evelyn and Alexander are the only children of Ryan.	Ryan has exactly 3 children.
entailment	Joe, Sarah and Matthew are the only children of Edith.	Edith has exactly 3 children.
entailment	George, Greg and Julie are the only children of Bruce.	Bruce has exactly 3 children.
entailment	Scott, Pamela and Melissa are the only children of Tony.	Tony has exactly 3 children.
entailment	Laura, Christine and Patrick are the only children of Edith.	Edith has exactly 3 children.
entailment	Laura, David and Ashley are the only children of Wendy.	Wendy has exactly 3 children.
entailment	Virginia, Grace and Alexander are the only children of Heather.	Heather has exactly 3 children.
entailment	Mary, Alice and Carl are the only children of Kenneth.	Kenneth has exactly 3 children.
entailment	Joe, Harriet and Peter are the only children of Rose.	Rose has exactly 3 children.
entailment	Harry, Eleanor and Kim are the only children of Frank.	Frank has exactly 3 children.
entailment	Lisa, Helen and Daniel are the only children of Matthew.	Matthew has exactly 3 children.
entailment	Nancy, Barbara and Walter are the only children of Kathy.	Kathy has exactly 3 children.
entailment	Steve, Louis and Virginia are the only children of Carol.	Carol has exactly 3 children.
entailment	Mike, Grace and Paul are the only children of Nancy.	Nancy has exactly 3 children.
entailment	Rose, Michelle and Annie are the only children of Nick.	Nick has exactly 3 children.
entailment	Leslie, Kevin and Cynthia are the only children of Tony.	Tony has exactly 3 children.
entailment	Jimmy, Jason and Lawrence are the only children of Paul.	Paul has exactly 3 children.
entailment	Emma, Rachel and Tony are the only children of Dave.	Dave has exactly 3 children.
entailment	Michael, Kathryn and Hugh are the only children of Simon.	Simon has exactly 3 children.
entailment	Philip, Edward and Kathy are the only children of Paul.	Paul has exactly 3 children.
entailment	Amy, Linda and Melissa are the only children of Diana.	Diana has exactly 3 children.
entailment	Kathy, Katherine and Charles are the only children of Martin.	Martin has exactly 3 children.
entailment	Lawrence, Matt and Hugh are the only children of Carl.	Carl has exactly 3 children.
entailment	Wendy, Lawrence and Sally are the only children of Anthony.	Anthony has exactly 3 children.
entailment	Jimmy, Patrick and Heather are the only children of Katie.	Katie has exactly 3 children.
entailment	Jennifer, Janet and Daniel are the only children of Lynn.	Lynn has exactly 3 children.
entailment	Stephen, Roy and Billy are the only children of Julie.	Julie has exactly 3 children.
entailment	Ron, Henry and Anne are the only children of Daniel.	Daniel has exactly 3 children.
entailment	Thomas, Joe and Martha are the only children of Lucy.	Lucy has exactly 3 children.
entailment	Anne, Margaret and Virginia are the only children of Rose.	Rose has exactly 3 children.
entailment	Suzanne, Kim and Stephen are the only children of Harriet.	Harriet has exactly 3 children.
entailment	Jack, Melissa and Katherine are the only children of William.	William has exactly 3 children.
entailment	Harold, Kenneth and Kathryn are the only children of Carol.	Carol has exactly 3 children.
entailment	Lisa, Stephen and Kenneth are the only children of Ruth.	Ruth has exactly 3 children.
entailment	Bill, Bob and Donald are the only children of Christine.	Christine has exactly 3 children.
entailment	Helen, Sophie and Frances are the only children of Katherine.	Katherine has exactly 3 children.
entailment	Tom, Judith and John are the only children of Walter.	Walter has exactly 3 children.
entailment	Alan, Don and Marilyn are the only children of Bruce.	Bruce has exactly 3 children.
entailment	Kim, Philip and Kathryn are the only children of Fred.	Fred has exactly 3 children.
entailment	Ken, Alfred and Joe are the only children of Steve.	Steve has exactly 3 children.
entailment	Harold, Peter and Elaine are the only children of Eric.	Eric has exactly 3 children.
entailment	Emma, Kathy and Karen are the only children of Nicole.	Nicole has exactly 3 children.
entailment	William, Victoria and Jill are the only children of Keith.	Keith has exactly 3 children.
entailment	Paul, Lisa and Ian are the only children of Jill.	Jill has exactly 3 children.
entailment	Eleanor, Chris and Tom are the only children of Harold.	Harold has exactly 3 children.
entailment	Johnny, Peter and Jane are the only children of Francis.	Francis has exactly 3 children.
entailment	Katherine, Susan and Michelle are the only children of Roger.	Roger has exactly 3 children.
entailment	Charlie, Michael and Pamela are the only children of Ralph.	Ralph has exactly 3 children.
entailment	Arthur, Jane and Matthew are the only children of Charlotte.	Charlotte has exactly 3 children.
entailment	Keith, Walter and Alison are the only children of Mike.	Mike has exactly 3 children.
entailment	Ruth, Sharon and Victoria are the only children of Daniel.	Daniel has exactly 3 children.
entailment	Cynthia, Anna and Jimmy are the only children of Ron.	Ron has exactly 3 children.
entailment	Arthur, Fred and Elaine are the only children of Jack.	Jack has exactly 3 children.
entailment	Ryan, Jim and Rachel are the only children of Kathryn.	Kathryn has exactly 3 children.
entailment	Anne, Matt and Simon are the only children of Al.	Al has exactly 3 children.
entailment	Daniel, Janet and Matt are the only children of Samuel.	Samuel has exactly 3 children.
entailment	Thomas, David and Katie are the only children of Harriet.	Harriet has exactly 3 children.
entailment	Emma, Fiona and Sara are the only children of Keith.	Keith has exactly 3 children.
entailment	Anne, Alison and Alfred are the only children of Jimmy.	Jimmy has exactly 3 children.
entailment	Jane, Lisa and Greg are the only children of Robin.	Robin has exactly 3 children.
entailment	Amanda, Rachel and Jill are the only children of Susan.	Susan has exactly 3 children.
entailment	Henry, Kathleen and Linda are the only children of Philip.	Philip has exactly 3 children.
entailment	Rose, Suzanne and Michelle are the only children of Julia.	Julia has exactly 3 children.
entailment	Bruce, Betty and Fred are the only children of Dorothy.	Dorothy has exactly 3 children.
entailment	Alison, Ron and Roy are the only children of Tim.	Tim has exactly 3 children.
entailment	Daniel, Lauren and Matthew are the only children of Henry.	Henry has exactly 3 children.
entailment	Mary, Rachel and Richard are the only children of Michelle.	Michelle has exactly 3 children.
entailment	George, Leslie and Patricia are the only children of Deborah.	Deborah has exactly 3 children.
entailment	Nicole, Edward and John are the only children of Melissa.	Melissa has exactly 3 children.
entailment	Andrew, Marie and Joseph are the only children of Caroline.	Caroline has exactly 3 children.
entailment	Larry, Walter and Samuel are the only children of Philip.	Philip has exactly 3 children.
entailment	Alison, Patricia and Richard are the only children of Kate.	Kate has exactly 3 children.
entailment	Anthony, Christine and Caroline are the only children of Matthew.	Matthew has exactly 3 children.
entailment	Ray, Roger and Tim are the only children of Kate.	Kate has exactly 3 children.
entailment	Judy, Tom and Joan are the only children of Michelle.	Michelle has exactly 3 children.
entailment	Johnny, Harriet and Sophie are the only children of Dick.	Dick has exactly 3 children.
entailment	Michelle, Hugh and Philip are the only children of Christopher.	Christopher has exactly 3 children.
entailment	Billy, Martha and Rose are the only children of Jennifer.	Jennifer has exactly 3 children.
entailment	Daniel, Ruth and Ray are the only children of Patrick.	Patrick has exactly 3 children.
entailment	Tom, Simon and Edward are the only children of Martha.	Martha has exactly 3 children.
entailment	Cynthia, Frances and Sue are the only children of Rachel.	Rachel has exactly 3 children.
entailment	Howard, Roger and Betty are the only children of Caroline.	Caroline has exactly 3 children.
entailment	Jerry, Brian and Donald are the only children of Frederick.	Frederick has exactly 3 children.
entailment	Barbara, Thomas and Jane are the only children of Victoria.	Victoria has exactly 3 children.
entailment	Virginia, Jeff and Diane are the only children of Tim.	Tim has exactly 3 children.
entailment	Suzanne, Harry and Daniel are the only children of Claire.	Claire has exactly 3 children.
entailment	Marilyn, Donald and Paul are the only children of Sam.	Sam has exactly 3 children.
entailment	Patrick, Martha and Rose are the only children of Andrea.	Andrea has exactly 3 children.
entailment	Thomas, Carolyn and Samuel are the only children of Harold.	Harold has exactly 3 children.
entailment	Roger, Anne and Mike are the only children of Simon.	Simon has exactly 3 children.
entailment	Alice, Victoria and Andrea are the only children of Jean.	Jean has exactly 3 children.
entailment	Frederick, Rose and Sally are the only children of Scott.	Scott has exactly 3 children.
entailment	Suzanne, Anne and Marilyn are the only children of Carolyn.	Carolyn has exactly 3 children.
entailment	Jay, Fred and Angela are the only children of Alice.	Alice has exactly 3 children.
entailment	Heather, Helen and Walter are the only children of Martha.	Martha has exactly 3 children.
entailment	Kim, Al and Martha are the only children of Alexander.	Alexander has exactly 3 children.
entailment	Carolyn, Diana and Helen are the only children of Pamela.	Pamela has exactly 3 children.
entailment	Albert, Wendy and Larry are the only children of Dorothy.	Dorothy has exactly 3 children.
entailment	Fred, Fiona and Mark are the only children of Arthur.	Arthur has exactly 3 children.
entailment	Frances, Benjamin and Nicole are the only children of Edith.	Edith has exactly 3 children.
entailment	Joan, Betty and Mike are the only children of Jay.	Jay has exactly 3 children.
entailment	Ralph, Sandra and Ken are the only children of Jane.	Jane has exactly 3 children.
entailment	Alfred, Andrew and Jane are the only children of Anne.	Anne has exactly 3 children.
entailment	Albert, Margaret and Ray are the only children of Susan.	Susan has exactly 3 children.
entailment	Amanda, Margaret and Judy are the only children of Jason.	Jason has exactly 3 children.
entailment	Bob, Fiona and Caroline are the only children of Carl.	Carl has exactly 3 children.
entailment	Heather, Diana and Ashley are the only children of Alex.	Alex has exactly 3 children.
entailment	Sally, Ryan and Janet are the only children of Frances.	Frances has exactly 3 children.
entailment	Matthew, Marilyn and Lisa are the only children of Pamela.	Pamela has exactly 3 children.
entailment	Ray, Lynn and Deborah are the only children of Donald.	Donald has exactly 3 children.
entailment	Billy, Scott and Barbara are the only children of Jessica.	Jessica has exactly 3 children.
entailment	Kevin, Cynthia and Tom are the only children of Amanda.	Amanda has exactly 3 children.
entailment	Alison, Louise and Al are the only children of Carolyn.	Carolyn has exactly 3 children.
entailment	Emily, Steve and Alfred are the only children of Lauren.	Lauren has exactly 3 children.
entailment	Lawrence, Julia and Sam are the only children of Matt.	Matt has exactly 3 children.
entailment	Kate, Dan and Marie are the only children of Ed.	Ed has exactly 3 children.
entailment	Robert, Frances and Grace are the only children of Christine.	Christine has exactly 3 children.
entailment	Eleanor, Martha and Laura are the only children of Stephen.	Stephen has exactly 3 children.
entailment	Simon, Edwin and Donald are the only children of Stephanie.	Stephanie has exactly 3 children.
entailment	Adam, Dave and Alexander are the only children of Jane.	Jane has exactly 3 children.
entailment	Virginia, Christine and Carolyn are the only children of Jessica.	Jessica has exactly 3 children.
entailment	Diane, Stephen and Ashley are the only children of Peter.	Peter has exactly 3 children.
entailment	Harriet, Kate and Elizabeth are the only children of Stephen.	Stephen has exactly 3 children.
entailment	Betty, Ashley and Julie are the only children of Joseph.	Joseph has exactly 3 children.
entailment	Dave, Jim and Kathy are the only children of Charlotte.	Charlotte has exactly 3 children.
entailment	Patrick, Deborah and Al are the only children of Ed.	Ed has exactly 3 children.
entailment	Ian, Sharon and Carol are the only children of Barbara.	Barbara has exactly 3 children.
entailment	Carolyn, Evelyn and Elaine are the only children of George.	George has exactly 3 children.
entailment	Heather, Matthew and Sara are the only children of Larry.	Larry has exactly 3 children.
entailment	Scott, Grace and Patricia are the only children of Walter.	Walter has exactly 3 children.
entailment	Jerry, Benjamin and Anne are the only children of Ralph.	Ralph has exactly 3 children.
entailment	Anne, Barbara and Diane are the only children of Ellen.	Ellen has exactly 3 children.
entailment	Alexander, Sharon and Stephen are the only children of Diana.	Diana has exactly 3 children.
entailment	Harriet, Ray and Rebecca are the only children of Nicole.	Nicole has exactly 3 children.
entailment	Michael, Karen and Harold are the only children of Helen.	Helen has exactly 3 children.
entailment	Sue, Florence and Ed are the only children of Andrew.	Andrew has exactly 3 children.
entailment	Jeff, Adam and Jonathan are the only children of Leslie.	Leslie has exactly 3 children.
entailment	Jason, Michael and Peter are the only children of Florence.	Florence has exactly 3 children.
entailment	Christine, Fiona and Ian are the only children of Kate.	Kate has exactly 3 children.
entailment	Catherine, Philip and Janet are the only children of Billy.	Billy has exactly 3 children.
entailment	Michelle, Helen and Sandra are the only children of Howard.	Howard has exactly 3 children.
entailment	Johnny, George and Jack are the only children of Virginia.	Virginia has exactly 3 children.
entailment	Linda, Daniel and Harriet are the only children of Angela.	Angela has exactly 3 children.
entailment	Albert, Mark and Ed are the only children of Daniel.	Daniel has exactly 3 children.
entailment	Matthew, Jerry and Ken are the only children of Steve.	Steve has exactly 3 children.
entailment	Lisa, Ken and Lynn are the only children of Melissa.	Melissa has exactly 3 children.
entailment	Stephanie, Ryan and Fred are the only children of Kathy.	Kathy has exactly 3 children.
entailment	Al, Jack and Johnny are the only children of Billy.	Billy has exactly 3 children.
entailment	Judy, Laura and Jean are the only children of Samuel.	Samuel has exactly 3 children.
entailment	Wendy, Sandra and Matt are the only children of Carol.	Carol has exactly 3 children.
entailment	Rebecca, Martha and Larry are the only children of Julia.	Julia has exactly 3 children.
entailment	Jessica, Johnny and Anthony are the only children of Greg.	Greg has exactly 3 children.
entailment	Rachel, Patrick and Fred are the only children of Anthony.	Anthony has exactly 3 children.
entailment	Maria, Andrea and Bobby are the only children of Robin.	Robin has exactly 3 children.
entailment	Maria, Sarah and Marilyn are the only children of Ken.	Ken has exactly 3 children.
entailment	Marilyn, Sharon and Keith are the only children of Anthony.	Anthony has exactly 3 children.
entailment	Lauren, Arthur and Carolyn are the only children of Joe.	Joe has exactly 3 children.
entailment	Sue, Alice and Sarah are the only children of Rebecca.	Rebecca has exactly 3 children.
entailment	Marie, Amy and Ben are the only children of William.	William has exactly 3 children.
entailment	Jeff, Carolyn and Nick are the only children of Bob.	Bob has exactly 3 children.
entailment	Kelly, Pamela and Annie are the only children of Johnny.	Johnny has exactly 3 children.
entailment	Lawrence, Mary and Philip are the only children of Christopher.	Christopher has exactly 3 children.
entailment	Angela, Donald and Rachel are the only children of William.	William has exactly 3 children.
entailment	Don, Billy and Paul are the only children of Jason.	Jason has exactly 3 children.
entailment	Colin, Ian and Alex are the only children of Billy.	Billy has exactly 3 children.
entailment	Edwin, Deborah and Donna are the only children of Louis.	Louis has exactly 3 children.
entailment	Dan, Ron and Sam are the only children of Andrew.	Andrew has exactly 3 children.
entailment	John, Sarah and George are the only children of Robert.	Robert has exactly 3 children.
entailment	Steven, Larry and Jerry are the only children of Alison.	Alison has exactly 3 children.
entailment	Daniel, Larry and Patrick are the only children of Carolyn.	Carolyn has exactly 3 children.
entailment	Claire, Anne and Alex are the only children of Alfred.	Alfred has exactly 3 children.
entailment	Colin, Alfred and Ashley are the only children of Dave.	Dave has exactly 3 children.
entailment	Louise, Scott and Fred are the only children of Lisa.	Lisa has exactly 3 children.
entailment	Eleanor, Frances and Edwin are the only children of Sandra.	Sandra has exactly 3 children.
entailment	Brian, Harold and Susan are the only children of William.	William has exactly 3 children.
entailment	Jim, Rachel and Betty are the only children of Judy.	Judy has exactly 3 children.
entailment	Julie, Martin and Diane are the only children of Brian.	Brian has exactly 3 children.
entailment	Florence, Louise and David are the only children of Leslie.	Leslie has exactly 3 children.
entailment	Kathryn, Jason and Adam are the only children of James.	James has exactly 3 children.
entailment	Matt, Peter and Cynthia are the only children of Edward.	Edward has exactly 3 children.
entailment	Fiona, Ryan and Nancy are the only children of Alan.	Alan has exactly 3 children.
entailment	George, Margaret and Charlotte are the only children of Heather.	Heather has exactly 3 children.
entailment	Evelyn, Ann and Janet are the only children of Benjamin.	Benjamin has exactly 3 children.
entailment	Frederick, Bill and Roger are the only children of Eleanor.	Eleanor has exactly 3 children.
entailment	Louise, Wendy and Emily are the only children of Alan.	Alan has exactly 3 children.
entailment	Matthew, Ray and Steve are the only children of Hugh.	Hugh has exactly 3 children.
entailment	Kelly, Jean and Amanda are the only children of Dorothy.	Dorothy has exactly 3 children.
entailment	Joan, Katherine and Christopher are the only children of Alexandra.	Alexandra has exactly 3 children.
entailment	Patrick, Howard and Catherine are the only children of Jean.	Jean has exactly 3 children.
entailment	Brian, Alfred and Linda are the only children of Edith.	Edith has exactly 3 children.
entailment	Paul, Keith and Leslie are the only children of Sally.	Sally has exactly 3 children.
entailment	Dave, Rose and Martin are the only children of Matthew.	Matthew has exactly 3 children.
entailment	Donna, Alfred and Bobby are the only children of Judy.	Judy has exactly 3 children.
entailment	Kelly, Sara and Emma are the only children of Roy.	Roy has exactly 3 children.
entailment	Lisa, Walter and Marie are the only children of Diane.	Diane has exactly 3 children.
entailment	Karen, Emily and Tim are the only children of Ann.	Ann has exactly 3 children.
entailment	Francis, Billy and Henry are the only children of Amanda.	Amanda has exactly 3 children.
entailment	Emma, Lynn and Colin are the only children of Ellen.	Ellen has exactly 3 children.
entailment	Lynn, Anna and Steve are the only children of Peter.	Peter has exactly 3 children.
entailment	Janet, Matt and Stephanie are the only children of Alice.	Alice has exactly 3 children.
entailment	Peter, Matthew and Brian are the only children of Frederick.	Frederick has exactly 3 children.
entailment	Jay, Charlie and Katie are the only children of Anne.	Anne has exactly 3 children.
entailment	Louis, Brian and Ron are the only children of Angela.	Angela has exactly 3 children.
