entailment	Nick, Leslie and Anne are the only children of Alexander.	Alexander has exactly 3 children.
entailment	Stephanie, Amy and Greg are the only children of Bobby.	Bobby has exactly 3 children.
entailment	Martin, Johnny and Gary are the only children of Amanda.	Amanda has exactly 3 children.
entailment	Fiona, Jay and Jill are the only children of Donald.	Donald has exactly 3 children.
entailment	Martha, Ellen and Heather are the only children of Bill.	Bill has exactly 3 children.
entailment	Philip, Steve and Caroline are the only children of Joe.	Joe has exactly 3 children.
entailment	Dave, Edward and Arthur are the only children of Francis.	Francis has exactly 3 children.
entailment	Matthew, Evelyn and Helen are the only children of Jonathan.	Jonathan has exactly 3 children.
entailment	Judy, Alexander and Katherine are the only children of Betty.	Betty has exactly 3 children.
entailment	Sarah, Gary and William are the only children of Evelyn.	Evelyn has exactly 3 children.
entailment	Brian, Paul and Simon are the only children of Christopher.	Christopher has exactly 3 children.
entailment	William, Heather and Colin are the only children of Charlotte.	Charlotte has exactly 3 children.
entailment	Alan, Elizabeth and Fred are the only children of Henry.	Henry has exactly 3 children.
entailment	Bob, Sara and Kathryn are the only children of Samuel.	Samuel has exactly 3 children.
entailment	Robert, Karen and Martha are the only children of Rose.	Rose has exactly 3 children.
entailment	Gary, Steve and Amy are the only children of Charles.	Charles has exactly 3 children.
entailment	Fred, Helen and Edith are the only children of Ruth.	Ruth has exactly 3 children.
entailment	Sara, Katie and Sally are the only children of Steven.	Steven has exactly 3 children.
entailment	Arthur, Andrea and Matt are the only children of Alice.	Alice has exactly 3 children.
entailment	Colin, Heather and Susan are the only children of Kenneth.	Kenneth has exactly 3 children.
entailment	Heather, Diana and Mary are the only children of Dan.	Dan has exactly 3 children.
entailment	Charlotte, Rebecca and Rose are the only children of Colin.	Colin has exactly 3 children.
entailment	James, Kathy and Catherine are the only children of Amy.	Amy has exactly 3 children.
entailment	Sue, Mark and Betty are the only children of Carl.	Carl has exactly 3 children.
entailment	Rachel, Kenneth and Alice are the only children of Claire.	Claire has exactly 3 children.
entailment	Anne, Walter and Nick are the only children of Kenneth.	Kenneth has exactly 3 children.
entailment	Roger, Rachel and Sharon are the only children of Tom.	Tom has exactly 3 children.
entailment	Alan, Heather and Ryan are the only children of Judith.	Judith has exactly 3 children.
entailment	Chris, Alison and Eleanor are the only children of Billy.	Billy has exactly 3 children.
entailment	Evelyn, Peter and Tony are the only children of William.	William has exactly 3 children.
entailment	Sandra, Scott and Donald are the only children of Joan.	Joan has exactly 3 children.
entailment	Florence, Nancy and Brian are the only children of Dorothy.	Dorothy has exactly 3 children.
entailment	Edith, Carol and Ray are the only children of Tony.	Tony has exactly 3 children.
entailment	Sarah, Ken and Joseph are the only children of Sandra.	Sandra has exactly 3 children.
entailment	Colin, Mary and Jason are the only children of Joseph.	Joseph has exactly 3 children.
entailment	Johnny, Diane and Adam are the only children of Chris.	Chris has exactly 3 children.
entailment	Alex, Christine and Sandra are the only children of Ron.	Ron has exactly 3 children.
entailment	Alison, Linda and George are the only children of Helen.	Helen has exactly 3 children.
entailment	Janet, Evelyn and Elaine are the only children of Anne.	Anne has exactly 3 children.
entailment	Martha, Jessica and Robert are the only children of Sharon.	Sharon has exactly 3 children.
entailment	Diana, Lisa and Robin are the only children of Dick.	Dick has exactly 3 children.
entailment	Ian, Carl and Karen are the only children of Elaine.	Elaine has exactly 3 children.
entailment	Frederick, Annie and Hugh are the only children of Brian.	Brian has exactly 3 children.
entailment	Marie, Carl and Elaine are the only children of Melissa.	Melissa has exactly 3 children.
entailment	Heather, Harriet and Katherine are the only children of Sam.	Sam has exactly 3 children.
entailment	Lucy, William and Harriet are the only children of Don.	Don has exactly 3 children.
entailment	Maria, Ryan and Victoria are the only children of Gary.	Gary has exactly 3 children.
entailment	Matthew, Nick and Carol are the only children of Barbara.	Barbara has exactly 3 children.
entailment	Jack, Ron and Kenneth are the only children of Alex.	Alex has exactly 3 children.
entailment	Jean, Ken and Adam are the only children of Patricia.	Patricia has exactly 3 children.
entailment	Louise, Julie and Joan are the only children of Caroline.	Caroline has exactly 3 children.
entailment	Alan, Samuel and Carolyn are the only children of Sally.	Sally has exactly 3 children.
entailment	Caroline, Sue and Edwin are the only children of Howard.	Howard has exactly 3 children.
entailment	Suzanne, Jill and Jane are the only children of Marie.	Marie has exactly 3 children.
entailment	Patricia, Karen and Nancy are the only children of Ed.	Ed has exactly 3 children.
entailment	Jerry, Ruth and Francis are the only children of Rebecca.	Rebecca has exactly 3 children.
entailment	Virginia, Sally and Joan are the only children of Kathryn.	Kathryn has exactly 3 children.
entailment	Sally, Daniel and Al are the only children of Amanda.	Amanda has exactly 3 children.
entailment	Kim, Jennifer and Charlie are the only children of Judith.	Judith has exactly 3 children.
entailment	Alan, Hugh and Fred are the only children of Caroline.	Caroline has exactly 3 children.
entailment	Victoria, Gary and Michelle are the only children of Jennifer.	Jennifer has exactly 3 children.
entailment	Suzanne, Judith and Jane are the only children of Charles.	Charles has exactly 3 children.
entailment	Ian, Jay and Steven are the only children of Lawrence.	Lawrence has exactly 3 children.
entailment	Walter, Emma and Anna are the only children of Nicole.	Nicole has exactly 3 children.
entailment	Mike, Ken and Larry are the only children of Billy.	Billy has exactly 3 children.
entailment	Brian, Julia and Mike are the only children of Gary.	Gary has exactly 3 children.
entailment	Dan, Lynn and Ken are the only children of Rebecca.	Rebecca has exactly 3 children.
entailment	Daniel, Steve and Patricia are the only children of Angela.	Angela has exactly 3 children.
entailment	Patricia, Claire and Sue are the only children of Julia.	Julia has exactly 3 children.
entailment	Peter, Kate and Karen are the only children of Greg.	Greg has exactly 3 children.
entailment	Joseph, Rose and Michelle are the only children of Ashley.	Ashley has exactly 3 children.
entailment	Lucy, Rose and Adam are the only children of Bob.	Bob has exactly 3 children.
entailment	Michelle, Charlotte and Virginia are the only children of Anna.	Anna has exactly 3 children.
entailment	Grace, Thomas and Helen are the only children of Andrea.	Andrea has exactly 3 children.
entailment	Edwin, Bobby and Ken are the only children of Lucy.	Lucy has exactly 3 children.
entailment	Dan, Eric and Sally are the only children of Amanda.	Amanda has exactly 3 children.
entailment	Evelyn, Edward and Tim are the only children of Grace.	Grace has exactly 3 children.
entailment	Ellen, Louis and Benjamin are the only children of Emily.	Emily has exactly 3 children.
entailment	Andrew, Patrick and Ralph are the only children of Frances.	Frances has exactly 3 children.
entailment	Louise, Robert and Susan are the only children of Samuel.	Samuel has exactly 3 children.
entailment	Carl, Al and Jay are the only children of Stephanie.	Stephanie has exactly 3 children.
entailment	Eric, Martha and Billy are the only children of Judy.	Judy has exactly 3 children.
entailment	Christopher, Elizabeth and Alexander are the only children of Sally.	Sally has exactly 3 children.
entailment	Maria, Virginia and Victoria are the only children of Amanda.	Amanda has exactly 3 children.
entailment	Charlie, Paul and Florence are the only children of Edward.	Edward has exactly 3 children.
entailment	Kathy, Julie and Francis are the only children of Suzanne.	Suzanne has exactly 3 children.
entailment	John, Carolyn and Janet are the only children of Steven.	Steven has exactly 3 children.
entailment	Charlie, Carolyn and Wendy are the only children of Lynn.	Lynn has exactly 3 children.
entailment	Christine, Anna and Steve are the only children of Carol.	Carol has exactly 3 children.
entailment	David, Amanda and Elizabeth are the only children of Dick.	Dick has exactly 3 children.
entailment	Mary, Jill and Jeff are the only children of Matt.	Matt has exactly 3 children.
entailment	Emma, Kelly and Pamela are the only children of Keith.	Keith has exactly 3 children.
entailment	Linda, Suzanne and Louis are the only children of Richard.	Richard has exactly 3 children.
entailment	Richard, Walter and Jerry are the only children of Michael.	Michael has exactly 3 children.
entailment	Fred, Victoria and Patricia are the only children of Pamela.	Pamela has exactly 3 children.
entailment	Anna, Ian and Christine are the only children of Kathryn.	Kathryn has exactly 3 children.
entailment	Patrick, Steven and Ellen are the only children of Jean.	Jean has exactly 3 children.
entailment	Annie, Fiona and Judith are the only children of Fred.	Fred has exactly 3 children.
entailment	Laura, Joan and Joe are the only children of Kathryn.	Kathryn has exactly 3 children.
entailment	Howard, Florence and Karen are the only children of Roy.	Roy has exactly 3 children.
entailment	Bill, Ellen and Carolyn are the only children of Harold.	Harold has exactly 3 children.
entailment	Stephanie, Sophie and Ashley are the only children of Jim.	Jim has exactly 3 children.
entailment	Jason, Jay and Ellen are the only children of Patricia.	Patricia has exactly 3 children.
entailment	Janet, Jean and Karen are the only children of Francis.	Francis has exactly 3 children.
entailment	Paul, Ron and Maria are the only children of Florence.	Florence has exactly 3 children.
entailment	Samuel, Roy and Larry are the only children of Emma.	Emma has exactly 3 children.
entailment	Kevin, Caroline and Ralph are the only children of Johnny.	Johnny has exactly 3 children.
entailment	Donald, Colin and Brian are the only children of Fred.	Fred has exactly 3 children.
entailment	Peter, Alan and Alfred are the only children of Alex.	Alex has exactly 3 children.
entailment	Deborah, Nick and Dorothy are the only children of Ann.	Ann has exactly 3 children.
entailment	Pamela, Christine and Lisa are the only children of Francis.	Francis has exactly 3 children.
entailment	Mary, Ellen and Angela are the only children of Larry.	Larry has exactly 3 children.
entailment	Robert, Adam and Diana are the only children of Emma.	Emma has exactly 3 children.
entailment	Bob, Helen and Amanda are the only children of Julie.	Julie has exactly 3 children.
entailment	Bob, Kelly and Louis are the only children of Donna.	Donna has exactly 3 children.
entailment	John, Walter and Julia are the only children of Fred.	Fred has exactly 3 children.
entailment	Matt, Katherine and Alison are the only children of George.	George has exactly 3 children.
entailment	Alexander, Ed and Suzanne are the only children of Sarah.	Sarah has exactly 3 children.
entailment	Kathy, Ken and Wendy are the only children of Peter.	Peter has exactly 3 children.
entailment	Lynn, Claire and Diane are the only children of Victoria.	Victoria has exactly 3 children.
entailment	Alice, Philip and Margaret are the only children of Louis.	Louis has exactly 3 children.
entailment	Sally, Charles and Paul are the only children of Annie.	Annie has exactly 3 children.
entailment	Nicole, Emma and Adam are the only children of Michelle.	Michelle has exactly 3 children.
entailment	Johnny, Ken and Samuel are the only children of Larry.	Larry has exactly 3 children.
entailment	Virginia, Alexandra and Grace are the only children of William.	William has exactly 3 children.
entailment	Jennifer, Linda and Julia are the only children of Simon.	Simon has exactly 3 children.
entailment	Robert, Frank and Arthur are the only children of Bruce.	Bruce has exactly 3 children.
entailment	Alan, Emily and Julie are the only children of Joseph.	Joseph has exactly 3 children.
entailment	Helen, Bill and Matt are the only children of Jay.	Jay has exactly 3 children.
entailment	Elaine, Dick and Adam are the only children of Carl.	Carl has exactly 3 children.
entailment	Marie, Pamela and Thomas are the only children of Frank.	Frank has exactly 3 children.
entailment	Judy, Jason and Patricia are the only children of Louis.	Louis has exactly 3 children.
entailment	Tim, Ryan and Jessica are the only children of Patricia.	Patricia has exactly 3 children.
entailment	Tony, Carol and Karen are the only children of Fiona.	Fiona has exactly 3 children.
entailment	Donna, Greg and Brian are the only children of Steven.	Steven has exactly 3 children.
entailment	Kenneth, Florence and Kathleen are the only children of Andrew.	Andrew has exactly 3 children.
entailment	Wendy, Katie and Elizabeth are the only children of Donna.	Donna has exactly 3 children.
entailment	Evelyn, Harry and Sandra are the only children of Charlotte.	Charlotte has exactly 3 children.
entailment	Linda, Carl and Frances are the only children of Steven.	Steven has exactly 3 children.
entailment	Fiona, Amy and Jimmy are the only children of Greg.	Greg has exactly 3 children.
entailment	Barbara, Michael and Kevin are the only children of Roy.	Roy has exactly 3 children.
entailment	Julia, Lucy and Frances are the only children of Martin.	Martin has exactly 3 children.
entailment	Howard, Pamela and Eric are the only children of Judith.	Judith has exactly 3 children.
entailment	Martin, Matthew and Steven are the only children of Christopher.	Christopher has exactly 3 children.
entailment	Catherine, Ellen and Nicole are the only children of Judy.	Judy has exactly 3 children.
entailment	Grace, Don and Matt are the only children of Jill.	Jill has exactly 3 children.
entailment	Cynthia, Elizabeth and Andrew are the only children of Kathleen.	Kathleen has exactly 3 children.
entailment	Mary, Andrea and Jennifer are the only children of Ed.	Ed has exactly 3 children.
entailment	Patricia, Ralph and Tony are the only children of Mark.	Mark has exactly 3 children.
entailment	Nancy, Larry and Mark are the only children of George.	George has exactly 3 children.
entailment	Anthony, Andrew and Charlotte are the only children of Dave.	Dave has exactly 3 children.
entailment	Claire, Wendy and Roy are the only children of Melissa.	Melissa has exactly 3 children.
entailment	Simon, Rebecca and Al are the only children of Thomas.	Thomas has exactly 3 children.
entailment	Linda, Robin and Kathleen are the only children of Barbara.	Barbara has exactly 3 children.
entailment	Donald, Lisa and Anne are the only children of Harry.	Harry has exactly 3 children.
entailment	Mary, Adam and Jack are the only children of Jane.	Jane has exactly 3 children.
entailment	Louise, Larry and Victoria are the only children of Judy.	Judy has exactly 3 children.
entailment	Wendy, Ruth and Linda are the only children of Suzanne.	Suzanne has exactly 3 children.
entailment	Emma, Nick and Deborah are the only children of Karen.	Karen has exactly 3 children.
entailment	Roy, Betty and Carolyn are the only children of Robin.	Robin has exactly 3 children.
entailment	Mark, Harry and Andrea are the only children of Al.	Al has exactly 3 children.
entailment	Donna, Sarah and Steven are the only children of Laura.	Laura has exactly 3 children.
entailment	Hugh, Greg and Chris are the only children of Carolyn.	Carolyn has exactly 3 children.
entailment	Sarah, Steve and Martha are the only children of Diana.	Diana has exactly 3 children.
entailment	Kathleen, Edith and Don are the only children of Diane.	Diane has exactly 3 children.
entailment	Kathleen, James and Dorothy are the only children of Janet.	Janet has exactly 3 children.
entailment	Bill, Joe and Ben are the only children of Julie.	Julie has exactly 3 children.
entailment	Deborah, Tim and Sandra are the only children of Larry.	Larry has exactly 3 children.
entailment	Joan, Marie and Charlotte are the only children of Richard.	Richard has exactly 3 children.
entailment	George, Joan and Samuel are the only children of Don.	Don has exactly 3 children.
entailment	Laura, Jean and Harry are the only children of Daniel.	Daniel has exactly 3 children.
entailment	Arthur, Edith and Dorothy are the only children of Judith.	Judith has exactly 3 children.
entailment	Kevin, George and Alfred are the only children of David.	David has exactly 3 children.
entailment	Lawrence, Ellen and Keith are the only children of Ian.	Ian has exactly 3 children.
entailment	Jim, Howard and Keith are the only children of Ron.	Ron has exactly 3 children.
entailment	Samuel, Evelyn and Laura are the only children of Philip.	Philip has exactly 3 children.
entailment	Bruce, Dorothy and Frank are the only children of Donna.	Donna has exactly 3 children.
entailment	Alice, Tim and Alfred are the only children of Alison.	Alison has exactly 3 children.
entailment	Patrick, Nancy and Sally are the only children of Simon.	Simon has exactly 3 children.
entailment	Christine, Ann and Rachel are the only children of Dave.	Dave has exactly 3 children.
entailment	Jonathan, Andrea and Fred are the only children of Howard.	Howard has exactly 3 children.
entailment	Jessica, Albert and Angela are the only children of Kevin.	Kevin has exactly 3 children.
entailment	Janet, Paul and Dorothy are the only children of Don.	Don has exactly 3 children.
entailment	Harry, Grace and Rebecca are the only children of Greg.	Greg has exactly 3 children.
entailment	Judith, Sue and George are the only children of Ann.	Ann has exactly 3 children.
entailment	Christine, Adam and Roger are the only children of Johnny.	Johnny has exactly 3 children.
entailment	Tony, Sandra and Joe are the only children of Walter.	Walter has exactly 3 children.
entailment	Alfred, Scott and Sue are the only children of Alex.	Alex has exactly 3 children.
entailment	Andrea, Pamela and Lynn are the only children of Judith.	Judith has exactly 3 children.
entailment	Hugh, Tom and Eric are the only children of Martin.	Martin has exactly 3 children.
entailment	Dan, Donna and David are the only children of Colin.	Colin has exactly 3 children.
entailment	Anne, Stephen and Alfred are the only children of Helen.	Helen has exactly 3 children.
entailment	Ellen, Louise and Alexandra are the only children of Fred.	Fred has exactly 3 children.
entailment	Martin, Barbara and Anne are the only children of Andrea.	Andrea has exactly 3 children.
entailment	Julie, Sara and Caroline are the only children of Edith.	Edith has exactly 3 children.
entailment	Ken, Patricia and Kim are the only children of Evelyn.	Evelyn has exactly 3 children.
entailment	Sandra, Sarah and Charles are the only children of James.	James has exactly 3 children.
entailment	Donna, John and Michael are the only children of Sarah.	Sarah has exactly 3 children.
entailment	Diana, Dave and William are the only children of Edwin.	Edwin has exactly 3 children.
entailment	Al, Louise and Marie are the only children of Gary.	Gary has exactly 3 children.
entailment	Colin, Anne and Louis are the only children of Jane.	Jane has exactly 3 children.
entailment	Fiona, Kathy and Sally are the only children of Jessica.	Jessica has exactly 3 children.
entailment	Judith, Ray and Ian are the only children of Larry.	Larry has exactly 3 children.
entailment	Johnny, Joseph and Ann are the only children of Jean.	Jean has exactly 3 children.
entailment	Mike, Julie and Jim are the only children of Charlotte.	Charlotte has exactly 3 children.
entailment	Sarah, Linda and Peter are the only children of Deborah.	Deborah has exactly 3 children.
entailment	Diana, Eleanor and Jerry are the only children of Frances.	Frances has exactly 3 children.
entailment	Colin, Nicole and Helen are the only children of Frank.	Frank has exactly 3 children.
entailment	Lucy, Tom and Al are the only children of Kathryn.	Kathryn has exactly 3 children.
entailment	Louis, Diane and Angela are the only children of Elaine.	Elaine has exactly 3 children.
entailment	George, Alexandra and Edwin are the only children of Angela.	Angela has exactly 3 children.
entailment	Robert, Greg and Eric are the only children of Lawrence.	Lawrence has exactly 3 children.
entailment	Amy, Bruce and Jim are the only children of Mike.	Mike has exactly 3 children.
entailment	Florence, Hugh and Tom are the only children of Kate.	Kate has exactly 3 children.
entailment	Sharon, Diana and Cynthia are the only children of Johnny.	Johnny has exactly 3 children.
entailment	Richard, Rebecca and Nancy are the only children of Ryan.	Ryan has exactly 3 children.
entailment	Julie, Kenneth and Billy are the only children of Ryan.	Ryan has exactly 3 children.
entailment	Dave, Alison and Katie are the only children of Jeff.	Jeff has exactly 3 children.
entailment	Caroline, Dave and Sophie are the only children of Rebecca.	Rebecca has exactly 3 children.
entailment	Virginia, James and Fred are the only children of Florence.	Florence has exactly 3 children.
entailment	Alexandra, Sally and David are the only children of Victoria.	Victoria has exactly 3 children.
entailment	Mark, Judith and Benjamin are the only children of Laura.	Laura has exactly 3 children.
entailment	Sara, Mike and Greg are the only children of Carol.	Carol has exactly 3 children.
entailment	Mark, Kim and Kathryn are the only children of Ken.	Ken has exactly 3 children.
entailment	Amanda, Robert and Louise are the only children of Jay.	Jay has exactly 3 children.
entailment	Thomas, Wendy and Walter are the only children of Bobby.	Bobby has exactly 3 children.
entailment	Bruce, Gary and Ron are the only children of Jim.	Jim has exactly 3 children.
entailment	Colin, Alice and Judith are the only children of Joseph.	Joseph has exactly 3 children.
entailment	Gary, Ken and Stephen are the only children of Jay.	Jay has exactly 3 children.
entailment	Mike, Virginia and Rebecca are the only children of Ben.	Ben has exactly 3 children.
entailment	Alfred, Virginia and Richard are the only children of Mary.	Mary has exactly 3 children.
entailment	Ashley, George and Fred are the only children of Andrew.	Andrew has exactly 3 children.
entailment	Jane, Kevin and Nancy are the only children of Ray.	Ray has exactly 3 children.
entailment	Donna, Virginia and Jim are the only children of Victoria.	Victoria has exactly 3 children.
entailment	Carl, Kathryn and Nicole are the only children of Jay.	Jay has exactly 3 children.
entailment	Janet, Greg and Jennifer are the only children of Harriet.	Harriet has exactly 3 children.
entailment	Ray, Keith and Fred are the only children of Jerry.	Jerry has exactly 3 children.
entailment	Betty, Alan and Grace are the only children of Amanda.	Amanda has exactly 3 children.
entailment	Jennifer, George and Jimmy are the only children of Katherine.	Katherine has exactly 3 children.
entailment	Adam, Ruth and Nick are the only children of Margaret.	Margaret has exactly 3 children.
entailment	Rose, Suzanne and Sam are the only children of George.	George has exactly 3 children.
entailment	Charlie, Grace and Jerry are the only children of Lynn.	Lynn has exactly 3 children.
entailment	Diane, Judith and Martha are the only children of Jessica.	Jessica has exactly 3 children.
entailment	Pamela, Anthony and Kevin are the only children of Francis.	Francis has exactly 3 children.
entailment	Simon, Alfred and Nancy are the only children of Anna.	Anna has exactly 3 children.
entailment	Lynn, Katherine and Judith are the only children of Kim.	Kim has exactly 3 children.
entailment	Jack, Jane and Frances are the only children of Robert.	Robert has exactly 3 children.
entailment	Elizabeth, Emily and Catherine are the only children of Alice.	Alice has exactly 3 children.
entailment	Jeff, Sandra and Carol are the only children of Arthur.	Arthur has exactly 3 children.
entailment	Alexandra, Victoria and Edith are the only children of Caroline.	Caroline has exactly 3 children.
entailment	Carolyn, Ron and Cynthia are the only children of Bruce.	Bruce has exactly 3 children.
entailment	Janet, Richard and Stephen are the only children of Linda.	Linda has exactly 3 children.
entailment	David, Mark and Stephanie are the only children of Jeff.	Jeff has exactly 3 children.
entailment	Caroline, Billy and Julie are the only children of Charlie.	Charlie has exactly 3 children.
entailment	Ed, Julie and Dan are the only children of Karen.	Karen has exactly 3 children.
entailment	Catherine, Henry and Jerry are the only children of Edwin.	Edwin has exactly 3 children.
entailment	Kevin, Ed and Jeff are the only children of Joseph.	Joseph has exactly 3 children.
entailment	Francis, Frederick and Kelly are the only children of Andrea.	Andrea has exactly 3 children.
entailment	Patrick, Sam and Ralph are the only children of Jill.	Jill has exactly 3 children.
entailment	Wendy, Thomas and Kim are the only children of Susan.	Susan has exactly 3 children.
entailment	Daniel, Ruth and Robert are the only children of Joe.	Joe has exactly 3 children.
entailment	Deborah, Marilyn and Anthony are the only children of Robin.	Robin has exactly 3 children.
entailment	Alexandra, Betty and Pamela are the only children of Martin.	Martin has exactly 3 children.
entailment	Julie, William and Harriet are the only children of Howard.	Howard has exactly 3 children.
entailment	Ron, Julia and Ken are the only children of Eric.	Eric has exactly 3 children.
