entailment	Frederick, Rebecca and Scott are the only children of Louise.	Louise has exactly 3 children.
entailment	Matthew, Ryan and Bob are the only children of Caroline.	Caroline has exactly 3 children.
entailment	Andrew, Patrick and Philip are the only children of Karen.	Karen has exactly 3 children.
entailment	Anna, Brian and Matthew are the only children of Sharon.	Sharon has exactly 3 children.
entailment	Deborah, Sarah and Alex are the only children of Harold.	Harold has exactly 3 children.
entailment	Alfred, Michael and Caroline are the only children of Jason.	Jason has exactly 3 children.
entailment	Andrea, Sue and Florence are the only children of Cynthia.	Cynthia has exactly 3 children.
entailment	Maria, Cynthia and William are the only children of Nancy.	Nancy has exactly 3 children.
entailment	Catherine, Alice and Joe are the only children of Matt.	Matt has exactly 3 children.
entailment	Amanda, Al and Fiona are the only children of Julie.	Julie has exactly 3 children.
entailment	Alfred, Julie and Robert are the only children of Sam.	Sam has exactly 3 children.
entailment	Lucy, Tim and Sharon are the only children of Sandra.	Sandra has exactly 3 children.
entailment	Ian, Nick and Eric are the only children of Kenneth.	Kenneth has exactly 3 children.
entailment	Amanda, Louis and Henry are the only children of Keith.	Keith has exactly 3 children.
entailment	Sara, Alex and Jill are the only children of Carl.	Carl has exactly 3 children.
entailment	Ralph, Edith and Thomas are the only children of Ruth.	Ruth has exactly 3 children.
entailment	Ruth, Tim and Mike are the only children of Stephen.	Stephen has exactly 3 children.
entailment	Helen, Albert and Sara are the only children of Wendy.	Wendy has exactly 3 children.
entailment	Ellen, Thomas and Andrew are the only children of Kevin.	Kevin has exactly 3 children.
entailment	Andrea, Harold and Larry are the only children of Cynthia.	Cynthia has exactly 3 children.
entailment	Richard, Nicole and Emily are the only children of Frances.	Frances has exactly 3 children.
entailment	Andrea, Sally and Suzanne are the only children of Steven.	Steven has exactly 3 children.
entailment	Alexander, Jane and Keith are the only children of Greg.	Greg has exactly 3 children.
entailment	Julie, Joseph and Charles are the only children of Alexander.	Alexander has exactly 3 children.
entailment	Sandra, Mark and Ryan are the only children of Kevin.	Kevin has exactly 3 children.
entailment	Anne, George and Kathy are the only children of Charles.	Charles has exactly 3 children.
entailment	Matthew, Ken and David are the only children of Sandra.	Sandra has exactly 3 children.
entailment	Sara, Roy and Kevin are the only children of Charlie.	Charlie has exactly 3 children.
entailment	Sue, Ron and Jennifer are the only children of Steven.	Steven has exactly 3 children.
entailment	Louis, Fred and Jean are the only children of Jim.	Jim has exactly 3 children.
entailment	Colin, Deborah and Ian are the only children of Bobby.	Bobby has exactly 3 children.
entailment	Robin, Jimmy and Rose are the only children of Anna.	Anna has exactly 3 children.
entailment	Johnny, Dave and Katie are the only children of Diana.	Diana has exactly 3 children.
entailment	Roy, Scott and Andrea are the only children of Stephen.	Stephen has exactly 3 children.
entailment	David, Francis and Anna are the only children of Colin.	Colin has exactly 3 children.
entailment	Michael, Leslie and Tim are the only children of Lucy.	Lucy has exactly 3 children.
entailment	Susan, Kathy and Alexandra are the only children of Bob.	Bob has exactly 3 children.
entailment	Kenneth, Gary and Eric are the only children of Carolyn.	Carolyn has exactly 3 children.
entailment	Paul, Ruth and Harold are the only children of Evelyn.	Evelyn has exactly 3 children.
entailment	Karen, Alison and Roy are the only children of Colin.	Colin has exactly 3 children.
entailment	Carolyn, Benjamin and Martha are the only children of Maria.	Maria has exactly 3 children.
entailment	Florence, Jean and Adam are the only children of Margaret.	Margaret has exactly 3 children.
entailment	Fred, Ron and Anthony are the only children of Martin.	Martin has exactly 3 children.
entailment	Emma, Donald and Christine are the only children of Patrick.	Patrick has exactly 3 children.
entailment	Larry, Jennifer and Susan are the only children of Marie.	Marie has exactly 3 children.
entailment	James, Amanda and Arthur are the only children of Alfred.	Alfred has exactly 3 children.
entailment	Karen, Amanda and Jill are the only children of Joan.	Joan has exactly 3 children.
entailment	Sue, Helen and Ann are the only children of Laura.	Laura has exactly 3 children.
entailment	Kelly, Brian and Billy are the only children of Frances.	Frances has exactly 3 children.
entailment	Ashley, Frederick and Harold are the only children of Hugh.	Hugh has exactly 3 children.
entailment	Carol, Henry and Helen are the only children of Benjamin.	Benjamin has exactly 3 children.
entailment	Elaine, Jeff and Caroline are the only children of Steven.	Steven has exactly 3 children.
entailment	Steve, Kathy and Jonathan are the only children of Ed.	Ed has exactly 3 children.
entailment	Ruth, Sharon and Suzanne are the only children of Roy.	Roy has exactly 3 children.
entailment	Melissa, Mary and Alice are the only children of Christine.	Christine has exactly 3 children.
entailment	Ellen, Alice and Linda are the only children of Judy.	Judy has exactly 3 children.
entailment	Jim, Ashley and Robert are the only children of Chris.	Chris has exactly 3 children.
entailment	Laura, Anthony and Leslie are the only children of Michelle.	Michelle has exactly 3 children.
entailment	Joan, Elaine and Anthony are the only children of Harriet.	Harriet has exactly 3 children.
entailment	Carl, Victoria and Harold are the only children of Martin.	Martin has exactly 3 children.
entailment	Adam, Peter and Paul are the only children of Dan.	Dan has exactly 3 children.
entailment	Joe, Walter and Grace are the only children of Diana.	Diana has exactly 3 children.
entailment	Matt, Kim and Betty are the only children of Grace.	Grace has exactly 3 children.
entailment	Sophie, Gary and Benjamin are the only children of Emma.	Emma has exactly 3 children.
entailment	Alfred, Steven and Jonathan are the only children of Ann.	Ann has exactly 3 children.
entailment	Dan, Jim and Michael are the only children of Jonathan.	Jonathan has exactly 3 children.
entailment	Ashley, Chris and Gary are the only children of Andrew.	Andrew has exactly 3 children.
entailment	Stephanie, Jim and Christine are the only children of Ellen.	Ellen has exactly 3 children.
entailment	Christine, Frances and Michelle are the only children of John.	John has exactly 3 children.
entailment	Matthew, Karen and Edward are the only children of Larry.	Larry has exactly 3 children.
entailment	Katherine, Charlie and Walter are the only children of Virginia.	Virginia has exactly 3 children.
entailment	Judith, Roy and Alex are the only children of Benjamin.	Benjamin has exactly 3 children.
entailment	Jessica, Margaret and Jonathan are the only children of Dorothy.	Dorothy has exactly 3 children.
entailment	Jonathan, Andrew and Kevin are the only children of Alice.	Alice has exactly 3 children.
entailment	Tony, Louis and Julie are the only children of Evelyn.	Evelyn has exactly 3 children.
entailment	Deborah, Matt and Andrea are the only children of Bruce.	Bruce has exactly 3 children.
entailment	Larry, Angela and Maria are the only children of Cynthia.	Cynthia has exactly 3 children.
entailment	Elaine, Betty and Charlie are the only children of Donna.	Donna has exactly 3 children.
entailment	Mark, Anthony and Ann are the only children of Patricia.	Patricia has exactly 3 children.
entailment	Pamela, Martha and Deborah are the only children of Nick.	Nick has exactly 3 children.
entailment	Ellen, Diana and Katie are the only children of Jonathan.	Jonathan has exactly 3 children.
entailment	Patricia, Amanda and Katie are the only children of Sandra.	Sandra has exactly 3 children.
entailment	Heather, Ian and Ben are the only children of William.	William has exactly 3 children.
entailment	Edith, Anna and Martha are the only children of Howard.	Howard has exactly 3 children.
entailment	Greg, Annie and Ben are the only children of Joseph.	Joseph has exactly 3 children.
entailment	Alex, Ben and Gary are the only children of Amy.	Amy has exactly 3 children.
entailment	Arthur, Thomas and Amy are the only children of Bobby.	Bobby has exactly 3 children.
entailment	Harry, Emily and Rebecca are the only children of Hugh.	Hugh has exactly 3 children.
entailment	Elizabeth, Louise and Martin are the only children of Kathleen.	Kathleen has exactly 3 children.
entailment	Albert, Richard and Jennifer are the only children of Roy.	Roy has exactly 3 children.
entailment	Amanda, Karen and Melissa are the only children of Joseph.	Joseph has exactly 3 children.
entailment	Heather, Roy and Grace are the only children of Andrew.	Andrew has exactly 3 children.
entailment	Edward, Ryan and Joseph are the only children of Sam.	Sam has exactly 3 children.
entailment	Kate, Christopher and Heather are the only children of Harold.	Harold has exactly 3 children.
entailment	Christine, Bob and Chris are the only children of Ann.	Ann has exactly 3 children.
entailment	Albert, Patricia and Ellen are the only children of Jane.	Jane has exactly 3 children.
entailment	Melissa, Alexandra and Adam are the only children of Angela.	Angela has exactly 3 children.
entailment	Billy, Fiona and Wendy are the only children of Sandra.	Sandra has exactly 3 children.
entailment	Barbara, Alice and Robin are the only children of Steve.	Steve has exactly 3 children.
entailment	Janet, Melissa and Francis are the only children of Louis.	Louis has exactly 3 children.
entailment	Elaine, Michael and Amy are the only children of Roy.	Roy has exactly 3 children.
entailment	Victoria, Dave and Paul are the only children of Stephanie.	Stephanie has exactly 3 children.
entailment	Ben, Laura and Scott are the only children of Sandra.	Sandra has exactly 3 children.
entailment	Deborah, Johnny and Alexander are the only children of Ruth.	Ruth has exactly 3 children.
entailment	Florence, Joseph and Heather are the only children of Billy.	Billy has exactly 3 children.
entailment	Ben, Michelle and Harriet are the only children of Lucy.	Lucy has exactly 3 children.
entailment	Sharon, Sophie and Ann are the only children of Jerry.	Jerry has exactly 3 children.
entailment	Ellen, Colin and Sue are the only children of Nick.	Nick has exactly 3 children.
entailment	Jane, Michelle and Michael are the only children of Anna.	Anna has exactly 3 children.
entailment	Sharon, Linda and Edith are the only children of Katherine.	Katherine has exactly 3 children.
entailment	Dan, Diana and Charlotte are the only children of Alfred.	Alfred has exactly 3 children.
entailment	Henry, Edwin and Larry are the only children of Ray.	Ray has exactly 3 children.
entailment	Matt, Claire and Chris are the only children of Susan.	Susan has exactly 3 children.
entailment	Patrick, Larry and Sally are the only children of Tom.	Tom has exactly 3 children.
entailment	Sue, Sara and Bruce are the only children of Wendy.	Wendy has exactly 3 children.
entailment	Alice, Rebecca and Sharon are the only children of Sandra.	Sandra has exactly 3 children.
entailment	Harold, Fiona and Ian are the only children of Barbara.	Barbara has exactly 3 children.
entailment	Kevin, Diane and Daniel are the only children of Sarah.	Sarah has exactly 3 children.
entailment	Fiona, Carolyn and Gary are the only children of Jonathan.	Jonathan has exactly 3 children.
entailment	Donald, Frank and Kenneth are the only children of Edith.	Edith has exactly 3 children.
entailment	Kevin, David and Jimmy are the only children of Pamela.	Pamela has exactly 3 children.
entailment	Claire, Anthony and Sharon are the only children of Roger.	Roger has exactly 3 children.
entailment	Tom, Jay and Ron are the only children of Rebecca.	Rebecca has exactly 3 children.
entailment	Lawrence, Colin and Jonathan are the only children of Mary.	Mary has exactly 3 children.
entailment	Ed, Andrew and Claire are the only children of Julia.	Julia has exactly 3 children.
entailment	Jean, Hugh and Greg are the only children of Margaret.	Margaret has exactly 3 children.
entailment	Grace, Ed and Amanda are the only children of David.	David has exactly 3 children.
entailment	Ashley, Charles and Suzanne are the only children of Lucy.	Lucy has exactly 3 children.
entailment	David, Ruth and Diana are the only children of Suzanne.	Suzanne has exactly 3 children.
entailment	Amy, James and Ryan are the only children of David.	David has exactly 3 children.
entailment	Kathleen, Jay and Deborah are the only children of Alexander.	Alexander has exactly 3 children.
entailment	James, Sally and Martin are the only children of Hugh.	Hugh has exactly 3 children.
entailment	Annie, Nancy and Greg are the only children of Christopher.	Christopher has exactly 3 children.
entailment	Ken, Samuel and Tom are the only children of Sally.	Sally has exactly 3 children.
entailment	Christopher, Betty and Frank are the only children of Annie.	Annie has exactly 3 children.
entailment	Diane, Fred and Jessica are the only children of Eric.	Eric has exactly 3 children.
entailment	Linda, Carl and Melissa are the only children of Henry.	Henry has exactly 3 children.
entailment	Samuel, Sue and Ray are the only children of Laura.	Laura has exactly 3 children.
entailment	Sue, Jeff and Louise are the only children of Mary.	Mary has exactly 3 children.
entailment	Keith, Cynthia and Grace are the only children of Karen.	Karen has exactly 3 children.
entailment	Ralph, Sue and Janet are the only children of Joseph.	Joseph has exactly 3 children.
entailment	Jimmy, Adam and Amanda are the only children of Katie.	Katie has exactly 3 children.
entailment	Louise, Anna and Colin are the only children of Lawrence.	Lawrence has exactly 3 children.
entailment	William, Wendy and Hugh are the only children of Florence.	Florence has exactly 3 children.
entailment	Nicole, Scott and Victoria are the only children of Jill.	Jill has exactly 3 children.
entailment	Sharon, Arthur and Al are the only children of Lucy.	Lucy has exactly 3 children.
entailment	Carl, Tony and Jimmy are the only children of Alan.	Alan has exactly 3 children.
entailment	Colin, Frances and George are the only children of Amy.	Amy has exactly 3 children.
entailment	Diane, Amanda and Rose are the only children of Marilyn.	Marilyn has exactly 3 children.
entailment	Kevin, Howard and Harriet are the only children of Kathleen.	Kathleen has exactly 3 children.
entailment	Wendy, James and Kelly are the only children of Donna.	Donna has exactly 3 children.
entailment	Eric, Martin and Alfred are the only children of Sara.	Sara has exactly 3 children.
entailment	Ruth, William and Claire are the only children of Mike.	Mike has exactly 3 children.
entailment	Thomas, Jim and Donald are the only children of Evelyn.	Evelyn has exactly 3 children.
entailment	Virginia, James and Thomas are the only children of Howard.	Howard has exactly 3 children.
entailment	Ruth, Kim and Kenneth are the only children of Thomas.	Thomas has exactly 3 children.
entailment	Roger, William and Laura are the only children of Martha.	Martha has exactly 3 children.
entailment	Joe, Fiona and Amy are the only children of Katie.	Katie has exactly 3 children.
entailment	Johnny, Ashley and Tom are the only children of Lynn.	Lynn has exactly 3 children.
entailment	Susan, Florence and Harold are the only children of Sally.	Sally has exactly 3 children.
entailment	Lynn, Mary and Kathy are the only children of Roger.	Roger has exactly 3 children.
entailment	Mike, Evelyn and Anthony are the only children of Martha.	Martha has exactly 3 children.
entailment	Jay, Julia and Kathryn are the only children of Steve.	Steve has exactly 3 children.
entailment	Michelle, Ed and Don are the only children of Ann.	Ann has exactly 3 children.
entailment	Jim, Andrea and Gary are the only children of Jason.	Jason has exactly 3 children.
entailment	Mary, Cynthia and Diana are the only children of Chris.	Chris has exactly 3 children.
entailment	Sally, Leslie and Billy are the only children of Joe.	Joe has exactly 3 children.
entailment	Charlie, Mark and Lawrence are the only children of Jack.	Jack has exactly 3 children.
entailment	Bill, Ken and Ben are the only children of Nick.	Nick has exactly 3 children.
entailment	Anthony, Jessica and Christine are the only children of Grace.	Grace has exactly 3 children.
entailment	Alex, Betty and Caroline are the only children of Laura.	Laura has exactly 3 children.
entailment	Joe, Caroline and Alfred are the only children of Lisa.	Lisa has exactly 3 children.
entailment	Charles, Joseph and Ben are the only children of Linda.	Linda has exactly 3 children.
entailment	Sally, Julia and Helen are the only children of Kathleen.	Kathleen has exactly 3 children.
entailment	Ben, Eric and Caroline are the only children of Alan.	Alan has exactly 3 children.
entailment	Margaret, Dan and Brian are the only children of Suzanne.	Suzanne has exactly 3 children.
entailment	Kathleen, Sue and Eleanor are the only children of Maria.	Maria has exactly 3 children.
entailment	Ben, Melissa and Emily are the only children of Francis.	Francis has exactly 3 children.
entailment	Jill, Sharon and Melissa are the only children of Grace.	Grace has exactly 3 children.
entailment	Sandra, Fred and Alice are the only children of Carolyn.	Carolyn has exactly 3 children.
entailment	Bobby, David and Charles are the only children of Sophie.	Sophie has exactly 3 children.
entailment	Judy, Peter and Jack are the only children of Billy.	Billy has exactly 3 children.
entailment	Edwin, Andrew and Frederick are the only children of Ron.	Ron has exactly 3 children.
entailment	Ralph, Tom and Sam are the only children of Katherine.	Katherine has exactly 3 children.
entailment	Ben, Jane and Dave are the only children of Janet.	Janet has exactly 3 children.
entailment	Jason, Suzanne and Karen are the only children of Eric.	Eric has exactly 3 children.
entailment	Wendy, George and Louis are the only children of Alison.	Alison has exactly 3 children.
entailment	Barbara, Ray and Bruce are the only children of Ken.	Ken has exactly 3 children.
entailment	Barbara, Helen and Roger are the only children of Lawrence.	Lawrence has exactly 3 children.
entailment	David, Jean and Barbara are the only children of Jerry.	Jerry has exactly 3 children.
entailment	Chris, Linda and Hugh are the only children of Joseph.	Joseph has exactly 3 children.
entailment	Frances, Lisa and Mike are the only children of Kelly.	Kelly has exactly 3 children.
entailment	Jeff, Katie and Louise are the only children of Jean.	Jean has exactly 3 children.
entailment	Tom, Eric and Leslie are the only children of Alison.	Alison has exactly 3 children.
entailment	Betty, Kathy and Jeff are the only children of Alan.	Alan has exactly 3 children.
entailment	Lauren, Amy and Amanda are the only children of Wendy.	Wendy has exactly 3 children.
entailment	Harriet, Angela and Jennifer are the only children of Tom.	Tom has exactly 3 children.
entailment	Johnny, Rachel and Ann are the only children of Emma.	Emma has exactly 3 children.
entailment	Sophie, Diane and Jennifer are the only children of Alan.	Alan has exactly 3 children.
entailment	Christopher, Greg and Kim are the only children of Lawrence.	Lawrence has exactly 3 children.
entailment	Howard, Eleanor and George are the only children of Deborah.	Deborah has exactly 3 children.
entailment	Rebecca, Louise and George are the only children of Pamela.	Pamela has exactly 3 children.
entailment	Kelly, Christopher and Julia are the only children of Al.	Al has exactly 3 children.
entailment	Catherine, Maria and Heather are the only children of Julia.	Julia has exactly 3 children.
entailment	Tim, Pamela and Sam are the only children of Roger.	Roger has exactly 3 children.
entailment	Greg, Jim and Charles are the only children of Billy.	Billy has exactly 3 children.
entailment	Scott, William and Alfred are the only children of Kathy.	Kathy has exactly 3 children.
entailment	Ryan, Amanda and Simon are the only children of Nick.	Nick has exactly 3 children.
entailment	Jay, Robin and Francis are the only children of Lucy.	Lucy has exactly 3 children.
entailment	Alexander, Francis and Elaine are the only children of Bob.	Bob has exactly 3 children.
entailment	Sandra, Charlotte and George are the only children of Florence.	Florence has exactly 3 children.
entailment	Donald, Diane and Alexander are the only children of Ryan.	Ryan has exactly 3 children.
entailment	Eric, Kevin and Robin are the only children of Albert.	Albert has exactly 3 children.
entailment	Joan, Sophie and Steven are the only children of Barbara.	Barbara has exactly 3 children.
entailment	Emily, Harriet and Stephanie are the only children of Lawrence.	Lawrence has exactly 3 children.
entailment	Virginia, Laura and Wendy are the only children of Frank.	Frank has exactly 3 children.
entailment	Claire, Frances and Ashley are the only children of Johnny.	Johnny has exactly 3 children.
entailment	Harry, Barbara and Maria are the only children of Alice.	Alice has exactly 3 children.
entailment	Patricia, Paul and Linda are the only children of Martin.	Martin has exactly 3 children.
entailment	Kate, Sandra and Sue are the only children of Lauren.	Lauren has exactly 3 children.
entailment	Jerry, John and Larry are the only children of Martha.	Martha has exactly 3 children.
entailment	Alexandra, Edwin and Bobby are the only children of Jessica.	Jessica has exactly 3 children.
entailment	Ralph, Katherine and Patricia are the only children of Melissa.	Melissa has exactly 3 children.
entailment	Frederick, Suzanne and Jonathan are the only children of Donald.	Donald has exactly 3 children.
entailment	Greg, Colin and William are the only children of Nancy.	Nancy has exactly 3 children.
entailment	Matt, Donna and Bobby are the only children of Francis.	Francis has exactly 3 children.
entailment	Nick, Martha and Jonathan are the only children of Rose.	Rose has exactly 3 children.
entailment	Jason, Harry and Melissa are the only children of Kelly.	Kelly has exactly 3 children.
entailment	Jill, William and Anna are the only children of Brian.	Brian has exactly 3 children.
entailment	Donna, Florence and Paul are the only children of Ralph.	Ralph has exactly 3 children.
entailment	Mike, Kevin and Charlotte are the only children of Nick.	Nick has exactly 3 children.
entailment	Jimmy, Edwin and Amy are the only children of Annie.	Annie has exactly 3 children.
entailment	Jean, Mike and Judith are the only children of Richard.	Richard has exactly 3 children.
entailment	Stephen, James and Suzanne are the only children of Julia.	Julia has exactly 3 children.
entailment	Dan, Philip and Florence are the only children of Fiona.	Fiona has exactly 3 children.
entailment	Andrew, Jack and Edward are the only children of Kathleen.	Kathleen has exactly 3 children.
entailment	Martha, Anthony and Edith are the only children of Stephen.	Stephen has exactly 3 children.
entailment	Anthony, Amanda and Charlie are the only children of Stephen.	Stephen has exactly 3 children.
entailment	Helen, Annie and Mike are the only children of Angela.	Angela has exactly 3 children.
entailment	Matt, Charles and Benjamin are the only children of Rebecca.	Rebecca has exactly 3 children.
entailment	Tom, Christopher and Scott are the only children of George.	George has exactly 3 children.
entailment	Ann, Charlie and Greg are the only children of Robert.	Robert has exactly 3 children.
entailment	Anna, Dave and Jessica are the only children of Paul.	Paul has exactly 3 children.
entailment	Lisa, Sandra and Larry are the only children of Maria.	Maria has exactly 3 children.
entailment	Peter, Billy and Ian are the only children of Evelyn.	Evelyn has exactly 3 children.
entailment	Ken, Ann and Kathy are the only children of Harry.	Harry has exactly 3 children.
entailment	Carl, Louise and Nancy are the only children of Anna.	Anna has exactly 3 children.
entailment	Suzanne, Pamela and Rose are the only children of Lawrence.	Lawrence has exactly 3 children.
entailment	Harry, Sharon and Evelyn are the only children of Johnny.	Johnny has exactly 3 children.
entailment	Amanda, Andrea and Howard are the only children of Eric.	Eric has exactly 3 children.
entailment	Patricia, Frances and Caroline are the only children of Sally.	Sally has exactly 3 children.
entailment	Leslie, Lisa and Harry are the only children of Donna.	Donna has exactly 3 children.
entailment	Alfred, Thomas and Lisa are the only children of Katherine.	Katherine has exactly 3 children.
entailment	Patricia, Claire and Colin are the only children of Roger.	Roger has exactly 3 children.
entailment	Lawrence, Patricia and Howard are the only children of Jack.	Jack has exactly 3 children.
entailment	Alice, Anthony and Ray are the only children of Edith.	Edith has exactly 3 children.
entailment	Jeff, Claire and Janet are the only children of Martin.	Martin has exactly 3 children.
entailment	Jane, Annie and Claire are the only children of Jerry.	Jerry has exactly 3 children.
entailment	Howard, Kim and Albert are the only children of Caroline.	Caroline has exactly 3 children.
entailment	Sally, Kathryn and Harry are the only children of Heather.	Heather has exactly 3 children.
entailment	Richard, Chris and Charlotte are the only children of Howard.	Howard has exactly 3 children.
entailment	Heather, Alex and James are the only children of Rachel.	Rachel has exactly 3 children.
entailment	Carol, Jennifer and Brian are the only children of Fiona.	Fiona has exactly 3 children.
entailment	Simon, Sue and Louise are the only children of Sarah.	Sarah has exactly 3 children.
