contradiction	Lauren and Eric are the only children of Anna.	Anna has exactly 4 children.
contradiction	Alfred and Edward are the only children of Judy.	Judy has exactly 3 children.
contradiction	Lisa and Anna are the only children of Larry.	Larry has exactly 5 children.
contradiction	Susan and Katie are the only children of Carol.	Carol has exactly 5 children.
contradiction	Catherine and Diana are the only children of Arthur.	Arthur has exactly 5 children.
contradiction	Sam and Jerry are the only children of Brian.	Brian has exactly 1 children.
contradiction	Kelly and Louise are the only children of Sandra.	Sandra has exactly 1 children.
contradiction	Dorothy and Carol are the only children of Ralph.	Ralph has exactly 1 children.
contradiction	Cynthia and Eric are the only children of Marie.	Marie has exactly 1 children.
contradiction	Alexandra and Steven are the only children of Bobby.	Bobby has exactly 4 children.
contradiction	Heather and David are the only children of Diana.	Diana has exactly 4 children.
contradiction	Greg and Eric are the only children of Sharon.	Sharon has exactly 0 children.
contradiction	Bruce and Charles are the only children of Henry.	Henry has exactly 0 children.
contradiction	Diana and Jeff are the only children of Diane.	Diane has exactly 4 children.
contradiction	Don and Edward are the only children of Philip.	Philip has exactly 0 children.
contradiction	Edwin and Eric are the only children of Ryan.	Ryan has exactly 3 children.
contradiction	Lynn and Lisa are the only children of Barbara.	Barbara has exactly 4 children.
contradiction	Scott and Chris are the only children of Bruce.	Bruce has exactly 0 children.
contradiction	Adam and Fiona are the only children of Marilyn.	Marilyn has exactly 4 children.
contradiction	Charlotte and Samuel are the only children of Claire.	Claire has exactly 1 children.
contradiction	Carolyn and Arthur are the only children of Nicole.	Nicole has exactly 3 children.
contradiction	Billy and Diane are the only children of Kim.	Kim has exactly 5 children.
contradiction	Mary and Christine are the only children of Nick.	Nick has exactly 0 children.
contradiction	Frederick and Dan are the only children of Louise.	Louise has exactly 0 children.
contradiction	Kate and Simon are the only children of Elaine.	Elaine has exactly 0 children.
contradiction	Chris and John are the only children of Harriet.	Harriet has exactly 5 children.
contradiction	Karen and Angela are the only children of Samuel.	Samuel has exactly 5 children.
contradiction	Al and Kathleen are the only children of Hugh.	Hugh has exactly 5 children.
contradiction	Keith and Dorothy are the only children of Anna.	Anna has exactly 5 children.
contradiction	Jack and Peter are the only children of Lauren.	Lauren has exactly 0 children.
contradiction	Andrea and Patricia are the only children of Louis.	Louis has exactly 4 children.
contradiction	Christine and Alan are the only children of Edward.	Edward has exactly 5 children.
contradiction	Alexander and Judy are the only children of Christopher.	Christopher has exactly 1 children.
contradiction	Roy and Elaine are the only children of Robin.	Robin has exactly 0 children.
contradiction	Edward and Brian are the only children of Albert.	Albert has exactly 5 children.
contradiction	Don and Lucy are the only children of Andrew.	Andrew has exactly 1 children.
contradiction	Diana and Greg are the only children of Frances.	Frances has exactly 5 children.
contradiction	Emma and Francis are the only children of Martha.	Martha has exactly 0 children.
contradiction	Billy and William are the only children of Patrick.	Patrick has exactly 1 children.
contradiction	Lawrence and Ryan are the only children of Margaret.	Margaret has exactly 0 children.
contradiction	Robert and David are the only children of Charlotte.	Charlotte has exactly 0 children.
contradiction	Heather and John are the only children of Hugh.	Hugh has exactly 3 children.
contradiction	Cynthia and Marilyn are the only children of Ed.	Ed has exactly 3 children.
contradiction	Deborah and Francis are the only children of Jay.	Jay has exactly 0 children.
contradiction	David and Robin are the only children of Matt.	Matt has exactly 4 children.
contradiction	Christine and Samuel are the only children of Janet.	Janet has exactly 0 children.
contradiction	Colin and Kenneth are the only children of Frederick.	Frederick has exactly 5 children.
contradiction	Alfred and Eric are the only children of Robert.	Robert has exactly 0 children.
contradiction	Nick and Johnny are the only children of Tom.	Tom has exactly 3 children.
contradiction	Emily and Catherine are the only children of Patrick.	Patrick has exactly 1 children.
contradiction	Peter and Heather are the only children of Sharon.	Sharon has exactly 4 children.
contradiction	Sally and Katie are the only children of Eric.	Eric has exactly 3 children.
contradiction	Simon and Katie are the only children of Roy.	Roy has exactly 0 children.
contradiction	Leslie and Ralph are the only children of Don.	Don has exactly 0 children.
contradiction	Charlie and Don are the only children of Roger.	Roger has exactly 1 children.
contradiction	Joseph and Sharon are the only children of Richard.	Richard has exactly 3 children.
contradiction	Sara and Leslie are the only children of Walter.	Walter has exactly 4 children.
contradiction	Eleanor and Ed are the only children of Jean.	Jean has exactly 1 children.
contradiction	Angela and Leslie are the only children of Susan.	Susan has exactly 1 children.
contradiction	Donna and Martha are the only children of Jean.	Jean has exactly 5 children.
contradiction	James and Charles are the only children of Fiona.	Fiona has exactly 0 children.
contradiction	Walter and Tim are the only children of Marie.	Marie has exactly 4 children.
contradiction	Mike and Daniel are the only children of Walter.	Walter has exactly 5 children.
contradiction	Brian and Patricia are the only children of Louis.	Louis has exactly 4 children.
contradiction	Lawrence and Martha are the only children of Deborah.	Deborah has exactly 3 children.
contradiction	Kate and Florence are the only children of Emma.	Emma has exactly 3 children.
contradiction	Pamela and Caroline are the only children of Jennifer.	Jennifer has exactly 1 children.
contradiction	Bill and Emily are the only children of Rose.	Rose has exactly 3 children.
contradiction	Sam and Kenneth are the only children of Ellen.	Ellen has exactly 4 children.
contradiction	Martha and Adam are the only children of Bob.	Bob has exactly 1 children.
contradiction	Maria and Kathryn are the only children of Melissa.	Melissa has exactly 3 children.
contradiction	Jonathan and Tony are the only children of Marilyn.	Marilyn has exactly 1 children.
contradiction	Linda and Thomas are the only children of Mark.	Mark has exactly 1 children.
contradiction	Alex and Jerry are the only children of Annie.	Annie has exactly 0 children.
contradiction	Ken and Bobby are the only children of Martha.	Martha has exactly 1 children.
contradiction	Florence and Gary are the only children of Harriet.	Harriet has exactly 1 children.
contradiction	Virginia and Ken are the only children of Kenneth.	Kenneth has exactly 1 children.
contradiction	Jonathan and Donald are the only children of Julia.	Julia has exactly 3 children.
contradiction	Alfred and Ken are the only children of Nicole.	Nicole has exactly 5 children.
contradiction	Donald and Lucy are the only children of Peter.	Peter has exactly 4 children.
contradiction	Tom and Karen are the only children of Claire.	Claire has exactly 1 children.
contradiction	Jonathan and Victoria are the only children of Judy.	Judy has exactly 5 children.
contradiction	Edward and Philip are the only children of Ruth.	Ruth has exactly 3 children.
contradiction	Diane and Billy are the only children of Jessica.	Jessica has exactly 3 children.
contradiction	Joan and Fred are the only children of Katherine.	Katherine has exactly 4 children.
contradiction	Amy and Christopher are the only children of Margaret.	Margaret has exactly 3 children.
contradiction	Thomas and Ellen are the only children of Alfred.	Alfred has exactly 5 children.
contradiction	Carolyn and Katherine are the only children of Albert.	Albert has exactly 5 children.
contradiction	Ryan and Victoria are the only children of Kathryn.	Kathryn has exactly 0 children.
contradiction	Ryan and Joan are the only children of Stephen.	Stephen has exactly 1 children.
contradiction	Wendy and Christine are the only children of Peter.	Peter has exactly 0 children.
contradiction	Claire and Alice are the only children of Alexandra.	Alexandra has exactly 1 children.
contradiction	Matthew and Ken are the only children of Leslie.	Leslie has exactly 1 children.
contradiction	Victoria and Lawrence are the only children of Samuel.	Samuel has exactly 4 children.
contradiction	Bob and Kathy are the only children of Keith.	Keith has exactly 4 children.
contradiction	Heather and Mary are the only children of Katie.	Katie has exactly 1 children.
contradiction	Anthony and Stephen are the only children of Ken.	Ken has exactly 0 children.
contradiction	Keith and Michael are the only children of Kathryn.	Kathryn has exactly 5 children.
contradiction	Harry and Ryan are the only children of Louise.	Louise has exactly 4 children.
contradiction	Carl and Lynn are the only children of Jean.	Jean has exactly 1 children.
contradiction	Bruce and Tom are the only children of Joan.	Joan has exactly 5 children.
contradiction	Bill and Henry are the only children of Joseph.	Joseph has exactly 5 children.
contradiction	Catherine and Mark are the only children of Paul.	Paul has exactly 4 children.
contradiction	Don and Richard are the only children of Matthew.	Matthew has exactly 0 children.
contradiction	Sophie and Peter are the only children of Kelly.	Kelly has exactly 4 children.
contradiction	Margaret and Sharon are the only children of Christine.	Christine has exactly 1 children.
contradiction	Judy and Cynthia are the only children of Jane.	Jane has exactly 5 children.
contradiction	Stephanie and Wendy are the only children of Steven.	Steven has exactly 0 children.
contradiction	Sam and Sharon are the only children of Joseph.	Joseph has exactly 5 children.
contradiction	Ed and Sophie are the only children of Martin.	Martin has exactly 0 children.
contradiction	Janet and Leslie are the only children of Carol.	Carol has exactly 0 children.
contradiction	Jimmy and Joe are the only children of Ray.	Ray has exactly 3 children.
contradiction	Nancy and Frances are the only children of Roger.	Roger has exactly 0 children.
contradiction	Jay and Jim are the only children of Kelly.	Kelly has exactly 0 children.
contradiction	Walter and Carol are the only children of Charlotte.	Charlotte has exactly 5 children.
contradiction	Edward and Deborah are the only children of Bill.	Bill has exactly 0 children.
contradiction	Ken and Roger are the only children of Elaine.	Elaine has exactly 3 children.
contradiction	Marilyn and Cynthia are the only children of Lawrence.	Lawrence has exactly 4 children.
contradiction	Ralph and David are the only children of Rebecca.	Rebecca has exactly 0 children.
contradiction	Johnny and Deborah are the only children of Stephen.	Stephen has exactly 5 children.
contradiction	Bob and Roy are the only children of Ryan.	Ryan has exactly 0 children.
contradiction	Frederick and Steve are the only children of Eric.	Eric has exactly 0 children.
contradiction	Kate and Walter are the only children of Emily.	Emily has exactly 1 children.
contradiction	Kim and Carl are the only children of Eric.	Eric has exactly 1 children.
contradiction	Rose and Alice are the only children of David.	David has exactly 1 children.
contradiction	Kelly and Alexandra are the only children of William.	William has exactly 1 children.
contradiction	Diana and Marie are the only children of Kate.	Kate has exactly 4 children.
contradiction	Frederick and Charlie are the only children of Walter.	Walter has exactly 4 children.
contradiction	Heather and Thomas are the only children of Carl.	Carl has exactly 1 children.
contradiction	Sharon and Andrea are the only children of Martha.	Martha has exactly 0 children.
contradiction	Ralph and Anna are the only children of Sue.	Sue has exactly 1 children.
contradiction	Jeff and Alison are the only children of Florence.	Florence has exactly 3 children.
contradiction	Philip and Ed are the only children of Jim.	Jim has exactly 4 children.
contradiction	Christopher and Charles are the only children of Joe.	Joe has exactly 1 children.
contradiction	Frederick and Ruth are the only children of Edith.	Edith has exactly 0 children.
contradiction	Claire and Jean are the only children of Francis.	Francis has exactly 0 children.
contradiction	Mary and Catherine are the only children of Alexandra.	Alexandra has exactly 3 children.
contradiction	Marilyn and Andrew are the only children of Caroline.	Caroline has exactly 1 children.
contradiction	Rose and Karen are the only children of Lauren.	Lauren has exactly 3 children.
contradiction	Stephanie and Anne are the only children of Steven.	Steven has exactly 0 children.
contradiction	Stephen and Alfred are the only children of Robin.	Robin has exactly 4 children.
contradiction	Keith and Kenneth are the only children of Amanda.	Amanda has exactly 0 children.
contradiction	Roger and Kenneth are the only children of Jack.	Jack has exactly 5 children.
contradiction	Scott and Patricia are the only children of Tim.	Tim has exactly 5 children.
contradiction	Albert and Dave are the only children of Ann.	Ann has exactly 3 children.
contradiction	Evelyn and Philip are the only children of Bobby.	Bobby has exactly 3 children.
contradiction	Roger and Steven are the only children of James.	James has exactly 5 children.
contradiction	Nicole and Helen are the only children of Lawrence.	Lawrence has exactly 0 children.
contradiction	Sharon and Christopher are the only children of William.	William has exactly 4 children.
contradiction	Don and Scott are the only children of Jason.	Jason has exactly 4 children.
contradiction	Kate and Linda are the only children of Eleanor.	Eleanor has exactly 4 children.
contradiction	Margaret and Marie are the only children of Nicole.	Nicole has exactly 5 children.
contradiction	Sarah and Chris are the only children of David.	David has exactly 4 children.
contradiction	James and Judith are the only children of Anthony.	Anthony has exactly 0 children.
contradiction	Marie and Edward are the only children of Anna.	Anna has exactly 3 children.
contradiction	Jane and Alice are the only children of Patricia.	Patricia has exactly 0 children.
contradiction	Jennifer and Julia are the only children of Walter.	Walter has exactly 4 children.
contradiction	Harold and Alison are the only children of Ann.	Ann has exactly 4 children.
contradiction	Kevin and Chris are the only children of Eric.	Eric has exactly 1 children.
contradiction	Daniel and Alice are the only children of Eleanor.	Eleanor has exactly 0 children.
contradiction	Albert and Brian are the only children of Elaine.	Elaine has exactly 5 children.
contradiction	Annie and Matthew are the only children of Louise.	Louise has exactly 0 children.
contradiction	Jack and Charlie are the only children of Jean.	Jean has exactly 0 children.
contradiction	Claire and Eric are the only children of Grace.	Grace has exactly 1 children.
contradiction	David and Judith are the only children of Ann.	Ann has exactly 1 children.
contradiction	Nancy and Grace are the only children of Tony.	Tony has exactly 3 children.
contradiction	Evelyn and Peter are the only children of Maria.	Maria has exactly 1 children.
contradiction	Simon and Florence are the only children of Elizabeth.	Elizabeth has exactly 5 children.
contradiction	Jim and Michael are the only children of Sara.	Sara has exactly 0 children.
contradiction	Alan and Jerry are the only children of Anne.	Anne has exactly 0 children.
contradiction	Margaret and Tony are the only children of Sue.	Sue has exactly 4 children.
contradiction	Laura and Eleanor are the only children of Rose.	Rose has exactly 0 children.
contradiction	William and Dick are the only children of Michelle.	Michelle has exactly 1 children.
contradiction	Tim and Patricia are the only children of Andrea.	Andrea has exactly 1 children.
contradiction	Diana and Ashley are the only children of Andrea.	Andrea has exactly 5 children.
contradiction	Patrick and Ray are the only children of Simon.	Simon has exactly 4 children.
contradiction	Brian and Anna are the only children of Nancy.	Nancy has exactly 0 children.
contradiction	Thomas and Howard are the only children of Bobby.	Bobby has exactly 0 children.
contradiction	Suzanne and Janet are the only children of Steve.	Steve has exactly 0 children.
contradiction	Ralph and Jack are the only children of Andrew.	Andrew has exactly 5 children.
contradiction	Marie and Eric are the only children of Diane.	Diane has exactly 5 children.
contradiction	George and Dick are the only children of Louis.	Louis has exactly 1 children.
contradiction	Kathy and Simon are the only children of Frank.	Frank has exactly 1 children.
contradiction	Scott and Sandra are the only children of Edward.	Edward has exactly 4 children.
contradiction	Jean and Suzanne are the only children of Donald.	Donald has exactly 5 children.
contradiction	Leslie and Wendy are the only children of Robin.	Robin has exactly 3 children.
contradiction	Sophie and Nick are the only children of Al.	Al has exactly 0 children.
contradiction	Sally and Jerry are the only children of Louis.	Louis has exactly 3 children.
contradiction	Sarah and Julia are the only children of Adam.	Adam has exactly 3 children.
contradiction	Margaret and Harry are the only children of Emma.	Emma has exactly 5 children.
contradiction	Katherine and Greg are the only children of Kate.	Kate has exactly 5 children.
contradiction	Sally and Kelly are the only children of Howard.	Howard has exactly 5 children.
contradiction	Fiona and Stephanie are the only children of Cynthia.	Cynthia has exactly 5 children.
contradiction	William and Roger are the only children of Lynn.	Lynn has exactly 0 children.
contradiction	Charles and Edith are the only children of Bill.	Bill has exactly 5 children.
contradiction	Kate and Emily are the only children of Angela.	Angela has exactly 1 children.
contradiction	Martin and Simon are the only children of Judy.	Judy has exactly 3 children.
contradiction	Kelly and Billy are the only children of Thomas.	Thomas has exactly 0 children.
contradiction	Amanda and Elaine are the only children of Sharon.	Sharon has exactly 0 children.
contradiction	Alice and Mary are the only children of Frances.	Frances has exactly 4 children.
contradiction	Jim and Margaret are the only children of Tim.	Tim has exactly 5 children.
contradiction	Emily and Sarah are the only children of Bill.	Bill has exactly 0 children.
contradiction	Mike and Jack are the only children of Richard.	Richard has exactly 0 children.
contradiction	Charles and Katie are the only children of Grace.	Grace has exactly 5 children.
contradiction	Kate and Marilyn are the only children of Alexander.	Alexander has exactly 1 children.
contradiction	Richard and Janet are the only children of Jeff.	Jeff has exactly 0 children.
contradiction	Joe and Johnny are the only children of Fiona.	Fiona has exactly 1 children.
contradiction	Jane and Jill are the only children of Pamela.	Pamela has exactly 5 children.
contradiction	Dave and James are the only children of Leslie.	Leslie has exactly 3 children.
contradiction	Ellen and Jimmy are the only children of Patrick.	Patrick has exactly 4 children.
contradiction	Brian and Jane are the only children of Patricia.	Patricia has exactly 3 children.
contradiction	Ryan and Gary are the only children of Eric.	Eric has exactly 5 children.
contradiction	Ray and Roger are the only children of Jonathan.	Jonathan has exactly 5 children.
contradiction	Mark and Alex are the only children of Ann.	Ann has exactly 0 children.
contradiction	Steve and Ray are the only children of Thomas.	Thomas has exactly 1 children.
contradiction	Marilyn and Edith are the only children of Claire.	Claire has exactly 1 children.
contradiction	Lynn and Jessica are the only children of Keith.	Keith has exactly 5 children.
contradiction	Ron and Henry are the only children of Maria.	Maria has exactly 1 children.
contradiction	Christine and Charles are the only children of Patricia.	Patricia has exactly 5 children.
contradiction	Sam and Fred are the only children of Deborah.	Deborah has exactly 5 children.
contradiction	Kim and Albert are the only children of Jonathan.	Jonathan has exactly 3 children.
contradiction	Charlotte and Bill are the only children of Larry.	Larry has exactly 5 children.
contradiction	Arthur and Howard are the only children of Jonathan.	Jonathan has exactly 1 children.
contradiction	Heather and Alan are the only children of Nick.	Nick has exactly 1 children.
contradiction	Stephanie and Deborah are the only children of Alfred.	Alfred has exactly 4 children.
contradiction	David and Robin are the only children of Kathleen.	Kathleen has exactly 1 children.
contradiction	Heather and Edwin are the only children of Bobby.	Bobby has exactly 4 children.
contradiction	Charlotte and William are the only children of Sandra.	Sandra has exactly 0 children.
contradiction	Karen and Katie are the only children of Ruth.	Ruth has exactly 3 children.
contradiction	Eric and Francis are the only children of Stephen.	Stephen has exactly 4 children.
contradiction	Robin and Donna are the only children of Marie.	Marie has exactly 5 children.
contradiction	Amanda and James are the only children of Helen.	Helen has exactly 3 children.
contradiction	Simon and Jeff are the only children of Diana.	Diana has exactly 5 children.
contradiction	Jerry and Diane are the only children of Hugh.	Hugh has exactly 5 children.
contradiction	Deborah and Brian are the only children of Grace.	Grace has exactly 1 children.
contradiction	Joe and Amanda are the only children of George.	George has exactly 1 children.
contradiction	Louis and Scott are the only children of Ken.	Ken has exactly 1 children.
contradiction	Judith and Dick are the only children of Gary.	Gary has exactly 3 children.
contradiction	Edith and Leslie are the only children of Edwin.	Edwin has exactly 1 children.
contradiction	Francis and Jill are the only children of Jane.	Jane has exactly 4 children.
contradiction	Lynn and Alfred are the only children of Robin.	Robin has exactly 5 children.
contradiction	Frederick and Ryan are the only children of Jimmy.	Jimmy has exactly 4 children.
contradiction	Alex and Sue are the only children of Kate.	Kate has exactly 1 children.
contradiction	Jerry and David are the only children of Tom.	Tom has exactly 1 children.
contradiction	Jean and Laura are the only children of Mark.	Mark has exactly 5 children.
contradiction	Samuel and Kathleen are the only children of Jerry.	Jerry has exactly 5 children.
contradiction	Frederick and Mary are the only children of Martha.	Martha has exactly 5 children.
contradiction	Edith and Marie are the only children of Frederick.	Frederick has exactly 3 children.
contradiction	Ken and Mark are the only children of Brian.	Brian has exactly 0 children.
contradiction	Judy and Sue are the only children of Sandra.	Sandra has exactly 3 children.
contradiction	Evelyn and Grace are the only children of Marilyn.	Marilyn has exactly 5 children.
contradiction	Kathy and Matthew are the only children of Sandra.	Sandra has exactly 4 children.
contradiction	Christine and Diane are the only children of Mark.	Mark has exactly 4 children.
contradiction	Sandra and Dorothy are the only children of Anne.	Anne has exactly 3 children.
contradiction	William and David are the only children of Alexander.	Alexander has exactly 4 children.
contradiction	Kim and Donald are the only children of Tony.	Tony has exactly 0 children.
contradiction	Edward and Lynn are the only children of Tony.	Tony has exactly 4 children.
contradiction	Joan and Ed are the only children of Judith.	Judith has exactly 5 children.
contradiction	Tim and Rebecca are the only children of Ed.	Ed has exactly 3 children.
contradiction	Donald and Angela are the only children of Martin.	Martin has exactly 1 children.
contradiction	Bobby and Bruce are the only children of Annie.	Annie has exactly 5 children.
contradiction	Susan and Christine are the only children of Marie.	Marie has exactly 1 children.
contradiction	Jason and Alan are the only children of Ryan.	Ryan has exactly 3 children.
contradiction	Keith and James are the only children of Roy.	Roy has exactly 5 children.
contradiction	Julie and Susan are the only children of Jerry.	Jerry has exactly 0 children.
contradiction	Katherine and Lisa are the only children of Harry.	Harry has exactly 5 children.
contradiction	Jay and Jane are the only children of Diane.	Diane has exactly 0 children.
contradiction	Henry and Kenneth are the only children of Mark.	Mark has exactly 5 children.
contradiction	Elaine and Linda are the only children of Stephen.	Stephen has exactly 4 children.
contradiction	Nick and Roger are the only children of Lucy.	Lucy has exactly 4 children.
contradiction	Al and Ann are the only children of Frances.	Frances has exactly 5 children.
contradiction	William and Charles are the only children of Tony.	Tony has exactly 4 children.
contradiction	Nick and Martha are the only children of Alan.	Alan has exactly 3 children.
contradiction	Katie and Keith are the only children of Robert.	Robert has exactly 0 children.
contradiction	Bobby and Carol are the only children of Charles.	Charles has exactly 4 children.
contradiction	Carolyn and Barbara are the only children of Jill.	Jill has exactly 5 children.
contradiction	Harold and Mark are the only children of Jeff.	Jeff has exactly 5 children.
