entailment	Caroline's daughter is brave.	Caroline has a daughter.
entailment	Jimmy's son is gluttonous.	Jimmy has a son.
entailment	Eric's brother is interesting.	Eric has a brother.
entailment	Donna's father is curious.	Donna has a father.
entailment	Sarah's son is brilliant.	Sarah has a son.
entailment	Larry's brother is lithe.	Larry has a brother.
entailment	Tim's brother is spirited.	Tim has a brother.
entailment	James's wife is earnest.	James has a wife.
entailment	Emma's husband is silly.	Emma has a husband.
entailment	Rose's sister is warm.	Rose has a sister.
entailment	Melissa's brother is awful.	Melissa has a brother.
entailment	Janet's mother is nasty.	Janet has a mother.
entailment	Adam's husband is industrious.	Adam has a husband.
entailment	Lawrence's husband is critical.	Lawrence has a husband.
entailment	Tony's daughter is analytical.	Tony has a daughter.
entailment	Ed's wife is dowdy.	Ed has a wife.
entailment	Cynthia's mother is abnormal.	Cynthia has a mother.
entailment	Robert's mother is jovial.	Robert has a mother.
entailment	Christopher's brother is numb.	Christopher has a brother.
entailment	Bill's son is idle.	Bill has a son.
entailment	Lisa's sister is excitable.	Lisa has a sister.
entailment	Julia's mother is slovenly.	Julia has a mother.
entailment	Eric's sister is mercurial.	Eric has a sister.
entailment	Jill's mother is blue.	Jill has a mother.
entailment	Martha's husband is well-rounded.	Martha has a husband.
entailment	Jonathan's wife is energetic.	Jonathan has a wife.
entailment	Michelle's brother is illogical.	Michelle has a brother.
entailment	Joseph's brother is obliging.	Joseph has a brother.
entailment	Don's husband is petulant.	Don has a husband.
entailment	Stephen's sister is versatile.	Stephen has a sister.
entailment	Melissa's mother is affectionate.	Melissa has a mother.
entailment	Mary's husband is bright.	Mary has a husband.
entailment	Tony's wife is testy.	Tony has a wife.
entailment	Joe's brother is delicate.	Joe has a brother.
entailment	Jimmy's daughter is responsible.	Jimmy has a daughter.
entailment	Diane's brother is impractical.	Diane has a brother.
entailment	Harriet's daughter is able.	Harriet has a daughter.
entailment	Ralph's sister is thinking.	Ralph has a sister.
entailment	Anne's brother is meddlesome.	Anne has a brother.
entailment	Catherine's son is pleasant.	Catherine has a son.
entailment	Janet's wife is lithe.	Janet has a wife.
entailment	Bobby's sister is snobby.	Bobby has a sister.
entailment	Hugh's son is stern.	Hugh has a son.
entailment	Alice's wife is careless.	Alice has a wife.
entailment	Pamela's sister is lethargic.	Pamela has a sister.
entailment	Donna's wife is easy-going.	Donna has a wife.
entailment	Mark's daughter is impressive.	Mark has a daughter.
entailment	Emily's sister is dramatic.	Emily has a sister.
entailment	Alexandra's daughter is coherent.	Alexandra has a daughter.
entailment	Philip's daughter is lithe.	Philip has a daughter.
entailment	Greg's son is devoted.	Greg has a son.
entailment	Julie's mother is angelic.	Julie has a mother.
entailment	Steven's son is slight.	Steven has a son.
entailment	Colin's daughter is musical.	Colin has a daughter.
entailment	James's sister is blue.	James has a sister.
entailment	Paul's daughter is leery.	Paul has a daughter.
entailment	Alex's mother is snazzy.	Alex has a mother.
entailment	Charlie's sister is distant.	Charlie has a sister.
entailment	Johnny's daughter is popular.	Johnny has a daughter.
entailment	Sue's wife is devoted.	Sue has a wife.
entailment	Louise's mother is delightful.	Louise has a mother.
entailment	Jim's mother is impressive.	Jim has a mother.
entailment	Suzanne's brother is fervent.	Suzanne has a brother.
entailment	Don's husband is conscientious.	Don has a husband.
entailment	Louise's husband is indolent.	Louise has a husband.
entailment	Marie's wife is warmhearted.	Marie has a wife.
entailment	Pamela's wife is long-winded.	Pamela has a wife.
entailment	Gary's brother is conscientious.	Gary has a brother.
entailment	Susan's mother is paternalistic.	Susan has a mother.
entailment	Sara's father is obliging.	Sara has a father.
entailment	Anna's daughter is bright.	Anna has a daughter.
entailment	Laura's sister is gloomy.	Laura has a sister.
entailment	Charles's son is resourceful.	Charles has a son.
entailment	Rachel's daughter is uncooperative.	Rachel has a daughter.
entailment	Jill's mother is touchy.	Jill has a mother.
entailment	Harriet's brother is methodical.	Harriet has a brother.
entailment	Elizabeth's daughter is outspoken.	Elizabeth has a daughter.
entailment	Tom's mother is earnest.	Tom has a mother.
entailment	Philip's son is sullen.	Philip has a son.
entailment	Pamela's husband is distant.	Pamela has a husband.
entailment	Wendy's father is spirited.	Wendy has a father.
entailment	Karen's husband is vulnerable.	Karen has a husband.
entailment	Dave's husband is sneering.	Dave has a husband.
entailment	Kenneth's wife is sour.	Kenneth has a wife.
entailment	Frances's son is cruel.	Frances has a son.
entailment	Annie's son is unsophisticated.	Annie has a son.
entailment	Harold's brother is attentive.	Harold has a brother.
entailment	Steven's husband is above average.	Steven has a husband.
entailment	Helen's son is confused.	Helen has a son.
entailment	Joe's sister is mercurial.	Joe has a sister.
entailment	Wendy's husband is well-rounded.	Wendy has a husband.
entailment	George's wife is snobby.	George has a wife.
entailment	Howard's wife is unemotional.	Howard has a wife.
entailment	Margaret's wife is impractical.	Margaret has a wife.
entailment	Jay's husband is provocative.	Jay has a husband.
entailment	Paul's father is sweet.	Paul has a father.
entailment	Elaine's father is bright.	Elaine has a father.
entailment	Howard's husband is crafty.	Howard has a husband.
entailment	Bill's brother is paternalistic.	Bill has a brother.
entailment	Roy's wife is ugly.	Roy has a wife.
entailment	Lisa's wife is depressed.	Lisa has a wife.
entailment	Chris's daughter is modest.	Chris has a daughter.
entailment	Ray's son is fastidious.	Ray has a son.
entailment	Wendy's brother is provocative.	Wendy has a brother.
entailment	Lawrence's mother is cool-headed.	Lawrence has a mother.
entailment	Kate's wife is plain-speaking.	Kate has a wife.
entailment	Roy's daughter is childlike.	Roy has a daughter.
entailment	Alex's son is amazing.	Alex has a son.
entailment	Elizabeth's son is curious.	Elizabeth has a son.
entailment	Mark's father is awesome.	Mark has a father.
entailment	Rebecca's brother is direct.	Rebecca has a brother.
entailment	Jonathan's mother is sober.	Jonathan has a mother.
entailment	Colin's son is motivated.	Colin has a son.
entailment	Rose's wife is inactive.	Rose has a wife.
entailment	Colin's son is sensible.	Colin has a son.
entailment	Christine's father is impetuous.	Christine has a father.
entailment	Eric's wife is resigned.	Eric has a wife.
entailment	Walter's son is obnoxious.	Walter has a son.
entailment	Christine's father is practical.	Christine has a father.
entailment	Nancy's daughter is exacting.	Nancy has a daughter.
entailment	Kathleen's father is inconsistent.	Kathleen has a father.
entailment	Carolyn's wife is pleasant.	Carolyn has a wife.
entailment	Simon's husband is grouchy.	Simon has a husband.
entailment	Charlie's sister is cooperative.	Charlie has a sister.
entailment	Carol's father is nosy.	Carol has a father.
entailment	Maria's brother is powerful.	Maria has a brother.
entailment	Sharon's wife is bright.	Sharon has a wife.
entailment	Mary's son is paternalistic.	Mary has a son.
entailment	Linda's wife is sulky.	Linda has a wife.
entailment	Julia's daughter is composed.	Julia has a daughter.
entailment	Roger's wife is negative.	Roger has a wife.
entailment	Benjamin's wife is hearty.	Benjamin has a wife.
entailment	Ian's brother is wonderful.	Ian has a brother.
entailment	Laura's son is helpful.	Laura has a son.
entailment	Fred's brother is timid.	Fred has a brother.
entailment	Ruth's sister is brilliant.	Ruth has a sister.
entailment	Jonathan's son is naughty.	Jonathan has a son.
entailment	Joseph's brother is drugged.	Joseph has a brother.
entailment	Kelly's wife is brilliant.	Kelly has a wife.
entailment	Ellen's wife is able.	Ellen has a wife.
entailment	Leslie's mother is generous.	Leslie has a mother.
entailment	David's sister is enthusiastic.	David has a sister.
entailment	Tom's daughter is quick.	Tom has a daughter.
entailment	Robin's daughter is sad.	Robin has a daughter.
entailment	Anthony's husband is analytical.	Anthony has a husband.
entailment	Caroline's son is soulful.	Caroline has a son.
entailment	Ben's father is well-intentioned.	Ben has a father.
entailment	Caroline's father is unpleasant.	Caroline has a father.
entailment	Kathryn's father is evasive.	Kathryn has a father.
entailment	Suzanne's brother is prudent.	Suzanne has a brother.
entailment	Andrew's son is suspicious.	Andrew has a son.
entailment	Alice's wife is dainty.	Alice has a wife.
entailment	Cynthia's daughter is thinking.	Cynthia has a daughter.
entailment	Dick's husband is versatile.	Dick has a husband.
entailment	Lauren's daughter is hypercritical.	Lauren has a daughter.
entailment	Bill's son is plain.	Bill has a son.
entailment	Billy's brother is undependable.	Billy has a brother.
entailment	Lucy's sister is cruel.	Lucy has a sister.
entailment	Jay's sister is conscientious.	Jay has a sister.
entailment	Sandra's daughter is unfriendly.	Sandra has a daughter.
entailment	Kelly's mother is enterprising.	Kelly has a mother.
entailment	Paul's brother is hearty.	Paul has a brother.
entailment	Martin's sister is proud.	Martin has a sister.
entailment	Frances's brother is cautious.	Frances has a brother.
entailment	Julie's son is ferocious.	Julie has a son.
entailment	Edwin's sister is undependable.	Edwin has a sister.
entailment	Julia's father is good.	Julia has a father.
entailment	Margaret's mother is reliable.	Margaret has a mother.
entailment	Linda's mother is buff.	Linda has a mother.
entailment	Diane's husband is great.	Diane has a husband.
entailment	Wendy's daughter is negative.	Wendy has a daughter.
entailment	Edwin's wife is leery.	Edwin has a wife.
entailment	Kelly's son is childlike.	Kelly has a son.
entailment	Peter's son is cool.	Peter has a son.
entailment	Kelly's husband is cautious.	Kelly has a husband.
entailment	Jill's daughter is uncooperative.	Jill has a daughter.
entailment	Andrea's husband is amazing.	Andrea has a husband.
entailment	Ben's father is apathetic.	Ben has a father.
entailment	Adam's father is ostentatious.	Adam has a father.
entailment	Paul's wife is impulsive.	Paul has a wife.
entailment	Anthony's father is attentive.	Anthony has a father.
entailment	Melissa's brother is logical.	Melissa has a brother.
entailment	Christine's brother is quarrelsome.	Christine has a brother.
entailment	David's husband is apprehensive.	David has a husband.
entailment	Carl's mother is indolent.	Carl has a mother.
entailment	Robert's husband is careless.	Robert has a husband.
entailment	Anna's sister is drugged.	Anna has a sister.
entailment	Lisa's father is tolerant.	Lisa has a father.
entailment	Sara's husband is naughty.	Sara has a husband.
entailment	Anne's sister is well-intentioned.	Anne has a sister.
entailment	Ron's son is blunt.	Ron has a son.
entailment	Lynn's husband is venal.	Lynn has a husband.
entailment	Annie's brother is competent.	Annie has a brother.
entailment	Grace's husband is irascible.	Grace has a husband.
entailment	Jane's husband is pensive.	Jane has a husband.
entailment	Dorothy's wife is sneering.	Dorothy has a wife.
entailment	Stephanie's father is careful.	Stephanie has a father.
entailment	Stephen's husband is slight.	Stephen has a husband.
entailment	Bruce's mother is peaceful.	Bruce has a mother.
entailment	Michelle's brother is proficient.	Michelle has a brother.
entailment	Margaret's mother is stupid.	Margaret has a mother.
entailment	Dick's daughter is even-tempered.	Dick has a daughter.
entailment	Patricia's wife is composed.	Patricia has a wife.
entailment	Jessica's daughter is sassy.	Jessica has a daughter.
entailment	Grace's daughter is ambitious.	Grace has a daughter.
entailment	Jennifer's sister is adventurous.	Jennifer has a sister.
entailment	Henry's daughter is dowdy.	Henry has a daughter.
entailment	Simon's daughter is lame.	Simon has a daughter.
entailment	Judy's mother is disruptive.	Judy has a mother.
entailment	Mary's wife is quiet.	Mary has a wife.
entailment	Betty's mother is conceited.	Betty has a mother.
entailment	Jerry's father is methodical.	Jerry has a father.
entailment	Frances's mother is delightful.	Frances has a mother.
entailment	Kathy's sister is dainty.	Kathy has a sister.
entailment	Alfred's wife is disruptive.	Alfred has a wife.
entailment	Ian's son is critical.	Ian has a son.
entailment	Claire's sister is normal.	Claire has a sister.
entailment	George's sister is hearty.	George has a sister.
entailment	Stephen's mother is conceited.	Stephen has a mother.
entailment	Ellen's mother is vulnerable.	Ellen has a mother.
entailment	Carolyn's wife is punctual.	Carolyn has a wife.
entailment	Scott's husband is pretty.	Scott has a husband.
entailment	Christine's brother is outgoing.	Christine has a brother.
entailment	Bruce's daughter is churlish.	Bruce has a daughter.
entailment	Amy's brother is persnickety.	Amy has a brother.
entailment	Janet's son is decisive.	Janet has a son.
entailment	Alexandra's son is lovable.	Alexandra has a son.
entailment	Charlie's sister is soulful.	Charlie has a sister.
entailment	Patricia's mother is conceited.	Patricia has a mother.
entailment	Leslie's mother is orderly.	Leslie has a mother.
entailment	Jill's son is hesitant.	Jill has a son.
entailment	James's daughter is chic.	James has a daughter.
entailment	Larry's husband is snazzy.	Larry has a husband.
entailment	David's husband is cowardly.	David has a husband.
entailment	Jack's mother is attentive.	Jack has a mother.
entailment	Fred's father is impressionable.	Fred has a father.
entailment	Bobby's husband is distant.	Bobby has a husband.
entailment	Steve's son is ardent.	Steve has a son.
entailment	Stephen's daughter is insensitive.	Stephen has a daughter.
entailment	Philip's daughter is excellent.	Philip has a daughter.
entailment	Harold's son is adventurous.	Harold has a son.
entailment	Anne's mother is evasive.	Anne has a mother.
entailment	Frances's brother is callous.	Frances has a brother.
entailment	Kathryn's son is blue.	Kathryn has a son.
entailment	Virginia's son is sophisticated.	Virginia has a son.
entailment	Dorothy's brother is indefatigable.	Dorothy has a brother.
entailment	Mary's mother is fervent.	Mary has a mother.
entailment	Charles's sister is brave.	Charles has a sister.
entailment	Michael's son is cantankerous.	Michael has a son.
entailment	Matthew's sister is cooperative.	Matthew has a sister.
entailment	Katie's father is inspiring.	Katie has a father.
entailment	Hugh's father is impressionable.	Hugh has a father.
entailment	Thomas's sister is inactive.	Thomas has a sister.
entailment	Laura's wife is picky.	Laura has a wife.
entailment	Ruth's brother is realistic.	Ruth has a brother.
entailment	Sarah's sister is playful.	Sarah has a sister.
entailment	Anne's sister is delicate.	Anne has a sister.
entailment	Jean's mother is incompetent.	Jean has a mother.
entailment	Sue's brother is selfish.	Sue has a brother.
entailment	Suzanne's mother is cowardly.	Suzanne has a mother.
entailment	Harry's father is excitable.	Harry has a father.
entailment	Melissa's wife is artificial.	Melissa has a wife.
entailment	Sara's sister is uncooperative.	Sara has a sister.
entailment	Cynthia's brother is kind.	Cynthia has a brother.
entailment	Michelle's daughter is uncooperative.	Michelle has a daughter.
entailment	Ryan's daughter is charming.	Ryan has a daughter.
entailment	Jonathan's father is demure.	Jonathan has a father.
entailment	Anna's brother is thoughtless.	Anna has a brother.
entailment	Ben's son is pretty.	Ben has a son.
entailment	Virginia's mother is irritable.	Virginia has a mother.
entailment	Lauren's brother is conscientious.	Lauren has a brother.
entailment	Mark's mother is unfriendly.	Mark has a mother.
entailment	Maria's son is fussy.	Maria has a son.
entailment	Larry's mother is jovial.	Larry has a mother.
entailment	Maria's son is affectionate.	Maria has a son.
entailment	Katherine's sister is flashy.	Katherine has a sister.
entailment	Roy's son is quick-tempered.	Roy has a son.
entailment	Anna's husband is unwilling.	Anna has a husband.
entailment	Rose's father is meticulous.	Rose has a father.
entailment	Dave's mother is crabby.	Dave has a mother.
entailment	Susan's wife is subtle.	Susan has a wife.
entailment	Keith's daughter is incompetent.	Keith has a daughter.
entailment	Emma's wife is slow.	Emma has a wife.
entailment	Lucy's father is passive.	Lucy has a father.
entailment	Lisa's brother is watchful.	Lisa has a brother.
entailment	Roy's daughter is joyous.	Roy has a daughter.
entailment	Edward's sister is generous.	Edward has a sister.
entailment	Chris's daughter is timid.	Chris has a daughter.
entailment	Alexandra's son is resourceful.	Alexandra has a son.
entailment	Francis's daughter is cool-headed.	Francis has a daughter.
entailment	Chris's husband is unmotivated.	Chris has a husband.
entailment	Alan's sister is agreeable.	Alan has a sister.
entailment	Catherine's brother is illogical.	Catherine has a brother.
entailment	Ann's daughter is quick-tempered.	Ann has a daughter.
entailment	Jerry's brother is fervent.	Jerry has a brother.
entailment	George's sister is plain.	George has a sister.
entailment	Eric's son is unreliable.	Eric has a son.
entailment	Anne's wife is joyous.	Anne has a wife.
entailment	Lisa's son is egotistical.	Lisa has a son.
entailment	Caroline's father is beneficent.	Caroline has a father.
entailment	Claire's father is sweet.	Claire has a father.
entailment	Dave's daughter is imperturbable.	Dave has a daughter.
entailment	Robin's mother is weak.	Robin has a mother.
entailment	Ruth's son is clean.	Ruth has a son.
entailment	Greg's father is eager.	Greg has a father.
entailment	Karen's husband is boisterous.	Karen has a husband.
entailment	Walter's daughter is clean.	Walter has a daughter.
entailment	Ann's wife is surly.	Ann has a wife.
entailment	Patricia's wife is buff.	Patricia has a wife.
entailment	George's mother is cynical.	George has a mother.
entailment	Sophie's mother is grouchy.	Sophie has a mother.
entailment	Eleanor's wife is average.	Eleanor has a wife.
entailment	Rachel's father is patient.	Rachel has a father.
entailment	Ellen's daughter is sober.	Ellen has a daughter.
entailment	Richard's father is churlish.	Richard has a father.
entailment	Judy's husband is cautious.	Judy has a husband.
entailment	Evelyn's father is easy-going.	Evelyn has a father.
entailment	Benjamin's husband is quarrelsome.	Benjamin has a husband.
entailment	Anna's brother is tactful.	Anna has a brother.
entailment	Julia's son is petulant.	Julia has a son.
entailment	Alfred's son is stoic.	Alfred has a son.
entailment	Henry's brother is able.	Henry has a brother.
entailment	Cynthia's daughter is insensitive.	Cynthia has a daughter.
entailment	Richard's husband is helpful.	Richard has a husband.
entailment	Diana's wife is impressionable.	Diana has a wife.
entailment	Jack's wife is unimaginative.	Jack has a wife.
entailment	Cynthia's son is uncooperative.	Cynthia has a son.
entailment	Rachel's father is inconsistent.	Rachel has a father.
entailment	Alexandra's father is dramatic.	Alexandra has a father.
entailment	Chris's brother is eager.	Chris has a brother.
entailment	David's brother is modest.	David has a brother.
entailment	Ed's mother is dirty.	Ed has a mother.
entailment	Louise's sister is thoughtless.	Louise has a sister.
entailment	Walter's sister is proud.	Walter has a sister.
entailment	Helen's daughter is awesome.	Helen has a daughter.
entailment	Alice's wife is crass.	Alice has a wife.
entailment	Harold's sister is unpleasant.	Harold has a sister.
entailment	James's daughter is kind.	James has a daughter.
entailment	Bob's son is discerning.	Bob has a son.
entailment	Kelly's sister is brilliant.	Kelly has a sister.
entailment	David's sister is reliable.	David has a sister.
entailment	Joseph's mother is impatient.	Joseph has a mother.
entailment	Eleanor's daughter is strong.	Eleanor has a daughter.
entailment	Frances's husband is discreet.	Frances has a husband.
entailment	Amanda's father is agreeable.	Amanda has a father.
entailment	Claire's daughter is short-tempered.	Claire has a daughter.
entailment	Nancy's sister is selfish.	Nancy has a sister.
entailment	Eleanor's son is modest.	Eleanor has a son.
entailment	Deborah's daughter is well-developed.	Deborah has a daughter.
entailment	Sally's brother is sober.	Sally has a brother.
entailment	Hugh's sister is assertive.	Hugh has a sister.
entailment	Maria's son is meticulous.	Maria has a son.
entailment	Kathy's sister is experienced.	Kathy has a sister.
entailment	Mark's wife is inconsiderate.	Mark has a wife.
entailment	Helen's father is old-fashioned.	Helen has a father.
entailment	Patrick's brother is versatile.	Patrick has a brother.
entailment	Mark's husband is miserable.	Mark has a husband.
entailment	Amanda's father is industrious.	Amanda has a father.
entailment	Adam's daughter is quick-tempered.	Adam has a daughter.
entailment	Fiona's daughter is sedate.	Fiona has a daughter.
entailment	Albert's sister is spirited.	Albert has a sister.
entailment	Eleanor's daughter is beautiful.	Eleanor has a daughter.
entailment	Richard's wife is agreeable.	Richard has a wife.
entailment	Margaret's father is sad.	Margaret has a father.
entailment	Charlotte's sister is guarded.	Charlotte has a sister.
entailment	Sarah's brother is sophisticated.	Sarah has a brother.
entailment	Simon's father is reluctant.	Simon has a father.
entailment	Melissa's brother is capable.	Melissa has a brother.
entailment	Emma's wife is sensible.	Emma has a wife.
entailment	Ed's wife is flabby.	Ed has a wife.
entailment	Michael's sister is noisy.	Michael has a sister.
entailment	Patrick's son is distraught.	Patrick has a son.
entailment	Evelyn's sister is practical.	Evelyn has a sister.
entailment	Angela's son is sincere.	Angela has a son.
entailment	Bobby's daughter is testy.	Bobby has a daughter.
entailment	Kevin's husband is irritable.	Kevin has a husband.
entailment	Andrew's father is interesting.	Andrew has a father.
entailment	Robert's mother is irascible.	Robert has a mother.
entailment	Mike's daughter is lovely.	Mike has a daughter.
entailment	Ashley's wife is analytical.	Ashley has a wife.
entailment	Rose's brother is cold.	Rose has a brother.
entailment	Jimmy's daughter is decisive.	Jimmy has a daughter.
entailment	Robin's sister is clever.	Robin has a sister.
entailment	John's husband is love-lorn.	John has a husband.
entailment	Melissa's husband is cold.	Melissa has a husband.
entailment	Bruce's husband is adventurous.	Bruce has a husband.
entailment	Andrea's brother is reassuring.	Andrea has a brother.
entailment	Grace's father is nasty.	Grace has a father.
entailment	Chris's wife is timid.	Chris has a wife.
entailment	Arthur's husband is abnormal.	Arthur has a husband.
entailment	Jay's husband is unthinking.	Jay has a husband.
entailment	Louis's husband is dependent.	Louis has a husband.
entailment	Virginia's mother is industrious.	Virginia has a mother.
entailment	Laura's sister is ambitious.	Laura has a sister.
entailment	Nancy's husband is saucy.	Nancy has a husband.
entailment	Alexander's sister is lively.	Alexander has a sister.
entailment	Daniel's brother is well-respected.	Daniel has a brother.
entailment	Simon's wife is flabby.	Simon has a wife.
entailment	Kathy's sister is diligent.	Kathy has a sister.
entailment	Katie's husband is tactless.	Katie has a husband.
entailment	Al's son is gentle.	Al has a son.
entailment	Benjamin's son is above average.	Benjamin has a son.
entailment	Christine's husband is sassy.	Christine has a husband.
entailment	Tony's husband is unguarded.	Tony has a husband.
entailment	Edith's sister is uncooperative.	Edith has a sister.
entailment	Sam's son is impatient.	Sam has a son.
entailment	Carl's father is intelligent.	Carl has a father.
entailment	Betty's father is beautiful.	Betty has a father.
entailment	Ashley's son is easy-going.	Ashley has a son.
entailment	Mark's son is slothful.	Mark has a son.
entailment	Greg's sister is uncooperative.	Greg has a sister.
entailment	Benjamin's wife is pretty.	Benjamin has a wife.
entailment	Billy's daughter is unreliable.	Billy has a daughter.
entailment	Angela's sister is sour.	Angela has a sister.
entailment	Philip's son is versatile.	Philip has a son.
entailment	Roy's daughter is absent-minded.	Roy has a daughter.
entailment	Nancy's wife is mild.	Nancy has a wife.
entailment	Elaine's son is positive.	Elaine has a son.
entailment	Francis's sister is naughty.	Francis has a sister.
entailment	Lisa's sister is shy.	Lisa has a sister.
entailment	Walter's wife is respectful.	Walter has a wife.
entailment	Cynthia's son is ugly.	Cynthia has a son.
entailment	Elizabeth's mother is depressed.	Elizabeth has a mother.
entailment	Karen's sister is paternalistic.	Karen has a sister.
entailment	Tim's son is attentive.	Tim has a son.
entailment	Ashley's father is above average.	Ashley has a father.
entailment	Robert's son is tranquil.	Robert has a son.
entailment	Caroline's sister is hateful.	Caroline has a sister.
entailment	Laura's wife is miserable.	Laura has a wife.
entailment	Rebecca's wife is irritable.	Rebecca has a wife.
entailment	Sue's father is inconsistent.	Sue has a father.
entailment	Tony's husband is energetic.	Tony has a husband.
entailment	Ashley's brother is proficient.	Ashley has a brother.
entailment	James's father is pensive.	James has a father.
entailment	Virginia's son is local.	Virginia has a son.
