entailment	Jim's sister is soulful.	Jim has a sister.
entailment	Jack's sister is confident.	Jack has a sister.
entailment	Barbara's mother is pensive.	Barbara has a mother.
entailment	Emma's wife is indiscreet.	Emma has a wife.
entailment	Katie's sister is sincere.	Katie has a sister.
entailment	Nick's mother is cowardly.	Nick has a mother.
entailment	Alice's son is fervent.	Alice has a son.
entailment	Bruce's wife is vulnerable.	Bruce has a wife.
entailment	Harold's husband is deep.	Harold has a husband.
entailment	Francis's wife is insensitive.	Francis has a wife.
entailment	Hugh's wife is cranky.	Hugh has a wife.
entailment	Nicole's mother is pretty.	Nicole has a mother.
entailment	Julie's brother is responsible.	Julie has a brother.
entailment	Daniel's mother is level-headed.	Daniel has a mother.
entailment	Ruth's sister is cool.	Ruth has a sister.
entailment	Bob's father is dainty.	Bob has a father.
entailment	Marilyn's husband is vigilant.	Marilyn has a husband.
entailment	Susan's father is clever.	Susan has a father.
entailment	Alison's husband is dainty.	Alison has a husband.
entailment	Johnny's daughter is cool-headed.	Johnny has a daughter.
entailment	Edward's son is modest.	Edward has a son.
entailment	Stephanie's husband is unimaginative.	Stephanie has a husband.
entailment	Charlotte's father is logical.	Charlotte has a father.
entailment	Jean's brother is revered.	Jean has a brother.
entailment	Ed's wife is discerning.	Ed has a wife.
entailment	Matthew's brother is clean.	Matthew has a brother.
entailment	Susan's husband is quick.	Susan has a husband.
entailment	Louis's daughter is cautious.	Louis has a daughter.
entailment	Emily's son is self-assured.	Emily has a son.
entailment	Emily's wife is keen.	Emily has a wife.
entailment	Sara's mother is inconsistent.	Sara has a mother.
entailment	Keith's sister is keen.	Keith has a sister.
entailment	Mike's wife is enterprising.	Mike has a wife.
entailment	Jane's daughter is unsure.	Jane has a daughter.
entailment	Benjamin's mother is quarrelsome.	Benjamin has a mother.
entailment	Michelle's son is logical.	Michelle has a son.
entailment	Andrea's husband is unimaginative.	Andrea has a husband.
entailment	Frances's father is impatient.	Frances has a father.
entailment	Bruce's husband is lovely.	Bruce has a husband.
entailment	Marilyn's husband is ferocious.	Marilyn has a husband.
entailment	Keith's father is crafty.	Keith has a father.
entailment	Maria's brother is mature.	Maria has a brother.
entailment	Al's mother is maternal.	Al has a mother.
entailment	Judy's daughter is cautious.	Judy has a daughter.
entailment	Sara's husband is cantankerous.	Sara has a husband.
entailment	Tim's husband is lethargic.	Tim has a husband.
entailment	Philip's son is cranky.	Philip has a son.
entailment	Edith's sister is nervous.	Edith has a sister.
entailment	Charlie's son is serious.	Charlie has a son.
entailment	Frank's father is cranky.	Frank has a father.
entailment	Alexandra's husband is flabby.	Alexandra has a husband.
entailment	Ron's brother is alert.	Ron has a brother.
entailment	Rose's daughter is careless.	Rose has a daughter.
entailment	Sarah's daughter is slow.	Sarah has a daughter.
entailment	Grace's husband is hateful.	Grace has a husband.
entailment	Thomas's father is excitable.	Thomas has a father.
entailment	Edith's brother is delightful.	Edith has a brother.
entailment	Fred's husband is excellent.	Fred has a husband.
entailment	Elizabeth's brother is short-tempered.	Elizabeth has a brother.
entailment	Joan's wife is blue.	Joan has a wife.
entailment	Jim's wife is impressive.	Jim has a wife.
entailment	Sharon's daughter is unimaginative.	Sharon has a daughter.
entailment	Jonathan's son is mild.	Jonathan has a son.
entailment	Donald's daughter is methodical.	Donald has a daughter.
entailment	Tony's husband is confused.	Tony has a husband.
entailment	Eleanor's daughter is easy-going.	Eleanor has a daughter.
entailment	Suzanne's father is kind.	Suzanne has a father.
entailment	Adam's daughter is cynical.	Adam has a daughter.
entailment	Deborah's brother is orderly.	Deborah has a brother.
entailment	Melissa's mother is conscientious.	Melissa has a mother.
entailment	Eleanor's sister is unmotivated.	Eleanor has a sister.
entailment	Carl's wife is depressed.	Carl has a wife.
entailment	Roger's son is talented.	Roger has a son.
entailment	Lisa's sister is watchful.	Lisa has a sister.
entailment	Harriet's daughter is drugged.	Harriet has a daughter.
entailment	Jeff's husband is querulous.	Jeff has a husband.
entailment	Bruce's sister is ugly.	Bruce has a sister.
entailment	Samuel's father is volcanic.	Samuel has a father.
entailment	Alexander's husband is caustic.	Alexander has a husband.
entailment	Annie's brother is unstable.	Annie has a brother.
entailment	Thomas's brother is distraught.	Thomas has a brother.
entailment	Sue's brother is dextrous.	Sue has a brother.
entailment	Kevin's husband is even-tempered.	Kevin has a husband.
entailment	Elizabeth's brother is impetuous.	Elizabeth has a brother.
entailment	Ray's daughter is circumspect.	Ray has a daughter.
entailment	Roger's daughter is enterprising.	Roger has a daughter.
entailment	Katherine's sister is quick-tempered.	Katherine has a sister.
entailment	Patricia's father is disruptive.	Patricia has a father.
entailment	Sue's husband is buff.	Sue has a husband.
entailment	Kathleen's son is normal.	Kathleen has a son.
entailment	Ann's daughter is above average.	Ann has a daughter.
entailment	Maria's brother is immature.	Maria has a brother.
entailment	Amy's mother is methodical.	Amy has a mother.
entailment	Jessica's sister is gloomy.	Jessica has a sister.
entailment	Virginia's brother is maternal.	Virginia has a brother.
entailment	Rose's son is uncertain.	Rose has a son.
entailment	Sophie's brother is meddlesome.	Sophie has a brother.
entailment	Arthur's brother is dextrous.	Arthur has a brother.
entailment	Sharon's brother is below average.	Sharon has a brother.
entailment	Ray's daughter is sulky.	Ray has a daughter.
entailment	Victoria's daughter is keen.	Victoria has a daughter.
entailment	Don's mother is steady.	Don has a mother.
entailment	Rebecca's son is soulless.	Rebecca has a son.
entailment	Albert's mother is maternal.	Albert has a mother.
entailment	Alexander's husband is naive.	Alexander has a husband.
entailment	Lisa's husband is balanced.	Lisa has a husband.
entailment	Paul's husband is reserved.	Paul has a husband.
entailment	Roger's son is prejudiced.	Roger has a son.
entailment	Ralph's husband is discerning.	Ralph has a husband.
entailment	Carol's wife is experienced.	Carol has a wife.
entailment	Susan's husband is reclusive.	Susan has a husband.
entailment	Alan's father is plain-speaking.	Alan has a father.
entailment	Ryan's husband is incompetent.	Ryan has a husband.
entailment	Suzanne's father is exacting.	Suzanne has a father.
entailment	Charlotte's wife is pleasant.	Charlotte has a wife.
entailment	Karen's father is hesitant.	Karen has a father.
entailment	Alan's mother is devoted.	Alan has a mother.
entailment	Al's mother is childlike.	Al has a mother.
entailment	Jonathan's sister is reclusive.	Jonathan has a sister.
entailment	Eric's brother is testy.	Eric has a brother.
entailment	Pamela's brother is awful.	Pamela has a brother.
entailment	Melissa's son is quarrelsome.	Melissa has a son.
entailment	Jonathan's husband is slight.	Jonathan has a husband.
entailment	Tony's wife is awesome.	Tony has a wife.
entailment	Sophie's sister is fervent.	Sophie has a sister.
entailment	Elizabeth's daughter is wonderful.	Elizabeth has a daughter.
entailment	Diane's sister is evasive.	Diane has a sister.
entailment	Sara's sister is apprehensive.	Sara has a sister.
entailment	Alfred's son is sturdy.	Alfred has a son.
