entailment	Larry's wife is considerate.	Larry has a wife.
entailment	Dick's husband is natural.	Dick has a husband.
entailment	Ryan's daughter is excitable.	Ryan has a daughter.
entailment	Sally's wife is mild.	Sally has a wife.
entailment	Marilyn's daughter is meticulous.	Marilyn has a daughter.
entailment	Laura's father is agreeable.	Laura has a father.
entailment	Ashley's husband is fastidious.	Ashley has a husband.
entailment	Anna's brother is leery.	Anna has a brother.
entailment	Judith's husband is disruptive.	Judith has a husband.
entailment	Arthur's father is drugged.	Arthur has a father.
entailment	Johnny's daughter is morose.	Johnny has a daughter.
entailment	Nicole's husband is independent.	Nicole has a husband.
entailment	Jack's father is natural.	Jack has a father.
entailment	Alison's mother is testy.	Alison has a mother.
entailment	Donald's daughter is resourceful.	Donald has a daughter.
entailment	Mary's father is reassuring.	Mary has a father.
entailment	Tom's mother is disagreeable.	Tom has a mother.
entailment	Linda's father is punctual.	Linda has a father.
entailment	Kathleen's sister is indolent.	Kathleen has a sister.
entailment	Diane's mother is passive.	Diane has a mother.
entailment	Dan's sister is cowardly.	Dan has a sister.
entailment	Edward's sister is persevering.	Edward has a sister.
entailment	Frances's wife is sturdy.	Frances has a wife.
entailment	Tom's mother is idle.	Tom has a mother.
entailment	Gary's husband is apathetic.	Gary has a husband.
entailment	Kathy's brother is unpleasant.	Kathy has a brother.
entailment	Marie's father is sneering.	Marie has a father.
entailment	Dorothy's daughter is proficient.	Dorothy has a daughter.
entailment	Nancy's husband is impulsive.	Nancy has a husband.
entailment	Roy's daughter is sharp.	Roy has a daughter.
entailment	Ralph's wife is excellent.	Ralph has a wife.
entailment	Kenneth's husband is natural.	Kenneth has a husband.
entailment	William's son is deep.	William has a son.
entailment	Greg's husband is great.	Greg has a husband.
entailment	Harry's father is sulky.	Harry has a father.
entailment	Pamela's father is sassy.	Pamela has a father.
entailment	Martin's husband is sensible.	Martin has a husband.
entailment	Walter's husband is sedate.	Walter has a husband.
entailment	Colin's brother is thoughtless.	Colin has a brother.
entailment	Evelyn's son is unwilling.	Evelyn has a son.
entailment	Lauren's mother is disruptive.	Lauren has a mother.
entailment	Jim's father is surly.	Jim has a father.
entailment	Katherine's mother is impatient.	Katherine has a mother.
entailment	Charlotte's mother is alert.	Charlotte has a mother.
entailment	Ashley's father is meticulous.	Ashley has a father.
entailment	Bob's mother is ugly.	Bob has a mother.
entailment	Jerry's wife is guarded.	Jerry has a wife.
entailment	George's son is unpopular.	George has a son.
entailment	Sandra's sister is critical.	Sandra has a sister.
entailment	Katie's father is touchy.	Katie has a father.
entailment	Harry's mother is unstable.	Harry has a mother.
entailment	Alexandra's mother is sharp.	Alexandra has a mother.
entailment	Leslie's daughter is unguarded.	Leslie has a daughter.
entailment	Katie's son is persnickety.	Katie has a son.
entailment	Jane's mother is touchy.	Jane has a mother.
entailment	Sarah's father is unguarded.	Sarah has a father.
entailment	Evelyn's father is delightful.	Evelyn has a father.
entailment	Jack's mother is crafty.	Jack has a mother.
entailment	Louis's sister is churlish.	Louis has a sister.
entailment	Jim's sister is hysterical.	Jim has a sister.
entailment	Michael's son is cool.	Michael has a son.
entailment	Emily's son is discerning.	Emily has a son.
entailment	Donald's mother is sober.	Donald has a mother.
entailment	Adam's sister is snazzy.	Adam has a sister.
entailment	Wendy's husband is judgmental.	Wendy has a husband.
entailment	Lawrence's mother is unwilling.	Lawrence has a mother.
entailment	Larry's brother is love-lorn.	Larry has a brother.
entailment	Alan's father is proficient.	Alan has a father.
entailment	Bruce's brother is impractical.	Bruce has a brother.
entailment	Maria's sister is shy.	Maria has a sister.
entailment	Gary's father is unpopular.	Gary has a father.
entailment	Virginia's mother is lovable.	Virginia has a mother.
entailment	Marie's brother is jovial.	Marie has a brother.
entailment	Linda's mother is earnest.	Linda has a mother.
entailment	Ryan's daughter is practical.	Ryan has a daughter.
entailment	Colin's sister is exacting.	Colin has a sister.
entailment	Alfred's sister is soulless.	Alfred has a sister.
entailment	Alan's son is artistic.	Alan has a son.
entailment	Ed's mother is egotistical.	Ed has a mother.
entailment	Ralph's son is quick.	Ralph has a son.
entailment	Amy's sister is inconsistent.	Amy has a sister.
entailment	Donald's daughter is agreeable.	Donald has a daughter.
entailment	Al's brother is volcanic.	Al has a brother.
entailment	Philip's sister is paternalistic.	Philip has a sister.
entailment	Pamela's wife is charming.	Pamela has a wife.
entailment	Donald's mother is meticulous.	Donald has a mother.
entailment	Joe's son is mercurial.	Joe has a son.
entailment	Caroline's daughter is surly.	Caroline has a daughter.
entailment	Gary's brother is gluttonous.	Gary has a brother.
entailment	Kelly's husband is ferocious.	Kelly has a husband.
entailment	Betty's father is naughty.	Betty has a father.
entailment	Andrea's husband is revered.	Andrea has a husband.
entailment	Howard's brother is well-intentioned.	Howard has a brother.
entailment	Dan's mother is plain.	Dan has a mother.
entailment	Peter's father is distraught.	Peter has a father.
entailment	Leslie's father is natural.	Leslie has a father.
entailment	Laura's husband is dirty.	Laura has a husband.
entailment	Anthony's son is distraught.	Anthony has a son.
entailment	Evelyn's wife is cautious.	Evelyn has a wife.
entailment	Harry's brother is curious.	Harry has a brother.
entailment	Grace's mother is respected.	Grace has a mother.
entailment	Howard's wife is insensitive.	Howard has a wife.
entailment	Sam's husband is soulless.	Sam has a husband.
entailment	Stephen's son is stable.	Stephen has a son.
entailment	Ben's father is brave.	Ben has a father.
entailment	Rose's son is unsure.	Rose has a son.
entailment	Charlotte's mother is tactless.	Charlotte has a mother.
entailment	Chris's sister is maternal.	Chris has a sister.
entailment	Sam's father is obnoxious.	Sam has a father.
entailment	Keith's sister is flaky.	Keith has a sister.
entailment	Ed's husband is grouchy.	Ed has a husband.
entailment	Bob's father is thoughtless.	Bob has a father.
entailment	Edward's mother is sassy.	Edward has a mother.
entailment	Joe's daughter is snobby.	Joe has a daughter.
entailment	Frederick's sister is tactless.	Frederick has a sister.
entailment	Steve's mother is vulnerable.	Steve has a mother.
entailment	Evelyn's daughter is efficient.	Evelyn has a daughter.
entailment	Cynthia's wife is reclusive.	Cynthia has a wife.
entailment	Caroline's brother is drugged.	Caroline has a brother.
entailment	Colin's sister is sober.	Colin has a sister.
entailment	Carolyn's daughter is cautious.	Carolyn has a daughter.
entailment	Evelyn's wife is flashy.	Evelyn has a wife.
entailment	Edith's wife is petulant.	Edith has a wife.
entailment	Katherine's sister is crass.	Katherine has a sister.
entailment	Elaine's sister is hearty.	Elaine has a sister.
entailment	Florence's sister is imaginative.	Florence has a sister.
entailment	Amanda's sister is egotistical.	Amanda has a sister.
entailment	Ann's father is slow.	Ann has a father.
entailment	Donna's sister is intelligent.	Donna has a sister.
entailment	Roger's husband is sassy.	Roger has a husband.
entailment	Annie's husband is shrewd.	Annie has a husband.
entailment	William's wife is amusing.	William has a wife.
entailment	Alexander's brother is sleepy.	Alexander has a brother.
entailment	Charlotte's sister is playful.	Charlotte has a sister.
entailment	Francis's son is sensitive.	Francis has a son.
entailment	Billy's mother is abnormal.	Billy has a mother.
entailment	Peter's husband is unemotional.	Peter has a husband.
entailment	Catherine's husband is sensible.	Catherine has a husband.
entailment	Simon's sister is dreary.	Simon has a sister.
entailment	Grace's father is incisive.	Grace has a father.
entailment	Simon's mother is one-sided.	Simon has a mother.
entailment	Frederick's wife is boisterous.	Frederick has a wife.
entailment	Edith's mother is lazy.	Edith has a mother.
entailment	Margaret's daughter is dependent.	Margaret has a daughter.
entailment	Matt's brother is churlish.	Matt has a brother.
entailment	Marilyn's mother is provocative.	Marilyn has a mother.
entailment	Nancy's mother is resigned.	Nancy has a mother.
entailment	David's daughter is maternal.	David has a daughter.
entailment	Jim's brother is self-assured.	Jim has a brother.
entailment	Alfred's sister is demonic.	Alfred has a sister.
entailment	Louise's sister is sassy.	Louise has a sister.
entailment	Betty's wife is delicate.	Betty has a wife.
entailment	Jonathan's husband is quarrelsome.	Jonathan has a husband.
entailment	Claire's mother is fabulous.	Claire has a mother.
entailment	Anthony's brother is tactless.	Anthony has a brother.
entailment	Edith's wife is dependent.	Edith has a wife.
entailment	Philip's husband is gloomy.	Philip has a husband.
entailment	Martin's son is dowdy.	Martin has a son.
entailment	Adam's daughter is watchful.	Adam has a daughter.
entailment	Bill's son is cordial.	Bill has a son.
entailment	Nancy's husband is well-behaved.	Nancy has a husband.
entailment	Ann's mother is even-tempered.	Ann has a mother.
entailment	Kathy's husband is methodical.	Kathy has a husband.
entailment	Ellen's daughter is vigilant.	Ellen has a daughter.
entailment	Louis's sister is amazing.	Louis has a sister.
entailment	Alan's sister is gluttonous.	Alan has a sister.
entailment	Jennifer's mother is soulful.	Jennifer has a mother.
entailment	Wendy's mother is staid.	Wendy has a mother.
entailment	Kathy's son is cordial.	Kathy has a son.
entailment	Tony's sister is one-sided.	Tony has a sister.
entailment	Suzanne's wife is hysterical.	Suzanne has a wife.
entailment	Kevin's father is responsible.	Kevin has a father.
entailment	Gary's son is numb.	Gary has a son.
entailment	Matt's brother is unguarded.	Matt has a brother.
entailment	Leslie's daughter is listless.	Leslie has a daughter.
entailment	Emily's daughter is emotional.	Emily has a daughter.
entailment	Rachel's brother is intolerant.	Rachel has a brother.
entailment	Roy's son is condescending.	Roy has a son.
entailment	Dan's brother is excellent.	Dan has a brother.
entailment	Heather's mother is disagreeable.	Heather has a mother.
entailment	Marilyn's sister is timid.	Marilyn has a sister.
entailment	Charlie's husband is short-tempered.	Charlie has a husband.
entailment	Bobby's son is direct.	Bobby has a son.
entailment	Jane's son is unpleasant.	Jane has a son.
entailment	Peter's mother is tranquil.	Peter has a mother.
entailment	Emily's daughter is confident.	Emily has a daughter.
entailment	Claire's sister is grave.	Claire has a sister.
entailment	Tim's sister is inactive.	Tim has a sister.
entailment	Barbara's wife is cranky.	Barbara has a wife.
entailment	Amanda's daughter is tolerant.	Amanda has a daughter.
entailment	Carol's sister is excellent.	Carol has a sister.
entailment	Mary's father is resigned.	Mary has a father.
entailment	Deborah's brother is efficient.	Deborah has a brother.
entailment	Ralph's daughter is morose.	Ralph has a daughter.
entailment	Lynn's father is hearty.	Lynn has a father.
entailment	Dan's mother is sad.	Dan has a mother.
entailment	Betty's sister is devoted.	Betty has a sister.
entailment	Jack's son is easy-going.	Jack has a son.
entailment	Jimmy's sister is jovial.	Jimmy has a sister.
entailment	Jane's husband is disagreeable.	Jane has a husband.
entailment	Angela's daughter is cool-headed.	Angela has a daughter.
entailment	Fred's son is agreeable.	Fred has a son.
entailment	Simon's daughter is inactive.	Simon has a daughter.
entailment	Bill's daughter is below average.	Bill has a daughter.
entailment	Eleanor's brother is tranquil.	Eleanor has a brother.
entailment	Ray's husband is vulnerable.	Ray has a husband.
entailment	Edith's wife is resentful.	Edith has a wife.
entailment	Ellen's sister is unfriendly.	Ellen has a sister.
entailment	Julie's mother is tired.	Julie has a mother.
entailment	Ryan's son is groggy.	Ryan has a son.
entailment	Anthony's daughter is direct.	Anthony has a daughter.
entailment	Al's wife is chic.	Al has a wife.
entailment	Ed's mother is spiteful.	Ed has a mother.
entailment	Christopher's son is direct.	Christopher has a son.
entailment	Donna's husband is picky.	Donna has a husband.
entailment	Heather's brother is demure.	Heather has a brother.
entailment	Sara's brother is indefatigable.	Sara has a brother.
entailment	Eric's brother is pretty.	Eric has a brother.
entailment	Samuel's husband is independent.	Samuel has a husband.
entailment	Ben's son is paternalistic.	Ben has a son.
entailment	Leslie's wife is flaky.	Leslie has a wife.
entailment	Roy's husband is proficient.	Roy has a husband.
entailment	Anna's daughter is sedate.	Anna has a daughter.
entailment	Florence's brother is crass.	Florence has a brother.
entailment	Alice's son is disagreeable.	Alice has a son.
entailment	Donald's daughter is flabby.	Donald has a daughter.
entailment	Ashley's husband is capable.	Ashley has a husband.
entailment	Fred's brother is adventurous.	Fred has a brother.
entailment	Arthur's father is thinking.	Arthur has a father.
entailment	Deborah's mother is delightful.	Deborah has a mother.
entailment	Francis's father is decisive.	Francis has a father.
entailment	Charlie's daughter is sweet.	Charlie has a daughter.
entailment	Scott's wife is venal.	Scott has a wife.
entailment	Leslie's daughter is proud.	Leslie has a daughter.
entailment	Julie's husband is buff.	Julie has a husband.
entailment	Andrea's husband is proficient.	Andrea has a husband.
entailment	Ray's husband is hesitant.	Ray has a husband.
entailment	Billy's mother is drugged.	Billy has a mother.
entailment	Edward's daughter is sulky.	Edward has a daughter.
entailment	Ken's son is picky.	Ken has a son.
entailment	Laura's sister is grouchy.	Laura has a sister.
entailment	Jonathan's sister is confused.	Jonathan has a sister.
entailment	Martha's mother is lazy.	Martha has a mother.
entailment	Frances's sister is mild.	Frances has a sister.
entailment	Lauren's mother is lazy.	Lauren has a mother.
entailment	Alan's mother is tired.	Alan has a mother.
entailment	Joseph's wife is grave.	Joseph has a wife.
entailment	Bob's brother is agile.	Bob has a brother.
entailment	Hugh's sister is crass.	Hugh has a sister.
entailment	Howard's son is long-winded.	Howard has a son.
entailment	Grace's husband is charming.	Grace has a husband.
entailment	Alexander's wife is indefatigable.	Alexander has a wife.
entailment	Evelyn's father is soulless.	Evelyn has a father.
entailment	Ian's wife is idiotic.	Ian has a wife.
entailment	Jennifer's father is sincere.	Jennifer has a father.
entailment	Jill's sister is decisive.	Jill has a sister.
entailment	Carol's sister is clumsy.	Carol has a sister.
entailment	Virginia's wife is sentimental.	Virginia has a wife.
entailment	William's father is practical.	William has a father.
entailment	Mark's daughter is guarded.	Mark has a daughter.
entailment	Jimmy's wife is popular.	Jimmy has a wife.
entailment	Christopher's wife is bright.	Christopher has a wife.
entailment	Simon's husband is civil.	Simon has a husband.
entailment	Catherine's husband is testy.	Catherine has a husband.
entailment	Ashley's husband is responsible.	Ashley has a husband.
entailment	Ryan's husband is content.	Ryan has a husband.
entailment	Linda's daughter is methodical.	Linda has a daughter.
entailment	William's father is stable.	William has a father.
entailment	Alice's wife is selfish.	Alice has a wife.
entailment	Jennifer's wife is nasty.	Jennifer has a wife.
entailment	Betty's son is methodical.	Betty has a son.
entailment	Rose's brother is restless.	Rose has a brother.
entailment	Kathy's sister is unemotional.	Kathy has a sister.
entailment	Pamela's father is impractical.	Pamela has a father.
entailment	Julie's husband is respected.	Julie has a husband.
entailment	Patrick's son is apathetic.	Patrick has a son.
entailment	James's son is unbalanced.	James has a son.
entailment	Lawrence's mother is sour.	Lawrence has a mother.
entailment	Alexandra's daughter is distrustful.	Alexandra has a daughter.
entailment	Simon's brother is cynical.	Simon has a brother.
entailment	Patrick's husband is jovial.	Patrick has a husband.
entailment	Kevin's mother is cold.	Kevin has a mother.
entailment	Louis's mother is joyous.	Louis has a mother.
entailment	Dan's father is sentimental.	Dan has a father.
entailment	Rebecca's sister is negative.	Rebecca has a sister.
entailment	Mary's husband is efficient.	Mary has a husband.
entailment	Wendy's sister is reserved.	Wendy has a sister.
entailment	Julie's husband is agreeable.	Julie has a husband.
entailment	Pamela's brother is inactive.	Pamela has a brother.
entailment	Colin's daughter is silly.	Colin has a daughter.
entailment	Lynn's mother is drugged.	Lynn has a mother.
entailment	Mike's father is reassuring.	Mike has a father.
entailment	Peter's father is careful.	Peter has a father.
entailment	Leslie's brother is maternal.	Leslie has a brother.
entailment	Rose's mother is enterprising.	Rose has a mother.
entailment	Steven's wife is lovable.	Steven has a wife.
entailment	Walter's father is lean.	Walter has a father.
entailment	Diana's son is jocular.	Diana has a son.
entailment	Ellen's father is demonic.	Ellen has a father.
entailment	Lisa's mother is amazing.	Lisa has a mother.
entailment	Peter's husband is stupid.	Peter has a husband.
entailment	Lynn's brother is buff.	Lynn has a brother.
entailment	Tim's daughter is powerful.	Tim has a daughter.
entailment	Ed's brother is amazing.	Ed has a brother.
entailment	Ian's brother is short-tempered.	Ian has a brother.
entailment	Susan's father is artistic.	Susan has a father.
entailment	Judith's son is lovable.	Judith has a son.
entailment	Emily's mother is slothful.	Emily has a mother.
entailment	Brian's mother is joyous.	Brian has a mother.
entailment	Patrick's brother is lovable.	Patrick has a brother.
entailment	Heather's daughter is inactive.	Heather has a daughter.
entailment	Kim's mother is excellent.	Kim has a mother.
entailment	Carol's husband is direct.	Carol has a husband.
entailment	Richard's son is dowdy.	Richard has a son.
entailment	Karen's sister is mercurial.	Karen has a sister.
entailment	Carol's sister is amiable.	Carol has a sister.
entailment	Anna's husband is restless.	Anna has a husband.
entailment	Kelly's father is critical.	Kelly has a father.
entailment	Christine's mother is suspicious.	Christine has a mother.
entailment	Wendy's son is cantankerous.	Wendy has a son.
entailment	Barbara's daughter is tactful.	Barbara has a daughter.
entailment	Andrea's mother is awful.	Andrea has a mother.
entailment	Sarah's husband is obliging.	Sarah has a husband.
entailment	Tim's husband is churlish.	Tim has a husband.
entailment	Annie's wife is drowsy.	Annie has a wife.
entailment	Katherine's wife is cautious.	Katherine has a wife.
entailment	Jennifer's mother is unpopular.	Jennifer has a mother.
entailment	Margaret's mother is negative.	Margaret has a mother.
entailment	Kevin's brother is cordial.	Kevin has a brother.
entailment	Gary's mother is restless.	Gary has a mother.
entailment	Frank's mother is unemotional.	Frank has a mother.
entailment	Frances's wife is impractical.	Frances has a wife.
entailment	Claire's daughter is revered.	Claire has a daughter.
entailment	Matt's husband is enthusiastic.	Matt has a husband.
entailment	Anna's mother is abnormal.	Anna has a mother.
entailment	Rose's daughter is disruptive.	Rose has a daughter.
entailment	Roger's mother is incompetent.	Roger has a mother.
entailment	Howard's son is unmotivated.	Howard has a son.
entailment	Alexander's husband is cruel.	Alexander has a husband.
entailment	Edwin's mother is ridiculous.	Edwin has a mother.
entailment	George's daughter is alert.	George has a daughter.
entailment	Rachel's father is generous.	Rachel has a father.
entailment	Pamela's daughter is discerning.	Pamela has a daughter.
entailment	Louis's wife is snazzy.	Louis has a wife.
entailment	Emily's sister is reserved.	Emily has a sister.
entailment	Alan's daughter is delicate.	Alan has a daughter.
entailment	Thomas's father is impulsive.	Thomas has a father.
entailment	Scott's brother is logical.	Scott has a brother.
entailment	Ed's wife is enterprising.	Ed has a wife.
entailment	Carol's father is indiscreet.	Carol has a father.
entailment	Donna's sister is beneficent.	Donna has a sister.
entailment	Laura's brother is friendly.	Laura has a brother.
entailment	Sally's daughter is dirty.	Sally has a daughter.
entailment	Emily's father is intelligent.	Emily has a father.
entailment	Ray's brother is impractical.	Ray has a brother.
entailment	Greg's wife is well-rounded.	Greg has a wife.
entailment	Lynn's husband is self-assured.	Lynn has a husband.
entailment	Amy's mother is cordial.	Amy has a mother.
entailment	Robert's sister is blunt.	Robert has a sister.
entailment	Scott's son is short-tempered.	Scott has a son.
entailment	Elizabeth's father is ugly.	Elizabeth has a father.
entailment	Jack's mother is vigilant.	Jack has a mother.
entailment	Richard's wife is mild.	Richard has a wife.
entailment	Charlie's father is alert.	Charlie has a father.
entailment	Frederick's mother is brilliant.	Frederick has a mother.
entailment	Ralph's mother is well-intentioned.	Ralph has a mother.
entailment	Anne's daughter is impulsive.	Anne has a daughter.
entailment	Daniel's sister is motivated.	Daniel has a sister.
entailment	Melissa's brother is sedate.	Melissa has a brother.
entailment	Roger's father is curious.	Roger has a father.
entailment	Annie's daughter is artificial.	Annie has a daughter.
entailment	Andrew's son is nervous.	Andrew has a son.
entailment	Charlie's daughter is methodical.	Charlie has a daughter.
entailment	Joan's sister is sensitive.	Joan has a sister.
entailment	Emma's husband is helpful.	Emma has a husband.
entailment	Alan's father is quarrelsome.	Alan has a father.
entailment	Alan's son is confident.	Alan has a son.
entailment	Jane's father is callous.	Jane has a father.
entailment	Arthur's husband is powerful.	Arthur has a husband.
entailment	Sue's son is stoic.	Sue has a son.
entailment	Walter's daughter is blue.	Walter has a daughter.
entailment	Sarah's wife is fussy.	Sarah has a wife.
entailment	Linda's brother is wonderful.	Linda has a brother.
entailment	Benjamin's wife is watchful.	Benjamin has a wife.
entailment	Sophie's husband is dirty.	Sophie has a husband.
entailment	Anna's brother is amusing.	Anna has a brother.
entailment	Chris's father is sophisticated.	Chris has a father.
entailment	Roger's wife is steady.	Roger has a wife.
entailment	Ken's sister is friendly.	Ken has a sister.
entailment	Richard's wife is dependent.	Richard has a wife.
entailment	Alice's son is plain-speaking.	Alice has a son.
entailment	Bobby's mother is independent.	Bobby has a mother.
entailment	Karen's mother is sullen.	Karen has a mother.
entailment	Florence's brother is intolerant.	Florence has a brother.
entailment	Fred's mother is guarded.	Fred has a mother.
entailment	David's brother is plain-speaking.	David has a brother.
entailment	Alex's wife is guarded.	Alex has a wife.
entailment	Annie's husband is spiteful.	Annie has a husband.
entailment	Kenneth's son is cordial.	Kenneth has a son.
entailment	Peter's mother is mild.	Peter has a mother.
entailment	Andrew's brother is drowsy.	Andrew has a brother.
entailment	Helen's son is amiable.	Helen has a son.
entailment	Joseph's daughter is proficient.	Joseph has a daughter.
entailment	Rachel's son is pretty.	Rachel has a son.
entailment	Francis's brother is crabby.	Francis has a brother.
entailment	Henry's sister is ugly.	Henry has a sister.
entailment	Edith's mother is unreliable.	Edith has a mother.
entailment	Martin's sister is competent.	Martin has a sister.
entailment	Andrew's wife is restless.	Andrew has a wife.
entailment	Peter's sister is willing.	Peter has a sister.
entailment	Patrick's father is numb.	Patrick has a father.
entailment	Benjamin's son is distrustful.	Benjamin has a son.
entailment	Billy's brother is affectionate.	Billy has a brother.
entailment	Fiona's brother is sweet.	Fiona has a brother.
entailment	Eleanor's mother is sturdy.	Eleanor has a mother.
entailment	Linda's brother is cordial.	Linda has a brother.
entailment	Emily's brother is reliable.	Emily has a brother.
entailment	Ryan's mother is sensitive.	Ryan has a mother.
entailment	Victoria's brother is orderly.	Victoria has a brother.
entailment	Eric's father is persnickety.	Eric has a father.
entailment	Jim's son is impetuous.	Jim has a son.
entailment	Bill's mother is unpopular.	Bill has a mother.
entailment	James's daughter is reclusive.	James has a daughter.
entailment	Alison's mother is inspiring.	Alison has a mother.
entailment	Laura's husband is reserved.	Laura has a husband.
entailment	Amanda's husband is short-tempered.	Amanda has a husband.
entailment	Julie's sister is confident.	Julie has a sister.
entailment	Helen's sister is practical.	Helen has a sister.
entailment	Robert's sister is unemotional.	Robert has a sister.
entailment	Sophie's son is lazy.	Sophie has a son.
entailment	Lauren's mother is candid.	Lauren has a mother.
entailment	Sue's wife is lovable.	Sue has a wife.
entailment	Sophie's father is gloomy.	Sophie has a father.
entailment	Dan's husband is incisive.	Dan has a husband.
entailment	Steven's mother is stern.	Steven has a mother.
entailment	Joe's wife is shy.	Joe has a wife.
