entailment	Alfred reached hotel at 11:30 AM whereas George reached at 6:30 AM.	Alfred reached after George.
entailment	James reached hotel at 7 AM whereas Katherine reached at 6 AM.	James reached after Katherine.
entailment	Lauren reached hospital at 3:30 PM whereas John reached at 6:30 AM.	Lauren reached after John.
entailment	Janet reached theatre at 5:30 PM whereas Walter reached at 2:30 PM.	Janet reached after Walter.
entailment	Linda reached school at 11:30 AM whereas Sarah reached at 8:30 AM.	Linda reached after Sarah.
entailment	Mark reached hospital at 5 PM whereas Kathy reached at 4 PM.	Mark reached after Kathy.
entailment	Ron reached theatre at 2 PM whereas Harry reached at 1 PM.	Ron reached after Harry.
entailment	Florence reached theatre at 2:30 PM whereas Jonathan reached at 11 AM.	Florence reached after Jonathan.
entailment	Emily reached school at 1 PM whereas Edwin reached at 6:30 AM.	Emily reached after Edwin.
entailment	Harold reached school at 9:30 AM whereas Roy reached at 6 AM.	Harold reached after Roy.
entailment	Sandra reached park at 12 noon whereas Karen reached at 10:30 AM.	Sandra reached after Karen.
entailment	Margaret reached theatre at 10:30 AM whereas Rachel reached at 10 AM.	Margaret reached after Rachel.
entailment	Tim reached theatre at 5:30 PM whereas Ray reached at 10 AM.	Tim reached after Ray.
entailment	Katie reached park at 4:30 PM whereas Steven reached at 9 AM.	Katie reached after Steven.
entailment	Florence reached museum at 9 AM whereas Angela reached at 6:30 AM.	Florence reached after Angela.
entailment	Sharon reached park at 5 PM whereas Daniel reached at 8 AM.	Sharon reached after Daniel.
entailment	Ruth reached museum at 12:30 PM whereas Alison reached at 7:30 AM.	Ruth reached after Alison.
entailment	Billy reached park at 3:30 PM whereas Richard reached at 3 PM.	Billy reached after Richard.
entailment	Eric reached office at 8 AM whereas Harriet reached at 6:30 AM.	Eric reached after Harriet.
entailment	Julia reached park at 2:30 PM whereas Kathryn reached at 8 AM.	Julia reached after Kathryn.
entailment	Dorothy reached hospital at 9:30 AM whereas Margaret reached at 8 AM.	Dorothy reached after Margaret.
entailment	Jack reached park at 7:30 AM whereas Charles reached at 6:30 AM.	Jack reached after Charles.
entailment	Dan reached school at 6 PM whereas Edith reached at 6:30 AM.	Dan reached after Edith.
entailment	Don reached school at 4:30 PM whereas Harry reached at 7:30 AM.	Don reached after Harry.
entailment	Philip reached hospital at 12:30 PM whereas Ruth reached at 8:30 AM.	Philip reached after Ruth.
entailment	Alice reached theatre at 6 PM whereas Harriet reached at 3:30 PM.	Alice reached after Harriet.
entailment	Julia reached hotel at 5:30 PM whereas Ian reached at 10 AM.	Julia reached after Ian.
entailment	Ian reached school at 4 PM whereas Barbara reached at 9:30 AM.	Ian reached after Barbara.
entailment	Katie reached museum at 11:30 AM whereas Harriet reached at 6:30 AM.	Katie reached after Harriet.
entailment	Wendy reached school at 9:30 AM whereas Jeff reached at 6:30 AM.	Wendy reached after Jeff.
entailment	Scott reached office at 5 PM whereas Grace reached at 4 PM.	Scott reached after Grace.
entailment	Mark reached hospital at 7:30 AM whereas Nicole reached at 7 AM.	Mark reached after Nicole.
entailment	Dorothy reached school at 1:30 PM whereas Colin reached at 6:30 AM.	Dorothy reached after Colin.
entailment	Roger reached office at 2:30 PM whereas Nicole reached at 12:30 PM.	Roger reached after Nicole.
entailment	Jessica reached museum at 12:30 PM whereas Anne reached at 11:30 AM.	Jessica reached after Anne.
entailment	Emily reached hotel at 3 PM whereas Marilyn reached at 11:30 AM.	Emily reached after Marilyn.
entailment	Philip reached museum at 4 PM whereas Susan reached at 1 PM.	Philip reached after Susan.
entailment	Alex reached school at 3:30 PM whereas Bobby reached at 12 noon.	Alex reached after Bobby.
entailment	Emma reached school at 12 noon whereas Jason reached at 6 AM.	Emma reached after Jason.
entailment	Diane reached office at 2 PM whereas Edith reached at 11 AM.	Diane reached after Edith.
entailment	Annie reached hospital at 6 PM whereas Sue reached at 2:30 PM.	Annie reached after Sue.
entailment	Nancy reached park at 11:30 AM whereas Christine reached at 11 AM.	Nancy reached after Christine.
entailment	Nancy reached office at 2 PM whereas Heather reached at 9 AM.	Nancy reached after Heather.
entailment	Roy reached hotel at 11:30 AM whereas Evelyn reached at 7 AM.	Roy reached after Evelyn.
entailment	Tim reached hotel at 2 PM whereas Jason reached at 12 noon.	Tim reached after Jason.
entailment	Simon reached theatre at 5 PM whereas Joseph reached at 7 AM.	Simon reached after Joseph.
entailment	Victoria reached museum at 3 PM whereas Joan reached at 9 AM.	Victoria reached after Joan.
entailment	Virginia reached hospital at 12 noon whereas Larry reached at 7:30 AM.	Virginia reached after Larry.
entailment	Roger reached theatre at 12 noon whereas Louise reached at 9 AM.	Roger reached after Louise.
entailment	Christine reached school at 8 AM whereas Tom reached at 6 AM.	Christine reached after Tom.
entailment	Amanda reached hospital at 1:30 PM whereas Alfred reached at 8 AM.	Amanda reached after Alfred.
entailment	Victoria reached hospital at 4:30 PM whereas Evelyn reached at 7:30 AM.	Victoria reached after Evelyn.
entailment	Linda reached hospital at 4 PM whereas Wendy reached at 10 AM.	Linda reached after Wendy.
entailment	Carol reached hotel at 4:30 PM whereas Sam reached at 9 AM.	Carol reached after Sam.
entailment	Victoria reached museum at 1 PM whereas Christopher reached at 11:30 AM.	Victoria reached after Christopher.
entailment	John reached hospital at 8 AM whereas Maria reached at 7 AM.	John reached after Maria.
entailment	Linda reached park at 10:30 AM whereas James reached at 8 AM.	Linda reached after James.
entailment	Catherine reached office at 6 PM whereas Fred reached at 7:30 AM.	Catherine reached after Fred.
entailment	Heather reached school at 9:30 AM whereas Roy reached at 6 AM.	Heather reached after Roy.
entailment	Alexandra reached office at 3:30 PM whereas Dorothy reached at 12 noon.	Alexandra reached after Dorothy.
entailment	Heather reached hospital at 2:30 PM whereas Tom reached at 7:30 AM.	Heather reached after Tom.
entailment	Charlotte reached park at 5 PM whereas Al reached at 1:30 PM.	Charlotte reached after Al.
entailment	Carl reached park at 4:30 PM whereas Mary reached at 11 AM.	Carl reached after Mary.
entailment	Steven reached theatre at 11 AM whereas Alison reached at 8 AM.	Steven reached after Alison.
entailment	Henry reached hospital at 11 AM whereas Linda reached at 7:30 AM.	Henry reached after Linda.
entailment	Christopher reached hotel at 6 PM whereas Bill reached at 12 noon.	Christopher reached after Bill.
entailment	Ron reached hospital at 3:30 PM whereas Dave reached at 1:30 PM.	Ron reached after Dave.
entailment	Ray reached park at 10 AM whereas Ashley reached at 6:30 AM.	Ray reached after Ashley.
entailment	Tom reached museum at 4:30 PM whereas Ian reached at 8:30 AM.	Tom reached after Ian.
entailment	Louis reached office at 8 AM whereas Jane reached at 6 AM.	Louis reached after Jane.
entailment	Billy reached museum at 3 PM whereas Tom reached at 10:30 AM.	Billy reached after Tom.
entailment	Mary reached school at 9:30 AM whereas Angela reached at 8 AM.	Mary reached after Angela.
entailment	Rose reached theatre at 8 AM whereas Amanda reached at 6 AM.	Rose reached after Amanda.
entailment	Judy reached hospital at 12:30 PM whereas Ellen reached at 7:30 AM.	Judy reached after Ellen.
entailment	Howard reached park at 4:30 PM whereas Nick reached at 4 PM.	Howard reached after Nick.
entailment	Harry reached hospital at 3 PM whereas Ryan reached at 6:30 AM.	Harry reached after Ryan.
entailment	Katherine reached hospital at 6:30 AM whereas Robin reached at 6 AM.	Katherine reached after Robin.
entailment	Kathy reached school at 7 AM whereas Jeff reached at 6 AM.	Kathy reached after Jeff.
entailment	Christine reached office at 7 AM whereas Julie reached at 6 AM.	Christine reached after Julie.
entailment	Steve reached theatre at 9:30 AM whereas Sally reached at 9 AM.	Steve reached after Sally.
entailment	Pamela reached hospital at 8 AM whereas Richard reached at 6:30 AM.	Pamela reached after Richard.
entailment	Mark reached museum at 2 PM whereas Ruth reached at 10:30 AM.	Mark reached after Ruth.
entailment	Anthony reached hotel at 6 PM whereas Richard reached at 8 AM.	Anthony reached after Richard.
entailment	Jane reached museum at 10:30 AM whereas Betty reached at 6:30 AM.	Jane reached after Betty.
entailment	Christopher reached park at 1:30 PM whereas Louise reached at 12 noon.	Christopher reached after Louise.
entailment	Alexander reached hotel at 9 AM whereas Johnny reached at 8:30 AM.	Alexander reached after Johnny.
entailment	Billy reached museum at 2 PM whereas Sandra reached at 7:30 AM.	Billy reached after Sandra.
entailment	Ryan reached school at 12 noon whereas Dorothy reached at 8:30 AM.	Ryan reached after Dorothy.
entailment	Ruth reached park at 4:30 PM whereas Bobby reached at 9 AM.	Ruth reached after Bobby.
entailment	Benjamin reached park at 1:30 PM whereas Harriet reached at 10 AM.	Benjamin reached after Harriet.
entailment	Steve reached hospital at 3:30 PM whereas Catherine reached at 2:30 PM.	Steve reached after Catherine.
entailment	Jay reached hotel at 12 noon whereas Matthew reached at 11:30 AM.	Jay reached after Matthew.
entailment	Suzanne reached theatre at 10:30 AM whereas Elaine reached at 6:30 AM.	Suzanne reached after Elaine.
entailment	William reached hospital at 3 PM whereas Dave reached at 11:30 AM.	William reached after Dave.
entailment	Ian reached hotel at 7:30 AM whereas Robert reached at 6 AM.	Ian reached after Robert.
entailment	Anna reached theatre at 2 PM whereas Sally reached at 12:30 PM.	Anna reached after Sally.
entailment	Brian reached office at 2 PM whereas Henry reached at 7:30 AM.	Brian reached after Henry.
entailment	Florence reached school at 5 PM whereas Annie reached at 9 AM.	Florence reached after Annie.
entailment	Barbara reached museum at 4 PM whereas Patrick reached at 8 AM.	Barbara reached after Patrick.
entailment	Alison reached school at 11 AM whereas Ed reached at 9:30 AM.	Alison reached after Ed.
entailment	Jay reached school at 12:30 PM whereas Emma reached at 6 AM.	Jay reached after Emma.
entailment	Christopher reached theatre at 10 AM whereas Jack reached at 8:30 AM.	Christopher reached after Jack.
entailment	Elaine reached museum at 2:30 PM whereas Ken reached at 10 AM.	Elaine reached after Ken.
entailment	Caroline reached office at 9:30 AM whereas Edward reached at 8:30 AM.	Caroline reached after Edward.
entailment	Harry reached school at 10 AM whereas Matthew reached at 8:30 AM.	Harry reached after Matthew.
entailment	Melissa reached hospital at 6 PM whereas Christine reached at 1 PM.	Melissa reached after Christine.
entailment	Marilyn reached hotel at 2:30 PM whereas Johnny reached at 10 AM.	Marilyn reached after Johnny.
entailment	Harriet reached museum at 6:30 AM whereas Catherine reached at 6 AM.	Harriet reached after Catherine.
entailment	Edward reached theatre at 9:30 AM whereas Ralph reached at 7:30 AM.	Edward reached after Ralph.
entailment	Linda reached hospital at 8:30 AM whereas Kathleen reached at 6:30 AM.	Linda reached after Kathleen.
entailment	Maria reached office at 7 AM whereas Nick reached at 6 AM.	Maria reached after Nick.
entailment	Linda reached park at 5:30 PM whereas Alfred reached at 3 PM.	Linda reached after Alfred.
entailment	Jerry reached office at 5 PM whereas Evelyn reached at 12:30 PM.	Jerry reached after Evelyn.
entailment	Jimmy reached park at 2:30 PM whereas Keith reached at 7:30 AM.	Jimmy reached after Keith.
entailment	Diane reached hospital at 2 PM whereas Anthony reached at 7:30 AM.	Diane reached after Anthony.
entailment	Anthony reached museum at 9:30 AM whereas Anne reached at 8:30 AM.	Anthony reached after Anne.
entailment	Florence reached hotel at 3:30 PM whereas Carolyn reached at 11 AM.	Florence reached after Carolyn.
entailment	William reached hotel at 4:30 PM whereas Katie reached at 7:30 AM.	William reached after Katie.
entailment	Peter reached office at 4:30 PM whereas Nick reached at 12 noon.	Peter reached after Nick.
entailment	Simon reached school at 9 AM whereas Kim reached at 6 AM.	Simon reached after Kim.
entailment	Melissa reached hotel at 2 PM whereas Judy reached at 10 AM.	Melissa reached after Judy.
entailment	Eleanor reached hospital at 5 PM whereas Albert reached at 4 PM.	Eleanor reached after Albert.
entailment	Roger reached park at 2 PM whereas Dorothy reached at 11 AM.	Roger reached after Dorothy.
entailment	Jimmy reached theatre at 11 AM whereas Margaret reached at 6 AM.	Jimmy reached after Margaret.
entailment	Arthur reached school at 2 PM whereas Rebecca reached at 10 AM.	Arthur reached after Rebecca.
entailment	Kevin reached park at 12 noon whereas Sue reached at 9:30 AM.	Kevin reached after Sue.
entailment	Samuel reached museum at 12:30 PM whereas Kevin reached at 7 AM.	Samuel reached after Kevin.
entailment	Hugh reached museum at 6:30 AM whereas Sara reached at 6 AM.	Hugh reached after Sara.
entailment	Frank reached museum at 4:30 PM whereas Matt reached at 4 PM.	Frank reached after Matt.
entailment	Pamela reached hospital at 2:30 PM whereas Ron reached at 8 AM.	Pamela reached after Ron.
entailment	Patrick reached hotel at 10 AM whereas Louise reached at 8:30 AM.	Patrick reached after Louise.
entailment	Patricia reached hotel at 5 PM whereas Sarah reached at 11 AM.	Patricia reached after Sarah.
entailment	Sandra reached hotel at 11 AM whereas Kathleen reached at 9 AM.	Sandra reached after Kathleen.
entailment	Ellen reached hospital at 2:30 PM whereas Harold reached at 9:30 AM.	Ellen reached after Harold.
entailment	Frank reached school at 5:30 PM whereas Laura reached at 1 PM.	Frank reached after Laura.
entailment	Bobby reached hotel at 3 PM whereas Donald reached at 9 AM.	Bobby reached after Donald.
entailment	Margaret reached office at 8 AM whereas Christopher reached at 6 AM.	Margaret reached after Christopher.
entailment	Philip reached school at 2:30 PM whereas Jack reached at 7 AM.	Philip reached after Jack.
entailment	Louise reached theatre at 1 PM whereas Betty reached at 6:30 AM.	Louise reached after Betty.
entailment	Susan reached hospital at 8 AM whereas Johnny reached at 6 AM.	Susan reached after Johnny.
entailment	Leslie reached park at 3:30 PM whereas Suzanne reached at 1 PM.	Leslie reached after Suzanne.
entailment	Roger reached park at 1 PM whereas Angela reached at 6:30 AM.	Roger reached after Angela.
entailment	Fiona reached school at 11:30 AM whereas Charlotte reached at 11 AM.	Fiona reached after Charlotte.
entailment	Pamela reached museum at 6 PM whereas Louise reached at 9:30 AM.	Pamela reached after Louise.
entailment	Robin reached school at 5:30 PM whereas Frances reached at 1:30 PM.	Robin reached after Frances.
entailment	Bill reached museum at 4 PM whereas Kathryn reached at 12:30 PM.	Bill reached after Kathryn.
entailment	Claire reached theatre at 10:30 AM whereas Victoria reached at 9:30 AM.	Claire reached after Victoria.
entailment	Albert reached theatre at 10 AM whereas Bruce reached at 7 AM.	Albert reached after Bruce.
entailment	Nancy reached theatre at 5:30 PM whereas Jay reached at 9:30 AM.	Nancy reached after Jay.
entailment	Ed reached hotel at 11 AM whereas Louis reached at 8:30 AM.	Ed reached after Louis.
entailment	Frank reached hospital at 8:30 AM whereas Judith reached at 6:30 AM.	Frank reached after Judith.
entailment	Donald reached museum at 12 noon whereas Rachel reached at 9:30 AM.	Donald reached after Rachel.
entailment	Jay reached office at 3:30 PM whereas Julie reached at 1 PM.	Jay reached after Julie.
entailment	Kevin reached hotel at 6:30 AM whereas Michael reached at 6 AM.	Kevin reached after Michael.
entailment	Annie reached theatre at 12:30 PM whereas Jill reached at 12 noon.	Annie reached after Jill.
entailment	Ann reached park at 12 noon whereas Roy reached at 7:30 AM.	Ann reached after Roy.
entailment	Nicole reached museum at 5:30 PM whereas Anna reached at 6:30 AM.	Nicole reached after Anna.
entailment	Peter reached theatre at 10 AM whereas Patrick reached at 6:30 AM.	Peter reached after Patrick.
entailment	George reached hotel at 4 PM whereas Judith reached at 2 PM.	George reached after Judith.
entailment	Greg reached hospital at 12 noon whereas Fiona reached at 8:30 AM.	Greg reached after Fiona.
entailment	Frances reached office at 9 AM whereas Carol reached at 6:30 AM.	Frances reached after Carol.
entailment	Tom reached office at 8:30 AM whereas Daniel reached at 6:30 AM.	Tom reached after Daniel.
entailment	Sandra reached park at 1:30 PM whereas Simon reached at 10:30 AM.	Sandra reached after Simon.
entailment	Helen reached park at 12:30 PM whereas Pamela reached at 12 noon.	Helen reached after Pamela.
entailment	Sally reached hotel at 6 PM whereas Arthur reached at 11 AM.	Sally reached after Arthur.
entailment	Wendy reached school at 1 PM whereas William reached at 6:30 AM.	Wendy reached after William.
entailment	Bobby reached theatre at 11 AM whereas Billy reached at 9 AM.	Bobby reached after Billy.
entailment	Maria reached museum at 5:30 PM whereas Roger reached at 7 AM.	Maria reached after Roger.
entailment	Sandra reached office at 12 noon whereas Judy reached at 6 AM.	Sandra reached after Judy.
entailment	Johnny reached theatre at 3 PM whereas Brian reached at 6:30 AM.	Johnny reached after Brian.
entailment	Lucy reached theatre at 3:30 PM whereas Joseph reached at 2:30 PM.	Lucy reached after Joseph.
entailment	Elaine reached hospital at 10 AM whereas Nicole reached at 9 AM.	Elaine reached after Nicole.
entailment	Andrea reached theatre at 11:30 AM whereas Rebecca reached at 6:30 AM.	Andrea reached after Rebecca.
entailment	Lawrence reached hotel at 4:30 PM whereas Stephen reached at 10 AM.	Lawrence reached after Stephen.
entailment	Bill reached theatre at 1:30 PM whereas Walter reached at 8:30 AM.	Bill reached after Walter.
entailment	Martin reached school at 1:30 PM whereas Sue reached at 11 AM.	Martin reached after Sue.
entailment	Henry reached theatre at 9 AM whereas Harriet reached at 7:30 AM.	Henry reached after Harriet.
entailment	Steven reached theatre at 6 PM whereas Louise reached at 10 AM.	Steven reached after Louise.
entailment	Daniel reached hospital at 12 noon whereas Marie reached at 8:30 AM.	Daniel reached after Marie.
entailment	Barbara reached theatre at 5:30 PM whereas Rebecca reached at 4 PM.	Barbara reached after Rebecca.
entailment	Jim reached park at 6:30 AM whereas Michael reached at 6 AM.	Jim reached after Michael.
entailment	Charlotte reached park at 4:30 PM whereas Jonathan reached at 10:30 AM.	Charlotte reached after Jonathan.
entailment	Alexandra reached museum at 3 PM whereas Amanda reached at 12 noon.	Alexandra reached after Amanda.
entailment	Ian reached office at 8:30 AM whereas Annie reached at 8 AM.	Ian reached after Annie.
entailment	Christopher reached hospital at 8:30 AM whereas Dick reached at 8 AM.	Christopher reached after Dick.
entailment	Marie reached museum at 8:30 AM whereas Adam reached at 7 AM.	Marie reached after Adam.
entailment	Edith reached park at 7:30 AM whereas Dan reached at 7 AM.	Edith reached after Dan.
entailment	Steven reached hotel at 8:30 AM whereas Carl reached at 8 AM.	Steven reached after Carl.
entailment	Alan reached hotel at 2:30 PM whereas Diane reached at 7 AM.	Alan reached after Diane.
entailment	Rebecca reached hotel at 1 PM whereas Rachel reached at 7 AM.	Rebecca reached after Rachel.
entailment	Ian reached hotel at 6 PM whereas Stephen reached at 7 AM.	Ian reached after Stephen.
entailment	Anthony reached office at 7 AM whereas Kenneth reached at 6 AM.	Anthony reached after Kenneth.
entailment	Michael reached hotel at 4 PM whereas Samuel reached at 7 AM.	Michael reached after Samuel.
entailment	Tony reached hotel at 3:30 PM whereas Walter reached at 9:30 AM.	Tony reached after Walter.
entailment	Bobby reached museum at 6:30 AM whereas Martin reached at 6 AM.	Bobby reached after Martin.
entailment	Eleanor reached park at 6:30 AM whereas Linda reached at 6 AM.	Eleanor reached after Linda.
entailment	Carolyn reached school at 9 AM whereas George reached at 6:30 AM.	Carolyn reached after George.
entailment	Don reached museum at 5 PM whereas Elizabeth reached at 6 AM.	Don reached after Elizabeth.
entailment	Judith reached office at 4:30 PM whereas Carol reached at 6 AM.	Judith reached after Carol.
entailment	Jay reached school at 9 AM whereas Annie reached at 7 AM.	Jay reached after Annie.
entailment	Diane reached school at 2 PM whereas Sally reached at 1 PM.	Diane reached after Sally.
entailment	Jay reached school at 1:30 PM whereas James reached at 11 AM.	Jay reached after James.
entailment	Tim reached museum at 2 PM whereas Rachel reached at 12:30 PM.	Tim reached after Rachel.
entailment	Alexander reached hospital at 1:30 PM whereas Charlie reached at 10:30 AM.	Alexander reached after Charlie.
entailment	Johnny reached office at 8:30 AM whereas Katie reached at 7:30 AM.	Johnny reached after Katie.
entailment	Patricia reached hotel at 9 AM whereas Lawrence reached at 7:30 AM.	Patricia reached after Lawrence.
entailment	Karen reached museum at 11:30 AM whereas Samuel reached at 6 AM.	Karen reached after Samuel.
entailment	Ralph reached theatre at 7 AM whereas Ryan reached at 6 AM.	Ralph reached after Ryan.
entailment	Kim reached hotel at 4:30 PM whereas Frederick reached at 8 AM.	Kim reached after Frederick.
entailment	David reached hospital at 6:30 AM whereas Joan reached at 6 AM.	David reached after Joan.
entailment	Christopher reached park at 5:30 PM whereas Simon reached at 2 PM.	Christopher reached after Simon.
entailment	Gary reached park at 8 AM whereas Edith reached at 7 AM.	Gary reached after Edith.
entailment	Margaret reached school at 9:30 AM whereas Lynn reached at 7:30 AM.	Margaret reached after Lynn.
entailment	Kathy reached park at 11 AM whereas George reached at 10:30 AM.	Kathy reached after George.
entailment	Brian reached park at 12:30 PM whereas Tim reached at 10 AM.	Brian reached after Tim.
entailment	Harriet reached school at 6:30 AM whereas Daniel reached at 6 AM.	Harriet reached after Daniel.
entailment	Samuel reached theatre at 3 PM whereas Ken reached at 11 AM.	Samuel reached after Ken.
entailment	Julia reached hospital at 12:30 PM whereas Dorothy reached at 9:30 AM.	Julia reached after Dorothy.
entailment	Laura reached office at 4:30 PM whereas Heather reached at 11:30 AM.	Laura reached after Heather.
entailment	Judith reached school at 12 noon whereas Tony reached at 6:30 AM.	Judith reached after Tony.
entailment	Alice reached office at 3:30 PM whereas Richard reached at 8:30 AM.	Alice reached after Richard.
entailment	Sandra reached theatre at 9 AM whereas Tom reached at 6 AM.	Sandra reached after Tom.
entailment	Rachel reached office at 4 PM whereas Judith reached at 9:30 AM.	Rachel reached after Judith.
entailment	Ian reached hotel at 9:30 AM whereas Scott reached at 6 AM.	Ian reached after Scott.
entailment	Annie reached theatre at 3 PM whereas Dorothy reached at 1 PM.	Annie reached after Dorothy.
entailment	Karen reached theatre at 9:30 AM whereas Jean reached at 9 AM.	Karen reached after Jean.
entailment	Sophie reached school at 7:30 AM whereas Bobby reached at 7 AM.	Sophie reached after Bobby.
entailment	Jane reached park at 2 PM whereas Jean reached at 6:30 AM.	Jane reached after Jean.
entailment	Daniel reached hospital at 7 AM whereas Frances reached at 6 AM.	Daniel reached after Frances.
entailment	Philip reached hospital at 5:30 PM whereas Johnny reached at 7:30 AM.	Philip reached after Johnny.
entailment	Sharon reached hospital at 4:30 PM whereas Sam reached at 9:30 AM.	Sharon reached after Sam.
entailment	Julie reached park at 6 PM whereas Alfred reached at 5 PM.	Julie reached after Alfred.
entailment	Catherine reached museum at 4:30 PM whereas Jay reached at 3 PM.	Catherine reached after Jay.
entailment	Claire reached museum at 10:30 AM whereas Sophie reached at 6 AM.	Claire reached after Sophie.
entailment	Greg reached park at 2 PM whereas Andrew reached at 7 AM.	Greg reached after Andrew.
entailment	Emma reached park at 5:30 PM whereas Jessica reached at 10 AM.	Emma reached after Jessica.
entailment	Colin reached park at 6:30 AM whereas Nancy reached at 6 AM.	Colin reached after Nancy.
entailment	Carol reached theatre at 11 AM whereas Ed reached at 6 AM.	Carol reached after Ed.
entailment	Judith reached school at 9 AM whereas Betty reached at 6 AM.	Judith reached after Betty.
entailment	Jessica reached museum at 6 PM whereas Ian reached at 1:30 PM.	Jessica reached after Ian.
entailment	Florence reached hospital at 5:30 PM whereas Steve reached at 8:30 AM.	Florence reached after Steve.
entailment	Charlotte reached museum at 10 AM whereas Ruth reached at 7 AM.	Charlotte reached after Ruth.
entailment	Barbara reached office at 1:30 PM whereas Kathleen reached at 7:30 AM.	Barbara reached after Kathleen.
entailment	Jennifer reached museum at 11:30 AM whereas Howard reached at 9 AM.	Jennifer reached after Howard.
entailment	Colin reached school at 8:30 AM whereas Don reached at 7:30 AM.	Colin reached after Don.
entailment	Kathleen reached park at 7:30 AM whereas Frances reached at 7 AM.	Kathleen reached after Frances.
entailment	Mary reached office at 6 PM whereas Harriet reached at 12:30 PM.	Mary reached after Harriet.
entailment	Fiona reached park at 7:30 AM whereas Catherine reached at 7 AM.	Fiona reached after Catherine.
entailment	Mike reached theatre at 4 PM whereas James reached at 6 AM.	Mike reached after James.
entailment	Hugh reached school at 4:30 PM whereas Sally reached at 10 AM.	Hugh reached after Sally.
