entailment	Sandra reached hospital at 2:30 PM whereas Judy reached at 10:30 AM.	Sandra reached after Judy.
entailment	Samuel reached hotel at 5:30 PM whereas Frederick reached at 8 AM.	Samuel reached after Frederick.
entailment	Patrick reached hospital at 5:30 PM whereas Sharon reached at 3:30 PM.	Patrick reached after Sharon.
entailment	Paul reached school at 3:30 PM whereas Stephen reached at 10 AM.	Paul reached after Stephen.
entailment	Tom reached office at 1 PM whereas Jennifer reached at 6 AM.	Tom reached after Jennifer.
entailment	Sara reached office at 3:30 PM whereas Tom reached at 8:30 AM.	Sara reached after Tom.
entailment	Marie reached school at 11:30 AM whereas Larry reached at 6 AM.	Marie reached after Larry.
entailment	Angela reached school at 11 AM whereas Anthony reached at 7 AM.	Angela reached after Anthony.
entailment	Colin reached office at 5 PM whereas Sue reached at 6:30 AM.	Colin reached after Sue.
entailment	Larry reached hotel at 9:30 AM whereas Christine reached at 9 AM.	Larry reached after Christine.
entailment	Elaine reached theatre at 11:30 AM whereas Alexandra reached at 7 AM.	Elaine reached after Alexandra.
entailment	Kim reached office at 10 AM whereas Chris reached at 6 AM.	Kim reached after Chris.
entailment	Ben reached park at 11:30 AM whereas Janet reached at 9:30 AM.	Ben reached after Janet.
entailment	Donna reached park at 7 AM whereas Steve reached at 6 AM.	Donna reached after Steve.
entailment	Frank reached theatre at 2 PM whereas Deborah reached at 7:30 AM.	Frank reached after Deborah.
entailment	Victoria reached hospital at 7:30 AM whereas Ron reached at 7 AM.	Victoria reached after Ron.
entailment	Edward reached hospital at 5:30 PM whereas Patrick reached at 6 AM.	Edward reached after Patrick.
entailment	Bobby reached hotel at 2:30 PM whereas Janet reached at 6 AM.	Bobby reached after Janet.
entailment	Sharon reached museum at 9 AM whereas Florence reached at 6 AM.	Sharon reached after Florence.
entailment	Joseph reached school at 5:30 PM whereas Kathryn reached at 1:30 PM.	Joseph reached after Kathryn.
entailment	Deborah reached theatre at 10 AM whereas Katherine reached at 7:30 AM.	Deborah reached after Katherine.
entailment	Emily reached park at 5 PM whereas Diana reached at 10 AM.	Emily reached after Diana.
entailment	Frank reached office at 6:30 AM whereas Catherine reached at 6 AM.	Frank reached after Catherine.
entailment	Pamela reached school at 9 AM whereas Matthew reached at 6:30 AM.	Pamela reached after Matthew.
entailment	Angela reached theatre at 6:30 AM whereas Kathleen reached at 6 AM.	Angela reached after Kathleen.
entailment	Catherine reached museum at 4:30 PM whereas Andrew reached at 10 AM.	Catherine reached after Andrew.
entailment	Ryan reached hospital at 4:30 PM whereas Samuel reached at 6:30 AM.	Ryan reached after Samuel.
entailment	Amanda reached hospital at 10:30 AM whereas Diana reached at 9 AM.	Amanda reached after Diana.
entailment	Alan reached park at 11 AM whereas Scott reached at 7 AM.	Alan reached after Scott.
entailment	Harry reached office at 11 AM whereas Al reached at 8:30 AM.	Harry reached after Al.
entailment	Richard reached hotel at 11 AM whereas Judith reached at 6 AM.	Richard reached after Judith.
entailment	Marie reached museum at 3:30 PM whereas Benjamin reached at 10:30 AM.	Marie reached after Benjamin.
entailment	Alexandra reached hospital at 5 PM whereas Angela reached at 1 PM.	Alexandra reached after Angela.
entailment	Anne reached theatre at 2:30 PM whereas Martin reached at 11:30 AM.	Anne reached after Martin.
entailment	Ron reached park at 9:30 AM whereas Alex reached at 8:30 AM.	Ron reached after Alex.
entailment	Carolyn reached hotel at 10:30 AM whereas Janet reached at 9 AM.	Carolyn reached after Janet.
entailment	Paul reached museum at 7:30 AM whereas Karen reached at 7 AM.	Paul reached after Karen.
entailment	Catherine reached museum at 10 AM whereas Ruth reached at 9 AM.	Catherine reached after Ruth.
entailment	Jeff reached school at 2:30 PM whereas Stephanie reached at 12 noon.	Jeff reached after Stephanie.
entailment	Ruth reached theatre at 11 AM whereas Larry reached at 6:30 AM.	Ruth reached after Larry.
entailment	Fred reached office at 2 PM whereas Bruce reached at 7 AM.	Fred reached after Bruce.
entailment	Louise reached museum at 3:30 PM whereas John reached at 8:30 AM.	Louise reached after John.
entailment	Amanda reached hospital at 5 PM whereas Karen reached at 7:30 AM.	Amanda reached after Karen.
entailment	Ron reached hospital at 4:30 PM whereas Suzanne reached at 10 AM.	Ron reached after Suzanne.
entailment	Colin reached theatre at 3:30 PM whereas Roger reached at 1:30 PM.	Colin reached after Roger.
entailment	Sara reached museum at 8:30 AM whereas Samuel reached at 6 AM.	Sara reached after Samuel.
entailment	Donald reached museum at 3 PM whereas Nick reached at 9 AM.	Donald reached after Nick.
entailment	Susan reached hospital at 5 PM whereas Jerry reached at 12 noon.	Susan reached after Jerry.
entailment	Albert reached theatre at 4:30 PM whereas Laura reached at 3:30 PM.	Albert reached after Laura.
entailment	Philip reached theatre at 4 PM whereas Claire reached at 6:30 AM.	Philip reached after Claire.
entailment	Christopher reached museum at 8 AM whereas Al reached at 6 AM.	Christopher reached after Al.
entailment	Jack reached hotel at 1:30 PM whereas Samuel reached at 10:30 AM.	Jack reached after Samuel.
entailment	Steve reached hospital at 6 PM whereas Helen reached at 2 PM.	Steve reached after Helen.
entailment	Frances reached park at 10:30 AM whereas Florence reached at 8 AM.	Frances reached after Florence.
entailment	Tim reached school at 6:30 AM whereas Claire reached at 6 AM.	Tim reached after Claire.
entailment	Alison reached school at 5 PM whereas Joseph reached at 3:30 PM.	Alison reached after Joseph.
entailment	Edward reached school at 10 AM whereas Janet reached at 6:30 AM.	Edward reached after Janet.
entailment	Julia reached museum at 10:30 AM whereas Benjamin reached at 9:30 AM.	Julia reached after Benjamin.
entailment	Kim reached school at 1:30 PM whereas Rebecca reached at 10 AM.	Kim reached after Rebecca.
entailment	Kathryn reached park at 3 PM whereas Alexandra reached at 11:30 AM.	Kathryn reached after Alexandra.
entailment	Edwin reached park at 1 PM whereas Jack reached at 8:30 AM.	Edwin reached after Jack.
entailment	Jay reached park at 9 AM whereas Alice reached at 8 AM.	Jay reached after Alice.
entailment	Louis reached hospital at 4 PM whereas Larry reached at 6 AM.	Louis reached after Larry.
entailment	Rebecca reached hotel at 10:30 AM whereas Linda reached at 9 AM.	Rebecca reached after Linda.
entailment	George reached park at 12:30 PM whereas Jack reached at 12 noon.	George reached after Jack.
entailment	Diane reached park at 7:30 AM whereas Wendy reached at 6 AM.	Diane reached after Wendy.
entailment	Simon reached theatre at 4 PM whereas Fiona reached at 2 PM.	Simon reached after Fiona.
entailment	Tom reached theatre at 1 PM whereas Ron reached at 12 noon.	Tom reached after Ron.
entailment	Scott reached theatre at 12:30 PM whereas Larry reached at 7 AM.	Scott reached after Larry.
entailment	Joan reached hotel at 5:30 PM whereas Ellen reached at 11 AM.	Joan reached after Ellen.
entailment	Sarah reached school at 4:30 PM whereas Jerry reached at 3:30 PM.	Sarah reached after Jerry.
entailment	Alexander reached hospital at 8 AM whereas Linda reached at 6:30 AM.	Alexander reached after Linda.
entailment	Betty reached park at 3 PM whereas Michael reached at 8 AM.	Betty reached after Michael.
entailment	Louis reached hospital at 11 AM whereas Victoria reached at 6 AM.	Louis reached after Victoria.
entailment	Tony reached office at 7 AM whereas Frances reached at 6:30 AM.	Tony reached after Frances.
entailment	Kenneth reached park at 9 AM whereas Walter reached at 7:30 AM.	Kenneth reached after Walter.
entailment	Alfred reached hospital at 1:30 PM whereas Samuel reached at 6:30 AM.	Alfred reached after Samuel.
entailment	Katie reached theatre at 1 PM whereas Judy reached at 11 AM.	Katie reached after Judy.
entailment	Nicole reached school at 3 PM whereas Greg reached at 2 PM.	Nicole reached after Greg.
entailment	Sally reached hospital at 10 AM whereas Lawrence reached at 6:30 AM.	Sally reached after Lawrence.
entailment	Mike reached park at 6:30 AM whereas Roy reached at 6 AM.	Mike reached after Roy.
entailment	Lynn reached hospital at 12:30 PM whereas Marilyn reached at 8 AM.	Lynn reached after Marilyn.
entailment	Eleanor reached hotel at 4:30 PM whereas Eric reached at 11 AM.	Eleanor reached after Eric.
entailment	Edward reached school at 4:30 PM whereas Charles reached at 1 PM.	Edward reached after Charles.
entailment	Joe reached theatre at 11:30 AM whereas Eleanor reached at 6 AM.	Joe reached after Eleanor.
entailment	Christopher reached museum at 6:30 AM whereas Samuel reached at 6 AM.	Christopher reached after Samuel.
entailment	Louise reached park at 6:30 AM whereas Dorothy reached at 6 AM.	Louise reached after Dorothy.
entailment	Lawrence reached museum at 9 AM whereas Diana reached at 7 AM.	Lawrence reached after Diana.
entailment	Jonathan reached school at 3:30 PM whereas Tony reached at 6 AM.	Jonathan reached after Tony.
entailment	Peter reached hotel at 11 AM whereas Alfred reached at 7 AM.	Peter reached after Alfred.
entailment	Sophie reached park at 6:30 AM whereas Bill reached at 6 AM.	Sophie reached after Bill.
entailment	Susan reached hospital at 7 AM whereas Joe reached at 6 AM.	Susan reached after Joe.
entailment	Hugh reached hospital at 5 PM whereas Kathy reached at 11:30 AM.	Hugh reached after Kathy.
entailment	Kim reached hotel at 11:30 AM whereas Christine reached at 9 AM.	Kim reached after Christine.
entailment	Michael reached hotel at 5:30 PM whereas William reached at 6:30 AM.	Michael reached after William.
entailment	Tim reached office at 6 PM whereas Sue reached at 2 PM.	Tim reached after Sue.
entailment	Claire reached school at 7 AM whereas Anthony reached at 6:30 AM.	Claire reached after Anthony.
entailment	Fiona reached park at 6:30 AM whereas Keith reached at 6 AM.	Fiona reached after Keith.
entailment	Richard reached park at 12:30 PM whereas Scott reached at 6:30 AM.	Richard reached after Scott.
entailment	Janet reached hospital at 3 PM whereas Ann reached at 12:30 PM.	Janet reached after Ann.
entailment	Jason reached office at 3 PM whereas Roy reached at 6:30 AM.	Jason reached after Roy.
entailment	Charlie reached hotel at 4 PM whereas Leslie reached at 6:30 AM.	Charlie reached after Leslie.
entailment	Henry reached hospital at 5 PM whereas Wendy reached at 3 PM.	Henry reached after Wendy.
entailment	Evelyn reached park at 6 PM whereas Dave reached at 11:30 AM.	Evelyn reached after Dave.
entailment	Hugh reached theatre at 11:30 AM whereas Ed reached at 9 AM.	Hugh reached after Ed.
entailment	Andrew reached office at 2:30 PM whereas Ellen reached at 12 noon.	Andrew reached after Ellen.
entailment	Billy reached hotel at 7:30 AM whereas Daniel reached at 6 AM.	Billy reached after Daniel.
entailment	Harold reached theatre at 11:30 AM whereas Marie reached at 11 AM.	Harold reached after Marie.
entailment	Victoria reached park at 3:30 PM whereas Bob reached at 12:30 PM.	Victoria reached after Bob.
entailment	Patrick reached hospital at 9:30 AM whereas Bobby reached at 6:30 AM.	Patrick reached after Bobby.
entailment	Kathryn reached office at 10 AM whereas Alexander reached at 7 AM.	Kathryn reached after Alexander.
entailment	Harriet reached school at 9:30 AM whereas Kelly reached at 8 AM.	Harriet reached after Kelly.
entailment	Roger reached hotel at 2 PM whereas Laura reached at 7 AM.	Roger reached after Laura.
entailment	Matt reached hospital at 3:30 PM whereas Jerry reached at 3 PM.	Matt reached after Jerry.
entailment	Stephen reached museum at 3:30 PM whereas Diana reached at 2:30 PM.	Stephen reached after Diana.
entailment	Grace reached school at 2 PM whereas Charlie reached at 6 AM.	Grace reached after Charlie.
entailment	Susan reached hospital at 5:30 PM whereas Carolyn reached at 4:30 PM.	Susan reached after Carolyn.
entailment	Charlotte reached theatre at 8 AM whereas Ron reached at 7 AM.	Charlotte reached after Ron.
entailment	Ken reached hotel at 1 PM whereas Betty reached at 9 AM.	Ken reached after Betty.
entailment	Ellen reached park at 9 AM whereas Victoria reached at 8 AM.	Ellen reached after Victoria.
entailment	Elizabeth reached park at 6 PM whereas Benjamin reached at 2:30 PM.	Elizabeth reached after Benjamin.
entailment	Catherine reached office at 1:30 PM whereas Judith reached at 6:30 AM.	Catherine reached after Judith.
entailment	Linda reached office at 8:30 AM whereas Fred reached at 6 AM.	Linda reached after Fred.
entailment	Laura reached office at 11:30 AM whereas Joe reached at 6:30 AM.	Laura reached after Joe.
entailment	Elaine reached museum at 1:30 PM whereas Julie reached at 10 AM.	Elaine reached after Julie.
entailment	Ralph reached office at 8 AM whereas Lucy reached at 6 AM.	Ralph reached after Lucy.
entailment	Ralph reached hotel at 9 AM whereas Evelyn reached at 7 AM.	Ralph reached after Evelyn.
entailment	Matt reached hotel at 6:30 AM whereas Charlie reached at 6 AM.	Matt reached after Charlie.
entailment	Pamela reached theatre at 7:30 AM whereas Chris reached at 6:30 AM.	Pamela reached after Chris.
entailment	Ed reached museum at 9 AM whereas Frances reached at 6 AM.	Ed reached after Frances.
entailment	Evelyn reached museum at 8:30 AM whereas James reached at 8 AM.	Evelyn reached after James.
entailment	Anne reached museum at 11:30 AM whereas Matt reached at 10 AM.	Anne reached after Matt.
entailment	Frank reached park at 3 PM whereas Robert reached at 2:30 PM.	Frank reached after Robert.
entailment	Fiona reached theatre at 3 PM whereas Alexander reached at 10:30 AM.	Fiona reached after Alexander.
entailment	Kate reached hotel at 8:30 AM whereas Dave reached at 6:30 AM.	Kate reached after Dave.
entailment	Grace reached museum at 2:30 PM whereas Stephanie reached at 7 AM.	Grace reached after Stephanie.
entailment	Rachel reached theatre at 10:30 AM whereas Tim reached at 6:30 AM.	Rachel reached after Tim.
entailment	Adam reached office at 7 AM whereas Dorothy reached at 6:30 AM.	Adam reached after Dorothy.
entailment	Rebecca reached hospital at 11 AM whereas Matthew reached at 6 AM.	Rebecca reached after Matthew.
entailment	Margaret reached office at 9 AM whereas Larry reached at 8:30 AM.	Margaret reached after Larry.
entailment	Frank reached park at 9 AM whereas Gary reached at 8 AM.	Frank reached after Gary.
entailment	Christopher reached theatre at 3:30 PM whereas Mike reached at 7:30 AM.	Christopher reached after Mike.
entailment	Albert reached hospital at 2:30 PM whereas Ed reached at 12 noon.	Albert reached after Ed.
entailment	Billy reached hotel at 5:30 PM whereas Fred reached at 5 PM.	Billy reached after Fred.
entailment	Louis reached museum at 3:30 PM whereas Billy reached at 11:30 AM.	Louis reached after Billy.
entailment	Sue reached hotel at 1:30 PM whereas Louise reached at 9 AM.	Sue reached after Louise.
entailment	Anna reached office at 4 PM whereas Sue reached at 3:30 PM.	Anna reached after Sue.
entailment	Jonathan reached school at 6:30 AM whereas Harry reached at 6 AM.	Jonathan reached after Harry.
entailment	Mark reached office at 6 PM whereas Betty reached at 11 AM.	Mark reached after Betty.
entailment	Charles reached museum at 7 AM whereas Claire reached at 6:30 AM.	Charles reached after Claire.
entailment	Helen reached hospital at 11 AM whereas Bob reached at 10 AM.	Helen reached after Bob.
entailment	Katie reached hotel at 1:30 PM whereas Annie reached at 11:30 AM.	Katie reached after Annie.
entailment	Patrick reached museum at 6:30 AM whereas Amanda reached at 6 AM.	Patrick reached after Amanda.
entailment	Stephanie reached school at 3 PM whereas Tim reached at 12:30 PM.	Stephanie reached after Tim.
entailment	Laura reached park at 6 PM whereas Peter reached at 9 AM.	Laura reached after Peter.
entailment	Edith reached park at 9:30 AM whereas Nick reached at 9 AM.	Edith reached after Nick.
entailment	Dan reached park at 4 PM whereas Ryan reached at 12:30 PM.	Dan reached after Ryan.
entailment	Sara reached office at 12 noon whereas Kevin reached at 7 AM.	Sara reached after Kevin.
entailment	Joan reached theatre at 4:30 PM whereas Pamela reached at 9:30 AM.	Joan reached after Pamela.
entailment	Rebecca reached museum at 6 PM whereas Tim reached at 10 AM.	Rebecca reached after Tim.
entailment	Fred reached hotel at 7:30 AM whereas Wendy reached at 6:30 AM.	Fred reached after Wendy.
entailment	Maria reached theatre at 6:30 AM whereas Harold reached at 6 AM.	Maria reached after Harold.
entailment	Frances reached school at 5 PM whereas Grace reached at 10 AM.	Frances reached after Grace.
entailment	Francis reached school at 12:30 PM whereas Daniel reached at 6 AM.	Francis reached after Daniel.
entailment	Joseph reached theatre at 4:30 PM whereas Frank reached at 2 PM.	Joseph reached after Frank.
entailment	Lauren reached park at 2 PM whereas Leslie reached at 1 PM.	Lauren reached after Leslie.
entailment	Patricia reached hotel at 5:30 PM whereas Dick reached at 8 AM.	Patricia reached after Dick.
entailment	Angela reached office at 8:30 AM whereas Adam reached at 6 AM.	Angela reached after Adam.
entailment	Louise reached museum at 6 PM whereas Ken reached at 4 PM.	Louise reached after Ken.
entailment	Al reached office at 6 PM whereas Evelyn reached at 3 PM.	Al reached after Evelyn.
entailment	Laura reached office at 3:30 PM whereas Ed reached at 2:30 PM.	Laura reached after Ed.
entailment	Susan reached school at 6 PM whereas Dorothy reached at 9:30 AM.	Susan reached after Dorothy.
entailment	Edward reached park at 2:30 PM whereas Diana reached at 1:30 PM.	Edward reached after Diana.
entailment	Diane reached office at 9 AM whereas Frances reached at 6:30 AM.	Diane reached after Frances.
entailment	Leslie reached park at 10 AM whereas Kathleen reached at 6:30 AM.	Leslie reached after Kathleen.
entailment	Fiona reached office at 11 AM whereas Michael reached at 9 AM.	Fiona reached after Michael.
entailment	Ellen reached museum at 4:30 PM whereas Adam reached at 8:30 AM.	Ellen reached after Adam.
entailment	Edwin reached office at 7 AM whereas Elizabeth reached at 6 AM.	Edwin reached after Elizabeth.
entailment	David reached museum at 10 AM whereas Albert reached at 9 AM.	David reached after Albert.
entailment	Anna reached theatre at 6:30 AM whereas Lauren reached at 6 AM.	Anna reached after Lauren.
entailment	Donna reached museum at 10 AM whereas Ashley reached at 9 AM.	Donna reached after Ashley.
entailment	Kathryn reached park at 8:30 AM whereas Angela reached at 6 AM.	Kathryn reached after Angela.
entailment	Francis reached office at 12:30 PM whereas Sandra reached at 8:30 AM.	Francis reached after Sandra.
entailment	Donna reached park at 5 PM whereas Dave reached at 10 AM.	Donna reached after Dave.
entailment	Rachel reached park at 8 AM whereas Carol reached at 7:30 AM.	Rachel reached after Carol.
entailment	Stephanie reached hotel at 5 PM whereas Diane reached at 6 AM.	Stephanie reached after Diane.
entailment	Ellen reached hotel at 4:30 PM whereas Kelly reached at 2:30 PM.	Ellen reached after Kelly.
entailment	Simon reached hotel at 12:30 PM whereas Mike reached at 7:30 AM.	Simon reached after Mike.
entailment	Eleanor reached museum at 7:30 AM whereas Sam reached at 7 AM.	Eleanor reached after Sam.
entailment	Charles reached hotel at 9 AM whereas Steven reached at 7:30 AM.	Charles reached after Steven.
entailment	Louise reached hotel at 11:30 AM whereas Alexander reached at 6 AM.	Louise reached after Alexander.
entailment	Jerry reached theatre at 12 noon whereas Ruth reached at 9:30 AM.	Jerry reached after Ruth.
entailment	William reached office at 5:30 PM whereas Sandra reached at 6:30 AM.	William reached after Sandra.
entailment	Robert reached hospital at 7 AM whereas Roy reached at 6:30 AM.	Robert reached after Roy.
entailment	Ken reached hotel at 5:30 PM whereas Mike reached at 2:30 PM.	Ken reached after Mike.
entailment	Jerry reached office at 11 AM whereas Amy reached at 9:30 AM.	Jerry reached after Amy.
entailment	Edith reached office at 9 AM whereas George reached at 6 AM.	Edith reached after George.
entailment	Margaret reached office at 11 AM whereas Alex reached at 8:30 AM.	Margaret reached after Alex.
entailment	Margaret reached park at 10:30 AM whereas Amanda reached at 8 AM.	Margaret reached after Amanda.
entailment	Thomas reached theatre at 9 AM whereas Harriet reached at 6 AM.	Thomas reached after Harriet.
entailment	Diana reached park at 9:30 AM whereas Amanda reached at 6:30 AM.	Diana reached after Amanda.
entailment	Howard reached hotel at 2:30 PM whereas Dan reached at 8 AM.	Howard reached after Dan.
entailment	Alexander reached school at 2 PM whereas Benjamin reached at 10 AM.	Alexander reached after Benjamin.
entailment	Alfred reached office at 2:30 PM whereas Philip reached at 11:30 AM.	Alfred reached after Philip.
entailment	Billy reached hospital at 11:30 AM whereas Charlotte reached at 6:30 AM.	Billy reached after Charlotte.
entailment	Heather reached school at 1 PM whereas Barbara reached at 12 noon.	Heather reached after Barbara.
entailment	Stephen reached hotel at 2 PM whereas Robin reached at 9:30 AM.	Stephen reached after Robin.
entailment	Michael reached hospital at 1:30 PM whereas Jennifer reached at 12:30 PM.	Michael reached after Jennifer.
entailment	Matthew reached office at 5 PM whereas Fred reached at 12:30 PM.	Matthew reached after Fred.
entailment	Mark reached theatre at 2 PM whereas Sue reached at 10:30 AM.	Mark reached after Sue.
entailment	Dorothy reached theatre at 2 PM whereas Greg reached at 11 AM.	Dorothy reached after Greg.
entailment	Christopher reached museum at 7:30 AM whereas Alison reached at 6:30 AM.	Christopher reached after Alison.
entailment	Grace reached museum at 11 AM whereas Alan reached at 10 AM.	Grace reached after Alan.
entailment	Jason reached theatre at 2:30 PM whereas Patricia reached at 2 PM.	Jason reached after Patricia.
entailment	Ann reached office at 1:30 PM whereas Linda reached at 12:30 PM.	Ann reached after Linda.
entailment	Frank reached hospital at 7 AM whereas Emily reached at 6:30 AM.	Frank reached after Emily.
entailment	Daniel reached school at 5:30 PM whereas Bobby reached at 6:30 AM.	Daniel reached after Bobby.
entailment	Brian reached school at 5 PM whereas Arthur reached at 6:30 AM.	Brian reached after Arthur.
entailment	Carolyn reached theatre at 1:30 PM whereas Ryan reached at 10:30 AM.	Carolyn reached after Ryan.
entailment	Dan reached hospital at 8 AM whereas Laura reached at 7 AM.	Dan reached after Laura.
entailment	Caroline reached office at 9 AM whereas Frederick reached at 7:30 AM.	Caroline reached after Frederick.
entailment	Marilyn reached museum at 11:30 AM whereas Sally reached at 9:30 AM.	Marilyn reached after Sally.
entailment	Ellen reached office at 12:30 PM whereas Billy reached at 10 AM.	Ellen reached after Billy.
entailment	Margaret reached office at 12:30 PM whereas Mark reached at 11 AM.	Margaret reached after Mark.
entailment	Julie reached museum at 11:30 AM whereas Tom reached at 9:30 AM.	Julie reached after Tom.
entailment	Larry reached theatre at 2 PM whereas Steven reached at 1:30 PM.	Larry reached after Steven.
entailment	Marilyn reached park at 5 PM whereas John reached at 12:30 PM.	Marilyn reached after John.
entailment	Michelle reached hotel at 3:30 PM whereas Dorothy reached at 11 AM.	Michelle reached after Dorothy.
entailment	Lisa reached museum at 5 PM whereas Elaine reached at 4 PM.	Lisa reached after Elaine.
entailment	Sally reached museum at 2:30 PM whereas Linda reached at 9:30 AM.	Sally reached after Linda.
entailment	Donna reached theatre at 8 AM whereas Christopher reached at 7:30 AM.	Donna reached after Christopher.
entailment	Dorothy reached hospital at 1 PM whereas Lynn reached at 9:30 AM.	Dorothy reached after Lynn.
entailment	Francis reached park at 10 AM whereas Barbara reached at 9 AM.	Francis reached after Barbara.
entailment	Carolyn reached park at 7:30 AM whereas Alfred reached at 6:30 AM.	Carolyn reached after Alfred.
entailment	Claire reached museum at 3:30 PM whereas Michael reached at 6 AM.	Claire reached after Michael.
entailment	Charles reached park at 3:30 PM whereas Kenneth reached at 10:30 AM.	Charles reached after Kenneth.
entailment	Rose reached hotel at 4:30 PM whereas Alfred reached at 9:30 AM.	Rose reached after Alfred.
entailment	Steven reached office at 6 PM whereas Ellen reached at 4:30 PM.	Steven reached after Ellen.
entailment	Bill reached office at 7 AM whereas Charlotte reached at 6:30 AM.	Bill reached after Charlotte.
entailment	Jane reached museum at 8:30 AM whereas Evelyn reached at 6:30 AM.	Jane reached after Evelyn.
entailment	Donald reached hotel at 2:30 PM whereas Leslie reached at 11:30 AM.	Donald reached after Leslie.
entailment	Jane reached museum at 12:30 PM whereas Rachel reached at 10:30 AM.	Jane reached after Rachel.
entailment	Sophie reached school at 12 noon whereas Robert reached at 8 AM.	Sophie reached after Robert.
entailment	Greg reached hotel at 9:30 AM whereas Ann reached at 8:30 AM.	Greg reached after Ann.
entailment	Melissa reached museum at 10 AM whereas Sophie reached at 6 AM.	Melissa reached after Sophie.
entailment	Paul reached hotel at 1:30 PM whereas Kathryn reached at 6:30 AM.	Paul reached after Kathryn.
entailment	Annie reached museum at 8 AM whereas Dan reached at 7 AM.	Annie reached after Dan.
