entailment	Annie reached school at 2:30 PM whereas Victoria reached at 12 noon.	Annie reached after Victoria.
entailment	Jerry reached hotel at 4 PM whereas Michael reached at 8:30 AM.	Jerry reached after Michael.
entailment	Betty reached office at 7:30 AM whereas Nicole reached at 6:30 AM.	Betty reached after Nicole.
entailment	Maria reached theatre at 3 PM whereas Dick reached at 2:30 PM.	Maria reached after Dick.
entailment	Alexander reached theatre at 7 AM whereas Sara reached at 6:30 AM.	Alexander reached after Sara.
entailment	Scott reached theatre at 1:30 PM whereas Sara reached at 11:30 AM.	Scott reached after Sara.
entailment	Julie reached theatre at 3 PM whereas Frances reached at 12:30 PM.	Julie reached after Frances.
entailment	Alfred reached museum at 8 AM whereas Leslie reached at 7 AM.	Alfred reached after Leslie.
entailment	Edward reached park at 6:30 AM whereas Jack reached at 6 AM.	Edward reached after Jack.
entailment	Patricia reached theatre at 2 PM whereas Susan reached at 10 AM.	Patricia reached after Susan.
entailment	Stephen reached hotel at 10:30 AM whereas Kathleen reached at 9 AM.	Stephen reached after Kathleen.
entailment	Jean reached museum at 12 noon whereas Simon reached at 6:30 AM.	Jean reached after Simon.
entailment	Pamela reached theatre at 1:30 PM whereas Claire reached at 1 PM.	Pamela reached after Claire.
entailment	Greg reached theatre at 3 PM whereas Richard reached at 2:30 PM.	Greg reached after Richard.
entailment	Jeff reached hotel at 12:30 PM whereas Francis reached at 6 AM.	Jeff reached after Francis.
entailment	Harriet reached museum at 11 AM whereas Susan reached at 8:30 AM.	Harriet reached after Susan.
entailment	Emily reached museum at 12 noon whereas John reached at 8 AM.	Emily reached after John.
entailment	Steven reached school at 4 PM whereas Lucy reached at 1:30 PM.	Steven reached after Lucy.
entailment	Margaret reached school at 1 PM whereas Kathryn reached at 9 AM.	Margaret reached after Kathryn.
entailment	Judy reached hospital at 10 AM whereas Helen reached at 6:30 AM.	Judy reached after Helen.
entailment	Greg reached hospital at 10:30 AM whereas Victoria reached at 6:30 AM.	Greg reached after Victoria.
entailment	Annie reached hospital at 3 PM whereas Jim reached at 9:30 AM.	Annie reached after Jim.
entailment	Ian reached museum at 7 AM whereas Frances reached at 6:30 AM.	Ian reached after Frances.
entailment	Stephen reached hotel at 5 PM whereas Annie reached at 3 PM.	Stephen reached after Annie.
entailment	Angela reached park at 2:30 PM whereas Albert reached at 1:30 PM.	Angela reached after Albert.
entailment	Charles reached hotel at 6 PM whereas Bruce reached at 4:30 PM.	Charles reached after Bruce.
entailment	Jack reached park at 11:30 AM whereas Matthew reached at 8:30 AM.	Jack reached after Matthew.
entailment	Kathleen reached school at 7:30 AM whereas Nicole reached at 6 AM.	Kathleen reached after Nicole.
entailment	Francis reached hotel at 5:30 PM whereas Florence reached at 6 AM.	Francis reached after Florence.
entailment	Lucy reached office at 8:30 AM whereas Eleanor reached at 8 AM.	Lucy reached after Eleanor.
entailment	Richard reached hotel at 2 PM whereas Jerry reached at 7 AM.	Richard reached after Jerry.
entailment	Bobby reached park at 10:30 AM whereas Adam reached at 10 AM.	Bobby reached after Adam.
entailment	Andrea reached museum at 10:30 AM whereas Hugh reached at 6:30 AM.	Andrea reached after Hugh.
entailment	Walter reached museum at 3 PM whereas Julie reached at 2 PM.	Walter reached after Julie.
entailment	Howard reached park at 11:30 AM whereas Alan reached at 8 AM.	Howard reached after Alan.
entailment	Edwin reached office at 12:30 PM whereas Francis reached at 7 AM.	Edwin reached after Francis.
entailment	Alice reached theatre at 2 PM whereas Samuel reached at 9:30 AM.	Alice reached after Samuel.
entailment	Amanda reached museum at 11 AM whereas Emma reached at 8:30 AM.	Amanda reached after Emma.
entailment	Amy reached theatre at 9 AM whereas Joan reached at 6:30 AM.	Amy reached after Joan.
entailment	Samuel reached museum at 5:30 PM whereas Alexandra reached at 4 PM.	Samuel reached after Alexandra.
entailment	Frances reached theatre at 7 AM whereas Diane reached at 6 AM.	Frances reached after Diane.
entailment	Stephanie reached museum at 11:30 AM whereas Heather reached at 6 AM.	Stephanie reached after Heather.
entailment	Linda reached museum at 6:30 AM whereas Patrick reached at 6 AM.	Linda reached after Patrick.
entailment	Billy reached office at 2 PM whereas Chris reached at 1 PM.	Billy reached after Chris.
entailment	Elaine reached park at 9 AM whereas Daniel reached at 8 AM.	Elaine reached after Daniel.
entailment	Grace reached hotel at 4:30 PM whereas Marilyn reached at 8:30 AM.	Grace reached after Marilyn.
entailment	Charles reached hotel at 8 AM whereas Patricia reached at 7 AM.	Charles reached after Patricia.
entailment	Betty reached hospital at 6:30 AM whereas Janet reached at 6 AM.	Betty reached after Janet.
entailment	Chris reached theatre at 3:30 PM whereas Simon reached at 2:30 PM.	Chris reached after Simon.
entailment	Heather reached school at 2 PM whereas Samuel reached at 12:30 PM.	Heather reached after Samuel.
entailment	Jim reached hospital at 5:30 PM whereas Sandra reached at 9:30 AM.	Jim reached after Sandra.
entailment	Louise reached hotel at 9 AM whereas Melissa reached at 7 AM.	Louise reached after Melissa.
entailment	Alfred reached office at 7 AM whereas Melissa reached at 6:30 AM.	Alfred reached after Melissa.
entailment	Philip reached hospital at 11 AM whereas Brian reached at 7 AM.	Philip reached after Brian.
entailment	Kim reached hotel at 11:30 AM whereas Kevin reached at 10:30 AM.	Kim reached after Kevin.
entailment	Karen reached office at 8 AM whereas John reached at 7:30 AM.	Karen reached after John.
entailment	Joan reached school at 6:30 AM whereas Mike reached at 6 AM.	Joan reached after Mike.
entailment	Philip reached hotel at 8:30 AM whereas Florence reached at 6 AM.	Philip reached after Florence.
entailment	Ben reached school at 9 AM whereas Julia reached at 6:30 AM.	Ben reached after Julia.
entailment	Larry reached hospital at 7:30 AM whereas Katie reached at 6 AM.	Larry reached after Katie.
entailment	Nancy reached school at 11:30 AM whereas Judy reached at 8:30 AM.	Nancy reached after Judy.
entailment	Scott reached school at 1 PM whereas Martha reached at 9:30 AM.	Scott reached after Martha.
entailment	Patricia reached museum at 3 PM whereas Grace reached at 8:30 AM.	Patricia reached after Grace.
entailment	Rachel reached hospital at 10 AM whereas Alison reached at 9:30 AM.	Rachel reached after Alison.
entailment	Robert reached hotel at 12 noon whereas Deborah reached at 9:30 AM.	Robert reached after Deborah.
entailment	Philip reached park at 6:30 AM whereas Sara reached at 6 AM.	Philip reached after Sara.
entailment	Marilyn reached hospital at 5:30 PM whereas Sue reached at 12:30 PM.	Marilyn reached after Sue.
entailment	Sue reached museum at 6:30 AM whereas Eleanor reached at 6 AM.	Sue reached after Eleanor.
entailment	Patricia reached hospital at 11:30 AM whereas George reached at 9 AM.	Patricia reached after George.
entailment	Alexander reached theatre at 9 AM whereas Andrew reached at 8 AM.	Alexander reached after Andrew.
entailment	Amanda reached hospital at 2:30 PM whereas Francis reached at 11 AM.	Amanda reached after Francis.
entailment	Janet reached museum at 6 PM whereas Rebecca reached at 12 noon.	Janet reached after Rebecca.
entailment	Jack reached theatre at 9 AM whereas Jim reached at 6:30 AM.	Jack reached after Jim.
entailment	Ellen reached park at 10 AM whereas Jennifer reached at 8:30 AM.	Ellen reached after Jennifer.
entailment	Marie reached hospital at 8 AM whereas Nicole reached at 6 AM.	Marie reached after Nicole.
entailment	Wendy reached park at 12:30 PM whereas Barbara reached at 12 noon.	Wendy reached after Barbara.
entailment	Jennifer reached hospital at 7:30 AM whereas David reached at 6:30 AM.	Jennifer reached after David.
entailment	Jerry reached park at 2 PM whereas Johnny reached at 6:30 AM.	Jerry reached after Johnny.
entailment	Kevin reached hospital at 12 noon whereas Ken reached at 9 AM.	Kevin reached after Ken.
entailment	Harriet reached hotel at 2 PM whereas Jessica reached at 10 AM.	Harriet reached after Jessica.
entailment	Louis reached school at 2 PM whereas Dave reached at 10 AM.	Louis reached after Dave.
entailment	Harry reached park at 7:30 AM whereas Emma reached at 6 AM.	Harry reached after Emma.
entailment	Bobby reached park at 2:30 PM whereas Jay reached at 8:30 AM.	Bobby reached after Jay.
entailment	Judy reached park at 1 PM whereas Emily reached at 9 AM.	Judy reached after Emily.
entailment	Alice reached park at 3:30 PM whereas Stephanie reached at 10 AM.	Alice reached after Stephanie.
entailment	Ed reached museum at 12 noon whereas Katherine reached at 8 AM.	Ed reached after Katherine.
entailment	Claire reached school at 1:30 PM whereas Steven reached at 8 AM.	Claire reached after Steven.
entailment	Al reached school at 12:30 PM whereas Ralph reached at 10 AM.	Al reached after Ralph.
entailment	Ed reached hotel at 9 AM whereas Kim reached at 6 AM.	Ed reached after Kim.
entailment	Brian reached museum at 9 AM whereas Thomas reached at 6:30 AM.	Brian reached after Thomas.
entailment	Annie reached theatre at 5 PM whereas Pamela reached at 12:30 PM.	Annie reached after Pamela.
entailment	Emily reached museum at 2:30 PM whereas Jimmy reached at 6:30 AM.	Emily reached after Jimmy.
entailment	Ashley reached hotel at 11 AM whereas Jane reached at 6:30 AM.	Ashley reached after Jane.
entailment	Matt reached museum at 2 PM whereas Steven reached at 7:30 AM.	Matt reached after Steven.
entailment	Kenneth reached school at 4 PM whereas Billy reached at 7 AM.	Kenneth reached after Billy.
entailment	William reached hospital at 4:30 PM whereas Barbara reached at 3:30 PM.	William reached after Barbara.
entailment	Anne reached school at 1 PM whereas Julia reached at 11 AM.	Anne reached after Julia.
entailment	Benjamin reached hotel at 6:30 AM whereas Fiona reached at 6 AM.	Benjamin reached after Fiona.
entailment	Andrea reached theatre at 11 AM whereas Barbara reached at 8 AM.	Andrea reached after Barbara.
entailment	Scott reached hospital at 1:30 PM whereas Roger reached at 7 AM.	Scott reached after Roger.
entailment	Kelly reached museum at 12 noon whereas Harriet reached at 10 AM.	Kelly reached after Harriet.
entailment	Sara reached school at 4 PM whereas Barbara reached at 8:30 AM.	Sara reached after Barbara.
entailment	Howard reached theatre at 2 PM whereas Mike reached at 9 AM.	Howard reached after Mike.
entailment	Dick reached office at 7:30 AM whereas Matthew reached at 6:30 AM.	Dick reached after Matthew.
entailment	Katherine reached park at 1 PM whereas Stephanie reached at 10 AM.	Katherine reached after Stephanie.
entailment	Marie reached park at 2 PM whereas Betty reached at 1:30 PM.	Marie reached after Betty.
entailment	Philip reached office at 3 PM whereas Patrick reached at 11:30 AM.	Philip reached after Patrick.
entailment	Sue reached office at 8 AM whereas Ryan reached at 7:30 AM.	Sue reached after Ryan.
entailment	Edward reached park at 1:30 PM whereas Alexander reached at 8 AM.	Edward reached after Alexander.
entailment	Jessica reached office at 8 AM whereas Grace reached at 7 AM.	Jessica reached after Grace.
entailment	Joseph reached hospital at 8:30 AM whereas Maria reached at 6:30 AM.	Joseph reached after Maria.
entailment	Ed reached park at 3 PM whereas Ralph reached at 8:30 AM.	Ed reached after Ralph.
entailment	Greg reached hotel at 7:30 AM whereas Arthur reached at 6 AM.	Greg reached after Arthur.
entailment	Nicole reached museum at 4:30 PM whereas Julia reached at 12 noon.	Nicole reached after Julia.
entailment	Virginia reached park at 2 PM whereas Kim reached at 6 AM.	Virginia reached after Kim.
entailment	Dick reached theatre at 1 PM whereas Andrew reached at 9 AM.	Dick reached after Andrew.
entailment	Sarah reached museum at 7:30 AM whereas Amy reached at 7 AM.	Sarah reached after Amy.
entailment	Maria reached museum at 7 AM whereas Sarah reached at 6:30 AM.	Maria reached after Sarah.
entailment	Fiona reached school at 11:30 AM whereas Gary reached at 8 AM.	Fiona reached after Gary.
entailment	Ray reached hotel at 1:30 PM whereas Robin reached at 7:30 AM.	Ray reached after Robin.
entailment	Elizabeth reached hotel at 2 PM whereas Hugh reached at 6 AM.	Elizabeth reached after Hugh.
entailment	Kim reached park at 2:30 PM whereas Samuel reached at 2 PM.	Kim reached after Samuel.
entailment	Ron reached theatre at 1 PM whereas Kevin reached at 10 AM.	Ron reached after Kevin.
entailment	Angela reached school at 6 PM whereas Jill reached at 6:30 AM.	Angela reached after Jill.
entailment	Don reached school at 10:30 AM whereas Larry reached at 6 AM.	Don reached after Larry.
entailment	Sue reached theatre at 2:30 PM whereas Ray reached at 6 AM.	Sue reached after Ray.
entailment	Amy reached museum at 11:30 AM whereas Jennifer reached at 9:30 AM.	Amy reached after Jennifer.
entailment	Marilyn reached hospital at 11:30 AM whereas Janet reached at 6:30 AM.	Marilyn reached after Janet.
entailment	Robin reached hospital at 2 PM whereas Billy reached at 6 AM.	Robin reached after Billy.
entailment	Steven reached museum at 12 noon whereas Daniel reached at 11 AM.	Steven reached after Daniel.
entailment	Benjamin reached school at 1 PM whereas Robin reached at 12 noon.	Benjamin reached after Robin.
entailment	Robin reached school at 10:30 AM whereas Mary reached at 6 AM.	Robin reached after Mary.
entailment	Sandra reached office at 3 PM whereas Alison reached at 2:30 PM.	Sandra reached after Alison.
entailment	Barbara reached museum at 5:30 PM whereas Richard reached at 10 AM.	Barbara reached after Richard.
entailment	Robin reached hospital at 9 AM whereas Ellen reached at 8:30 AM.	Robin reached after Ellen.
entailment	Grace reached park at 10 AM whereas Catherine reached at 9 AM.	Grace reached after Catherine.
entailment	Angela reached office at 5:30 PM whereas Rose reached at 1:30 PM.	Angela reached after Rose.
entailment	Howard reached museum at 7 AM whereas Janet reached at 6 AM.	Howard reached after Janet.
entailment	Joseph reached office at 11 AM whereas Jim reached at 9:30 AM.	Joseph reached after Jim.
entailment	Billy reached museum at 8 AM whereas Ron reached at 6:30 AM.	Billy reached after Ron.
entailment	Catherine reached hospital at 3:30 PM whereas Jason reached at 11 AM.	Catherine reached after Jason.
entailment	Matt reached museum at 7 AM whereas Carol reached at 6 AM.	Matt reached after Carol.
entailment	Scott reached park at 2:30 PM whereas Samuel reached at 12 noon.	Scott reached after Samuel.
entailment	Carl reached school at 5 PM whereas Louis reached at 12 noon.	Carl reached after Louis.
entailment	Alexandra reached hospital at 6 PM whereas Joe reached at 2 PM.	Alexandra reached after Joe.
entailment	Judy reached park at 2 PM whereas Kathryn reached at 1:30 PM.	Judy reached after Kathryn.
entailment	Jane reached museum at 10 AM whereas Frank reached at 8:30 AM.	Jane reached after Frank.
entailment	Frederick reached park at 1:30 PM whereas Stephen reached at 11 AM.	Frederick reached after Stephen.
entailment	Jonathan reached office at 7 AM whereas Martha reached at 6 AM.	Jonathan reached after Martha.
entailment	Donna reached park at 11:30 AM whereas Sandra reached at 8 AM.	Donna reached after Sandra.
entailment	Andrea reached hospital at 7:30 AM whereas Kathy reached at 6:30 AM.	Andrea reached after Kathy.
entailment	Keith reached hospital at 2:30 PM whereas Jack reached at 7:30 AM.	Keith reached after Jack.
entailment	Jimmy reached hotel at 2 PM whereas Charlotte reached at 10:30 AM.	Jimmy reached after Charlotte.
entailment	Linda reached office at 4 PM whereas Ellen reached at 10:30 AM.	Linda reached after Ellen.
entailment	Andrew reached hotel at 12:30 PM whereas Harold reached at 8:30 AM.	Andrew reached after Harold.
entailment	Alex reached theatre at 4:30 PM whereas Lawrence reached at 7 AM.	Alex reached after Lawrence.
entailment	Jessica reached hotel at 7:30 AM whereas Alex reached at 7 AM.	Jessica reached after Alex.
entailment	Susan reached park at 1 PM whereas Christine reached at 11 AM.	Susan reached after Christine.
entailment	Kim reached park at 11 AM whereas Alison reached at 9 AM.	Kim reached after Alison.
entailment	Frances reached office at 7 AM whereas Jessica reached at 6:30 AM.	Frances reached after Jessica.
entailment	Maria reached theatre at 7:30 AM whereas Keith reached at 7 AM.	Maria reached after Keith.
entailment	Karen reached school at 2 PM whereas Diana reached at 10 AM.	Karen reached after Diana.
entailment	Jay reached school at 11 AM whereas Edwin reached at 6:30 AM.	Jay reached after Edwin.
entailment	Richard reached office at 2 PM whereas Chris reached at 8:30 AM.	Richard reached after Chris.
entailment	Frances reached theatre at 6:30 AM whereas Amanda reached at 6 AM.	Frances reached after Amanda.
entailment	Frederick reached school at 6:30 AM whereas Matthew reached at 6 AM.	Frederick reached after Matthew.
entailment	Ashley reached museum at 9:30 AM whereas Maria reached at 6:30 AM.	Ashley reached after Maria.
entailment	Matthew reached museum at 5:30 PM whereas Lawrence reached at 1 PM.	Matthew reached after Lawrence.
entailment	Judith reached park at 6:30 AM whereas Sarah reached at 6 AM.	Judith reached after Sarah.
entailment	Diane reached hotel at 12 noon whereas George reached at 8 AM.	Diane reached after George.
entailment	Kevin reached museum at 4:30 PM whereas Ruth reached at 8 AM.	Kevin reached after Ruth.
entailment	Henry reached school at 2 PM whereas Kenneth reached at 12 noon.	Henry reached after Kenneth.
entailment	Frank reached school at 5 PM whereas Ray reached at 4 PM.	Frank reached after Ray.
entailment	Tim reached museum at 5:30 PM whereas Amy reached at 8:30 AM.	Tim reached after Amy.
entailment	Sharon reached office at 8 AM whereas Elizabeth reached at 7 AM.	Sharon reached after Elizabeth.
entailment	Harriet reached hospital at 3:30 PM whereas Kathleen reached at 7:30 AM.	Harriet reached after Kathleen.
entailment	Ann reached office at 7:30 AM whereas Ellen reached at 7 AM.	Ann reached after Ellen.
entailment	Lisa reached office at 7:30 AM whereas Margaret reached at 6 AM.	Lisa reached after Margaret.
entailment	Alison reached hotel at 4 PM whereas Anne reached at 6 AM.	Alison reached after Anne.
entailment	Sue reached hospital at 7 AM whereas Donald reached at 6:30 AM.	Sue reached after Donald.
entailment	Anna reached theatre at 11:30 AM whereas Edwin reached at 9:30 AM.	Anna reached after Edwin.
entailment	Helen reached hotel at 1:30 PM whereas Kevin reached at 11 AM.	Helen reached after Kevin.
entailment	Anna reached hotel at 10:30 AM whereas Lucy reached at 9 AM.	Anna reached after Lucy.
entailment	Lucy reached school at 4:30 PM whereas Alexandra reached at 3 PM.	Lucy reached after Alexandra.
entailment	Diana reached hotel at 11:30 AM whereas Simon reached at 9 AM.	Diana reached after Simon.
entailment	Helen reached museum at 7 AM whereas Edwin reached at 6:30 AM.	Helen reached after Edwin.
entailment	Carl reached museum at 3:30 PM whereas Arthur reached at 2:30 PM.	Carl reached after Arthur.
entailment	Mark reached hotel at 11 AM whereas Al reached at 8 AM.	Mark reached after Al.
entailment	Karen reached museum at 7:30 AM whereas Nancy reached at 7 AM.	Karen reached after Nancy.
entailment	Thomas reached park at 2 PM whereas Scott reached at 8 AM.	Thomas reached after Scott.
entailment	Ann reached museum at 6 PM whereas Bob reached at 1 PM.	Ann reached after Bob.
entailment	Diane reached hotel at 4 PM whereas Mark reached at 7:30 AM.	Diane reached after Mark.
entailment	Kim reached hotel at 3 PM whereas Kathleen reached at 11:30 AM.	Kim reached after Kathleen.
entailment	Donna reached office at 7:30 AM whereas Kelly reached at 6 AM.	Donna reached after Kelly.
entailment	Nicole reached park at 11 AM whereas Andrea reached at 7:30 AM.	Nicole reached after Andrea.
entailment	Jonathan reached museum at 2 PM whereas Ray reached at 9:30 AM.	Jonathan reached after Ray.
entailment	Amanda reached school at 8:30 AM whereas John reached at 6 AM.	Amanda reached after John.
entailment	Eric reached hospital at 7 AM whereas Anna reached at 6 AM.	Eric reached after Anna.
entailment	William reached office at 12:30 PM whereas Alex reached at 6 AM.	William reached after Alex.
entailment	Harriet reached hospital at 8:30 AM whereas Louise reached at 6 AM.	Harriet reached after Louise.
entailment	Jeff reached park at 7 AM whereas Sam reached at 6 AM.	Jeff reached after Sam.
entailment	Joan reached school at 7:30 AM whereas Edward reached at 6 AM.	Joan reached after Edward.
entailment	Matt reached hospital at 3 PM whereas Linda reached at 10 AM.	Matt reached after Linda.
entailment	George reached museum at 12:30 PM whereas Elizabeth reached at 10 AM.	George reached after Elizabeth.
entailment	Jessica reached museum at 3:30 PM whereas Jonathan reached at 10:30 AM.	Jessica reached after Jonathan.
entailment	Deborah reached hospital at 4:30 PM whereas Evelyn reached at 2 PM.	Deborah reached after Evelyn.
entailment	Jimmy reached hotel at 6 PM whereas Ian reached at 8 AM.	Jimmy reached after Ian.
entailment	Ken reached theatre at 7:30 AM whereas Mark reached at 6:30 AM.	Ken reached after Mark.
entailment	Elaine reached office at 9:30 AM whereas Tony reached at 8 AM.	Elaine reached after Tony.
entailment	Donald reached office at 6:30 AM whereas Simon reached at 6 AM.	Donald reached after Simon.
entailment	Tony reached school at 5:30 PM whereas Katherine reached at 3:30 PM.	Tony reached after Katherine.
entailment	Melissa reached hotel at 10:30 AM whereas Stephen reached at 8:30 AM.	Melissa reached after Stephen.
entailment	Frederick reached museum at 12 noon whereas Kathy reached at 7 AM.	Frederick reached after Kathy.
entailment	Joe reached school at 1 PM whereas Elaine reached at 9:30 AM.	Joe reached after Elaine.
entailment	Walter reached park at 10:30 AM whereas Angela reached at 7:30 AM.	Walter reached after Angela.
entailment	Thomas reached school at 8:30 AM whereas Jean reached at 7 AM.	Thomas reached after Jean.
entailment	Don reached park at 4 PM whereas Jeff reached at 1 PM.	Don reached after Jeff.
entailment	Jack reached hospital at 11:30 AM whereas Christine reached at 11 AM.	Jack reached after Christine.
entailment	Ruth reached museum at 3:30 PM whereas Julia reached at 10:30 AM.	Ruth reached after Julia.
entailment	Steven reached hotel at 6 PM whereas Kelly reached at 6:30 AM.	Steven reached after Kelly.
entailment	Peter reached school at 5:30 PM whereas Greg reached at 7 AM.	Peter reached after Greg.
entailment	Thomas reached hotel at 10:30 AM whereas John reached at 6:30 AM.	Thomas reached after John.
entailment	Thomas reached hotel at 1:30 PM whereas Nick reached at 7 AM.	Thomas reached after Nick.
entailment	Alexandra reached office at 1 PM whereas Alfred reached at 6:30 AM.	Alexandra reached after Alfred.
entailment	Nancy reached theatre at 9 AM whereas Tony reached at 8 AM.	Nancy reached after Tony.
entailment	Stephanie reached school at 6 PM whereas Amanda reached at 12 noon.	Stephanie reached after Amanda.
entailment	Katherine reached theatre at 10:30 AM whereas Jean reached at 6 AM.	Katherine reached after Jean.
entailment	Larry reached school at 7 AM whereas Kathryn reached at 6:30 AM.	Larry reached after Kathryn.
entailment	Kelly reached hotel at 1 PM whereas Brian reached at 7:30 AM.	Kelly reached after Brian.
entailment	Emily reached school at 7 AM whereas Tony reached at 6 AM.	Emily reached after Tony.
entailment	Heather reached hotel at 3 PM whereas Robin reached at 7 AM.	Heather reached after Robin.
entailment	Alexander reached theatre at 5:30 PM whereas Jack reached at 4:30 PM.	Alexander reached after Jack.
entailment	Jeff reached museum at 2:30 PM whereas Kathryn reached at 9:30 AM.	Jeff reached after Kathryn.
entailment	Angela reached office at 3:30 PM whereas Janet reached at 12:30 PM.	Angela reached after Janet.
entailment	Roy reached hospital at 1:30 PM whereas Charlotte reached at 6 AM.	Roy reached after Charlotte.
entailment	Linda reached hotel at 12 noon whereas Martha reached at 11 AM.	Linda reached after Martha.
entailment	Michelle reached office at 4 PM whereas Ellen reached at 6:30 AM.	Michelle reached after Ellen.
entailment	Don reached park at 7:30 AM whereas Stephen reached at 7 AM.	Don reached after Stephen.
entailment	Philip reached office at 2 PM whereas Adam reached at 9 AM.	Philip reached after Adam.
entailment	Ian reached hospital at 11 AM whereas Jason reached at 6:30 AM.	Ian reached after Jason.
entailment	Simon reached school at 3:30 PM whereas Mary reached at 2 PM.	Simon reached after Mary.
entailment	Emma reached office at 4 PM whereas Carolyn reached at 1:30 PM.	Emma reached after Carolyn.
entailment	Arthur reached school at 12 noon whereas Angela reached at 6:30 AM.	Arthur reached after Angela.
entailment	Katie reached theatre at 3:30 PM whereas Dave reached at 1:30 PM.	Katie reached after Dave.
entailment	Edwin reached school at 10 AM whereas Ralph reached at 7 AM.	Edwin reached after Ralph.
entailment	Martha reached school at 6 PM whereas Edith reached at 3 PM.	Martha reached after Edith.
entailment	Emma reached park at 4 PM whereas Lawrence reached at 10 AM.	Emma reached after Lawrence.
entailment	Lucy reached hospital at 1 PM whereas Victoria reached at 8 AM.	Lucy reached after Victoria.
entailment	Scott reached theatre at 11:30 AM whereas Donna reached at 9:30 AM.	Scott reached after Donna.
entailment	Edward reached hospital at 6 PM whereas Hugh reached at 12 noon.	Edward reached after Hugh.
entailment	Annie reached hospital at 4:30 PM whereas Daniel reached at 6:30 AM.	Annie reached after Daniel.
entailment	Elizabeth reached theatre at 7:30 AM whereas Emily reached at 6 AM.	Elizabeth reached after Emily.
