entailment	Jean reached museum at 5 PM whereas Frank reached at 2:30 PM.	Jean reached after Frank.
entailment	Alice reached hotel at 8 AM whereas Heather reached at 6:30 AM.	Alice reached after Heather.
entailment	Emma reached hospital at 9:30 AM whereas Florence reached at 9 AM.	Emma reached after Florence.
entailment	Albert reached park at 5:30 PM whereas Andrea reached at 12 noon.	Albert reached after Andrea.
entailment	Steve reached theatre at 3 PM whereas Christopher reached at 8:30 AM.	Steve reached after Christopher.
entailment	Howard reached museum at 6 PM whereas Richard reached at 4:30 PM.	Howard reached after Richard.
entailment	Kelly reached park at 9:30 AM whereas Caroline reached at 8 AM.	Kelly reached after Caroline.
entailment	Joe reached hospital at 3 PM whereas Katherine reached at 1:30 PM.	Joe reached after Katherine.
entailment	Dan reached theatre at 4:30 PM whereas Amanda reached at 8:30 AM.	Dan reached after Amanda.
entailment	Steve reached office at 9 AM whereas Annie reached at 6:30 AM.	Steve reached after Annie.
entailment	Angela reached hospital at 6 PM whereas Ben reached at 1:30 PM.	Angela reached after Ben.
entailment	Robert reached museum at 2:30 PM whereas Grace reached at 2 PM.	Robert reached after Grace.
entailment	Anthony reached park at 1 PM whereas Charlotte reached at 11 AM.	Anthony reached after Charlotte.
entailment	Jeff reached office at 11 AM whereas Albert reached at 10 AM.	Jeff reached after Albert.
entailment	Emily reached school at 7 AM whereas Barbara reached at 6:30 AM.	Emily reached after Barbara.
entailment	Mike reached museum at 11:30 AM whereas Howard reached at 8 AM.	Mike reached after Howard.
entailment	Barbara reached park at 9:30 AM whereas Mike reached at 9 AM.	Barbara reached after Mike.
entailment	Lawrence reached office at 11 AM whereas Christine reached at 6:30 AM.	Lawrence reached after Christine.
entailment	Diane reached hospital at 6 PM whereas Nancy reached at 6:30 AM.	Diane reached after Nancy.
entailment	Grace reached theatre at 7:30 AM whereas Greg reached at 6 AM.	Grace reached after Greg.
entailment	Bruce reached museum at 11 AM whereas David reached at 7:30 AM.	Bruce reached after David.
entailment	Charlotte reached theatre at 5:30 PM whereas Al reached at 8 AM.	Charlotte reached after Al.
entailment	Gary reached museum at 1:30 PM whereas Deborah reached at 6 AM.	Gary reached after Deborah.
entailment	Gary reached office at 10:30 AM whereas Ray reached at 6 AM.	Gary reached after Ray.
entailment	Charlie reached hotel at 1:30 PM whereas Bill reached at 11:30 AM.	Charlie reached after Bill.
entailment	Sally reached museum at 2 PM whereas Thomas reached at 11 AM.	Sally reached after Thomas.
entailment	Ann reached hospital at 2 PM whereas Ken reached at 6:30 AM.	Ann reached after Ken.
entailment	Frank reached museum at 1:30 PM whereas Jimmy reached at 7:30 AM.	Frank reached after Jimmy.
entailment	Judy reached office at 6:30 AM whereas Evelyn reached at 6 AM.	Judy reached after Evelyn.
entailment	Susan reached office at 1 PM whereas Deborah reached at 10 AM.	Susan reached after Deborah.
entailment	Julia reached office at 11 AM whereas Jane reached at 9:30 AM.	Julia reached after Jane.
entailment	Donna reached hotel at 1 PM whereas Eleanor reached at 12:30 PM.	Donna reached after Eleanor.
entailment	John reached hospital at 11 AM whereas Steve reached at 8 AM.	John reached after Steve.
entailment	Brian reached museum at 5:30 PM whereas Joseph reached at 10:30 AM.	Brian reached after Joseph.
entailment	Ron reached museum at 8:30 AM whereas Steve reached at 6 AM.	Ron reached after Steve.
entailment	Jill reached museum at 7 AM whereas Anne reached at 6:30 AM.	Jill reached after Anne.
entailment	Angela reached theatre at 9 AM whereas Ed reached at 7:30 AM.	Angela reached after Ed.
entailment	Ray reached museum at 1:30 PM whereas Maria reached at 9:30 AM.	Ray reached after Maria.
entailment	Kenneth reached park at 1:30 PM whereas Leslie reached at 7 AM.	Kenneth reached after Leslie.
entailment	Betty reached office at 6:30 AM whereas Evelyn reached at 6 AM.	Betty reached after Evelyn.
entailment	Michelle reached school at 1 PM whereas Frederick reached at 6 AM.	Michelle reached after Frederick.
entailment	Jimmy reached theatre at 5 PM whereas Brian reached at 2 PM.	Jimmy reached after Brian.
entailment	Barbara reached office at 7:30 AM whereas Al reached at 7 AM.	Barbara reached after Al.
entailment	Alexandra reached hotel at 9:30 AM whereas Ashley reached at 9 AM.	Alexandra reached after Ashley.
entailment	Karen reached hotel at 8:30 AM whereas Patrick reached at 7 AM.	Karen reached after Patrick.
entailment	Amanda reached hospital at 5 PM whereas Gary reached at 11:30 AM.	Amanda reached after Gary.
entailment	Diane reached theatre at 6 PM whereas Judy reached at 4:30 PM.	Diane reached after Judy.
entailment	Rebecca reached school at 6 PM whereas Elizabeth reached at 6 AM.	Rebecca reached after Elizabeth.
entailment	Mary reached office at 4:30 PM whereas Sandra reached at 8 AM.	Mary reached after Sandra.
entailment	Sue reached hospital at 5 PM whereas Florence reached at 4:30 PM.	Sue reached after Florence.
entailment	Walter reached office at 2 PM whereas Frances reached at 1 PM.	Walter reached after Frances.
entailment	Eleanor reached school at 6 PM whereas Walter reached at 5:30 PM.	Eleanor reached after Walter.
entailment	Judith reached hotel at 11 AM whereas Martha reached at 7 AM.	Judith reached after Martha.
entailment	Jeff reached school at 11 AM whereas Julia reached at 9 AM.	Jeff reached after Julia.
entailment	Rose reached park at 12:30 PM whereas Karen reached at 7 AM.	Rose reached after Karen.
entailment	Margaret reached office at 6:30 AM whereas Andrew reached at 6 AM.	Margaret reached after Andrew.
entailment	Eleanor reached school at 2 PM whereas Lucy reached at 6 AM.	Eleanor reached after Lucy.
entailment	Amanda reached school at 12:30 PM whereas Gary reached at 7 AM.	Amanda reached after Gary.
entailment	Daniel reached theatre at 9 AM whereas Dick reached at 6:30 AM.	Daniel reached after Dick.
entailment	Deborah reached hospital at 9 AM whereas Kenneth reached at 7 AM.	Deborah reached after Kenneth.
entailment	Ray reached park at 1:30 PM whereas Anthony reached at 10:30 AM.	Ray reached after Anthony.
entailment	Jay reached museum at 5:30 PM whereas Alice reached at 3:30 PM.	Jay reached after Alice.
entailment	Matthew reached school at 12:30 PM whereas Donna reached at 7 AM.	Matthew reached after Donna.
entailment	Laura reached park at 4:30 PM whereas Helen reached at 6 AM.	Laura reached after Helen.
entailment	Edwin reached office at 2:30 PM whereas Linda reached at 8 AM.	Edwin reached after Linda.
entailment	Catherine reached office at 8 AM whereas Lauren reached at 7 AM.	Catherine reached after Lauren.
entailment	Benjamin reached hotel at 7:30 AM whereas Don reached at 7 AM.	Benjamin reached after Don.
entailment	Lauren reached park at 1:30 PM whereas Eric reached at 11 AM.	Lauren reached after Eric.
entailment	Sarah reached hospital at 5:30 PM whereas Mike reached at 12 noon.	Sarah reached after Mike.
entailment	Martha reached museum at 3 PM whereas Ed reached at 8:30 AM.	Martha reached after Ed.
entailment	Bill reached museum at 5:30 PM whereas Eric reached at 8 AM.	Bill reached after Eric.
entailment	Jane reached park at 11:30 AM whereas Alan reached at 11 AM.	Jane reached after Alan.
entailment	Elizabeth reached hospital at 6:30 AM whereas Lauren reached at 6 AM.	Elizabeth reached after Lauren.
entailment	Frances reached office at 9:30 AM whereas Walter reached at 7 AM.	Frances reached after Walter.
entailment	Kate reached park at 1 PM whereas David reached at 8 AM.	Kate reached after David.
entailment	Elizabeth reached hospital at 5:30 PM whereas Sally reached at 6:30 AM.	Elizabeth reached after Sally.
entailment	John reached school at 7 AM whereas David reached at 6 AM.	John reached after David.
entailment	Jeff reached school at 2:30 PM whereas Jack reached at 1 PM.	Jeff reached after Jack.
entailment	Jay reached park at 11:30 AM whereas Janet reached at 10 AM.	Jay reached after Janet.
entailment	Gary reached park at 6 PM whereas Dick reached at 6:30 AM.	Gary reached after Dick.
entailment	Amy reached office at 8 AM whereas Heather reached at 6 AM.	Amy reached after Heather.
entailment	Ralph reached theatre at 6 PM whereas Victoria reached at 12 noon.	Ralph reached after Victoria.
entailment	Jimmy reached hospital at 1:30 PM whereas Kelly reached at 7 AM.	Jimmy reached after Kelly.
entailment	Katie reached hotel at 3 PM whereas Larry reached at 1 PM.	Katie reached after Larry.
entailment	Amy reached hotel at 12:30 PM whereas Billy reached at 11 AM.	Amy reached after Billy.
entailment	Bobby reached park at 3:30 PM whereas Bill reached at 10:30 AM.	Bobby reached after Bill.
entailment	Kenneth reached office at 8:30 AM whereas Judy reached at 6:30 AM.	Kenneth reached after Judy.
entailment	Jennifer reached office at 9:30 AM whereas Barbara reached at 6:30 AM.	Jennifer reached after Barbara.
entailment	Chris reached park at 11 AM whereas Eleanor reached at 10 AM.	Chris reached after Eleanor.
entailment	Tony reached theatre at 1 PM whereas Catherine reached at 9:30 AM.	Tony reached after Catherine.
entailment	Alexander reached hotel at 2 PM whereas Lauren reached at 1 PM.	Alexander reached after Lauren.
entailment	Fiona reached hospital at 12 noon whereas Jill reached at 6 AM.	Fiona reached after Jill.
entailment	Peter reached park at 12:30 PM whereas Bob reached at 6 AM.	Peter reached after Bob.
entailment	Eleanor reached hotel at 2:30 PM whereas Rebecca reached at 12 noon.	Eleanor reached after Rebecca.
entailment	Jeff reached theatre at 4:30 PM whereas James reached at 10 AM.	Jeff reached after James.
entailment	Jane reached hotel at 2 PM whereas Alex reached at 6:30 AM.	Jane reached after Alex.
entailment	Billy reached theatre at 5:30 PM whereas Jane reached at 8:30 AM.	Billy reached after Jane.
entailment	Matt reached museum at 9:30 AM whereas Jay reached at 8:30 AM.	Matt reached after Jay.
entailment	Judith reached museum at 10 AM whereas Frances reached at 7 AM.	Judith reached after Frances.
entailment	Nick reached office at 5 PM whereas Bobby reached at 10 AM.	Nick reached after Bobby.
entailment	Brian reached hotel at 3:30 PM whereas Louise reached at 9 AM.	Brian reached after Louise.
entailment	Heather reached park at 2 PM whereas Edwin reached at 7:30 AM.	Heather reached after Edwin.
entailment	Richard reached hotel at 10:30 AM whereas Carolyn reached at 9:30 AM.	Richard reached after Carolyn.
entailment	Matthew reached museum at 10:30 AM whereas Walter reached at 6 AM.	Matthew reached after Walter.
entailment	Frank reached park at 2 PM whereas Paul reached at 6:30 AM.	Frank reached after Paul.
entailment	Jane reached park at 5 PM whereas Dave reached at 6:30 AM.	Jane reached after Dave.
entailment	Bill reached theatre at 8:30 AM whereas Fred reached at 6:30 AM.	Bill reached after Fred.
entailment	Katherine reached theatre at 7:30 AM whereas Edward reached at 7 AM.	Katherine reached after Edward.
entailment	Sally reached school at 11 AM whereas Alison reached at 9:30 AM.	Sally reached after Alison.
entailment	Benjamin reached museum at 9:30 AM whereas Jerry reached at 9 AM.	Benjamin reached after Jerry.
entailment	Janet reached museum at 9:30 AM whereas Helen reached at 8:30 AM.	Janet reached after Helen.
entailment	Sue reached theatre at 3:30 PM whereas Martha reached at 3 PM.	Sue reached after Martha.
entailment	Kenneth reached school at 11:30 AM whereas Charles reached at 8 AM.	Kenneth reached after Charles.
entailment	Laura reached school at 10 AM whereas Harold reached at 6:30 AM.	Laura reached after Harold.
entailment	Jennifer reached office at 5 PM whereas Anna reached at 10:30 AM.	Jennifer reached after Anna.
entailment	Diana reached hotel at 12 noon whereas Alice reached at 7 AM.	Diana reached after Alice.
entailment	Lynn reached hospital at 11 AM whereas Arthur reached at 7:30 AM.	Lynn reached after Arthur.
entailment	Bobby reached school at 11 AM whereas Michael reached at 6:30 AM.	Bobby reached after Michael.
entailment	Ron reached park at 11 AM whereas Wendy reached at 7 AM.	Ron reached after Wendy.
entailment	Stephen reached hospital at 3:30 PM whereas Melissa reached at 7:30 AM.	Stephen reached after Melissa.
entailment	Patrick reached school at 1:30 PM whereas Diana reached at 10 AM.	Patrick reached after Diana.
entailment	Fiona reached office at 11 AM whereas Jason reached at 10 AM.	Fiona reached after Jason.
entailment	Jim reached hotel at 12:30 PM whereas Christopher reached at 9:30 AM.	Jim reached after Christopher.
entailment	Peter reached park at 4:30 PM whereas Alfred reached at 9:30 AM.	Peter reached after Alfred.
entailment	Victoria reached hospital at 8 AM whereas Paul reached at 7 AM.	Victoria reached after Paul.
entailment	Alan reached theatre at 10:30 AM whereas Lynn reached at 7 AM.	Alan reached after Lynn.
entailment	Samuel reached office at 4 PM whereas Paul reached at 3 PM.	Samuel reached after Paul.
entailment	Kim reached school at 1:30 PM whereas Marilyn reached at 9:30 AM.	Kim reached after Marilyn.
entailment	Kate reached school at 1 PM whereas Donna reached at 9 AM.	Kate reached after Donna.
entailment	Peter reached theatre at 2:30 PM whereas Annie reached at 2 PM.	Peter reached after Annie.
entailment	Larry reached hospital at 6 PM whereas Paul reached at 1 PM.	Larry reached after Paul.
entailment	Claire reached hospital at 1:30 PM whereas Ralph reached at 10:30 AM.	Claire reached after Ralph.
entailment	Tom reached office at 1 PM whereas Marilyn reached at 10 AM.	Tom reached after Marilyn.
entailment	Diane reached park at 12:30 PM whereas Jonathan reached at 8:30 AM.	Diane reached after Jonathan.
entailment	William reached theatre at 10 AM whereas Janet reached at 6:30 AM.	William reached after Janet.
entailment	Andrea reached hotel at 8:30 AM whereas Robert reached at 6:30 AM.	Andrea reached after Robert.
entailment	Frances reached museum at 10 AM whereas Stephen reached at 7:30 AM.	Frances reached after Stephen.
entailment	Kevin reached school at 7 AM whereas Edward reached at 6 AM.	Kevin reached after Edward.
entailment	Ron reached hotel at 1:30 PM whereas Anthony reached at 6:30 AM.	Ron reached after Anthony.
entailment	Florence reached theatre at 12:30 PM whereas Ian reached at 9:30 AM.	Florence reached after Ian.
entailment	Ken reached hotel at 10:30 AM whereas Anna reached at 7:30 AM.	Ken reached after Anna.
entailment	Christine reached school at 10 AM whereas Emily reached at 9:30 AM.	Christine reached after Emily.
entailment	Kenneth reached park at 7:30 AM whereas Elaine reached at 6:30 AM.	Kenneth reached after Elaine.
entailment	Robin reached theatre at 8 AM whereas Sophie reached at 7:30 AM.	Robin reached after Sophie.
entailment	Francis reached hotel at 8 AM whereas Alexander reached at 7 AM.	Francis reached after Alexander.
entailment	Christine reached school at 3:30 PM whereas Lisa reached at 8:30 AM.	Christine reached after Lisa.
entailment	Carol reached office at 9:30 AM whereas Bobby reached at 8 AM.	Carol reached after Bobby.
entailment	Kate reached hotel at 8 AM whereas Victoria reached at 6 AM.	Kate reached after Victoria.
entailment	Julia reached museum at 2:30 PM whereas Ralph reached at 6 AM.	Julia reached after Ralph.
entailment	Chris reached office at 7 AM whereas Jerry reached at 6:30 AM.	Chris reached after Jerry.
entailment	Scott reached park at 7 AM whereas Katie reached at 6 AM.	Scott reached after Katie.
entailment	William reached office at 12:30 PM whereas Emily reached at 11 AM.	William reached after Emily.
entailment	Kathleen reached theatre at 6 PM whereas Alison reached at 7 AM.	Kathleen reached after Alison.
entailment	Lauren reached office at 5:30 PM whereas Fred reached at 11:30 AM.	Lauren reached after Fred.
entailment	Fred reached school at 9:30 AM whereas Heather reached at 9 AM.	Fred reached after Heather.
entailment	Eleanor reached school at 10 AM whereas Francis reached at 7:30 AM.	Eleanor reached after Francis.
entailment	Diana reached hospital at 11:30 AM whereas Ray reached at 9:30 AM.	Diana reached after Ray.
entailment	Heather reached school at 10 AM whereas Carol reached at 7 AM.	Heather reached after Carol.
entailment	Rebecca reached office at 5:30 PM whereas Edward reached at 8 AM.	Rebecca reached after Edward.
entailment	Patricia reached hotel at 8 AM whereas Deborah reached at 6:30 AM.	Patricia reached after Deborah.
entailment	Anna reached office at 3 PM whereas Kathryn reached at 12 noon.	Anna reached after Kathryn.
entailment	George reached hospital at 8:30 AM whereas Harold reached at 6:30 AM.	George reached after Harold.
entailment	Cynthia reached theatre at 3:30 PM whereas Mark reached at 7 AM.	Cynthia reached after Mark.
entailment	Eric reached office at 6:30 AM whereas Lisa reached at 6 AM.	Eric reached after Lisa.
entailment	Jerry reached office at 8 AM whereas Lucy reached at 6:30 AM.	Jerry reached after Lucy.
entailment	Jim reached office at 6:30 AM whereas Eleanor reached at 6 AM.	Jim reached after Eleanor.
entailment	Anna reached office at 6:30 AM whereas Jill reached at 6 AM.	Anna reached after Jill.
entailment	David reached hotel at 7 AM whereas Jimmy reached at 6:30 AM.	David reached after Jimmy.
entailment	Kelly reached hotel at 5:30 PM whereas Donna reached at 4 PM.	Kelly reached after Donna.
entailment	Eric reached park at 11 AM whereas Anne reached at 8 AM.	Eric reached after Anne.
entailment	Bill reached theatre at 6 PM whereas Marilyn reached at 5 PM.	Bill reached after Marilyn.
entailment	Jerry reached office at 11 AM whereas Catherine reached at 7 AM.	Jerry reached after Catherine.
entailment	Maria reached office at 7 AM whereas Anne reached at 6:30 AM.	Maria reached after Anne.
entailment	Helen reached theatre at 3:30 PM whereas Joan reached at 6:30 AM.	Helen reached after Joan.
entailment	Judith reached office at 9 AM whereas Roger reached at 6:30 AM.	Judith reached after Roger.
entailment	Keith reached theatre at 7:30 AM whereas Annie reached at 7 AM.	Keith reached after Annie.
entailment	Benjamin reached park at 11:30 AM whereas Harry reached at 8 AM.	Benjamin reached after Harry.
entailment	Jennifer reached theatre at 4:30 PM whereas Emily reached at 2:30 PM.	Jennifer reached after Emily.
entailment	Ben reached hotel at 11 AM whereas Donna reached at 10:30 AM.	Ben reached after Donna.
entailment	Betty reached school at 5 PM whereas Pamela reached at 7:30 AM.	Betty reached after Pamela.
entailment	Julia reached hospital at 8:30 AM whereas Julie reached at 7 AM.	Julia reached after Julie.
entailment	Jean reached office at 9 AM whereas Donald reached at 6 AM.	Jean reached after Donald.
entailment	Colin reached museum at 1:30 PM whereas Alex reached at 12:30 PM.	Colin reached after Alex.
entailment	Alan reached office at 7:30 AM whereas Jane reached at 6:30 AM.	Alan reached after Jane.
entailment	Howard reached theatre at 8:30 AM whereas Anthony reached at 6:30 AM.	Howard reached after Anthony.
entailment	Andrew reached hotel at 11:30 AM whereas Elizabeth reached at 6:30 AM.	Andrew reached after Elizabeth.
entailment	Nancy reached hotel at 12 noon whereas Florence reached at 10 AM.	Nancy reached after Florence.
entailment	Ray reached theatre at 2 PM whereas Mark reached at 10 AM.	Ray reached after Mark.
entailment	Lawrence reached museum at 12 noon whereas Francis reached at 8:30 AM.	Lawrence reached after Francis.
entailment	Suzanne reached park at 7 AM whereas Julie reached at 6 AM.	Suzanne reached after Julie.
entailment	Louise reached school at 4:30 PM whereas Fiona reached at 1 PM.	Louise reached after Fiona.
entailment	Simon reached theatre at 1:30 PM whereas Robert reached at 9 AM.	Simon reached after Robert.
entailment	Pamela reached school at 9:30 AM whereas Kathy reached at 8:30 AM.	Pamela reached after Kathy.
entailment	Ashley reached museum at 10:30 AM whereas Paul reached at 8:30 AM.	Ashley reached after Paul.
entailment	Stephanie reached school at 7 AM whereas Cynthia reached at 6:30 AM.	Stephanie reached after Cynthia.
entailment	Ralph reached office at 1:30 PM whereas Jack reached at 10 AM.	Ralph reached after Jack.
entailment	Roy reached school at 7:30 AM whereas Albert reached at 7 AM.	Roy reached after Albert.
entailment	Dave reached school at 1:30 PM whereas Michelle reached at 10 AM.	Dave reached after Michelle.
entailment	Lynn reached hotel at 1:30 PM whereas Ruth reached at 10:30 AM.	Lynn reached after Ruth.
entailment	Andrew reached office at 3 PM whereas Scott reached at 12 noon.	Andrew reached after Scott.
entailment	Simon reached hospital at 4:30 PM whereas David reached at 6 AM.	Simon reached after David.
entailment	Kathryn reached hotel at 1 PM whereas Virginia reached at 6 AM.	Kathryn reached after Virginia.
entailment	George reached hospital at 5 PM whereas Edwin reached at 9 AM.	George reached after Edwin.
entailment	Wendy reached school at 9 AM whereas Sara reached at 6 AM.	Wendy reached after Sara.
entailment	Lauren reached office at 9 AM whereas Dorothy reached at 7 AM.	Lauren reached after Dorothy.
entailment	Simon reached theatre at 7 AM whereas Steve reached at 6 AM.	Simon reached after Steve.
entailment	Tony reached park at 5:30 PM whereas Anne reached at 10:30 AM.	Tony reached after Anne.
entailment	Dan reached park at 9:30 AM whereas Sara reached at 6:30 AM.	Dan reached after Sara.
entailment	Billy reached hospital at 7:30 AM whereas Benjamin reached at 6:30 AM.	Billy reached after Benjamin.
entailment	Jessica reached school at 11 AM whereas Nick reached at 10 AM.	Jessica reached after Nick.
entailment	Grace reached hospital at 11 AM whereas Martha reached at 7 AM.	Grace reached after Martha.
entailment	Jane reached hospital at 7 AM whereas Martin reached at 6 AM.	Jane reached after Martin.
entailment	Heather reached hospital at 2:30 PM whereas Kenneth reached at 1 PM.	Heather reached after Kenneth.
entailment	Elizabeth reached office at 6:30 AM whereas Nicole reached at 6 AM.	Elizabeth reached after Nicole.
entailment	Anna reached theatre at 4 PM whereas Susan reached at 2:30 PM.	Anna reached after Susan.
entailment	Jennifer reached museum at 3:30 PM whereas Michael reached at 6 AM.	Jennifer reached after Michael.
entailment	Francis reached office at 8 AM whereas Jean reached at 7 AM.	Francis reached after Jean.
entailment	Robin reached school at 2:30 PM whereas Simon reached at 6:30 AM.	Robin reached after Simon.
entailment	Michael reached hospital at 5 PM whereas Emily reached at 1 PM.	Michael reached after Emily.
entailment	Christine reached museum at 10:30 AM whereas Jay reached at 9:30 AM.	Christine reached after Jay.
entailment	Janet reached school at 11 AM whereas Sara reached at 6:30 AM.	Janet reached after Sara.
entailment	Julia reached hospital at 8:30 AM whereas Maria reached at 7:30 AM.	Julia reached after Maria.
entailment	George reached park at 11:30 AM whereas Philip reached at 8:30 AM.	George reached after Philip.
entailment	Sara reached theatre at 10 AM whereas Fred reached at 9 AM.	Sara reached after Fred.
entailment	David reached school at 3 PM whereas Elaine reached at 9:30 AM.	David reached after Elaine.
entailment	Al reached theatre at 1:30 PM whereas Charlie reached at 9 AM.	Al reached after Charlie.
entailment	Mary reached office at 9 AM whereas Alan reached at 7 AM.	Mary reached after Alan.
entailment	Anthony reached hospital at 3:30 PM whereas Charlotte reached at 9 AM.	Anthony reached after Charlotte.
entailment	Lawrence reached office at 5 PM whereas Elaine reached at 7 AM.	Lawrence reached after Elaine.
entailment	Walter reached park at 9:30 AM whereas Florence reached at 9 AM.	Walter reached after Florence.
entailment	Anna reached theatre at 5 PM whereas Ben reached at 12 noon.	Anna reached after Ben.
entailment	Melissa reached museum at 9:30 AM whereas Catherine reached at 7:30 AM.	Melissa reached after Catherine.
entailment	Daniel reached park at 3:30 PM whereas Andrea reached at 2:30 PM.	Daniel reached after Andrea.
entailment	Harry reached museum at 11 AM whereas Robin reached at 9 AM.	Harry reached after Robin.
entailment	Sam reached office at 2:30 PM whereas Kate reached at 2 PM.	Sam reached after Kate.
entailment	Jennifer reached park at 12 noon whereas Anne reached at 10 AM.	Jennifer reached after Anne.
entailment	Alexander reached park at 4:30 PM whereas Jack reached at 12:30 PM.	Alexander reached after Jack.
entailment	Rose reached museum at 10:30 AM whereas Katie reached at 9 AM.	Rose reached after Katie.
entailment	Heather reached theatre at 8:30 AM whereas Deborah reached at 6 AM.	Heather reached after Deborah.
entailment	Claire reached museum at 2 PM whereas Ryan reached at 1:30 PM.	Claire reached after Ryan.
entailment	Alice reached hotel at 9 AM whereas Diane reached at 7:30 AM.	Alice reached after Diane.
entailment	Joan reached school at 2 PM whereas Marilyn reached at 1:30 PM.	Joan reached after Marilyn.
entailment	Donald reached park at 4 PM whereas Marie reached at 11 AM.	Donald reached after Marie.
entailment	Louis reached theatre at 6 PM whereas Judy reached at 8 AM.	Louis reached after Judy.
entailment	Kathleen reached park at 4 PM whereas Dave reached at 2:30 PM.	Kathleen reached after Dave.
entailment	Dick reached hospital at 9 AM whereas Kathleen reached at 6 AM.	Dick reached after Kathleen.
entailment	Steven reached school at 7:30 AM whereas Bob reached at 6 AM.	Steven reached after Bob.
entailment	Brian reached school at 7 AM whereas Sophie reached at 6:30 AM.	Brian reached after Sophie.
entailment	Judy reached park at 12:30 PM whereas Tony reached at 8 AM.	Judy reached after Tony.
entailment	Rebecca reached hospital at 4:30 PM whereas Sarah reached at 11 AM.	Rebecca reached after Sarah.
entailment	Dave reached museum at 5:30 PM whereas Fiona reached at 6:30 AM.	Dave reached after Fiona.
